demo_artifacts/logs/mm_ms/rocm_mm_706_13824_5120/database_tuning_record.json
[0,[[[["GetBlock",[],["C","main"],["b0"]],["GetBlock",[],["root","main"],["b1"]],["Annotate",["b0","\"SSSRRSRS\""],["meta_schedule.tiling_structure"],[]],["GetLoops",["b0"],[],["l2","l3","l4"]],["SamplePerfectTile",["l2"],[5,64],["v5","v6","v7","v8","v9"]],["Split",["l2","v5","v6","v7","v8","v9"],[1,0],["l10","l11","l12","l13","l14"]],["SamplePerfectTile",["l3"],[5,64],["v15","v16","v17","v18","v19"]],["Split",["l3","v15","v16","v17","v18","v19"],[1,0],["l20","l21","l22","l23","l24"]],["SamplePerfectTile",["l4"],[3,64],["v25","v26","v27"]],["Split",["l4","v25","v26","v27"],[1,0],["l28","l29","l30"]],["Reorder",["l10","l20","l11","l21","l12","l22","l28","l29","l13","l23","l30","l14","l24"],[],[]],["Fuse",["l10","l20"],[1],["l31"]],["Bind",["l31"],["blockIdx.x"],[]],["Fuse",["l11","l21"],[1],["l32"]],["Bind",["l32"],["vthread.x"],[]],["Fuse",["l12","l22"],[1],["l33"]],["Bind",["l33"],["threadIdx.x"],[]],["Annotate",["b0",64],["meta_schedule.thread_extent_low_inclusive"],[]],["Annotate",["b0",1024],["meta_schedule.thread_extent_high_inclusive"],[]],["CacheWrite",["b0",[]],[0,"local"],["b34"]],["ReverseComputeAt",["b34","l33"],[1,-1],[]],["CacheRead",["b0",["b0"]],[0,"shared"],["b35"]],["ComputeAt",["b35","l28"],[1,-1],[]],["GetLoops",["b35"],[],["l36","l37","l38","l39","l40","l41"]],["Fuse",["l40","l41"],[1],["l42"]],["SampleCategorical",[],[[1,2,4,8],[0.25,0.25,0.25,0.25]],["v43"]],["Annotate",["b35","v43"],["meta_schedule.cooperative_fetch"],[]],["CacheRead",["b0",["b0"]],[1,"shared"],["b44"]],["ComputeAt",["b44","l28"],[1,-1],[]],["GetLoops",["b44"],[],["l45","l46","l47","l48","l49","l50"]],["Fuse",["l49","l50"],[1],["l51"]],["SampleCategorical",[],[[1,2,4,8],[0.25,0.25,0.25,0.25]],["v52"]],["Annotate",["b44","v52"],["meta_schedule.cooperative_fetch"],[]],["SampleCategorical",[],[[0,16,64,512,1024],[0.2000000000000000111,0.2000000000000000111,0.2000000000000000111,0.2000000000000000111,0.2000000000000000111]],["v53"]],["Annotate",["b1","v53"],["meta_schedule.unroll_explicit"],[]],["EnterPostproc",[],[],[]],["Unannotate",["b35"],["meta_schedule.cooperative_fetch"],[]],["GetLoops",["b35"],[],["l54","l55","l56","l57","l58"]],["Split",["l58","None",706],[1,0],["l59","l60"]],["Bind",["l60"],["threadIdx.x"],[]],["Unannotate",["b44"],["meta_schedule.cooperative_fetch"],[]],["GetLoops",["b44"],[],["l61","l62","l63","l64","l65"]],["Split",["l65","None",706,8],[1,0],["l66","l67","l68"]],["Vectorize",["l68"],[],[]],["Bind",["l67"],["threadIdx.x"],[]],["GetBlock",[],["root","main"],["b69"]],["Unannotate",["b69"],["meta_schedule.unroll_explicit"],[]],["GetChildBlocks",["b69"],[],["b70","b71","b72","b73"]],["GetLoops",["b70"],[],["l74","l75","l76","l77","l78","l79"]],["GetLoops",["b71"],[],["l80","l81","l82","l83","l84","l85","l86"]],["GetLoops",["b72"],[],["l87","l88","l89","l90","l91","l92","l93","l94","l95","l96"]],["Annotate",["l87",512],["pragma_auto_unroll_max_step"],[]],["Annotate",["l87",1],["pragma_unroll_explicit"],[]],["GetLoops",["b73"],[],["l97","l98","l99","l100","l101"]],["GetBlock",[],["C","main"],["b102"]],["GetLoops",["b102"],[],["l103","l104","l105","l106","l107","l108","l109","l110","l111","l112"]],["DecomposeReduction",["b102","l106"],[],["b113"]]],[[4,[1,1,353,1,2]],[6,[144,3,2,4,4]],[8,[320,2,8]],[25,0],[31,3],[33,3]]],[0.0026009896923076922422,0.0026010739999999996606,0.0026009662307692306762],{"host":{"keys":["cpu"],"kind":"llvm","mtriple":"x86_64-unknown-linux-gnu","tag":""},"keys":["rocm","gpu"],"kind":"rocm","max_num_threads":256,"max_shared_memory_per_block":49152,"max_threads_per_block":1024,"mcpu":"gfx942","model":"MI300","mtriple":"amdgcn-amd-amdhsa-hcc","tag":"","thread_warp_size":64},[["TENSOR","float16",[706,5120]],["TENSOR","float16",[5120,13824]],["TENSOR","float16",[706,13824]]]]]
[0,[[[["GetBlock",[],["C","main"],["b0"]],["GetBlock",[],["root","main"],["b1"]],["Annotate",["b0","\"SSSRRSRS\""],["meta_schedule.tiling_structure"],[]],["GetLoops",["b0"],[],["l2","l3","l4"]],["SamplePerfectTile",["l2"],[5,64],["v5","v6","v7","v8","v9"]],["Split",["l2","v5","v6","v7","v8","v9"],[1,0],["l10","l11","l12","l13","l14"]],["SamplePerfectTile",["l3"],[5,64],["v15","v16","v17","v18","v19"]],["Split",["l3","v15","v16","v17","v18","v19"],[1,0],["l20","l21","l22","l23","l24"]],["SamplePerfectTile",["l4"],[3,64],["v25","v26","v27"]],["Split",["l4","v25","v26","v27"],[1,0],["l28","l29","l30"]],["Reorder",["l10","l20","l11","l21","l12","l22","l28","l29","l13","l23","l30","l14","l24"],[],[]],["Fuse",["l10","l20"],[1],["l31"]],["Bind",["l31"],["blockIdx.x"],[]],["Fuse",["l11","l21"],[1],["l32"]],["Bind",["l32"],["vthread.x"],[]],["Fuse",["l12","l22"],[1],["l33"]],["Bind",["l33"],["threadIdx.x"],[]],["Annotate",["b0",64],["meta_schedule.thread_extent_low_inclusive"],[]],["Annotate",["b0",1024],["meta_schedule.thread_extent_high_inclusive"],[]],["CacheWrite",["b0",[]],[0,"local"],["b34"]],["ReverseComputeAt",["b34","l33"],[1,-1],[]],["CacheRead",["b0",["b0"]],[0,"shared"],["b35"]],["ComputeAt",["b35","l28"],[1,-1],[]],["GetLoops",["b35"],[],["l36","l37","l38","l39","l40","l41"]],["Fuse",["l40","l41"],[1],["l42"]],["SampleCategorical",[],[[1,2,4,8],[0.25,0.25,0.25,0.25]],["v43"]],["Annotate",["b35","v43"],["meta_schedule.cooperative_fetch"],[]],["CacheRead",["b0",["b0"]],[1,"shared"],["b44"]],["ComputeAt",["b44","l28"],[1,-1],[]],["GetLoops",["b44"],[],["l45","l46","l47","l48","l49","l50"]],["Fuse",["l49","l50"],[1],["l51"]],["SampleCategorical",[],[[1,2,4,8],[0.25,0.25,0.25,0.25]],["v52"]],["Annotate",["b44","v52"],["meta_schedule.cooperative_fetch"],[]],["SampleCategorical",[],[[0,16,64,512,1024],[0.2000000000000000111,0.2000000000000000111,0.2000000000000000111,0.2000000000000000111,0.2000000000000000111]],["v53"]],["Annotate",["b1","v53"],["meta_schedule.unroll_explicit"],[]],["EnterPostproc",[],[],[]],["Unannotate",["b35"],["meta_schedule.cooperative_fetch"],[]],["GetLoops",["b35"],[],["l54","l55","l56","l57","l58"]],["Split",["l58","None",706,2],[1,0],["l59","l60","l61"]],["Vectorize",["l61"],[],[]],["Bind",["l60"],["threadIdx.x"],[]],["Unannotate",["b44"],["meta_schedule.cooperative_fetch"],[]],["GetLoops",["b44"],[],["l62","l63","l64","l65","l66"]],["Split",["l66","None",706,8],[1,0],["l67","l68","l69"]],["Vectorize",["l69"],[],[]],["Bind",["l68"],["threadIdx.x"],[]],["GetBlock",[],["root","main"],["b70"]],["Unannotate",["b70"],["meta_schedule.unroll_explicit"],[]],["GetChildBlocks",["b70"],[],["b71","b72","b73","b74"]],["GetLoops",["b71"],[],["l75","l76","l77","l78","l79","l80","l81"]],["GetLoops",["b72"],[],["l82","l83","l84","l85","l86","l87","l88"]],["GetLoops",["b73"],[],["l89","l90","l91","l92","l93","l94","l95","l96","l97","l98"]],["Annotate",["l89",64],["pragma_auto_unroll_max_step"],[]],["Annotate",["l89",1],["pragma_unroll_explicit"],[]],["GetLoops",["b74"],[],["l99","l100","l101","l102","l103"]],["GetBlock",[],["C","main"],["b104"]],["GetLoops",["b104"],[],["l105","l106","l107","l108","l109","l110","l111","l112","l113","l114"]],["DecomposeReduction",["b104","l108"],[],["b115"]]],[[4,[1,2,353,1,1]],[6,[128,1,2,2,27]],[8,[640,4,2]],[25,1],[31,3],[33,2]]],[0.0035178339534883721826,0.0035184006744186048163,0.003518159372093023797],{"host":{"keys":["cpu"],"kind":"llvm","mtriple":"x86_64-unknown-linux-gnu","tag":""},"keys":["rocm","gpu"],"kind":"rocm","max_num_threads":256,"max_shared_memory_per_block":49152,"max_threads_per_block":1024,"mcpu":"gfx942","model":"MI300","mtriple":"amdgcn-amd-amdhsa-hcc","tag":"","thread_warp_size":64},[["TENSOR","float16",[706,5120]],["TENSOR","float16",[5120,13824]],["TENSOR","float16",[706,13824]]]]]
[0,[[[["GetBlock",[],["C","main"],["b0"]],["GetBlock",[],["root","main"],["b1"]],["Annotate",["b0","\"SSSRRSRS\""],["meta_schedule.tiling_structure"],[]],["GetLoops",["b0"],[],["l2","l3","l4"]],["SamplePerfectTile",["l2"],[5,64],["v5","v6","v7","v8","v9"]],["Split",["l2","v5","v6","v7","v8","v9"],[1,0],["l10","l11","l12","l13","l14"]],["SamplePerfectTile",["l3"],[5,64],["v15","v16","v17","v18","v19"]],["Split",["l3","v15","v16","v17","v18","v19"],[1,0],["l20","l21","l22","l23","l24"]],["SamplePerfectTile",["l4"],[3,64],["v25","v26","v27"]],["Split",["l4","v25","v26","v27"],[1,0],["l28","l29","l30"]],["Reorder",["l10","l20","l11","l21","l12","l22","l28","l29","l13","l23","l30","l14","l24"],[],[]],["Fuse",["l10","l20"],[1],["l31"]],["Bind",["l31"],["blockIdx.x"],[]],["Fuse",["l11","l21"],[1],["l32"]],["Bind",["l32"],["vthread.x"],[]],["Fuse",["l12","l22"],[1],["l33"]],["Bind",["l33"],["threadIdx.x"],[]],["Annotate",["b0",64],["meta_schedule.thread_extent_low_inclusive"],[]],["Annotate",["b0",1024],["meta_schedule.thread_extent_high_inclusive"],[]],["CacheWrite",["b0",[]],[0,"local"],["b34"]],["ReverseComputeAt",["b34","l33"],[1,-1],[]],["CacheRead",["b0",["b0"]],[0,"shared"],["b35"]],["ComputeAt",["b35","l28"],[1,-1],[]],["GetLoops",["b35"],[],["l36","l37","l38","l39","l40","l41"]],["Fuse",["l40","l41"],[1],["l42"]],["SampleCategorical",[],[[1,2,4,8],[0.25,0.25,0.25,0.25]],["v43"]],["Annotate",["b35","v43"],["meta_schedule.cooperative_fetch"],[]],["CacheRead",["b0",["b0"]],[1,"shared"],["b44"]],["ComputeAt",["b44","l28"],[1,-1],[]],["GetLoops",["b44"],[],["l45","l46","l47","l48","l49","l50"]],["Fuse",["l49","l50"],[1],["l51"]],["SampleCategorical",[],[[1,2,4,8],[0.25,0.25,0.25,0.25]],["v52"]],["Annotate",["b44","v52"],["meta_schedule.cooperative_fetch"],[]],["SampleCategorical",[],[[0,16,64,512,1024],[0.2000000000000000111,0.2000000000000000111,0.2000000000000000111,0.2000000000000000111,0.2000000000000000111]],["v53"]],["Annotate",["b1","v53"],["meta_schedule.unroll_explicit"],[]],["EnterPostproc",[],[],[]],["Unannotate",["b35"],["meta_schedule.cooperative_fetch"],[]],["GetLoops",["b35"],[],["l54","l55","l56","l57","l58"]],["Split",["l58","None",64],[1,0],["l59","l60"]],["Bind",["l60"],["threadIdx.x"],[]],["Unannotate",["b44"],["meta_schedule.cooperative_fetch"],[]],["GetLoops",["b44"],[],["l61","l62","l63","l64","l65"]],["Split",["l65","None",64,2],[1,0],["l66","l67","l68"]],["Vectorize",["l68"],[],[]],["Bind",["l67"],["threadIdx.x"],[]],["GetBlock",[],["root","main"],["b69"]],["Unannotate",["b69"],["meta_schedule.unroll_explicit"],[]],["GetChildBlocks",["b69"],[],["b70","b71","b72","b73"]],["GetLoops",["b70"],[],["l74","l75","l76","l77","l78","l79"]],["GetLoops",["b71"],[],["l80","l81","l82","l83","l84","l85","l86"]],["GetLoops",["b72"],[],["l87","l88","l89","l90","l91","l92","l93","l94","l95","l96"]],["Annotate",["l87",1024],["pragma_auto_unroll_max_step"],[]],["Annotate",["l87",1],["pragma_unroll_explicit"],[]],["GetLoops",["b73"],[],["l97","l98","l99","l100","l101"]],["GetBlock",[],["C","main"],["b102"]],["GetLoops",["b102"],[],["l103","l104","l105","l106","l107","l108","l109","l110","l111","l112"]],["DecomposeReduction",["b102","l106"],[],["b113"]]],[[4,[353,2,1,1,1]],[6,[18,4,64,3,1]],[8,[320,16,1]],[25,0],[31,1],[33,4]]],[0.051745697000000000221,0.051810190666666672277,0.051539697999999994904],{"host":{"keys":["cpu"],"kind":"llvm","mtriple":"x86_64-unknown-linux-gnu","tag":""},"keys":["rocm","gpu"],"kind":"rocm","max_num_threads":256,"max_shared_memory_per_block":49152,"max_threads_per_block":1024,"mcpu":"gfx942","model":"MI300","mtriple":"amdgcn-amd-amdhsa-hcc","tag":"","thread_warp_size":64},[["TENSOR","float16",[706,5120]],["TENSOR","float16",[5120,13824]],["TENSOR","float16",[706,13824]]]]]
[0,[[[["GetBlock",[],["C","main"],["b0"]],["GetBlock",[],["root","main"],["b1"]],["Annotate",["b0","\"SSSRRSRS\""],["meta_schedule.tiling_structure"],[]],["GetLoops",["b0"],[],["l2","l3","l4"]],["SamplePerfectTile",["l2"],[5,64],["v5","v6","v7","v8","v9"]],["Split",["l2","v5","v6","v7","v8","v9"],[1,0],["l10","l11","l12","l13","l14"]],["SamplePerfectTile",["l3"],[5,64],["v15","v16","v17","v18","v19"]],["Split",["l3","v15","v16","v17","v18","v19"],[1,0],["l20","l21","l22","l23","l24"]],["SamplePerfectTile",["l4"],[3,64],["v25","v26","v27"]],["Split",["l4","v25","v26","v27"],[1,0],["l28","l29","l30"]],["Reorder",["l10","l20","l11","l21","l12","l22","l28","l29","l13","l23","l30","l14","l24"],[],[]],["Fuse",["l10","l20"],[1],["l31"]],["Bind",["l31"],["blockIdx.x"],[]],["Fuse",["l11","l21"],[1],["l32"]],["Bind",["l32"],["vthread.x"],[]],["Fuse",["l12","l22"],[1],["l33"]],["Bind",["l33"],["threadIdx.x"],[]],["Annotate",["b0",64],["meta_schedule.thread_extent_low_inclusive"],[]],["Annotate",["b0",1024],["meta_schedule.thread_extent_high_inclusive"],[]],["CacheWrite",["b0",[]],[0,"local"],["b34"]],["ReverseComputeAt",["b34","l33"],[1,-1],[]],["CacheRead",["b0",["b0"]],[0,"shared"],["b35"]],["ComputeAt",["b35","l28"],[1,-1],[]],["GetLoops",["b35"],[],["l36","l37","l38","l39","l40","l41"]],["Fuse",["l40","l41"],[1],["l42"]],["SampleCategorical",[],[[1,2,4,8],[0.25,0.25,0.25,0.25]],["v43"]],["Annotate",["b35","v43"],["meta_schedule.cooperative_fetch"],[]],["CacheRead",["b0",["b0"]],[1,"shared"],["b44"]],["ComputeAt",["b44","l28"],[1,-1],[]],["GetLoops",["b44"],[],["l45","l46","l47","l48","l49","l50"]],["Fuse",["l49","l50"],[1],["l51"]],["SampleCategorical",[],[[1,2,4,8],[0.25,0.25,0.25,0.25]],["v52"]],["Annotate",["b44","v52"],["meta_schedule.cooperative_fetch"],[]],["SampleCategorical",[],[[0,16,64,512,1024],[0.2000000000000000111,0.2000000000000000111,0.2000000000000000111,0.2000000000000000111,0.2000000000000000111]],["v53"]],["Annotate",["b1","v53"],["meta_schedule.unroll_explicit"],[]],["EnterPostproc",[],[],[]],["Unannotate",["b35"],["meta_schedule.cooperative_fetch"],[]],["GetLoops",["b35"],[],["l54","l55","l56","l57","l58"]],["Split",["l58","None",192,2],[1,0],["l59","l60","l61"]],["Vectorize",["l61"],[],[]],["Bind",["l60"],["threadIdx.x"],[]],["Unannotate",["b44"],["meta_schedule.cooperative_fetch"],[]],["GetLoops",["b44"],[],["l62","l63","l64","l65","l66"]],["Split",["l66","None",192,8],[1,0],["l67","l68","l69"]],["Vectorize",["l69"],[],[]],["Bind",["l68"],["threadIdx.x"],[]],["GetBlock",[],["root","main"],["b70"]],["Unannotate",["b70"],["meta_schedule.unroll_explicit"],[]],["GetChildBlocks",["b70"],[],["b71","b72","b73","b74"]],["GetLoops",["b71"],[],["l75","l76","l77","l78","l79","l80","l81"]],["GetLoops",["b72"],[],["l82","l83","l84","l85","l86","l87","l88"]],["GetLoops",["b73"],[],["l89","l90","l91","l92","l93","l94","l95","l96","l97","l98"]],["Annotate",["l89",64],["pragma_auto_unroll_max_step"],[]],["Annotate",["l89",1],["pragma_unroll_explicit"],[]],["GetLoops",["b74"],[],["l99","l100","l101","l102","l103"]],["GetBlock",[],["C","main"],["b104"]],["GetLoops",["b104"],[],["l105","l106","l107","l108","l109","l110","l111","l112","l113","l114"]],["DecomposeReduction",["b104","l108"],[],["b115"]]],[[4,[1,353,2,1,1]],[6,[18,4,96,2,1]],[8,[1280,2,2]],[25,1],[31,3],[33,2]]],[1.1536486000000001351,1.1651788736666668367,1.1681947426666667855],{"host":{"keys":["cpu"],"kind":"llvm","mtriple":"x86_64-unknown-linux-gnu","tag":""},"keys":["rocm","gpu"],"kind":"rocm","max_num_threads":256,"max_shared_memory_per_block":49152,"max_threads_per_block":1024,"mcpu":"gfx942","model":"MI300","mtriple":"amdgcn-amd-amdhsa-hcc","tag":"","thread_warp_size":64},[["TENSOR","float16",[706,5120]],["TENSOR","float16",[5120,13824]],["TENSOR","float16",[706,13824]]]]]
[0,[[[["GetBlock",[],["C","main"],["b0"]],["GetBlock",[],["root","main"],["b1"]],["Annotate",["b0","\"SSSRRSRS\""],["meta_schedule.tiling_structure"],[]],["GetLoops",["b0"],[],["l2","l3","l4"]],["SamplePerfectTile",["l2"],[5,64],["v5","v6","v7","v8","v9"]],["Split",["l2","v5","v6","v7","v8","v9"],[1,0],["l10","l11","l12","l13","l14"]],["SamplePerfectTile",["l3"],[5,64],["v15","v16","v17","v18","v19"]],["Split",["l3","v15","v16","v17","v18","v19"],[1,0],["l20","l21","l22","l23","l24"]],["SamplePerfectTile",["l4"],[3,64],["v25","v26","v27"]],["Split",["l4","v25","v26","v27"],[1,0],["l28","l29","l30"]],["Reorder",["l10","l20","l11","l21","l12","l22","l28","l29","l13","l23","l30","l14","l24"],[],[]],["Fuse",["l10","l20"],[1],["l31"]],["Bind",["l31"],["blockIdx.x"],[]],["Fuse",["l11","l21"],[1],["l32"]],["Bind",["l32"],["vthread.x"],[]],["Fuse",["l12","l22"],[1],["l33"]],["Bind",["l33"],["threadIdx.x"],[]],["Annotate",["b0",64],["meta_schedule.thread_extent_low_inclusive"],[]],["Annotate",["b0",1024],["meta_schedule.thread_extent_high_inclusive"],[]],["CacheWrite",["b0",[]],[0,"local"],["b34"]],["ReverseComputeAt",["b34","l33"],[1,-1],[]],["CacheRead",["b0",["b0"]],[0,"shared"],["b35"]],["ComputeAt",["b35","l28"],[1,-1],[]],["GetLoops",["b35"],[],["l36","l37","l38","l39","l40","l41"]],["Fuse",["l40","l41"],[1],["l42"]],["SampleCategorical",[],[[1,2,4,8],[0.25,0.25,0.25,0.25]],["v43"]],["Annotate",["b35","v43"],["meta_schedule.cooperative_fetch"],[]],["CacheRead",["b0",["b0"]],[1,"shared"],["b44"]],["ComputeAt",["b44","l28"],[1,-1],[]],["GetLoops",["b44"],[],["l45","l46","l47","l48","l49","l50"]],["Fuse",["l49","l50"],[1],["l51"]],["SampleCategorical",[],[[1,2,4,8],[0.25,0.25,0.25,0.25]],["v52"]],["Annotate",["b44","v52"],["meta_schedule.cooperative_fetch"],[]],["SampleCategorical",[],[[0,16,64,512,1024],[0.2000000000000000111,0.2000000000000000111,0.2000000000000000111,0.2000000000000000111,0.2000000000000000111]],["v53"]],["Annotate",["b1","v53"],["meta_schedule.unroll_explicit"],[]],["EnterPostproc",[],[],[]],["Unannotate",["b35"],["meta_schedule.cooperative_fetch"],[]],["GetLoops",["b35"],[],["l54","l55","l56","l57","l58"]],["Split",["l58","None",64,4],[1,0],["l59","l60","l61"]],["Vectorize",["l61"],[],[]],["Bind",["l60"],["threadIdx.x"],[]],["Unannotate",["b44"],["meta_schedule.cooperative_fetch"],[]],["GetLoops",["b44"],[],["l62","l63","l64","l65","l66"]],["Split",["l66","None",64,4],[1,0],["l67","l68","l69"]],["Vectorize",["l69"],[],[]],["Bind",["l68"],["threadIdx.x"],[]],["GetBlock",[],["root","main"],["b70"]],["Unannotate",["b70"],["meta_schedule.unroll_explicit"],[]],["GetChildBlocks",["b70"],[],["b71","b72","b73","b74"]],["GetLoops",["b71"],[],["l75","l76","l77","l78","l79","l80","l81"]],["GetLoops",["b72"],[],["l82","l83","l84","l85","l86","l87","l88"]],["GetLoops",["b73"],[],["l89","l90","l91","l92","l93","l94","l95","l96","l97","l98"]],["Annotate",["l89",1024],["pragma_auto_unroll_max_step"],[]],["Annotate",["l89",1],["pragma_unroll_explicit"],[]],["GetLoops",["b74"],[],["l99","l100","l101","l102","l103"]],["GetBlock",[],["C","main"],["b104"]],["GetLoops",["b104"],[],["l105","l106","l107","l108","l109","l110","l111","l112","l113","l114"]],["DecomposeReduction",["b104","l108"],[],["b115"]]],[[4,[353,1,1,2,1]],[6,[2,4,64,27,1]],[8,[2560,2,1]],[25,2],[31,2],[33,4]]],[0.051220118000000001979,0.051354781999999994657,0.051381505000000000927],{"host":{"keys":["cpu"],"kind":"llvm","mtriple":"x86_64-unknown-linux-gnu","tag":""},"keys":["rocm","gpu"],"kind":"rocm","max_num_threads":256,"max_shared_memory_per_block":49152,"max_threads_per_block":1024,"mcpu":"gfx942","model":"MI300","mtriple":"amdgcn-amd-amdhsa-hcc","tag":"","thread_warp_size":64},[["TENSOR","float16",[706,5120]],["TENSOR","float16",[5120,13824]],["TENSOR","float16",[706,13824]]]]]
[0,[[[["GetBlock",[],["C","main"],["b0"]],["GetBlock",[],["root","main"],["b1"]],["Annotate",["b0","\"SSSRRSRS\""],["meta_schedule.tiling_structure"],[]],["GetLoops",["b0"],[],["l2","l3","l4"]],["SamplePerfectTile",["l2"],[5,64],["v5","v6","v7","v8","v9"]],["Split",["l2","v5","v6","v7","v8","v9"],[1,0],["l10","l11","l12","l13","l14"]],["SamplePerfectTile",["l3"],[5,64],["v15","v16","v17","v18","v19"]],["Split",["l3","v15","v16","v17","v18","v19"],[1,0],["l20","l21","l22","l23","l24"]],["SamplePerfectTile",["l4"],[3,64],["v25","v26","v27"]],["Split",["l4","v25","v26","v27"],[1,0],["l28","l29","l30"]],["Reorder",["l10","l20","l11","l21","l12","l22","l28","l29","l13","l23","l30","l14","l24"],[],[]],["Fuse",["l10","l20"],[1],["l31"]],["Bind",["l31"],["blockIdx.x"],[]],["Fuse",["l11","l21"],[1],["l32"]],["Bind",["l32"],["vthread.x"],[]],["Fuse",["l12","l22"],[1],["l33"]],["Bind",["l33"],["threadIdx.x"],[]],["Annotate",["b0",64],["meta_schedule.thread_extent_low_inclusive"],[]],["Annotate",["b0",1024],["meta_schedule.thread_extent_high_inclusive"],[]],["CacheWrite",["b0",[]],[0,"local"],["b34"]],["ReverseComputeAt",["b34","l33"],[1,-1],[]],["CacheRead",["b0",["b0"]],[0,"shared"],["b35"]],["ComputeAt",["b35","l28"],[1,-1],[]],["GetLoops",["b35"],[],["l36","l37","l38","l39","l40","l41"]],["Fuse",["l40","l41"],[1],["l42"]],["SampleCategorical",[],[[1,2,4,8],[0.25,0.25,0.25,0.25]],["v43"]],["Annotate",["b35","v43"],["meta_schedule.cooperative_fetch"],[]],["CacheRead",["b0",["b0"]],[1,"shared"],["b44"]],["ComputeAt",["b44","l28"],[1,-1],[]],["GetLoops",["b44"],[],["l45","l46","l47","l48","l49","l50"]],["Fuse",["l49","l50"],[1],["l51"]],["SampleCategorical",[],[[1,2,4,8],[0.25,0.25,0.25,0.25]],["v52"]],["Annotate",["b44","v52"],["meta_schedule.cooperative_fetch"],[]],["SampleCategorical",[],[[0,16,64,512,1024],[0.2000000000000000111,0.2000000000000000111,0.2000000000000000111,0.2000000000000000111,0.2000000000000000111]],["v53"]],["Annotate",["b1","v53"],["meta_schedule.unroll_explicit"],[]],["EnterPostproc",[],[],[]],["Unannotate",["b35"],["meta_schedule.cooperative_fetch"],[]],["GetLoops",["b35"],[],["l54","l55","l56","l57","l58"]],["Split",["l58","None",706,4],[1,0],["l59","l60","l61"]],["Vectorize",["l61"],[],[]],["Bind",["l60"],["threadIdx.x"],[]],["Unannotate",["b44"],["meta_schedule.cooperative_fetch"],[]],["GetLoops",["b44"],[],["l62","l63","l64","l65","l66"]],["Split",["l66","None",706,8],[1,0],["l67","l68","l69"]],["Vectorize",["l69"],[],[]],["Bind",["l68"],["threadIdx.x"],[]],["GetBlock",[],["root","main"],["b70"]],["Unannotate",["b70"],["meta_schedule.unroll_explicit"],[]],["GetChildBlocks",["b70"],[],["b71","b72","b73","b74"]],["GetLoops",["b71"],[],["l75","l76","l77","l78","l79","l80","l81"]],["GetLoops",["b72"],[],["l82","l83","l84","l85","l86","l87","l88"]],["GetLoops",["b73"],[],["l89","l90","l91","l92","l93","l94","l95","l96","l97","l98"]],["Annotate",["l89",1024],["pragma_auto_unroll_max_step"],[]],["Annotate",["l89",1],["pragma_unroll_explicit"],[]],["GetLoops",["b74"],[],["l99","l100","l101","l102","l103"]],["GetBlock",[],["C","main"],["b104"]],["GetLoops",["b104"],[],["l105","l106","l107","l108","l109","l110","l111","l112","l113","l114"]],["DecomposeReduction",["b104","l108"],[],["b115"]]],[[4,[2,1,353,1,1]],[6,[8,24,2,36,1]],[8,[640,1,8]],[25,2],[31,3],[33,4]]],[0.056433069666666661746,0.056674387333333332839,0.05643150833333333144],{"host":{"keys":["cpu"],"kind":"llvm","mtriple":"x86_64-unknown-linux-gnu","tag":""},"keys":["rocm","gpu"],"kind":"rocm","max_num_threads":256,"max_shared_memory_per_block":49152,"max_threads_per_block":1024,"mcpu":"gfx942","model":"MI300","mtriple":"amdgcn-amd-amdhsa-hcc","tag":"","thread_warp_size":64},[["TENSOR","float16",[706,5120]],["TENSOR","float16",[5120,13824]],["TENSOR","float16",[706,13824]]]]]
[0,[[[["GetBlock",[],["C","main"],["b0"]],["GetBlock",[],["root","main"],["b1"]],["Annotate",["b0","\"SSSRRSRS\""],["meta_schedule.tiling_structure"],[]],["GetLoops",["b0"],[],["l2","l3","l4"]],["SamplePerfectTile",["l2"],[5,64],["v5","v6","v7","v8","v9"]],["Split",["l2","v5","v6","v7","v8","v9"],[1,0],["l10","l11","l12","l13","l14"]],["SamplePerfectTile",["l3"],[5,64],["v15","v16","v17","v18","v19"]],["Split",["l3","v15","v16","v17","v18","v19"],[1,0],["l20","l21","l22","l23","l24"]],["SamplePerfectTile",["l4"],[3,64],["v25","v26","v27"]],["Split",["l4","v25","v26","v27"],[1,0],["l28","l29","l30"]],["Reorder",["l10","l20","l11","l21","l12","l22","l28","l29","l13","l23","l30","l14","l24"],[],[]],["Fuse",["l10","l20"],[1],["l31"]],["Bind",["l31"],["blockIdx.x"],[]],["Fuse",["l11","l21"],[1],["l32"]],["Bind",["l32"],["vthread.x"],[]],["Fuse",["l12","l22"],[1],["l33"]],["Bind",["l33"],["threadIdx.x"],[]],["Annotate",["b0",64],["meta_schedule.thread_extent_low_inclusive"],[]],["Annotate",["b0",1024],["meta_schedule.thread_extent_high_inclusive"],[]],["CacheWrite",["b0",[]],[0,"local"],["b34"]],["ReverseComputeAt",["b34","l33"],[1,-1],[]],["CacheRead",["b0",["b0"]],[0,"shared"],["b35"]],["ComputeAt",["b35","l28"],[1,-1],[]],["GetLoops",["b35"],[],["l36","l37","l38","l39","l40","l41"]],["Fuse",["l40","l41"],[1],["l42"]],["SampleCategorical",[],[[1,2,4,8],[0.25,0.25,0.25,0.25]],["v43"]],["Annotate",["b35","v43"],["meta_schedule.cooperative_fetch"],[]],["CacheRead",["b0",["b0"]],[1,"shared"],["b44"]],["ComputeAt",["b44","l28"],[1,-1],[]],["GetLoops",["b44"],[],["l45","l46","l47","l48","l49","l50"]],["Fuse",["l49","l50"],[1],["l51"]],["SampleCategorical",[],[[1,2,4,8],[0.25,0.25,0.25,0.25]],["v52"]],["Annotate",["b44","v52"],["meta_schedule.cooperative_fetch"],[]],["SampleCategorical",[],[[0,16,64,512,1024],[0.2000000000000000111,0.2000000000000000111,0.2000000000000000111,0.2000000000000000111,0.2000000000000000111]],["v53"]],["Annotate",["b1","v53"],["meta_schedule.unroll_explicit"],[]],["EnterPostproc",[],[],[]],["Unannotate",["b35"],["meta_schedule.cooperative_fetch"],[]],["GetLoops",["b35"],[],["l54","l55","l56","l57","l58"]],["Split",["l58","None",706],[1,0],["l59","l60"]],["Bind",["l60"],["threadIdx.x"],[]],["Unannotate",["b44"],["meta_schedule.cooperative_fetch"],[]],["GetLoops",["b44"],[],["l61","l62","l63","l64","l65"]],["Split",["l65","None",706,2],[1,0],["l66","l67","l68"]],["Vectorize",["l68"],[],[]],["Bind",["l67"],["threadIdx.x"],[]],["GetBlock",[],["root","main"],["b69"]],["Unannotate",["b69"],["meta_schedule.unroll_explicit"],[]],["GetChildBlocks",["b69"],[],["b70","b71","b72","b73"]],["GetLoops",["b70"],[],["l74","l75","l76","l77","l78","l79"]],["GetLoops",["b71"],[],["l80","l81","l82","l83","l84","l85","l86"]],["GetLoops",["b72"],[],["l87","l88","l89","l90","l91","l92","l93","l94","l95","l96"]],["Annotate",["l87",64],["pragma_auto_unroll_max_step"],[]],["Annotate",["l87",1],["pragma_unroll_explicit"],[]],["GetLoops",["b73"],[],["l97","l98","l99","l100","l101"]],["GetBlock",[],["C","main"],["b102"]],["GetLoops",["b102"],[],["l103","l104","l105","l106","l107","l108","l109","l110","l111","l112"]],["DecomposeReduction",["b102","l106"],[],["b113"]]],[[4,[1,2,353,1,1]],[6,[128,1,2,2,27]],[8,[640,8,1]],[25,0],[31,1],[33,2]]],[0.0034810141034482761438,0.0034795842413793101784,0.0034880605172413793602],{"host":{"keys":["cpu"],"kind":"llvm","mtriple":"x86_64-unknown-linux-gnu","tag":""},"keys":["rocm","gpu"],"kind":"rocm","max_num_threads":256,"max_shared_memory_per_block":49152,"max_threads_per_block":1024,"mcpu":"gfx942","model":"MI300","mtriple":"amdgcn-amd-amdhsa-hcc","tag":"","thread_warp_size":64},[["TENSOR","float16",[706,5120]],["TENSOR","float16",[5120,13824]],["TENSOR","float16",[706,13824]]]]]
[0,[[[["GetBlock",[],["C","main"],["b0"]],["GetBlock",[],["root","main"],["b1"]],["Annotate",["b0","\"SSSRRSRS\""],["meta_schedule.tiling_structure"],[]],["GetLoops",["b0"],[],["l2","l3","l4"]],["SamplePerfectTile",["l2"],[5,64],["v5","v6","v7","v8","v9"]],["Split",["l2","v5","v6","v7","v8","v9"],[1,0],["l10","l11","l12","l13","l14"]],["SamplePerfectTile",["l3"],[5,64],["v15","v16","v17","v18","v19"]],["Split",["l3","v15","v16","v17","v18","v19"],[1,0],["l20","l21","l22","l23","l24"]],["SamplePerfectTile",["l4"],[3,64],["v25","v26","v27"]],["Split",["l4","v25","v26","v27"],[1,0],["l28","l29","l30"]],["Reorder",["l10","l20","l11","l21","l12","l22","l28","l29","l13","l23","l30","l14","l24"],[],[]],["Fuse",["l10","l20"],[1],["l31"]],["Bind",["l31"],["blockIdx.x"],[]],["Fuse",["l11","l21"],[1],["l32"]],["Bind",["l32"],["vthread.x"],[]],["Fuse",["l12","l22"],[1],["l33"]],["Bind",["l33"],["threadIdx.x"],[]],["Annotate",["b0",64],["meta_schedule.thread_extent_low_inclusive"],[]],["Annotate",["b0",1024],["meta_schedule.thread_extent_high_inclusive"],[]],["CacheWrite",["b0",[]],[0,"local"],["b34"]],["ReverseComputeAt",["b34","l33"],[1,-1],[]],["CacheRead",["b0",["b0"]],[0,"shared"],["b35"]],["ComputeAt",["b35","l28"],[1,-1],[]],["GetLoops",["b35"],[],["l36","l37","l38","l39","l40","l41"]],["Fuse",["l40","l41"],[1],["l42"]],["SampleCategorical",[],[[1,2,4,8],[0.25,0.25,0.25,0.25]],["v43"]],["Annotate",["b35","v43"],["meta_schedule.cooperative_fetch"],[]],["CacheRead",["b0",["b0"]],[1,"shared"],["b44"]],["ComputeAt",["b44","l28"],[1,-1],[]],["GetLoops",["b44"],[],["l45","l46","l47","l48","l49","l50"]],["Fuse",["l49","l50"],[1],["l51"]],["SampleCategorical",[],[[1,2,4,8],[0.25,0.25,0.25,0.25]],["v52"]],["Annotate",["b44","v52"],["meta_schedule.cooperative_fetch"],[]],["SampleCategorical",[],[[0,16,64,512,1024],[0.2000000000000000111,0.2000000000000000111,0.2000000000000000111,0.2000000000000000111,0.2000000000000000111]],["v53"]],["Annotate",["b1","v53"],["meta_schedule.unroll_explicit"],[]],["EnterPostproc",[],[],[]],["Unannotate",["b35"],["meta_schedule.cooperative_fetch"],[]],["GetLoops",["b35"],[],["l54","l55","l56","l57","l58"]],["Split",["l58","None",353,2],[1,0],["l59","l60","l61"]],["Vectorize",["l61"],[],[]],["Bind",["l60"],["threadIdx.x"],[]],["Unannotate",["b44"],["meta_schedule.cooperative_fetch"],[]],["GetLoops",["b44"],[],["l62","l63","l64","l65","l66"]],["Split",["l66","None",353],[1,0],["l67","l68"]],["Bind",["l68"],["threadIdx.x"],[]],["GetBlock",[],["root","main"],["b69"]],["Unannotate",["b69"],["meta_schedule.unroll_explicit"],[]],["GetChildBlocks",["b69"],[],["b70","b71","b72","b73"]],["GetLoops",["b70"],[],["l74","l75","l76","l77","l78","l79","l80"]],["GetLoops",["b71"],[],["l81","l82","l83","l84","l85","l86"]],["GetLoops",["b72"],[],["l87","l88","l89","l90","l91","l92","l93","l94","l95","l96"]],["Annotate",["l87",1024],["pragma_auto_unroll_max_step"],[]],["Annotate",["l87",1],["pragma_unroll_explicit"],[]],["GetLoops",["b73"],[],["l97","l98","l99","l100","l101"]],["GetBlock",[],["C","main"],["b102"]],["GetLoops",["b102"],[],["l103","l104","l105","l106","l107","l108","l109","l110","l111","l112"]],["DecomposeReduction",["b102","l106"],[],["b113"]]],[[4,[1,1,353,2,1]],[6,[128,1,1,9,12]],[8,[1024,5,1]],[25,1],[31,3],[33,4]]],[0.0066448907500000001236,0.0066799006250000004387,0.0066598057500000000172],{"host":{"keys":["cpu"],"kind":"llvm","mtriple":"x86_64-unknown-linux-gnu","tag":""},"keys":["rocm","gpu"],"kind":"rocm","max_num_threads":256,"max_shared_memory_per_block":49152,"max_threads_per_block":1024,"mcpu":"gfx942","model":"MI300","mtriple":"amdgcn-amd-amdhsa-hcc","tag":"","thread_warp_size":64},[["TENSOR","float16",[706,5120]],["TENSOR","float16",[5120,13824]],["TENSOR","float16",[706,13824]]]]]
[0,[[[["GetBlock",[],["C","main"],["b0"]],["GetBlock",[],["root","main"],["b1"]],["Annotate",["b0","\"SSSRRSRS\""],["meta_schedule.tiling_structure"],[]],["GetLoops",["b0"],[],["l2","l3","l4"]],["SamplePerfectTile",["l2"],[5,64],["v5","v6","v7","v8","v9"]],["Split",["l2","v5","v6","v7","v8","v9"],[1,0],["l10","l11","l12","l13","l14"]],["SamplePerfectTile",["l3"],[5,64],["v15","v16","v17","v18","v19"]],["Split",["l3","v15","v16","v17","v18","v19"],[1,0],["l20","l21","l22","l23","l24"]],["SamplePerfectTile",["l4"],[3,64],["v25","v26","v27"]],["Split",["l4","v25","v26","v27"],[1,0],["l28","l29","l30"]],["Reorder",["l10","l20","l11","l21","l12","l22","l28","l29","l13","l23","l30","l14","l24"],[],[]],["Fuse",["l10","l20"],[1],["l31"]],["Bind",["l31"],["blockIdx.x"],[]],["Fuse",["l11","l21"],[1],["l32"]],["Bind",["l32"],["vthread.x"],[]],["Fuse",["l12","l22"],[1],["l33"]],["Bind",["l33"],["threadIdx.x"],[]],["Annotate",["b0",64],["meta_schedule.thread_extent_low_inclusive"],[]],["Annotate",["b0",1024],["meta_schedule.thread_extent_high_inclusive"],[]],["CacheWrite",["b0",[]],[0,"local"],["b34"]],["ReverseComputeAt",["b34","l33"],[1,-1],[]],["CacheRead",["b0",["b0"]],[0,"shared"],["b35"]],["ComputeAt",["b35","l28"],[1,-1],[]],["GetLoops",["b35"],[],["l36","l37","l38","l39","l40","l41"]],["Fuse",["l40","l41"],[1],["l42"]],["SampleCategorical",[],[[1,2,4,8],[0.25,0.25,0.25,0.25]],["v43"]],["Annotate",["b35","v43"],["meta_schedule.cooperative_fetch"],[]],["CacheRead",["b0",["b0"]],[1,"shared"],["b44"]],["ComputeAt",["b44","l28"],[1,-1],[]],["GetLoops",["b44"],[],["l45","l46","l47","l48","l49","l50"]],["Fuse",["l49","l50"],[1],["l51"]],["SampleCategorical",[],[[1,2,4,8],[0.25,0.25,0.25,0.25]],["v52"]],["Annotate",["b44","v52"],["meta_schedule.cooperative_fetch"],[]],["SampleCategorical",[],[[0,16,64,512,1024],[0.2000000000000000111,0.2000000000000000111,0.2000000000000000111,0.2000000000000000111,0.2000000000000000111]],["v53"]],["Annotate",["b1","v53"],["meta_schedule.unroll_explicit"],[]],["EnterPostproc",[],[],[]],["Unannotate",["b35"],["meta_schedule.cooperative_fetch"],[]],["GetLoops",["b35"],[],["l54","l55","l56","l57","l58"]],["Split",["l58","None",353,2],[1,0],["l59","l60","l61"]],["Vectorize",["l61"],[],[]],["Bind",["l60"],["threadIdx.x"],[]],["Unannotate",["b44"],["meta_schedule.cooperative_fetch"],[]],["GetLoops",["b44"],[],["l62","l63","l64","l65","l66"]],["Split",["l66","None",353,4],[1,0],["l67","l68","l69"]],["Vectorize",["l69"],[],[]],["Bind",["l68"],["threadIdx.x"],[]],["GetBlock",[],["root","main"],["b70"]],["Unannotate",["b70"],["meta_schedule.unroll_explicit"],[]],["GetChildBlocks",["b70"],[],["b71","b72","b73","b74"]],["GetLoops",["b71"],[],["l75","l76","l77","l78","l79","l80","l81"]],["GetLoops",["b72"],[],["l82","l83","l84","l85","l86","l87","l88"]],["GetLoops",["b73"],[],["l89","l90","l91","l92","l93","l94","l95","l96","l97","l98"]],["Annotate",["l89",1024],["pragma_auto_unroll_max_step"],[]],["Annotate",["l89",1],["pragma_unroll_explicit"],[]],["GetLoops",["b74"],[],["l99","l100","l101","l102","l103"]],["GetBlock",[],["C","main"],["b104"]],["GetLoops",["b104"],[],["l105","l106","l107","l108","l109","l110","l111","l112","l113","l114"]],["DecomposeReduction",["b104","l108"],[],["b115"]]],[[4,[1,1,353,1,2]],[6,[108,1,1,4,32]],[8,[1280,4,1]],[25,1],[31,2],[33,4]]],[0.013317493374999999495,0.013243748625000001037,0.013273497500000000157],{"host":{"keys":["cpu"],"kind":"llvm","mtriple":"x86_64-unknown-linux-gnu","tag":""},"keys":["rocm","gpu"],"kind":"rocm","max_num_threads":256,"max_shared_memory_per_block":49152,"max_threads_per_block":1024,"mcpu":"gfx942","model":"MI300","mtriple":"amdgcn-amd-amdhsa-hcc","tag":"","thread_warp_size":64},[["TENSOR","float16",[706,5120]],["TENSOR","float16",[5120,13824]],["TENSOR","float16",[706,13824]]]]]
[0,[[[["GetBlock",[],["C","main"],["b0"]],["GetBlock",[],["root","main"],["b1"]],["Annotate",["b0","\"SSSRRSRS\""],["meta_schedule.tiling_structure"],[]],["GetLoops",["b0"],[],["l2","l3","l4"]],["SamplePerfectTile",["l2"],[5,64],["v5","v6","v7","v8","v9"]],["Split",["l2","v5","v6","v7","v8","v9"],[1,0],["l10","l11","l12","l13","l14"]],["SamplePerfectTile",["l3"],[5,64],["v15","v16","v17","v18","v19"]],["Split",["l3","v15","v16","v17","v18","v19"],[1,0],["l20","l21","l22","l23","l24"]],["SamplePerfectTile",["l4"],[3,64],["v25","v26","v27"]],["Split",["l4","v25","v26","v27"],[1,0],["l28","l29","l30"]],["Reorder",["l10","l20","l11","l21","l12","l22","l28","l29","l13","l23","l30","l14","l24"],[],[]],["Fuse",["l10","l20"],[1],["l31"]],["Bind",["l31"],["blockIdx.x"],[]],["Fuse",["l11","l21"],[1],["l32"]],["Bind",["l32"],["vthread.x"],[]],["Fuse",["l12","l22"],[1],["l33"]],["Bind",["l33"],["threadIdx.x"],[]],["Annotate",["b0",64],["meta_schedule.thread_extent_low_inclusive"],[]],["Annotate",["b0",1024],["meta_schedule.thread_extent_high_inclusive"],[]],["CacheWrite",["b0",[]],[0,"local"],["b34"]],["ReverseComputeAt",["b34","l33"],[1,-1],[]],["CacheRead",["b0",["b0"]],[0,"shared"],["b35"]],["ComputeAt",["b35","l28"],[1,-1],[]],["GetLoops",["b35"],[],["l36","l37","l38","l39","l40","l41"]],["Fuse",["l40","l41"],[1],["l42"]],["SampleCategorical",[],[[1,2,4,8],[0.25,0.25,0.25,0.25]],["v43"]],["Annotate",["b35","v43"],["meta_schedule.cooperative_fetch"],[]],["CacheRead",["b0",["b0"]],[1,"shared"],["b44"]],["ComputeAt",["b44","l28"],[1,-1],[]],["GetLoops",["b44"],[],["l45","l46","l47","l48","l49","l50"]],["Fuse",["l49","l50"],[1],["l51"]],["SampleCategorical",[],[[1,2,4,8],[0.25,0.25,0.25,0.25]],["v52"]],["Annotate",["b44","v52"],["meta_schedule.cooperative_fetch"],[]],["SampleCategorical",[],[[0,16,64,512,1024],[0.2000000000000000111,0.2000000000000000111,0.2000000000000000111,0.2000000000000000111,0.2000000000000000111]],["v53"]],["Annotate",["b1","v53"],["meta_schedule.unroll_explicit"],[]],["EnterPostproc",[],[],[]],["Unannotate",["b35"],["meta_schedule.cooperative_fetch"],[]],["GetLoops",["b35"],[],["l54","l55","l56","l57","l58"]],["Split",["l58","None",128],[1,0],["l59","l60"]],["Bind",["l60"],["threadIdx.x"],[]],["Unannotate",["b44"],["meta_schedule.cooperative_fetch"],[]],["GetLoops",["b44"],[],["l61","l62","l63","l64","l65"]],["Split",["l65","None",128,2],[1,0],["l66","l67","l68"]],["Vectorize",["l68"],[],[]],["Bind",["l67"],["threadIdx.x"],[]],["GetBlock",[],["root","main"],["b69"]],["Unannotate",["b69"],["meta_schedule.unroll_explicit"],[]],["GetChildBlocks",["b69"],[],["b70","b71","b72","b73"]],["GetLoops",["b70"],[],["l74","l75","l76","l77","l78","l79"]],["GetLoops",["b71"],[],["l80","l81","l82","l83","l84","l85","l86"]],["GetLoops",["b72"],[],["l87","l88","l89","l90","l91","l92","l93","l94","l95","l96"]],["GetLoops",["b73"],[],["l97","l98","l99","l100","l101"]],["GetBlock",[],["C","main"],["b102"]],["GetLoops",["b102"],[],["l103","l104","l105","l106","l107","l108","l109","l110","l111","l112"]],["DecomposeReduction",["b102","l106"],[],["b113"]]],[[4,[1,1,2,353,1]],[6,[36,6,64,1,1]],[8,[5120,1,1]],[25,3],[31,1],[33,0]]],[0.44462890599999999042,0.44487288400000002397,0.44537992333333331629],{"host":{"keys":["cpu"],"kind":"llvm","mtriple":"x86_64-unknown-linux-gnu","tag":""},"keys":["rocm","gpu"],"kind":"rocm","max_num_threads":256,"max_shared_memory_per_block":49152,"max_threads_per_block":1024,"mcpu":"gfx942","model":"MI300","mtriple":"amdgcn-amd-amdhsa-hcc","tag":"","thread_warp_size":64},[["TENSOR","float16",[706,5120]],["TENSOR","float16",[5120,13824]],["TENSOR","float16",[706,13824]]]]]
[0,[[[["GetBlock",[],["C","main"],["b0"]],["GetBlock",[],["root","main"],["b1"]],["Annotate",["b0","\"SSSRRSRS\""],["meta_schedule.tiling_structure"],[]],["GetLoops",["b0"],[],["l2","l3","l4"]],["SamplePerfectTile",["l2"],[5,64],["v5","v6","v7","v8","v9"]],["Split",["l2","v5","v6","v7","v8","v9"],[1,0],["l10","l11","l12","l13","l14"]],["SamplePerfectTile",["l3"],[5,64],["v15","v16","v17","v18","v19"]],["Split",["l3","v15","v16","v17","v18","v19"],[1,0],["l20","l21","l22","l23","l24"]],["SamplePerfectTile",["l4"],[3,64],["v25","v26","v27"]],["Split",["l4","v25","v26","v27"],[1,0],["l28","l29","l30"]],["Reorder",["l10","l20","l11","l21","l12","l22","l28","l29","l13","l23","l30","l14","l24"],[],[]],["Fuse",["l10","l20"],[1],["l31"]],["Bind",["l31"],["blockIdx.x"],[]],["Fuse",["l11","l21"],[1],["l32"]],["Bind",["l32"],["vthread.x"],[]],["Fuse",["l12","l22"],[1],["l33"]],["Bind",["l33"],["threadIdx.x"],[]],["Annotate",["b0",64],["meta_schedule.thread_extent_low_inclusive"],[]],["Annotate",["b0",1024],["meta_schedule.thread_extent_high_inclusive"],[]],["CacheWrite",["b0",[]],[0,"local"],["b34"]],["ReverseComputeAt",["b34","l33"],[1,-1],[]],["CacheRead",["b0",["b0"]],[0,"shared"],["b35"]],["ComputeAt",["b35","l28"],[1,-1],[]],["GetLoops",["b35"],[],["l36","l37","l38","l39","l40","l41"]],["Fuse",["l40","l41"],[1],["l42"]],["SampleCategorical",[],[[1,2,4,8],[0.25,0.25,0.25,0.25]],["v43"]],["Annotate",["b35","v43"],["meta_schedule.cooperative_fetch"],[]],["CacheRead",["b0",["b0"]],[1,"shared"],["b44"]],["ComputeAt",["b44","l28"],[1,-1],[]],["GetLoops",["b44"],[],["l45","l46","l47","l48","l49","l50"]],["Fuse",["l49","l50"],[1],["l51"]],["SampleCategorical",[],[[1,2,4,8],[0.25,0.25,0.25,0.25]],["v52"]],["Annotate",["b44","v52"],["meta_schedule.cooperative_fetch"],[]],["SampleCategorical",[],[[0,16,64,512,1024],[0.2000000000000000111,0.2000000000000000111,0.2000000000000000111,0.2000000000000000111,0.2000000000000000111]],["v53"]],["Annotate",["b1","v53"],["meta_schedule.unroll_explicit"],[]],["EnterPostproc",[],[],[]],["Unannotate",["b35"],["meta_schedule.cooperative_fetch"],[]],["GetLoops",["b35"],[],["l54","l55","l56","l57","l58"]],["Split",["l58","None",192],[1,0],["l59","l60"]],["Bind",["l60"],["threadIdx.x"],[]],["Unannotate",["b44"],["meta_schedule.cooperative_fetch"],[]],["GetLoops",["b44"],[],["l61","l62","l63","l64","l65"]],["Split",["l65","None",192],[1,0],["l66","l67"]],["Bind",["l67"],["threadIdx.x"],[]],["GetBlock",[],["root","main"],["b68"]],["Unannotate",["b68"],["meta_schedule.unroll_explicit"],[]],["GetChildBlocks",["b68"],[],["b69","b70","b71","b72"]],["GetLoops",["b69"],[],["l73","l74","l75","l76","l77","l78"]],["GetLoops",["b70"],[],["l79","l80","l81","l82","l83","l84"]],["GetLoops",["b71"],[],["l85","l86","l87","l88","l89","l90","l91","l92","l93","l94"]],["Annotate",["l85",16],["pragma_auto_unroll_max_step"],[]],["Annotate",["l85",1],["pragma_unroll_explicit"],[]],["GetLoops",["b72"],[],["l95","l96","l97","l98","l99"]],["GetBlock",[],["C","main"],["b100"]],["GetLoops",["b100"],[],["l101","l102","l103","l104","l105","l106","l107","l108","l109","l110"]],["DecomposeReduction",["b100","l104"],[],["b111"]]],[[4,[353,2,1,1,1]],[6,[36,2,192,1,1]],[8,[160,1,32]],[25,0],[31,0],[33,1]]],[0.016156660857142856463,0.016167792142857143056,0.016291239000000002496],{"host":{"keys":["cpu"],"kind":"llvm","mtriple":"x86_64-unknown-linux-gnu","tag":""},"keys":["rocm","gpu"],"kind":"rocm","max_num_threads":256,"max_shared_memory_per_block":49152,"max_threads_per_block":1024,"mcpu":"gfx942","model":"MI300","mtriple":"amdgcn-amd-amdhsa-hcc","tag":"","thread_warp_size":64},[["TENSOR","float16",[706,5120]],["TENSOR","float16",[5120,13824]],["TENSOR","float16",[706,13824]]]]]
[0,[[[["GetBlock",[],["C","main"],["b0"]],["GetBlock",[],["root","main"],["b1"]],["Annotate",["b0","\"SSSRRSRS\""],["meta_schedule.tiling_structure"],[]],["GetLoops",["b0"],[],["l2","l3","l4"]],["SamplePerfectTile",["l2"],[5,64],["v5","v6","v7","v8","v9"]],["Split",["l2","v5","v6","v7","v8","v9"],[1,0],["l10","l11","l12","l13","l14"]],["SamplePerfectTile",["l3"],[5,64],["v15","v16","v17","v18","v19"]],["Split",["l3","v15","v16","v17","v18","v19"],[1,0],["l20","l21","l22","l23","l24"]],["SamplePerfectTile",["l4"],[3,64],["v25","v26","v27"]],["Split",["l4","v25","v26","v27"],[1,0],["l28","l29","l30"]],["Reorder",["l10","l20","l11","l21","l12","l22","l28","l29","l13","l23","l30","l14","l24"],[],[]],["Fuse",["l10","l20"],[1],["l31"]],["Bind",["l31"],["blockIdx.x"],[]],["Fuse",["l11","l21"],[1],["l32"]],["Bind",["l32"],["vthread.x"],[]],["Fuse",["l12","l22"],[1],["l33"]],["Bind",["l33"],["threadIdx.x"],[]],["Annotate",["b0",64],["meta_schedule.thread_extent_low_inclusive"],[]],["Annotate",["b0",1024],["meta_schedule.thread_extent_high_inclusive"],[]],["CacheWrite",["b0",[]],[0,"local"],["b34"]],["ReverseComputeAt",["b34","l33"],[1,-1],[]],["CacheRead",["b0",["b0"]],[0,"shared"],["b35"]],["ComputeAt",["b35","l28"],[1,-1],[]],["GetLoops",["b35"],[],["l36","l37","l38","l39","l40","l41"]],["Fuse",["l40","l41"],[1],["l42"]],["SampleCategorical",[],[[1,2,4,8],[0.25,0.25,0.25,0.25]],["v43"]],["Annotate",["b35","v43"],["meta_schedule.cooperative_fetch"],[]],["CacheRead",["b0",["b0"]],[1,"shared"],["b44"]],["ComputeAt",["b44","l28"],[1,-1],[]],["GetLoops",["b44"],[],["l45","l46","l47","l48","l49","l50"]],["Fuse",["l49","l50"],[1],["l51"]],["SampleCategorical",[],[[1,2,4,8],[0.25,0.25,0.25,0.25]],["v52"]],["Annotate",["b44","v52"],["meta_schedule.cooperative_fetch"],[]],["SampleCategorical",[],[[0,16,64,512,1024],[0.2000000000000000111,0.2000000000000000111,0.2000000000000000111,0.2000000000000000111,0.2000000000000000111]],["v53"]],["Annotate",["b1","v53"],["meta_schedule.unroll_explicit"],[]],["EnterPostproc",[],[],[]],["Unannotate",["b35"],["meta_schedule.cooperative_fetch"],[]],["GetLoops",["b35"],[],["l54","l55","l56","l57","l58"]],["Split",["l58","None",706],[1,0],["l59","l60"]],["Bind",["l60"],["threadIdx.x"],[]],["Unannotate",["b44"],["meta_schedule.cooperative_fetch"],[]],["GetLoops",["b44"],[],["l61","l62","l63","l64","l65"]],["Split",["l65","None",706],[1,0],["l66","l67"]],["Bind",["l67"],["threadIdx.x"],[]],["GetBlock",[],["root","main"],["b68"]],["Unannotate",["b68"],["meta_schedule.unroll_explicit"],[]],["GetChildBlocks",["b68"],[],["b69","b70","b71","b72"]],["GetLoops",["b69"],[],["l73","l74","l75","l76","l77","l78"]],["GetLoops",["b70"],[],["l79","l80","l81","l82","l83","l84"]],["GetLoops",["b71"],[],["l85","l86","l87","l88","l89","l90","l91","l92","l93","l94"]],["GetLoops",["b72"],[],["l95","l96","l97","l98","l99"]],["GetBlock",[],["C","main"],["b100"]],["GetLoops",["b100"],[],["l101","l102","l103","l104","l105","l106","l107","l108","l109","l110"]],["DecomposeReduction",["b100","l104"],[],["b111"]]],[[4,[2,1,353,1,1]],[6,[192,1,2,1,36]],[8,[5120,1,1]],[25,0],[31,0],[33,0]]],[0.011051084100000000549,0.011033569300000000551,0.0097902078124999999953],{"host":{"keys":["cpu"],"kind":"llvm","mtriple":"x86_64-unknown-linux-gnu","tag":""},"keys":["rocm","gpu"],"kind":"rocm","max_num_threads":256,"max_shared_memory_per_block":49152,"max_threads_per_block":1024,"mcpu":"gfx942","model":"MI300","mtriple":"amdgcn-amd-amdhsa-hcc","tag":"","thread_warp_size":64},[["TENSOR","float16",[706,5120]],["TENSOR","float16",[5120,13824]],["TENSOR","float16",[706,13824]]]]]
[0,[[[["GetBlock",[],["C","main"],["b0"]],["GetBlock",[],["root","main"],["b1"]],["Annotate",["b0","\"SSSRRSRS\""],["meta_schedule.tiling_structure"],[]],["GetLoops",["b0"],[],["l2","l3","l4"]],["SamplePerfectTile",["l2"],[5,64],["v5","v6","v7","v8","v9"]],["Split",["l2","v5","v6","v7","v8","v9"],[1,0],["l10","l11","l12","l13","l14"]],["SamplePerfectTile",["l3"],[5,64],["v15","v16","v17","v18","v19"]],["Split",["l3","v15","v16","v17","v18","v19"],[1,0],["l20","l21","l22","l23","l24"]],["SamplePerfectTile",["l4"],[3,64],["v25","v26","v27"]],["Split",["l4","v25","v26","v27"],[1,0],["l28","l29","l30"]],["Reorder",["l10","l20","l11","l21","l12","l22","l28","l29","l13","l23","l30","l14","l24"],[],[]],["Fuse",["l10","l20"],[1],["l31"]],["Bind",["l31"],["blockIdx.x"],[]],["Fuse",["l11","l21"],[1],["l32"]],["Bind",["l32"],["vthread.x"],[]],["Fuse",["l12","l22"],[1],["l33"]],["Bind",["l33"],["threadIdx.x"],[]],["Annotate",["b0",64],["meta_schedule.thread_extent_low_inclusive"],[]],["Annotate",["b0",1024],["meta_schedule.thread_extent_high_inclusive"],[]],["CacheWrite",["b0",[]],[0,"local"],["b34"]],["ReverseComputeAt",["b34","l33"],[1,-1],[]],["CacheRead",["b0",["b0"]],[0,"shared"],["b35"]],["ComputeAt",["b35","l28"],[1,-1],[]],["GetLoops",["b35"],[],["l36","l37","l38","l39","l40","l41"]],["Fuse",["l40","l41"],[1],["l42"]],["SampleCategorical",[],[[1,2,4,8],[0.25,0.25,0.25,0.25]],["v43"]],["Annotate",["b35","v43"],["meta_schedule.cooperative_fetch"],[]],["CacheRead",["b0",["b0"]],[1,"shared"],["b44"]],["ComputeAt",["b44","l28"],[1,-1],[]],["GetLoops",["b44"],[],["l45","l46","l47","l48","l49","l50"]],["Fuse",["l49","l50"],[1],["l51"]],["SampleCategorical",[],[[1,2,4,8],[0.25,0.25,0.25,0.25]],["v52"]],["Annotate",["b44","v52"],["meta_schedule.cooperative_fetch"],[]],["SampleCategorical",[],[[0,16,64,512,1024],[0.2000000000000000111,0.2000000000000000111,0.2000000000000000111,0.2000000000000000111,0.2000000000000000111]],["v53"]],["Annotate",["b1","v53"],["meta_schedule.unroll_explicit"],[]],["EnterPostproc",[],[],[]],["Unannotate",["b35"],["meta_schedule.cooperative_fetch"],[]],["GetLoops",["b35"],[],["l54","l55","l56","l57","l58"]],["Split",["l58","None",706],[1,0],["l59","l60"]],["Bind",["l60"],["threadIdx.x"],[]],["Unannotate",["b44"],["meta_schedule.cooperative_fetch"],[]],["GetLoops",["b44"],[],["l61","l62","l63","l64","l65"]],["Split",["l65","None",706],[1,0],["l66","l67"]],["Bind",["l67"],["threadIdx.x"],[]],["GetBlock",[],["root","main"],["b68"]],["Unannotate",["b68"],["meta_schedule.unroll_explicit"],[]],["GetChildBlocks",["b68"],[],["b69","b70","b71","b72"]],["GetLoops",["b69"],[],["l73","l74","l75","l76","l77","l78"]],["GetLoops",["b70"],[],["l79","l80","l81","l82","l83","l84"]],["GetLoops",["b71"],[],["l85","l86","l87","l88","l89","l90","l91","l92","l93","l94"]],["Annotate",["l85",64],["pragma_auto_unroll_max_step"],[]],["Annotate",["l85",1],["pragma_unroll_explicit"],[]],["GetLoops",["b72"],[],["l95","l96","l97","l98","l99"]],["GetBlock",[],["C","main"],["b100"]],["GetLoops",["b100"],[],["l101","l102","l103","l104","l105","l106","l107","l108","l109","l110"]],["DecomposeReduction",["b100","l104"],[],["b111"]]],[[4,[1,1,706,1,1]],[6,[64,18,1,2,6]],[8,[640,4,2]],[25,0],[31,0],[33,2]]],[0.010090157299999999441,0.009331874812499999991,0.0097848824999999996915],{"host":{"keys":["cpu"],"kind":"llvm","mtriple":"x86_64-unknown-linux-gnu","tag":""},"keys":["rocm","gpu"],"kind":"rocm","max_num_threads":256,"max_shared_memory_per_block":49152,"max_threads_per_block":1024,"mcpu":"gfx942","model":"MI300","mtriple":"amdgcn-amd-amdhsa-hcc","tag":"","thread_warp_size":64},[["TENSOR","float16",[706,5120]],["TENSOR","float16",[5120,13824]],["TENSOR","float16",[706,13824]]]]]
[0,[[[["GetBlock",[],["C","main"],["b0"]],["GetBlock",[],["root","main"],["b1"]],["Annotate",["b0","\"SSSRRSRS\""],["meta_schedule.tiling_structure"],[]],["GetLoops",["b0"],[],["l2","l3","l4"]],["SamplePerfectTile",["l2"],[5,64],["v5","v6","v7","v8","v9"]],["Split",["l2","v5","v6","v7","v8","v9"],[1,0],["l10","l11","l12","l13","l14"]],["SamplePerfectTile",["l3"],[5,64],["v15","v16","v17","v18","v19"]],["Split",["l3","v15","v16","v17","v18","v19"],[1,0],["l20","l21","l22","l23","l24"]],["SamplePerfectTile",["l4"],[3,64],["v25","v26","v27"]],["Split",["l4","v25","v26","v27"],[1,0],["l28","l29","l30"]],["Reorder",["l10","l20","l11","l21","l12","l22","l28","l29","l13","l23","l30","l14","l24"],[],[]],["Fuse",["l10","l20"],[1],["l31"]],["Bind",["l31"],["blockIdx.x"],[]],["Fuse",["l11","l21"],[1],["l32"]],["Bind",["l32"],["vthread.x"],[]],["Fuse",["l12","l22"],[1],["l33"]],["Bind",["l33"],["threadIdx.x"],[]],["Annotate",["b0",64],["meta_schedule.thread_extent_low_inclusive"],[]],["Annotate",["b0",1024],["meta_schedule.thread_extent_high_inclusive"],[]],["CacheWrite",["b0",[]],[0,"local"],["b34"]],["ReverseComputeAt",["b34","l33"],[1,-1],[]],["CacheRead",["b0",["b0"]],[0,"shared"],["b35"]],["ComputeAt",["b35","l28"],[1,-1],[]],["GetLoops",["b35"],[],["l36","l37","l38","l39","l40","l41"]],["Fuse",["l40","l41"],[1],["l42"]],["SampleCategorical",[],[[1,2,4,8],[0.25,0.25,0.25,0.25]],["v43"]],["Annotate",["b35","v43"],["meta_schedule.cooperative_fetch"],[]],["CacheRead",["b0",["b0"]],[1,"shared"],["b44"]],["ComputeAt",["b44","l28"],[1,-1],[]],["GetLoops",["b44"],[],["l45","l46","l47","l48","l49","l50"]],["Fuse",["l49","l50"],[1],["l51"]],["SampleCategorical",[],[[1,2,4,8],[0.25,0.25,0.25,0.25]],["v52"]],["Annotate",["b44","v52"],["meta_schedule.cooperative_fetch"],[]],["SampleCategorical",[],[[0,16,64,512,1024],[0.2000000000000000111,0.2000000000000000111,0.2000000000000000111,0.2000000000000000111,0.2000000000000000111]],["v53"]],["Annotate",["b1","v53"],["meta_schedule.unroll_explicit"],[]],["EnterPostproc",[],[],[]],["Unannotate",["b35"],["meta_schedule.cooperative_fetch"],[]],["GetLoops",["b35"],[],["l54","l55","l56","l57","l58"]],["Split",["l58","None",353,8],[1,0],["l59","l60","l61"]],["Vectorize",["l61"],[],[]],["Bind",["l60"],["threadIdx.x"],[]],["Unannotate",["b44"],["meta_schedule.cooperative_fetch"],[]],["GetLoops",["b44"],[],["l62","l63","l64","l65","l66"]],["Split",["l66","None",353,2],[1,0],["l67","l68","l69"]],["Vectorize",["l69"],[],[]],["Bind",["l68"],["threadIdx.x"],[]],["GetBlock",[],["root","main"],["b70"]],["Unannotate",["b70"],["meta_schedule.unroll_explicit"],[]],["GetChildBlocks",["b70"],[],["b71","b72","b73","b74"]],["GetLoops",["b71"],[],["l75","l76","l77","l78","l79","l80","l81"]],["GetLoops",["b72"],[],["l82","l83","l84","l85","l86","l87","l88"]],["GetLoops",["b73"],[],["l89","l90","l91","l92","l93","l94","l95","l96","l97","l98"]],["GetLoops",["b74"],[],["l99","l100","l101","l102","l103"]],["GetBlock",[],["C","main"],["b104"]],["GetLoops",["b104"],[],["l105","l106","l107","l108","l109","l110","l111","l112","l113","l114"]],["DecomposeReduction",["b104","l108"],[],["b115"]]],[[4,[1,2,353,1,1]],[6,[24,9,1,16,4]],[8,[640,4,2]],[25,3],[31,1],[33,0]]],[0.1492137753333333261,0.14897882066666665035,0.14888681000000000831],{"host":{"keys":["cpu"],"kind":"llvm","mtriple":"x86_64-unknown-linux-gnu","tag":""},"keys":["rocm","gpu"],"kind":"rocm","max_num_threads":256,"max_shared_memory_per_block":49152,"max_threads_per_block":1024,"mcpu":"gfx942","model":"MI300","mtriple":"amdgcn-amd-amdhsa-hcc","tag":"","thread_warp_size":64},[["TENSOR","float16",[706,5120]],["TENSOR","float16",[5120,13824]],["TENSOR","float16",[706,13824]]]]]
[0,[[[["GetBlock",[],["C","main"],["b0"]],["GetBlock",[],["root","main"],["b1"]],["Annotate",["b0","\"SSSRRSRS\""],["meta_schedule.tiling_structure"],[]],["GetLoops",["b0"],[],["l2","l3","l4"]],["SamplePerfectTile",["l2"],[5,64],["v5","v6","v7","v8","v9"]],["Split",["l2","v5","v6","v7","v8","v9"],[1,0],["l10","l11","l12","l13","l14"]],["SamplePerfectTile",["l3"],[5,64],["v15","v16","v17","v18","v19"]],["Split",["l3","v15","v16","v17","v18","v19"],[1,0],["l20","l21","l22","l23","l24"]],["SamplePerfectTile",["l4"],[3,64],["v25","v26","v27"]],["Split",["l4","v25","v26","v27"],[1,0],["l28","l29","l30"]],["Reorder",["l10","l20","l11","l21","l12","l22","l28","l29","l13","l23","l30","l14","l24"],[],[]],["Fuse",["l10","l20"],[1],["l31"]],["Bind",["l31"],["blockIdx.x"],[]],["Fuse",["l11","l21"],[1],["l32"]],["Bind",["l32"],["vthread.x"],[]],["Fuse",["l12","l22"],[1],["l33"]],["Bind",["l33"],["threadIdx.x"],[]],["Annotate",["b0",64],["meta_schedule.thread_extent_low_inclusive"],[]],["Annotate",["b0",1024],["meta_schedule.thread_extent_high_inclusive"],[]],["CacheWrite",["b0",[]],[0,"local"],["b34"]],["ReverseComputeAt",["b34","l33"],[1,-1],[]],["CacheRead",["b0",["b0"]],[0,"shared"],["b35"]],["ComputeAt",["b35","l28"],[1,-1],[]],["GetLoops",["b35"],[],["l36","l37","l38","l39","l40","l41"]],["Fuse",["l40","l41"],[1],["l42"]],["SampleCategorical",[],[[1,2,4,8],[0.25,0.25,0.25,0.25]],["v43"]],["Annotate",["b35","v43"],["meta_schedule.cooperative_fetch"],[]],["CacheRead",["b0",["b0"]],[1,"shared"],["b44"]],["ComputeAt",["b44","l28"],[1,-1],[]],["GetLoops",["b44"],[],["l45","l46","l47","l48","l49","l50"]],["Fuse",["l49","l50"],[1],["l51"]],["SampleCategorical",[],[[1,2,4,8],[0.25,0.25,0.25,0.25]],["v52"]],["Annotate",["b44","v52"],["meta_schedule.cooperative_fetch"],[]],["SampleCategorical",[],[[0,16,64,512,1024],[0.2000000000000000111,0.2000000000000000111,0.2000000000000000111,0.2000000000000000111,0.2000000000000000111]],["v53"]],["Annotate",["b1","v53"],["meta_schedule.unroll_explicit"],[]],["EnterPostproc",[],[],[]],["Unannotate",["b35"],["meta_schedule.cooperative_fetch"],[]],["GetLoops",["b35"],[],["l54","l55","l56","l57","l58"]],["Split",["l58","None",512,2],[1,0],["l59","l60","l61"]],["Vectorize",["l61"],[],[]],["Bind",["l60"],["threadIdx.x"],[]],["Unannotate",["b44"],["meta_schedule.cooperative_fetch"],[]],["GetLoops",["b44"],[],["l62","l63","l64","l65","l66"]],["Split",["l66","None",512,4],[1,0],["l67","l68","l69"]],["Vectorize",["l69"],[],[]],["Bind",["l68"],["threadIdx.x"],[]],["GetBlock",[],["root","main"],["b70"]],["Unannotate",["b70"],["meta_schedule.unroll_explicit"],[]],["GetChildBlocks",["b70"],[],["b71","b72","b73","b74"]],["GetLoops",["b71"],[],["l75","l76","l77","l78","l79","l80","l81"]],["GetLoops",["b72"],[],["l82","l83","l84","l85","l86","l87","l88"]],["GetLoops",["b73"],[],["l89","l90","l91","l92","l93","l94","l95","l96","l97","l98"]],["Annotate",["l89",16],["pragma_auto_unroll_max_step"],[]],["Annotate",["l89",1],["pragma_unroll_explicit"],[]],["GetLoops",["b74"],[],["l99","l100","l101","l102","l103"]],["GetBlock",[],["C","main"],["b104"]],["GetLoops",["b104"],[],["l105","l106","l107","l108","l109","l110","l111","l112","l113","l114"]],["DecomposeReduction",["b104","l108"],[],["b115"]]],[[4,[353,1,2,1,1]],[6,[18,1,256,3,1]],[8,[256,1,20]],[25,1],[31,2],[33,1]]],[0.030882684500000000261,0.030883043249999998781,0.030881051999999999114],{"host":{"keys":["cpu"],"kind":"llvm","mtriple":"x86_64-unknown-linux-gnu","tag":""},"keys":["rocm","gpu"],"kind":"rocm","max_num_threads":256,"max_shared_memory_per_block":49152,"max_threads_per_block":1024,"mcpu":"gfx942","model":"MI300","mtriple":"amdgcn-amd-amdhsa-hcc","tag":"","thread_warp_size":64},[["TENSOR","float16",[706,5120]],["TENSOR","float16",[5120,13824]],["TENSOR","float16",[706,13824]]]]]
[0,[[[["GetBlock",[],["C","main"],["b0"]],["GetBlock",[],["root","main"],["b1"]],["Annotate",["b0","\"SSSRRSRS\""],["meta_schedule.tiling_structure"],[]],["GetLoops",["b0"],[],["l2","l3","l4"]],["SamplePerfectTile",["l2"],[5,64],["v5","v6","v7","v8","v9"]],["Split",["l2","v5","v6","v7","v8","v9"],[1,0],["l10","l11","l12","l13","l14"]],["SamplePerfectTile",["l3"],[5,64],["v15","v16","v17","v18","v19"]],["Split",["l3","v15","v16","v17","v18","v19"],[1,0],["l20","l21","l22","l23","l24"]],["SamplePerfectTile",["l4"],[3,64],["v25","v26","v27"]],["Split",["l4","v25","v26","v27"],[1,0],["l28","l29","l30"]],["Reorder",["l10","l20","l11","l21","l12","l22","l28","l29","l13","l23","l30","l14","l24"],[],[]],["Fuse",["l10","l20"],[1],["l31"]],["Bind",["l31"],["blockIdx.x"],[]],["Fuse",["l11","l21"],[1],["l32"]],["Bind",["l32"],["vthread.x"],[]],["Fuse",["l12","l22"],[1],["l33"]],["Bind",["l33"],["threadIdx.x"],[]],["Annotate",["b0",64],["meta_schedule.thread_extent_low_inclusive"],[]],["Annotate",["b0",1024],["meta_schedule.thread_extent_high_inclusive"],[]],["CacheWrite",["b0",[]],[0,"local"],["b34"]],["ReverseComputeAt",["b34","l33"],[1,-1],[]],["CacheRead",["b0",["b0"]],[0,"shared"],["b35"]],["ComputeAt",["b35","l28"],[1,-1],[]],["GetLoops",["b35"],[],["l36","l37","l38","l39","l40","l41"]],["Fuse",["l40","l41"],[1],["l42"]],["SampleCategorical",[],[[1,2,4,8],[0.25,0.25,0.25,0.25]],["v43"]],["Annotate",["b35","v43"],["meta_schedule.cooperative_fetch"],[]],["CacheRead",["b0",["b0"]],[1,"shared"],["b44"]],["ComputeAt",["b44","l28"],[1,-1],[]],["GetLoops",["b44"],[],["l45","l46","l47","l48","l49","l50"]],["Fuse",["l49","l50"],[1],["l51"]],["SampleCategorical",[],[[1,2,4,8],[0.25,0.25,0.25,0.25]],["v52"]],["Annotate",["b44","v52"],["meta_schedule.cooperative_fetch"],[]],["SampleCategorical",[],[[0,16,64,512,1024],[0.2000000000000000111,0.2000000000000000111,0.2000000000000000111,0.2000000000000000111,0.2000000000000000111]],["v53"]],["Annotate",["b1","v53"],["meta_schedule.unroll_explicit"],[]],["EnterPostproc",[],[],[]],["Unannotate",["b35"],["meta_schedule.cooperative_fetch"],[]],["GetLoops",["b35"],[],["l54","l55","l56","l57","l58"]],["Split",["l58","None",128],[1,0],["l59","l60"]],["Bind",["l60"],["threadIdx.x"],[]],["Unannotate",["b44"],["meta_schedule.cooperative_fetch"],[]],["GetLoops",["b44"],[],["l61","l62","l63","l64","l65"]],["Split",["l65","None",128,4],[1,0],["l66","l67","l68"]],["Vectorize",["l68"],[],[]],["Bind",["l67"],["threadIdx.x"],[]],["GetBlock",[],["root","main"],["b69"]],["Unannotate",["b69"],["meta_schedule.unroll_explicit"],[]],["GetChildBlocks",["b69"],[],["b70","b71","b72","b73"]],["GetLoops",["b70"],[],["l74","l75","l76","l77","l78","l79"]],["GetLoops",["b71"],[],["l80","l81","l82","l83","l84","l85","l86"]],["GetLoops",["b72"],[],["l87","l88","l89","l90","l91","l92","l93","l94","l95","l96"]],["Annotate",["l87",64],["pragma_auto_unroll_max_step"],[]],["Annotate",["l87",1],["pragma_unroll_explicit"],[]],["GetLoops",["b73"],[],["l97","l98","l99","l100","l101"]],["GetBlock",[],["C","main"],["b102"]],["GetLoops",["b102"],[],["l103","l104","l105","l106","l107","l108","l109","l110","l111","l112"]],["DecomposeReduction",["b102","l106"],[],["b113"]]],[[4,[1,353,1,2,1]],[6,[18,3,128,1,2]],[8,[5120,1,1]],[25,2],[31,2],[33,2]]],[1.6019731443333331544,1.6062246093333332198,1.5927216796666667786],{"host":{"keys":["cpu"],"kind":"llvm","mtriple":"x86_64-unknown-linux-gnu","tag":""},"keys":["rocm","gpu"],"kind":"rocm","max_num_threads":256,"max_shared_memory_per_block":49152,"max_threads_per_block":1024,"mcpu":"gfx942","model":"MI300","mtriple":"amdgcn-amd-amdhsa-hcc","tag":"","thread_warp_size":64},[["TENSOR","float16",[706,5120]],["TENSOR","float16",[5120,13824]],["TENSOR","float16",[706,13824]]]]]
[0,[[[["GetBlock",[],["C","main"],["b0"]],["GetBlock",[],["root","main"],["b1"]],["Annotate",["b0","\"SSSRRSRS\""],["meta_schedule.tiling_structure"],[]],["GetLoops",["b0"],[],["l2","l3","l4"]],["SamplePerfectTile",["l2"],[5,64],["v5","v6","v7","v8","v9"]],["Split",["l2","v5","v6","v7","v8","v9"],[1,0],["l10","l11","l12","l13","l14"]],["SamplePerfectTile",["l3"],[5,64],["v15","v16","v17","v18","v19"]],["Split",["l3","v15","v16","v17","v18","v19"],[1,0],["l20","l21","l22","l23","l24"]],["SamplePerfectTile",["l4"],[3,64],["v25","v26","v27"]],["Split",["l4","v25","v26","v27"],[1,0],["l28","l29","l30"]],["Reorder",["l10","l20","l11","l21","l12","l22","l28","l29","l13","l23","l30","l14","l24"],[],[]],["Fuse",["l10","l20"],[1],["l31"]],["Bind",["l31"],["blockIdx.x"],[]],["Fuse",["l11","l21"],[1],["l32"]],["Bind",["l32"],["vthread.x"],[]],["Fuse",["l12","l22"],[1],["l33"]],["Bind",["l33"],["threadIdx.x"],[]],["Annotate",["b0",64],["meta_schedule.thread_extent_low_inclusive"],[]],["Annotate",["b0",1024],["meta_schedule.thread_extent_high_inclusive"],[]],["CacheWrite",["b0",[]],[0,"local"],["b34"]],["ReverseComputeAt",["b34","l33"],[1,-1],[]],["CacheRead",["b0",["b0"]],[0,"shared"],["b35"]],["ComputeAt",["b35","l28"],[1,-1],[]],["GetLoops",["b35"],[],["l36","l37","l38","l39","l40","l41"]],["Fuse",["l40","l41"],[1],["l42"]],["SampleCategorical",[],[[1,2,4,8],[0.25,0.25,0.25,0.25]],["v43"]],["Annotate",["b35","v43"],["meta_schedule.cooperative_fetch"],[]],["CacheRead",["b0",["b0"]],[1,"shared"],["b44"]],["ComputeAt",["b44","l28"],[1,-1],[]],["GetLoops",["b44"],[],["l45","l46","l47","l48","l49","l50"]],["Fuse",["l49","l50"],[1],["l51"]],["SampleCategorical",[],[[1,2,4,8],[0.25,0.25,0.25,0.25]],["v52"]],["Annotate",["b44","v52"],["meta_schedule.cooperative_fetch"],[]],["SampleCategorical",[],[[0,16,64,512,1024],[0.2000000000000000111,0.2000000000000000111,0.2000000000000000111,0.2000000000000000111,0.2000000000000000111]],["v53"]],["Annotate",["b1","v53"],["meta_schedule.unroll_explicit"],[]],["EnterPostproc",[],[],[]],["Unannotate",["b35"],["meta_schedule.cooperative_fetch"],[]],["GetLoops",["b35"],[],["l54","l55","l56","l57","l58"]],["Split",["l58","None",353,8],[1,0],["l59","l60","l61"]],["Vectorize",["l61"],[],[]],["Bind",["l60"],["threadIdx.x"],[]],["Unannotate",["b44"],["meta_schedule.cooperative_fetch"],[]],["GetLoops",["b44"],[],["l62","l63","l64","l65","l66"]],["Split",["l66","None",353,8],[1,0],["l67","l68","l69"]],["Vectorize",["l69"],[],[]],["Bind",["l68"],["threadIdx.x"],[]],["GetBlock",[],["root","main"],["b70"]],["Unannotate",["b70"],["meta_schedule.unroll_explicit"],[]],["GetChildBlocks",["b70"],[],["b71","b72","b73","b74"]],["GetLoops",["b71"],[],["l75","l76","l77","l78","l79","l80","l81"]],["GetLoops",["b72"],[],["l82","l83","l84","l85","l86","l87","l88"]],["GetLoops",["b73"],[],["l89","l90","l91","l92","l93","l94","l95","l96","l97","l98"]],["GetLoops",["b74"],[],["l99","l100","l101","l102","l103"]],["GetBlock",[],["C","main"],["b104"]],["GetLoops",["b104"],[],["l105","l106","l107","l108","l109","l110","l111","l112","l113","l114"]],["DecomposeReduction",["b104","l108"],[],["b115"]]],[[4,[2,1,353,1,1]],[6,[216,1,1,16,4]],[8,[640,4,2]],[25,3],[31,3],[33,0]]],[0.0026500140677966099213,0.0026651246610169491286,0.0026596188135593217851],{"host":{"keys":["cpu"],"kind":"llvm","mtriple":"x86_64-unknown-linux-gnu","tag":""},"keys":["rocm","gpu"],"kind":"rocm","max_num_threads":256,"max_shared_memory_per_block":49152,"max_threads_per_block":1024,"mcpu":"gfx942","model":"MI300","mtriple":"amdgcn-amd-amdhsa-hcc","tag":"","thread_warp_size":64},[["TENSOR","float16",[706,5120]],["TENSOR","float16",[5120,13824]],["TENSOR","float16",[706,13824]]]]]
