demo_artifacts/logs/mm_ms/rocm_mm_642_1024_4096/database_tuning_record.json
[0,[[[["GetBlock",[],["C","main"],["b0"]],["GetBlock",[],["root","main"],["b1"]],["Annotate",["b0","\"SSSRRSRS\""],["meta_schedule.tiling_structure"],[]],["GetLoops",["b0"],[],["l2","l3","l4"]],["SamplePerfectTile",["l2"],[5,64],["v5","v6","v7","v8","v9"]],["Split",["l2","v5","v6","v7","v8","v9"],[1,0],["l10","l11","l12","l13","l14"]],["SamplePerfectTile",["l3"],[5,64],["v15","v16","v17","v18","v19"]],["Split",["l3","v15","v16","v17","v18","v19"],[1,0],["l20","l21","l22","l23","l24"]],["SamplePerfectTile",["l4"],[3,64],["v25","v26","v27"]],["Split",["l4","v25","v26","v27"],[1,0],["l28","l29","l30"]],["Reorder",["l10","l20","l11","l21","l12","l22","l28","l29","l13","l23","l30","l14","l24"],[],[]],["Fuse",["l10","l20"],[1],["l31"]],["Bind",["l31"],["blockIdx.x"],[]],["Fuse",["l11","l21"],[1],["l32"]],["Bind",["l32"],["vthread.x"],[]],["Fuse",["l12","l22"],[1],["l33"]],["Bind",["l33"],["threadIdx.x"],[]],["Annotate",["b0",64],["meta_schedule.thread_extent_low_inclusive"],[]],["Annotate",["b0",1024],["meta_schedule.thread_extent_high_inclusive"],[]],["CacheWrite",["b0",[]],[0,"local"],["b34"]],["ReverseComputeAt",["b34","l33"],[1,-1],[]],["CacheRead",["b0",["b0"]],[0,"shared"],["b35"]],["ComputeAt",["b35","l28"],[1,-1],[]],["GetLoops",["b35"],[],["l36","l37","l38","l39","l40","l41"]],["Fuse",["l40","l41"],[1],["l42"]],["SampleCategorical",[],[[1,2,4,8],[0.25,0.25,0.25,0.25]],["v43"]],["Annotate",["b35","v43"],["meta_schedule.cooperative_fetch"],[]],["CacheRead",["b0",["b0"]],[1,"shared"],["b44"]],["ComputeAt",["b44","l28"],[1,-1],[]],["GetLoops",["b44"],[],["l45","l46","l47","l48","l49","l50"]],["Fuse",["l49","l50"],[1],["l51"]],["SampleCategorical",[],[[1,2,4,8],[0.25,0.25,0.25,0.25]],["v52"]],["Annotate",["b44","v52"],["meta_schedule.cooperative_fetch"],[]],["SampleCategorical",[],[[0,16,64,512,1024],[0.2000000000000000111,0.2000000000000000111,0.2000000000000000111,0.2000000000000000111,0.2000000000000000111]],["v53"]],["Annotate",["b1","v53"],["meta_schedule.unroll_explicit"],[]],["EnterPostproc",[],[],[]],["Unannotate",["b35"],["meta_schedule.cooperative_fetch"],[]],["GetLoops",["b35"],[],["l54","l55","l56","l57","l58"]],["Split",["l58","None",107],[1,0],["l59","l60"]],["Bind",["l60"],["threadIdx.x"],[]],["Unannotate",["b44"],["meta_schedule.cooperative_fetch"],[]],["GetLoops",["b44"],[],["l61","l62","l63","l64","l65"]],["Split",["l65","None",107],[1,0],["l66","l67"]],["Bind",["l67"],["threadIdx.x"],[]],["GetBlock",[],["root","main"],["b68"]],["Unannotate",["b68"],["meta_schedule.unroll_explicit"],[]],["GetChildBlocks",["b68"],[],["b69","b70","b71","b72"]],["GetLoops",["b69"],[],["l73","l74","l75","l76","l77","l78"]],["GetLoops",["b70"],[],["l79","l80","l81","l82","l83","l84"]],["GetLoops",["b71"],[],["l85","l86","l87","l88","l89","l90","l91","l92","l93","l94"]],["Annotate",["l85",1024],["pragma_auto_unroll_max_step"],[]],["Annotate",["l85",1],["pragma_unroll_explicit"],[]],["GetLoops",["b72"],[],["l95","l96","l97","l98","l99"]],["GetBlock",[],["C","main"],["b100"]],["GetLoops",["b100"],[],["l101","l102","l103","l104","l105","l106","l107","l108","l109","l110"]],["DecomposeReduction",["b100","l104"],[],["b111"]]],[[4,[1,1,107,1,6]],[6,[4,2,1,8,16]],[8,[1024,4,1]],[25,0],[31,0],[33,4]]],[0.099205698333333328098,0.099184315666666675315,0.098996368333333320533],{"host":{"keys":["cpu"],"kind":"llvm","mtriple":"x86_64-unknown-linux-gnu","tag":""},"keys":["rocm","gpu"],"kind":"rocm","max_num_threads":256,"max_shared_memory_per_block":49152,"max_threads_per_block":1024,"mcpu":"gfx942","model":"MI300","mtriple":"amdgcn-amd-amdhsa-hcc","tag":"","thread_warp_size":64},[["TENSOR","float16",[642,4096]],["TENSOR","float16",[4096,1024]],["TENSOR","float16",[642,1024]]]]]
[0,[[[["GetBlock",[],["C","main"],["b0"]],["GetBlock",[],["root","main"],["b1"]],["Annotate",["b0","\"SSSRRSRS\""],["meta_schedule.tiling_structure"],[]],["GetLoops",["b0"],[],["l2","l3","l4"]],["SamplePerfectTile",["l2"],[5,64],["v5","v6","v7","v8","v9"]],["Split",["l2","v5","v6","v7","v8","v9"],[1,0],["l10","l11","l12","l13","l14"]],["SamplePerfectTile",["l3"],[5,64],["v15","v16","v17","v18","v19"]],["Split",["l3","v15","v16","v17","v18","v19"],[1,0],["l20","l21","l22","l23","l24"]],["SamplePerfectTile",["l4"],[3,64],["v25","v26","v27"]],["Split",["l4","v25","v26","v27"],[1,0],["l28","l29","l30"]],["Reorder",["l10","l20","l11","l21","l12","l22","l28","l29","l13","l23","l30","l14","l24"],[],[]],["Fuse",["l10","l20"],[1],["l31"]],["Bind",["l31"],["blockIdx.x"],[]],["Fuse",["l11","l21"],[1],["l32"]],["Bind",["l32"],["vthread.x"],[]],["Fuse",["l12","l22"],[1],["l33"]],["Bind",["l33"],["threadIdx.x"],[]],["Annotate",["b0",64],["meta_schedule.thread_extent_low_inclusive"],[]],["Annotate",["b0",1024],["meta_schedule.thread_extent_high_inclusive"],[]],["CacheWrite",["b0",[]],[0,"local"],["b34"]],["ReverseComputeAt",["b34","l33"],[1,-1],[]],["CacheRead",["b0",["b0"]],[0,"shared"],["b35"]],["ComputeAt",["b35","l28"],[1,-1],[]],["GetLoops",["b35"],[],["l36","l37","l38","l39","l40","l41"]],["Fuse",["l40","l41"],[1],["l42"]],["SampleCategorical",[],[[1,2,4,8],[0.25,0.25,0.25,0.25]],["v43"]],["Annotate",["b35","v43"],["meta_schedule.cooperative_fetch"],[]],["CacheRead",["b0",["b0"]],[1,"shared"],["b44"]],["ComputeAt",["b44","l28"],[1,-1],[]],["GetLoops",["b44"],[],["l45","l46","l47","l48","l49","l50"]],["Fuse",["l49","l50"],[1],["l51"]],["SampleCategorical",[],[[1,2,4,8],[0.25,0.25,0.25,0.25]],["v52"]],["Annotate",["b44","v52"],["meta_schedule.cooperative_fetch"],[]],["SampleCategorical",[],[[0,16,64,512,1024],[0.2000000000000000111,0.2000000000000000111,0.2000000000000000111,0.2000000000000000111,0.2000000000000000111]],["v53"]],["Annotate",["b1","v53"],["meta_schedule.unroll_explicit"],[]],["EnterPostproc",[],[],[]],["Unannotate",["b35"],["meta_schedule.cooperative_fetch"],[]],["GetLoops",["b35"],[],["l54","l55","l56","l57","l58"]],["Split",["l58","None",428,8],[1,0],["l59","l60","l61"]],["Vectorize",["l61"],[],[]],["Bind",["l60"],["threadIdx.x"],[]],["Unannotate",["b44"],["meta_schedule.cooperative_fetch"],[]],["GetLoops",["b44"],[],["l62","l63","l64","l65","l66"]],["Split",["l66","None",428],[1,0],["l67","l68"]],["Bind",["l68"],["threadIdx.x"],[]],["GetBlock",[],["root","main"],["b69"]],["Unannotate",["b69"],["meta_schedule.unroll_explicit"],[]],["GetChildBlocks",["b69"],[],["b70","b71","b72","b73"]],["GetLoops",["b70"],[],["l74","l75","l76","l77","l78","l79","l80"]],["GetLoops",["b71"],[],["l81","l82","l83","l84","l85","l86"]],["GetLoops",["b72"],[],["l87","l88","l89","l90","l91","l92","l93","l94","l95","l96"]],["Annotate",["l87",1024],["pragma_auto_unroll_max_step"],[]],["Annotate",["l87",1],["pragma_unroll_explicit"],[]],["GetLoops",["b73"],[],["l97","l98","l99","l100","l101"]],["GetBlock",[],["C","main"],["b102"]],["GetLoops",["b102"],[],["l103","l104","l105","l106","l107","l108","l109","l110","l111","l112"]],["DecomposeReduction",["b102","l106"],[],["b113"]]],[[4,[6,1,107,1,1]],[6,[1,4,4,1,64]],[8,[256,8,2]],[25,3],[31,0],[33,4]]],[0.019389395333333333399,0.019354155166666667937,0.019320276833333333705],{"host":{"keys":["cpu"],"kind":"llvm","mtriple":"x86_64-unknown-linux-gnu","tag":""},"keys":["rocm","gpu"],"kind":"rocm","max_num_threads":256,"max_shared_memory_per_block":49152,"max_threads_per_block":1024,"mcpu":"gfx942","model":"MI300","mtriple":"amdgcn-amd-amdhsa-hcc","tag":"","thread_warp_size":64},[["TENSOR","float16",[642,4096]],["TENSOR","float16",[4096,1024]],["TENSOR","float16",[642,1024]]]]]
[0,[[[["GetBlock",[],["C","main"],["b0"]],["GetBlock",[],["root","main"],["b1"]],["Annotate",["b0","\"SSSRRSRS\""],["meta_schedule.tiling_structure"],[]],["GetLoops",["b0"],[],["l2","l3","l4"]],["SamplePerfectTile",["l2"],[5,64],["v5","v6","v7","v8","v9"]],["Split",["l2","v5","v6","v7","v8","v9"],[1,0],["l10","l11","l12","l13","l14"]],["SamplePerfectTile",["l3"],[5,64],["v15","v16","v17","v18","v19"]],["Split",["l3","v15","v16","v17","v18","v19"],[1,0],["l20","l21","l22","l23","l24"]],["SamplePerfectTile",["l4"],[3,64],["v25","v26","v27"]],["Split",["l4","v25","v26","v27"],[1,0],["l28","l29","l30"]],["Reorder",["l10","l20","l11","l21","l12","l22","l28","l29","l13","l23","l30","l14","l24"],[],[]],["Fuse",["l10","l20"],[1],["l31"]],["Bind",["l31"],["blockIdx.x"],[]],["Fuse",["l11","l21"],[1],["l32"]],["Bind",["l32"],["vthread.x"],[]],["Fuse",["l12","l22"],[1],["l33"]],["Bind",["l33"],["threadIdx.x"],[]],["Annotate",["b0",64],["meta_schedule.thread_extent_low_inclusive"],[]],["Annotate",["b0",1024],["meta_schedule.thread_extent_high_inclusive"],[]],["CacheWrite",["b0",[]],[0,"local"],["b34"]],["ReverseComputeAt",["b34","l33"],[1,-1],[]],["CacheRead",["b0",["b0"]],[0,"shared"],["b35"]],["ComputeAt",["b35","l28"],[1,-1],[]],["GetLoops",["b35"],[],["l36","l37","l38","l39","l40","l41"]],["Fuse",["l40","l41"],[1],["l42"]],["SampleCategorical",[],[[1,2,4,8],[0.25,0.25,0.25,0.25]],["v43"]],["Annotate",["b35","v43"],["meta_schedule.cooperative_fetch"],[]],["CacheRead",["b0",["b0"]],[1,"shared"],["b44"]],["ComputeAt",["b44","l28"],[1,-1],[]],["GetLoops",["b44"],[],["l45","l46","l47","l48","l49","l50"]],["Fuse",["l49","l50"],[1],["l51"]],["SampleCategorical",[],[[1,2,4,8],[0.25,0.25,0.25,0.25]],["v52"]],["Annotate",["b44","v52"],["meta_schedule.cooperative_fetch"],[]],["SampleCategorical",[],[[0,16,64,512,1024],[0.2000000000000000111,0.2000000000000000111,0.2000000000000000111,0.2000000000000000111,0.2000000000000000111]],["v53"]],["Annotate",["b1","v53"],["meta_schedule.unroll_explicit"],[]],["EnterPostproc",[],[],[]],["Unannotate",["b35"],["meta_schedule.cooperative_fetch"],[]],["GetLoops",["b35"],[],["l54","l55","l56","l57","l58"]],["Split",["l58","None",107,4],[1,0],["l59","l60","l61"]],["Vectorize",["l61"],[],[]],["Bind",["l60"],["threadIdx.x"],[]],["Unannotate",["b44"],["meta_schedule.cooperative_fetch"],[]],["GetLoops",["b44"],[],["l62","l63","l64","l65","l66"]],["Split",["l66","None",107,2],[1,0],["l67","l68","l69"]],["Vectorize",["l69"],[],[]],["Bind",["l68"],["threadIdx.x"],[]],["GetBlock",[],["root","main"],["b70"]],["Unannotate",["b70"],["meta_schedule.unroll_explicit"],[]],["GetChildBlocks",["b70"],[],["b71","b72","b73","b74"]],["GetLoops",["b71"],[],["l75","l76","l77","l78","l79","l80","l81"]],["GetLoops",["b72"],[],["l82","l83","l84","l85","l86","l87","l88"]],["GetLoops",["b73"],[],["l89","l90","l91","l92","l93","l94","l95","l96","l97","l98"]],["GetLoops",["b74"],[],["l99","l100","l101","l102","l103"]],["GetBlock",[],["C","main"],["b104"]],["GetLoops",["b104"],[],["l105","l106","l107","l108","l109","l110","l111","l112","l113","l114"]],["DecomposeReduction",["b104","l108"],[],["b115"]]],[[4,[3,1,107,2,1]],[6,[2,32,1,1,16]],[8,[2048,1,2]],[25,2],[31,1],[33,0]]],[0.06299260933333332424,0.063015416333333337806,0.062965901666666670988],{"host":{"keys":["cpu"],"kind":"llvm","mtriple":"x86_64-unknown-linux-gnu","tag":""},"keys":["rocm","gpu"],"kind":"rocm","max_num_threads":256,"max_shared_memory_per_block":49152,"max_threads_per_block":1024,"mcpu":"gfx942","model":"MI300","mtriple":"amdgcn-amd-amdhsa-hcc","tag":"","thread_warp_size":64},[["TENSOR","float16",[642,4096]],["TENSOR","float16",[4096,1024]],["TENSOR","float16",[642,1024]]]]]
[0,[[[["GetBlock",[],["C","main"],["b0"]],["GetBlock",[],["root","main"],["b1"]],["Annotate",["b0","\"SSSRRSRS\""],["meta_schedule.tiling_structure"],[]],["GetLoops",["b0"],[],["l2","l3","l4"]],["SamplePerfectTile",["l2"],[5,64],["v5","v6","v7","v8","v9"]],["Split",["l2","v5","v6","v7","v8","v9"],[1,0],["l10","l11","l12","l13","l14"]],["SamplePerfectTile",["l3"],[5,64],["v15","v16","v17","v18","v19"]],["Split",["l3","v15","v16","v17","v18","v19"],[1,0],["l20","l21","l22","l23","l24"]],["SamplePerfectTile",["l4"],[3,64],["v25","v26","v27"]],["Split",["l4","v25","v26","v27"],[1,0],["l28","l29","l30"]],["Reorder",["l10","l20","l11","l21","l12","l22","l28","l29","l13","l23","l30","l14","l24"],[],[]],["Fuse",["l10","l20"],[1],["l31"]],["Bind",["l31"],["blockIdx.x"],[]],["Fuse",["l11","l21"],[1],["l32"]],["Bind",["l32"],["vthread.x"],[]],["Fuse",["l12","l22"],[1],["l33"]],["Bind",["l33"],["threadIdx.x"],[]],["Annotate",["b0",64],["meta_schedule.thread_extent_low_inclusive"],[]],["Annotate",["b0",1024],["meta_schedule.thread_extent_high_inclusive"],[]],["CacheWrite",["b0",[]],[0,"local"],["b34"]],["ReverseComputeAt",["b34","l33"],[1,-1],[]],["CacheRead",["b0",["b0"]],[0,"shared"],["b35"]],["ComputeAt",["b35","l28"],[1,-1],[]],["GetLoops",["b35"],[],["l36","l37","l38","l39","l40","l41"]],["Fuse",["l40","l41"],[1],["l42"]],["SampleCategorical",[],[[1,2,4,8],[0.25,0.25,0.25,0.25]],["v43"]],["Annotate",["b35","v43"],["meta_schedule.cooperative_fetch"],[]],["CacheRead",["b0",["b0"]],[1,"shared"],["b44"]],["ComputeAt",["b44","l28"],[1,-1],[]],["GetLoops",["b44"],[],["l45","l46","l47","l48","l49","l50"]],["Fuse",["l49","l50"],[1],["l51"]],["SampleCategorical",[],[[1,2,4,8],[0.25,0.25,0.25,0.25]],["v52"]],["Annotate",["b44","v52"],["meta_schedule.cooperative_fetch"],[]],["SampleCategorical",[],[[0,16,64,512,1024],[0.2000000000000000111,0.2000000000000000111,0.2000000000000000111,0.2000000000000000111,0.2000000000000000111]],["v53"]],["Annotate",["b1","v53"],["meta_schedule.unroll_explicit"],[]],["EnterPostproc",[],[],[]],["Unannotate",["b35"],["meta_schedule.cooperative_fetch"],[]],["GetLoops",["b35"],[],["l54","l55","l56","l57","l58"]],["Split",["l58","None",214,4],[1,0],["l59","l60","l61"]],["Vectorize",["l61"],[],[]],["Bind",["l60"],["threadIdx.x"],[]],["Unannotate",["b44"],["meta_schedule.cooperative_fetch"],[]],["GetLoops",["b44"],[],["l62","l63","l64","l65","l66"]],["Split",["l66","None",214,2],[1,0],["l67","l68","l69"]],["Vectorize",["l69"],[],[]],["Bind",["l68"],["threadIdx.x"],[]],["GetBlock",[],["root","main"],["b70"]],["Unannotate",["b70"],["meta_schedule.unroll_explicit"],[]],["GetChildBlocks",["b70"],[],["b71","b72","b73","b74"]],["GetLoops",["b71"],[],["l75","l76","l77","l78","l79","l80","l81"]],["GetLoops",["b72"],[],["l82","l83","l84","l85","l86","l87","l88"]],["GetLoops",["b73"],[],["l89","l90","l91","l92","l93","l94","l95","l96","l97","l98"]],["Annotate",["l89",64],["pragma_auto_unroll_max_step"],[]],["Annotate",["l89",1],["pragma_unroll_explicit"],[]],["GetLoops",["b74"],[],["l99","l100","l101","l102","l103"]],["GetBlock",[],["C","main"],["b104"]],["GetLoops",["b104"],[],["l105","l106","l107","l108","l109","l110","l111","l112","l113","l114"]],["DecomposeReduction",["b104","l108"],[],["b115"]]],[[4,[1,3,107,2,1]],[6,[2,1,2,256,1]],[8,[1024,1,4]],[25,2],[31,1],[33,2]]],[0.069970692666666667314,0.069814056333333332494,0.069810775666666657902],{"host":{"keys":["cpu"],"kind":"llvm","mtriple":"x86_64-unknown-linux-gnu","tag":""},"keys":["rocm","gpu"],"kind":"rocm","max_num_threads":256,"max_shared_memory_per_block":49152,"max_threads_per_block":1024,"mcpu":"gfx942","model":"MI300","mtriple":"amdgcn-amd-amdhsa-hcc","tag":"","thread_warp_size":64},[["TENSOR","float16",[642,4096]],["TENSOR","float16",[4096,1024]],["TENSOR","float16",[642,1024]]]]]
[0,[[[["GetBlock",[],["C","main"],["b0"]],["GetBlock",[],["root","main"],["b1"]],["Annotate",["b0","\"SSSRRSRS\""],["meta_schedule.tiling_structure"],[]],["GetLoops",["b0"],[],["l2","l3","l4"]],["SamplePerfectTile",["l2"],[5,64],["v5","v6","v7","v8","v9"]],["Split",["l2","v5","v6","v7","v8","v9"],[1,0],["l10","l11","l12","l13","l14"]],["SamplePerfectTile",["l3"],[5,64],["v15","v16","v17","v18","v19"]],["Split",["l3","v15","v16","v17","v18","v19"],[1,0],["l20","l21","l22","l23","l24"]],["SamplePerfectTile",["l4"],[3,64],["v25","v26","v27"]],["Split",["l4","v25","v26","v27"],[1,0],["l28","l29","l30"]],["Reorder",["l10","l20","l11","l21","l12","l22","l28","l29","l13","l23","l30","l14","l24"],[],[]],["Fuse",["l10","l20"],[1],["l31"]],["Bind",["l31"],["blockIdx.x"],[]],["Fuse",["l11","l21"],[1],["l32"]],["Bind",["l32"],["vthread.x"],[]],["Fuse",["l12","l22"],[1],["l33"]],["Bind",["l33"],["threadIdx.x"],[]],["Annotate",["b0",64],["meta_schedule.thread_extent_low_inclusive"],[]],["Annotate",["b0",1024],["meta_schedule.thread_extent_high_inclusive"],[]],["CacheWrite",["b0",[]],[0,"local"],["b34"]],["ReverseComputeAt",["b34","l33"],[1,-1],[]],["CacheRead",["b0",["b0"]],[0,"shared"],["b35"]],["ComputeAt",["b35","l28"],[1,-1],[]],["GetLoops",["b35"],[],["l36","l37","l38","l39","l40","l41"]],["Fuse",["l40","l41"],[1],["l42"]],["SampleCategorical",[],[[1,2,4,8],[0.25,0.25,0.25,0.25]],["v43"]],["Annotate",["b35","v43"],["meta_schedule.cooperative_fetch"],[]],["CacheRead",["b0",["b0"]],[1,"shared"],["b44"]],["ComputeAt",["b44","l28"],[1,-1],[]],["GetLoops",["b44"],[],["l45","l46","l47","l48","l49","l50"]],["Fuse",["l49","l50"],[1],["l51"]],["SampleCategorical",[],[[1,2,4,8],[0.25,0.25,0.25,0.25]],["v52"]],["Annotate",["b44","v52"],["meta_schedule.cooperative_fetch"],[]],["SampleCategorical",[],[[0,16,64,512,1024],[0.2000000000000000111,0.2000000000000000111,0.2000000000000000111,0.2000000000000000111,0.2000000000000000111]],["v53"]],["Annotate",["b1","v53"],["meta_schedule.unroll_explicit"],[]],["EnterPostproc",[],[],[]],["Unannotate",["b35"],["meta_schedule.cooperative_fetch"],[]],["GetLoops",["b35"],[],["l54","l55","l56","l57","l58"]],["Split",["l58","None",428,4],[1,0],["l59","l60","l61"]],["Vectorize",["l61"],[],[]],["Bind",["l60"],["threadIdx.x"],[]],["Unannotate",["b44"],["meta_schedule.cooperative_fetch"],[]],["GetLoops",["b44"],[],["l62","l63","l64","l65","l66"]],["Split",["l66","None",428,2],[1,0],["l67","l68","l69"]],["Vectorize",["l69"],[],[]],["Bind",["l68"],["threadIdx.x"],[]],["GetBlock",[],["root","main"],["b70"]],["Unannotate",["b70"],["meta_schedule.unroll_explicit"],[]],["GetChildBlocks",["b70"],[],["b71","b72","b73","b74"]],["GetLoops",["b71"],[],["l75","l76","l77","l78","l79","l80","l81"]],["GetLoops",["b72"],[],["l82","l83","l84","l85","l86","l87","l88"]],["GetLoops",["b73"],[],["l89","l90","l91","l92","l93","l94","l95","l96","l97","l98"]],["Annotate",["l89",16],["pragma_auto_unroll_max_step"],[]],["Annotate",["l89",1],["pragma_unroll_explicit"],[]],["GetLoops",["b74"],[],["l99","l100","l101","l102","l103"]],["GetBlock",[],["C","main"],["b104"]],["GetLoops",["b104"],[],["l105","l106","l107","l108","l109","l110","l111","l112","l113","l114"]],["DecomposeReduction",["b104","l108"],[],["b115"]]],[[4,[2,1,107,1,3]],[6,[32,4,4,1,2]],[8,[512,2,4]],[25,2],[31,1],[33,1]]],[0.00068773674887892381497,0.00068781379372197303055,0.00068778868161434986422],{"host":{"keys":["cpu"],"kind":"llvm","mtriple":"x86_64-unknown-linux-gnu","tag":""},"keys":["rocm","gpu"],"kind":"rocm","max_num_threads":256,"max_shared_memory_per_block":49152,"max_threads_per_block":1024,"mcpu":"gfx942","model":"MI300","mtriple":"amdgcn-amd-amdhsa-hcc","tag":"","thread_warp_size":64},[["TENSOR","float16",[642,4096]],["TENSOR","float16",[4096,1024]],["TENSOR","float16",[642,1024]]]]]
[0,[[[["GetBlock",[],["C","main"],["b0"]],["GetBlock",[],["root","main"],["b1"]],["Annotate",["b0","\"SSSRRSRS\""],["meta_schedule.tiling_structure"],[]],["GetLoops",["b0"],[],["l2","l3","l4"]],["SamplePerfectTile",["l2"],[5,64],["v5","v6","v7","v8","v9"]],["Split",["l2","v5","v6","v7","v8","v9"],[1,0],["l10","l11","l12","l13","l14"]],["SamplePerfectTile",["l3"],[5,64],["v15","v16","v17","v18","v19"]],["Split",["l3","v15","v16","v17","v18","v19"],[1,0],["l20","l21","l22","l23","l24"]],["SamplePerfectTile",["l4"],[3,64],["v25","v26","v27"]],["Split",["l4","v25","v26","v27"],[1,0],["l28","l29","l30"]],["Reorder",["l10","l20","l11","l21","l12","l22","l28","l29","l13","l23","l30","l14","l24"],[],[]],["Fuse",["l10","l20"],[1],["l31"]],["Bind",["l31"],["blockIdx.x"],[]],["Fuse",["l11","l21"],[1],["l32"]],["Bind",["l32"],["vthread.x"],[]],["Fuse",["l12","l22"],[1],["l33"]],["Bind",["l33"],["threadIdx.x"],[]],["Annotate",["b0",64],["meta_schedule.thread_extent_low_inclusive"],[]],["Annotate",["b0",1024],["meta_schedule.thread_extent_high_inclusive"],[]],["CacheWrite",["b0",[]],[0,"local"],["b34"]],["ReverseComputeAt",["b34","l33"],[1,-1],[]],["CacheRead",["b0",["b0"]],[0,"shared"],["b35"]],["ComputeAt",["b35","l28"],[1,-1],[]],["GetLoops",["b35"],[],["l36","l37","l38","l39","l40","l41"]],["Fuse",["l40","l41"],[1],["l42"]],["SampleCategorical",[],[[1,2,4,8],[0.25,0.25,0.25,0.25]],["v43"]],["Annotate",["b35","v43"],["meta_schedule.cooperative_fetch"],[]],["CacheRead",["b0",["b0"]],[1,"shared"],["b44"]],["ComputeAt",["b44","l28"],[1,-1],[]],["GetLoops",["b44"],[],["l45","l46","l47","l48","l49","l50"]],["Fuse",["l49","l50"],[1],["l51"]],["SampleCategorical",[],[[1,2,4,8],[0.25,0.25,0.25,0.25]],["v52"]],["Annotate",["b44","v52"],["meta_schedule.cooperative_fetch"],[]],["SampleCategorical",[],[[0,16,64,512,1024],[0.2000000000000000111,0.2000000000000000111,0.2000000000000000111,0.2000000000000000111,0.2000000000000000111]],["v53"]],["Annotate",["b1","v53"],["meta_schedule.unroll_explicit"],[]],["EnterPostproc",[],[],[]],["Unannotate",["b35"],["meta_schedule.cooperative_fetch"],[]],["GetLoops",["b35"],[],["l54","l55","l56","l57","l58"]],["Split",["l58","None",321,4],[1,0],["l59","l60","l61"]],["Vectorize",["l61"],[],[]],["Bind",["l60"],["threadIdx.x"],[]],["Unannotate",["b44"],["meta_schedule.cooperative_fetch"],[]],["GetLoops",["b44"],[],["l62","l63","l64","l65","l66"]],["Split",["l66","None",321,2],[1,0],["l67","l68","l69"]],["Vectorize",["l69"],[],[]],["Bind",["l68"],["threadIdx.x"],[]],["GetBlock",[],["root","main"],["b70"]],["Unannotate",["b70"],["meta_schedule.unroll_explicit"],[]],["GetChildBlocks",["b70"],[],["b71","b72","b73","b74"]],["GetLoops",["b71"],[],["l75","l76","l77","l78","l79","l80","l81"]],["GetLoops",["b72"],[],["l82","l83","l84","l85","l86","l87","l88"]],["GetLoops",["b73"],[],["l89","l90","l91","l92","l93","l94","l95","l96","l97","l98"]],["Annotate",["l89",512],["pragma_auto_unroll_max_step"],[]],["Annotate",["l89",1],["pragma_unroll_explicit"],[]],["GetLoops",["b74"],[],["l99","l100","l101","l102","l103"]],["GetBlock",[],["C","main"],["b104"]],["GetLoops",["b104"],[],["l105","l106","l107","l108","l109","l110","l111","l112","l113","l114"]],["DecomposeReduction",["b104","l108"],[],["b115"]]],[[4,[2,1,321,1,1]],[6,[128,1,1,8,1]],[8,[256,16,1]],[25,2],[31,1],[33,3]]],[0.00038147385463659148853,0.00038148337844611527247,0.00038153508270676690303],{"host":{"keys":["cpu"],"kind":"llvm","mtriple":"x86_64-unknown-linux-gnu","tag":""},"keys":["rocm","gpu"],"kind":"rocm","max_num_threads":256,"max_shared_memory_per_block":49152,"max_threads_per_block":1024,"mcpu":"gfx942","model":"MI300","mtriple":"amdgcn-amd-amdhsa-hcc","tag":"","thread_warp_size":64},[["TENSOR","float16",[642,4096]],["TENSOR","float16",[4096,1024]],["TENSOR","float16",[642,1024]]]]]
[0,[[[["GetBlock",[],["C","main"],["b0"]],["GetBlock",[],["root","main"],["b1"]],["Annotate",["b0","\"SSSRRSRS\""],["meta_schedule.tiling_structure"],[]],["GetLoops",["b0"],[],["l2","l3","l4"]],["SamplePerfectTile",["l2"],[5,64],["v5","v6","v7","v8","v9"]],["Split",["l2","v5","v6","v7","v8","v9"],[1,0],["l10","l11","l12","l13","l14"]],["SamplePerfectTile",["l3"],[5,64],["v15","v16","v17","v18","v19"]],["Split",["l3","v15","v16","v17","v18","v19"],[1,0],["l20","l21","l22","l23","l24"]],["SamplePerfectTile",["l4"],[3,64],["v25","v26","v27"]],["Split",["l4","v25","v26","v27"],[1,0],["l28","l29","l30"]],["Reorder",["l10","l20","l11","l21","l12","l22","l28","l29","l13","l23","l30","l14","l24"],[],[]],["Fuse",["l10","l20"],[1],["l31"]],["Bind",["l31"],["blockIdx.x"],[]],["Fuse",["l11","l21"],[1],["l32"]],["Bind",["l32"],["vthread.x"],[]],["Fuse",["l12","l22"],[1],["l33"]],["Bind",["l33"],["threadIdx.x"],[]],["Annotate",["b0",64],["meta_schedule.thread_extent_low_inclusive"],[]],["Annotate",["b0",1024],["meta_schedule.thread_extent_high_inclusive"],[]],["CacheWrite",["b0",[]],[0,"local"],["b34"]],["ReverseComputeAt",["b34","l33"],[1,-1],[]],["CacheRead",["b0",["b0"]],[0,"shared"],["b35"]],["ComputeAt",["b35","l28"],[1,-1],[]],["GetLoops",["b35"],[],["l36","l37","l38","l39","l40","l41"]],["Fuse",["l40","l41"],[1],["l42"]],["SampleCategorical",[],[[1,2,4,8],[0.25,0.25,0.25,0.25]],["v43"]],["Annotate",["b35","v43"],["meta_schedule.cooperative_fetch"],[]],["CacheRead",["b0",["b0"]],[1,"shared"],["b44"]],["ComputeAt",["b44","l28"],[1,-1],[]],["GetLoops",["b44"],[],["l45","l46","l47","l48","l49","l50"]],["Fuse",["l49","l50"],[1],["l51"]],["SampleCategorical",[],[[1,2,4,8],[0.25,0.25,0.25,0.25]],["v52"]],["Annotate",["b44","v52"],["meta_schedule.cooperative_fetch"],[]],["SampleCategorical",[],[[0,16,64,512,1024],[0.2000000000000000111,0.2000000000000000111,0.2000000000000000111,0.2000000000000000111,0.2000000000000000111]],["v53"]],["Annotate",["b1","v53"],["meta_schedule.unroll_explicit"],[]],["EnterPostproc",[],[],[]],["Unannotate",["b35"],["meta_schedule.cooperative_fetch"],[]],["GetLoops",["b35"],[],["l54","l55","l56","l57","l58"]],["Split",["l58","None",428,8],[1,0],["l59","l60","l61"]],["Vectorize",["l61"],[],[]],["Bind",["l60"],["threadIdx.x"],[]],["Unannotate",["b44"],["meta_schedule.cooperative_fetch"],[]],["GetLoops",["b44"],[],["l62","l63","l64","l65","l66"]],["Split",["l66","None",428,2],[1,0],["l67","l68","l69"]],["Vectorize",["l69"],[],[]],["Bind",["l68"],["threadIdx.x"],[]],["GetBlock",[],["root","main"],["b70"]],["Unannotate",["b70"],["meta_schedule.unroll_explicit"],[]],["GetChildBlocks",["b70"],[],["b71","b72","b73","b74"]],["GetLoops",["b71"],[],["l75","l76","l77","l78","l79","l80","l81"]],["GetLoops",["b72"],[],["l82","l83","l84","l85","l86","l87","l88"]],["GetLoops",["b73"],[],["l89","l90","l91","l92","l93","l94","l95","l96","l97","l98"]],["Annotate",["l89",512],["pragma_auto_unroll_max_step"],[]],["Annotate",["l89",1],["pragma_unroll_explicit"],[]],["GetLoops",["b74"],[],["l99","l100","l101","l102","l103"]],["GetBlock",[],["C","main"],["b104"]],["GetLoops",["b104"],[],["l105","l106","l107","l108","l109","l110","l111","l112","l113","l114"]],["DecomposeReduction",["b104","l108"],[],["b115"]]],[[4,[1,1,214,1,3]],[6,[64,1,2,8,1]],[8,[256,2,8]],[25,3],[31,1],[33,3]]],[0.00056752197368421060039,0.00056755472932330829679,0.00056758163533834589745],{"host":{"keys":["cpu"],"kind":"llvm","mtriple":"x86_64-unknown-linux-gnu","tag":""},"keys":["rocm","gpu"],"kind":"rocm","max_num_threads":256,"max_shared_memory_per_block":49152,"max_threads_per_block":1024,"mcpu":"gfx942","model":"MI300","mtriple":"amdgcn-amd-amdhsa-hcc","tag":"","thread_warp_size":64},[["TENSOR","float16",[642,4096]],["TENSOR","float16",[4096,1024]],["TENSOR","float16",[642,1024]]]]]
[0,[[[["GetBlock",[],["C","main"],["b0"]],["GetBlock",[],["root","main"],["b1"]],["Annotate",["b0","\"SSSRRSRS\""],["meta_schedule.tiling_structure"],[]],["GetLoops",["b0"],[],["l2","l3","l4"]],["SamplePerfectTile",["l2"],[5,64],["v5","v6","v7","v8","v9"]],["Split",["l2","v5","v6","v7","v8","v9"],[1,0],["l10","l11","l12","l13","l14"]],["SamplePerfectTile",["l3"],[5,64],["v15","v16","v17","v18","v19"]],["Split",["l3","v15","v16","v17","v18","v19"],[1,0],["l20","l21","l22","l23","l24"]],["SamplePerfectTile",["l4"],[3,64],["v25","v26","v27"]],["Split",["l4","v25","v26","v27"],[1,0],["l28","l29","l30"]],["Reorder",["l10","l20","l11","l21","l12","l22","l28","l29","l13","l23","l30","l14","l24"],[],[]],["Fuse",["l10","l20"],[1],["l31"]],["Bind",["l31"],["blockIdx.x"],[]],["Fuse",["l11","l21"],[1],["l32"]],["Bind",["l32"],["vthread.x"],[]],["Fuse",["l12","l22"],[1],["l33"]],["Bind",["l33"],["threadIdx.x"],[]],["Annotate",["b0",64],["meta_schedule.thread_extent_low_inclusive"],[]],["Annotate",["b0",1024],["meta_schedule.thread_extent_high_inclusive"],[]],["CacheWrite",["b0",[]],[0,"local"],["b34"]],["ReverseComputeAt",["b34","l33"],[1,-1],[]],["CacheRead",["b0",["b0"]],[0,"shared"],["b35"]],["ComputeAt",["b35","l28"],[1,-1],[]],["GetLoops",["b35"],[],["l36","l37","l38","l39","l40","l41"]],["Fuse",["l40","l41"],[1],["l42"]],["SampleCategorical",[],[[1,2,4,8],[0.25,0.25,0.25,0.25]],["v43"]],["Annotate",["b35","v43"],["meta_schedule.cooperative_fetch"],[]],["CacheRead",["b0",["b0"]],[1,"shared"],["b44"]],["ComputeAt",["b44","l28"],[1,-1],[]],["GetLoops",["b44"],[],["l45","l46","l47","l48","l49","l50"]],["Fuse",["l49","l50"],[1],["l51"]],["SampleCategorical",[],[[1,2,4,8],[0.25,0.25,0.25,0.25]],["v52"]],["Annotate",["b44","v52"],["meta_schedule.cooperative_fetch"],[]],["SampleCategorical",[],[[0,16,64,512,1024],[0.2000000000000000111,0.2000000000000000111,0.2000000000000000111,0.2000000000000000111,0.2000000000000000111]],["v53"]],["Annotate",["b1","v53"],["meta_schedule.unroll_explicit"],[]],["EnterPostproc",[],[],[]],["Unannotate",["b35"],["meta_schedule.cooperative_fetch"],[]],["GetLoops",["b35"],[],["l54","l55","l56","l57","l58"]],["Split",["l58","None",428,4],[1,0],["l59","l60","l61"]],["Vectorize",["l61"],[],[]],["Bind",["l60"],["threadIdx.x"],[]],["Unannotate",["b44"],["meta_schedule.cooperative_fetch"],[]],["GetLoops",["b44"],[],["l62","l63","l64","l65","l66"]],["Split",["l66","None",428,8],[1,0],["l67","l68","l69"]],["Vectorize",["l69"],[],[]],["Bind",["l68"],["threadIdx.x"],[]],["GetBlock",[],["root","main"],["b70"]],["Unannotate",["b70"],["meta_schedule.unroll_explicit"],[]],["GetChildBlocks",["b70"],[],["b71","b72","b73","b74"]],["GetLoops",["b71"],[],["l75","l76","l77","l78","l79","l80","l81"]],["GetLoops",["b72"],[],["l82","l83","l84","l85","l86","l87","l88"]],["GetLoops",["b73"],[],["l89","l90","l91","l92","l93","l94","l95","l96","l97","l98"]],["Annotate",["l89",1024],["pragma_auto_unroll_max_step"],[]],["Annotate",["l89",1],["pragma_unroll_explicit"],[]],["GetLoops",["b74"],[],["l99","l100","l101","l102","l103"]],["GetBlock",[],["C","main"],["b104"]],["GetLoops",["b104"],[],["l105","l106","l107","l108","l109","l110","l111","l112","l113","l114"]],["DecomposeReduction",["b104","l108"],[],["b115"]]],[[4,[2,3,107,1,1]],[6,[1,128,4,1,2]],[8,[1024,4,1]],[25,2],[31,3],[33,4]]],[0.31568184399999998924,0.32203544099999997785,0.32163216133333333291],{"host":{"keys":["cpu"],"kind":"llvm","mtriple":"x86_64-unknown-linux-gnu","tag":""},"keys":["rocm","gpu"],"kind":"rocm","max_num_threads":256,"max_shared_memory_per_block":49152,"max_threads_per_block":1024,"mcpu":"gfx942","model":"MI300","mtriple":"amdgcn-amd-amdhsa-hcc","tag":"","thread_warp_size":64},[["TENSOR","float16",[642,4096]],["TENSOR","float16",[4096,1024]],["TENSOR","float16",[642,1024]]]]]
[0,[[[["GetBlock",[],["C","main"],["b0"]],["GetBlock",[],["root","main"],["b1"]],["Annotate",["b0","\"SSSRRSRS\""],["meta_schedule.tiling_structure"],[]],["GetLoops",["b0"],[],["l2","l3","l4"]],["SamplePerfectTile",["l2"],[5,64],["v5","v6","v7","v8","v9"]],["Split",["l2","v5","v6","v7","v8","v9"],[1,0],["l10","l11","l12","l13","l14"]],["SamplePerfectTile",["l3"],[5,64],["v15","v16","v17","v18","v19"]],["Split",["l3","v15","v16","v17","v18","v19"],[1,0],["l20","l21","l22","l23","l24"]],["SamplePerfectTile",["l4"],[3,64],["v25","v26","v27"]],["Split",["l4","v25","v26","v27"],[1,0],["l28","l29","l30"]],["Reorder",["l10","l20","l11","l21","l12","l22","l28","l29","l13","l23","l30","l14","l24"],[],[]],["Fuse",["l10","l20"],[1],["l31"]],["Bind",["l31"],["blockIdx.x"],[]],["Fuse",["l11","l21"],[1],["l32"]],["Bind",["l32"],["vthread.x"],[]],["Fuse",["l12","l22"],[1],["l33"]],["Bind",["l33"],["threadIdx.x"],[]],["Annotate",["b0",64],["meta_schedule.thread_extent_low_inclusive"],[]],["Annotate",["b0",1024],["meta_schedule.thread_extent_high_inclusive"],[]],["CacheWrite",["b0",[]],[0,"local"],["b34"]],["ReverseComputeAt",["b34","l33"],[1,-1],[]],["CacheRead",["b0",["b0"]],[0,"shared"],["b35"]],["ComputeAt",["b35","l28"],[1,-1],[]],["GetLoops",["b35"],[],["l36","l37","l38","l39","l40","l41"]],["Fuse",["l40","l41"],[1],["l42"]],["SampleCategorical",[],[[1,2,4,8],[0.25,0.25,0.25,0.25]],["v43"]],["Annotate",["b35","v43"],["meta_schedule.cooperative_fetch"],[]],["CacheRead",["b0",["b0"]],[1,"shared"],["b44"]],["ComputeAt",["b44","l28"],[1,-1],[]],["GetLoops",["b44"],[],["l45","l46","l47","l48","l49","l50"]],["Fuse",["l49","l50"],[1],["l51"]],["SampleCategorical",[],[[1,2,4,8],[0.25,0.25,0.25,0.25]],["v52"]],["Annotate",["b44","v52"],["meta_schedule.cooperative_fetch"],[]],["SampleCategorical",[],[[0,16,64,512,1024],[0.2000000000000000111,0.2000000000000000111,0.2000000000000000111,0.2000000000000000111,0.2000000000000000111]],["v53"]],["Annotate",["b1","v53"],["meta_schedule.unroll_explicit"],[]],["EnterPostproc",[],[],[]],["Unannotate",["b35"],["meta_schedule.cooperative_fetch"],[]],["GetLoops",["b35"],[],["l54","l55","l56","l57","l58"]],["Split",["l58","None",107,2],[1,0],["l59","l60","l61"]],["Vectorize",["l61"],[],[]],["Bind",["l60"],["threadIdx.x"],[]],["Unannotate",["b44"],["meta_schedule.cooperative_fetch"],[]],["GetLoops",["b44"],[],["l62","l63","l64","l65","l66"]],["Split",["l66","None",107,2],[1,0],["l67","l68","l69"]],["Vectorize",["l69"],[],[]],["Bind",["l68"],["threadIdx.x"],[]],["GetBlock",[],["root","main"],["b70"]],["Unannotate",["b70"],["meta_schedule.unroll_explicit"],[]],["GetChildBlocks",["b70"],[],["b71","b72","b73","b74"]],["GetLoops",["b71"],[],["l75","l76","l77","l78","l79","l80","l81"]],["GetLoops",["b72"],[],["l82","l83","l84","l85","l86","l87","l88"]],["GetLoops",["b73"],[],["l89","l90","l91","l92","l93","l94","l95","l96","l97","l98"]],["GetLoops",["b74"],[],["l99","l100","l101","l102","l103"]],["GetBlock",[],["C","main"],["b104"]],["GetLoops",["b104"],[],["l105","l106","l107","l108","l109","l110","l111","l112","l113","l114"]],["DecomposeReduction",["b104","l108"],[],["b115"]]],[[4,[3,1,107,2,1]],[6,[32,32,1,1,1]],[8,[1024,4,1]],[25,1],[31,1],[33,0]]],[0.0012210293228346457296,0.0012209532677165356711,0.0012210358110236220475],{"host":{"keys":["cpu"],"kind":"llvm","mtriple":"x86_64-unknown-linux-gnu","tag":""},"keys":["rocm","gpu"],"kind":"rocm","max_num_threads":256,"max_shared_memory_per_block":49152,"max_threads_per_block":1024,"mcpu":"gfx942","model":"MI300","mtriple":"amdgcn-amd-amdhsa-hcc","tag":"","thread_warp_size":64},[["TENSOR","float16",[642,4096]],["TENSOR","float16",[4096,1024]],["TENSOR","float16",[642,1024]]]]]
[0,[[[["GetBlock",[],["C","main"],["b0"]],["GetBlock",[],["root","main"],["b1"]],["Annotate",["b0","\"SSSRRSRS\""],["meta_schedule.tiling_structure"],[]],["GetLoops",["b0"],[],["l2","l3","l4"]],["SamplePerfectTile",["l2"],[5,64],["v5","v6","v7","v8","v9"]],["Split",["l2","v5","v6","v7","v8","v9"],[1,0],["l10","l11","l12","l13","l14"]],["SamplePerfectTile",["l3"],[5,64],["v15","v16","v17","v18","v19"]],["Split",["l3","v15","v16","v17","v18","v19"],[1,0],["l20","l21","l22","l23","l24"]],["SamplePerfectTile",["l4"],[3,64],["v25","v26","v27"]],["Split",["l4","v25","v26","v27"],[1,0],["l28","l29","l30"]],["Reorder",["l10","l20","l11","l21","l12","l22","l28","l29","l13","l23","l30","l14","l24"],[],[]],["Fuse",["l10","l20"],[1],["l31"]],["Bind",["l31"],["blockIdx.x"],[]],["Fuse",["l11","l21"],[1],["l32"]],["Bind",["l32"],["vthread.x"],[]],["Fuse",["l12","l22"],[1],["l33"]],["Bind",["l33"],["threadIdx.x"],[]],["Annotate",["b0",64],["meta_schedule.thread_extent_low_inclusive"],[]],["Annotate",["b0",1024],["meta_schedule.thread_extent_high_inclusive"],[]],["CacheWrite",["b0",[]],[0,"local"],["b34"]],["ReverseComputeAt",["b34","l33"],[1,-1],[]],["CacheRead",["b0",["b0"]],[0,"shared"],["b35"]],["ComputeAt",["b35","l28"],[1,-1],[]],["GetLoops",["b35"],[],["l36","l37","l38","l39","l40","l41"]],["Fuse",["l40","l41"],[1],["l42"]],["SampleCategorical",[],[[1,2,4,8],[0.25,0.25,0.25,0.25]],["v43"]],["Annotate",["b35","v43"],["meta_schedule.cooperative_fetch"],[]],["CacheRead",["b0",["b0"]],[1,"shared"],["b44"]],["ComputeAt",["b44","l28"],[1,-1],[]],["GetLoops",["b44"],[],["l45","l46","l47","l48","l49","l50"]],["Fuse",["l49","l50"],[1],["l51"]],["SampleCategorical",[],[[1,2,4,8],[0.25,0.25,0.25,0.25]],["v52"]],["Annotate",["b44","v52"],["meta_schedule.cooperative_fetch"],[]],["SampleCategorical",[],[[0,16,64,512,1024],[0.2000000000000000111,0.2000000000000000111,0.2000000000000000111,0.2000000000000000111,0.2000000000000000111]],["v53"]],["Annotate",["b1","v53"],["meta_schedule.unroll_explicit"],[]],["EnterPostproc",[],[],[]],["Unannotate",["b35"],["meta_schedule.cooperative_fetch"],[]],["GetLoops",["b35"],[],["l54","l55","l56","l57","l58"]],["Split",["l58","None",428,2],[1,0],["l59","l60","l61"]],["Vectorize",["l61"],[],[]],["Bind",["l60"],["threadIdx.x"],[]],["Unannotate",["b44"],["meta_schedule.cooperative_fetch"],[]],["GetLoops",["b44"],[],["l62","l63","l64","l65","l66"]],["Split",["l66","None",428,4],[1,0],["l67","l68","l69"]],["Vectorize",["l69"],[],[]],["Bind",["l68"],["threadIdx.x"],[]],["GetBlock",[],["root","main"],["b70"]],["Unannotate",["b70"],["meta_schedule.unroll_explicit"],[]],["GetChildBlocks",["b70"],[],["b71","b72","b73","b74"]],["GetLoops",["b71"],[],["l75","l76","l77","l78","l79","l80","l81"]],["GetLoops",["b72"],[],["l82","l83","l84","l85","l86","l87","l88"]],["GetLoops",["b73"],[],["l89","l90","l91","l92","l93","l94","l95","l96","l97","l98"]],["GetLoops",["b74"],[],["l99","l100","l101","l102","l103"]],["GetBlock",[],["C","main"],["b104"]],["GetLoops",["b104"],[],["l105","l106","l107","l108","l109","l110","l111","l112","l113","l114"]],["DecomposeReduction",["b104","l108"],[],["b115"]]],[[4,[3,1,107,1,2]],[6,[32,8,4,1,1]],[8,[1024,4,1]],[25,1],[31,2],[33,0]]],[0.0009649381962025316891,0.00096489367721518993787,0.00096495403797468358269],{"host":{"keys":["cpu"],"kind":"llvm","mtriple":"x86_64-unknown-linux-gnu","tag":""},"keys":["rocm","gpu"],"kind":"rocm","max_num_threads":256,"max_shared_memory_per_block":49152,"max_threads_per_block":1024,"mcpu":"gfx942","model":"MI300","mtriple":"amdgcn-amd-amdhsa-hcc","tag":"","thread_warp_size":64},[["TENSOR","float16",[642,4096]],["TENSOR","float16",[4096,1024]],["TENSOR","float16",[642,1024]]]]]
[0,[[[["GetBlock",[],["C","main"],["b0"]],["GetBlock",[],["root","main"],["b1"]],["Annotate",["b0","\"SSSRRSRS\""],["meta_schedule.tiling_structure"],[]],["GetLoops",["b0"],[],["l2","l3","l4"]],["SamplePerfectTile",["l2"],[5,64],["v5","v6","v7","v8","v9"]],["Split",["l2","v5","v6","v7","v8","v9"],[1,0],["l10","l11","l12","l13","l14"]],["SamplePerfectTile",["l3"],[5,64],["v15","v16","v17","v18","v19"]],["Split",["l3","v15","v16","v17","v18","v19"],[1,0],["l20","l21","l22","l23","l24"]],["SamplePerfectTile",["l4"],[3,64],["v25","v26","v27"]],["Split",["l4","v25","v26","v27"],[1,0],["l28","l29","l30"]],["Reorder",["l10","l20","l11","l21","l12","l22","l28","l29","l13","l23","l30","l14","l24"],[],[]],["Fuse",["l10","l20"],[1],["l31"]],["Bind",["l31"],["blockIdx.x"],[]],["Fuse",["l11","l21"],[1],["l32"]],["Bind",["l32"],["vthread.x"],[]],["Fuse",["l12","l22"],[1],["l33"]],["Bind",["l33"],["threadIdx.x"],[]],["Annotate",["b0",64],["meta_schedule.thread_extent_low_inclusive"],[]],["Annotate",["b0",1024],["meta_schedule.thread_extent_high_inclusive"],[]],["CacheWrite",["b0",[]],[0,"local"],["b34"]],["ReverseComputeAt",["b34","l33"],[1,-1],[]],["CacheRead",["b0",["b0"]],[0,"shared"],["b35"]],["ComputeAt",["b35","l28"],[1,-1],[]],["GetLoops",["b35"],[],["l36","l37","l38","l39","l40","l41"]],["Fuse",["l40","l41"],[1],["l42"]],["SampleCategorical",[],[[1,2,4,8],[0.25,0.25,0.25,0.25]],["v43"]],["Annotate",["b35","v43"],["meta_schedule.cooperative_fetch"],[]],["CacheRead",["b0",["b0"]],[1,"shared"],["b44"]],["ComputeAt",["b44","l28"],[1,-1],[]],["GetLoops",["b44"],[],["l45","l46","l47","l48","l49","l50"]],["Fuse",["l49","l50"],[1],["l51"]],["SampleCategorical",[],[[1,2,4,8],[0.25,0.25,0.25,0.25]],["v52"]],["Annotate",["b44","v52"],["meta_schedule.cooperative_fetch"],[]],["SampleCategorical",[],[[0,16,64,512,1024],[0.2000000000000000111,0.2000000000000000111,0.2000000000000000111,0.2000000000000000111,0.2000000000000000111]],["v53"]],["Annotate",["b1","v53"],["meta_schedule.unroll_explicit"],[]],["EnterPostproc",[],[],[]],["Unannotate",["b35"],["meta_schedule.cooperative_fetch"],[]],["GetLoops",["b35"],[],["l54","l55","l56","l57","l58"]],["Split",["l58","None",256,2],[1,0],["l59","l60","l61"]],["Vectorize",["l61"],[],[]],["Bind",["l60"],["threadIdx.x"],[]],["Unannotate",["b44"],["meta_schedule.cooperative_fetch"],[]],["GetLoops",["b44"],[],["l62","l63","l64","l65","l66"]],["Split",["l66","None",256,2],[1,0],["l67","l68","l69"]],["Vectorize",["l69"],[],[]],["Bind",["l68"],["threadIdx.x"],[]],["GetBlock",[],["root","main"],["b70"]],["Unannotate",["b70"],["meta_schedule.unroll_explicit"],[]],["GetChildBlocks",["b70"],[],["b71","b72","b73","b74"]],["GetLoops",["b71"],[],["l75","l76","l77","l78","l79","l80","l81"]],["GetLoops",["b72"],[],["l82","l83","l84","l85","l86","l87","l88"]],["GetLoops",["b73"],[],["l89","l90","l91","l92","l93","l94","l95","l96","l97","l98"]],["Annotate",["l89",16],["pragma_auto_unroll_max_step"],[]],["Annotate",["l89",1],["pragma_unroll_explicit"],[]],["GetLoops",["b74"],[],["l99","l100","l101","l102","l103"]],["GetBlock",[],["C","main"],["b104"]],["GetLoops",["b104"],[],["l105","l106","l107","l108","l109","l110","l111","l112","l113","l114"]],["DecomposeReduction",["b104","l108"],[],["b115"]]],[[4,[1,1,2,107,3]],[6,[1,8,128,1,1]],[8,[512,8,1]],[25,1],[31,1],[33,1]]],[0.67337097166666659565,0.67319209766666665562,0.67324527966666669609],{"host":{"keys":["cpu"],"kind":"llvm","mtriple":"x86_64-unknown-linux-gnu","tag":""},"keys":["rocm","gpu"],"kind":"rocm","max_num_threads":256,"max_shared_memory_per_block":49152,"max_threads_per_block":1024,"mcpu":"gfx942","model":"MI300","mtriple":"amdgcn-amd-amdhsa-hcc","tag":"","thread_warp_size":64},[["TENSOR","float16",[642,4096]],["TENSOR","float16",[4096,1024]],["TENSOR","float16",[642,1024]]]]]
[0,[[[["GetBlock",[],["C","main"],["b0"]],["GetBlock",[],["root","main"],["b1"]],["Annotate",["b0","\"SSSRRSRS\""],["meta_schedule.tiling_structure"],[]],["GetLoops",["b0"],[],["l2","l3","l4"]],["SamplePerfectTile",["l2"],[5,64],["v5","v6","v7","v8","v9"]],["Split",["l2","v5","v6","v7","v8","v9"],[1,0],["l10","l11","l12","l13","l14"]],["SamplePerfectTile",["l3"],[5,64],["v15","v16","v17","v18","v19"]],["Split",["l3","v15","v16","v17","v18","v19"],[1,0],["l20","l21","l22","l23","l24"]],["SamplePerfectTile",["l4"],[3,64],["v25","v26","v27"]],["Split",["l4","v25","v26","v27"],[1,0],["l28","l29","l30"]],["Reorder",["l10","l20","l11","l21","l12","l22","l28","l29","l13","l23","l30","l14","l24"],[],[]],["Fuse",["l10","l20"],[1],["l31"]],["Bind",["l31"],["blockIdx.x"],[]],["Fuse",["l11","l21"],[1],["l32"]],["Bind",["l32"],["vthread.x"],[]],["Fuse",["l12","l22"],[1],["l33"]],["Bind",["l33"],["threadIdx.x"],[]],["Annotate",["b0",64],["meta_schedule.thread_extent_low_inclusive"],[]],["Annotate",["b0",1024],["meta_schedule.thread_extent_high_inclusive"],[]],["CacheWrite",["b0",[]],[0,"local"],["b34"]],["ReverseComputeAt",["b34","l33"],[1,-1],[]],["CacheRead",["b0",["b0"]],[0,"shared"],["b35"]],["ComputeAt",["b35","l28"],[1,-1],[]],["GetLoops",["b35"],[],["l36","l37","l38","l39","l40","l41"]],["Fuse",["l40","l41"],[1],["l42"]],["SampleCategorical",[],[[1,2,4,8],[0.25,0.25,0.25,0.25]],["v43"]],["Annotate",["b35","v43"],["meta_schedule.cooperative_fetch"],[]],["CacheRead",["b0",["b0"]],[1,"shared"],["b44"]],["ComputeAt",["b44","l28"],[1,-1],[]],["GetLoops",["b44"],[],["l45","l46","l47","l48","l49","l50"]],["Fuse",["l49","l50"],[1],["l51"]],["SampleCategorical",[],[[1,2,4,8],[0.25,0.25,0.25,0.25]],["v52"]],["Annotate",["b44","v52"],["meta_schedule.cooperative_fetch"],[]],["SampleCategorical",[],[[0,16,64,512,1024],[0.2000000000000000111,0.2000000000000000111,0.2000000000000000111,0.2000000000000000111,0.2000000000000000111]],["v53"]],["Annotate",["b1","v53"],["meta_schedule.unroll_explicit"],[]],["EnterPostproc",[],[],[]],["Unannotate",["b35"],["meta_schedule.cooperative_fetch"],[]],["GetLoops",["b35"],[],["l54","l55","l56","l57","l58"]],["Split",["l58","None",214,8],[1,0],["l59","l60","l61"]],["Vectorize",["l61"],[],[]],["Bind",["l60"],["threadIdx.x"],[]],["Unannotate",["b44"],["meta_schedule.cooperative_fetch"],[]],["GetLoops",["b44"],[],["l62","l63","l64","l65","l66"]],["Split",["l66","None",214,2],[1,0],["l67","l68","l69"]],["Vectorize",["l69"],[],[]],["Bind",["l68"],["threadIdx.x"],[]],["GetBlock",[],["root","main"],["b70"]],["Unannotate",["b70"],["meta_schedule.unroll_explicit"],[]],["GetChildBlocks",["b70"],[],["b71","b72","b73","b74"]],["GetLoops",["b71"],[],["l75","l76","l77","l78","l79","l80","l81"]],["GetLoops",["b72"],[],["l82","l83","l84","l85","l86","l87","l88"]],["GetLoops",["b73"],[],["l89","l90","l91","l92","l93","l94","l95","l96","l97","l98"]],["Annotate",["l89",64],["pragma_auto_unroll_max_step"],[]],["Annotate",["l89",1],["pragma_unroll_explicit"],[]],["GetLoops",["b74"],[],["l99","l100","l101","l102","l103"]],["GetBlock",[],["C","main"],["b104"]],["GetLoops",["b104"],[],["l105","l106","l107","l108","l109","l110","l111","l112","l113","l114"]],["DecomposeReduction",["b104","l108"],[],["b115"]]],[[4,[1,1,214,3,1]],[6,[1,64,1,1,16]],[8,[512,2,4]],[25,3],[31,1],[33,2]]],[0.52971683733333330135,0.53170825166666668693,0.52678702766666674062],{"host":{"keys":["cpu"],"kind":"llvm","mtriple":"x86_64-unknown-linux-gnu","tag":""},"keys":["rocm","gpu"],"kind":"rocm","max_num_threads":256,"max_shared_memory_per_block":49152,"max_threads_per_block":1024,"mcpu":"gfx942","model":"MI300","mtriple":"amdgcn-amd-amdhsa-hcc","tag":"","thread_warp_size":64},[["TENSOR","float16",[642,4096]],["TENSOR","float16",[4096,1024]],["TENSOR","float16",[642,1024]]]]]
[0,[[[["GetBlock",[],["C","main"],["b0"]],["GetBlock",[],["root","main"],["b1"]],["Annotate",["b0","\"SSSRRSRS\""],["meta_schedule.tiling_structure"],[]],["GetLoops",["b0"],[],["l2","l3","l4"]],["SamplePerfectTile",["l2"],[5,64],["v5","v6","v7","v8","v9"]],["Split",["l2","v5","v6","v7","v8","v9"],[1,0],["l10","l11","l12","l13","l14"]],["SamplePerfectTile",["l3"],[5,64],["v15","v16","v17","v18","v19"]],["Split",["l3","v15","v16","v17","v18","v19"],[1,0],["l20","l21","l22","l23","l24"]],["SamplePerfectTile",["l4"],[3,64],["v25","v26","v27"]],["Split",["l4","v25","v26","v27"],[1,0],["l28","l29","l30"]],["Reorder",["l10","l20","l11","l21","l12","l22","l28","l29","l13","l23","l30","l14","l24"],[],[]],["Fuse",["l10","l20"],[1],["l31"]],["Bind",["l31"],["blockIdx.x"],[]],["Fuse",["l11","l21"],[1],["l32"]],["Bind",["l32"],["vthread.x"],[]],["Fuse",["l12","l22"],[1],["l33"]],["Bind",["l33"],["threadIdx.x"],[]],["Annotate",["b0",64],["meta_schedule.thread_extent_low_inclusive"],[]],["Annotate",["b0",1024],["meta_schedule.thread_extent_high_inclusive"],[]],["CacheWrite",["b0",[]],[0,"local"],["b34"]],["ReverseComputeAt",["b34","l33"],[1,-1],[]],["CacheRead",["b0",["b0"]],[0,"shared"],["b35"]],["ComputeAt",["b35","l28"],[1,-1],[]],["GetLoops",["b35"],[],["l36","l37","l38","l39","l40","l41"]],["Fuse",["l40","l41"],[1],["l42"]],["SampleCategorical",[],[[1,2,4,8],[0.25,0.25,0.25,0.25]],["v43"]],["Annotate",["b35","v43"],["meta_schedule.cooperative_fetch"],[]],["CacheRead",["b0",["b0"]],[1,"shared"],["b44"]],["ComputeAt",["b44","l28"],[1,-1],[]],["GetLoops",["b44"],[],["l45","l46","l47","l48","l49","l50"]],["Fuse",["l49","l50"],[1],["l51"]],["SampleCategorical",[],[[1,2,4,8],[0.25,0.25,0.25,0.25]],["v52"]],["Annotate",["b44","v52"],["meta_schedule.cooperative_fetch"],[]],["SampleCategorical",[],[[0,16,64,512,1024],[0.2000000000000000111,0.2000000000000000111,0.2000000000000000111,0.2000000000000000111,0.2000000000000000111]],["v53"]],["Annotate",["b1","v53"],["meta_schedule.unroll_explicit"],[]],["EnterPostproc",[],[],[]],["Unannotate",["b35"],["meta_schedule.cooperative_fetch"],[]],["GetLoops",["b35"],[],["l54","l55","l56","l57","l58"]],["Split",["l58","None",214],[1,0],["l59","l60"]],["Bind",["l60"],["threadIdx.x"],[]],["Unannotate",["b44"],["meta_schedule.cooperative_fetch"],[]],["GetLoops",["b44"],[],["l61","l62","l63","l64","l65"]],["Split",["l65","None",214,8],[1,0],["l66","l67","l68"]],["Vectorize",["l68"],[],[]],["Bind",["l67"],["threadIdx.x"],[]],["GetBlock",[],["root","main"],["b69"]],["Unannotate",["b69"],["meta_schedule.unroll_explicit"],[]],["GetChildBlocks",["b69"],[],["b70","b71","b72","b73"]],["GetLoops",["b70"],[],["l74","l75","l76","l77","l78","l79"]],["GetLoops",["b71"],[],["l80","l81","l82","l83","l84","l85","l86"]],["GetLoops",["b72"],[],["l87","l88","l89","l90","l91","l92","l93","l94","l95","l96"]],["Annotate",["l87",512],["pragma_auto_unroll_max_step"],[]],["Annotate",["l87",1],["pragma_unroll_explicit"],[]],["GetLoops",["b73"],[],["l97","l98","l99","l100","l101"]],["GetBlock",[],["C","main"],["b102"]],["GetLoops",["b102"],[],["l103","l104","l105","l106","l107","l108","l109","l110","l111","l112"]],["DecomposeReduction",["b102","l106"],[],["b113"]]],[[4,[6,1,107,1,1]],[6,[1,8,2,8,8]],[8,[1024,2,2]],[25,0],[31,3],[33,3]]],[0.037047802999999997209,0.037058138333333330572,0.037003606000000001386],{"host":{"keys":["cpu"],"kind":"llvm","mtriple":"x86_64-unknown-linux-gnu","tag":""},"keys":["rocm","gpu"],"kind":"rocm","max_num_threads":256,"max_shared_memory_per_block":49152,"max_threads_per_block":1024,"mcpu":"gfx942","model":"MI300","mtriple":"amdgcn-amd-amdhsa-hcc","tag":"","thread_warp_size":64},[["TENSOR","float16",[642,4096]],["TENSOR","float16",[4096,1024]],["TENSOR","float16",[642,1024]]]]]
[0,[[[["GetBlock",[],["C","main"],["b0"]],["GetBlock",[],["root","main"],["b1"]],["Annotate",["b0","\"SSSRRSRS\""],["meta_schedule.tiling_structure"],[]],["GetLoops",["b0"],[],["l2","l3","l4"]],["SamplePerfectTile",["l2"],[5,64],["v5","v6","v7","v8","v9"]],["Split",["l2","v5","v6","v7","v8","v9"],[1,0],["l10","l11","l12","l13","l14"]],["SamplePerfectTile",["l3"],[5,64],["v15","v16","v17","v18","v19"]],["Split",["l3","v15","v16","v17","v18","v19"],[1,0],["l20","l21","l22","l23","l24"]],["SamplePerfectTile",["l4"],[3,64],["v25","v26","v27"]],["Split",["l4","v25","v26","v27"],[1,0],["l28","l29","l30"]],["Reorder",["l10","l20","l11","l21","l12","l22","l28","l29","l13","l23","l30","l14","l24"],[],[]],["Fuse",["l10","l20"],[1],["l31"]],["Bind",["l31"],["blockIdx.x"],[]],["Fuse",["l11","l21"],[1],["l32"]],["Bind",["l32"],["vthread.x"],[]],["Fuse",["l12","l22"],[1],["l33"]],["Bind",["l33"],["threadIdx.x"],[]],["Annotate",["b0",64],["meta_schedule.thread_extent_low_inclusive"],[]],["Annotate",["b0",1024],["meta_schedule.thread_extent_high_inclusive"],[]],["CacheWrite",["b0",[]],[0,"local"],["b34"]],["ReverseComputeAt",["b34","l33"],[1,-1],[]],["CacheRead",["b0",["b0"]],[0,"shared"],["b35"]],["ComputeAt",["b35","l28"],[1,-1],[]],["GetLoops",["b35"],[],["l36","l37","l38","l39","l40","l41"]],["Fuse",["l40","l41"],[1],["l42"]],["SampleCategorical",[],[[1,2,4,8],[0.25,0.25,0.25,0.25]],["v43"]],["Annotate",["b35","v43"],["meta_schedule.cooperative_fetch"],[]],["CacheRead",["b0",["b0"]],[1,"shared"],["b44"]],["ComputeAt",["b44","l28"],[1,-1],[]],["GetLoops",["b44"],[],["l45","l46","l47","l48","l49","l50"]],["Fuse",["l49","l50"],[1],["l51"]],["SampleCategorical",[],[[1,2,4,8],[0.25,0.25,0.25,0.25]],["v52"]],["Annotate",["b44","v52"],["meta_schedule.cooperative_fetch"],[]],["SampleCategorical",[],[[0,16,64,512,1024],[0.2000000000000000111,0.2000000000000000111,0.2000000000000000111,0.2000000000000000111,0.2000000000000000111]],["v53"]],["Annotate",["b1","v53"],["meta_schedule.unroll_explicit"],[]],["EnterPostproc",[],[],[]],["Unannotate",["b35"],["meta_schedule.cooperative_fetch"],[]],["GetLoops",["b35"],[],["l54","l55","l56","l57","l58"]],["Split",["l58","None",214,2],[1,0],["l59","l60","l61"]],["Vectorize",["l61"],[],[]],["Bind",["l60"],["threadIdx.x"],[]],["Unannotate",["b44"],["meta_schedule.cooperative_fetch"],[]],["GetLoops",["b44"],[],["l62","l63","l64","l65","l66"]],["Split",["l66","None",214,2],[1,0],["l67","l68","l69"]],["Vectorize",["l69"],[],[]],["Bind",["l68"],["threadIdx.x"],[]],["GetBlock",[],["root","main"],["b70"]],["Unannotate",["b70"],["meta_schedule.unroll_explicit"],[]],["GetChildBlocks",["b70"],[],["b71","b72","b73","b74"]],["GetLoops",["b71"],[],["l75","l76","l77","l78","l79","l80","l81"]],["GetLoops",["b72"],[],["l82","l83","l84","l85","l86","l87","l88"]],["GetLoops",["b73"],[],["l89","l90","l91","l92","l93","l94","l95","l96","l97","l98"]],["GetLoops",["b74"],[],["l99","l100","l101","l102","l103"]],["GetBlock",[],["C","main"],["b104"]],["GetLoops",["b104"],[],["l105","l106","l107","l108","l109","l110","l111","l112","l113","l114"]],["DecomposeReduction",["b104","l108"],[],["b115"]]],[[4,[1,3,214,1,1]],[6,[32,2,1,1,16]],[8,[512,2,4]],[25,1],[31,1],[33,0]]],[0.0015812878399999999099,0.001577460930000000117,0.0015781544400000002085],{"host":{"keys":["cpu"],"kind":"llvm","mtriple":"x86_64-unknown-linux-gnu","tag":""},"keys":["rocm","gpu"],"kind":"rocm","max_num_threads":256,"max_shared_memory_per_block":49152,"max_threads_per_block":1024,"mcpu":"gfx942","model":"MI300","mtriple":"amdgcn-amd-amdhsa-hcc","tag":"","thread_warp_size":64},[["TENSOR","float16",[642,4096]],["TENSOR","float16",[4096,1024]],["TENSOR","float16",[642,1024]]]]]
[0,[[[["GetBlock",[],["C","main"],["b0"]],["GetBlock",[],["root","main"],["b1"]],["Annotate",["b0","\"SSSRRSRS\""],["meta_schedule.tiling_structure"],[]],["GetLoops",["b0"],[],["l2","l3","l4"]],["SamplePerfectTile",["l2"],[5,64],["v5","v6","v7","v8","v9"]],["Split",["l2","v5","v6","v7","v8","v9"],[1,0],["l10","l11","l12","l13","l14"]],["SamplePerfectTile",["l3"],[5,64],["v15","v16","v17","v18","v19"]],["Split",["l3","v15","v16","v17","v18","v19"],[1,0],["l20","l21","l22","l23","l24"]],["SamplePerfectTile",["l4"],[3,64],["v25","v26","v27"]],["Split",["l4","v25","v26","v27"],[1,0],["l28","l29","l30"]],["Reorder",["l10","l20","l11","l21","l12","l22","l28","l29","l13","l23","l30","l14","l24"],[],[]],["Fuse",["l10","l20"],[1],["l31"]],["Bind",["l31"],["blockIdx.x"],[]],["Fuse",["l11","l21"],[1],["l32"]],["Bind",["l32"],["vthread.x"],[]],["Fuse",["l12","l22"],[1],["l33"]],["Bind",["l33"],["threadIdx.x"],[]],["Annotate",["b0",64],["meta_schedule.thread_extent_low_inclusive"],[]],["Annotate",["b0",1024],["meta_schedule.thread_extent_high_inclusive"],[]],["CacheWrite",["b0",[]],[0,"local"],["b34"]],["ReverseComputeAt",["b34","l33"],[1,-1],[]],["CacheRead",["b0",["b0"]],[0,"shared"],["b35"]],["ComputeAt",["b35","l28"],[1,-1],[]],["GetLoops",["b35"],[],["l36","l37","l38","l39","l40","l41"]],["Fuse",["l40","l41"],[1],["l42"]],["SampleCategorical",[],[[1,2,4,8],[0.25,0.25,0.25,0.25]],["v43"]],["Annotate",["b35","v43"],["meta_schedule.cooperative_fetch"],[]],["CacheRead",["b0",["b0"]],[1,"shared"],["b44"]],["ComputeAt",["b44","l28"],[1,-1],[]],["GetLoops",["b44"],[],["l45","l46","l47","l48","l49","l50"]],["Fuse",["l49","l50"],[1],["l51"]],["SampleCategorical",[],[[1,2,4,8],[0.25,0.25,0.25,0.25]],["v52"]],["Annotate",["b44","v52"],["meta_schedule.cooperative_fetch"],[]],["SampleCategorical",[],[[0,16,64,512,1024],[0.2000000000000000111,0.2000000000000000111,0.2000000000000000111,0.2000000000000000111,0.2000000000000000111]],["v53"]],["Annotate",["b1","v53"],["meta_schedule.unroll_explicit"],[]],["EnterPostproc",[],[],[]],["Unannotate",["b35"],["meta_schedule.cooperative_fetch"],[]],["GetLoops",["b35"],[],["l54","l55","l56","l57","l58"]],["Split",["l58","None",321],[1,0],["l59","l60"]],["Bind",["l60"],["threadIdx.x"],[]],["Unannotate",["b44"],["meta_schedule.cooperative_fetch"],[]],["GetLoops",["b44"],[],["l61","l62","l63","l64","l65"]],["Split",["l65","None",321,8],[1,0],["l66","l67","l68"]],["Vectorize",["l68"],[],[]],["Bind",["l67"],["threadIdx.x"],[]],["GetBlock",[],["root","main"],["b69"]],["Unannotate",["b69"],["meta_schedule.unroll_explicit"],[]],["GetChildBlocks",["b69"],[],["b70","b71","b72","b73"]],["GetLoops",["b70"],[],["l74","l75","l76","l77","l78","l79"]],["GetLoops",["b71"],[],["l80","l81","l82","l83","l84","l85","l86"]],["GetLoops",["b72"],[],["l87","l88","l89","l90","l91","l92","l93","l94","l95","l96"]],["Annotate",["l87",16],["pragma_auto_unroll_max_step"],[]],["Annotate",["l87",1],["pragma_unroll_explicit"],[]],["GetLoops",["b73"],[],["l97","l98","l99","l100","l101"]],["GetBlock",[],["C","main"],["b102"]],["GetLoops",["b102"],[],["l103","l104","l105","l106","l107","l108","l109","l110","l111","l112"]],["DecomposeReduction",["b102","l106"],[],["b113"]]],[[4,[1,2,321,1,1]],[6,[32,2,1,1,16]],[8,[256,16,1]],[25,0],[31,3],[33,1]]],[0.0013885022807017546008,0.0013888290087719298588,0.0013888909824561403595],{"host":{"keys":["cpu"],"kind":"llvm","mtriple":"x86_64-unknown-linux-gnu","tag":""},"keys":["rocm","gpu"],"kind":"rocm","max_num_threads":256,"max_shared_memory_per_block":49152,"max_threads_per_block":1024,"mcpu":"gfx942","model":"MI300","mtriple":"amdgcn-amd-amdhsa-hcc","tag":"","thread_warp_size":64},[["TENSOR","float16",[642,4096]],["TENSOR","float16",[4096,1024]],["TENSOR","float16",[642,1024]]]]]
[0,[[[["GetBlock",[],["C","main"],["b0"]],["GetBlock",[],["root","main"],["b1"]],["Annotate",["b0","\"SSSRRSRS\""],["meta_schedule.tiling_structure"],[]],["GetLoops",["b0"],[],["l2","l3","l4"]],["SamplePerfectTile",["l2"],[5,64],["v5","v6","v7","v8","v9"]],["Split",["l2","v5","v6","v7","v8","v9"],[1,0],["l10","l11","l12","l13","l14"]],["SamplePerfectTile",["l3"],[5,64],["v15","v16","v17","v18","v19"]],["Split",["l3","v15","v16","v17","v18","v19"],[1,0],["l20","l21","l22","l23","l24"]],["SamplePerfectTile",["l4"],[3,64],["v25","v26","v27"]],["Split",["l4","v25","v26","v27"],[1,0],["l28","l29","l30"]],["Reorder",["l10","l20","l11","l21","l12","l22","l28","l29","l13","l23","l30","l14","l24"],[],[]],["Fuse",["l10","l20"],[1],["l31"]],["Bind",["l31"],["blockIdx.x"],[]],["Fuse",["l11","l21"],[1],["l32"]],["Bind",["l32"],["vthread.x"],[]],["Fuse",["l12","l22"],[1],["l33"]],["Bind",["l33"],["threadIdx.x"],[]],["Annotate",["b0",64],["meta_schedule.thread_extent_low_inclusive"],[]],["Annotate",["b0",1024],["meta_schedule.thread_extent_high_inclusive"],[]],["CacheWrite",["b0",[]],[0,"local"],["b34"]],["ReverseComputeAt",["b34","l33"],[1,-1],[]],["CacheRead",["b0",["b0"]],[0,"shared"],["b35"]],["ComputeAt",["b35","l28"],[1,-1],[]],["GetLoops",["b35"],[],["l36","l37","l38","l39","l40","l41"]],["Fuse",["l40","l41"],[1],["l42"]],["SampleCategorical",[],[[1,2,4,8],[0.25,0.25,0.25,0.25]],["v43"]],["Annotate",["b35","v43"],["meta_schedule.cooperative_fetch"],[]],["CacheRead",["b0",["b0"]],[1,"shared"],["b44"]],["ComputeAt",["b44","l28"],[1,-1],[]],["GetLoops",["b44"],[],["l45","l46","l47","l48","l49","l50"]],["Fuse",["l49","l50"],[1],["l51"]],["SampleCategorical",[],[[1,2,4,8],[0.25,0.25,0.25,0.25]],["v52"]],["Annotate",["b44","v52"],["meta_schedule.cooperative_fetch"],[]],["SampleCategorical",[],[[0,16,64,512,1024],[0.2000000000000000111,0.2000000000000000111,0.2000000000000000111,0.2000000000000000111,0.2000000000000000111]],["v53"]],["Annotate",["b1","v53"],["meta_schedule.unroll_explicit"],[]],["EnterPostproc",[],[],[]],["Unannotate",["b35"],["meta_schedule.cooperative_fetch"],[]],["GetLoops",["b35"],[],["l54","l55","l56","l57","l58"]],["Split",["l58","None",107,8],[1,0],["l59","l60","l61"]],["Vectorize",["l61"],[],[]],["Bind",["l60"],["threadIdx.x"],[]],["Unannotate",["b44"],["meta_schedule.cooperative_fetch"],[]],["GetLoops",["b44"],[],["l62","l63","l64","l65","l66"]],["Split",["l66","None",107,4],[1,0],["l67","l68","l69"]],["Vectorize",["l69"],[],[]],["Bind",["l68"],["threadIdx.x"],[]],["GetBlock",[],["root","main"],["b70"]],["Unannotate",["b70"],["meta_schedule.unroll_explicit"],[]],["GetChildBlocks",["b70"],[],["b71","b72","b73","b74"]],["GetLoops",["b71"],[],["l75","l76","l77","l78","l79","l80","l81"]],["GetLoops",["b72"],[],["l82","l83","l84","l85","l86","l87","l88"]],["GetLoops",["b73"],[],["l89","l90","l91","l92","l93","l94","l95","l96","l97","l98"]],["GetLoops",["b74"],[],["l99","l100","l101","l102","l103"]],["GetBlock",[],["C","main"],["b104"]],["GetLoops",["b104"],[],["l105","l106","l107","l108","l109","l110","l111","l112","l113","l114"]],["DecomposeReduction",["b104","l108"],[],["b115"]]],[[4,[2,1,107,3,1]],[6,[1,8,1,16,8]],[8,[512,8,1]],[25,3],[31,2],[33,0]]],[0.18252254199999998208,0.18254221566666670173,0.18228780099999997155],{"host":{"keys":["cpu"],"kind":"llvm","mtriple":"x86_64-unknown-linux-gnu","tag":""},"keys":["rocm","gpu"],"kind":"rocm","max_num_threads":256,"max_shared_memory_per_block":49152,"max_threads_per_block":1024,"mcpu":"gfx942","model":"MI300","mtriple":"amdgcn-amd-amdhsa-hcc","tag":"","thread_warp_size":64},[["TENSOR","float16",[642,4096]],["TENSOR","float16",[4096,1024]],["TENSOR","float16",[642,1024]]]]]
[0,[[[["GetBlock",[],["C","main"],["b0"]],["GetBlock",[],["root","main"],["b1"]],["Annotate",["b0","\"SSSRRSRS\""],["meta_schedule.tiling_structure"],[]],["GetLoops",["b0"],[],["l2","l3","l4"]],["SamplePerfectTile",["l2"],[5,64],["v5","v6","v7","v8","v9"]],["Split",["l2","v5","v6","v7","v8","v9"],[1,0],["l10","l11","l12","l13","l14"]],["SamplePerfectTile",["l3"],[5,64],["v15","v16","v17","v18","v19"]],["Split",["l3","v15","v16","v17","v18","v19"],[1,0],["l20","l21","l22","l23","l24"]],["SamplePerfectTile",["l4"],[3,64],["v25","v26","v27"]],["Split",["l4","v25","v26","v27"],[1,0],["l28","l29","l30"]],["Reorder",["l10","l20","l11","l21","l12","l22","l28","l29","l13","l23","l30","l14","l24"],[],[]],["Fuse",["l10","l20"],[1],["l31"]],["Bind",["l31"],["blockIdx.x"],[]],["Fuse",["l11","l21"],[1],["l32"]],["Bind",["l32"],["vthread.x"],[]],["Fuse",["l12","l22"],[1],["l33"]],["Bind",["l33"],["threadIdx.x"],[]],["Annotate",["b0",64],["meta_schedule.thread_extent_low_inclusive"],[]],["Annotate",["b0",1024],["meta_schedule.thread_extent_high_inclusive"],[]],["CacheWrite",["b0",[]],[0,"local"],["b34"]],["ReverseComputeAt",["b34","l33"],[1,-1],[]],["CacheRead",["b0",["b0"]],[0,"shared"],["b35"]],["ComputeAt",["b35","l28"],[1,-1],[]],["GetLoops",["b35"],[],["l36","l37","l38","l39","l40","l41"]],["Fuse",["l40","l41"],[1],["l42"]],["SampleCategorical",[],[[1,2,4,8],[0.25,0.25,0.25,0.25]],["v43"]],["Annotate",["b35","v43"],["meta_schedule.cooperative_fetch"],[]],["CacheRead",["b0",["b0"]],[1,"shared"],["b44"]],["ComputeAt",["b44","l28"],[1,-1],[]],["GetLoops",["b44"],[],["l45","l46","l47","l48","l49","l50"]],["Fuse",["l49","l50"],[1],["l51"]],["SampleCategorical",[],[[1,2,4,8],[0.25,0.25,0.25,0.25]],["v52"]],["Annotate",["b44","v52"],["meta_schedule.cooperative_fetch"],[]],["SampleCategorical",[],[[0,16,64,512,1024],[0.2000000000000000111,0.2000000000000000111,0.2000000000000000111,0.2000000000000000111,0.2000000000000000111]],["v53"]],["Annotate",["b1","v53"],["meta_schedule.unroll_explicit"],[]],["EnterPostproc",[],[],[]],["Unannotate",["b35"],["meta_schedule.cooperative_fetch"],[]],["GetLoops",["b35"],[],["l54","l55","l56","l57","l58"]],["Split",["l58","None",107,8],[1,0],["l59","l60","l61"]],["Vectorize",["l61"],[],[]],["Bind",["l60"],["threadIdx.x"],[]],["Unannotate",["b44"],["meta_schedule.cooperative_fetch"],[]],["GetLoops",["b44"],[],["l62","l63","l64","l65","l66"]],["Split",["l66","None",107],[1,0],["l67","l68"]],["Bind",["l68"],["threadIdx.x"],[]],["GetBlock",[],["root","main"],["b69"]],["Unannotate",["b69"],["meta_schedule.unroll_explicit"],[]],["GetChildBlocks",["b69"],[],["b70","b71","b72","b73"]],["GetLoops",["b70"],[],["l74","l75","l76","l77","l78","l79","l80"]],["GetLoops",["b71"],[],["l81","l82","l83","l84","l85","l86"]],["GetLoops",["b72"],[],["l87","l88","l89","l90","l91","l92","l93","l94","l95","l96"]],["GetLoops",["b73"],[],["l97","l98","l99","l100","l101"]],["GetBlock",[],["C","main"],["b102"]],["GetLoops",["b102"],[],["l103","l104","l105","l106","l107","l108","l109","l110","l111","l112"]],["DecomposeReduction",["b102","l106"],[],["b113"]]],[[4,[2,1,107,1,3]],[6,[1,8,1,16,8]],[8,[512,8,1]],[25,3],[31,0],[33,0]]],[0.19214320866666667609,0.19280977366666665618,0.19252359999999998919],{"host":{"keys":["cpu"],"kind":"llvm","mtriple":"x86_64-unknown-linux-gnu","tag":""},"keys":["rocm","gpu"],"kind":"rocm","max_num_threads":256,"max_shared_memory_per_block":49152,"max_threads_per_block":1024,"mcpu":"gfx942","model":"MI300","mtriple":"amdgcn-amd-amdhsa-hcc","tag":"","thread_warp_size":64},[["TENSOR","float16",[642,4096]],["TENSOR","float16",[4096,1024]],["TENSOR","float16",[642,1024]]]]]
