demo_artifacts/logs/mm_ms/rocm_mm_2048_8192_8192/database_tuning_record.json
[0,[[[["GetBlock",[],["C","main"],["b0"]],["GetBlock",[],["root","main"],["b1"]],["Annotate",["b0","\"SSSRRSRS\""],["meta_schedule.tiling_structure"],[]],["GetLoops",["b0"],[],["l2","l3","l4"]],["SamplePerfectTile",["l2"],[5,64],["v5","v6","v7","v8","v9"]],["Split",["l2","v5","v6","v7","v8","v9"],[1,0],["l10","l11","l12","l13","l14"]],["SamplePerfectTile",["l3"],[5,64],["v15","v16","v17","v18","v19"]],["Split",["l3","v15","v16","v17","v18","v19"],[1,0],["l20","l21","l22","l23","l24"]],["SamplePerfectTile",["l4"],[3,64],["v25","v26","v27"]],["Split",["l4","v25","v26","v27"],[1,0],["l28","l29","l30"]],["Reorder",["l10","l20","l11","l21","l12","l22","l28","l29","l13","l23","l30","l14","l24"],[],[]],["Fuse",["l10","l20"],[1],["l31"]],["Bind",["l31"],["blockIdx.x"],[]],["Fuse",["l11","l21"],[1],["l32"]],["Bind",["l32"],["vthread.x"],[]],["Fuse",["l12","l22"],[1],["l33"]],["Bind",["l33"],["threadIdx.x"],[]],["Annotate",["b0",64],["meta_schedule.thread_extent_low_inclusive"],[]],["Annotate",["b0",1024],["meta_schedule.thread_extent_high_inclusive"],[]],["CacheWrite",["b0",[]],[0,"local"],["b34"]],["ReverseComputeAt",["b34","l33"],[1,-1],[]],["CacheRead",["b0",["b0"]],[0,"shared"],["b35"]],["ComputeAt",["b35","l28"],[1,-1],[]],["GetLoops",["b35"],[],["l36","l37","l38","l39","l40","l41"]],["Fuse",["l40","l41"],[1],["l42"]],["SampleCategorical",[],[[1,2,4,8],[0.25,0.25,0.25,0.25]],["v43"]],["Annotate",["b35","v43"],["meta_schedule.cooperative_fetch"],[]],["CacheRead",["b0",["b0"]],[1,"shared"],["b44"]],["ComputeAt",["b44","l28"],[1,-1],[]],["GetLoops",["b44"],[],["l45","l46","l47","l48","l49","l50"]],["Fuse",["l49","l50"],[1],["l51"]],["SampleCategorical",[],[[1,2,4,8],[0.25,0.25,0.25,0.25]],["v52"]],["Annotate",["b44","v52"],["meta_schedule.cooperative_fetch"],[]],["SampleCategorical",[],[[0,16,64,512,1024],[0.2000000000000000111,0.2000000000000000111,0.2000000000000000111,0.2000000000000000111,0.2000000000000000111]],["v53"]],["Annotate",["b1","v53"],["meta_schedule.unroll_explicit"],[]],["EnterPostproc",[],[],[]],["Unannotate",["b35"],["meta_schedule.cooperative_fetch"],[]],["GetLoops",["b35"],[],["l54","l55","l56","l57","l58"]],["Split",["l58","None",128],[1,0],["l59","l60"]],["Bind",["l60"],["threadIdx.x"],[]],["Unannotate",["b44"],["meta_schedule.cooperative_fetch"],[]],["GetLoops",["b44"],[],["l61","l62","l63","l64","l65"]],["Split",["l65","None",128],[1,0],["l66","l67"]],["Bind",["l67"],["threadIdx.x"],[]],["GetBlock",[],["root","main"],["b68"]],["Unannotate",["b68"],["meta_schedule.unroll_explicit"],[]],["GetChildBlocks",["b68"],[],["b69","b70","b71","b72"]],["GetLoops",["b69"],[],["l73","l74","l75","l76","l77","l78"]],["GetLoops",["b70"],[],["l79","l80","l81","l82","l83","l84"]],["GetLoops",["b71"],[],["l85","l86","l87","l88","l89","l90","l91","l92","l93","l94"]],["GetLoops",["b72"],[],["l95","l96","l97","l98","l99"]],["GetBlock",[],["C","main"],["b100"]],["GetLoops",["b100"],[],["l101","l102","l103","l104","l105","l106","l107","l108","l109","l110"]],["DecomposeReduction",["b100","l104"],[],["b111"]]],[[4,[8,2,1,2,64]],[6,[16,2,128,1,2]],[8,[512,2,8]],[25,0],[31,0],[33,0]]],[0.46084305800000002762,0.45937487766666662559,0.45993290200000003232],{"host":{"keys":["cpu"],"kind":"llvm","mtriple":"x86_64-unknown-linux-gnu","tag":""},"keys":["rocm","gpu"],"kind":"rocm","max_num_threads":256,"max_shared_memory_per_block":49152,"max_threads_per_block":1024,"mcpu":"gfx942","model":"MI300","mtriple":"amdgcn-amd-amdhsa-hcc","tag":"","thread_warp_size":64},[["TENSOR","float16",[2048,8192]],["TENSOR","float16",[8192,8192]],["TENSOR","float16",[2048,8192]]]]]
[0,[[[["GetBlock",[],["C","main"],["b0"]],["GetBlock",[],["root","main"],["b1"]],["Annotate",["b0","\"SSSRRSRS\""],["meta_schedule.tiling_structure"],[]],["GetLoops",["b0"],[],["l2","l3","l4"]],["SamplePerfectTile",["l2"],[5,64],["v5","v6","v7","v8","v9"]],["Split",["l2","v5","v6","v7","v8","v9"],[1,0],["l10","l11","l12","l13","l14"]],["SamplePerfectTile",["l3"],[5,64],["v15","v16","v17","v18","v19"]],["Split",["l3","v15","v16","v17","v18","v19"],[1,0],["l20","l21","l22","l23","l24"]],["SamplePerfectTile",["l4"],[3,64],["v25","v26","v27"]],["Split",["l4","v25","v26","v27"],[1,0],["l28","l29","l30"]],["Reorder",["l10","l20","l11","l21","l12","l22","l28","l29","l13","l23","l30","l14","l24"],[],[]],["Fuse",["l10","l20"],[1],["l31"]],["Bind",["l31"],["blockIdx.x"],[]],["Fuse",["l11","l21"],[1],["l32"]],["Bind",["l32"],["vthread.x"],[]],["Fuse",["l12","l22"],[1],["l33"]],["Bind",["l33"],["threadIdx.x"],[]],["Annotate",["b0",64],["meta_schedule.thread_extent_low_inclusive"],[]],["Annotate",["b0",1024],["meta_schedule.thread_extent_high_inclusive"],[]],["CacheWrite",["b0",[]],[0,"local"],["b34"]],["ReverseComputeAt",["b34","l33"],[1,-1],[]],["CacheRead",["b0",["b0"]],[0,"shared"],["b35"]],["ComputeAt",["b35","l28"],[1,-1],[]],["GetLoops",["b35"],[],["l36","l37","l38","l39","l40","l41"]],["Fuse",["l40","l41"],[1],["l42"]],["SampleCategorical",[],[[1,2,4,8],[0.25,0.25,0.25,0.25]],["v43"]],["Annotate",["b35","v43"],["meta_schedule.cooperative_fetch"],[]],["CacheRead",["b0",["b0"]],[1,"shared"],["b44"]],["ComputeAt",["b44","l28"],[1,-1],[]],["GetLoops",["b44"],[],["l45","l46","l47","l48","l49","l50"]],["Fuse",["l49","l50"],[1],["l51"]],["SampleCategorical",[],[[1,2,4,8],[0.25,0.25,0.25,0.25]],["v52"]],["Annotate",["b44","v52"],["meta_schedule.cooperative_fetch"],[]],["SampleCategorical",[],[[0,16,64,512,1024],[0.2000000000000000111,0.2000000000000000111,0.2000000000000000111,0.2000000000000000111,0.2000000000000000111]],["v53"]],["Annotate",["b1","v53"],["meta_schedule.unroll_explicit"],[]],["EnterPostproc",[],[],[]],["Unannotate",["b35"],["meta_schedule.cooperative_fetch"],[]],["GetLoops",["b35"],[],["l54","l55","l56","l57","l58"]],["Split",["l58","None",512],[1,0],["l59","l60"]],["Bind",["l60"],["threadIdx.x"],[]],["Unannotate",["b44"],["meta_schedule.cooperative_fetch"],[]],["GetLoops",["b44"],[],["l61","l62","l63","l64","l65"]],["Split",["l65","None",512],[1,0],["l66","l67"]],["Bind",["l67"],["threadIdx.x"],[]],["GetBlock",[],["root","main"],["b68"]],["Unannotate",["b68"],["meta_schedule.unroll_explicit"],[]],["GetChildBlocks",["b68"],[],["b69","b70","b71","b72"]],["GetLoops",["b69"],[],["l73","l74","l75","l76","l77","l78"]],["GetLoops",["b70"],[],["l79","l80","l81","l82","l83","l84"]],["GetLoops",["b71"],[],["l85","l86","l87","l88","l89","l90","l91","l92","l93","l94"]],["GetLoops",["b72"],[],["l95","l96","l97","l98","l99"]],["GetBlock",[],["C","main"],["b100"]],["GetLoops",["b100"],[],["l101","l102","l103","l104","l105","l106","l107","l108","l109","l110"]],["DecomposeReduction",["b100","l104"],[],["b111"]]],[[4,[1,4,32,2,8]],[6,[32,16,16,1,1]],[8,[2048,2,2]],[25,0],[31,0],[33,0]]],[1.0686866859999999413,1.0677316893333332892,1.0685715329999998513],{"host":{"keys":["cpu"],"kind":"llvm","mtriple":"x86_64-unknown-linux-gnu","tag":""},"keys":["rocm","gpu"],"kind":"rocm","max_num_threads":256,"max_shared_memory_per_block":49152,"max_threads_per_block":1024,"mcpu":"gfx942","model":"MI300","mtriple":"amdgcn-amd-amdhsa-hcc","tag":"","thread_warp_size":64},[["TENSOR","float16",[2048,8192]],["TENSOR","float16",[8192,8192]],["TENSOR","float16",[2048,8192]]]]]
[0,[[[["GetBlock",[],["C","main"],["b0"]],["GetBlock",[],["root","main"],["b1"]],["Annotate",["b0","\"SSSRRSRS\""],["meta_schedule.tiling_structure"],[]],["GetLoops",["b0"],[],["l2","l3","l4"]],["SamplePerfectTile",["l2"],[5,64],["v5","v6","v7","v8","v9"]],["Split",["l2","v5","v6","v7","v8","v9"],[1,0],["l10","l11","l12","l13","l14"]],["SamplePerfectTile",["l3"],[5,64],["v15","v16","v17","v18","v19"]],["Split",["l3","v15","v16","v17","v18","v19"],[1,0],["l20","l21","l22","l23","l24"]],["SamplePerfectTile",["l4"],[3,64],["v25","v26","v27"]],["Split",["l4","v25","v26","v27"],[1,0],["l28","l29","l30"]],["Reorder",["l10","l20","l11","l21","l12","l22","l28","l29","l13","l23","l30","l14","l24"],[],[]],["Fuse",["l10","l20"],[1],["l31"]],["Bind",["l31"],["blockIdx.x"],[]],["Fuse",["l11","l21"],[1],["l32"]],["Bind",["l32"],["vthread.x"],[]],["Fuse",["l12","l22"],[1],["l33"]],["Bind",["l33"],["threadIdx.x"],[]],["Annotate",["b0",64],["meta_schedule.thread_extent_low_inclusive"],[]],["Annotate",["b0",1024],["meta_schedule.thread_extent_high_inclusive"],[]],["CacheWrite",["b0",[]],[0,"local"],["b34"]],["ReverseComputeAt",["b34","l33"],[1,-1],[]],["CacheRead",["b0",["b0"]],[0,"shared"],["b35"]],["ComputeAt",["b35","l28"],[1,-1],[]],["GetLoops",["b35"],[],["l36","l37","l38","l39","l40","l41"]],["Fuse",["l40","l41"],[1],["l42"]],["SampleCategorical",[],[[1,2,4,8],[0.25,0.25,0.25,0.25]],["v43"]],["Annotate",["b35","v43"],["meta_schedule.cooperative_fetch"],[]],["CacheRead",["b0",["b0"]],[1,"shared"],["b44"]],["ComputeAt",["b44","l28"],[1,-1],[]],["GetLoops",["b44"],[],["l45","l46","l47","l48","l49","l50"]],["Fuse",["l49","l50"],[1],["l51"]],["SampleCategorical",[],[[1,2,4,8],[0.25,0.25,0.25,0.25]],["v52"]],["Annotate",["b44","v52"],["meta_schedule.cooperative_fetch"],[]],["SampleCategorical",[],[[0,16,64,512,1024],[0.2000000000000000111,0.2000000000000000111,0.2000000000000000111,0.2000000000000000111,0.2000000000000000111]],["v53"]],["Annotate",["b1","v53"],["meta_schedule.unroll_explicit"],[]],["EnterPostproc",[],[],[]],["Unannotate",["b35"],["meta_schedule.cooperative_fetch"],[]],["GetLoops",["b35"],[],["l54","l55","l56","l57","l58"]],["Split",["l58","None",128,4],[1,0],["l59","l60","l61"]],["Vectorize",["l61"],[],[]],["Bind",["l60"],["threadIdx.x"],[]],["Unannotate",["b44"],["meta_schedule.cooperative_fetch"],[]],["GetLoops",["b44"],[],["l62","l63","l64","l65","l66"]],["Split",["l66","None",128,2],[1,0],["l67","l68","l69"]],["Vectorize",["l69"],[],[]],["Bind",["l68"],["threadIdx.x"],[]],["GetBlock",[],["root","main"],["b70"]],["Unannotate",["b70"],["meta_schedule.unroll_explicit"],[]],["GetChildBlocks",["b70"],[],["b71","b72","b73","b74"]],["GetLoops",["b71"],[],["l75","l76","l77","l78","l79","l80","l81"]],["GetLoops",["b72"],[],["l82","l83","l84","l85","l86","l87","l88"]],["GetLoops",["b73"],[],["l89","l90","l91","l92","l93","l94","l95","l96","l97","l98"]],["Annotate",["l89",64],["pragma_auto_unroll_max_step"],[]],["Annotate",["l89",1],["pragma_unroll_explicit"],[]],["GetLoops",["b74"],[],["l99","l100","l101","l102","l103"]],["GetBlock",[],["C","main"],["b104"]],["GetLoops",["b104"],[],["l105","l106","l107","l108","l109","l110","l111","l112","l113","l114"]],["DecomposeReduction",["b104","l108"],[],["b115"]]],[[4,[16,2,1,2,32]],[6,[16,2,128,2,1]],[8,[512,2,8]],[25,2],[31,1],[33,2]]],[0.36333614066666669595,0.36145621733333338499,0.36212898733333331869],{"host":{"keys":["cpu"],"kind":"llvm","mtriple":"x86_64-unknown-linux-gnu","tag":""},"keys":["rocm","gpu"],"kind":"rocm","max_num_threads":256,"max_shared_memory_per_block":49152,"max_threads_per_block":1024,"mcpu":"gfx942","model":"MI300","mtriple":"amdgcn-amd-amdhsa-hcc","tag":"","thread_warp_size":64},[["TENSOR","float16",[2048,8192]],["TENSOR","float16",[8192,8192]],["TENSOR","float16",[2048,8192]]]]]
[0,[[[["GetBlock",[],["C","main"],["b0"]],["GetBlock",[],["root","main"],["b1"]],["Annotate",["b0","\"SSSRRSRS\""],["meta_schedule.tiling_structure"],[]],["GetLoops",["b0"],[],["l2","l3","l4"]],["SamplePerfectTile",["l2"],[5,64],["v5","v6","v7","v8","v9"]],["Split",["l2","v5","v6","v7","v8","v9"],[1,0],["l10","l11","l12","l13","l14"]],["SamplePerfectTile",["l3"],[5,64],["v15","v16","v17","v18","v19"]],["Split",["l3","v15","v16","v17","v18","v19"],[1,0],["l20","l21","l22","l23","l24"]],["SamplePerfectTile",["l4"],[3,64],["v25","v26","v27"]],["Split",["l4","v25","v26","v27"],[1,0],["l28","l29","l30"]],["Reorder",["l10","l20","l11","l21","l12","l22","l28","l29","l13","l23","l30","l14","l24"],[],[]],["Fuse",["l10","l20"],[1],["l31"]],["Bind",["l31"],["blockIdx.x"],[]],["Fuse",["l11","l21"],[1],["l32"]],["Bind",["l32"],["vthread.x"],[]],["Fuse",["l12","l22"],[1],["l33"]],["Bind",["l33"],["threadIdx.x"],[]],["Annotate",["b0",64],["meta_schedule.thread_extent_low_inclusive"],[]],["Annotate",["b0",1024],["meta_schedule.thread_extent_high_inclusive"],[]],["CacheWrite",["b0",[]],[0,"local"],["b34"]],["ReverseComputeAt",["b34","l33"],[1,-1],[]],["CacheRead",["b0",["b0"]],[0,"shared"],["b35"]],["ComputeAt",["b35","l28"],[1,-1],[]],["GetLoops",["b35"],[],["l36","l37","l38","l39","l40","l41"]],["Fuse",["l40","l41"],[1],["l42"]],["SampleCategorical",[],[[1,2,4,8],[0.25,0.25,0.25,0.25]],["v43"]],["Annotate",["b35","v43"],["meta_schedule.cooperative_fetch"],[]],["CacheRead",["b0",["b0"]],[1,"shared"],["b44"]],["ComputeAt",["b44","l28"],[1,-1],[]],["GetLoops",["b44"],[],["l45","l46","l47","l48","l49","l50"]],["Fuse",["l49","l50"],[1],["l51"]],["SampleCategorical",[],[[1,2,4,8],[0.25,0.25,0.25,0.25]],["v52"]],["Annotate",["b44","v52"],["meta_schedule.cooperative_fetch"],[]],["SampleCategorical",[],[[0,16,64,512,1024],[0.2000000000000000111,0.2000000000000000111,0.2000000000000000111,0.2000000000000000111,0.2000000000000000111]],["v53"]],["Annotate",["b1","v53"],["meta_schedule.unroll_explicit"],[]],["EnterPostproc",[],[],[]],["Unannotate",["b35"],["meta_schedule.cooperative_fetch"],[]],["GetLoops",["b35"],[],["l54","l55","l56","l57","l58"]],["Split",["l58","None",1024],[1,0],["l59","l60"]],["Bind",["l60"],["threadIdx.x"],[]],["Unannotate",["b44"],["meta_schedule.cooperative_fetch"],[]],["GetLoops",["b44"],[],["l61","l62","l63","l64","l65"]],["Split",["l65","None",1024],[1,0],["l66","l67"]],["Bind",["l67"],["threadIdx.x"],[]],["GetBlock",[],["root","main"],["b68"]],["Unannotate",["b68"],["meta_schedule.unroll_explicit"],[]],["GetChildBlocks",["b68"],[],["b69","b70","b71","b72"]],["GetLoops",["b69"],[],["l73","l74","l75","l76","l77","l78"]],["GetLoops",["b70"],[],["l79","l80","l81","l82","l83","l84"]],["GetLoops",["b71"],[],["l85","l86","l87","l88","l89","l90","l91","l92","l93","l94"]],["Annotate",["l85",16],["pragma_auto_unroll_max_step"],[]],["Annotate",["l85",1],["pragma_unroll_explicit"],[]],["GetLoops",["b72"],[],["l95","l96","l97","l98","l99"]],["GetBlock",[],["C","main"],["b100"]],["GetLoops",["b100"],[],["l101","l102","l103","l104","l105","l106","l107","l108","l109","l110"]],["DecomposeReduction",["b100","l104"],[],["b111"]]],[[4,[1,128,8,2,1]],[6,[64,1,128,1,1]],[8,[4096,1,2]],[25,0],[31,0],[33,1]]],[0.46184200000000003028,0.46973872866666671611,0.46949967433333333888],{"host":{"keys":["cpu"],"kind":"llvm","mtriple":"x86_64-unknown-linux-gnu","tag":""},"keys":["rocm","gpu"],"kind":"rocm","max_num_threads":256,"max_shared_memory_per_block":49152,"max_threads_per_block":1024,"mcpu":"gfx942","model":"MI300","mtriple":"amdgcn-amd-amdhsa-hcc","tag":"","thread_warp_size":64},[["TENSOR","float16",[2048,8192]],["TENSOR","float16",[8192,8192]],["TENSOR","float16",[2048,8192]]]]]
[0,[[[["GetBlock",[],["C","main"],["b0"]],["GetBlock",[],["root","main"],["b1"]],["Annotate",["b0","\"SSSRRSRS\""],["meta_schedule.tiling_structure"],[]],["GetLoops",["b0"],[],["l2","l3","l4"]],["SamplePerfectTile",["l2"],[5,64],["v5","v6","v7","v8","v9"]],["Split",["l2","v5","v6","v7","v8","v9"],[1,0],["l10","l11","l12","l13","l14"]],["SamplePerfectTile",["l3"],[5,64],["v15","v16","v17","v18","v19"]],["Split",["l3","v15","v16","v17","v18","v19"],[1,0],["l20","l21","l22","l23","l24"]],["SamplePerfectTile",["l4"],[3,64],["v25","v26","v27"]],["Split",["l4","v25","v26","v27"],[1,0],["l28","l29","l30"]],["Reorder",["l10","l20","l11","l21","l12","l22","l28","l29","l13","l23","l30","l14","l24"],[],[]],["Fuse",["l10","l20"],[1],["l31"]],["Bind",["l31"],["blockIdx.x"],[]],["Fuse",["l11","l21"],[1],["l32"]],["Bind",["l32"],["vthread.x"],[]],["Fuse",["l12","l22"],[1],["l33"]],["Bind",["l33"],["threadIdx.x"],[]],["Annotate",["b0",64],["meta_schedule.thread_extent_low_inclusive"],[]],["Annotate",["b0",1024],["meta_schedule.thread_extent_high_inclusive"],[]],["CacheWrite",["b0",[]],[0,"local"],["b34"]],["ReverseComputeAt",["b34","l33"],[1,-1],[]],["CacheRead",["b0",["b0"]],[0,"shared"],["b35"]],["ComputeAt",["b35","l28"],[1,-1],[]],["GetLoops",["b35"],[],["l36","l37","l38","l39","l40","l41"]],["Fuse",["l40","l41"],[1],["l42"]],["SampleCategorical",[],[[1,2,4,8],[0.25,0.25,0.25,0.25]],["v43"]],["Annotate",["b35","v43"],["meta_schedule.cooperative_fetch"],[]],["CacheRead",["b0",["b0"]],[1,"shared"],["b44"]],["ComputeAt",["b44","l28"],[1,-1],[]],["GetLoops",["b44"],[],["l45","l46","l47","l48","l49","l50"]],["Fuse",["l49","l50"],[1],["l51"]],["SampleCategorical",[],[[1,2,4,8],[0.25,0.25,0.25,0.25]],["v52"]],["Annotate",["b44","v52"],["meta_schedule.cooperative_fetch"],[]],["SampleCategorical",[],[[0,16,64,512,1024],[0.2000000000000000111,0.2000000000000000111,0.2000000000000000111,0.2000000000000000111,0.2000000000000000111]],["v53"]],["Annotate",["b1","v53"],["meta_schedule.unroll_explicit"],[]],["EnterPostproc",[],[],[]],["Unannotate",["b35"],["meta_schedule.cooperative_fetch"],[]],["GetLoops",["b35"],[],["l54","l55","l56","l57","l58"]],["Split",["l58","None",256,2],[1,0],["l59","l60","l61"]],["Vectorize",["l61"],[],[]],["Bind",["l60"],["threadIdx.x"],[]],["Unannotate",["b44"],["meta_schedule.cooperative_fetch"],[]],["GetLoops",["b44"],[],["l62","l63","l64","l65","l66"]],["Split",["l66","None",256,2],[1,0],["l67","l68","l69"]],["Vectorize",["l69"],[],[]],["Bind",["l68"],["threadIdx.x"],[]],["GetBlock",[],["root","main"],["b70"]],["Unannotate",["b70"],["meta_schedule.unroll_explicit"],[]],["GetChildBlocks",["b70"],[],["b71","b72","b73","b74"]],["GetLoops",["b71"],[],["l75","l76","l77","l78","l79","l80","l81"]],["GetLoops",["b72"],[],["l82","l83","l84","l85","l86","l87","l88"]],["GetLoops",["b73"],[],["l89","l90","l91","l92","l93","l94","l95","l96","l97","l98"]],["Annotate",["l89",1024],["pragma_auto_unroll_max_step"],[]],["Annotate",["l89",1],["pragma_unroll_explicit"],[]],["GetLoops",["b74"],[],["l99","l100","l101","l102","l103"]],["GetBlock",[],["C","main"],["b104"]],["GetLoops",["b104"],[],["l105","l106","l107","l108","l109","l110","l111","l112","l113","l114"]],["DecomposeReduction",["b104","l108"],[],["b115"]]],[[4,[16,1,64,2,1]],[6,[256,8,4,1,1]],[8,[2048,2,2]],[25,1],[31,1],[33,4]]],[0.0085125960833333323002,0.0083724440833333330092,0.0085172289999999994253],{"host":{"keys":["cpu"],"kind":"llvm","mtriple":"x86_64-unknown-linux-gnu","tag":""},"keys":["rocm","gpu"],"kind":"rocm","max_num_threads":256,"max_shared_memory_per_block":49152,"max_threads_per_block":1024,"mcpu":"gfx942","model":"MI300","mtriple":"amdgcn-amd-amdhsa-hcc","tag":"","thread_warp_size":64},[["TENSOR","float16",[2048,8192]],["TENSOR","float16",[8192,8192]],["TENSOR","float16",[2048,8192]]]]]
[0,[[[["GetBlock",[],["C","main"],["b0"]],["GetBlock",[],["root","main"],["b1"]],["Annotate",["b0","\"SSSRRSRS\""],["meta_schedule.tiling_structure"],[]],["GetLoops",["b0"],[],["l2","l3","l4"]],["SamplePerfectTile",["l2"],[5,64],["v5","v6","v7","v8","v9"]],["Split",["l2","v5","v6","v7","v8","v9"],[1,0],["l10","l11","l12","l13","l14"]],["SamplePerfectTile",["l3"],[5,64],["v15","v16","v17","v18","v19"]],["Split",["l3","v15","v16","v17","v18","v19"],[1,0],["l20","l21","l22","l23","l24"]],["SamplePerfectTile",["l4"],[3,64],["v25","v26","v27"]],["Split",["l4","v25","v26","v27"],[1,0],["l28","l29","l30"]],["Reorder",["l10","l20","l11","l21","l12","l22","l28","l29","l13","l23","l30","l14","l24"],[],[]],["Fuse",["l10","l20"],[1],["l31"]],["Bind",["l31"],["blockIdx.x"],[]],["Fuse",["l11","l21"],[1],["l32"]],["Bind",["l32"],["vthread.x"],[]],["Fuse",["l12","l22"],[1],["l33"]],["Bind",["l33"],["threadIdx.x"],[]],["Annotate",["b0",64],["meta_schedule.thread_extent_low_inclusive"],[]],["Annotate",["b0",1024],["meta_schedule.thread_extent_high_inclusive"],[]],["CacheWrite",["b0",[]],[0,"local"],["b34"]],["ReverseComputeAt",["b34","l33"],[1,-1],[]],["CacheRead",["b0",["b0"]],[0,"shared"],["b35"]],["ComputeAt",["b35","l28"],[1,-1],[]],["GetLoops",["b35"],[],["l36","l37","l38","l39","l40","l41"]],["Fuse",["l40","l41"],[1],["l42"]],["SampleCategorical",[],[[1,2,4,8],[0.25,0.25,0.25,0.25]],["v43"]],["Annotate",["b35","v43"],["meta_schedule.cooperative_fetch"],[]],["CacheRead",["b0",["b0"]],[1,"shared"],["b44"]],["ComputeAt",["b44","l28"],[1,-1],[]],["GetLoops",["b44"],[],["l45","l46","l47","l48","l49","l50"]],["Fuse",["l49","l50"],[1],["l51"]],["SampleCategorical",[],[[1,2,4,8],[0.25,0.25,0.25,0.25]],["v52"]],["Annotate",["b44","v52"],["meta_schedule.cooperative_fetch"],[]],["SampleCategorical",[],[[0,16,64,512,1024],[0.2000000000000000111,0.2000000000000000111,0.2000000000000000111,0.2000000000000000111,0.2000000000000000111]],["v53"]],["Annotate",["b1","v53"],["meta_schedule.unroll_explicit"],[]],["EnterPostproc",[],[],[]],["Unannotate",["b35"],["meta_schedule.cooperative_fetch"],[]],["GetLoops",["b35"],[],["l54","l55","l56","l57","l58"]],["Split",["l58","None",128,4],[1,0],["l59","l60","l61"]],["Vectorize",["l61"],[],[]],["Bind",["l60"],["threadIdx.x"],[]],["Unannotate",["b44"],["meta_schedule.cooperative_fetch"],[]],["GetLoops",["b44"],[],["l62","l63","l64","l65","l66"]],["Split",["l66","None",128],[1,0],["l67","l68"]],["Bind",["l68"],["threadIdx.x"],[]],["GetBlock",[],["root","main"],["b69"]],["Unannotate",["b69"],["meta_schedule.unroll_explicit"],[]],["GetChildBlocks",["b69"],[],["b70","b71","b72","b73"]],["GetLoops",["b70"],[],["l74","l75","l76","l77","l78","l79","l80"]],["GetLoops",["b71"],[],["l81","l82","l83","l84","l85","l86"]],["GetLoops",["b72"],[],["l87","l88","l89","l90","l91","l92","l93","l94","l95","l96"]],["GetLoops",["b73"],[],["l97","l98","l99","l100","l101"]],["GetBlock",[],["C","main"],["b102"]],["GetLoops",["b102"],[],["l103","l104","l105","l106","l107","l108","l109","l110","l111","l112"]],["DecomposeReduction",["b102","l106"],[],["b113"]]],[[4,[16,2,1,2,32]],[6,[16,2,128,2,1]],[8,[512,2,8]],[25,2],[31,0],[33,0]]],[0.35658117666666666601,0.35887296533333334914,0.35728767900000008018],{"host":{"keys":["cpu"],"kind":"llvm","mtriple":"x86_64-unknown-linux-gnu","tag":""},"keys":["rocm","gpu"],"kind":"rocm","max_num_threads":256,"max_shared_memory_per_block":49152,"max_threads_per_block":1024,"mcpu":"gfx942","model":"MI300","mtriple":"amdgcn-amd-amdhsa-hcc","tag":"","thread_warp_size":64},[["TENSOR","float16",[2048,8192]],["TENSOR","float16",[8192,8192]],["TENSOR","float16",[2048,8192]]]]]
[0,[[[["GetBlock",[],["C","main"],["b0"]],["GetBlock",[],["root","main"],["b1"]],["Annotate",["b0","\"SSSRRSRS\""],["meta_schedule.tiling_structure"],[]],["GetLoops",["b0"],[],["l2","l3","l4"]],["SamplePerfectTile",["l2"],[5,64],["v5","v6","v7","v8","v9"]],["Split",["l2","v5","v6","v7","v8","v9"],[1,0],["l10","l11","l12","l13","l14"]],["SamplePerfectTile",["l3"],[5,64],["v15","v16","v17","v18","v19"]],["Split",["l3","v15","v16","v17","v18","v19"],[1,0],["l20","l21","l22","l23","l24"]],["SamplePerfectTile",["l4"],[3,64],["v25","v26","v27"]],["Split",["l4","v25","v26","v27"],[1,0],["l28","l29","l30"]],["Reorder",["l10","l20","l11","l21","l12","l22","l28","l29","l13","l23","l30","l14","l24"],[],[]],["Fuse",["l10","l20"],[1],["l31"]],["Bind",["l31"],["blockIdx.x"],[]],["Fuse",["l11","l21"],[1],["l32"]],["Bind",["l32"],["vthread.x"],[]],["Fuse",["l12","l22"],[1],["l33"]],["Bind",["l33"],["threadIdx.x"],[]],["Annotate",["b0",64],["meta_schedule.thread_extent_low_inclusive"],[]],["Annotate",["b0",1024],["meta_schedule.thread_extent_high_inclusive"],[]],["CacheWrite",["b0",[]],[0,"local"],["b34"]],["ReverseComputeAt",["b34","l33"],[1,-1],[]],["CacheRead",["b0",["b0"]],[0,"shared"],["b35"]],["ComputeAt",["b35","l28"],[1,-1],[]],["GetLoops",["b35"],[],["l36","l37","l38","l39","l40","l41"]],["Fuse",["l40","l41"],[1],["l42"]],["SampleCategorical",[],[[1,2,4,8],[0.25,0.25,0.25,0.25]],["v43"]],["Annotate",["b35","v43"],["meta_schedule.cooperative_fetch"],[]],["CacheRead",["b0",["b0"]],[1,"shared"],["b44"]],["ComputeAt",["b44","l28"],[1,-1],[]],["GetLoops",["b44"],[],["l45","l46","l47","l48","l49","l50"]],["Fuse",["l49","l50"],[1],["l51"]],["SampleCategorical",[],[[1,2,4,8],[0.25,0.25,0.25,0.25]],["v52"]],["Annotate",["b44","v52"],["meta_schedule.cooperative_fetch"],[]],["SampleCategorical",[],[[0,16,64,512,1024],[0.2000000000000000111,0.2000000000000000111,0.2000000000000000111,0.2000000000000000111,0.2000000000000000111]],["v53"]],["Annotate",["b1","v53"],["meta_schedule.unroll_explicit"],[]],["EnterPostproc",[],[],[]],["Unannotate",["b35"],["meta_schedule.cooperative_fetch"],[]],["GetLoops",["b35"],[],["l54","l55","l56","l57","l58"]],["Split",["l58","None",256,2],[1,0],["l59","l60","l61"]],["Vectorize",["l61"],[],[]],["Bind",["l60"],["threadIdx.x"],[]],["Unannotate",["b44"],["meta_schedule.cooperative_fetch"],[]],["GetLoops",["b44"],[],["l62","l63","l64","l65","l66"]],["Split",["l66","None",256],[1,0],["l67","l68"]],["Bind",["l68"],["threadIdx.x"],[]],["GetBlock",[],["root","main"],["b69"]],["Unannotate",["b69"],["meta_schedule.unroll_explicit"],[]],["GetChildBlocks",["b69"],[],["b70","b71","b72","b73"]],["GetLoops",["b70"],[],["l74","l75","l76","l77","l78","l79","l80"]],["GetLoops",["b71"],[],["l81","l82","l83","l84","l85","l86"]],["GetLoops",["b72"],[],["l87","l88","l89","l90","l91","l92","l93","l94","l95","l96"]],["Annotate",["l87",64],["pragma_auto_unroll_max_step"],[]],["Annotate",["l87",1],["pragma_unroll_explicit"],[]],["GetLoops",["b73"],[],["l97","l98","l99","l100","l101"]],["GetBlock",[],["C","main"],["b102"]],["GetLoops",["b102"],[],["l103","l104","l105","l106","l107","l108","l109","l110","l111","l112"]],["DecomposeReduction",["b102","l106"],[],["b113"]]],[[4,[16,4,4,2,4]],[6,[4,2,64,2,8]],[8,[2048,2,2]],[25,1],[31,0],[33,2]]],[0.26291217033333330599,0.26301680500000002016,0.26291105133333331212],{"host":{"keys":["cpu"],"kind":"llvm","mtriple":"x86_64-unknown-linux-gnu","tag":""},"keys":["rocm","gpu"],"kind":"rocm","max_num_threads":256,"max_shared_memory_per_block":49152,"max_threads_per_block":1024,"mcpu":"gfx942","model":"MI300","mtriple":"amdgcn-amd-amdhsa-hcc","tag":"","thread_warp_size":64},[["TENSOR","float16",[2048,8192]],["TENSOR","float16",[8192,8192]],["TENSOR","float16",[2048,8192]]]]]
[0,[[[["GetBlock",[],["C","main"],["b0"]],["GetBlock",[],["root","main"],["b1"]],["Annotate",["b0","\"SSSRRSRS\""],["meta_schedule.tiling_structure"],[]],["GetLoops",["b0"],[],["l2","l3","l4"]],["SamplePerfectTile",["l2"],[5,64],["v5","v6","v7","v8","v9"]],["Split",["l2","v5","v6","v7","v8","v9"],[1,0],["l10","l11","l12","l13","l14"]],["SamplePerfectTile",["l3"],[5,64],["v15","v16","v17","v18","v19"]],["Split",["l3","v15","v16","v17","v18","v19"],[1,0],["l20","l21","l22","l23","l24"]],["SamplePerfectTile",["l4"],[3,64],["v25","v26","v27"]],["Split",["l4","v25","v26","v27"],[1,0],["l28","l29","l30"]],["Reorder",["l10","l20","l11","l21","l12","l22","l28","l29","l13","l23","l30","l14","l24"],[],[]],["Fuse",["l10","l20"],[1],["l31"]],["Bind",["l31"],["blockIdx.x"],[]],["Fuse",["l11","l21"],[1],["l32"]],["Bind",["l32"],["vthread.x"],[]],["Fuse",["l12","l22"],[1],["l33"]],["Bind",["l33"],["threadIdx.x"],[]],["Annotate",["b0",64],["meta_schedule.thread_extent_low_inclusive"],[]],["Annotate",["b0",1024],["meta_schedule.thread_extent_high_inclusive"],[]],["CacheWrite",["b0",[]],[0,"local"],["b34"]],["ReverseComputeAt",["b34","l33"],[1,-1],[]],["CacheRead",["b0",["b0"]],[0,"shared"],["b35"]],["ComputeAt",["b35","l28"],[1,-1],[]],["GetLoops",["b35"],[],["l36","l37","l38","l39","l40","l41"]],["Fuse",["l40","l41"],[1],["l42"]],["SampleCategorical",[],[[1,2,4,8],[0.25,0.25,0.25,0.25]],["v43"]],["Annotate",["b35","v43"],["meta_schedule.cooperative_fetch"],[]],["CacheRead",["b0",["b0"]],[1,"shared"],["b44"]],["ComputeAt",["b44","l28"],[1,-1],[]],["GetLoops",["b44"],[],["l45","l46","l47","l48","l49","l50"]],["Fuse",["l49","l50"],[1],["l51"]],["SampleCategorical",[],[[1,2,4,8],[0.25,0.25,0.25,0.25]],["v52"]],["Annotate",["b44","v52"],["meta_schedule.cooperative_fetch"],[]],["SampleCategorical",[],[[0,16,64,512,1024],[0.2000000000000000111,0.2000000000000000111,0.2000000000000000111,0.2000000000000000111,0.2000000000000000111]],["v53"]],["Annotate",["b1","v53"],["meta_schedule.unroll_explicit"],[]],["EnterPostproc",[],[],[]],["Unannotate",["b35"],["meta_schedule.cooperative_fetch"],[]],["GetLoops",["b35"],[],["l54","l55","l56","l57","l58"]],["Split",["l58","None",256,4],[1,0],["l59","l60","l61"]],["Vectorize",["l61"],[],[]],["Bind",["l60"],["threadIdx.x"],[]],["Unannotate",["b44"],["meta_schedule.cooperative_fetch"],[]],["GetLoops",["b44"],[],["l62","l63","l64","l65","l66"]],["Split",["l66","None",256,8],[1,0],["l67","l68","l69"]],["Vectorize",["l69"],[],[]],["Bind",["l68"],["threadIdx.x"],[]],["GetBlock",[],["root","main"],["b70"]],["Unannotate",["b70"],["meta_schedule.unroll_explicit"],[]],["GetChildBlocks",["b70"],[],["b71","b72","b73","b74"]],["GetLoops",["b71"],[],["l75","l76","l77","l78","l79","l80","l81"]],["GetLoops",["b72"],[],["l82","l83","l84","l85","l86","l87","l88"]],["GetLoops",["b73"],[],["l89","l90","l91","l92","l93","l94","l95","l96","l97","l98"]],["Annotate",["l89",16],["pragma_auto_unroll_max_step"],[]],["Annotate",["l89",1],["pragma_unroll_explicit"],[]],["GetLoops",["b74"],[],["l99","l100","l101","l102","l103"]],["GetBlock",[],["C","main"],["b104"]],["GetLoops",["b104"],[],["l105","l106","l107","l108","l109","l110","l111","l112","l113","l114"]],["DecomposeReduction",["b104","l108"],[],["b115"]]],[[4,[2,8,64,2,1]],[6,[4,2,4,256,1]],[8,[1024,1,8]],[25,2],[31,3],[33,1]]],[1.015689778333333404,1.0175703123333332822,1.015246256333333319],{"host":{"keys":["cpu"],"kind":"llvm","mtriple":"x86_64-unknown-linux-gnu","tag":""},"keys":["rocm","gpu"],"kind":"rocm","max_num_threads":256,"max_shared_memory_per_block":49152,"max_threads_per_block":1024,"mcpu":"gfx942","model":"MI300","mtriple":"amdgcn-amd-amdhsa-hcc","tag":"","thread_warp_size":64},[["TENSOR","float16",[2048,8192]],["TENSOR","float16",[8192,8192]],["TENSOR","float16",[2048,8192]]]]]
[0,[[[["GetBlock",[],["C","main"],["b0"]],["GetBlock",[],["root","main"],["b1"]],["Annotate",["b0","\"SSSRRSRS\""],["meta_schedule.tiling_structure"],[]],["GetLoops",["b0"],[],["l2","l3","l4"]],["SamplePerfectTile",["l2"],[5,64],["v5","v6","v7","v8","v9"]],["Split",["l2","v5","v6","v7","v8","v9"],[1,0],["l10","l11","l12","l13","l14"]],["SamplePerfectTile",["l3"],[5,64],["v15","v16","v17","v18","v19"]],["Split",["l3","v15","v16","v17","v18","v19"],[1,0],["l20","l21","l22","l23","l24"]],["SamplePerfectTile",["l4"],[3,64],["v25","v26","v27"]],["Split",["l4","v25","v26","v27"],[1,0],["l28","l29","l30"]],["Reorder",["l10","l20","l11","l21","l12","l22","l28","l29","l13","l23","l30","l14","l24"],[],[]],["Fuse",["l10","l20"],[1],["l31"]],["Bind",["l31"],["blockIdx.x"],[]],["Fuse",["l11","l21"],[1],["l32"]],["Bind",["l32"],["vthread.x"],[]],["Fuse",["l12","l22"],[1],["l33"]],["Bind",["l33"],["threadIdx.x"],[]],["Annotate",["b0",64],["meta_schedule.thread_extent_low_inclusive"],[]],["Annotate",["b0",1024],["meta_schedule.thread_extent_high_inclusive"],[]],["CacheWrite",["b0",[]],[0,"local"],["b34"]],["ReverseComputeAt",["b34","l33"],[1,-1],[]],["CacheRead",["b0",["b0"]],[0,"shared"],["b35"]],["ComputeAt",["b35","l28"],[1,-1],[]],["GetLoops",["b35"],[],["l36","l37","l38","l39","l40","l41"]],["Fuse",["l40","l41"],[1],["l42"]],["SampleCategorical",[],[[1,2,4,8],[0.25,0.25,0.25,0.25]],["v43"]],["Annotate",["b35","v43"],["meta_schedule.cooperative_fetch"],[]],["CacheRead",["b0",["b0"]],[1,"shared"],["b44"]],["ComputeAt",["b44","l28"],[1,-1],[]],["GetLoops",["b44"],[],["l45","l46","l47","l48","l49","l50"]],["Fuse",["l49","l50"],[1],["l51"]],["SampleCategorical",[],[[1,2,4,8],[0.25,0.25,0.25,0.25]],["v52"]],["Annotate",["b44","v52"],["meta_schedule.cooperative_fetch"],[]],["SampleCategorical",[],[[0,16,64,512,1024],[0.2000000000000000111,0.2000000000000000111,0.2000000000000000111,0.2000000000000000111,0.2000000000000000111]],["v53"]],["Annotate",["b1","v53"],["meta_schedule.unroll_explicit"],[]],["EnterPostproc",[],[],[]],["Unannotate",["b35"],["meta_schedule.cooperative_fetch"],[]],["GetLoops",["b35"],[],["l54","l55","l56","l57","l58"]],["Split",["l58","None",64],[1,0],["l59","l60"]],["Bind",["l60"],["threadIdx.x"],[]],["Unannotate",["b44"],["meta_schedule.cooperative_fetch"],[]],["GetLoops",["b44"],[],["l61","l62","l63","l64","l65"]],["Split",["l65","None",64,8],[1,0],["l66","l67","l68"]],["Vectorize",["l68"],[],[]],["Bind",["l67"],["threadIdx.x"],[]],["GetBlock",[],["root","main"],["b69"]],["Unannotate",["b69"],["meta_schedule.unroll_explicit"],[]],["GetChildBlocks",["b69"],[],["b70","b71","b72","b73"]],["GetLoops",["b70"],[],["l74","l75","l76","l77","l78","l79"]],["GetLoops",["b71"],[],["l80","l81","l82","l83","l84","l85","l86"]],["GetLoops",["b72"],[],["l87","l88","l89","l90","l91","l92","l93","l94","l95","l96"]],["Annotate",["l87",1024],["pragma_auto_unroll_max_step"],[]],["Annotate",["l87",1],["pragma_unroll_explicit"],[]],["GetLoops",["b73"],[],["l97","l98","l99","l100","l101"]],["GetBlock",[],["C","main"],["b102"]],["GetLoops",["b102"],[],["l103","l104","l105","l106","l107","l108","l109","l110","l111","l112"]],["DecomposeReduction",["b102","l106"],[],["b113"]]],[[4,[128,4,4,1,1]],[6,[8,2,16,32,1]],[8,[512,16,1]],[25,0],[31,3],[33,4]]],[0.052947361999999997817,0.052993997999999993553,0.052968683666666661891],{"host":{"keys":["cpu"],"kind":"llvm","mtriple":"x86_64-unknown-linux-gnu","tag":""},"keys":["rocm","gpu"],"kind":"rocm","max_num_threads":256,"max_shared_memory_per_block":49152,"max_threads_per_block":1024,"mcpu":"gfx942","model":"MI300","mtriple":"amdgcn-amd-amdhsa-hcc","tag":"","thread_warp_size":64},[["TENSOR","float16",[2048,8192]],["TENSOR","float16",[8192,8192]],["TENSOR","float16",[2048,8192]]]]]
[0,[[[["GetBlock",[],["C","main"],["b0"]],["GetBlock",[],["root","main"],["b1"]],["Annotate",["b0","\"SSSRRSRS\""],["meta_schedule.tiling_structure"],[]],["GetLoops",["b0"],[],["l2","l3","l4"]],["SamplePerfectTile",["l2"],[5,64],["v5","v6","v7","v8","v9"]],["Split",["l2","v5","v6","v7","v8","v9"],[1,0],["l10","l11","l12","l13","l14"]],["SamplePerfectTile",["l3"],[5,64],["v15","v16","v17","v18","v19"]],["Split",["l3","v15","v16","v17","v18","v19"],[1,0],["l20","l21","l22","l23","l24"]],["SamplePerfectTile",["l4"],[3,64],["v25","v26","v27"]],["Split",["l4","v25","v26","v27"],[1,0],["l28","l29","l30"]],["Reorder",["l10","l20","l11","l21","l12","l22","l28","l29","l13","l23","l30","l14","l24"],[],[]],["Fuse",["l10","l20"],[1],["l31"]],["Bind",["l31"],["blockIdx.x"],[]],["Fuse",["l11","l21"],[1],["l32"]],["Bind",["l32"],["vthread.x"],[]],["Fuse",["l12","l22"],[1],["l33"]],["Bind",["l33"],["threadIdx.x"],[]],["Annotate",["b0",64],["meta_schedule.thread_extent_low_inclusive"],[]],["Annotate",["b0",1024],["meta_schedule.thread_extent_high_inclusive"],[]],["CacheWrite",["b0",[]],[0,"local"],["b34"]],["ReverseComputeAt",["b34","l33"],[1,-1],[]],["CacheRead",["b0",["b0"]],[0,"shared"],["b35"]],["ComputeAt",["b35","l28"],[1,-1],[]],["GetLoops",["b35"],[],["l36","l37","l38","l39","l40","l41"]],["Fuse",["l40","l41"],[1],["l42"]],["SampleCategorical",[],[[1,2,4,8],[0.25,0.25,0.25,0.25]],["v43"]],["Annotate",["b35","v43"],["meta_schedule.cooperative_fetch"],[]],["CacheRead",["b0",["b0"]],[1,"shared"],["b44"]],["ComputeAt",["b44","l28"],[1,-1],[]],["GetLoops",["b44"],[],["l45","l46","l47","l48","l49","l50"]],["Fuse",["l49","l50"],[1],["l51"]],["SampleCategorical",[],[[1,2,4,8],[0.25,0.25,0.25,0.25]],["v52"]],["Annotate",["b44","v52"],["meta_schedule.cooperative_fetch"],[]],["SampleCategorical",[],[[0,16,64,512,1024],[0.2000000000000000111,0.2000000000000000111,0.2000000000000000111,0.2000000000000000111,0.2000000000000000111]],["v53"]],["Annotate",["b1","v53"],["meta_schedule.unroll_explicit"],[]],["EnterPostproc",[],[],[]],["Unannotate",["b35"],["meta_schedule.cooperative_fetch"],[]],["GetLoops",["b35"],[],["l54","l55","l56","l57","l58"]],["Split",["l58","None",256,4],[1,0],["l59","l60","l61"]],["Vectorize",["l61"],[],[]],["Bind",["l60"],["threadIdx.x"],[]],["Unannotate",["b44"],["meta_schedule.cooperative_fetch"],[]],["GetLoops",["b44"],[],["l62","l63","l64","l65","l66"]],["Split",["l66","None",256],[1,0],["l67","l68"]],["Bind",["l68"],["threadIdx.x"],[]],["GetBlock",[],["root","main"],["b69"]],["Unannotate",["b69"],["meta_schedule.unroll_explicit"],[]],["GetChildBlocks",["b69"],[],["b70","b71","b72","b73"]],["GetLoops",["b70"],[],["l74","l75","l76","l77","l78","l79","l80"]],["GetLoops",["b71"],[],["l81","l82","l83","l84","l85","l86"]],["GetLoops",["b72"],[],["l87","l88","l89","l90","l91","l92","l93","l94","l95","l96"]],["Annotate",["l87",1024],["pragma_auto_unroll_max_step"],[]],["Annotate",["l87",1],["pragma_unroll_explicit"],[]],["GetLoops",["b73"],[],["l97","l98","l99","l100","l101"]],["GetBlock",[],["C","main"],["b102"]],["GetLoops",["b102"],[],["l103","l104","l105","l106","l107","l108","l109","l110","l111","l112"]],["DecomposeReduction",["b102","l106"],[],["b113"]]],[[4,[2,16,2,16,2]],[6,[16,2,128,1,2]],[8,[1024,8,1]],[25,2],[31,0],[33,4]]],[0.540172403666666745,0.54005289700000003172,0.54011096166666672236],{"host":{"keys":["cpu"],"kind":"llvm","mtriple":"x86_64-unknown-linux-gnu","tag":""},"keys":["rocm","gpu"],"kind":"rocm","max_num_threads":256,"max_shared_memory_per_block":49152,"max_threads_per_block":1024,"mcpu":"gfx942","model":"MI300","mtriple":"amdgcn-amd-amdhsa-hcc","tag":"","thread_warp_size":64},[["TENSOR","float16",[2048,8192]],["TENSOR","float16",[8192,8192]],["TENSOR","float16",[2048,8192]]]]]
[0,[[[["GetBlock",[],["C","main"],["b0"]],["GetBlock",[],["root","main"],["b1"]],["Annotate",["b0","\"SSSRRSRS\""],["meta_schedule.tiling_structure"],[]],["GetLoops",["b0"],[],["l2","l3","l4"]],["SamplePerfectTile",["l2"],[5,64],["v5","v6","v7","v8","v9"]],["Split",["l2","v5","v6","v7","v8","v9"],[1,0],["l10","l11","l12","l13","l14"]],["SamplePerfectTile",["l3"],[5,64],["v15","v16","v17","v18","v19"]],["Split",["l3","v15","v16","v17","v18","v19"],[1,0],["l20","l21","l22","l23","l24"]],["SamplePerfectTile",["l4"],[3,64],["v25","v26","v27"]],["Split",["l4","v25","v26","v27"],[1,0],["l28","l29","l30"]],["Reorder",["l10","l20","l11","l21","l12","l22","l28","l29","l13","l23","l30","l14","l24"],[],[]],["Fuse",["l10","l20"],[1],["l31"]],["Bind",["l31"],["blockIdx.x"],[]],["Fuse",["l11","l21"],[1],["l32"]],["Bind",["l32"],["vthread.x"],[]],["Fuse",["l12","l22"],[1],["l33"]],["Bind",["l33"],["threadIdx.x"],[]],["Annotate",["b0",64],["meta_schedule.thread_extent_low_inclusive"],[]],["Annotate",["b0",1024],["meta_schedule.thread_extent_high_inclusive"],[]],["CacheWrite",["b0",[]],[0,"local"],["b34"]],["ReverseComputeAt",["b34","l33"],[1,-1],[]],["CacheRead",["b0",["b0"]],[0,"shared"],["b35"]],["ComputeAt",["b35","l28"],[1,-1],[]],["GetLoops",["b35"],[],["l36","l37","l38","l39","l40","l41"]],["Fuse",["l40","l41"],[1],["l42"]],["SampleCategorical",[],[[1,2,4,8],[0.25,0.25,0.25,0.25]],["v43"]],["Annotate",["b35","v43"],["meta_schedule.cooperative_fetch"],[]],["CacheRead",["b0",["b0"]],[1,"shared"],["b44"]],["ComputeAt",["b44","l28"],[1,-1],[]],["GetLoops",["b44"],[],["l45","l46","l47","l48","l49","l50"]],["Fuse",["l49","l50"],[1],["l51"]],["SampleCategorical",[],[[1,2,4,8],[0.25,0.25,0.25,0.25]],["v52"]],["Annotate",["b44","v52"],["meta_schedule.cooperative_fetch"],[]],["SampleCategorical",[],[[0,16,64,512,1024],[0.2000000000000000111,0.2000000000000000111,0.2000000000000000111,0.2000000000000000111,0.2000000000000000111]],["v53"]],["Annotate",["b1","v53"],["meta_schedule.unroll_explicit"],[]],["EnterPostproc",[],[],[]],["Unannotate",["b35"],["meta_schedule.cooperative_fetch"],[]],["GetLoops",["b35"],[],["l54","l55","l56","l57","l58"]],["Split",["l58","None",256,4],[1,0],["l59","l60","l61"]],["Vectorize",["l61"],[],[]],["Bind",["l60"],["threadIdx.x"],[]],["Unannotate",["b44"],["meta_schedule.cooperative_fetch"],[]],["GetLoops",["b44"],[],["l62","l63","l64","l65","l66"]],["Split",["l66","None",256,4],[1,0],["l67","l68","l69"]],["Vectorize",["l69"],[],[]],["Bind",["l68"],["threadIdx.x"],[]],["GetBlock",[],["root","main"],["b70"]],["Unannotate",["b70"],["meta_schedule.unroll_explicit"],[]],["GetChildBlocks",["b70"],[],["b71","b72","b73","b74"]],["GetLoops",["b71"],[],["l75","l76","l77","l78","l79","l80","l81"]],["GetLoops",["b72"],[],["l82","l83","l84","l85","l86","l87","l88"]],["GetLoops",["b73"],[],["l89","l90","l91","l92","l93","l94","l95","l96","l97","l98"]],["Annotate",["l89",64],["pragma_auto_unroll_max_step"],[]],["Annotate",["l89",1],["pragma_unroll_explicit"],[]],["GetLoops",["b74"],[],["l99","l100","l101","l102","l103"]],["GetBlock",[],["C","main"],["b104"]],["GetLoops",["b104"],[],["l105","l106","l107","l108","l109","l110","l111","l112","l113","l114"]],["DecomposeReduction",["b104","l108"],[],["b115"]]],[[4,[2,16,2,16,2]],[6,[16,1,128,1,4]],[8,[512,2,8]],[25,2],[31,2],[33,2]]],[0.52189977999999992431,0.52171948233333331757,0.52187829566666665837],{"host":{"keys":["cpu"],"kind":"llvm","mtriple":"x86_64-unknown-linux-gnu","tag":""},"keys":["rocm","gpu"],"kind":"rocm","max_num_threads":256,"max_shared_memory_per_block":49152,"max_threads_per_block":1024,"mcpu":"gfx942","model":"MI300","mtriple":"amdgcn-amd-amdhsa-hcc","tag":"","thread_warp_size":64},[["TENSOR","float16",[2048,8192]],["TENSOR","float16",[8192,8192]],["TENSOR","float16",[2048,8192]]]]]
[0,[[[["GetBlock",[],["C","main"],["b0"]],["GetBlock",[],["root","main"],["b1"]],["Annotate",["b0","\"SSSRRSRS\""],["meta_schedule.tiling_structure"],[]],["GetLoops",["b0"],[],["l2","l3","l4"]],["SamplePerfectTile",["l2"],[5,64],["v5","v6","v7","v8","v9"]],["Split",["l2","v5","v6","v7","v8","v9"],[1,0],["l10","l11","l12","l13","l14"]],["SamplePerfectTile",["l3"],[5,64],["v15","v16","v17","v18","v19"]],["Split",["l3","v15","v16","v17","v18","v19"],[1,0],["l20","l21","l22","l23","l24"]],["SamplePerfectTile",["l4"],[3,64],["v25","v26","v27"]],["Split",["l4","v25","v26","v27"],[1,0],["l28","l29","l30"]],["Reorder",["l10","l20","l11","l21","l12","l22","l28","l29","l13","l23","l30","l14","l24"],[],[]],["Fuse",["l10","l20"],[1],["l31"]],["Bind",["l31"],["blockIdx.x"],[]],["Fuse",["l11","l21"],[1],["l32"]],["Bind",["l32"],["vthread.x"],[]],["Fuse",["l12","l22"],[1],["l33"]],["Bind",["l33"],["threadIdx.x"],[]],["Annotate",["b0",64],["meta_schedule.thread_extent_low_inclusive"],[]],["Annotate",["b0",1024],["meta_schedule.thread_extent_high_inclusive"],[]],["CacheWrite",["b0",[]],[0,"local"],["b34"]],["ReverseComputeAt",["b34","l33"],[1,-1],[]],["CacheRead",["b0",["b0"]],[0,"shared"],["b35"]],["ComputeAt",["b35","l28"],[1,-1],[]],["GetLoops",["b35"],[],["l36","l37","l38","l39","l40","l41"]],["Fuse",["l40","l41"],[1],["l42"]],["SampleCategorical",[],[[1,2,4,8],[0.25,0.25,0.25,0.25]],["v43"]],["Annotate",["b35","v43"],["meta_schedule.cooperative_fetch"],[]],["CacheRead",["b0",["b0"]],[1,"shared"],["b44"]],["ComputeAt",["b44","l28"],[1,-1],[]],["GetLoops",["b44"],[],["l45","l46","l47","l48","l49","l50"]],["Fuse",["l49","l50"],[1],["l51"]],["SampleCategorical",[],[[1,2,4,8],[0.25,0.25,0.25,0.25]],["v52"]],["Annotate",["b44","v52"],["meta_schedule.cooperative_fetch"],[]],["SampleCategorical",[],[[0,16,64,512,1024],[0.2000000000000000111,0.2000000000000000111,0.2000000000000000111,0.2000000000000000111,0.2000000000000000111]],["v53"]],["Annotate",["b1","v53"],["meta_schedule.unroll_explicit"],[]],["EnterPostproc",[],[],[]],["Unannotate",["b35"],["meta_schedule.cooperative_fetch"],[]],["GetLoops",["b35"],[],["l54","l55","l56","l57","l58"]],["Split",["l58","None",256],[1,0],["l59","l60"]],["Bind",["l60"],["threadIdx.x"],[]],["Unannotate",["b44"],["meta_schedule.cooperative_fetch"],[]],["GetLoops",["b44"],[],["l61","l62","l63","l64","l65"]],["Split",["l65","None",256,4],[1,0],["l66","l67","l68"]],["Vectorize",["l68"],[],[]],["Bind",["l67"],["threadIdx.x"],[]],["GetBlock",[],["root","main"],["b69"]],["Unannotate",["b69"],["meta_schedule.unroll_explicit"],[]],["GetChildBlocks",["b69"],[],["b70","b71","b72","b73"]],["GetLoops",["b70"],[],["l74","l75","l76","l77","l78","l79"]],["GetLoops",["b71"],[],["l80","l81","l82","l83","l84","l85","l86"]],["GetLoops",["b72"],[],["l87","l88","l89","l90","l91","l92","l93","l94","l95","l96"]],["Annotate",["l87",16],["pragma_auto_unroll_max_step"],[]],["Annotate",["l87",1],["pragma_unroll_explicit"],[]],["GetLoops",["b73"],[],["l97","l98","l99","l100","l101"]],["GetBlock",[],["C","main"],["b102"]],["GetLoops",["b102"],[],["l103","l104","l105","l106","l107","l108","l109","l110","l111","l112"]],["DecomposeReduction",["b102","l106"],[],["b113"]]],[[4,[16,2,1,2,32]],[6,[8,2,256,1,2]],[8,[1024,1,8]],[25,0],[31,2],[33,1]]],[0.14492588266666667218,0.14493595366666667257,0.14510260999999999298],{"host":{"keys":["cpu"],"kind":"llvm","mtriple":"x86_64-unknown-linux-gnu","tag":""},"keys":["rocm","gpu"],"kind":"rocm","max_num_threads":256,"max_shared_memory_per_block":49152,"max_threads_per_block":1024,"mcpu":"gfx942","model":"MI300","mtriple":"amdgcn-amd-amdhsa-hcc","tag":"","thread_warp_size":64},[["TENSOR","float16",[2048,8192]],["TENSOR","float16",[8192,8192]],["TENSOR","float16",[2048,8192]]]]]
[0,[[[["GetBlock",[],["C","main"],["b0"]],["GetBlock",[],["root","main"],["b1"]],["Annotate",["b0","\"SSSRRSRS\""],["meta_schedule.tiling_structure"],[]],["GetLoops",["b0"],[],["l2","l3","l4"]],["SamplePerfectTile",["l2"],[5,64],["v5","v6","v7","v8","v9"]],["Split",["l2","v5","v6","v7","v8","v9"],[1,0],["l10","l11","l12","l13","l14"]],["SamplePerfectTile",["l3"],[5,64],["v15","v16","v17","v18","v19"]],["Split",["l3","v15","v16","v17","v18","v19"],[1,0],["l20","l21","l22","l23","l24"]],["SamplePerfectTile",["l4"],[3,64],["v25","v26","v27"]],["Split",["l4","v25","v26","v27"],[1,0],["l28","l29","l30"]],["Reorder",["l10","l20","l11","l21","l12","l22","l28","l29","l13","l23","l30","l14","l24"],[],[]],["Fuse",["l10","l20"],[1],["l31"]],["Bind",["l31"],["blockIdx.x"],[]],["Fuse",["l11","l21"],[1],["l32"]],["Bind",["l32"],["vthread.x"],[]],["Fuse",["l12","l22"],[1],["l33"]],["Bind",["l33"],["threadIdx.x"],[]],["Annotate",["b0",64],["meta_schedule.thread_extent_low_inclusive"],[]],["Annotate",["b0",1024],["meta_schedule.thread_extent_high_inclusive"],[]],["CacheWrite",["b0",[]],[0,"local"],["b34"]],["ReverseComputeAt",["b34","l33"],[1,-1],[]],["CacheRead",["b0",["b0"]],[0,"shared"],["b35"]],["ComputeAt",["b35","l28"],[1,-1],[]],["GetLoops",["b35"],[],["l36","l37","l38","l39","l40","l41"]],["Fuse",["l40","l41"],[1],["l42"]],["SampleCategorical",[],[[1,2,4,8],[0.25,0.25,0.25,0.25]],["v43"]],["Annotate",["b35","v43"],["meta_schedule.cooperative_fetch"],[]],["CacheRead",["b0",["b0"]],[1,"shared"],["b44"]],["ComputeAt",["b44","l28"],[1,-1],[]],["GetLoops",["b44"],[],["l45","l46","l47","l48","l49","l50"]],["Fuse",["l49","l50"],[1],["l51"]],["SampleCategorical",[],[[1,2,4,8],[0.25,0.25,0.25,0.25]],["v52"]],["Annotate",["b44","v52"],["meta_schedule.cooperative_fetch"],[]],["SampleCategorical",[],[[0,16,64,512,1024],[0.2000000000000000111,0.2000000000000000111,0.2000000000000000111,0.2000000000000000111,0.2000000000000000111]],["v53"]],["Annotate",["b1","v53"],["meta_schedule.unroll_explicit"],[]],["EnterPostproc",[],[],[]],["Unannotate",["b35"],["meta_schedule.cooperative_fetch"],[]],["GetLoops",["b35"],[],["l54","l55","l56","l57","l58"]],["Split",["l58","None",512,4],[1,0],["l59","l60","l61"]],["Vectorize",["l61"],[],[]],["Bind",["l60"],["threadIdx.x"],[]],["Unannotate",["b44"],["meta_schedule.cooperative_fetch"],[]],["GetLoops",["b44"],[],["l62","l63","l64","l65","l66"]],["Split",["l66","None",512,2],[1,0],["l67","l68","l69"]],["Vectorize",["l69"],[],[]],["Bind",["l68"],["threadIdx.x"],[]],["GetBlock",[],["root","main"],["b70"]],["Unannotate",["b70"],["meta_schedule.unroll_explicit"],[]],["GetChildBlocks",["b70"],[],["b71","b72","b73","b74"]],["GetLoops",["b71"],[],["l75","l76","l77","l78","l79","l80","l81"]],["GetLoops",["b72"],[],["l82","l83","l84","l85","l86","l87","l88"]],["GetLoops",["b73"],[],["l89","l90","l91","l92","l93","l94","l95","l96","l97","l98"]],["GetLoops",["b74"],[],["l99","l100","l101","l102","l103"]],["GetBlock",[],["C","main"],["b104"]],["GetLoops",["b104"],[],["l105","l106","l107","l108","l109","l110","l111","l112","l113","l114"]],["DecomposeReduction",["b104","l108"],[],["b115"]]],[[4,[1,1,4,256,2]],[6,[16,2,128,2,1]],[8,[1024,2,4]],[25,2],[31,1],[33,0]]],[2.4064812823333334713,2.4069519856666663493,2.4196844073333330094],{"host":{"keys":["cpu"],"kind":"llvm","mtriple":"x86_64-unknown-linux-gnu","tag":""},"keys":["rocm","gpu"],"kind":"rocm","max_num_threads":256,"max_shared_memory_per_block":49152,"max_threads_per_block":1024,"mcpu":"gfx942","model":"MI300","mtriple":"amdgcn-amd-amdhsa-hcc","tag":"","thread_warp_size":64},[["TENSOR","float16",[2048,8192]],["TENSOR","float16",[8192,8192]],["TENSOR","float16",[2048,8192]]]]]
[0,[[[["GetBlock",[],["C","main"],["b0"]],["GetBlock",[],["root","main"],["b1"]],["Annotate",["b0","\"SSSRRSRS\""],["meta_schedule.tiling_structure"],[]],["GetLoops",["b0"],[],["l2","l3","l4"]],["SamplePerfectTile",["l2"],[5,64],["v5","v6","v7","v8","v9"]],["Split",["l2","v5","v6","v7","v8","v9"],[1,0],["l10","l11","l12","l13","l14"]],["SamplePerfectTile",["l3"],[5,64],["v15","v16","v17","v18","v19"]],["Split",["l3","v15","v16","v17","v18","v19"],[1,0],["l20","l21","l22","l23","l24"]],["SamplePerfectTile",["l4"],[3,64],["v25","v26","v27"]],["Split",["l4","v25","v26","v27"],[1,0],["l28","l29","l30"]],["Reorder",["l10","l20","l11","l21","l12","l22","l28","l29","l13","l23","l30","l14","l24"],[],[]],["Fuse",["l10","l20"],[1],["l31"]],["Bind",["l31"],["blockIdx.x"],[]],["Fuse",["l11","l21"],[1],["l32"]],["Bind",["l32"],["vthread.x"],[]],["Fuse",["l12","l22"],[1],["l33"]],["Bind",["l33"],["threadIdx.x"],[]],["Annotate",["b0",64],["meta_schedule.thread_extent_low_inclusive"],[]],["Annotate",["b0",1024],["meta_schedule.thread_extent_high_inclusive"],[]],["CacheWrite",["b0",[]],[0,"local"],["b34"]],["ReverseComputeAt",["b34","l33"],[1,-1],[]],["CacheRead",["b0",["b0"]],[0,"shared"],["b35"]],["ComputeAt",["b35","l28"],[1,-1],[]],["GetLoops",["b35"],[],["l36","l37","l38","l39","l40","l41"]],["Fuse",["l40","l41"],[1],["l42"]],["SampleCategorical",[],[[1,2,4,8],[0.25,0.25,0.25,0.25]],["v43"]],["Annotate",["b35","v43"],["meta_schedule.cooperative_fetch"],[]],["CacheRead",["b0",["b0"]],[1,"shared"],["b44"]],["ComputeAt",["b44","l28"],[1,-1],[]],["GetLoops",["b44"],[],["l45","l46","l47","l48","l49","l50"]],["Fuse",["l49","l50"],[1],["l51"]],["SampleCategorical",[],[[1,2,4,8],[0.25,0.25,0.25,0.25]],["v52"]],["Annotate",["b44","v52"],["meta_schedule.cooperative_fetch"],[]],["SampleCategorical",[],[[0,16,64,512,1024],[0.2000000000000000111,0.2000000000000000111,0.2000000000000000111,0.2000000000000000111,0.2000000000000000111]],["v53"]],["Annotate",["b1","v53"],["meta_schedule.unroll_explicit"],[]],["EnterPostproc",[],[],[]],["Unannotate",["b35"],["meta_schedule.cooperative_fetch"],[]],["GetLoops",["b35"],[],["l54","l55","l56","l57","l58"]],["Split",["l58","None",128,2],[1,0],["l59","l60","l61"]],["Vectorize",["l61"],[],[]],["Bind",["l60"],["threadIdx.x"],[]],["Unannotate",["b44"],["meta_schedule.cooperative_fetch"],[]],["GetLoops",["b44"],[],["l62","l63","l64","l65","l66"]],["Split",["l66","None",128,8],[1,0],["l67","l68","l69"]],["Vectorize",["l69"],[],[]],["Bind",["l68"],["threadIdx.x"],[]],["GetBlock",[],["root","main"],["b70"]],["Unannotate",["b70"],["meta_schedule.unroll_explicit"],[]],["GetChildBlocks",["b70"],[],["b71","b72","b73","b74"]],["GetLoops",["b71"],[],["l75","l76","l77","l78","l79","l80","l81"]],["GetLoops",["b72"],[],["l82","l83","l84","l85","l86","l87","l88"]],["GetLoops",["b73"],[],["l89","l90","l91","l92","l93","l94","l95","l96","l97","l98"]],["Annotate",["l89",64],["pragma_auto_unroll_max_step"],[]],["Annotate",["l89",1],["pragma_unroll_explicit"],[]],["GetLoops",["b74"],[],["l99","l100","l101","l102","l103"]],["GetBlock",[],["C","main"],["b104"]],["GetLoops",["b104"],[],["l105","l106","l107","l108","l109","l110","l111","l112","l113","l114"]],["DecomposeReduction",["b104","l108"],[],["b115"]]],[[4,[4,2,8,4,8]],[6,[8,1,16,1,64]],[8,[4096,2,1]],[25,1],[31,3],[33,2]]],[1.210184732999999957,1.2119605303333333968,1.210807291666666563],{"host":{"keys":["cpu"],"kind":"llvm","mtriple":"x86_64-unknown-linux-gnu","tag":""},"keys":["rocm","gpu"],"kind":"rocm","max_num_threads":256,"max_shared_memory_per_block":49152,"max_threads_per_block":1024,"mcpu":"gfx942","model":"MI300","mtriple":"amdgcn-amd-amdhsa-hcc","tag":"","thread_warp_size":64},[["TENSOR","float16",[2048,8192]],["TENSOR","float16",[8192,8192]],["TENSOR","float16",[2048,8192]]]]]
[0,[[[["GetBlock",[],["C","main"],["b0"]],["GetBlock",[],["root","main"],["b1"]],["Annotate",["b0","\"SSSRRSRS\""],["meta_schedule.tiling_structure"],[]],["GetLoops",["b0"],[],["l2","l3","l4"]],["SamplePerfectTile",["l2"],[5,64],["v5","v6","v7","v8","v9"]],["Split",["l2","v5","v6","v7","v8","v9"],[1,0],["l10","l11","l12","l13","l14"]],["SamplePerfectTile",["l3"],[5,64],["v15","v16","v17","v18","v19"]],["Split",["l3","v15","v16","v17","v18","v19"],[1,0],["l20","l21","l22","l23","l24"]],["SamplePerfectTile",["l4"],[3,64],["v25","v26","v27"]],["Split",["l4","v25","v26","v27"],[1,0],["l28","l29","l30"]],["Reorder",["l10","l20","l11","l21","l12","l22","l28","l29","l13","l23","l30","l14","l24"],[],[]],["Fuse",["l10","l20"],[1],["l31"]],["Bind",["l31"],["blockIdx.x"],[]],["Fuse",["l11","l21"],[1],["l32"]],["Bind",["l32"],["vthread.x"],[]],["Fuse",["l12","l22"],[1],["l33"]],["Bind",["l33"],["threadIdx.x"],[]],["Annotate",["b0",64],["meta_schedule.thread_extent_low_inclusive"],[]],["Annotate",["b0",1024],["meta_schedule.thread_extent_high_inclusive"],[]],["CacheWrite",["b0",[]],[0,"local"],["b34"]],["ReverseComputeAt",["b34","l33"],[1,-1],[]],["CacheRead",["b0",["b0"]],[0,"shared"],["b35"]],["ComputeAt",["b35","l28"],[1,-1],[]],["GetLoops",["b35"],[],["l36","l37","l38","l39","l40","l41"]],["Fuse",["l40","l41"],[1],["l42"]],["SampleCategorical",[],[[1,2,4,8],[0.25,0.25,0.25,0.25]],["v43"]],["Annotate",["b35","v43"],["meta_schedule.cooperative_fetch"],[]],["CacheRead",["b0",["b0"]],[1,"shared"],["b44"]],["ComputeAt",["b44","l28"],[1,-1],[]],["GetLoops",["b44"],[],["l45","l46","l47","l48","l49","l50"]],["Fuse",["l49","l50"],[1],["l51"]],["SampleCategorical",[],[[1,2,4,8],[0.25,0.25,0.25,0.25]],["v52"]],["Annotate",["b44","v52"],["meta_schedule.cooperative_fetch"],[]],["SampleCategorical",[],[[0,16,64,512,1024],[0.2000000000000000111,0.2000000000000000111,0.2000000000000000111,0.2000000000000000111,0.2000000000000000111]],["v53"]],["Annotate",["b1","v53"],["meta_schedule.unroll_explicit"],[]],["EnterPostproc",[],[],[]],["Unannotate",["b35"],["meta_schedule.cooperative_fetch"],[]],["GetLoops",["b35"],[],["l54","l55","l56","l57","l58"]],["Split",["l58","None",128,4],[1,0],["l59","l60","l61"]],["Vectorize",["l61"],[],[]],["Bind",["l60"],["threadIdx.x"],[]],["Unannotate",["b44"],["meta_schedule.cooperative_fetch"],[]],["GetLoops",["b44"],[],["l62","l63","l64","l65","l66"]],["Split",["l66","None",128,8],[1,0],["l67","l68","l69"]],["Vectorize",["l69"],[],[]],["Bind",["l68"],["threadIdx.x"],[]],["GetBlock",[],["root","main"],["b70"]],["Unannotate",["b70"],["meta_schedule.unroll_explicit"],[]],["GetChildBlocks",["b70"],[],["b71","b72","b73","b74"]],["GetLoops",["b71"],[],["l75","l76","l77","l78","l79","l80","l81"]],["GetLoops",["b72"],[],["l82","l83","l84","l85","l86","l87","l88"]],["GetLoops",["b73"],[],["l89","l90","l91","l92","l93","l94","l95","l96","l97","l98"]],["Annotate",["l89",64],["pragma_auto_unroll_max_step"],[]],["Annotate",["l89",1],["pragma_unroll_explicit"],[]],["GetLoops",["b74"],[],["l99","l100","l101","l102","l103"]],["GetBlock",[],["C","main"],["b104"]],["GetLoops",["b104"],[],["l105","l106","l107","l108","l109","l110","l111","l112","l113","l114"]],["DecomposeReduction",["b104","l108"],[],["b115"]]],[[4,[4,4,8,4,4]],[6,[16,1,16,1,32]],[8,[4096,2,1]],[25,2],[31,3],[33,2]]],[0.30886840799999998319,0.30841208900000000037,0.30934010800000000252],{"host":{"keys":["cpu"],"kind":"llvm","mtriple":"x86_64-unknown-linux-gnu","tag":""},"keys":["rocm","gpu"],"kind":"rocm","max_num_threads":256,"max_shared_memory_per_block":49152,"max_threads_per_block":1024,"mcpu":"gfx942","model":"MI300","mtriple":"amdgcn-amd-amdhsa-hcc","tag":"","thread_warp_size":64},[["TENSOR","float16",[2048,8192]],["TENSOR","float16",[8192,8192]],["TENSOR","float16",[2048,8192]]]]]
[0,[[[["GetBlock",[],["C","main"],["b0"]],["GetBlock",[],["root","main"],["b1"]],["Annotate",["b0","\"SSSRRSRS\""],["meta_schedule.tiling_structure"],[]],["GetLoops",["b0"],[],["l2","l3","l4"]],["SamplePerfectTile",["l2"],[5,64],["v5","v6","v7","v8","v9"]],["Split",["l2","v5","v6","v7","v8","v9"],[1,0],["l10","l11","l12","l13","l14"]],["SamplePerfectTile",["l3"],[5,64],["v15","v16","v17","v18","v19"]],["Split",["l3","v15","v16","v17","v18","v19"],[1,0],["l20","l21","l22","l23","l24"]],["SamplePerfectTile",["l4"],[3,64],["v25","v26","v27"]],["Split",["l4","v25","v26","v27"],[1,0],["l28","l29","l30"]],["Reorder",["l10","l20","l11","l21","l12","l22","l28","l29","l13","l23","l30","l14","l24"],[],[]],["Fuse",["l10","l20"],[1],["l31"]],["Bind",["l31"],["blockIdx.x"],[]],["Fuse",["l11","l21"],[1],["l32"]],["Bind",["l32"],["vthread.x"],[]],["Fuse",["l12","l22"],[1],["l33"]],["Bind",["l33"],["threadIdx.x"],[]],["Annotate",["b0",64],["meta_schedule.thread_extent_low_inclusive"],[]],["Annotate",["b0",1024],["meta_schedule.thread_extent_high_inclusive"],[]],["CacheWrite",["b0",[]],[0,"local"],["b34"]],["ReverseComputeAt",["b34","l33"],[1,-1],[]],["CacheRead",["b0",["b0"]],[0,"shared"],["b35"]],["ComputeAt",["b35","l28"],[1,-1],[]],["GetLoops",["b35"],[],["l36","l37","l38","l39","l40","l41"]],["Fuse",["l40","l41"],[1],["l42"]],["SampleCategorical",[],[[1,2,4,8],[0.25,0.25,0.25,0.25]],["v43"]],["Annotate",["b35","v43"],["meta_schedule.cooperative_fetch"],[]],["CacheRead",["b0",["b0"]],[1,"shared"],["b44"]],["ComputeAt",["b44","l28"],[1,-1],[]],["GetLoops",["b44"],[],["l45","l46","l47","l48","l49","l50"]],["Fuse",["l49","l50"],[1],["l51"]],["SampleCategorical",[],[[1,2,4,8],[0.25,0.25,0.25,0.25]],["v52"]],["Annotate",["b44","v52"],["meta_schedule.cooperative_fetch"],[]],["SampleCategorical",[],[[0,16,64,512,1024],[0.2000000000000000111,0.2000000000000000111,0.2000000000000000111,0.2000000000000000111,0.2000000000000000111]],["v53"]],["Annotate",["b1","v53"],["meta_schedule.unroll_explicit"],[]],["EnterPostproc",[],[],[]],["Unannotate",["b35"],["meta_schedule.cooperative_fetch"],[]],["GetLoops",["b35"],[],["l54","l55","l56","l57","l58"]],["Split",["l58","None",128,2],[1,0],["l59","l60","l61"]],["Vectorize",["l61"],[],[]],["Bind",["l60"],["threadIdx.x"],[]],["Unannotate",["b44"],["meta_schedule.cooperative_fetch"],[]],["GetLoops",["b44"],[],["l62","l63","l64","l65","l66"]],["Split",["l66","None",128,2],[1,0],["l67","l68","l69"]],["Vectorize",["l69"],[],[]],["Bind",["l68"],["threadIdx.x"],[]],["GetBlock",[],["root","main"],["b70"]],["Unannotate",["b70"],["meta_schedule.unroll_explicit"],[]],["GetChildBlocks",["b70"],[],["b71","b72","b73","b74"]],["GetLoops",["b71"],[],["l75","l76","l77","l78","l79","l80","l81"]],["GetLoops",["b72"],[],["l82","l83","l84","l85","l86","l87","l88"]],["GetLoops",["b73"],[],["l89","l90","l91","l92","l93","l94","l95","l96","l97","l98"]],["GetLoops",["b74"],[],["l99","l100","l101","l102","l103"]],["GetBlock",[],["C","main"],["b104"]],["GetLoops",["b104"],[],["l105","l106","l107","l108","l109","l110","l111","l112","l113","l114"]],["DecomposeReduction",["b104","l108"],[],["b115"]]],[[4,[4,1,64,8,1]],[6,[8,2,2,8,32]],[8,[1024,1,8]],[25,1],[31,1],[33,0]]],[1.3426659340000000054,1.3422228190000000669,1.3449400226666667901],{"host":{"keys":["cpu"],"kind":"llvm","mtriple":"x86_64-unknown-linux-gnu","tag":""},"keys":["rocm","gpu"],"kind":"rocm","max_num_threads":256,"max_shared_memory_per_block":49152,"max_threads_per_block":1024,"mcpu":"gfx942","model":"MI300","mtriple":"amdgcn-amd-amdhsa-hcc","tag":"","thread_warp_size":64},[["TENSOR","float16",[2048,8192]],["TENSOR","float16",[8192,8192]],["TENSOR","float16",[2048,8192]]]]]
[0,[[[["GetBlock",[],["C","main"],["b0"]],["GetBlock",[],["root","main"],["b1"]],["Annotate",["b0","\"SSSRRSRS\""],["meta_schedule.tiling_structure"],[]],["GetLoops",["b0"],[],["l2","l3","l4"]],["SamplePerfectTile",["l2"],[5,64],["v5","v6","v7","v8","v9"]],["Split",["l2","v5","v6","v7","v8","v9"],[1,0],["l10","l11","l12","l13","l14"]],["SamplePerfectTile",["l3"],[5,64],["v15","v16","v17","v18","v19"]],["Split",["l3","v15","v16","v17","v18","v19"],[1,0],["l20","l21","l22","l23","l24"]],["SamplePerfectTile",["l4"],[3,64],["v25","v26","v27"]],["Split",["l4","v25","v26","v27"],[1,0],["l28","l29","l30"]],["Reorder",["l10","l20","l11","l21","l12","l22","l28","l29","l13","l23","l30","l14","l24"],[],[]],["Fuse",["l10","l20"],[1],["l31"]],["Bind",["l31"],["blockIdx.x"],[]],["Fuse",["l11","l21"],[1],["l32"]],["Bind",["l32"],["vthread.x"],[]],["Fuse",["l12","l22"],[1],["l33"]],["Bind",["l33"],["threadIdx.x"],[]],["Annotate",["b0",64],["meta_schedule.thread_extent_low_inclusive"],[]],["Annotate",["b0",1024],["meta_schedule.thread_extent_high_inclusive"],[]],["CacheWrite",["b0",[]],[0,"local"],["b34"]],["ReverseComputeAt",["b34","l33"],[1,-1],[]],["CacheRead",["b0",["b0"]],[0,"shared"],["b35"]],["ComputeAt",["b35","l28"],[1,-1],[]],["GetLoops",["b35"],[],["l36","l37","l38","l39","l40","l41"]],["Fuse",["l40","l41"],[1],["l42"]],["SampleCategorical",[],[[1,2,4,8],[0.25,0.25,0.25,0.25]],["v43"]],["Annotate",["b35","v43"],["meta_schedule.cooperative_fetch"],[]],["CacheRead",["b0",["b0"]],[1,"shared"],["b44"]],["ComputeAt",["b44","l28"],[1,-1],[]],["GetLoops",["b44"],[],["l45","l46","l47","l48","l49","l50"]],["Fuse",["l49","l50"],[1],["l51"]],["SampleCategorical",[],[[1,2,4,8],[0.25,0.25,0.25,0.25]],["v52"]],["Annotate",["b44","v52"],["meta_schedule.cooperative_fetch"],[]],["SampleCategorical",[],[[0,16,64,512,1024],[0.2000000000000000111,0.2000000000000000111,0.2000000000000000111,0.2000000000000000111,0.2000000000000000111]],["v53"]],["Annotate",["b1","v53"],["meta_schedule.unroll_explicit"],[]],["EnterPostproc",[],[],[]],["Unannotate",["b35"],["meta_schedule.cooperative_fetch"],[]],["GetLoops",["b35"],[],["l54","l55","l56","l57","l58"]],["Split",["l58","None",512,2],[1,0],["l59","l60","l61"]],["Vectorize",["l61"],[],[]],["Bind",["l60"],["threadIdx.x"],[]],["Unannotate",["b44"],["meta_schedule.cooperative_fetch"],[]],["GetLoops",["b44"],[],["l62","l63","l64","l65","l66"]],["Split",["l66","None",512,4],[1,0],["l67","l68","l69"]],["Vectorize",["l69"],[],[]],["Bind",["l68"],["threadIdx.x"],[]],["GetBlock",[],["root","main"],["b70"]],["Unannotate",["b70"],["meta_schedule.unroll_explicit"],[]],["GetChildBlocks",["b70"],[],["b71","b72","b73","b74"]],["GetLoops",["b71"],[],["l75","l76","l77","l78","l79","l80","l81"]],["GetLoops",["b72"],[],["l82","l83","l84","l85","l86","l87","l88"]],["GetLoops",["b73"],[],["l89","l90","l91","l92","l93","l94","l95","l96","l97","l98"]],["GetLoops",["b74"],[],["l99","l100","l101","l102","l103"]],["GetBlock",[],["C","main"],["b104"]],["GetLoops",["b104"],[],["l105","l106","l107","l108","l109","l110","l111","l112","l113","l114"]],["DecomposeReduction",["b104","l108"],[],["b115"]]],[[4,[1,4,32,2,8]],[6,[32,16,16,1,1]],[8,[1024,2,4]],[25,1],[31,2],[33,0]]],[1.0610515950000001251,1.0604986163333334215,1.060579508333333365],{"host":{"keys":["cpu"],"kind":"llvm","mtriple":"x86_64-unknown-linux-gnu","tag":""},"keys":["rocm","gpu"],"kind":"rocm","max_num_threads":256,"max_shared_memory_per_block":49152,"max_threads_per_block":1024,"mcpu":"gfx942","model":"MI300","mtriple":"amdgcn-amd-amdhsa-hcc","tag":"","thread_warp_size":64},[["TENSOR","float16",[2048,8192]],["TENSOR","float16",[8192,8192]],["TENSOR","float16",[2048,8192]]]]]
