demo_artifacts/logs/mm_ansor/log_642_4096_14336.json
{"i": [["[\"ansor_mm\", 642, 4096, 14336, \"float16\"]", "rocm -keys=rocm,gpu -max_num_threads=256 -max_shared_memory_per_block=49152 -max_threads_per_block=1024 -mcpu=gfx942 -model=unknown -mtriple=amdgcn-amd-amdhsa-hcc -thread_warp_size=64", [-1, 16, 64, 65536, 2147483647, 1024, 16, 64], "llvm -keys=cpu -mtriple=x86_64-unknown-linux-gnu", 0, []], [[], [["CHW", 2, "local"], ["SP", 2, 0, 642, [1, 642, 1, 1], 1], ["SP", 2, 5, 4096, [1, 1, 256, 2], 1], ["SP", 2, 10, 14336, [2, 1], 1], ["RE", 2, [0, 5, 1, 6, 2, 7, 10, 11, 3, 8, 12, 4, 9]], ["FSP", 3, 0, 1, 3], ["FSP", 3, 4, 2, 3], ["RE", 3, [0, 4, 1, 5, 2, 6, 3, 7]], ["CA", 2, 3, 5], ["CHR", 1, "shared", [2]], ["CA", 2, 3, 6], ["CHR", 0, "shared", [3]], ["CA", 1, 4, 6], ["FU", 5, [0, 1]], ["AN", 5, 0, 5], ["FU", 5, [1, 2]], ["AN", 5, 1, 4], ["FU", 5, [2, 3]], ["AN", 5, 2, 6], ["FU", 3, [0, 1]], ["SP", 3, 0, 7168, [1], 1], ["AN", 3, 1, 2], ["FFSP", 3, 0, [2, 1], 1, 1], ["AN", 3, 1, 6], ["FU", 1, [0, 1]], ["SP", 1, 0, 14, [1], 1], ["AN", 1, 1, 2], ["FFSP", 1, 0, [2, 1], 1, 1], ["AN", 1, 1, 6], ["PR", 4, 0, "auto_unroll_max_step$1024"]]]], "r": [[0.610215, 0.610297, 0.610181], 0, 24.3965, 1759455265], "v": "v0.6"}
{"i": [["[\"ansor_mm\", 642, 4096, 14336, \"float16\"]", "rocm -keys=rocm,gpu -max_num_threads=256 -max_shared_memory_per_block=49152 -max_threads_per_block=1024 -mcpu=gfx942 -model=unknown -mtriple=amdgcn-amd-amdhsa-hcc -thread_warp_size=64", [-1, 16, 64, 65536, 2147483647, 1024, 16, 64], "llvm -keys=cpu -mtriple=x86_64-unknown-linux-gnu", 0, []], [[], [["CHW", 2, "local"], ["SP", 2, 0, 642, [1, 107, 1, 1], 1], ["SP", 2, 5, 4096, [1, 1, 16, 1], 1], ["SP", 2, 10, 14336, [16, 8], 1], ["RE", 2, [0, 5, 1, 6, 2, 7, 10, 11, 3, 8, 12, 4, 9]], ["FSP", 3, 0, 1, 3], ["FSP", 3, 4, 2, 3], ["RE", 3, [0, 4, 1, 5, 2, 6, 3, 7]], ["CA", 2, 3, 5], ["CHR", 1, "shared", [2]], ["CA", 2, 3, 6], ["CHR", 0, "shared", [3]], ["CA", 1, 4, 6], ["FU", 5, [0, 1]], ["AN", 5, 0, 5], ["FU", 5, [1, 2]], ["AN", 5, 1, 4], ["FU", 5, [2, 3]], ["AN", 5, 2, 6], ["FU", 3, [0, 1]], ["SP", 3, 0, 2048, [1], 1], ["AN", 3, 1, 2], ["FFSP", 3, 0, [2, 1], 1, 1], ["AN", 3, 1, 6], ["FU", 1, [0, 1]], ["SP", 1, 0, 128, [1], 1], ["AN", 1, 1, 2], ["FFSP", 1, 0, [2, 1], 1, 1], ["AN", 1, 1, 6], ["PR", 4, 0, "auto_unroll_max_step$1024"]]]], "r": [[0.0208762, 0.0208639, 0.0208689], 0, 5.80452, 1759455268], "v": "v0.6"}
{"i": [["[\"ansor_mm\", 642, 4096, 14336, \"float16\"]", "rocm -keys=rocm,gpu -max_num_threads=256 -max_shared_memory_per_block=49152 -max_threads_per_block=1024 -mcpu=gfx942 -model=unknown -mtriple=amdgcn-amd-amdhsa-hcc -thread_warp_size=64", [-1, 16, 64, 65536, 2147483647, 1024, 16, 64], "llvm -keys=cpu -mtriple=x86_64-unknown-linux-gnu", 0, []], [[], [["CHW", 2, "local"], ["SP", 2, 0, 642, [1, 107, 3, 2], 1], ["SP", 2, 5, 4096, [16, 2, 1, 32], 1], ["SP", 2, 10, 14336, [1, 1], 1], ["RE", 2, [0, 5, 1, 6, 2, 7, 10, 11, 3, 8, 12, 4, 9]], ["FSP", 3, 0, 1, 3], ["FSP", 3, 4, 2, 3], ["RE", 3, [0, 4, 1, 5, 2, 6, 3, 7]], ["CA", 2, 3, 5], ["CHR", 1, "shared", [2]], ["CA", 2, 3, 6], ["CHR", 0, "shared", [3]], ["CA", 1, 4, 6], ["FU", 5, [0, 1]], ["AN", 5, 0, 5], ["FU", 5, [1, 2]], ["AN", 5, 1, 4], ["FU", 5, [2, 3]], ["AN", 5, 2, 6], ["FU", 3, [0, 1]], ["SP", 3, 0, 256, [1], 1], ["AN", 3, 1, 2], ["FFSP", 3, 0, [2, 1], 1, 1], ["AN", 3, 1, 6], ["FU", 1, [0, 1]], ["SP", 1, 0, 48, [1], 1], ["AN", 1, 1, 2], ["FFSP", 1, 0, [2, 1], 1, 1], ["AN", 1, 1, 6], ["PR", 4, 0, "auto_unroll_max_step$64"]]]], "r": [[2.46879, 2.46615, 2.4579], 0, 84.6041, 1759455346], "v": "v0.6"}
{"i": [["[\"ansor_mm\", 642, 4096, 14336, \"float16\"]", "rocm -keys=rocm,gpu -max_num_threads=256 -max_shared_memory_per_block=49152 -max_threads_per_block=1024 -mcpu=gfx942 -model=unknown -mtriple=amdgcn-amd-amdhsa-hcc -thread_warp_size=64", [-1, 16, 64, 65536, 2147483647, 1024, 16, 64], "llvm -keys=cpu -mtriple=x86_64-unknown-linux-gnu", 0, []], [[], [["CHW", 2, "local"], ["SP", 2, 0, 642, [3, 1, 107, 1], 1], ["SP", 2, 5, 4096, [2, 64, 2, 1], 1], ["SP", 2, 10, 14336, [4, 7], 1], ["RE", 2, [0, 5, 1, 6, 2, 7, 10, 11, 3, 8, 12, 4, 9]], ["FSP", 3, 0, 1, 3], ["FSP", 3, 4, 2, 3], ["RE", 3, [0, 4, 1, 5, 2, 6, 3, 7]], ["CA", 2, 3, 5], ["CHR", 1, "shared", [2]], ["CA", 2, 3, 6], ["CHR", 0, "shared", [3]], ["CA", 1, 4, 6], ["FU", 5, [0, 1]], ["AN", 5, 0, 5], ["FU", 5, [1, 2]], ["AN", 5, 1, 4], ["FU", 5, [2, 3]], ["AN", 5, 2, 6], ["FU", 3, [0, 1]], ["SP", 3, 0, 56, [1], 1], ["AN", 3, 1, 2], ["FFSP", 3, 0, [2, 1], 1, 1], ["AN", 3, 1, 6], ["FU", 1, [0, 1]], ["SP", 1, 0, 2996, [7], 1], ["AN", 1, 1, 2], ["FFSP", 1, 0, [2, 1], 1, 1], ["AN", 1, 1, 6], ["PR", 4, 0, "auto_unroll_max_step$1024"]]]], "r": [[0.218249, 0.218469, 0.218069], 0, 11.9002, 1759455355], "v": "v0.6"}
{"i": [["[\"ansor_mm\", 642, 4096, 14336, \"float16\"]", "rocm -keys=rocm,gpu -max_num_threads=256 -max_shared_memory_per_block=49152 -max_threads_per_block=1024 -mcpu=gfx942 -model=unknown -mtriple=amdgcn-amd-amdhsa-hcc -thread_warp_size=64", [-1, 16, 64, 65536, 2147483647, 1024, 16, 64], "llvm -keys=cpu -mtriple=x86_64-unknown-linux-gnu", 0, []], [[], [["CHW", 2, "local"], ["SP", 2, 0, 642, [3, 1, 107, 1], 1], ["SP", 2, 5, 4096, [2, 512, 2, 2], 1], ["SP", 2, 10, 14336, [1, 7], 1], ["RE", 2, [0, 5, 1, 6, 2, 7, 10, 11, 3, 8, 12, 4, 9]], ["FSP", 3, 0, 1, 3], ["FSP", 3, 4, 2, 3], ["RE", 3, [0, 4, 1, 5, 2, 6, 3, 7]], ["CA", 2, 3, 5], ["CHR", 1, "shared", [2]], ["CA", 2, 3, 6], ["CHR", 0, "shared", [3]], ["CA", 1, 4, 6], ["FU", 5, [0, 1]], ["AN", 5, 0, 5], ["FU", 5, [1, 2]], ["AN", 5, 1, 4], ["FU", 5, [2, 3]], ["AN", 5, 2, 6], ["FU", 3, [0, 1]], ["SP", 3, 0, 56, [4], 1], ["AN", 3, 1, 2], ["FFSP", 3, 0, [2, 1], 1, 1], ["AN", 3, 1, 6], ["FU", 1, [0, 1]], ["SP", 1, 0, 749, [1], 1], ["AN", 1, 1, 2], ["FFSP", 1, 0, [2, 1], 1, 1], ["AN", 1, 1, 6], ["PR", 4, 0, "auto_unroll_max_step$1024"]]]], "r": [[0.458136, 0.458208, 0.458248], 0, 19.1504, 1759455371], "v": "v0.6"}
{"i": [["[\"ansor_mm\", 642, 4096, 14336, \"float16\"]", "rocm -keys=rocm,gpu -max_num_threads=256 -max_shared_memory_per_block=49152 -max_threads_per_block=1024 -mcpu=gfx942 -model=unknown -mtriple=amdgcn-amd-amdhsa-hcc -thread_warp_size=64", [-1, 16, 64, 65536, 2147483647, 1024, 16, 64], "llvm -keys=cpu -mtriple=x86_64-unknown-linux-gnu", 0, []], [[], [["CHW", 2, "local"], ["SP", 2, 0, 642, [1, 214, 1, 3], 1], ["SP", 2, 5, 4096, [4, 1, 128, 1], 1], ["SP", 2, 10, 14336, [1, 28], 1], ["RE", 2, [0, 5, 1, 6, 2, 7, 10, 11, 3, 8, 12, 4, 9]], ["FSP", 3, 0, 1, 3], ["FSP", 3, 4, 2, 3], ["RE", 3, [0, 4, 1, 5, 2, 6, 3, 7]], ["CA", 2, 3, 5], ["CHR", 1, "shared", [2]], ["CA", 2, 3, 6], ["CHR", 0, "shared", [3]], ["CA", 1, 4, 6], ["FU", 5, [0, 1]], ["AN", 5, 0, 5], ["FU", 5, [1, 2]], ["AN", 5, 1, 4], ["FU", 5, [2, 3]], ["AN", 5, 2, 6], ["FU", 3, [0, 1]], ["SP", 3, 0, 3584, [1], 1], ["AN", 3, 1, 2], ["FFSP", 3, 0, [2, 1], 1, 1], ["AN", 3, 1, 6], ["FU", 1, [0, 1]], ["SP", 1, 0, 84, [1], 1], ["AN", 1, 1, 2], ["FFSP", 1, 0, [2, 1], 1, 1], ["AN", 1, 1, 6], ["PR", 4, 0, "auto_unroll_max_step$1024"]]]], "r": [[0.226548, 0.225763, 0.226986], 0, 12.8005, 1759455380], "v": "v0.6"}
{"i": [["[\"ansor_mm\", 642, 4096, 14336, \"float16\"]", "rocm -keys=rocm,gpu -max_num_threads=256 -max_shared_memory_per_block=49152 -max_threads_per_block=1024 -mcpu=gfx942 -model=unknown -mtriple=amdgcn-amd-amdhsa-hcc -thread_warp_size=64", [-1, 16, 64, 65536, 2147483647, 1024, 16, 64], "llvm -keys=cpu -mtriple=x86_64-unknown-linux-gnu", 0, []], [[], [["CHW", 2, "local"], ["SP", 2, 0, 642, [6, 107, 1, 1], 1], ["SP", 2, 5, 4096, [2, 8, 2, 1], 1], ["SP", 2, 10, 14336, [1, 14], 1], ["RE", 2, [0, 5, 1, 6, 2, 7, 10, 11, 3, 8, 12, 4, 9]], ["FSP", 3, 0, 1, 3], ["FSP", 3, 4, 2, 3], ["RE", 3, [0, 4, 1, 5, 2, 6, 3, 7]], ["CA", 2, 3, 5], ["CHR", 1, "shared", [2]], ["CA", 2, 3, 6], ["CHR", 0, "shared", [3]], ["CA", 1, 4, 6], ["FU", 5, [0, 1]], ["AN", 5, 0, 5], ["FU", 5, [1, 2]], ["AN", 5, 1, 4], ["FU", 5, [2, 3]], ["AN", 5, 2, 6], ["FU", 3, [0, 1]], ["SP", 3, 0, 28, [1], 1], ["AN", 3, 1, 2], ["FFSP", 3, 0, [2, 1], 1, 1], ["AN", 3, 1, 6], ["FU", 1, [0, 1]], ["SP", 1, 0, 14, [2], 1], ["AN", 1, 1, 2], ["FFSP", 1, 0, [2, 1], 1, 1], ["AN", 1, 1, 6], ["PR", 4, 0, "auto_unroll_max_step$64"]]]], "r": [[0.00877432, 0.00877439, 0.00877335], 0, 5.1977, 1759455383], "v": "v0.6"}
{"i": [["[\"ansor_mm\", 642, 4096, 14336, \"float16\"]", "rocm -keys=rocm,gpu -max_num_threads=256 -max_shared_memory_per_block=49152 -max_threads_per_block=1024 -mcpu=gfx942 -model=unknown -mtriple=amdgcn-amd-amdhsa-hcc -thread_warp_size=64", [-1, 16, 64, 65536, 2147483647, 1024, 16, 64], "llvm -keys=cpu -mtriple=x86_64-unknown-linux-gnu", 0, []], [[], [["CHW", 2, "local"], ["SP", 2, 0, 642, [2, 107, 1, 3], 1], ["SP", 2, 5, 4096, [2, 8, 2, 1], 1], ["SP", 2, 10, 14336, [4, 1], 1], ["RE", 2, [0, 5, 1, 6, 2, 7, 10, 11, 3, 8, 12, 4, 9]], ["FSP", 3, 0, 1, 3], ["FSP", 3, 4, 2, 3], ["RE", 3, [0, 4, 1, 5, 2, 6, 3, 7]], ["CA", 2, 3, 5], ["CHR", 1, "shared", [2]], ["CA", 2, 3, 6], ["CHR", 0, "shared", [3]], ["CA", 1, 4, 6], ["FU", 5, [0, 1]], ["AN", 5, 0, 5], ["FU", 5, [1, 2]], ["AN", 5, 1, 4], ["FU", 5, [2, 3]], ["AN", 5, 2, 6], ["FU", 3, [0, 1]], ["SP", 3, 0, 32, [2], 1], ["AN", 3, 1, 2], ["FFSP", 3, 0, [2, 1], 1, 1], ["AN", 3, 1, 6], ["FU", 1, [0, 1]], ["SP", 1, 0, 48, [48], 1], ["AN", 1, 1, 2], ["FFSP", 1, 0, [2, 1], 1, 1], ["AN", 1, 1, 6], ["PR", 4, 0, "auto_unroll_max_step$16"]]]], "r": [[0.0285053, 0.0284946, 0.0285009], 0, 5.57125, 1759455386], "v": "v0.6"}
{"i": [["[\"ansor_mm\", 642, 4096, 14336, \"float16\"]", "rocm -keys=rocm,gpu -max_num_threads=256 -max_shared_memory_per_block=49152 -max_threads_per_block=1024 -mcpu=gfx942 -model=unknown -mtriple=amdgcn-amd-amdhsa-hcc -thread_warp_size=64", [-1, 16, 64, 65536, 2147483647, 1024, 16, 64], "llvm -keys=cpu -mtriple=x86_64-unknown-linux-gnu", 0, []], [[], [["CHW", 2, "local"], ["SP", 2, 0, 642, [3, 107, 2, 1], 1], ["SP", 2, 5, 4096, [2, 2, 32, 4], 1], ["SP", 2, 10, 14336, [1, 2], 1], ["RE", 2, [0, 5, 1, 6, 2, 7, 10, 11, 3, 8, 12, 4, 9]], ["FSP", 3, 0, 1, 3], ["FSP", 3, 4, 2, 3], ["RE", 3, [0, 4, 1, 5, 2, 6, 3, 7]], ["CA", 2, 3, 5], ["CHR", 1, "shared", [2]], ["CA", 2, 3, 6], ["CHR", 0, "shared", [3]], ["CA", 1, 4, 6], ["FU", 5, [0, 1]], ["AN", 5, 0, 5], ["FU", 5, [1, 2]], ["AN", 5, 1, 4], ["FU", 5, [2, 3]], ["AN", 5, 2, 6], ["FU", 3, [0, 1]], ["SP", 3, 0, 256, [1], 1], ["AN", 3, 1, 2], ["FFSP", 3, 0, [2, 1], 1, 1], ["AN", 3, 1, 6], ["FU", 1, [0, 1]], ["SP", 1, 0, 2, [1], 1], ["AN", 1, 1, 2], ["FFSP", 1, 0, [2, 1], 1, 1], ["AN", 1, 1, 6], ["PR", 4, 0, "auto_unroll_max_step$512"]]]], "r": [[0.370465, 0.369483, 0.368253], 0, 16.453, 1759455399], "v": "v0.6"}
{"i": [["[\"ansor_mm\", 642, 4096, 14336, \"float16\"]", "rocm -keys=rocm,gpu -max_num_threads=256 -max_shared_memory_per_block=49152 -max_threads_per_block=1024 -mcpu=gfx942 -model=unknown -mtriple=amdgcn-amd-amdhsa-hcc -thread_warp_size=64", [-1, 16, 64, 65536, 2147483647, 1024, 16, 64], "llvm -keys=cpu -mtriple=x86_64-unknown-linux-gnu", 0, []], [[], [["CHW", 2, "local"], ["SP", 2, 0, 642, [1, 107, 2, 3], 1], ["SP", 2, 5, 4096, [4, 1, 128, 1], 1], ["SP", 2, 10, 14336, [1, 28], 1], ["RE", 2, [0, 5, 1, 6, 2, 7, 10, 11, 3, 8, 12, 4, 9]], ["FSP", 3, 0, 1, 3], ["FSP", 3, 4, 2, 3], ["RE", 3, [0, 4, 1, 5, 2, 6, 3, 7]], ["CA", 2, 3, 5], ["CHR", 1, "shared", [2]], ["CA", 2, 3, 6], ["CHR", 0, "shared", [3]], ["CA", 1, 4, 6], ["FU", 5, [0, 1]], ["AN", 5, 0, 5], ["FU", 5, [1, 2]], ["AN", 5, 1, 4], ["FU", 5, [2, 3]], ["AN", 5, 2, 6], ["FU", 3, [0, 1]], ["SP", 3, 0, 3584, [1], 1], ["AN", 3, 1, 2], ["FFSP", 3, 0, [2, 1], 1, 1], ["AN", 3, 1, 6], ["FU", 1, [0, 1]], ["SP", 1, 0, 84, [3], 1], ["AN", 1, 1, 2], ["FFSP", 1, 0, [2, 1], 1, 1], ["AN", 1, 1, 6], ["PR", 4, 0, "auto_unroll_max_step$1024"]]]], "r": [[0.454418, 0.455646, 0.452426], 0, 20.7001, 1759455415], "v": "v0.6"}
{"i": [["[\"ansor_mm\", 642, 4096, 14336, \"float16\"]", "rocm -keys=rocm,gpu -max_num_threads=256 -max_shared_memory_per_block=49152 -max_threads_per_block=1024 -mcpu=gfx942 -model=unknown -mtriple=amdgcn-amd-amdhsa-hcc -thread_warp_size=64", [-1, 16, 64, 65536, 2147483647, 1024, 16, 64], "llvm -keys=cpu -mtriple=x86_64-unknown-linux-gnu", 0, []], [[], [["CHW", 2, "local"], ["SP", 2, 0, 642, [2, 107, 1, 3], 1], ["SP", 2, 5, 4096, [2, 8, 2, 4], 1], ["SP", 2, 10, 14336, [4, 4], 1], ["RE", 2, [0, 5, 1, 6, 2, 7, 10, 11, 3, 8, 12, 4, 9]], ["FSP", 3, 0, 1, 3], ["FSP", 3, 4, 2, 3], ["RE", 3, [0, 4, 1, 5, 2, 6, 3, 7]], ["CA", 2, 3, 5], ["CHR", 1, "shared", [2]], ["CA", 2, 3, 6], ["CHR", 0, "shared", [3]], ["CA", 1, 4, 6], ["FU", 5, [0, 1]], ["AN", 5, 0, 5], ["FU", 5, [1, 2]], ["AN", 5, 1, 4], ["FU", 5, [2, 3]], ["AN", 5, 2, 6], ["FU", 3, [0, 1]], ["SP", 3, 0, 32, [1], 1], ["AN", 3, 1, 2], ["FFSP", 3, 0, [2, 1], 1, 1], ["AN", 3, 1, 6], ["FU", 1, [0, 1]], ["SP", 1, 0, 48, [1], 1], ["AN", 1, 1, 2], ["FFSP", 1, 0, [2, 1], 1, 1], ["AN", 1, 1, 6], ["PR", 4, 0, "auto_unroll_max_step$16"]]]], "r": [[0.00750732, 0.00751065, 0.00750787], 0, 5.1847, 1759455418], "v": "v0.6"}
{"i": [["[\"ansor_mm\", 642, 4096, 14336, \"float16\"]", "rocm -keys=rocm,gpu -max_num_threads=256 -max_shared_memory_per_block=49152 -max_threads_per_block=1024 -mcpu=gfx942 -model=unknown -mtriple=amdgcn-amd-amdhsa-hcc -thread_warp_size=64", [-1, 16, 64, 65536, 2147483647, 1024, 16, 64], "llvm -keys=cpu -mtriple=x86_64-unknown-linux-gnu", 0, []], [[], [["CHW", 2, "local"], ["SP", 2, 0, 642, [2, 321, 1, 1], 1], ["SP", 2, 5, 4096, [4, 1, 2, 8], 1], ["SP", 2, 10, 14336, [2, 8], 1], ["RE", 2, [0, 5, 1, 6, 2, 7, 10, 11, 3, 8, 12, 4, 9]], ["FSP", 3, 0, 1, 3], ["FSP", 3, 4, 2, 3], ["RE", 3, [0, 4, 1, 5, 2, 6, 3, 7]], ["CA", 2, 3, 5], ["CHR", 1, "shared", [2]], ["CA", 2, 3, 6], ["CHR", 0, "shared", [3]], ["CA", 1, 4, 6], ["FU", 5, [0, 1]], ["AN", 5, 0, 5], ["FU", 5, [1, 2]], ["AN", 5, 1, 4], ["FU", 5, [2, 3]], ["AN", 5, 2, 6], ["FU", 3, [0, 1]], ["SP", 3, 0, 128, [1], 1], ["AN", 3, 1, 2], ["FFSP", 3, 0, [2, 1], 1, 1], ["AN", 3, 1, 6], ["FU", 1, [0, 1]], ["SP", 1, 0, 16, [8], 1], ["AN", 1, 1, 2], ["FFSP", 1, 0, [2, 1], 1, 1], ["AN", 1, 1, 6], ["PR", 4, 0, "auto_unroll_max_step$16"]]]], "r": [[0.00590633, 0.00590685, 0.00590796], 0, 5.32271, 1759455420], "v": "v0.6"}
{"i": [["[\"ansor_mm\", 642, 4096, 14336, \"float16\"]", "rocm -keys=rocm,gpu -max_num_threads=256 -max_shared_memory_per_block=49152 -max_threads_per_block=1024 -mcpu=gfx942 -model=unknown -mtriple=amdgcn-amd-amdhsa-hcc -thread_warp_size=64", [-1, 16, 64, 65536, 2147483647, 1024, 16, 64], "llvm -keys=cpu -mtriple=x86_64-unknown-linux-gnu", 0, []], [[], [["CHW", 2, "local"], ["SP", 2, 0, 642, [2, 1, 107, 1], 1], ["SP", 2, 5, 4096, [2, 256, 2, 4], 1], ["SP", 2, 10, 14336, [7, 1], 1], ["RE", 2, [0, 5, 1, 6, 2, 7, 10, 11, 3, 8, 12, 4, 9]], ["FSP", 3, 0, 1, 3], ["FSP", 3, 4, 2, 3], ["RE", 3, [0, 4, 1, 5, 2, 6, 3, 7]], ["CA", 2, 3, 5], ["CHR", 1, "shared", [2]], ["CA", 2, 3, 6], ["CHR", 0, "shared", [3]], ["CA", 1, 4, 6], ["FU", 5, [0, 1]], ["AN", 5, 0, 5], ["FU", 5, [1, 2]], ["AN", 5, 1, 4], ["FU", 5, [2, 3]], ["AN", 5, 2, 6], ["FU", 3, [0, 1]], ["SP", 3, 0, 56, [1], 1], ["AN", 3, 1, 2], ["FFSP", 3, 0, [2, 1], 1, 1], ["AN", 3, 1, 6], ["FU", 1, [0, 1]], ["SP", 1, 0, 749, [7], 1], ["AN", 1, 1, 2], ["FFSP", 1, 0, [2, 1], 1, 1], ["AN", 1, 1, 6], ["PR", 4, 0, "auto_unroll_max_step$1024"]]]], "r": [[1.52062, 1.52132, 1.52027], 0, 52.0708, 1759455469], "v": "v0.6"}
{"i": [["[\"ansor_mm\", 642, 4096, 14336, \"float16\"]", "rocm -keys=rocm,gpu -max_num_threads=256 -max_shared_memory_per_block=49152 -max_threads_per_block=1024 -mcpu=gfx942 -model=unknown -mtriple=amdgcn-amd-amdhsa-hcc -thread_warp_size=64", [-1, 16, 64, 65536, 2147483647, 1024, 16, 64], "llvm -keys=cpu -mtriple=x86_64-unknown-linux-gnu", 0, []], [[], [["CHW", 2, "local"], ["SP", 2, 0, 642, [3, 1, 107, 1], 1], ["SP", 2, 5, 4096, [2, 64, 2, 1], 1], ["SP", 2, 10, 14336, [4, 7], 1], ["RE", 2, [0, 5, 1, 6, 2, 7, 10, 11, 3, 8, 12, 4, 9]], ["FSP", 3, 0, 1, 3], ["FSP", 3, 4, 2, 3], ["RE", 3, [0, 4, 1, 5, 2, 6, 3, 7]], ["CA", 2, 3, 5], ["CHR", 1, "shared", [2]], ["CA", 2, 3, 6], ["CHR", 0, "shared", [3]], ["CA", 1, 4, 6], ["FU", 5, [0, 1]], ["AN", 5, 0, 5], ["FU", 5, [1, 2]], ["AN", 5, 1, 4], ["FU", 5, [2, 3]], ["AN", 5, 2, 6], ["FU", 3, [0, 1]], ["SP", 3, 0, 56, [1], 1], ["AN", 3, 1, 2], ["FFSP", 3, 0, [2, 1], 1, 1], ["AN", 3, 1, 6], ["FU", 1, [0, 1]], ["SP", 1, 0, 2996, [2], 1], ["AN", 1, 1, 2], ["FFSP", 1, 0, [2, 1], 1, 1], ["AN", 1, 1, 6], ["PR", 4, 0, "auto_unroll_max_step$1024"]]]], "r": [[0.23167, 0.231584, 0.231876], 0, 12.481, 1759455478], "v": "v0.6"}
{"i": [["[\"ansor_mm\", 642, 4096, 14336, \"float16\"]", "rocm -keys=rocm,gpu -max_num_threads=256 -max_shared_memory_per_block=49152 -max_threads_per_block=1024 -mcpu=gfx942 -model=unknown -mtriple=amdgcn-amd-amdhsa-hcc -thread_warp_size=64", [-1, 16, 64, 65536, 2147483647, 1024, 16, 64], "llvm -keys=cpu -mtriple=x86_64-unknown-linux-gnu", 0, []], [[], [["CHW", 2, "local"], ["SP", 2, 0, 642, [6, 107, 1, 1], 1], ["SP", 2, 5, 4096, [2, 8, 2, 1], 1], ["SP", 2, 10, 14336, [1, 14], 1], ["RE", 2, [0, 5, 1, 6, 2, 7, 10, 11, 3, 8, 12, 4, 9]], ["FSP", 3, 0, 1, 3], ["FSP", 3, 4, 2, 3], ["RE", 3, [0, 4, 1, 5, 2, 6, 3, 7]], ["CA", 2, 3, 5], ["CHR", 1, "shared", [2]], ["CA", 2, 3, 6], ["CHR", 0, "shared", [3]], ["CA", 1, 4, 6], ["FU", 5, [0, 1]], ["AN", 5, 0, 5], ["FU", 5, [1, 2]], ["AN", 5, 1, 4], ["FU", 5, [2, 3]], ["AN", 5, 2, 6], ["FU", 3, [0, 1]], ["SP", 3, 0, 28, [1], 1], ["AN", 3, 1, 2], ["FFSP", 3, 0, [2, 1], 1, 1], ["AN", 3, 1, 6], ["FU", 1, [0, 1]], ["SP", 1, 0, 14, [1], 1], ["AN", 1, 1, 2], ["FFSP", 1, 0, [2, 1], 1, 1], ["AN", 1, 1, 6], ["PR", 4, 0, "auto_unroll_max_step$64"]]]], "r": [[0.00886395, 0.00886111, 0.00886268], 0, 5.26296, 1759455481], "v": "v0.6"}
{"i": [["[\"ansor_mm\", 642, 4096, 14336, \"float16\"]", "rocm -keys=rocm,gpu -max_num_threads=256 -max_shared_memory_per_block=49152 -max_threads_per_block=1024 -mcpu=gfx942 -model=unknown -mtriple=amdgcn-amd-amdhsa-hcc -thread_warp_size=64", [-1, 16, 64, 65536, 2147483647, 1024, 16, 64], "llvm -keys=cpu -mtriple=x86_64-unknown-linux-gnu", 0, []], [[], [["CHW", 2, "local"], ["SP", 2, 0, 642, [1, 107, 1, 6], 1], ["SP", 2, 5, 4096, [1, 4, 16, 2], 1], ["SP", 2, 10, 14336, [32, 1], 1], ["RE", 2, [0, 5, 1, 6, 2, 7, 10, 11, 3, 8, 12, 4, 9]], ["FSP", 3, 0, 1, 3], ["FSP", 3, 4, 2, 3], ["RE", 3, [0, 4, 1, 5, 2, 6, 3, 7]], ["CA", 2, 3, 5], ["CHR", 1, "shared", [2]], ["CA", 2, 3, 6], ["CHR", 0, "shared", [3]], ["CA", 1, 4, 6], ["FU", 5, [0, 1]], ["AN", 5, 0, 5], ["FU", 5, [1, 2]], ["AN", 5, 1, 4], ["FU", 5, [2, 3]], ["AN", 5, 2, 6], ["FU", 3, [0, 1]], ["SP", 3, 0, 64, [1], 1], ["AN", 3, 1, 2], ["FFSP", 3, 0, [2, 1], 1, 1], ["AN", 3, 1, 6], ["FU", 1, [0, 1]], ["SP", 1, 0, 192, [1], 1], ["AN", 1, 1, 2], ["FFSP", 1, 0, [2, 1], 1, 1], ["AN", 1, 1, 6], ["PR", 4, 0, "auto_unroll_max_step$16"]]]], "r": [[0.0116653, 0.0116737, 0.0116634], 0, 5.14788, 1759455483], "v": "v0.6"}
{"i": [["[\"ansor_mm\", 642, 4096, 14336, \"float16\"]", "rocm -keys=rocm,gpu -max_num_threads=256 -max_shared_memory_per_block=49152 -max_threads_per_block=1024 -mcpu=gfx942 -model=unknown -mtriple=amdgcn-amd-amdhsa-hcc -thread_warp_size=64", [-1, 16, 64, 65536, 2147483647, 1024, 16, 64], "llvm -keys=cpu -mtriple=x86_64-unknown-linux-gnu", 0, []], [[], [["CHW", 2, "local"], ["SP", 2, 0, 642, [1, 107, 6, 1], 1], ["SP", 2, 5, 4096, [2, 8, 2, 1], 1], ["SP", 2, 10, 14336, [1, 14], 1], ["RE", 2, [0, 5, 1, 6, 2, 7, 10, 11, 3, 8, 12, 4, 9]], ["FSP", 3, 0, 1, 3], ["FSP", 3, 4, 2, 3], ["RE", 3, [0, 4, 1, 5, 2, 6, 3, 7]], ["CA", 2, 3, 5], ["CHR", 1, "shared", [2]], ["CA", 2, 3, 6], ["CHR", 0, "shared", [3]], ["CA", 1, 4, 6], ["FU", 5, [0, 1]], ["AN", 5, 0, 5], ["FU", 5, [1, 2]], ["AN", 5, 1, 4], ["FU", 5, [2, 3]], ["AN", 5, 2, 6], ["FU", 3, [0, 1]], ["SP", 3, 0, 28, [1], 1], ["AN", 3, 1, 2], ["FFSP", 3, 0, [2, 1], 1, 1], ["AN", 3, 1, 6], ["FU", 1, [0, 1]], ["SP", 1, 0, 14, [1], 1], ["AN", 1, 1, 2], ["FFSP", 1, 0, [2, 1], 1, 1], ["AN", 1, 1, 6], ["PR", 4, 0, "auto_unroll_max_step$64"]]]], "r": [[0.00383782, 0.00383947, 0.00383853], 0, 5.12086, 1759455486], "v": "v0.6"}
{"i": [["[\"ansor_mm\", 642, 4096, 14336, \"float16\"]", "rocm -keys=rocm,gpu -max_num_threads=256 -max_shared_memory_per_block=49152 -max_threads_per_block=1024 -mcpu=gfx942 -model=unknown -mtriple=amdgcn-amd-amdhsa-hcc -thread_warp_size=64", [-1, 16, 64, 65536, 2147483647, 1024, 16, 64], "llvm -keys=cpu -mtriple=x86_64-unknown-linux-gnu", 0, []], [[], [["CHW", 2, "local"], ["SP", 2, 0, 642, [6, 107, 1, 1], 1], ["SP", 2, 5, 4096, [2, 8, 2, 1], 1], ["SP", 2, 10, 14336, [1, 1], 1], ["RE", 2, [0, 5, 1, 6, 2, 7, 10, 11, 3, 8, 12, 4, 9]], ["FSP", 3, 0, 1, 3], ["FSP", 3, 4, 2, 3], ["RE", 3, [0, 4, 1, 5, 2, 6, 3, 7]], ["CA", 2, 3, 5], ["CHR", 1, "shared", [2]], ["CA", 2, 3, 6], ["CHR", 0, "shared", [3]], ["CA", 1, 4, 6], ["FU", 5, [0, 1]], ["AN", 5, 0, 5], ["FU", 5, [1, 2]], ["AN", 5, 1, 4], ["FU", 5, [2, 3]], ["AN", 5, 2, 6], ["FU", 3, [0, 1]], ["SP", 3, 0, 28, [1], 1], ["AN", 3, 1, 2], ["FFSP", 3, 0, [2, 1], 1, 1], ["AN", 3, 1, 6], ["FU", 1, [0, 1]], ["SP", 1, 0, 14, [14], 1], ["AN", 1, 1, 2], ["FFSP", 1, 0, [2, 1], 1, 1], ["AN", 1, 1, 6], ["PR", 4, 0, "auto_unroll_max_step$64"]]]], "r": [[0.0205, 0.0205038, 0.0205066], 0, 5.31269, 1759455488], "v": "v0.6"}
{"i": [["[\"ansor_mm\", 642, 4096, 14336, \"float16\"]", "rocm -keys=rocm,gpu -max_num_threads=256 -max_shared_memory_per_block=49152 -max_threads_per_block=1024 -mcpu=gfx942 -model=unknown -mtriple=amdgcn-amd-amdhsa-hcc -thread_warp_size=64", [-1, 16, 64, 65536, 2147483647, 1024, 16, 64], "llvm -keys=cpu -mtriple=x86_64-unknown-linux-gnu", 0, []], [[], [["CHW", 2, "local"], ["SP", 2, 0, 642, [1, 107, 1, 1], 1], ["SP", 2, 5, 4096, [16, 1, 1, 1], 1], ["SP", 2, 10, 14336, [16, 8], 1], ["RE", 2, [0, 5, 1, 6, 2, 7, 10, 11, 3, 8, 12, 4, 9]], ["FSP", 3, 0, 1, 3], ["FSP", 3, 4, 2, 3], ["RE", 3, [0, 4, 1, 5, 2, 6, 3, 7]], ["CA", 2, 3, 5], ["CHR", 1, "shared", [2]], ["CA", 2, 3, 6], ["CHR", 0, "shared", [3]], ["CA", 1, 4, 6], ["FU", 5, [0, 1]], ["AN", 5, 0, 5], ["FU", 5, [1, 2]], ["AN", 5, 1, 4], ["FU", 5, [2, 3]], ["AN", 5, 2, 6], ["FU", 3, [0, 1]], ["SP", 3, 0, 2048, [2], 1], ["AN", 3, 1, 2], ["FFSP", 3, 0, [2, 1], 1, 1], ["AN", 3, 1, 6], ["FU", 1, [0, 1]], ["SP", 1, 0, 128, [1], 1], ["AN", 1, 1, 2], ["FFSP", 1, 0, [2, 1], 1, 1], ["AN", 1, 1, 6], ["PR", 4, 0, "auto_unroll_max_step$1024"]]]], "r": [[0.0188926, 0.0188988, 0.0189036], 0, 5.80003, 1759455491], "v": "v0.6"}
{"i": [["[\"ansor_mm\", 642, 4096, 14336, \"float16\"]", "rocm -keys=rocm,gpu -max_num_threads=256 -max_shared_memory_per_block=49152 -max_threads_per_block=1024 -mcpu=gfx942 -model=unknown -mtriple=amdgcn-amd-amdhsa-hcc -thread_warp_size=64", [-1, 16, 64, 65536, 2147483647, 1024, 16, 64], "llvm -keys=cpu -mtriple=x86_64-unknown-linux-gnu", 0, []], [[], [["CHW", 2, "local"], ["SP", 2, 0, 642, [2, 107, 1, 3], 1], ["SP", 2, 5, 4096, [2, 8, 2, 1], 1], ["SP", 2, 10, 14336, [4, 1], 1], ["RE", 2, [0, 5, 1, 6, 2, 7, 10, 11, 3, 8, 12, 4, 9]], ["FSP", 3, 0, 1, 3], ["FSP", 3, 4, 2, 3], ["RE", 3, [0, 4, 1, 5, 2, 6, 3, 7]], ["CA", 2, 3, 5], ["CHR", 1, "shared", [2]], ["CA", 2, 3, 6], ["CHR", 0, "shared", [3]], ["CA", 1, 4, 6], ["FU", 5, [0, 1]], ["AN", 5, 0, 5], ["FU", 5, [1, 2]], ["AN", 5, 1, 4], ["FU", 5, [2, 3]], ["AN", 5, 2, 6], ["FU", 3, [0, 1]], ["SP", 3, 0, 32, [1], 1], ["AN", 3, 1, 2], ["FFSP", 3, 0, [2, 1], 1, 1], ["AN", 3, 1, 6], ["FU", 1, [0, 1]], ["SP", 1, 0, 48, [2], 1], ["AN", 1, 1, 2], ["FFSP", 1, 0, [2, 1], 1, 1], ["AN", 1, 1, 6], ["PR", 4, 0, "auto_unroll_max_step$16"]]]], "r": [[0.00532531, 0.00532631, 0.00532842], 0, 5.03605, 1759455493], "v": "v0.6"}
{"i": [["[\"ansor_mm\", 642, 4096, 14336, \"float16\"]", "rocm -keys=rocm,gpu -max_num_threads=256 -max_shared_memory_per_block=49152 -max_threads_per_block=1024 -mcpu=gfx942 -model=unknown -mtriple=amdgcn-amd-amdhsa-hcc -thread_warp_size=64", [-1, 16, 64, 65536, 2147483647, 1024, 16, 64], "llvm -keys=cpu -mtriple=x86_64-unknown-linux-gnu", 0, []], [[], [["CHW", 2, "local"], ["SP", 2, 0, 642, [1, 214, 1, 1], 1], ["SP", 2, 5, 4096, [4, 1, 64, 2], 1], ["SP", 2, 10, 14336, [14, 2], 1], ["RE", 2, [0, 5, 1, 6, 2, 7, 10, 11, 3, 8, 12, 4, 9]], ["FSP", 3, 0, 1, 3], ["FSP", 3, 4, 2, 3], ["RE", 3, [0, 4, 1, 5, 2, 6, 3, 7]], ["CA", 2, 3, 5], ["CHR", 1, "shared", [2]], ["CA", 2, 3, 6], ["CHR", 0, "shared", [3]], ["CA", 1, 4, 6], ["FU", 5, [0, 1]], ["AN", 5, 0, 5], ["FU", 5, [1, 2]], ["AN", 5, 1, 4], ["FU", 5, [2, 3]], ["AN", 5, 2, 6], ["FU", 3, [0, 1]], ["SP", 3, 0, 3584, [1], 1], ["AN", 3, 1, 2], ["FFSP", 3, 0, [2, 1], 1, 1], ["AN", 3, 1, 6], ["FU", 1, [0, 1]], ["SP", 1, 0, 28, [1], 1], ["AN", 1, 1, 2], ["FFSP", 1, 0, [2, 1], 1, 1], ["AN", 1, 1, 6], ["PR", 4, 0, "auto_unroll_max_step$64"]]]], "r": [[0.154842, 0.154747, 0.155513], 0, 9.54589, 1759455500], "v": "v0.6"}
{"i": [["[\"ansor_mm\", 642, 4096, 14336, \"float16\"]", "rocm -keys=rocm,gpu -max_num_threads=256 -max_shared_memory_per_block=49152 -max_threads_per_block=1024 -mcpu=gfx942 -model=unknown -mtriple=amdgcn-amd-amdhsa-hcc -thread_warp_size=64", [-1, 16, 64, 65536, 2147483647, 1024, 16, 64], "llvm -keys=cpu -mtriple=x86_64-unknown-linux-gnu", 0, []], [[], [["CHW", 2, "local"], ["SP", 2, 0, 642, [2, 1, 107, 3], 1], ["SP", 2, 5, 4096, [2, 1, 16, 1], 1], ["SP", 2, 10, 14336, [4, 4], 1], ["RE", 2, [0, 5, 1, 6, 2, 7, 10, 11, 3, 8, 12, 4, 9]], ["FSP", 3, 0, 1, 3], ["FSP", 3, 4, 2, 3], ["RE", 3, [0, 4, 1, 5, 2, 6, 3, 7]], ["CA", 2, 3, 5], ["CHR", 1, "shared", [2]], ["CA", 2, 3, 6], ["CHR", 0, "shared", [3]], ["CA", 1, 4, 6], ["FU", 5, [0, 1]], ["AN", 5, 0, 5], ["FU", 5, [1, 2]], ["AN", 5, 1, 4], ["FU", 5, [2, 3]], ["AN", 5, 2, 6], ["FU", 3, [0, 1]], ["SP", 3, 0, 32, [1], 1], ["AN", 3, 1, 2], ["FFSP", 3, 0, [2, 1], 1, 1], ["AN", 3, 1, 6], ["FU", 1, [0, 1]], ["SP", 1, 0, 48, [1], 1], ["AN", 1, 1, 2], ["FFSP", 1, 0, [2, 1], 1, 1], ["AN", 1, 1, 6], ["PR", 4, 0, "auto_unroll_max_step$16"]]]], "r": [[1.35884, 1.35963, 1.35876], 0, 50.2625, 1759455544], "v": "v0.6"}
{"i": [["[\"ansor_mm\", 642, 4096, 14336, \"float16\"]", "rocm -keys=rocm,gpu -max_num_threads=256 -max_shared_memory_per_block=49152 -max_threads_per_block=1024 -mcpu=gfx942 -model=unknown -mtriple=amdgcn-amd-amdhsa-hcc -thread_warp_size=64", [-1, 16, 64, 65536, 2147483647, 1024, 16, 64], "llvm -keys=cpu -mtriple=x86_64-unknown-linux-gnu", 0, []], [[], [["CHW", 2, "local"], ["SP", 2, 0, 642, [1, 1, 1, 2], 1], ["SP", 2, 5, 4096, [1, 128, 8, 1], 1], ["SP", 2, 10, 14336, [7, 1], 1], ["RE", 2, [0, 5, 1, 6, 2, 7, 10, 11, 3, 8, 12, 4, 9]], ["FSP", 3, 0, 1, 3], ["FSP", 3, 4, 2, 3], ["RE", 3, [0, 4, 1, 5, 2, 6, 3, 7]], ["CA", 2, 3, 5], ["CHR", 1, "shared", [2]], ["CA", 2, 3, 6], ["CHR", 0, "shared", [3]], ["CA", 1, 4, 6], ["FU", 5, [0, 1]], ["AN", 5, 0, 5], ["FU", 5, [1, 2]], ["AN", 5, 1, 4], ["FU", 5, [2, 3]], ["AN", 5, 2, 6], ["FU", 3, [0, 1]], ["SP", 3, 0, 28, [1], 1], ["AN", 3, 1, 2], ["FFSP", 3, 0, [2, 1], 1, 1], ["AN", 3, 1, 6], ["FU", 1, [0, 1]], ["SP", 1, 0, 1498, [7], 1], ["AN", 1, 1, 2], ["FFSP", 1, 0, [2, 1], 1, 1], ["AN", 1, 1, 6], ["PR", 4, 0, "auto_unroll_max_step$1024"]]]], "r": [[0.00864429, 0.00868839, 0.00853917], 0, 5.19629, 1759455547], "v": "v0.6"}
{"i": [["[\"ansor_mm\", 642, 4096, 14336, \"float16\"]", "rocm -keys=rocm,gpu -max_num_threads=256 -max_shared_memory_per_block=49152 -max_threads_per_block=1024 -mcpu=gfx942 -model=unknown -mtriple=amdgcn-amd-amdhsa-hcc -thread_warp_size=64", [-1, 16, 64, 65536, 2147483647, 1024, 16, 64], "llvm -keys=cpu -mtriple=x86_64-unknown-linux-gnu", 0, []], [[], [["CHW", 2, "local"], ["SP", 2, 0, 642, [1, 107, 1, 6], 1], ["SP", 2, 5, 4096, [1, 1, 32, 2], 1], ["SP", 2, 10, 14336, [1, 32], 1], ["RE", 2, [0, 5, 1, 6, 2, 7, 10, 11, 3, 8, 12, 4, 9]], ["FSP", 3, 0, 1, 3], ["FSP", 3, 4, 2, 3], ["RE", 3, [0, 4, 1, 5, 2, 6, 3, 7]], ["CA", 2, 3, 5], ["CHR", 1, "shared", [2]], ["CA", 2, 3, 6], ["CHR", 0, "shared", [3]], ["CA", 1, 4, 6], ["FU", 5, [0, 1]], ["AN", 5, 0, 5], ["FU", 5, [1, 2]], ["AN", 5, 1, 4], ["FU", 5, [2, 3]], ["AN", 5, 2, 6], ["FU", 3, [0, 1]], ["SP", 3, 0, 1024, [1], 1], ["AN", 3, 1, 2], ["FFSP", 3, 0, [2, 1], 1, 1], ["AN", 3, 1, 6], ["FU", 1, [0, 1]], ["SP", 1, 0, 64, [8], 1], ["AN", 1, 1, 2], ["FFSP", 1, 0, [2, 1], 1, 1], ["AN", 1, 1, 6], ["PR", 4, 0, "auto_unroll_max_step$512"]]]], "r": [[0.164532, 0.164523, 0.164477], 0, 11.11, 1759455554], "v": "v0.6"}
{"i": [["[\"ansor_mm\", 642, 4096, 14336, \"float16\"]", "rocm -keys=rocm,gpu -max_num_threads=256 -max_shared_memory_per_block=49152 -max_threads_per_block=1024 -mcpu=gfx942 -model=unknown -mtriple=amdgcn-amd-amdhsa-hcc -thread_warp_size=64", [-1, 16, 64, 65536, 2147483647, 1024, 16, 64], "llvm -keys=cpu -mtriple=x86_64-unknown-linux-gnu", 0, []], [[], [["CHW", 2, "local"], ["SP", 2, 0, 642, [1, 214, 1, 1], 1], ["SP", 2, 5, 4096, [1, 1, 8, 8], 1], ["SP", 2, 10, 14336, [16, 1], 1], ["RE", 2, [0, 5, 1, 6, 2, 7, 10, 11, 3, 8, 12, 4, 9]], ["FSP", 3, 0, 1, 3], ["FSP", 3, 4, 2, 3], ["RE", 3, [0, 4, 1, 5, 2, 6, 3, 7]], ["CA", 2, 3, 5], ["CHR", 1, "shared", [2]], ["CA", 2, 3, 6], ["CHR", 0, "shared", [3]], ["CA", 1, 4, 6], ["FU", 5, [0, 1]], ["AN", 5, 0, 5], ["FU", 5, [1, 2]], ["AN", 5, 1, 4], ["FU", 5, [2, 3]], ["AN", 5, 2, 6], ["FU", 3, [0, 1]], ["SP", 3, 0, 1024, [1], 1], ["AN", 3, 1, 2], ["FFSP", 3, 0, [2, 1], 1, 1], ["AN", 3, 1, 6], ["FU", 1, [0, 1]], ["SP", 1, 0, 32, [4], 1], ["AN", 1, 1, 2], ["FFSP", 1, 0, [2, 1], 1, 1], ["AN", 1, 1, 6], ["PR", 4, 0, "auto_unroll_max_step$64"]]]], "r": [[0.004026, 0.0040237, 0.00402697], 0, 4.93091, 1759455556], "v": "v0.6"}
{"i": [["[\"ansor_mm\", 642, 4096, 14336, \"float16\"]", "rocm -keys=rocm,gpu -max_num_threads=256 -max_shared_memory_per_block=49152 -max_threads_per_block=1024 -mcpu=gfx942 -model=unknown -mtriple=amdgcn-amd-amdhsa-hcc -thread_warp_size=64", [-1, 16, 64, 65536, 2147483647, 1024, 16, 64], "llvm -keys=cpu -mtriple=x86_64-unknown-linux-gnu", 0, []], [[], [["CHW", 2, "local"], ["SP", 2, 0, 642, [1, 107, 3, 1], 1], ["SP", 2, 5, 4096, [8, 1, 4, 2], 1], ["SP", 2, 10, 14336, [8, 7], 1], ["RE", 2, [0, 5, 1, 6, 2, 7, 10, 11, 3, 8, 12, 4, 9]], ["FSP", 3, 0, 1, 3], ["FSP", 3, 4, 2, 3], ["RE", 3, [0, 4, 1, 5, 2, 6, 3, 7]], ["CA", 2, 3, 5], ["CHR", 1, "shared", [2]], ["CA", 2, 3, 6], ["CHR", 0, "shared", [3]], ["CA", 1, 4, 6], ["FU", 5, [0, 1]], ["AN", 5, 0, 5], ["FU", 5, [1, 2]], ["AN", 5, 1, 4], ["FU", 5, [2, 3]], ["AN", 5, 2, 6], ["FU", 3, [0, 1]], ["SP", 3, 0, 448, [7], 1], ["AN", 3, 1, 2], ["FFSP", 3, 0, [2, 1], 1, 1], ["AN", 3, 1, 6], ["FU", 1, [0, 1]], ["SP", 1, 0, 168, [1], 1], ["AN", 1, 1, 2], ["FFSP", 1, 0, [2, 1], 1, 1], ["AN", 1, 1, 6], ["PR", 4, 0, "auto_unroll_max_step$512"]]]], "r": [[0.0305374, 0.0303503, 0.0305502], 0, 7.59737, 1759455559], "v": "v0.6"}
{"i": [["[\"ansor_mm\", 642, 4096, 14336, \"float16\"]", "rocm -keys=rocm,gpu -max_num_threads=256 -max_shared_memory_per_block=49152 -max_threads_per_block=1024 -mcpu=gfx942 -model=unknown -mtriple=amdgcn-amd-amdhsa-hcc -thread_warp_size=64", [-1, 16, 64, 65536, 2147483647, 1024, 16, 64], "llvm -keys=cpu -mtriple=x86_64-unknown-linux-gnu", 0, []], [[], [["CHW", 2, "local"], ["SP", 2, 0, 642, [6, 107, 1, 1], 1], ["SP", 2, 5, 4096, [2, 8, 2, 1], 1], ["SP", 2, 10, 14336, [1, 1], 1], ["RE", 2, [0, 5, 1, 6, 2, 7, 10, 11, 3, 8, 12, 4, 9]], ["FSP", 3, 0, 1, 3], ["FSP", 3, 4, 2, 3], ["RE", 3, [0, 4, 1, 5, 2, 6, 3, 7]], ["CA", 2, 3, 5], ["CHR", 1, "shared", [2]], ["CA", 2, 3, 6], ["CHR", 0, "shared", [3]], ["CA", 1, 4, 6], ["FU", 5, [0, 1]], ["AN", 5, 0, 5], ["FU", 5, [1, 2]], ["AN", 5, 1, 4], ["FU", 5, [2, 3]], ["AN", 5, 2, 6], ["FU", 3, [0, 1]], ["SP", 3, 0, 28, [2], 1], ["AN", 3, 1, 2], ["FFSP", 3, 0, [2, 1], 1, 1], ["AN", 3, 1, 6], ["FU", 1, [0, 1]], ["SP", 1, 0, 14, [1], 1], ["AN", 1, 1, 2], ["FFSP", 1, 0, [2, 1], 1, 1], ["AN", 1, 1, 6], ["PR", 4, 0, "auto_unroll_max_step$64"]]]], "r": [[0.0146633, 0.0146662, 0.0146628], 0, 5.15072, 1759455561], "v": "v0.6"}
{"i": [["[\"ansor_mm\", 642, 4096, 14336, \"float16\"]", "rocm -keys=rocm,gpu -max_num_threads=256 -max_shared_memory_per_block=49152 -max_threads_per_block=1024 -mcpu=gfx942 -model=unknown -mtriple=amdgcn-amd-amdhsa-hcc -thread_warp_size=64", [-1, 16, 64, 65536, 2147483647, 1024, 16, 64], "llvm -keys=cpu -mtriple=x86_64-unknown-linux-gnu", 0, []], [[], [["CHW", 2, "local"], ["SP", 2, 0, 642, [6, 1, 1, 1], 1], ["SP", 2, 5, 4096, [1, 64, 8, 2], 1], ["SP", 2, 10, 14336, [7, 2], 1], ["RE", 2, [0, 5, 1, 6, 2, 7, 10, 11, 3, 8, 12, 4, 9]], ["FSP", 3, 0, 1, 3], ["FSP", 3, 4, 2, 3], ["RE", 3, [0, 4, 1, 5, 2, 6, 3, 7]], ["CA", 2, 3, 5], ["CHR", 1, "shared", [2]], ["CA", 2, 3, 6], ["CHR", 0, "shared", [3]], ["CA", 1, 4, 6], ["FU", 5, [0, 1]], ["AN", 5, 0, 5], ["FU", 5, [1, 2]], ["AN", 5, 1, 4], ["FU", 5, [2, 3]], ["AN", 5, 2, 6], ["FU", 3, [0, 1]], ["SP", 3, 0, 224, [1], 1], ["AN", 3, 1, 2], ["FFSP", 3, 0, [2, 1], 1, 1], ["AN", 3, 1, 6], ["FU", 1, [0, 1]], ["SP", 1, 0, 84, [1], 1], ["AN", 1, 1, 2], ["FFSP", 1, 0, [2, 1], 1, 1], ["AN", 1, 1, 6], ["PR", 4, 0, "auto_unroll_max_step$1024"]]]], "r": [[0.0507984, 0.0508391, 0.0508049], 0, 6.50603, 1759455565], "v": "v0.6"}
{"i": [["[\"ansor_mm\", 642, 4096, 14336, \"float16\"]", "rocm -keys=rocm,gpu -max_num_threads=256 -max_shared_memory_per_block=49152 -max_threads_per_block=1024 -mcpu=gfx942 -model=unknown -mtriple=amdgcn-amd-amdhsa-hcc -thread_warp_size=64", [-1, 16, 64, 65536, 2147483647, 1024, 16, 64], "llvm -keys=cpu -mtriple=x86_64-unknown-linux-gnu", 0, []], [[], [["CHW", 2, "local"], ["SP", 2, 0, 642, [3, 1, 107, 1], 1], ["SP", 2, 5, 4096, [1, 256, 2, 8], 1], ["SP", 2, 10, 14336, [7, 1], 1], ["RE", 2, [0, 5, 1, 6, 2, 7, 10, 11, 3, 8, 12, 4, 9]], ["FSP", 3, 0, 1, 3], ["FSP", 3, 4, 2, 3], ["RE", 3, [0, 4, 1, 5, 2, 6, 3, 7]], ["CA", 2, 3, 5], ["CHR", 1, "shared", [2]], ["CA", 2, 3, 6], ["CHR", 0, "shared", [3]], ["CA", 1, 4, 6], ["FU", 5, [0, 1]], ["AN", 5, 0, 5], ["FU", 5, [1, 2]], ["AN", 5, 1, 4], ["FU", 5, [2, 3]], ["AN", 5, 2, 6], ["FU", 3, [0, 1]], ["SP", 3, 0, 56, [1], 1], ["AN", 3, 1, 2], ["FFSP", 3, 0, [2, 1], 1, 1], ["AN", 3, 1, 6], ["FU", 1, [0, 1]], ["SP", 1, 0, 749, [7], 1], ["AN", 1, 1, 2], ["FFSP", 1, 0, [2, 1], 1, 1], ["AN", 1, 1, 6], ["PR", 4, 0, "auto_unroll_max_step$1024"]]]], "r": [[2.34119, 2.34185, 2.34147], 0, 77.6922, 1759455639], "v": "v0.6"}
{"i": [["[\"ansor_mm\", 642, 4096, 14336, \"float16\"]", "rocm -keys=rocm,gpu -max_num_threads=256 -max_shared_memory_per_block=49152 -max_threads_per_block=1024 -mcpu=gfx942 -model=unknown -mtriple=amdgcn-amd-amdhsa-hcc -thread_warp_size=64", [-1, 16, 64, 65536, 2147483647, 1024, 16, 64], "llvm -keys=cpu -mtriple=x86_64-unknown-linux-gnu", 0, []], [[], [["CHW", 2, "local"], ["SP", 2, 0, 642, [1, 321, 1, 1], 1], ["SP", 2, 5, 4096, [2, 1, 1, 16], 1], ["SP", 2, 10, 14336, [32, 1], 1], ["RE", 2, [0, 5, 1, 6, 2, 7, 10, 11, 3, 8, 12, 4, 9]], ["FSP", 3, 0, 1, 3], ["FSP", 3, 4, 2, 3], ["RE", 3, [0, 4, 1, 5, 2, 6, 3, 7]], ["CA", 2, 3, 5], ["CHR", 1, "shared", [2]], ["CA", 2, 3, 6], ["CHR", 0, "shared", [3]], ["CA", 1, 4, 6], ["FU", 5, [0, 1]], ["AN", 5, 0, 5], ["FU", 5, [1, 2]], ["AN", 5, 1, 4], ["FU", 5, [2, 3]], ["AN", 5, 2, 6], ["FU", 3, [0, 1]], ["SP", 3, 0, 512, [1], 1], ["AN", 3, 1, 2], ["FFSP", 3, 0, [2, 1], 1, 1], ["AN", 3, 1, 6], ["FU", 1, [0, 1]], ["SP", 1, 0, 32, [1], 1], ["AN", 1, 1, 2], ["FFSP", 1, 0, [2, 1], 1, 1], ["AN", 1, 1, 6], ["PR", 4, 0, "auto_unroll_max_step$1024"]]]], "r": [[0.00256265, 0.00256305, 0.00256355], 0, 5.63989, 1759455642], "v": "v0.6"}
{"i": [["[\"ansor_mm\", 642, 4096, 14336, \"float16\"]", "rocm -keys=rocm,gpu -max_num_threads=256 -max_shared_memory_per_block=49152 -max_threads_per_block=1024 -mcpu=gfx942 -model=unknown -mtriple=amdgcn-amd-amdhsa-hcc -thread_warp_size=64", [-1, 16, 64, 65536, 2147483647, 1024, 16, 64], "llvm -keys=cpu -mtriple=x86_64-unknown-linux-gnu", 0, []], [[], [["CHW", 2, "local"], ["SP", 2, 0, 642, [1, 107, 6, 1], 1], ["SP", 2, 5, 4096, [1, 1, 4, 16], 1], ["SP", 2, 10, 14336, [8, 1], 1], ["RE", 2, [0, 5, 1, 6, 2, 7, 10, 11, 3, 8, 12, 4, 9]], ["FSP", 3, 0, 1, 3], ["FSP", 3, 4, 2, 3], ["RE", 3, [0, 4, 1, 5, 2, 6, 3, 7]], ["CA", 2, 3, 5], ["CHR", 1, "shared", [2]], ["CA", 2, 3, 6], ["CHR", 0, "shared", [3]], ["CA", 1, 4, 6], ["FU", 5, [0, 1]], ["AN", 5, 0, 5], ["FU", 5, [1, 2]], ["AN", 5, 1, 4], ["FU", 5, [2, 3]], ["AN", 5, 2, 6], ["FU", 3, [0, 1]], ["SP", 3, 0, 448, [4], 1], ["AN", 3, 1, 2], ["FFSP", 3, 0, [2, 1], 1, 1], ["AN", 3, 1, 6], ["FU", 1, [0, 1]], ["SP", 1, 0, 168, [1], 1], ["AN", 1, 1, 2], ["FFSP", 1, 0, [2, 1], 1, 1], ["AN", 1, 1, 6], ["PR", 4, 0, "auto_unroll_max_step$64"]]]], "r": [[0.0973081, 0.0976511, 0.0979956], 0, 8.15199, 1759455647], "v": "v0.6"}
{"i": [["[\"ansor_mm\", 642, 4096, 14336, \"float16\"]", "rocm -keys=rocm,gpu -max_num_threads=256 -max_shared_memory_per_block=49152 -max_threads_per_block=1024 -mcpu=gfx942 -model=unknown -mtriple=amdgcn-amd-amdhsa-hcc -thread_warp_size=64", [-1, 16, 64, 65536, 2147483647, 1024, 16, 64], "llvm -keys=cpu -mtriple=x86_64-unknown-linux-gnu", 0, []], [[], [["CHW", 2, "local"], ["SP", 2, 0, 642, [1, 321, 1, 1], 1], ["SP", 2, 5, 4096, [16, 1, 1, 16], 1], ["SP", 2, 10, 14336, [32, 1], 1], ["RE", 2, [0, 5, 1, 6, 2, 7, 10, 11, 3, 8, 12, 4, 9]], ["FSP", 3, 0, 1, 3], ["FSP", 3, 4, 2, 3], ["RE", 3, [0, 4, 1, 5, 2, 6, 3, 7]], ["CA", 2, 3, 5], ["CHR", 1, "shared", [2]], ["CA", 2, 3, 6], ["CHR", 0, "shared", [3]], ["CA", 1, 4, 6], ["FU", 5, [0, 1]], ["AN", 5, 0, 5], ["FU", 5, [1, 2]], ["AN", 5, 1, 4], ["FU", 5, [2, 3]], ["AN", 5, 2, 6], ["FU", 3, [0, 1]], ["SP", 3, 0, 512, [1], 1], ["AN", 3, 1, 2], ["FFSP", 3, 0, [2, 1], 1, 1], ["AN", 3, 1, 6], ["FU", 1, [0, 1]], ["SP", 1, 0, 32, [1], 1], ["AN", 1, 1, 2], ["FFSP", 1, 0, [2, 1], 1, 1], ["AN", 1, 1, 6], ["PR", 4, 0, "auto_unroll_max_step$1024"]]]], "r": [[0.0370382, 0.037038, 0.0370321], 0, 6.0805, 1759455650], "v": "v0.6"}
{"i": [["[\"ansor_mm\", 642, 4096, 14336, \"float16\"]", "rocm -keys=rocm,gpu -max_num_threads=256 -max_shared_memory_per_block=49152 -max_threads_per_block=1024 -mcpu=gfx942 -model=unknown -mtriple=amdgcn-amd-amdhsa-hcc -thread_warp_size=64", [-1, 16, 64, 65536, 2147483647, 1024, 16, 64], "llvm -keys=cpu -mtriple=x86_64-unknown-linux-gnu", 0, []], [[], [["CHW", 2, "local"], ["SP", 2, 0, 642, [1, 214, 1, 1], 1], ["SP", 2, 5, 4096, [16, 4, 8, 1], 1], ["SP", 2, 10, 14336, [1, 4], 1], ["RE", 2, [0, 5, 1, 6, 2, 7, 10, 11, 3, 8, 12, 4, 9]], ["FSP", 3, 0, 1, 3], ["FSP", 3, 4, 2, 3], ["RE", 3, [0, 4, 1, 5, 2, 6, 3, 7]], ["CA", 2, 3, 5], ["CHR", 1, "shared", [2]], ["CA", 2, 3, 6], ["CHR", 0, "shared", [3]], ["CA", 1, 4, 6], ["FU", 5, [0, 1]], ["AN", 5, 0, 5], ["FU", 5, [1, 2]], ["AN", 5, 1, 4], ["FU", 5, [2, 3]], ["AN", 5, 2, 6], ["FU", 3, [0, 1]], ["SP", 3, 0, 32, [2], 1], ["AN", 3, 1, 2], ["FFSP", 3, 0, [2, 1], 1, 1], ["AN", 3, 1, 6], ["FU", 1, [0, 1]], ["SP", 1, 0, 4, [4], 1], ["AN", 1, 1, 2], ["FFSP", 1, 0, [2, 1], 1, 1], ["AN", 1, 1, 6], ["PR", 4, 0, "auto_unroll_max_step$64"]]]], "r": [[0.0178495, 0.0177807, 0.0178214], 0, 5.46802, 1759455653], "v": "v0.6"}
{"i": [["[\"ansor_mm\", 642, 4096, 14336, \"float16\"]", "rocm -keys=rocm,gpu -max_num_threads=256 -max_shared_memory_per_block=49152 -max_threads_per_block=1024 -mcpu=gfx942 -model=unknown -mtriple=amdgcn-amd-amdhsa-hcc -thread_warp_size=64", [-1, 16, 64, 65536, 2147483647, 1024, 16, 64], "llvm -keys=cpu -mtriple=x86_64-unknown-linux-gnu", 0, []], [[], [["CHW", 2, "local"], ["SP", 2, 0, 642, [6, 107, 1, 1], 1], ["SP", 2, 5, 4096, [2, 8, 2, 1], 1], ["SP", 2, 10, 14336, [1, 14], 1], ["RE", 2, [0, 5, 1, 6, 2, 7, 10, 11, 3, 8, 12, 4, 9]], ["FSP", 3, 0, 1, 3], ["FSP", 3, 4, 2, 3], ["RE", 3, [0, 4, 1, 5, 2, 6, 3, 7]], ["CA", 2, 3, 5], ["CHR", 1, "shared", [2]], ["CA", 2, 3, 6], ["CHR", 0, "shared", [3]], ["CA", 1, 4, 6], ["FU", 5, [0, 1]], ["AN", 5, 0, 5], ["FU", 5, [1, 2]], ["AN", 5, 1, 4], ["FU", 5, [2, 3]], ["AN", 5, 2, 6], ["FU", 3, [0, 1]], ["SP", 3, 0, 28, [1], 1], ["AN", 3, 1, 2], ["FFSP", 3, 0, [2, 1], 1, 1], ["AN", 3, 1, 6], ["FU", 1, [0, 1]], ["SP", 1, 0, 14, [7], 1], ["AN", 1, 1, 2], ["FFSP", 1, 0, [2, 1], 1, 1], ["AN", 1, 1, 6], ["PR", 4, 0, "auto_unroll_max_step$64"]]]], "r": [[0.00895905, 0.00895998, 0.00895994], 0, 5.29691, 1759455655], "v": "v0.6"}
{"i": [["[\"ansor_mm\", 642, 4096, 14336, \"float16\"]", "rocm -keys=rocm,gpu -max_num_threads=256 -max_shared_memory_per_block=49152 -max_threads_per_block=1024 -mcpu=gfx942 -model=unknown -mtriple=amdgcn-amd-amdhsa-hcc -thread_warp_size=64", [-1, 16, 64, 65536, 2147483647, 1024, 16, 64], "llvm -keys=cpu -mtriple=x86_64-unknown-linux-gnu", 0, []], [[], [["CHW", 2, "local"], ["SP", 2, 0, 642, [3, 1, 107, 1], 1], ["SP", 2, 5, 4096, [2, 512, 2, 2], 1], ["SP", 2, 10, 14336, [4, 1], 1], ["RE", 2, [0, 5, 1, 6, 2, 7, 10, 11, 3, 8, 12, 4, 9]], ["FSP", 3, 0, 1, 3], ["FSP", 3, 4, 2, 3], ["RE", 3, [0, 4, 1, 5, 2, 6, 3, 7]], ["CA", 2, 3, 5], ["CHR", 1, "shared", [2]], ["CA", 2, 3, 6], ["CHR", 0, "shared", [3]], ["CA", 1, 4, 6], ["FU", 5, [0, 1]], ["AN", 5, 0, 5], ["FU", 5, [1, 2]], ["AN", 5, 1, 4], ["FU", 5, [2, 3]], ["AN", 5, 2, 6], ["FU", 3, [0, 1]], ["SP", 3, 0, 16, [1], 1], ["AN", 3, 1, 2], ["FFSP", 3, 0, [2, 1], 1, 1], ["AN", 3, 1, 6], ["FU", 1, [0, 1]], ["SP", 1, 0, 428, [2], 1], ["AN", 1, 1, 2], ["FFSP", 1, 0, [2, 1], 1, 1], ["AN", 1, 1, 6], ["PR", 4, 0, "auto_unroll_max_step$16"]]]], "r": [[2.30304, 2.30268, 2.30302], 0, 76.1752, 1759455729], "v": "v0.6"}
{"i": [["[\"ansor_mm\", 642, 4096, 14336, \"float16\"]", "rocm -keys=rocm,gpu -max_num_threads=256 -max_shared_memory_per_block=49152 -max_threads_per_block=1024 -mcpu=gfx942 -model=unknown -mtriple=amdgcn-amd-amdhsa-hcc -thread_warp_size=64", [-1, 16, 64, 65536, 2147483647, 1024, 16, 64], "llvm -keys=cpu -mtriple=x86_64-unknown-linux-gnu", 0, []], [[], [["CHW", 2, "local"], ["SP", 2, 0, 642, [1, 107, 1, 1], 1], ["SP", 2, 5, 4096, [2, 1, 2, 4], 1], ["SP", 2, 10, 14336, [16, 8], 1], ["RE", 2, [0, 5, 1, 6, 2, 7, 10, 11, 3, 8, 12, 4, 9]], ["FSP", 3, 0, 1, 3], ["FSP", 3, 4, 2, 3], ["RE", 3, [0, 4, 1, 5, 2, 6, 3, 7]], ["CA", 2, 3, 5], ["CHR", 1, "shared", [2]], ["CA", 2, 3, 6], ["CHR", 0, "shared", [3]], ["CA", 1, 4, 6], ["FU", 5, [0, 1]], ["AN", 5, 0, 5], ["FU", 5, [1, 2]], ["AN", 5, 1, 4], ["FU", 5, [2, 3]], ["AN", 5, 2, 6], ["FU", 3, [0, 1]], ["SP", 3, 0, 2048, [8], 1], ["AN", 3, 1, 2], ["FFSP", 3, 0, [2, 1], 1, 1], ["AN", 3, 1, 6], ["FU", 1, [0, 1]], ["SP", 1, 0, 128, [1], 1], ["AN", 1, 1, 2], ["FFSP", 1, 0, [2, 1], 1, 1], ["AN", 1, 1, 6], ["PR", 4, 0, "auto_unroll_max_step$1024"]]]], "r": [[0.0191507, 0.0191345, 0.0191309], 0, 5.74499, 1759455731], "v": "v0.6"}
{"i": [["[\"ansor_mm\", 642, 4096, 14336, \"float16\"]", "rocm -keys=rocm,gpu -max_num_threads=256 -max_shared_memory_per_block=49152 -max_threads_per_block=1024 -mcpu=gfx942 -model=unknown -mtriple=amdgcn-amd-amdhsa-hcc -thread_warp_size=64", [-1, 16, 64, 65536, 2147483647, 1024, 16, 64], "llvm -keys=cpu -mtriple=x86_64-unknown-linux-gnu", 0, []], [[], [["CHW", 2, "local"], ["SP", 2, 0, 642, [3, 107, 1, 2], 1], ["SP", 2, 5, 4096, [2, 2, 2, 4], 1], ["SP", 2, 10, 14336, [1, 28], 1], ["RE", 2, [0, 5, 1, 6, 2, 7, 10, 11, 3, 8, 12, 4, 9]], ["FSP", 3, 0, 1, 3], ["FSP", 3, 4, 2, 3], ["RE", 3, [0, 4, 1, 5, 2, 6, 3, 7]], ["CA", 2, 3, 5], ["CHR", 1, "shared", [2]], ["CA", 2, 3, 6], ["CHR", 0, "shared", [3]], ["CA", 1, 4, 6], ["FU", 5, [0, 1]], ["AN", 5, 0, 5], ["FU", 5, [1, 2]], ["AN", 5, 1, 4], ["FU", 5, [2, 3]], ["AN", 5, 2, 6], ["FU", 3, [0, 1]], ["SP", 3, 0, 28, [1], 1], ["AN", 3, 1, 2], ["FFSP", 3, 0, [2, 1], 1, 1], ["AN", 3, 1, 6], ["FU", 1, [0, 1]], ["SP", 1, 0, 14, [2], 1], ["AN", 1, 1, 2], ["FFSP", 1, 0, [2, 1], 1, 1], ["AN", 1, 1, 6], ["PR", 4, 0, "auto_unroll_max_step$64"]]]], "r": [[0.0061499, 0.00615015, 0.00615175], 0, 5.22042, 1759455734], "v": "v0.6"}
{"i": [["[\"ansor_mm\", 642, 4096, 14336, \"float16\"]", "rocm -keys=rocm,gpu -max_num_threads=256 -max_shared_memory_per_block=49152 -max_threads_per_block=1024 -mcpu=gfx942 -model=unknown -mtriple=amdgcn-amd-amdhsa-hcc -thread_warp_size=64", [-1, 16, 64, 65536, 2147483647, 1024, 16, 64], "llvm -keys=cpu -mtriple=x86_64-unknown-linux-gnu", 0, []], [[], [["CHW", 2, "local"], ["SP", 2, 0, 642, [3, 107, 1, 2], 1], ["SP", 2, 5, 4096, [4, 1, 4, 2], 1], ["SP", 2, 10, 14336, [16, 1], 1], ["RE", 2, [0, 5, 1, 6, 2, 7, 10, 11, 3, 8, 12, 4, 9]], ["FSP", 3, 0, 1, 3], ["FSP", 3, 4, 2, 3], ["RE", 3, [0, 4, 1, 5, 2, 6, 3, 7]], ["CA", 2, 3, 5], ["CHR", 1, "shared", [2]], ["CA", 2, 3, 6], ["CHR", 0, "shared", [3]], ["CA", 1, 4, 6], ["FU", 5, [0, 1]], ["AN", 5, 0, 5], ["FU", 5, [1, 2]], ["AN", 5, 1, 4], ["FU", 5, [2, 3]], ["AN", 5, 2, 6], ["FU", 3, [0, 1]], ["SP", 3, 0, 128, [8], 1], ["AN", 3, 1, 2], ["FFSP", 3, 0, [2, 1], 1, 1], ["AN", 3, 1, 6], ["FU", 1, [0, 1]], ["SP", 1, 0, 32, [1], 1], ["AN", 1, 1, 2], ["FFSP", 1, 0, [2, 1], 1, 1], ["AN", 1, 1, 6], ["PR", 4, 0, "auto_unroll_max_step$16"]]]], "r": [[0.0125972, 0.0126111, 0.0125951], 0, 5.39269, 1759455743], "v": "v0.6"}
{"i": [["[\"ansor_mm\", 642, 4096, 14336, \"float16\"]", "rocm -keys=rocm,gpu -max_num_threads=256 -max_shared_memory_per_block=49152 -max_threads_per_block=1024 -mcpu=gfx942 -model=unknown -mtriple=amdgcn-amd-amdhsa-hcc -thread_warp_size=64", [-1, 16, 64, 65536, 2147483647, 1024, 16, 64], "llvm -keys=cpu -mtriple=x86_64-unknown-linux-gnu", 0, []], [[], [["CHW", 2, "local"], ["SP", 2, 0, 642, [2, 107, 1, 1], 1], ["SP", 2, 5, 4096, [1, 1, 8, 16], 1], ["SP", 2, 10, 14336, [1, 2], 1], ["RE", 2, [0, 5, 1, 6, 2, 7, 10, 11, 3, 8, 12, 4, 9]], ["FSP", 3, 0, 1, 3], ["FSP", 3, 4, 2, 3], ["RE", 3, [0, 4, 1, 5, 2, 6, 3, 7]], ["CA", 2, 3, 5], ["CHR", 1, "shared", [2]], ["CA", 2, 3, 6], ["CHR", 0, "shared", [3]], ["CA", 1, 4, 6], ["FU", 5, [0, 1]], ["AN", 5, 0, 5], ["FU", 5, [1, 2]], ["AN", 5, 1, 4], ["FU", 5, [2, 3]], ["AN", 5, 2, 6], ["FU", 3, [0, 1]], ["SP", 3, 0, 2048, [4], 1], ["AN", 3, 1, 2], ["FFSP", 3, 0, [2, 1], 1, 1], ["AN", 3, 1, 6], ["FU", 1, [0, 1]], ["SP", 1, 0, 16, [4], 1], ["AN", 1, 1, 2], ["FFSP", 1, 0, [2, 1], 1, 1], ["AN", 1, 1, 6], ["PR", 4, 0, "auto_unroll_max_step$64"]]]], "r": [[0.0303946, 0.0304736, 0.0304438], 0, 5.71219, 1759455746], "v": "v0.6"}
{"i": [["[\"ansor_mm\", 642, 4096, 14336, \"float16\"]", "rocm -keys=rocm,gpu -max_num_threads=256 -max_shared_memory_per_block=49152 -max_threads_per_block=1024 -mcpu=gfx942 -model=unknown -mtriple=amdgcn-amd-amdhsa-hcc -thread_warp_size=64", [-1, 16, 64, 65536, 2147483647, 1024, 16, 64], "llvm -keys=cpu -mtriple=x86_64-unknown-linux-gnu", 0, []], [[], [["CHW", 2, "local"], ["SP", 2, 0, 642, [1, 214, 1, 1], 1], ["SP", 2, 5, 4096, [16, 1, 8, 32], 1], ["SP", 2, 10, 14336, [2, 1], 1], ["RE", 2, [0, 5, 1, 6, 2, 7, 10, 11, 3, 8, 12, 4, 9]], ["FSP", 3, 0, 1, 3], ["FSP", 3, 4, 2, 3], ["RE", 3, [0, 4, 1, 5, 2, 6, 3, 7]], ["CA", 2, 3, 5], ["CHR", 1, "shared", [2]], ["CA", 2, 3, 6], ["CHR", 0, "shared", [3]], ["CA", 1, 4, 6], ["FU", 5, [0, 1]], ["AN", 5, 0, 5], ["FU", 5, [1, 2]], ["AN", 5, 1, 4], ["FU", 5, [2, 3]], ["AN", 5, 2, 6], ["FU", 3, [0, 1]], ["SP", 3, 0, 512, [1], 1], ["AN", 3, 1, 2], ["FFSP", 3, 0, [2, 1], 1, 1], ["AN", 3, 1, 6], ["FU", 1, [0, 1]], ["SP", 1, 0, 2, [1], 1], ["AN", 1, 1, 2], ["FFSP", 1, 0, [2, 1], 1, 1], ["AN", 1, 1, 6], ["PR", 4, 0, "auto_unroll_max_step$16"]]]], "r": [[1.74226, 1.74188, 1.74234], 0, 58.9917, 1759455802], "v": "v0.6"}
{"i": [["[\"ansor_mm\", 642, 4096, 14336, \"float16\"]", "rocm -keys=rocm,gpu -max_num_threads=256 -max_shared_memory_per_block=49152 -max_threads_per_block=1024 -mcpu=gfx942 -model=unknown -mtriple=amdgcn-amd-amdhsa-hcc -thread_warp_size=64", [-1, 16, 64, 65536, 2147483647, 1024, 16, 64], "llvm -keys=cpu -mtriple=x86_64-unknown-linux-gnu", 0, []], [[], [["CHW", 2, "local"], ["SP", 2, 0, 642, [1, 214, 1, 1], 1], ["SP", 2, 5, 4096, [4, 1, 128, 2], 1], ["SP", 2, 10, 14336, [14, 1], 1], ["RE", 2, [0, 5, 1, 6, 2, 7, 10, 11, 3, 8, 12, 4, 9]], ["FSP", 3, 0, 1, 3], ["FSP", 3, 4, 2, 3], ["RE", 3, [0, 4, 1, 5, 2, 6, 3, 7]], ["CA", 2, 3, 5], ["CHR", 1, "shared", [2]], ["CA", 2, 3, 6], ["CHR", 0, "shared", [3]], ["CA", 1, 4, 6], ["FU", 5, [0, 1]], ["AN", 5, 0, 5], ["FU", 5, [1, 2]], ["AN", 5, 1, 4], ["FU", 5, [2, 3]], ["AN", 5, 2, 6], ["FU", 3, [0, 1]], ["SP", 3, 0, 3584, [1], 1], ["AN", 3, 1, 2], ["FFSP", 3, 0, [2, 1], 1, 1], ["AN", 3, 1, 6], ["FU", 1, [0, 1]], ["SP", 1, 0, 28, [1], 1], ["AN", 1, 1, 2], ["FFSP", 1, 0, [2, 1], 1, 1], ["AN", 1, 1, 6], ["PR", 4, 0, "auto_unroll_max_step$1024"]]]], "r": [[0.427304, 0.426974, 0.427467], 0, 19.2907, 1759455817], "v": "v0.6"}
{"i": [["[\"ansor_mm\", 642, 4096, 14336, \"float16\"]", "rocm -keys=rocm,gpu -max_num_threads=256 -max_shared_memory_per_block=49152 -max_threads_per_block=1024 -mcpu=gfx942 -model=unknown -mtriple=amdgcn-amd-amdhsa-hcc -thread_warp_size=64", [-1, 16, 64, 65536, 2147483647, 1024, 16, 64], "llvm -keys=cpu -mtriple=x86_64-unknown-linux-gnu", 0, []], [[], [["CHW", 2, "local"], ["SP", 2, 0, 642, [3, 1, 107, 1], 1], ["SP", 2, 5, 4096, [2, 512, 2, 2], 1], ["SP", 2, 10, 14336, [4, 1], 1], ["RE", 2, [0, 5, 1, 6, 2, 7, 10, 11, 3, 8, 12, 4, 9]], ["FSP", 3, 0, 1, 3], ["FSP", 3, 4, 2, 3], ["RE", 3, [0, 4, 1, 5, 2, 6, 3, 7]], ["CA", 2, 3, 5], ["CHR", 1, "shared", [2]], ["CA", 2, 3, 6], ["CHR", 0, "shared", [3]], ["CA", 1, 4, 6], ["FU", 5, [0, 1]], ["AN", 5, 0, 5], ["FU", 5, [1, 2]], ["AN", 5, 1, 4], ["FU", 5, [2, 3]], ["AN", 5, 2, 6], ["FU", 3, [0, 1]], ["SP", 3, 0, 16, [1], 1], ["AN", 3, 1, 2], ["FFSP", 3, 0, [2, 1], 1, 1], ["AN", 3, 1, 6], ["FU", 1, [0, 1]], ["SP", 1, 0, 428, [4], 1], ["AN", 1, 1, 2], ["FFSP", 1, 0, [2, 1], 1, 1], ["AN", 1, 1, 6], ["PR", 4, 0, "auto_unroll_max_step$16"]]]], "r": [[2.29947, 2.29998, 2.30066], 0, 76.0648, 1759455891], "v": "v0.6"}
{"i": [["[\"ansor_mm\", 642, 4096, 14336, \"float16\"]", "rocm -keys=rocm,gpu -max_num_threads=256 -max_shared_memory_per_block=49152 -max_threads_per_block=1024 -mcpu=gfx942 -model=unknown -mtriple=amdgcn-amd-amdhsa-hcc -thread_warp_size=64", [-1, 16, 64, 65536, 2147483647, 1024, 16, 64], "llvm -keys=cpu -mtriple=x86_64-unknown-linux-gnu", 0, []], [[], [["CHW", 2, "local"], ["SP", 2, 0, 642, [2, 107, 1, 3], 1], ["SP", 2, 5, 4096, [8, 2, 64, 1], 1], ["SP", 2, 10, 14336, [7, 1], 1], ["RE", 2, [0, 5, 1, 6, 2, 7, 10, 11, 3, 8, 12, 4, 9]], ["FSP", 3, 0, 1, 3], ["FSP", 3, 4, 2, 3], ["RE", 3, [0, 4, 1, 5, 2, 6, 3, 7]], ["CA", 2, 3, 5], ["CHR", 1, "shared", [2]], ["CA", 2, 3, 6], ["CHR", 0, "shared", [3]], ["CA", 1, 4, 6], ["FU", 5, [0, 1]], ["AN", 5, 0, 5], ["FU", 5, [1, 2]], ["AN", 5, 1, 4], ["FU", 5, [2, 3]], ["AN", 5, 2, 6], ["FU", 3, [0, 1]], ["SP", 3, 0, 448, [1], 1], ["AN", 3, 1, 2], ["FFSP", 3, 0, [2, 1], 1, 1], ["AN", 3, 1, 6], ["FU", 1, [0, 1]], ["SP", 1, 0, 21, [3], 1], ["AN", 1, 1, 2], ["FFSP", 1, 0, [2, 1], 1, 1], ["AN", 1, 1, 6], ["PR", 4, 0, "auto_unroll_max_step$512"]]]], "r": [[1.95179, 1.96028, 1.97115], 0, 65.7558, 1759455953], "v": "v0.6"}
{"i": [["[\"ansor_mm\", 642, 4096, 14336, \"float16\"]", "rocm -keys=rocm,gpu -max_num_threads=256 -max_shared_memory_per_block=49152 -max_threads_per_block=1024 -mcpu=gfx942 -model=unknown -mtriple=amdgcn-amd-amdhsa-hcc -thread_warp_size=64", [-1, 16, 64, 65536, 2147483647, 1024, 16, 64], "llvm -keys=cpu -mtriple=x86_64-unknown-linux-gnu", 0, []], [[], [["CHW", 2, "local"], ["SP", 2, 0, 642, [1, 107, 1, 6], 1], ["SP", 2, 5, 4096, [16, 8, 1, 2], 1], ["SP", 2, 10, 14336, [16, 2], 1], ["RE", 2, [0, 5, 1, 6, 2, 7, 10, 11, 3, 8, 12, 4, 9]], ["FSP", 3, 0, 1, 3], ["FSP", 3, 4, 2, 3], ["RE", 3, [0, 4, 1, 5, 2, 6, 3, 7]], ["CA", 2, 3, 5], ["CHR", 1, "shared", [2]], ["CA", 2, 3, 6], ["CHR", 0, "shared", [3]], ["CA", 1, 4, 6], ["FU", 5, [0, 1]], ["AN", 5, 0, 5], ["FU", 5, [1, 2]], ["AN", 5, 1, 4], ["FU", 5, [2, 3]], ["AN", 5, 2, 6], ["FU", 3, [0, 1]], ["SP", 3, 0, 64, [1], 1], ["AN", 3, 1, 2], ["FFSP", 3, 0, [2, 1], 1, 1], ["AN", 3, 1, 6], ["FU", 1, [0, 1]], ["SP", 1, 0, 192, [1], 1], ["AN", 1, 1, 2], ["FFSP", 1, 0, [2, 1], 1, 1], ["AN", 1, 1, 6], ["PR", 4, 0, "auto_unroll_max_step$512"]]]], "r": [[0.0182584, 0.0183012, 0.0182684], 0, 5.65751, 1759455956], "v": "v0.6"}
{"i": [["[\"ansor_mm\", 642, 4096, 14336, \"float16\"]", "rocm -keys=rocm,gpu -max_num_threads=256 -max_shared_memory_per_block=49152 -max_threads_per_block=1024 -mcpu=gfx942 -model=unknown -mtriple=amdgcn-amd-amdhsa-hcc -thread_warp_size=64", [-1, 16, 64, 65536, 2147483647, 1024, 16, 64], "llvm -keys=cpu -mtriple=x86_64-unknown-linux-gnu", 0, []], [[], [["CHW", 2, "local"], ["SP", 2, 0, 642, [1, 6, 1, 1], 1], ["SP", 2, 5, 4096, [2, 16, 1, 32], 1], ["SP", 2, 10, 14336, [7, 4], 1], ["RE", 2, [0, 5, 1, 6, 2, 7, 10, 11, 3, 8, 12, 4, 9]], ["FSP", 3, 0, 1, 3], ["FSP", 3, 4, 2, 3], ["RE", 3, [0, 4, 1, 5, 2, 6, 3, 7]], ["CA", 2, 3, 5], ["CHR", 1, "shared", [2]], ["CA", 2, 3, 6], ["CHR", 0, "shared", [3]], ["CA", 1, 4, 6], ["FU", 5, [0, 1]], ["AN", 5, 0, 5], ["FU", 5, [1, 2]], ["AN", 5, 1, 4], ["FU", 5, [2, 3]], ["AN", 5, 2, 6], ["FU", 3, [0, 1]], ["SP", 3, 0, 896, [1], 1], ["AN", 3, 1, 2], ["FFSP", 3, 0, [2, 1], 1, 1], ["AN", 3, 1, 6], ["FU", 1, [0, 1]], ["SP", 1, 0, 28, [1], 1], ["AN", 1, 1, 2], ["FFSP", 1, 0, [2, 1], 1, 1], ["AN", 1, 1, 6], ["PR", 4, 0, "auto_unroll_max_step$64"]]]], "r": [[0.0888458, 0.0889088, 0.0888287], 0, 7.42566, 1759455961], "v": "v0.6"}
{"i": [["[\"ansor_mm\", 642, 4096, 14336, \"float16\"]", "rocm -keys=rocm,gpu -max_num_threads=256 -max_shared_memory_per_block=49152 -max_threads_per_block=1024 -mcpu=gfx942 -model=unknown -mtriple=amdgcn-amd-amdhsa-hcc -thread_warp_size=64", [-1, 16, 64, 65536, 2147483647, 1024, 16, 64], "llvm -keys=cpu -mtriple=x86_64-unknown-linux-gnu", 0, []], [[], [["CHW", 2, "local"], ["SP", 2, 0, 642, [1, 107, 1, 6], 1], ["SP", 2, 5, 4096, [2, 8, 2, 1], 1], ["SP", 2, 10, 14336, [1, 14], 1], ["RE", 2, [0, 5, 1, 6, 2, 7, 10, 11, 3, 8, 12, 4, 9]], ["FSP", 3, 0, 1, 3], ["FSP", 3, 4, 2, 3], ["RE", 3, [0, 4, 1, 5, 2, 6, 3, 7]], ["CA", 2, 3, 5], ["CHR", 1, "shared", [2]], ["CA", 2, 3, 6], ["CHR", 0, "shared", [3]], ["CA", 1, 4, 6], ["FU", 5, [0, 1]], ["AN", 5, 0, 5], ["FU", 5, [1, 2]], ["AN", 5, 1, 4], ["FU", 5, [2, 3]], ["AN", 5, 2, 6], ["FU", 3, [0, 1]], ["SP", 3, 0, 28, [1], 1], ["AN", 3, 1, 2], ["FFSP", 3, 0, [2, 1], 1, 1], ["AN", 3, 1, 6], ["FU", 1, [0, 1]], ["SP", 1, 0, 14, [1], 1], ["AN", 1, 1, 2], ["FFSP", 1, 0, [2, 1], 1, 1], ["AN", 1, 1, 6], ["PR", 4, 0, "auto_unroll_max_step$512"]]]], "r": [[0.00741617, 0.00741601, 0.00741537], 0, 5.31763, 1759455963], "v": "v0.6"}
{"i": [["[\"ansor_mm\", 642, 4096, 14336, \"float16\"]", "rocm -keys=rocm,gpu -max_num_threads=256 -max_shared_memory_per_block=49152 -max_threads_per_block=1024 -mcpu=gfx942 -model=unknown -mtriple=amdgcn-amd-amdhsa-hcc -thread_warp_size=64", [-1, 16, 64, 65536, 2147483647, 1024, 16, 64], "llvm -keys=cpu -mtriple=x86_64-unknown-linux-gnu", 0, []], [[], [["CHW", 2, "local"], ["SP", 2, 0, 642, [2, 107, 1, 3], 1], ["SP", 2, 5, 4096, [2, 8, 2, 1], 1], ["SP", 2, 10, 14336, [8, 2], 1], ["RE", 2, [0, 5, 1, 6, 2, 7, 10, 11, 3, 8, 12, 4, 9]], ["FSP", 3, 0, 1, 3], ["FSP", 3, 4, 2, 3], ["RE", 3, [0, 4, 1, 5, 2, 6, 3, 7]], ["CA", 2, 3, 5], ["CHR", 1, "shared", [2]], ["CA", 2, 3, 6], ["CHR", 0, "shared", [3]], ["CA", 1, 4, 6], ["FU", 5, [0, 1]], ["AN", 5, 0, 5], ["FU", 5, [1, 2]], ["AN", 5, 1, 4], ["FU", 5, [2, 3]], ["AN", 5, 2, 6], ["FU", 3, [0, 1]], ["SP", 3, 0, 32, [4], 1], ["AN", 3, 1, 2], ["FFSP", 3, 0, [2, 1], 1, 1], ["AN", 3, 1, 6], ["FU", 1, [0, 1]], ["SP", 1, 0, 48, [4], 1], ["AN", 1, 1, 2], ["FFSP", 1, 0, [2, 1], 1, 1], ["AN", 1, 1, 6], ["PR", 4, 0, "auto_unroll_max_step$16"]]]], "r": [[0.00275865, 0.00276155, 0.00275965], 0, 5.16319, 1759455965], "v": "v0.6"}
{"i": [["[\"ansor_mm\", 642, 4096, 14336, \"float16\"]", "rocm -keys=rocm,gpu -max_num_threads=256 -max_shared_memory_per_block=49152 -max_threads_per_block=1024 -mcpu=gfx942 -model=unknown -mtriple=amdgcn-amd-amdhsa-hcc -thread_warp_size=64", [-1, 16, 64, 65536, 2147483647, 1024, 16, 64], "llvm -keys=cpu -mtriple=x86_64-unknown-linux-gnu", 0, []], [[], [["CHW", 2, "local"], ["SP", 2, 0, 642, [3, 107, 1, 2], 1], ["SP", 2, 5, 4096, [2, 2, 32, 4], 1], ["SP", 2, 10, 14336, [1, 2], 1], ["RE", 2, [0, 5, 1, 6, 2, 7, 10, 11, 3, 8, 12, 4, 9]], ["FSP", 3, 0, 1, 3], ["FSP", 3, 4, 2, 3], ["RE", 3, [0, 4, 1, 5, 2, 6, 3, 7]], ["CA", 2, 3, 5], ["CHR", 1, "shared", [2]], ["CA", 2, 3, 6], ["CHR", 0, "shared", [3]], ["CA", 1, 4, 6], ["FU", 5, [0, 1]], ["AN", 5, 0, 5], ["FU", 5, [1, 2]], ["AN", 5, 1, 4], ["FU", 5, [2, 3]], ["AN", 5, 2, 6], ["FU", 3, [0, 1]], ["SP", 3, 0, 256, [1], 1], ["AN", 3, 1, 2], ["FFSP", 3, 0, [2, 1], 1, 1], ["AN", 3, 1, 6], ["FU", 1, [0, 1]], ["SP", 1, 0, 2, [1], 1], ["AN", 1, 1, 2], ["FFSP", 1, 0, [2, 1], 1, 1], ["AN", 1, 1, 6], ["PR", 4, 0, "auto_unroll_max_step$512"]]]], "r": [[0.345407, 0.345189, 0.345246], 0, 15.9213, 1759455978], "v": "v0.6"}
{"i": [["[\"ansor_mm\", 642, 4096, 14336, \"float16\"]", "rocm -keys=rocm,gpu -max_num_threads=256 -max_shared_memory_per_block=49152 -max_threads_per_block=1024 -mcpu=gfx942 -model=unknown -mtriple=amdgcn-amd-amdhsa-hcc -thread_warp_size=64", [-1, 16, 64, 65536, 2147483647, 1024, 16, 64], "llvm -keys=cpu -mtriple=x86_64-unknown-linux-gnu", 0, []], [[], [["CHW", 2, "local"], ["SP", 2, 0, 642, [1, 107, 1, 1], 1], ["SP", 2, 5, 4096, [16, 1, 1, 1], 1], ["SP", 2, 10, 14336, [16, 8], 1], ["RE", 2, [0, 5, 1, 6, 2, 7, 10, 11, 3, 8, 12, 4, 9]], ["FSP", 3, 0, 1, 3], ["FSP", 3, 4, 2, 3], ["RE", 3, [0, 4, 1, 5, 2, 6, 3, 7]], ["CA", 2, 3, 5], ["CHR", 1, "shared", [2]], ["CA", 2, 3, 6], ["CHR", 0, "shared", [3]], ["CA", 1, 4, 6], ["FU", 5, [0, 1]], ["AN", 5, 0, 5], ["FU", 5, [1, 2]], ["AN", 5, 1, 4], ["FU", 5, [2, 3]], ["AN", 5, 2, 6], ["FU", 3, [0, 1]], ["SP", 3, 0, 2048, [1], 1], ["AN", 3, 1, 2], ["FFSP", 3, 0, [2, 1], 1, 1], ["AN", 3, 1, 6], ["FU", 1, [0, 1]], ["SP", 1, 0, 128, [1], 1], ["AN", 1, 1, 2], ["FFSP", 1, 0, [2, 1], 1, 1], ["AN", 1, 1, 6], ["PR", 4, 0, "auto_unroll_max_step$1024"]]]], "r": [[0.020969, 0.020959, 0.0209061], 0, 5.99025, 1759456082], "v": "v0.6"}
{"i": [["[\"ansor_mm\", 642, 4096, 14336, \"float16\"]", "rocm -keys=rocm,gpu -max_num_threads=256 -max_shared_memory_per_block=49152 -max_threads_per_block=1024 -mcpu=gfx942 -model=unknown -mtriple=amdgcn-amd-amdhsa-hcc -thread_warp_size=64", [-1, 16, 64, 65536, 2147483647, 1024, 16, 64], "llvm -keys=cpu -mtriple=x86_64-unknown-linux-gnu", 0, []], [[], [["CHW", 2, "local"], ["SP", 2, 0, 642, [1, 1, 214, 3], 1], ["SP", 2, 5, 4096, [2, 256, 1, 1], 1], ["SP", 2, 10, 14336, [8, 1], 1], ["RE", 2, [0, 5, 1, 6, 2, 7, 10, 11, 3, 8, 12, 4, 9]], ["FSP", 3, 0, 1, 3], ["FSP", 3, 4, 2, 3], ["RE", 3, [0, 4, 1, 5, 2, 6, 3, 7]], ["CA", 2, 3, 5], ["CHR", 1, "shared", [2]], ["CA", 2, 3, 6], ["CHR", 0, "shared", [3]], ["CA", 1, 4, 6], ["FU", 5, [0, 1]], ["AN", 5, 0, 5], ["FU", 5, [1, 2]], ["AN", 5, 1, 4], ["FU", 5, [2, 3]], ["AN", 5, 2, 6], ["FU", 3, [0, 1]], ["SP", 3, 0, 8, [1], 1], ["AN", 3, 1, 2], ["FFSP", 3, 0, [2, 1], 1, 1], ["AN", 3, 1, 6], ["FU", 1, [0, 1]], ["SP", 1, 0, 2568, [1], 1], ["AN", 1, 1, 2], ["FFSP", 1, 0, [2, 1], 1, 1], ["AN", 1, 1, 6], ["PR", 4, 0, "auto_unroll_max_step$64"]]]], "r": [[0.600068, 0.599803, 0.598817], 0, 23.3764, 1759456103], "v": "v0.6"}
{"i": [["[\"ansor_mm\", 642, 4096, 14336, \"float16\"]", "rocm -keys=rocm,gpu -max_num_threads=256 -max_shared_memory_per_block=49152 -max_threads_per_block=1024 -mcpu=gfx942 -model=unknown -mtriple=amdgcn-amd-amdhsa-hcc -thread_warp_size=64", [-1, 16, 64, 65536, 2147483647, 1024, 16, 64], "llvm -keys=cpu -mtriple=x86_64-unknown-linux-gnu", 0, []], [[], [["CHW", 2, "local"], ["SP", 2, 0, 642, [3, 214, 1, 1], 1], ["SP", 2, 5, 4096, [1, 1, 1, 32], 1], ["SP", 2, 10, 14336, [2, 16], 1], ["RE", 2, [0, 5, 1, 6, 2, 7, 10, 11, 3, 8, 12, 4, 9]], ["FSP", 3, 0, 1, 3], ["FSP", 3, 4, 2, 3], ["RE", 3, [0, 4, 1, 5, 2, 6, 3, 7]], ["CA", 2, 3, 5], ["CHR", 1, "shared", [2]], ["CA", 2, 3, 6], ["CHR", 0, "shared", [3]], ["CA", 1, 4, 6], ["FU", 5, [0, 1]], ["AN", 5, 0, 5], ["FU", 5, [1, 2]], ["AN", 5, 1, 4], ["FU", 5, [2, 3]], ["AN", 5, 2, 6], ["FU", 3, [0, 1]], ["SP", 3, 0, 32, [1], 1], ["AN", 3, 1, 2], ["FFSP", 3, 0, [2, 1], 1, 1], ["AN", 3, 1, 6], ["FU", 1, [0, 1]], ["SP", 1, 0, 96, [1], 1], ["AN", 1, 1, 2], ["FFSP", 1, 0, [2, 1], 1, 1], ["AN", 1, 1, 6], ["PR", 4, 0, "auto_unroll_max_step$0"]]]], "r": [[0.00634416, 0.00634795, 0.00635109], 0, 5.07461, 1759456105], "v": "v0.6"}
{"i": [["[\"ansor_mm\", 642, 4096, 14336, \"float16\"]", "rocm -keys=rocm,gpu -max_num_threads=256 -max_shared_memory_per_block=49152 -max_threads_per_block=1024 -mcpu=gfx942 -model=unknown -mtriple=amdgcn-amd-amdhsa-hcc -thread_warp_size=64", [-1, 16, 64, 65536, 2147483647, 1024, 16, 64], "llvm -keys=cpu -mtriple=x86_64-unknown-linux-gnu", 0, []], [[], [["CHW", 2, "local"], ["SP", 2, 0, 642, [2, 107, 1, 3], 1], ["SP", 2, 5, 4096, [2, 8, 2, 1], 1], ["SP", 2, 10, 14336, [4, 4], 1], ["RE", 2, [0, 5, 1, 6, 2, 7, 10, 11, 3, 8, 12, 4, 9]], ["FSP", 3, 0, 1, 3], ["FSP", 3, 4, 2, 3], ["RE", 3, [0, 4, 1, 5, 2, 6, 3, 7]], ["CA", 2, 3, 5], ["CHR", 1, "shared", [2]], ["CA", 2, 3, 6], ["CHR", 0, "shared", [3]], ["CA", 1, 4, 6], ["FU", 5, [0, 1]], ["AN", 5, 0, 5], ["FU", 5, [1, 2]], ["AN", 5, 1, 4], ["FU", 5, [2, 3]], ["AN", 5, 2, 6], ["FU", 3, [0, 1]], ["SP", 3, 0, 32, [4], 1], ["AN", 3, 1, 2], ["FFSP", 3, 0, [2, 1], 1, 1], ["AN", 3, 1, 6], ["FU", 1, [0, 1]], ["SP", 1, 0, 48, [1], 1], ["AN", 1, 1, 2], ["FFSP", 1, 0, [2, 1], 1, 1], ["AN", 1, 1, 6], ["PR", 4, 0, "auto_unroll_max_step$16"]]]], "r": [[0.00450663, 0.00450723, 0.00450724], 0, 5.12618, 1759456108], "v": "v0.6"}
{"i": [["[\"ansor_mm\", 642, 4096, 14336, \"float16\"]", "rocm -keys=rocm,gpu -max_num_threads=256 -max_shared_memory_per_block=49152 -max_threads_per_block=1024 -mcpu=gfx942 -model=unknown -mtriple=amdgcn-amd-amdhsa-hcc -thread_warp_size=64", [-1, 16, 64, 65536, 2147483647, 1024, 16, 64], "llvm -keys=cpu -mtriple=x86_64-unknown-linux-gnu", 0, []], [[], [["CHW", 2, "local"], ["SP", 2, 0, 642, [6, 107, 1, 1], 1], ["SP", 2, 5, 4096, [1, 8, 2, 1], 1], ["SP", 2, 10, 14336, [1, 14], 1], ["RE", 2, [0, 5, 1, 6, 2, 7, 10, 11, 3, 8, 12, 4, 9]], ["FSP", 3, 0, 1, 3], ["FSP", 3, 4, 2, 3], ["RE", 3, [0, 4, 1, 5, 2, 6, 3, 7]], ["CA", 2, 3, 5], ["CHR", 1, "shared", [2]], ["CA", 2, 3, 6], ["CHR", 0, "shared", [3]], ["CA", 1, 4, 6], ["FU", 5, [0, 1]], ["AN", 5, 0, 5], ["FU", 5, [1, 2]], ["AN", 5, 1, 4], ["FU", 5, [2, 3]], ["AN", 5, 2, 6], ["FU", 3, [0, 1]], ["SP", 3, 0, 28, [1], 1], ["AN", 3, 1, 2], ["FFSP", 3, 0, [2, 1], 1, 1], ["AN", 3, 1, 6], ["FU", 1, [0, 1]], ["SP", 1, 0, 14, [1], 1], ["AN", 1, 1, 2], ["FFSP", 1, 0, [2, 1], 1, 1], ["AN", 1, 1, 6], ["PR", 4, 0, "auto_unroll_max_step$64"]]]], "r": [[0.00718818, 0.0071948, 0.00720347], 0, 5.10829, 1759456110], "v": "v0.6"}
{"i": [["[\"ansor_mm\", 642, 4096, 14336, \"float16\"]", "rocm -keys=rocm,gpu -max_num_threads=256 -max_shared_memory_per_block=49152 -max_threads_per_block=1024 -mcpu=gfx942 -model=unknown -mtriple=amdgcn-amd-amdhsa-hcc -thread_warp_size=64", [-1, 16, 64, 65536, 2147483647, 1024, 16, 64], "llvm -keys=cpu -mtriple=x86_64-unknown-linux-gnu", 0, []], [[], [["CHW", 2, "local"], ["SP", 2, 0, 642, [1, 1, 3, 1], 1], ["SP", 2, 5, 4096, [16, 1, 2, 2], 1], ["SP", 2, 10, 14336, [8, 7], 1], ["RE", 2, [0, 5, 1, 6, 2, 7, 10, 11, 3, 8, 12, 4, 9]], ["FSP", 3, 0, 1, 3], ["FSP", 3, 4, 2, 3], ["RE", 3, [0, 4, 1, 5, 2, 6, 3, 7]], ["CA", 2, 3, 5], ["CHR", 1, "shared", [2]], ["CA", 2, 3, 6], ["CHR", 0, "shared", [3]], ["CA", 1, 4, 6], ["FU", 5, [0, 1]], ["AN", 5, 0, 5], ["FU", 5, [1, 2]], ["AN", 5, 1, 4], ["FU", 5, [2, 3]], ["AN", 5, 2, 6], ["FU", 3, [0, 1]], ["SP", 3, 0, 448, [1], 1], ["AN", 3, 1, 2], ["FFSP", 3, 0, [2, 1], 1, 1], ["AN", 3, 1, 6], ["FU", 1, [0, 1]], ["SP", 1, 0, 168, [1], 1], ["AN", 1, 1, 2], ["FFSP", 1, 0, [2, 1], 1, 1], ["AN", 1, 1, 6], ["PR", 4, 0, "auto_unroll_max_step$64"]]]], "r": [[0.403397, 0.402396, 0.404702], 0, 17.383, 1759456124], "v": "v0.6"}
