demo_artifacts/logs/mm_ansor/log_641_4096_2880.json
{"i": [["[\"ansor_mm\", 641, 4096, 2880, \"float16\"]", "rocm -keys=rocm,gpu -max_num_threads=256 -max_shared_memory_per_block=49152 -max_threads_per_block=1024 -mcpu=gfx942 -model=unknown -mtriple=amdgcn-amd-amdhsa-hcc -thread_warp_size=64", [-1, 16, 64, 65536, 2147483647, 1024, 16, 64], "llvm -keys=cpu -mtriple=x86_64-unknown-linux-gnu", 0, []], [[], [["CHW", 2, "local"], ["SP", 2, 0, 641, [1, 641, 1, 1], 1], ["SP", 2, 5, 4096, [8, 1, 8, 8], 1], ["SP", 2, 10, 2880, [2, 1], 1], ["RE", 2, [0, 5, 1, 6, 2, 7, 10, 11, 3, 8, 12, 4, 9]], ["FSP", 3, 0, 1, 3], ["FSP", 3, 4, 2, 3], ["RE", 3, [0, 4, 1, 5, 2, 6, 3, 7]], ["CA", 2, 3, 5], ["CHR", 1, "shared", [2]], ["CA", 2, 3, 6], ["CHR", 0, "shared", [3]], ["CA", 1, 4, 6], ["FU", 5, [0, 1]], ["AN", 5, 0, 5], ["FU", 5, [1, 2]], ["AN", 5, 1, 4], ["FU", 5, [2, 3]], ["AN", 5, 2, 6], ["FU", 3, [0, 1]], ["SP", 3, 0, 128, [1], 1], ["AN", 3, 1, 2], ["FFSP", 3, 0, [2, 1], 1, 1], ["AN", 3, 1, 6], ["FU", 1, [0, 1]], ["SP", 1, 0, 2, [1], 1], ["AN", 1, 1, 2], ["FFSP", 1, 0, [2, 1], 1, 1], ["AN", 1, 1, 6], ["PR", 4, 0, "auto_unroll_max_step$16"]]]], "r": [[0.119878, 0.119883, 0.119919], 0, 7.30802, 1759480909], "v": "v0.6"}
{"i": [["[\"ansor_mm\", 641, 4096, 2880, \"float16\"]", "rocm -keys=rocm,gpu -max_num_threads=256 -max_shared_memory_per_block=49152 -max_threads_per_block=1024 -mcpu=gfx942 -model=unknown -mtriple=amdgcn-amd-amdhsa-hcc -thread_warp_size=64", [-1, 16, 64, 65536, 2147483647, 1024, 16, 64], "llvm -keys=cpu -mtriple=x86_64-unknown-linux-gnu", 0, []], [[], [["CHW", 2, "local"], ["SP", 2, 0, 641, [1, 641, 1, 1], 1], ["SP", 2, 5, 4096, [1, 1, 64, 4], 1], ["SP", 2, 10, 2880, [1, 2], 1], ["RE", 2, [0, 5, 1, 6, 2, 7, 10, 11, 3, 8, 12, 4, 9]], ["FSP", 3, 0, 1, 3], ["FSP", 3, 4, 2, 3], ["RE", 3, [0, 4, 1, 5, 2, 6, 3, 7]], ["CA", 2, 3, 5], ["CHR", 1, "shared", [2]], ["CA", 2, 3, 6], ["CHR", 0, "shared", [3]], ["CA", 1, 4, 6], ["FU", 5, [0, 1]], ["AN", 5, 0, 5], ["FU", 5, [1, 2]], ["AN", 5, 1, 4], ["FU", 5, [2, 3]], ["AN", 5, 2, 6], ["FU", 3, [0, 1]], ["SP", 3, 0, 512, [1], 1], ["AN", 3, 1, 2], ["FFSP", 3, 0, [2, 1], 1, 1], ["AN", 3, 1, 6], ["FU", 1, [0, 1]], ["SP", 1, 0, 8, [1], 1], ["AN", 1, 1, 2], ["FFSP", 1, 0, [2, 1], 1, 1], ["AN", 1, 1, 6], ["PR", 4, 0, "auto_unroll_max_step$16"]]]], "r": [[0.0611053, 0.0611301, 0.0611187], 0, 5.1056, 1759480911], "v": "v0.6"}
{"i": [["[\"ansor_mm\", 641, 4096, 2880, \"float16\"]", "rocm -keys=rocm,gpu -max_num_threads=256 -max_shared_memory_per_block=49152 -max_threads_per_block=1024 -mcpu=gfx942 -model=unknown -mtriple=amdgcn-amd-amdhsa-hcc -thread_warp_size=64", [-1, 16, 64, 65536, 2147483647, 1024, 16, 64], "llvm -keys=cpu -mtriple=x86_64-unknown-linux-gnu", 0, []], [[], [["CHW", 2, "local"], ["SP", 2, 0, 641, [1, 1, 1, 1], 1], ["SP", 2, 5, 4096, [8, 64, 1, 2], 1], ["SP", 2, 10, 2880, [15, 1], 1], ["RE", 2, [0, 5, 1, 6, 2, 7, 10, 11, 3, 8, 12, 4, 9]], ["FSP", 3, 0, 1, 3], ["FSP", 3, 4, 2, 3], ["RE", 3, [0, 4, 1, 5, 2, 6, 3, 7]], ["CA", 2, 3, 5], ["CHR", 1, "shared", [2]], ["CA", 2, 3, 6], ["CHR", 0, "shared", [3]], ["CA", 1, 4, 6], ["FU", 5, [0, 1]], ["AN", 5, 0, 5], ["FU", 5, [1, 2]], ["AN", 5, 1, 4], ["FU", 5, [2, 3]], ["AN", 5, 2, 6], ["FU", 3, [0, 1]], ["SP", 3, 0, 30, [6], 1], ["AN", 3, 1, 2], ["FFSP", 3, 0, [2, 1], 1, 1], ["AN", 3, 1, 6], ["FU", 1, [0, 1]], ["SP", 1, 0, 15, [1], 1], ["AN", 1, 1, 2], ["FFSP", 1, 0, [2, 1], 1, 1], ["AN", 1, 1, 6], ["PR", 4, 0, "auto_unroll_max_step$16"]]]], "r": [[0.0131723, 0.0131715, 0.0131701], 0, 3.50357, 1759480912], "v": "v0.6"}
{"i": [["[\"ansor_mm\", 641, 4096, 2880, \"float16\"]", "rocm -keys=rocm,gpu -max_num_threads=256 -max_shared_memory_per_block=49152 -max_threads_per_block=1024 -mcpu=gfx942 -model=unknown -mtriple=amdgcn-amd-amdhsa-hcc -thread_warp_size=64", [-1, 16, 64, 65536, 2147483647, 1024, 16, 64], "llvm -keys=cpu -mtriple=x86_64-unknown-linux-gnu", 0, []], [[], [["CHW", 2, "local"], ["SP", 2, 0, 641, [1, 641, 1, 1], 1], ["SP", 2, 5, 4096, [8, 1, 16, 2], 1], ["SP", 2, 10, 2880, [8, 2], 1], ["RE", 2, [0, 5, 1, 6, 2, 7, 10, 11, 3, 8, 12, 4, 9]], ["FSP", 3, 0, 1, 3], ["FSP", 3, 4, 2, 3], ["RE", 3, [0, 4, 1, 5, 2, 6, 3, 7]], ["CA", 2, 3, 5], ["CHR", 1, "shared", [2]], ["CA", 2, 3, 6], ["CHR", 0, "shared", [3]], ["CA", 1, 4, 6], ["FU", 5, [0, 1]], ["AN", 5, 0, 5], ["FU", 5, [1, 2]], ["AN", 5, 1, 4], ["FU", 5, [2, 3]], ["AN", 5, 2, 6], ["FU", 3, [0, 1]], ["SP", 3, 0, 512, [2], 1], ["AN", 3, 1, 2], ["FFSP", 3, 0, [2, 1], 1, 1], ["AN", 3, 1, 6], ["FU", 1, [0, 1]], ["SP", 1, 0, 16, [1], 1], ["AN", 1, 1, 2], ["FFSP", 1, 0, [2, 1], 1, 1], ["AN", 1, 1, 6], ["PR", 4, 0, "auto_unroll_max_step$64"]]]], "r": [[0.00831056, 0.00831522, 0.0083127], 0, 3.90675, 1759480913], "v": "v0.6"}
{"i": [["[\"ansor_mm\", 641, 4096, 2880, \"float16\"]", "rocm -keys=rocm,gpu -max_num_threads=256 -max_shared_memory_per_block=49152 -max_threads_per_block=1024 -mcpu=gfx942 -model=unknown -mtriple=amdgcn-amd-amdhsa-hcc -thread_warp_size=64", [-1, 16, 64, 65536, 2147483647, 1024, 16, 64], "llvm -keys=cpu -mtriple=x86_64-unknown-linux-gnu", 0, []], [[], [["CHW", 2, "local"], ["SP", 2, 0, 641, [1, 641, 1, 1], 1], ["SP", 2, 5, 4096, [1, 1, 1024, 1], 1], ["SP", 2, 10, 2880, [2, 1], 1], ["RE", 2, [0, 5, 1, 6, 2, 7, 10, 11, 3, 8, 12, 4, 9]], ["FSP", 3, 0, 1, 3], ["FSP", 3, 4, 2, 3], ["RE", 3, [0, 4, 1, 5, 2, 6, 3, 7]], ["CA", 2, 3, 5], ["CHR", 1, "shared", [2]], ["CA", 2, 3, 6], ["CHR", 0, "shared", [3]], ["CA", 1, 4, 6], ["FU", 5, [0, 1]], ["AN", 5, 0, 5], ["FU", 5, [1, 2]], ["AN", 5, 1, 4], ["FU", 5, [2, 3]], ["AN", 5, 2, 6], ["FU", 3, [0, 1]], ["SP", 3, 0, 8192, [1], 1], ["AN", 3, 1, 2], ["FFSP", 3, 0, [2, 1], 1, 1], ["AN", 3, 1, 6], ["FU", 1, [0, 1]], ["SP", 1, 0, 8, [8], 1], ["AN", 1, 1, 2], ["FFSP", 1, 0, [2, 1], 1, 1], ["AN", 1, 1, 6], ["PR", 4, 0, "auto_unroll_max_step$16"]]]], "r": [[0.235241, 0.235313, 0.235268], 0, 10.5163, 1759480921], "v": "v0.6"}
{"i": [["[\"ansor_mm\", 641, 4096, 2880, \"float16\"]", "rocm -keys=rocm,gpu -max_num_threads=256 -max_shared_memory_per_block=49152 -max_threads_per_block=1024 -mcpu=gfx942 -model=unknown -mtriple=amdgcn-amd-amdhsa-hcc -thread_warp_size=64", [-1, 16, 64, 65536, 2147483647, 1024, 16, 64], "llvm -keys=cpu -mtriple=x86_64-unknown-linux-gnu", 0, []], [[], [["CHW", 2, "local"], ["SP", 2, 0, 641, [1, 1, 1, 1], 1], ["SP", 2, 5, 4096, [2, 32, 1, 1], 1], ["SP", 2, 10, 2880, [36, 2], 1], ["RE", 2, [0, 5, 1, 6, 2, 7, 10, 11, 3, 8, 12, 4, 9]], ["FSP", 3, 0, 1, 3], ["FSP", 3, 4, 2, 3], ["RE", 3, [0, 4, 1, 5, 2, 6, 3, 7]], ["CA", 2, 3, 5], ["CHR", 1, "shared", [2]], ["CA", 2, 3, 6], ["CHR", 0, "shared", [3]], ["CA", 1, 4, 6], ["FU", 5, [0, 1]], ["AN", 5, 0, 5], ["FU", 5, [1, 2]], ["AN", 5, 1, 4], ["FU", 5, [2, 3]], ["AN", 5, 2, 6], ["FU", 3, [0, 1]], ["SP", 3, 0, 72, [1], 1], ["AN", 3, 1, 2], ["FFSP", 3, 0, [2, 1], 1, 1], ["AN", 3, 1, 6], ["FU", 1, [0, 1]], ["SP", 1, 0, 72, [1], 1], ["AN", 1, 1, 2], ["FFSP", 1, 0, [2, 1], 1, 1], ["AN", 1, 1, 6], ["PR", 4, 0, "auto_unroll_max_step$1024"]]]], "r": [[0.0215078, 0.0215119, 0.0215126], 0, 3.87924, 1759480922], "v": "v0.6"}
{"i": [["[\"ansor_mm\", 641, 4096, 2880, \"float16\"]", "rocm -keys=rocm,gpu -max_num_threads=256 -max_shared_memory_per_block=49152 -max_threads_per_block=1024 -mcpu=gfx942 -model=unknown -mtriple=amdgcn-amd-amdhsa-hcc -thread_warp_size=64", [-1, 16, 64, 65536, 2147483647, 1024, 16, 64], "llvm -keys=cpu -mtriple=x86_64-unknown-linux-gnu", 0, []], [[], [["CHW", 2, "local"], ["SP", 2, 0, 641, [1, 641, 1, 1], 1], ["SP", 2, 5, 4096, [8, 1, 16, 4], 1], ["SP", 2, 10, 2880, [1, 15], 1], ["RE", 2, [0, 5, 1, 6, 2, 7, 10, 11, 3, 8, 12, 4, 9]], ["FSP", 3, 0, 1, 3], ["FSP", 3, 4, 2, 3], ["RE", 3, [0, 4, 1, 5, 2, 6, 3, 7]], ["CA", 2, 3, 5], ["CHR", 1, "shared", [2]], ["CA", 2, 3, 6], ["CHR", 0, "shared", [3]], ["CA", 1, 4, 6], ["FU", 5, [0, 1]], ["AN", 5, 0, 5], ["FU", 5, [1, 2]], ["AN", 5, 1, 4], ["FU", 5, [2, 3]], ["AN", 5, 2, 6], ["FU", 3, [0, 1]], ["SP", 3, 0, 960, [1], 1], ["AN", 3, 1, 2], ["FFSP", 3, 0, [2, 1], 1, 1], ["AN", 3, 1, 6], ["FU", 1, [0, 1]], ["SP", 1, 0, 15, [1], 1], ["AN", 1, 1, 2], ["FFSP", 1, 0, [2, 1], 1, 1], ["AN", 1, 1, 6], ["PR", 4, 0, "auto_unroll_max_step$0"]]]], "r": [[0.233025, 0.232934, 0.232958], 0, 9.91518, 1759480930], "v": "v0.6"}
{"i": [["[\"ansor_mm\", 641, 4096, 2880, \"float16\"]", "rocm -keys=rocm,gpu -max_num_threads=256 -max_shared_memory_per_block=49152 -max_threads_per_block=1024 -mcpu=gfx942 -model=unknown -mtriple=amdgcn-amd-amdhsa-hcc -thread_warp_size=64", [-1, 16, 64, 65536, 2147483647, 1024, 16, 64], "llvm -keys=cpu -mtriple=x86_64-unknown-linux-gnu", 0, []], [[], [["CHW", 2, "local"], ["SP", 2, 0, 641, [1, 1, 641, 1], 1], ["SP", 2, 5, 4096, [4, 64, 1, 1], 1], ["SP", 2, 10, 2880, [1, 36], 1], ["RE", 2, [0, 5, 1, 6, 2, 7, 10, 11, 3, 8, 12, 4, 9]], ["FSP", 3, 0, 1, 3], ["FSP", 3, 4, 2, 3], ["RE", 3, [0, 4, 1, 5, 2, 6, 3, 7]], ["CA", 2, 3, 5], ["CHR", 1, "shared", [2]], ["CA", 2, 3, 6], ["CHR", 0, "shared", [3]], ["CA", 1, 4, 6], ["FU", 5, [0, 1]], ["AN", 5, 0, 5], ["FU", 5, [1, 2]], ["AN", 5, 1, 4], ["FU", 5, [2, 3]], ["AN", 5, 2, 6], ["FU", 3, [0, 1]], ["SP", 3, 0, 18, [3], 1], ["AN", 3, 1, 2], ["FFSP", 3, 0, [2, 1], 1, 1], ["AN", 3, 1, 6], ["FU", 1, [0, 1]], ["SP", 1, 0, 11538, [1], 1], ["AN", 1, 1, 2], ["FFSP", 1, 0, [2, 1], 1, 1], ["AN", 1, 1, 6], ["PR", 4, 0, "auto_unroll_max_step$1024"]]]], "r": [[0.315667, 0.314953, 0.315314], 0, 14.9389, 1759480940], "v": "v0.6"}
{"i": [["[\"ansor_mm\", 641, 4096, 2880, \"float16\"]", "rocm -keys=rocm,gpu -max_num_threads=256 -max_shared_memory_per_block=49152 -max_threads_per_block=1024 -mcpu=gfx942 -model=unknown -mtriple=amdgcn-amd-amdhsa-hcc -thread_warp_size=64", [-1, 16, 64, 65536, 2147483647, 1024, 16, 64], "llvm -keys=cpu -mtriple=x86_64-unknown-linux-gnu", 0, []], [[], [["CHW", 2, "local"], ["SP", 2, 0, 641, [1, 1, 641, 1], 1], ["SP", 2, 5, 4096, [2, 1, 8, 1], 1], ["SP", 2, 10, 2880, [4, 1], 1], ["RE", 2, [0, 5, 1, 6, 2, 7, 10, 11, 3, 8, 12, 4, 9]], ["FSP", 3, 0, 1, 3], ["FSP", 3, 4, 2, 3], ["RE", 3, [0, 4, 1, 5, 2, 6, 3, 7]], ["CA", 2, 3, 5], ["CHR", 1, "shared", [2]], ["CA", 2, 3, 6], ["CHR", 0, "shared", [3]], ["CA", 1, 4, 6], ["FU", 5, [0, 1]], ["AN", 5, 0, 5], ["FU", 5, [1, 2]], ["AN", 5, 1, 4], ["FU", 5, [2, 3]], ["AN", 5, 2, 6], ["FU", 3, [0, 1]], ["SP", 3, 0, 32, [1], 1], ["AN", 3, 1, 2], ["FFSP", 3, 0, [2, 1], 1, 1], ["AN", 3, 1, 6], ["FU", 1, [0, 1]], ["SP", 1, 0, 4, [1], 1], ["AN", 1, 1, 2], ["FFSP", 1, 0, [2, 1], 1, 1], ["AN", 1, 1, 6], ["PR", 4, 0, "auto_unroll_max_step$1024"]]]], "r": [[0.454709, 0.454585, 0.454285], 0, 17.3337, 1759480955], "v": "v0.6"}
{"i": [["[\"ansor_mm\", 641, 4096, 2880, \"float16\"]", "rocm -keys=rocm,gpu -max_num_threads=256 -max_shared_memory_per_block=49152 -max_threads_per_block=1024 -mcpu=gfx942 -model=unknown -mtriple=amdgcn-amd-amdhsa-hcc -thread_warp_size=64", [-1, 16, 64, 65536, 2147483647, 1024, 16, 64], "llvm -keys=cpu -mtriple=x86_64-unknown-linux-gnu", 0, []], [[], [["CHW", 2, "local"], ["SP", 2, 0, 641, [1, 641, 1, 1], 1], ["SP", 2, 5, 4096, [8, 1, 16, 2], 1], ["SP", 2, 10, 2880, [2, 8], 1], ["RE", 2, [0, 5, 1, 6, 2, 7, 10, 11, 3, 8, 12, 4, 9]], ["FSP", 3, 0, 1, 3], ["FSP", 3, 4, 2, 3], ["RE", 3, [0, 4, 1, 5, 2, 6, 3, 7]], ["CA", 2, 3, 5], ["CHR", 1, "shared", [2]], ["CA", 2, 3, 6], ["CHR", 0, "shared", [3]], ["CA", 1, 4, 6], ["FU", 5, [0, 1]], ["AN", 5, 0, 5], ["FU", 5, [1, 2]], ["AN", 5, 1, 4], ["FU", 5, [2, 3]], ["AN", 5, 2, 6], ["FU", 3, [0, 1]], ["SP", 3, 0, 512, [1], 1], ["AN", 3, 1, 2], ["FFSP", 3, 0, [2, 1], 1, 1], ["AN", 3, 1, 6], ["FU", 1, [0, 1]], ["SP", 1, 0, 16, [1], 1], ["AN", 1, 1, 2], ["FFSP", 1, 0, [2, 1], 1, 1], ["AN", 1, 1, 6], ["PR", 4, 0, "auto_unroll_max_step$64"]]]], "r": [[0.00783941, 0.00783461, 0.00782875], 0, 3.93164, 1759480956], "v": "v0.6"}
{"i": [["[\"ansor_mm\", 641, 4096, 2880, \"float16\"]", "rocm -keys=rocm,gpu -max_num_threads=256 -max_shared_memory_per_block=49152 -max_threads_per_block=1024 -mcpu=gfx942 -model=unknown -mtriple=amdgcn-amd-amdhsa-hcc -thread_warp_size=64", [-1, 16, 64, 65536, 2147483647, 1024, 16, 64], "llvm -keys=cpu -mtriple=x86_64-unknown-linux-gnu", 0, []], [[], [["CHW", 2, "local"], ["SP", 2, 0, 641, [1, 1, 641, 1], 1], ["SP", 2, 5, 4096, [4, 128, 2, 1], 1], ["SP", 2, 10, 2880, [1, 4], 1], ["RE", 2, [0, 5, 1, 6, 2, 7, 10, 11, 3, 8, 12, 4, 9]], ["FSP", 3, 0, 1, 3], ["FSP", 3, 4, 2, 3], ["RE", 3, [0, 4, 1, 5, 2, 6, 3, 7]], ["CA", 2, 3, 5], ["CHR", 1, "shared", [2]], ["CA", 2, 3, 6], ["CHR", 0, "shared", [3]], ["CA", 1, 4, 6], ["FU", 5, [0, 1]], ["AN", 5, 0, 5], ["FU", 5, [1, 2]], ["AN", 5, 1, 4], ["FU", 5, [2, 3]], ["AN", 5, 2, 6], ["FU", 3, [0, 1]], ["SP", 3, 0, 4, [1], 1], ["AN", 3, 1, 2], ["FFSP", 3, 0, [2, 1], 1, 1], ["AN", 3, 1, 6], ["FU", 1, [0, 1]], ["SP", 1, 0, 1282, [1], 1], ["AN", 1, 1, 2], ["FFSP", 1, 0, [2, 1], 1, 1], ["AN", 1, 1, 6], ["PR", 4, 0, "auto_unroll_max_step$512"]]]], "r": [[0.138512, 0.138851, 0.138493], 0, 7.35442, 1759480960], "v": "v0.6"}
{"i": [["[\"ansor_mm\", 641, 4096, 2880, \"float16\"]", "rocm -keys=rocm,gpu -max_num_threads=256 -max_shared_memory_per_block=49152 -max_threads_per_block=1024 -mcpu=gfx942 -model=unknown -mtriple=amdgcn-amd-amdhsa-hcc -thread_warp_size=64", [-1, 16, 64, 65536, 2147483647, 1024, 16, 64], "llvm -keys=cpu -mtriple=x86_64-unknown-linux-gnu", 0, []], [[], [["CHW", 2, "local"], ["SP", 2, 0, 641, [1, 1, 641, 1], 1], ["SP", 2, 5, 4096, [2, 1, 16, 1], 1], ["SP", 2, 10, 2880, [3, 4], 1], ["RE", 2, [0, 5, 1, 6, 2, 7, 10, 11, 3, 8, 12, 4, 9]], ["FSP", 3, 0, 1, 3], ["FSP", 3, 4, 2, 3], ["RE", 3, [0, 4, 1, 5, 2, 6, 3, 7]], ["CA", 2, 3, 5], ["CHR", 1, "shared", [2]], ["CA", 2, 3, 6], ["CHR", 0, "shared", [3]], ["CA", 1, 4, 6], ["FU", 5, [0, 1]], ["AN", 5, 0, 5], ["FU", 5, [1, 2]], ["AN", 5, 1, 4], ["FU", 5, [2, 3]], ["AN", 5, 2, 6], ["FU", 3, [0, 1]], ["SP", 3, 0, 64, [1], 1], ["AN", 3, 1, 2], ["FFSP", 3, 0, [2, 1], 1, 1], ["AN", 3, 1, 6], ["FU", 1, [0, 1]], ["SP", 1, 0, 4, [4], 1], ["AN", 1, 1, 2], ["FFSP", 1, 0, [2, 1], 1, 1], ["AN", 1, 1, 6], ["PR", 4, 0, "auto_unroll_max_step$1024"]]]], "r": [[1.06575, 1.06667, 1.06677], 0, 36.712, 1759480994], "v": "v0.6"}
{"i": [["[\"ansor_mm\", 641, 4096, 2880, \"float16\"]", "rocm -keys=rocm,gpu -max_num_threads=256 -max_shared_memory_per_block=49152 -max_threads_per_block=1024 -mcpu=gfx942 -model=unknown -mtriple=amdgcn-amd-amdhsa-hcc -thread_warp_size=64", [-1, 16, 64, 65536, 2147483647, 1024, 16, 64], "llvm -keys=cpu -mtriple=x86_64-unknown-linux-gnu", 0, []], [[], [["CHW", 2, "local"], ["SP", 2, 0, 641, [1, 641, 1, 1], 1], ["SP", 2, 5, 4096, [8, 1, 16, 4], 1], ["SP", 2, 10, 2880, [1, 15], 1], ["RE", 2, [0, 5, 1, 6, 2, 7, 10, 11, 3, 8, 12, 4, 9]], ["FSP", 3, 0, 1, 3], ["FSP", 3, 4, 2, 3], ["RE", 3, [0, 4, 1, 5, 2, 6, 3, 7]], ["CA", 2, 3, 5], ["CHR", 1, "shared", [2]], ["CA", 2, 3, 6], ["CHR", 0, "shared", [3]], ["CA", 1, 4, 6], ["FU", 5, [0, 1]], ["AN", 5, 0, 5], ["FU", 5, [1, 2]], ["AN", 5, 1, 4], ["FU", 5, [2, 3]], ["AN", 5, 2, 6], ["FU", 3, [0, 1]], ["SP", 3, 0, 960, [1], 1], ["AN", 3, 1, 2], ["FFSP", 3, 0, [2, 1], 1, 1], ["AN", 3, 1, 6], ["FU", 1, [0, 1]], ["SP", 1, 0, 15, [3], 1], ["AN", 1, 1, 2], ["FFSP", 1, 0, [2, 1], 1, 1], ["AN", 1, 1, 6], ["PR", 4, 0, "auto_unroll_max_step$0"]]]], "r": [[0.238382, 0.238442, 0.238379], 0, 10.554, 1759481002], "v": "v0.6"}
{"i": [["[\"ansor_mm\", 641, 4096, 2880, \"float16\"]", "rocm -keys=rocm,gpu -max_num_threads=256 -max_shared_memory_per_block=49152 -max_threads_per_block=1024 -mcpu=gfx942 -model=unknown -mtriple=amdgcn-amd-amdhsa-hcc -thread_warp_size=64", [-1, 16, 64, 65536, 2147483647, 1024, 16, 64], "llvm -keys=cpu -mtriple=x86_64-unknown-linux-gnu", 0, []], [[], [["CHW", 2, "local"], ["SP", 2, 0, 641, [1, 641, 1, 1], 1], ["SP", 2, 5, 4096, [1, 1, 16, 32], 1], ["SP", 2, 10, 2880, [1, 24], 1], ["RE", 2, [0, 5, 1, 6, 2, 7, 10, 11, 3, 8, 12, 4, 9]], ["FSP", 3, 0, 1, 3], ["FSP", 3, 4, 2, 3], ["RE", 3, [0, 4, 1, 5, 2, 6, 3, 7]], ["CA", 2, 3, 5], ["CHR", 1, "shared", [2]], ["CA", 2, 3, 6], ["CHR", 0, "shared", [3]], ["CA", 1, 4, 6], ["FU", 5, [0, 1]], ["AN", 5, 0, 5], ["FU", 5, [1, 2]], ["AN", 5, 1, 4], ["FU", 5, [2, 3]], ["AN", 5, 2, 6], ["FU", 3, [0, 1]], ["SP", 3, 0, 12288, [6], 1], ["AN", 3, 1, 2], ["FFSP", 3, 0, [2, 1], 1, 1], ["AN", 3, 1, 6], ["FU", 1, [0, 1]], ["SP", 1, 0, 24, [6], 1], ["AN", 1, 1, 2], ["FFSP", 1, 0, [2, 1], 1, 1], ["AN", 1, 1, 6], ["PR", 4, 0, "auto_unroll_max_step$1024"]]]], "r": [[0.046004, 0.0460296, 0.0460038], 0, 5.24478, 1759481004], "v": "v0.6"}
{"i": [["[\"ansor_mm\", 641, 4096, 2880, \"float16\"]", "rocm -keys=rocm,gpu -max_num_threads=256 -max_shared_memory_per_block=49152 -max_threads_per_block=1024 -mcpu=gfx942 -model=unknown -mtriple=amdgcn-amd-amdhsa-hcc -thread_warp_size=64", [-1, 16, 64, 65536, 2147483647, 1024, 16, 64], "llvm -keys=cpu -mtriple=x86_64-unknown-linux-gnu", 0, []], [[], [["CHW", 2, "local"], ["SP", 2, 0, 641, [1, 1, 1, 1], 1], ["SP", 2, 5, 4096, [4, 128, 2, 1], 1], ["SP", 2, 10, 2880, [6, 1], 1], ["RE", 2, [0, 5, 1, 6, 2, 7, 10, 11, 3, 8, 12, 4, 9]], ["FSP", 3, 0, 1, 3], ["FSP", 3, 4, 2, 3], ["RE", 3, [0, 4, 1, 5, 2, 6, 3, 7]], ["CA", 2, 3, 5], ["CHR", 1, "shared", [2]], ["CA", 2, 3, 6], ["CHR", 0, "shared", [3]], ["CA", 1, 4, 6], ["FU", 5, [0, 1]], ["AN", 5, 0, 5], ["FU", 5, [1, 2]], ["AN", 5, 1, 4], ["FU", 5, [2, 3]], ["AN", 5, 2, 6], ["FU", 3, [0, 1]], ["SP", 3, 0, 12, [1], 1], ["AN", 3, 1, 2], ["FFSP", 3, 0, [2, 1], 1, 1], ["AN", 3, 1, 6], ["FU", 1, [0, 1]], ["SP", 1, 0, 6, [3], 1], ["AN", 1, 1, 2], ["FFSP", 1, 0, [2, 1], 1, 1], ["AN", 1, 1, 6], ["PR", 4, 0, "auto_unroll_max_step$512"]]]], "r": [[0.00200603, 0.00201205, 0.00201301], 0, 3.63065, 1759481005], "v": "v0.6"}
{"i": [["[\"ansor_mm\", 641, 4096, 2880, \"float16\"]", "rocm -keys=rocm,gpu -max_num_threads=256 -max_shared_memory_per_block=49152 -max_threads_per_block=1024 -mcpu=gfx942 -model=unknown -mtriple=amdgcn-amd-amdhsa-hcc -thread_warp_size=64", [-1, 16, 64, 65536, 2147483647, 1024, 16, 64], "llvm -keys=cpu -mtriple=x86_64-unknown-linux-gnu", 0, []], [[], [["CHW", 2, "local"], ["SP", 2, 0, 641, [1, 1, 641, 1], 1], ["SP", 2, 5, 4096, [4, 128, 4, 1], 1], ["SP", 2, 10, 2880, [1, 1], 1], ["RE", 2, [0, 5, 1, 6, 2, 7, 10, 11, 3, 8, 12, 4, 9]], ["FSP", 3, 0, 1, 3], ["FSP", 3, 4, 2, 3], ["RE", 3, [0, 4, 1, 5, 2, 6, 3, 7]], ["CA", 2, 3, 5], ["CHR", 1, "shared", [2]], ["CA", 2, 3, 6], ["CHR", 0, "shared", [3]], ["CA", 1, 4, 6], ["FU", 5, [0, 1]], ["AN", 5, 0, 5], ["FU", 5, [1, 2]], ["AN", 5, 1, 4], ["FU", 5, [2, 3]], ["AN", 5, 2, 6], ["FU", 3, [0, 1]], ["SP", 3, 0, 4, [1], 1], ["AN", 3, 1, 2], ["FFSP", 3, 0, [2, 1], 1, 1], ["AN", 3, 1, 6], ["FU", 1, [0, 1]], ["SP", 1, 0, 1282, [1], 1], ["AN", 1, 1, 2], ["FFSP", 1, 0, [2, 1], 1, 1], ["AN", 1, 1, 6], ["PR", 4, 0, "auto_unroll_max_step$512"]]]], "r": [[0.501674, 0.499052, 0.500228], 0, 18.5201, 1759481021], "v": "v0.6"}
{"i": [["[\"ansor_mm\", 641, 4096, 2880, \"float16\"]", "rocm -keys=rocm,gpu -max_num_threads=256 -max_shared_memory_per_block=49152 -max_threads_per_block=1024 -mcpu=gfx942 -model=unknown -mtriple=amdgcn-amd-amdhsa-hcc -thread_warp_size=64", [-1, 16, 64, 65536, 2147483647, 1024, 16, 64], "llvm -keys=cpu -mtriple=x86_64-unknown-linux-gnu", 0, []], [[], [["CHW", 2, "local"], ["SP", 2, 0, 641, [1, 1, 641, 1], 1], ["SP", 2, 5, 4096, [1, 64, 4, 1], 1], ["SP", 2, 10, 2880, [1, 5], 1], ["RE", 2, [0, 5, 1, 6, 2, 7, 10, 11, 3, 8, 12, 4, 9]], ["FSP", 3, 0, 1, 3], ["FSP", 3, 4, 2, 3], ["RE", 3, [0, 4, 1, 5, 2, 6, 3, 7]], ["CA", 2, 3, 5], ["CHR", 1, "shared", [2]], ["CA", 2, 3, 6], ["CHR", 0, "shared", [3]], ["CA", 1, 4, 6], ["FU", 5, [0, 1]], ["AN", 5, 0, 5], ["FU", 5, [1, 2]], ["AN", 5, 1, 4], ["FU", 5, [2, 3]], ["AN", 5, 2, 6], ["FU", 3, [0, 1]], ["SP", 3, 0, 10, [1], 1], ["AN", 3, 1, 2], ["FFSP", 3, 0, [2, 1], 1, 1], ["AN", 3, 1, 6], ["FU", 1, [0, 1]], ["SP", 1, 0, 3205, [1], 1], ["AN", 1, 1, 2], ["FFSP", 1, 0, [2, 1], 1, 1], ["AN", 1, 1, 6], ["PR", 4, 0, "auto_unroll_max_step$0"]]]], "r": [[0.13659, 0.136644, 0.136625], 0, 7.26594, 1759481026], "v": "v0.6"}
{"i": [["[\"ansor_mm\", 641, 4096, 2880, \"float16\"]", "rocm -keys=rocm,gpu -max_num_threads=256 -max_shared_memory_per_block=49152 -max_threads_per_block=1024 -mcpu=gfx942 -model=unknown -mtriple=amdgcn-amd-amdhsa-hcc -thread_warp_size=64", [-1, 16, 64, 65536, 2147483647, 1024, 16, 64], "llvm -keys=cpu -mtriple=x86_64-unknown-linux-gnu", 0, []], [[], [["CHW", 2, "local"], ["SP", 2, 0, 641, [1, 1, 1, 1], 1], ["SP", 2, 5, 4096, [4, 64, 4, 1], 1], ["SP", 2, 10, 2880, [5, 2], 1], ["RE", 2, [0, 5, 1, 6, 2, 7, 10, 11, 3, 8, 12, 4, 9]], ["FSP", 3, 0, 1, 3], ["FSP", 3, 4, 2, 3], ["RE", 3, [0, 4, 1, 5, 2, 6, 3, 7]], ["CA", 2, 3, 5], ["CHR", 1, "shared", [2]], ["CA", 2, 3, 6], ["CHR", 0, "shared", [3]], ["CA", 1, 4, 6], ["FU", 5, [0, 1]], ["AN", 5, 0, 5], ["FU", 5, [1, 2]], ["AN", 5, 1, 4], ["FU", 5, [2, 3]], ["AN", 5, 2, 6], ["FU", 3, [0, 1]], ["SP", 3, 0, 80, [1], 1], ["AN", 3, 1, 2], ["FFSP", 3, 0, [2, 1], 1, 1], ["AN", 3, 1, 6], ["FU", 1, [0, 1]], ["SP", 1, 0, 6410, [5], 1], ["AN", 1, 1, 2], ["FFSP", 1, 0, [2, 1], 1, 1], ["AN", 1, 1, 6], ["PR", 4, 0, "auto_unroll_max_step$512"]]]], "r": [[0.00264931, 0.00265736, 0.00265937], 0, 3.66041, 1759481027], "v": "v0.6"}
{"i": [["[\"ansor_mm\", 641, 4096, 2880, \"float16\"]", "rocm -keys=rocm,gpu -max_num_threads=256 -max_shared_memory_per_block=49152 -max_threads_per_block=1024 -mcpu=gfx942 -model=unknown -mtriple=amdgcn-amd-amdhsa-hcc -thread_warp_size=64", [-1, 16, 64, 65536, 2147483647, 1024, 16, 64], "llvm -keys=cpu -mtriple=x86_64-unknown-linux-gnu", 0, []], [[], [["CHW", 2, "local"], ["SP", 2, 0, 641, [1, 641, 1, 1], 1], ["SP", 2, 5, 4096, [1, 1, 1, 64], 1], ["SP", 2, 10, 2880, [5, 4], 1], ["RE", 2, [0, 5, 1, 6, 2, 7, 10, 11, 3, 8, 12, 4, 9]], ["FSP", 3, 0, 1, 3], ["FSP", 3, 4, 2, 3], ["RE", 3, [0, 4, 1, 5, 2, 6, 3, 7]], ["CA", 2, 3, 5], ["CHR", 1, "shared", [2]], ["CA", 2, 3, 6], ["CHR", 0, "shared", [3]], ["CA", 1, 4, 6], ["FU", 5, [0, 1]], ["AN", 5, 0, 5], ["FU", 5, [1, 2]], ["AN", 5, 1, 4], ["FU", 5, [2, 3]], ["AN", 5, 2, 6], ["FU", 3, [0, 1]], ["SP", 3, 0, 1280, [1], 1], ["AN", 3, 1, 2], ["FFSP", 3, 0, [2, 1], 1, 1], ["AN", 3, 1, 6], ["FU", 1, [0, 1]], ["SP", 1, 0, 20, [2], 1], ["AN", 1, 1, 2], ["FFSP", 1, 0, [2, 1], 1, 1], ["AN", 1, 1, 6], ["PR", 4, 0, "auto_unroll_max_step$512"]]]], "r": [[0.00144842, 0.0014487, 0.0014489], 0, 3.70502, 1759481028], "v": "v0.6"}
{"i": [["[\"ansor_mm\", 641, 4096, 2880, \"float16\"]", "rocm -keys=rocm,gpu -max_num_threads=256 -max_shared_memory_per_block=49152 -max_threads_per_block=1024 -mcpu=gfx942 -model=unknown -mtriple=amdgcn-amd-amdhsa-hcc -thread_warp_size=64", [-1, 16, 64, 65536, 2147483647, 1024, 16, 64], "llvm -keys=cpu -mtriple=x86_64-unknown-linux-gnu", 0, []], [[], [["CHW", 2, "local"], ["SP", 2, 0, 641, [1, 1, 1, 1], 1], ["SP", 2, 5, 4096, [1, 512, 2, 1], 1], ["SP", 2, 10, 2880, [18, 1], 1], ["RE", 2, [0, 5, 1, 6, 2, 7, 10, 11, 3, 8, 12, 4, 9]], ["FSP", 3, 0, 1, 3], ["FSP", 3, 4, 2, 3], ["RE", 3, [0, 4, 1, 5, 2, 6, 3, 7]], ["CA", 2, 3, 5], ["CHR", 1, "shared", [2]], ["CA", 2, 3, 6], ["CHR", 0, "shared", [3]], ["CA", 1, 4, 6], ["FU", 5, [0, 1]], ["AN", 5, 0, 5], ["FU", 5, [1, 2]], ["AN", 5, 1, 4], ["FU", 5, [2, 3]], ["AN", 5, 2, 6], ["FU", 3, [0, 1]], ["SP", 3, 0, 144, [1], 1], ["AN", 3, 1, 2], ["FFSP", 3, 0, [2, 1], 1, 1], ["AN", 3, 1, 6], ["FU", 1, [0, 1]], ["SP", 1, 0, 18, [1], 1], ["AN", 1, 1, 2], ["FFSP", 1, 0, [2, 1], 1, 1], ["AN", 1, 1, 6], ["PR", 4, 0, "auto_unroll_max_step$1024"]]]], "r": [[0.00488116, 0.00488075, 0.00487977], 0, 3.42525, 1759481029], "v": "v0.6"}
{"i": [["[\"ansor_mm\", 641, 4096, 2880, \"float16\"]", "rocm -keys=rocm,gpu -max_num_threads=256 -max_shared_memory_per_block=49152 -max_threads_per_block=1024 -mcpu=gfx942 -model=unknown -mtriple=amdgcn-amd-amdhsa-hcc -thread_warp_size=64", [-1, 16, 64, 65536, 2147483647, 1024, 16, 64], "llvm -keys=cpu -mtriple=x86_64-unknown-linux-gnu", 0, []], [[], [["CHW", 2, "local"], ["SP", 2, 0, 641, [1, 641, 1, 1], 1], ["SP", 2, 5, 4096, [1, 1, 1, 8], 1], ["SP", 2, 10, 2880, [6, 1], 1], ["RE", 2, [0, 5, 1, 6, 2, 7, 10, 11, 3, 8, 12, 4, 9]], ["FSP", 3, 0, 1, 3], ["FSP", 3, 4, 2, 3], ["RE", 3, [0, 4, 1, 5, 2, 6, 3, 7]], ["CA", 2, 3, 5], ["CHR", 1, "shared", [2]], ["CA", 2, 3, 6], ["CHR", 0, "shared", [3]], ["CA", 1, 4, 6], ["FU", 5, [0, 1]], ["AN", 5, 0, 5], ["FU", 5, [1, 2]], ["AN", 5, 1, 4], ["FU", 5, [2, 3]], ["AN", 5, 2, 6], ["FU", 3, [0, 1]], ["SP", 3, 0, 96, [3], 1], ["AN", 3, 1, 2], ["FFSP", 3, 0, [2, 1], 1, 1], ["AN", 3, 1, 6], ["FU", 1, [0, 1]], ["SP", 1, 0, 6, [1], 1], ["AN", 1, 1, 2], ["FFSP", 1, 0, [2, 1], 1, 1], ["AN", 1, 1, 6], ["PR", 4, 0, "auto_unroll_max_step$64"]]]], "r": [[0.00139247, 0.00139402, 0.001396], 0, 3.6203, 1759481030], "v": "v0.6"}
{"i": [["[\"ansor_mm\", 641, 4096, 2880, \"float16\"]", "rocm -keys=rocm,gpu -max_num_threads=256 -max_shared_memory_per_block=49152 -max_threads_per_block=1024 -mcpu=gfx942 -model=unknown -mtriple=amdgcn-amd-amdhsa-hcc -thread_warp_size=64", [-1, 16, 64, 65536, 2147483647, 1024, 16, 64], "llvm -keys=cpu -mtriple=x86_64-unknown-linux-gnu", 0, []], [[], [["CHW", 2, "local"], ["SP", 2, 0, 641, [1, 1, 1, 1], 1], ["SP", 2, 5, 4096, [1, 64, 1, 4], 1], ["SP", 2, 10, 2880, [4, 1], 1], ["RE", 2, [0, 5, 1, 6, 2, 7, 10, 11, 3, 8, 12, 4, 9]], ["FSP", 3, 0, 1, 3], ["FSP", 3, 4, 2, 3], ["RE", 3, [0, 4, 1, 5, 2, 6, 3, 7]], ["CA", 2, 3, 5], ["CHR", 1, "shared", [2]], ["CA", 2, 3, 6], ["CHR", 0, "shared", [3]], ["CA", 1, 4, 6], ["FU", 5, [0, 1]], ["AN", 5, 0, 5], ["FU", 5, [1, 2]], ["AN", 5, 1, 4], ["FU", 5, [2, 3]], ["AN", 5, 2, 6], ["FU", 3, [0, 1]], ["SP", 3, 0, 16, [4], 1], ["AN", 3, 1, 2], ["FFSP", 3, 0, [2, 1], 1, 1], ["AN", 3, 1, 6], ["FU", 1, [0, 1]], ["SP", 1, 0, 4, [1], 1], ["AN", 1, 1, 2], ["FFSP", 1, 0, [2, 1], 1, 1], ["AN", 1, 1, 6], ["PR", 4, 0, "auto_unroll_max_step$0"]]]], "r": [[0.00119828, 0.00119962, 0.00120178], 0, 3.62263, 1759481031], "v": "v0.6"}
{"i": [["[\"ansor_mm\", 641, 4096, 2880, \"float16\"]", "rocm -keys=rocm,gpu -max_num_threads=256 -max_shared_memory_per_block=49152 -max_threads_per_block=1024 -mcpu=gfx942 -model=unknown -mtriple=amdgcn-amd-amdhsa-hcc -thread_warp_size=64", [-1, 16, 64, 65536, 2147483647, 1024, 16, 64], "llvm -keys=cpu -mtriple=x86_64-unknown-linux-gnu", 0, []], [[], [["CHW", 2, "local"], ["SP", 2, 0, 641, [1, 1, 1, 1], 1], ["SP", 2, 5, 4096, [1, 64, 1, 16], 1], ["SP", 2, 10, 2880, [2, 9], 1], ["RE", 2, [0, 5, 1, 6, 2, 7, 10, 11, 3, 8, 12, 4, 9]], ["FSP", 3, 0, 1, 3], ["FSP", 3, 4, 2, 3], ["RE", 3, [0, 4, 1, 5, 2, 6, 3, 7]], ["CA", 2, 3, 5], ["CHR", 1, "shared", [2]], ["CA", 2, 3, 6], ["CHR", 0, "shared", [3]], ["CA", 1, 4, 6], ["FU", 5, [0, 1]], ["AN", 5, 0, 5], ["FU", 5, [1, 2]], ["AN", 5, 1, 4], ["FU", 5, [2, 3]], ["AN", 5, 2, 6], ["FU", 3, [0, 1]], ["SP", 3, 0, 288, [1], 1], ["AN", 3, 1, 2], ["FFSP", 3, 0, [2, 1], 1, 1], ["AN", 3, 1, 6], ["FU", 1, [0, 1]], ["SP", 1, 0, 18, [1], 1], ["AN", 1, 1, 2], ["FFSP", 1, 0, [2, 1], 1, 1], ["AN", 1, 1, 6], ["PR", 4, 0, "auto_unroll_max_step$512"]]]], "r": [[0.00526506, 0.00526578, 0.00526594], 0, 3.59278, 1759481032], "v": "v0.6"}
{"i": [["[\"ansor_mm\", 641, 4096, 2880, \"float16\"]", "rocm -keys=rocm,gpu -max_num_threads=256 -max_shared_memory_per_block=49152 -max_threads_per_block=1024 -mcpu=gfx942 -model=unknown -mtriple=amdgcn-amd-amdhsa-hcc -thread_warp_size=64", [-1, 16, 64, 65536, 2147483647, 1024, 16, 64], "llvm -keys=cpu -mtriple=x86_64-unknown-linux-gnu", 0, []], [[], [["CHW", 2, "local"], ["SP", 2, 0, 641, [1, 1, 1, 1], 1], ["SP", 2, 5, 4096, [2, 64, 2, 4], 1], ["SP", 2, 10, 2880, [1, 6], 1], ["RE", 2, [0, 5, 1, 6, 2, 7, 10, 11, 3, 8, 12, 4, 9]], ["FSP", 3, 0, 1, 3], ["FSP", 3, 4, 2, 3], ["RE", 3, [0, 4, 1, 5, 2, 6, 3, 7]], ["CA", 2, 3, 5], ["CHR", 1, "shared", [2]], ["CA", 2, 3, 6], ["CHR", 0, "shared", [3]], ["CA", 1, 4, 6], ["FU", 5, [0, 1]], ["AN", 5, 0, 5], ["FU", 5, [1, 2]], ["AN", 5, 1, 4], ["FU", 5, [2, 3]], ["AN", 5, 2, 6], ["FU", 3, [0, 1]], ["SP", 3, 0, 48, [1], 1], ["AN", 3, 1, 2], ["FFSP", 3, 0, [2, 1], 1, 1], ["AN", 3, 1, 6], ["FU", 1, [0, 1]], ["SP", 1, 0, 6, [1], 1], ["AN", 1, 1, 2], ["FFSP", 1, 0, [2, 1], 1, 1], ["AN", 1, 1, 6], ["PR", 4, 0, "auto_unroll_max_step$16"]]]], "r": [[0.00532105, 0.00531253, 0.00529781], 0, 3.57982, 1759481032], "v": "v0.6"}
{"i": [["[\"ansor_mm\", 641, 4096, 2880, \"float16\"]", "rocm -keys=rocm,gpu -max_num_threads=256 -max_shared_memory_per_block=49152 -max_threads_per_block=1024 -mcpu=gfx942 -model=unknown -mtriple=amdgcn-amd-amdhsa-hcc -thread_warp_size=64", [-1, 16, 64, 65536, 2147483647, 1024, 16, 64], "llvm -keys=cpu -mtriple=x86_64-unknown-linux-gnu", 0, []], [[], [["CHW", 2, "local"], ["SP", 2, 0, 641, [1, 1, 1, 1], 1], ["SP", 2, 5, 4096, [2, 64, 1, 1], 1], ["SP", 2, 10, 2880, [36, 2], 1], ["RE", 2, [0, 5, 1, 6, 2, 7, 10, 11, 3, 8, 12, 4, 9]], ["FSP", 3, 0, 1, 3], ["FSP", 3, 4, 2, 3], ["RE", 3, [0, 4, 1, 5, 2, 6, 3, 7]], ["CA", 2, 3, 5], ["CHR", 1, "shared", [2]], ["CA", 2, 3, 6], ["CHR", 0, "shared", [3]], ["CA", 1, 4, 6], ["FU", 5, [0, 1]], ["AN", 5, 0, 5], ["FU", 5, [1, 2]], ["AN", 5, 1, 4], ["FU", 5, [2, 3]], ["AN", 5, 2, 6], ["FU", 3, [0, 1]], ["SP", 3, 0, 72, [3], 1], ["AN", 3, 1, 2], ["FFSP", 3, 0, [2, 1], 1, 1], ["AN", 3, 1, 6], ["FU", 1, [0, 1]], ["SP", 1, 0, 72, [8], 1], ["AN", 1, 1, 2], ["FFSP", 1, 0, [2, 1], 1, 1], ["AN", 1, 1, 6], ["PR", 4, 0, "auto_unroll_max_step$1024"]]]], "r": [[0.0182135, 0.0182092, 0.0182028], 0, 4.17568, 1759481034], "v": "v0.6"}
{"i": [["[\"ansor_mm\", 641, 4096, 2880, \"float16\"]", "rocm -keys=rocm,gpu -max_num_threads=256 -max_shared_memory_per_block=49152 -max_threads_per_block=1024 -mcpu=gfx942 -model=unknown -mtriple=amdgcn-amd-amdhsa-hcc -thread_warp_size=64", [-1, 16, 64, 65536, 2147483647, 1024, 16, 64], "llvm -keys=cpu -mtriple=x86_64-unknown-linux-gnu", 0, []], [[], [["CHW", 2, "local"], ["SP", 2, 0, 641, [1, 1, 641, 1], 1], ["SP", 2, 5, 4096, [2, 64, 2, 1], 1], ["SP", 2, 10, 2880, [1, 30], 1], ["RE", 2, [0, 5, 1, 6, 2, 7, 10, 11, 3, 8, 12, 4, 9]], ["FSP", 3, 0, 1, 3], ["FSP", 3, 4, 2, 3], ["RE", 3, [0, 4, 1, 5, 2, 6, 3, 7]], ["CA", 2, 3, 5], ["CHR", 1, "shared", [2]], ["CA", 2, 3, 6], ["CHR", 0, "shared", [3]], ["CA", 1, 4, 6], ["FU", 5, [0, 1]], ["AN", 5, 0, 5], ["FU", 5, [1, 2]], ["AN", 5, 1, 4], ["FU", 5, [2, 3]], ["AN", 5, 2, 6], ["FU", 3, [0, 1]], ["SP", 3, 0, 10, [5], 1], ["AN", 3, 1, 2], ["FFSP", 3, 0, [2, 1], 1, 1], ["AN", 3, 1, 6], ["FU", 1, [0, 1]], ["SP", 1, 0, 3205, [5], 1], ["AN", 1, 1, 2], ["FFSP", 1, 0, [2, 1], 1, 1], ["AN", 1, 1, 6], ["PR", 4, 0, "auto_unroll_max_step$16"]]]], "r": [[0.138095, 0.138038, 0.138055], 0, 7.51844, 1759481038], "v": "v0.6"}
{"i": [["[\"ansor_mm\", 641, 4096, 2880, \"float16\"]", "rocm -keys=rocm,gpu -max_num_threads=256 -max_shared_memory_per_block=49152 -max_threads_per_block=1024 -mcpu=gfx942 -model=unknown -mtriple=amdgcn-amd-amdhsa-hcc -thread_warp_size=64", [-1, 16, 64, 65536, 2147483647, 1024, 16, 64], "llvm -keys=cpu -mtriple=x86_64-unknown-linux-gnu", 0, []], [[], [["CHW", 2, "local"], ["SP", 2, 0, 641, [1, 1, 1, 1], 1], ["SP", 2, 5, 4096, [1, 256, 1, 1], 1], ["SP", 2, 10, 2880, [12, 2], 1], ["RE", 2, [0, 5, 1, 6, 2, 7, 10, 11, 3, 8, 12, 4, 9]], ["FSP", 3, 0, 1, 3], ["FSP", 3, 4, 2, 3], ["RE", 3, [0, 4, 1, 5, 2, 6, 3, 7]], ["CA", 2, 3, 5], ["CHR", 1, "shared", [2]], ["CA", 2, 3, 6], ["CHR", 0, "shared", [3]], ["CA", 1, 4, 6], ["FU", 5, [0, 1]], ["AN", 5, 0, 5], ["FU", 5, [1, 2]], ["AN", 5, 1, 4], ["FU", 5, [2, 3]], ["AN", 5, 2, 6], ["FU", 3, [0, 1]], ["SP", 3, 0, 24, [8], 1], ["AN", 3, 1, 2], ["FFSP", 3, 0, [2, 1], 1, 1], ["AN", 3, 1, 6], ["FU", 1, [0, 1]], ["SP", 1, 0, 24, [1], 1], ["AN", 1, 1, 2], ["FFSP", 1, 0, [2, 1], 1, 1], ["AN", 1, 1, 6], ["PR", 4, 0, "auto_unroll_max_step$16"]]]], "r": [[0.00128962, 0.00129172, 0.00129454], 0, 3.74514, 1759481039], "v": "v0.6"}
{"i": [["[\"ansor_mm\", 641, 4096, 2880, \"float16\"]", "rocm -keys=rocm,gpu -max_num_threads=256 -max_shared_memory_per_block=49152 -max_threads_per_block=1024 -mcpu=gfx942 -model=unknown -mtriple=amdgcn-amd-amdhsa-hcc -thread_warp_size=64", [-1, 16, 64, 65536, 2147483647, 1024, 16, 64], "llvm -keys=cpu -mtriple=x86_64-unknown-linux-gnu", 0, []], [[], [["CHW", 2, "local"], ["SP", 2, 0, 641, [1, 1, 641, 1], 1], ["SP", 2, 5, 4096, [4, 8, 1, 2], 1], ["SP", 2, 10, 2880, [2, 1], 1], ["RE", 2, [0, 5, 1, 6, 2, 7, 10, 11, 3, 8, 12, 4, 9]], ["FSP", 3, 0, 1, 3], ["FSP", 3, 4, 2, 3], ["RE", 3, [0, 4, 1, 5, 2, 6, 3, 7]], ["CA", 2, 3, 5], ["CHR", 1, "shared", [2]], ["CA", 2, 3, 6], ["CHR", 0, "shared", [3]], ["CA", 1, 4, 6], ["FU", 5, [0, 1]], ["AN", 5, 0, 5], ["FU", 5, [1, 2]], ["AN", 5, 1, 4], ["FU", 5, [2, 3]], ["AN", 5, 2, 6], ["FU", 3, [0, 1]], ["SP", 3, 0, 4, [1], 1], ["AN", 3, 1, 2], ["FFSP", 3, 0, [2, 1], 1, 1], ["AN", 3, 1, 6], ["FU", 1, [0, 1]], ["SP", 1, 0, 1282, [1], 1], ["AN", 1, 1, 2], ["FFSP", 1, 0, [2, 1], 1, 1], ["AN", 1, 1, 6], ["PR", 4, 0, "auto_unroll_max_step$16"]]]], "r": [[0.324291, 0.323546, 0.323391], 0, 13.0904, 1759481050], "v": "v0.6"}
{"i": [["[\"ansor_mm\", 641, 4096, 2880, \"float16\"]", "rocm -keys=rocm,gpu -max_num_threads=256 -max_shared_memory_per_block=49152 -max_threads_per_block=1024 -mcpu=gfx942 -model=unknown -mtriple=amdgcn-amd-amdhsa-hcc -thread_warp_size=64", [-1, 16, 64, 65536, 2147483647, 1024, 16, 64], "llvm -keys=cpu -mtriple=x86_64-unknown-linux-gnu", 0, []], [[], [["CHW", 2, "local"], ["SP", 2, 0, 641, [1, 1, 1, 1], 1], ["SP", 2, 5, 4096, [1, 256, 1, 16], 1], ["SP", 2, 10, 2880, [1, 2], 1], ["RE", 2, [0, 5, 1, 6, 2, 7, 10, 11, 3, 8, 12, 4, 9]], ["FSP", 3, 0, 1, 3], ["FSP", 3, 4, 2, 3], ["RE", 3, [0, 4, 1, 5, 2, 6, 3, 7]], ["CA", 2, 3, 5], ["CHR", 1, "shared", [2]], ["CA", 2, 3, 6], ["CHR", 0, "shared", [3]], ["CA", 1, 4, 6], ["FU", 5, [0, 1]], ["AN", 5, 0, 5], ["FU", 5, [1, 2]], ["AN", 5, 1, 4], ["FU", 5, [2, 3]], ["AN", 5, 2, 6], ["FU", 3, [0, 1]], ["SP", 3, 0, 32, [1], 1], ["AN", 3, 1, 2], ["FFSP", 3, 0, [2, 1], 1, 1], ["AN", 3, 1, 6], ["FU", 1, [0, 1]], ["SP", 1, 0, 2, [2], 1], ["AN", 1, 1, 2], ["FFSP", 1, 0, [2, 1], 1, 1], ["AN", 1, 1, 6], ["PR", 4, 0, "auto_unroll_max_step$512"]]]], "r": [[0.00226267, 0.00226517, 0.00226504], 0, 3.75585, 1759481051], "v": "v0.6"}
{"i": [["[\"ansor_mm\", 641, 4096, 2880, \"float16\"]", "rocm -keys=rocm,gpu -max_num_threads=256 -max_shared_memory_per_block=49152 -max_threads_per_block=1024 -mcpu=gfx942 -model=unknown -mtriple=amdgcn-amd-amdhsa-hcc -thread_warp_size=64", [-1, 16, 64, 65536, 2147483647, 1024, 16, 64], "llvm -keys=cpu -mtriple=x86_64-unknown-linux-gnu", 0, []], [[], [["CHW", 2, "local"], ["SP", 2, 0, 641, [1, 1, 641, 1], 1], ["SP", 2, 5, 4096, [4, 128, 4, 1], 1], ["SP", 2, 10, 2880, [12, 1], 1], ["RE", 2, [0, 5, 1, 6, 2, 7, 10, 11, 3, 8, 12, 4, 9]], ["FSP", 3, 0, 1, 3], ["FSP", 3, 4, 2, 3], ["RE", 3, [0, 4, 1, 5, 2, 6, 3, 7]], ["CA", 2, 3, 5], ["CHR", 1, "shared", [2]], ["CA", 2, 3, 6], ["CHR", 0, "shared", [3]], ["CA", 1, 4, 6], ["FU", 5, [0, 1]], ["AN", 5, 0, 5], ["FU", 5, [1, 2]], ["AN", 5, 1, 4], ["FU", 5, [2, 3]], ["AN", 5, 2, 6], ["FU", 3, [0, 1]], ["SP", 3, 0, 48, [1], 1], ["AN", 3, 1, 2], ["FFSP", 3, 0, [2, 1], 1, 1], ["AN", 3, 1, 6], ["FU", 1, [0, 1]], ["SP", 1, 0, 7692, [1], 1], ["AN", 1, 1, 2], ["FFSP", 1, 0, [2, 1], 1, 1], ["AN", 1, 1, 6], ["PR", 4, 0, "auto_unroll_max_step$64"]]]], "r": [[0.500258, 0.500458, 0.500347], 0, 18.8531, 1759481067], "v": "v0.6"}
{"i": [["[\"ansor_mm\", 641, 4096, 2880, \"float16\"]", "rocm -keys=rocm,gpu -max_num_threads=256 -max_shared_memory_per_block=49152 -max_threads_per_block=1024 -mcpu=gfx942 -model=unknown -mtriple=amdgcn-amd-amdhsa-hcc -thread_warp_size=64", [-1, 16, 64, 65536, 2147483647, 1024, 16, 64], "llvm -keys=cpu -mtriple=x86_64-unknown-linux-gnu", 0, []], [[], [["CHW", 2, "local"], ["SP", 2, 0, 641, [1, 1, 1, 1], 1], ["SP", 2, 5, 4096, [2, 512, 2, 2], 1], ["SP", 2, 10, 2880, [2, 2], 1], ["RE", 2, [0, 5, 1, 6, 2, 7, 10, 11, 3, 8, 12, 4, 9]], ["FSP", 3, 0, 1, 3], ["FSP", 3, 4, 2, 3], ["RE", 3, [0, 4, 1, 5, 2, 6, 3, 7]], ["CA", 2, 3, 5], ["CHR", 1, "shared", [2]], ["CA", 2, 3, 6], ["CHR", 0, "shared", [3]], ["CA", 1, 4, 6], ["FU", 5, [0, 1]], ["AN", 5, 0, 5], ["FU", 5, [1, 2]], ["AN", 5, 1, 4], ["FU", 5, [2, 3]], ["AN", 5, 2, 6], ["FU", 3, [0, 1]], ["SP", 3, 0, 16, [1], 1], ["AN", 3, 1, 2], ["FFSP", 3, 0, [2, 1], 1, 1], ["AN", 3, 1, 6], ["FU", 1, [0, 1]], ["SP", 1, 0, 4, [2], 1], ["AN", 1, 1, 2], ["FFSP", 1, 0, [2, 1], 1, 1], ["AN", 1, 1, 6], ["PR", 4, 0, "auto_unroll_max_step$1024"]]]], "r": [[0.00248385, 0.0024848, 0.00248699], 0, 3.77213, 1759481068], "v": "v0.6"}
{"i": [["[\"ansor_mm\", 641, 4096, 2880, \"float16\"]", "rocm -keys=rocm,gpu -max_num_threads=256 -max_shared_memory_per_block=49152 -max_threads_per_block=1024 -mcpu=gfx942 -model=unknown -mtriple=amdgcn-amd-amdhsa-hcc -thread_warp_size=64", [-1, 16, 64, 65536, 2147483647, 1024, 16, 64], "llvm -keys=cpu -mtriple=x86_64-unknown-linux-gnu", 0, []], [[], [["CHW", 2, "local"], ["SP", 2, 0, 641, [1, 641, 1, 1], 1], ["SP", 2, 5, 4096, [1, 1, 4, 4], 1], ["SP", 2, 10, 2880, [2, 4], 1], ["RE", 2, [0, 5, 1, 6, 2, 7, 10, 11, 3, 8, 12, 4, 9]], ["FSP", 3, 0, 1, 3], ["FSP", 3, 4, 2, 3], ["RE", 3, [0, 4, 1, 5, 2, 6, 3, 7]], ["CA", 2, 3, 5], ["CHR", 1, "shared", [2]], ["CA", 2, 3, 6], ["CHR", 0, "shared", [3]], ["CA", 1, 4, 6], ["FU", 5, [0, 1]], ["AN", 5, 0, 5], ["FU", 5, [1, 2]], ["AN", 5, 1, 4], ["FU", 5, [2, 3]], ["AN", 5, 2, 6], ["FU", 3, [0, 1]], ["SP", 3, 0, 128, [4], 1], ["AN", 3, 1, 2], ["FFSP", 3, 0, [2, 1], 1, 1], ["AN", 3, 1, 6], ["FU", 1, [0, 1]], ["SP", 1, 0, 8, [1], 1], ["AN", 1, 1, 2], ["FFSP", 1, 0, [2, 1], 1, 1], ["AN", 1, 1, 6], ["PR", 4, 0, "auto_unroll_max_step$512"]]]], "r": [[0.000776373, 0.000776374, 0.000776338], 0, 3.77634, 1759481069], "v": "v0.6"}
{"i": [["[\"ansor_mm\", 641, 4096, 2880, \"float16\"]", "rocm -keys=rocm,gpu -max_num_threads=256 -max_shared_memory_per_block=49152 -max_threads_per_block=1024 -mcpu=gfx942 -model=unknown -mtriple=amdgcn-amd-amdhsa-hcc -thread_warp_size=64", [-1, 16, 64, 65536, 2147483647, 1024, 16, 64], "llvm -keys=cpu -mtriple=x86_64-unknown-linux-gnu", 0, []], [[], [["CHW", 2, "local"], ["SP", 2, 0, 641, [1, 641, 1, 1], 1], ["SP", 2, 5, 4096, [1, 1, 16, 32], 1], ["SP", 2, 10, 2880, [1, 24], 1], ["RE", 2, [0, 5, 1, 6, 2, 7, 10, 11, 3, 8, 12, 4, 9]], ["FSP", 3, 0, 1, 3], ["FSP", 3, 4, 2, 3], ["RE", 3, [0, 4, 1, 5, 2, 6, 3, 7]], ["CA", 2, 3, 5], ["CHR", 1, "shared", [2]], ["CA", 2, 3, 6], ["CHR", 0, "shared", [3]], ["CA", 1, 4, 6], ["FU", 5, [0, 1]], ["AN", 5, 0, 5], ["FU", 5, [1, 2]], ["AN", 5, 1, 4], ["FU", 5, [2, 3]], ["AN", 5, 2, 6], ["FU", 3, [0, 1]], ["SP", 3, 0, 12288, [1], 1], ["AN", 3, 1, 2], ["FFSP", 3, 0, [2, 1], 1, 1], ["AN", 3, 1, 6], ["FU", 1, [0, 1]], ["SP", 1, 0, 24, [8], 1], ["AN", 1, 1, 2], ["FFSP", 1, 0, [2, 1], 1, 1], ["AN", 1, 1, 6], ["PR", 4, 0, "auto_unroll_max_step$1024"]]]], "r": [[0.0458963, 0.045908, 0.0458576], 0, 5.20569, 1759481071], "v": "v0.6"}
{"i": [["[\"ansor_mm\", 641, 4096, 2880, \"float16\"]", "rocm -keys=rocm,gpu -max_num_threads=256 -max_shared_memory_per_block=49152 -max_threads_per_block=1024 -mcpu=gfx942 -model=unknown -mtriple=amdgcn-amd-amdhsa-hcc -thread_warp_size=64", [-1, 16, 64, 65536, 2147483647, 1024, 16, 64], "llvm -keys=cpu -mtriple=x86_64-unknown-linux-gnu", 0, []], [[], [["CHW", 2, "local"], ["SP", 2, 0, 641, [1, 641, 1, 1], 1], ["SP", 2, 5, 4096, [1, 1, 16, 32], 1], ["SP", 2, 10, 2880, [1, 24], 1], ["RE", 2, [0, 5, 1, 6, 2, 7, 10, 11, 3, 8, 12, 4, 9]], ["FSP", 3, 0, 1, 3], ["FSP", 3, 4, 2, 3], ["RE", 3, [0, 4, 1, 5, 2, 6, 3, 7]], ["CA", 2, 3, 5], ["CHR", 1, "shared", [2]], ["CA", 2, 3, 6], ["CHR", 0, "shared", [3]], ["CA", 1, 4, 6], ["FU", 5, [0, 1]], ["AN", 5, 0, 5], ["FU", 5, [1, 2]], ["AN", 5, 1, 4], ["FU", 5, [2, 3]], ["AN", 5, 2, 6], ["FU", 3, [0, 1]], ["SP", 3, 0, 12288, [1], 1], ["AN", 3, 1, 2], ["FFSP", 3, 0, [2, 1], 1, 1], ["AN", 3, 1, 6], ["FU", 1, [0, 1]], ["SP", 1, 0, 24, [1], 1], ["AN", 1, 1, 2], ["FFSP", 1, 0, [2, 1], 1, 1], ["AN", 1, 1, 6], ["PR", 4, 0, "auto_unroll_max_step$512"]]]], "r": [[0.0110832, 0.0110814, 0.0110761], 0, 3.73165, 1759481072], "v": "v0.6"}
{"i": [["[\"ansor_mm\", 641, 4096, 2880, \"float16\"]", "rocm -keys=rocm,gpu -max_num_threads=256 -max_shared_memory_per_block=49152 -max_threads_per_block=1024 -mcpu=gfx942 -model=unknown -mtriple=amdgcn-amd-amdhsa-hcc -thread_warp_size=64", [-1, 16, 64, 65536, 2147483647, 1024, 16, 64], "llvm -keys=cpu -mtriple=x86_64-unknown-linux-gnu", 0, []], [[], [["CHW", 2, "local"], ["SP", 2, 0, 641, [1, 641, 1, 1], 1], ["SP", 2, 5, 4096, [8, 1, 16, 4], 1], ["SP", 2, 10, 2880, [1, 15], 1], ["RE", 2, [0, 5, 1, 6, 2, 7, 10, 11, 3, 8, 12, 4, 9]], ["FSP", 3, 0, 1, 3], ["FSP", 3, 4, 2, 3], ["RE", 3, [0, 4, 1, 5, 2, 6, 3, 7]], ["CA", 2, 3, 5], ["CHR", 1, "shared", [2]], ["CA", 2, 3, 6], ["CHR", 0, "shared", [3]], ["CA", 1, 4, 6], ["FU", 5, [0, 1]], ["AN", 5, 0, 5], ["FU", 5, [1, 2]], ["AN", 5, 1, 4], ["FU", 5, [2, 3]], ["AN", 5, 2, 6], ["FU", 3, [0, 1]], ["SP", 3, 0, 960, [1], 1], ["AN", 3, 1, 2], ["FFSP", 3, 0, [2, 1], 1, 1], ["AN", 3, 1, 6], ["FU", 1, [0, 1]], ["SP", 1, 0, 15, [1], 1], ["AN", 1, 1, 2], ["FFSP", 1, 0, [2, 1], 1, 1], ["AN", 1, 1, 6], ["PR", 4, 0, "auto_unroll_max_step$1024"]]]], "r": [[0.0377319, 0.0377024, 0.0377107], 0, 4.81229, 1759481074], "v": "v0.6"}
{"i": [["[\"ansor_mm\", 641, 4096, 2880, \"float16\"]", "rocm -keys=rocm,gpu -max_num_threads=256 -max_shared_memory_per_block=49152 -max_threads_per_block=1024 -mcpu=gfx942 -model=unknown -mtriple=amdgcn-amd-amdhsa-hcc -thread_warp_size=64", [-1, 16, 64, 65536, 2147483647, 1024, 16, 64], "llvm -keys=cpu -mtriple=x86_64-unknown-linux-gnu", 0, []], [[], [["CHW", 2, "local"], ["SP", 2, 0, 641, [1, 641, 1, 1], 1], ["SP", 2, 5, 4096, [4, 1, 32, 4], 1], ["SP", 2, 10, 2880, [12, 2], 1], ["RE", 2, [0, 5, 1, 6, 2, 7, 10, 11, 3, 8, 12, 4, 9]], ["FSP", 3, 0, 1, 3], ["FSP", 3, 4, 2, 3], ["RE", 3, [0, 4, 1, 5, 2, 6, 3, 7]], ["CA", 2, 3, 5], ["CHR", 1, "shared", [2]], ["CA", 2, 3, 6], ["CHR", 0, "shared", [3]], ["CA", 1, 4, 6], ["FU", 5, [0, 1]], ["AN", 5, 0, 5], ["FU", 5, [1, 2]], ["AN", 5, 1, 4], ["FU", 5, [2, 3]], ["AN", 5, 2, 6], ["FU", 3, [0, 1]], ["SP", 3, 0, 192, [1], 1], ["AN", 3, 1, 2], ["FFSP", 3, 0, [2, 1], 1, 1], ["AN", 3, 1, 6], ["FU", 1, [0, 1]], ["SP", 1, 0, 24, [8], 1], ["AN", 1, 1, 2], ["FFSP", 1, 0, [2, 1], 1, 1], ["AN", 1, 1, 6], ["PR", 4, 0, "auto_unroll_max_step$0"]]]], "r": [[0.245843, 0.24585, 0.24489], 0, 10.7712, 1759481082], "v": "v0.6"}
{"i": [["[\"ansor_mm\", 641, 4096, 2880, \"float16\"]", "rocm -keys=rocm,gpu -max_num_threads=256 -max_shared_memory_per_block=49152 -max_threads_per_block=1024 -mcpu=gfx942 -model=unknown -mtriple=amdgcn-amd-amdhsa-hcc -thread_warp_size=64", [-1, 16, 64, 65536, 2147483647, 1024, 16, 64], "llvm -keys=cpu -mtriple=x86_64-unknown-linux-gnu", 0, []], [[], [["CHW", 2, "local"], ["SP", 2, 0, 641, [1, 1, 641, 1], 1], ["SP", 2, 5, 4096, [1, 128, 2, 1], 1], ["SP", 2, 10, 2880, [1, 5], 1], ["RE", 2, [0, 5, 1, 6, 2, 7, 10, 11, 3, 8, 12, 4, 9]], ["FSP", 3, 0, 1, 3], ["FSP", 3, 4, 2, 3], ["RE", 3, [0, 4, 1, 5, 2, 6, 3, 7]], ["CA", 2, 3, 5], ["CHR", 1, "shared", [2]], ["CA", 2, 3, 6], ["CHR", 0, "shared", [3]], ["CA", 1, 4, 6], ["FU", 5, [0, 1]], ["AN", 5, 0, 5], ["FU", 5, [1, 2]], ["AN", 5, 1, 4], ["FU", 5, [2, 3]], ["AN", 5, 2, 6], ["FU", 3, [0, 1]], ["SP", 3, 0, 10, [2], 1], ["AN", 3, 1, 2], ["FFSP", 3, 0, [2, 1], 1, 1], ["AN", 3, 1, 6], ["FU", 1, [0, 1]], ["SP", 1, 0, 3205, [1], 1], ["AN", 1, 1, 2], ["FFSP", 1, 0, [2, 1], 1, 1], ["AN", 1, 1, 6], ["PR", 4, 0, "auto_unroll_max_step$16"]]]], "r": [[0.0409198, 0.0410173, 0.0409377], 0, 4.3255, 1759481084], "v": "v0.6"}
{"i": [["[\"ansor_mm\", 641, 4096, 2880, \"float16\"]", "rocm -keys=rocm,gpu -max_num_threads=256 -max_shared_memory_per_block=49152 -max_threads_per_block=1024 -mcpu=gfx942 -model=unknown -mtriple=amdgcn-amd-amdhsa-hcc -thread_warp_size=64", [-1, 16, 64, 65536, 2147483647, 1024, 16, 64], "llvm -keys=cpu -mtriple=x86_64-unknown-linux-gnu", 0, []], [[], [["CHW", 2, "local"], ["SP", 2, 0, 641, [1, 641, 1, 1], 1], ["SP", 2, 5, 4096, [16, 1, 1, 32], 1], ["SP", 2, 10, 2880, [2, 12], 1], ["RE", 2, [0, 5, 1, 6, 2, 7, 10, 11, 3, 8, 12, 4, 9]], ["FSP", 3, 0, 1, 3], ["FSP", 3, 4, 2, 3], ["RE", 3, [0, 4, 1, 5, 2, 6, 3, 7]], ["CA", 2, 3, 5], ["CHR", 1, "shared", [2]], ["CA", 2, 3, 6], ["CHR", 0, "shared", [3]], ["CA", 1, 4, 6], ["FU", 5, [0, 1]], ["AN", 5, 0, 5], ["FU", 5, [1, 2]], ["AN", 5, 1, 4], ["FU", 5, [2, 3]], ["AN", 5, 2, 6], ["FU", 3, [0, 1]], ["SP", 3, 0, 768, [1], 1], ["AN", 3, 1, 2], ["FFSP", 3, 0, [2, 1], 1, 1], ["AN", 3, 1, 6], ["FU", 1, [0, 1]], ["SP", 1, 0, 24, [1], 1], ["AN", 1, 1, 2], ["FFSP", 1, 0, [2, 1], 1, 1], ["AN", 1, 1, 6], ["PR", 4, 0, "auto_unroll_max_step$1024"]]]], "r": [[0.144917, 0.14487, 0.144842], 0, 8.13693, 1759481089], "v": "v0.6"}
{"i": [["[\"ansor_mm\", 641, 4096, 2880, \"float16\"]", "rocm -keys=rocm,gpu -max_num_threads=256 -max_shared_memory_per_block=49152 -max_threads_per_block=1024 -mcpu=gfx942 -model=unknown -mtriple=amdgcn-amd-amdhsa-hcc -thread_warp_size=64", [-1, 16, 64, 65536, 2147483647, 1024, 16, 64], "llvm -keys=cpu -mtriple=x86_64-unknown-linux-gnu", 0, []], [[], [["CHW", 2, "local"], ["SP", 2, 0, 641, [1, 1, 1, 1], 1], ["SP", 2, 5, 4096, [2, 256, 1, 1], 1], ["SP", 2, 10, 2880, [1, 18], 1], ["RE", 2, [0, 5, 1, 6, 2, 7, 10, 11, 3, 8, 12, 4, 9]], ["FSP", 3, 0, 1, 3], ["FSP", 3, 4, 2, 3], ["RE", 3, [0, 4, 1, 5, 2, 6, 3, 7]], ["CA", 2, 3, 5], ["CHR", 1, "shared", [2]], ["CA", 2, 3, 6], ["CHR", 0, "shared", [3]], ["CA", 1, 4, 6], ["FU", 5, [0, 1]], ["AN", 5, 0, 5], ["FU", 5, [1, 2]], ["AN", 5, 1, 4], ["FU", 5, [2, 3]], ["AN", 5, 2, 6], ["FU", 3, [0, 1]], ["SP", 3, 0, 18, [3], 1], ["AN", 3, 1, 2], ["FFSP", 3, 0, [2, 1], 1, 1], ["AN", 3, 1, 6], ["FU", 1, [0, 1]], ["SP", 1, 0, 11538, [1], 1], ["AN", 1, 1, 2], ["FFSP", 1, 0, [2, 1], 1, 1], ["AN", 1, 1, 6], ["PR", 4, 0, "auto_unroll_max_step$0"]]]], "r": [[0.0050375, 0.00504403, 0.00504621], 0, 3.60349, 1759481089], "v": "v0.6"}
{"i": [["[\"ansor_mm\", 641, 4096, 2880, \"float16\"]", "rocm -keys=rocm,gpu -max_num_threads=256 -max_shared_memory_per_block=49152 -max_threads_per_block=1024 -mcpu=gfx942 -model=unknown -mtriple=amdgcn-amd-amdhsa-hcc -thread_warp_size=64", [-1, 16, 64, 65536, 2147483647, 1024, 16, 64], "llvm -keys=cpu -mtriple=x86_64-unknown-linux-gnu", 0, []], [[], [["CHW", 2, "local"], ["SP", 2, 0, 641, [1, 1, 641, 1], 1], ["SP", 2, 5, 4096, [4, 256, 1, 2], 1], ["SP", 2, 10, 2880, [1, 1], 1], ["RE", 2, [0, 5, 1, 6, 2, 7, 10, 11, 3, 8, 12, 4, 9]], ["FSP", 3, 0, 1, 3], ["FSP", 3, 4, 2, 3], ["RE", 3, [0, 4, 1, 5, 2, 6, 3, 7]], ["CA", 2, 3, 5], ["CHR", 1, "shared", [2]], ["CA", 2, 3, 6], ["CHR", 0, "shared", [3]], ["CA", 1, 4, 6], ["FU", 5, [0, 1]], ["AN", 5, 0, 5], ["FU", 5, [1, 2]], ["AN", 5, 1, 4], ["FU", 5, [2, 3]], ["AN", 5, 2, 6], ["FU", 3, [0, 1]], ["SP", 3, 0, 4, [1], 1], ["AN", 3, 1, 2], ["FFSP", 3, 0, [2, 1], 1, 1], ["AN", 3, 1, 6], ["FU", 1, [0, 1]], ["SP", 1, 0, 1282, [2], 1], ["AN", 1, 1, 2], ["FFSP", 1, 0, [2, 1], 1, 1], ["AN", 1, 1, 6], ["PR", 4, 0, "auto_unroll_max_step$16"]]]], "r": [[1.69875, 1.6981, 1.71382], 0, 55.8809, 1759481143], "v": "v0.6"}
{"i": [["[\"ansor_mm\", 641, 4096, 2880, \"float16\"]", "rocm -keys=rocm,gpu -max_num_threads=256 -max_shared_memory_per_block=49152 -max_threads_per_block=1024 -mcpu=gfx942 -model=unknown -mtriple=amdgcn-amd-amdhsa-hcc -thread_warp_size=64", [-1, 16, 64, 65536, 2147483647, 1024, 16, 64], "llvm -keys=cpu -mtriple=x86_64-unknown-linux-gnu", 0, []], [[], [["CHW", 2, "local"], ["SP", 2, 0, 641, [1, 1, 1, 1], 1], ["SP", 2, 5, 4096, [2, 256, 1, 8], 1], ["SP", 2, 10, 2880, [1, 2], 1], ["RE", 2, [0, 5, 1, 6, 2, 7, 10, 11, 3, 8, 12, 4, 9]], ["FSP", 3, 0, 1, 3], ["FSP", 3, 4, 2, 3], ["RE", 3, [0, 4, 1, 5, 2, 6, 3, 7]], ["CA", 2, 3, 5], ["CHR", 1, "shared", [2]], ["CA", 2, 3, 6], ["CHR", 0, "shared", [3]], ["CA", 1, 4, 6], ["FU", 5, [0, 1]], ["AN", 5, 0, 5], ["FU", 5, [1, 2]], ["AN", 5, 1, 4], ["FU", 5, [2, 3]], ["AN", 5, 2, 6], ["FU", 3, [0, 1]], ["SP", 3, 0, 32, [1], 1], ["AN", 3, 1, 2], ["FFSP", 3, 0, [2, 1], 1, 1], ["AN", 3, 1, 6], ["FU", 1, [0, 1]], ["SP", 1, 0, 2, [1], 1], ["AN", 1, 1, 2], ["FFSP", 1, 0, [2, 1], 1, 1], ["AN", 1, 1, 6], ["PR", 4, 0, "auto_unroll_max_step$1024"]]]], "r": [[0.00201202, 0.00201277, 0.00201187], 0, 3.75543, 1759481144], "v": "v0.6"}
{"i": [["[\"ansor_mm\", 641, 4096, 2880, \"float16\"]", "rocm -keys=rocm,gpu -max_num_threads=256 -max_shared_memory_per_block=49152 -max_threads_per_block=1024 -mcpu=gfx942 -model=unknown -mtriple=amdgcn-amd-amdhsa-hcc -thread_warp_size=64", [-1, 16, 64, 65536, 2147483647, 1024, 16, 64], "llvm -keys=cpu -mtriple=x86_64-unknown-linux-gnu", 0, []], [[], [["CHW", 2, "local"], ["SP", 2, 0, 641, [1, 1, 1, 1], 1], ["SP", 2, 5, 4096, [4, 64, 1, 1], 1], ["SP", 2, 10, 2880, [15, 1], 1], ["RE", 2, [0, 5, 1, 6, 2, 7, 10, 11, 3, 8, 12, 4, 9]], ["FSP", 3, 0, 1, 3], ["FSP", 3, 4, 2, 3], ["RE", 3, [0, 4, 1, 5, 2, 6, 3, 7]], ["CA", 2, 3, 5], ["CHR", 1, "shared", [2]], ["CA", 2, 3, 6], ["CHR", 0, "shared", [3]], ["CA", 1, 4, 6], ["FU", 5, [0, 1]], ["AN", 5, 0, 5], ["FU", 5, [1, 2]], ["AN", 5, 1, 4], ["FU", 5, [2, 3]], ["AN", 5, 2, 6], ["FU", 3, [0, 1]], ["SP", 3, 0, 30, [1], 1], ["AN", 3, 1, 2], ["FFSP", 3, 0, [2, 1], 1, 1], ["AN", 3, 1, 6], ["FU", 1, [0, 1]], ["SP", 1, 0, 15, [1], 1], ["AN", 1, 1, 2], ["FFSP", 1, 0, [2, 1], 1, 1], ["AN", 1, 1, 6], ["PR", 4, 0, "auto_unroll_max_step$16"]]]], "r": [[0.00523169, 0.00523003, 0.00523133], 0, 3.35146, 1759481145], "v": "v0.6"}
{"i": [["[\"ansor_mm\", 641, 4096, 2880, \"float16\"]", "rocm -keys=rocm,gpu -max_num_threads=256 -max_shared_memory_per_block=49152 -max_threads_per_block=1024 -mcpu=gfx942 -model=unknown -mtriple=amdgcn-amd-amdhsa-hcc -thread_warp_size=64", [-1, 16, 64, 65536, 2147483647, 1024, 16, 64], "llvm -keys=cpu -mtriple=x86_64-unknown-linux-gnu", 0, []], [[], [["CHW", 2, "local"], ["SP", 2, 0, 641, [1, 641, 1, 1], 1], ["SP", 2, 5, 4096, [2, 1, 16, 1], 1], ["SP", 2, 10, 2880, [1, 4], 1], ["RE", 2, [0, 5, 1, 6, 2, 7, 10, 11, 3, 8, 12, 4, 9]], ["FSP", 3, 0, 1, 3], ["FSP", 3, 4, 2, 3], ["RE", 3, [0, 4, 1, 5, 2, 6, 3, 7]], ["CA", 2, 3, 5], ["CHR", 1, "shared", [2]], ["CA", 2, 3, 6], ["CHR", 0, "shared", [3]], ["CA", 1, 4, 6], ["FU", 5, [0, 1]], ["AN", 5, 0, 5], ["FU", 5, [1, 2]], ["AN", 5, 1, 4], ["FU", 5, [2, 3]], ["AN", 5, 2, 6], ["FU", 3, [0, 1]], ["SP", 3, 0, 64, [1], 1], ["AN", 3, 1, 2], ["FFSP", 3, 0, [2, 1], 1, 1], ["AN", 3, 1, 6], ["FU", 1, [0, 1]], ["SP", 1, 0, 4, [1], 1], ["AN", 1, 1, 2], ["FFSP", 1, 0, [2, 1], 1, 1], ["AN", 1, 1, 6], ["PR", 4, 0, "auto_unroll_max_step$64"]]]], "r": [[0.00145523, 0.00145561, 0.00145545], 0, 3.34861, 1759481146], "v": "v0.6"}
{"i": [["[\"ansor_mm\", 641, 4096, 2880, \"float16\"]", "rocm -keys=rocm,gpu -max_num_threads=256 -max_shared_memory_per_block=49152 -max_threads_per_block=1024 -mcpu=gfx942 -model=unknown -mtriple=amdgcn-amd-amdhsa-hcc -thread_warp_size=64", [-1, 16, 64, 65536, 2147483647, 1024, 16, 64], "llvm -keys=cpu -mtriple=x86_64-unknown-linux-gnu", 0, []], [[], [["CHW", 2, "local"], ["SP", 2, 0, 641, [1, 1, 641, 1], 1], ["SP", 2, 5, 4096, [1, 256, 2, 8], 1], ["SP", 2, 10, 2880, [6, 1], 1], ["RE", 2, [0, 5, 1, 6, 2, 7, 10, 11, 3, 8, 12, 4, 9]], ["FSP", 3, 0, 1, 3], ["FSP", 3, 4, 2, 3], ["RE", 3, [0, 4, 1, 5, 2, 6, 3, 7]], ["CA", 2, 3, 5], ["CHR", 1, "shared", [2]], ["CA", 2, 3, 6], ["CHR", 0, "shared", [3]], ["CA", 1, 4, 6], ["FU", 5, [0, 1]], ["AN", 5, 0, 5], ["FU", 5, [1, 2]], ["AN", 5, 1, 4], ["FU", 5, [2, 3]], ["AN", 5, 2, 6], ["FU", 3, [0, 1]], ["SP", 3, 0, 96, [2], 1], ["AN", 3, 1, 2], ["FFSP", 3, 0, [2, 1], 1, 1], ["AN", 3, 1, 6], ["FU", 1, [0, 1]], ["SP", 1, 0, 3846, [1], 1], ["AN", 1, 1, 2], ["FFSP", 1, 0, [2, 1], 1, 1], ["AN", 1, 1, 6], ["PR", 4, 0, "auto_unroll_max_step$0"]]]], "r": [[0.929391, 0.929552, 0.929451], 0, 31.9252, 1759481175], "v": "v0.6"}
{"i": [["[\"ansor_mm\", 641, 4096, 2880, \"float16\"]", "rocm -keys=rocm,gpu -max_num_threads=256 -max_shared_memory_per_block=49152 -max_threads_per_block=1024 -mcpu=gfx942 -model=unknown -mtriple=amdgcn-amd-amdhsa-hcc -thread_warp_size=64", [-1, 16, 64, 65536, 2147483647, 1024, 16, 64], "llvm -keys=cpu -mtriple=x86_64-unknown-linux-gnu", 0, []], [[], [["CHW", 2, "local"], ["SP", 2, 0, 641, [1, 1, 641, 1], 1], ["SP", 2, 5, 4096, [1, 128, 2, 1], 1], ["SP", 2, 10, 2880, [5, 4], 1], ["RE", 2, [0, 5, 1, 6, 2, 7, 10, 11, 3, 8, 12, 4, 9]], ["FSP", 3, 0, 1, 3], ["FSP", 3, 4, 2, 3], ["RE", 3, [0, 4, 1, 5, 2, 6, 3, 7]], ["CA", 2, 3, 5], ["CHR", 1, "shared", [2]], ["CA", 2, 3, 6], ["CHR", 0, "shared", [3]], ["CA", 1, 4, 6], ["FU", 5, [0, 1]], ["AN", 5, 0, 5], ["FU", 5, [1, 2]], ["AN", 5, 1, 4], ["FU", 5, [2, 3]], ["AN", 5, 2, 6], ["FU", 3, [0, 1]], ["SP", 3, 0, 4, [1], 1], ["AN", 3, 1, 2], ["FFSP", 3, 0, [2, 1], 1, 1], ["AN", 3, 1, 6], ["FU", 1, [0, 1]], ["SP", 1, 0, 1282, [1], 1], ["AN", 1, 1, 2], ["FFSP", 1, 0, [2, 1], 1, 1], ["AN", 1, 1, 6], ["PR", 4, 0, "auto_unroll_max_step$16"]]]], "r": [[0.0350785, 0.0351748, 0.0350745], 0, 4.40208, 1759481177], "v": "v0.6"}
{"i": [["[\"ansor_mm\", 641, 4096, 2880, \"float16\"]", "rocm -keys=rocm,gpu -max_num_threads=256 -max_shared_memory_per_block=49152 -max_threads_per_block=1024 -mcpu=gfx942 -model=unknown -mtriple=amdgcn-amd-amdhsa-hcc -thread_warp_size=64", [-1, 16, 64, 65536, 2147483647, 1024, 16, 64], "llvm -keys=cpu -mtriple=x86_64-unknown-linux-gnu", 0, []], [[], [["CHW", 2, "local"], ["SP", 2, 0, 641, [1, 1, 641, 1], 1], ["SP", 2, 5, 4096, [2, 64, 2, 1], 1], ["SP", 2, 10, 2880, [1, 5], 1], ["RE", 2, [0, 5, 1, 6, 2, 7, 10, 11, 3, 8, 12, 4, 9]], ["FSP", 3, 0, 1, 3], ["FSP", 3, 4, 2, 3], ["RE", 3, [0, 4, 1, 5, 2, 6, 3, 7]], ["CA", 2, 3, 5], ["CHR", 1, "shared", [2]], ["CA", 2, 3, 6], ["CHR", 0, "shared", [3]], ["CA", 1, 4, 6], ["FU", 5, [0, 1]], ["AN", 5, 0, 5], ["FU", 5, [1, 2]], ["AN", 5, 1, 4], ["FU", 5, [2, 3]], ["AN", 5, 2, 6], ["FU", 3, [0, 1]], ["SP", 3, 0, 10, [1], 1], ["AN", 3, 1, 2], ["FFSP", 3, 0, [2, 1], 1, 1], ["AN", 3, 1, 6], ["FU", 1, [0, 1]], ["SP", 1, 0, 3205, [1], 1], ["AN", 1, 1, 2], ["FFSP", 1, 0, [2, 1], 1, 1], ["AN", 1, 1, 6], ["PR", 4, 0, "auto_unroll_max_step$16"]]]], "r": [[0.0851106, 0.0847468, 0.0849672], 0, 5.77247, 1759481180], "v": "v0.6"}
{"i": [["[\"ansor_mm\", 641, 4096, 2880, \"float16\"]", "rocm -keys=rocm,gpu -max_num_threads=256 -max_shared_memory_per_block=49152 -max_threads_per_block=1024 -mcpu=gfx942 -model=unknown -mtriple=amdgcn-amd-amdhsa-hcc -thread_warp_size=64", [-1, 16, 64, 65536, 2147483647, 1024, 16, 64], "llvm -keys=cpu -mtriple=x86_64-unknown-linux-gnu", 0, []], [[], [["CHW", 2, "local"], ["SP", 2, 0, 641, [1, 1, 1, 1], 1], ["SP", 2, 5, 4096, [4, 256, 1, 2], 1], ["SP", 2, 10, 2880, [4, 1], 1], ["RE", 2, [0, 5, 1, 6, 2, 7, 10, 11, 3, 8, 12, 4, 9]], ["FSP", 3, 0, 1, 3], ["FSP", 3, 4, 2, 3], ["RE", 3, [0, 4, 1, 5, 2, 6, 3, 7]], ["CA", 2, 3, 5], ["CHR", 1, "shared", [2]], ["CA", 2, 3, 6], ["CHR", 0, "shared", [3]], ["CA", 1, 4, 6], ["FU", 5, [0, 1]], ["AN", 5, 0, 5], ["FU", 5, [1, 2]], ["AN", 5, 1, 4], ["FU", 5, [2, 3]], ["AN", 5, 2, 6], ["FU", 3, [0, 1]], ["SP", 3, 0, 16, [1], 1], ["AN", 3, 1, 2], ["FFSP", 3, 0, [2, 1], 1, 1], ["AN", 3, 1, 6], ["FU", 1, [0, 1]], ["SP", 1, 0, 4, [1], 1], ["AN", 1, 1, 2], ["FFSP", 1, 0, [2, 1], 1, 1], ["AN", 1, 1, 6], ["PR", 4, 0, "auto_unroll_max_step$0"]]]], "r": [[0.00222578, 0.00222775, 0.00223079], 0, 3.81516, 1759481181], "v": "v0.6"}
{"i": [["[\"ansor_mm\", 641, 4096, 2880, \"float16\"]", "rocm -keys=rocm,gpu -max_num_threads=256 -max_shared_memory_per_block=49152 -max_threads_per_block=1024 -mcpu=gfx942 -model=unknown -mtriple=amdgcn-amd-amdhsa-hcc -thread_warp_size=64", [-1, 16, 64, 65536, 2147483647, 1024, 16, 64], "llvm -keys=cpu -mtriple=x86_64-unknown-linux-gnu", 0, []], [[], [["CHW", 2, "local"], ["SP", 2, 0, 641, [1, 641, 1, 1], 1], ["SP", 2, 5, 4096, [8, 1, 2, 32], 1], ["SP", 2, 10, 2880, [2, 1], 1], ["RE", 2, [0, 5, 1, 6, 2, 7, 10, 11, 3, 8, 12, 4, 9]], ["FSP", 3, 0, 1, 3], ["FSP", 3, 4, 2, 3], ["RE", 3, [0, 4, 1, 5, 2, 6, 3, 7]], ["CA", 2, 3, 5], ["CHR", 1, "shared", [2]], ["CA", 2, 3, 6], ["CHR", 0, "shared", [3]], ["CA", 1, 4, 6], ["FU", 5, [0, 1]], ["AN", 5, 0, 5], ["FU", 5, [1, 2]], ["AN", 5, 1, 4], ["FU", 5, [2, 3]], ["AN", 5, 2, 6], ["FU", 3, [0, 1]], ["SP", 3, 0, 128, [1], 1], ["AN", 3, 1, 2], ["FFSP", 3, 0, [2, 1], 1, 1], ["AN", 3, 1, 6], ["FU", 1, [0, 1]], ["SP", 1, 0, 2, [1], 1], ["AN", 1, 1, 2], ["FFSP", 1, 0, [2, 1], 1, 1], ["AN", 1, 1, 6], ["PR", 4, 0, "auto_unroll_max_step$16"]]]], "r": [[0.192244, 0.192173, 0.192169], 0, 9.19207, 1759481187], "v": "v0.6"}
{"i": [["[\"ansor_mm\", 641, 4096, 2880, \"float16\"]", "rocm -keys=rocm,gpu -max_num_threads=256 -max_shared_memory_per_block=49152 -max_threads_per_block=1024 -mcpu=gfx942 -model=unknown -mtriple=amdgcn-amd-amdhsa-hcc -thread_warp_size=64", [-1, 16, 64, 65536, 2147483647, 1024, 16, 64], "llvm -keys=cpu -mtriple=x86_64-unknown-linux-gnu", 0, []], [[], [["CHW", 2, "local"], ["SP", 2, 0, 641, [1, 1, 1, 1], 1], ["SP", 2, 5, 4096, [8, 128, 1, 1], 1], ["SP", 2, 10, 2880, [15, 1], 1], ["RE", 2, [0, 5, 1, 6, 2, 7, 10, 11, 3, 8, 12, 4, 9]], ["FSP", 3, 0, 1, 3], ["FSP", 3, 4, 2, 3], ["RE", 3, [0, 4, 1, 5, 2, 6, 3, 7]], ["CA", 2, 3, 5], ["CHR", 1, "shared", [2]], ["CA", 2, 3, 6], ["CHR", 0, "shared", [3]], ["CA", 1, 4, 6], ["FU", 5, [0, 1]], ["AN", 5, 0, 5], ["FU", 5, [1, 2]], ["AN", 5, 1, 4], ["FU", 5, [2, 3]], ["AN", 5, 2, 6], ["FU", 3, [0, 1]], ["SP", 3, 0, 30, [1], 1], ["AN", 3, 1, 2], ["FFSP", 3, 0, [2, 1], 1, 1], ["AN", 3, 1, 6], ["FU", 1, [0, 1]], ["SP", 1, 0, 15, [1], 1], ["AN", 1, 1, 2], ["FFSP", 1, 0, [2, 1], 1, 1], ["AN", 1, 1, 6], ["PR", 4, 0, "auto_unroll_max_step$16"]]]], "r": [[0.00711725, 0.00711621, 0.0071188], 0, 3.6959, 1759481188], "v": "v0.6"}
{"i": [["[\"ansor_mm\", 641, 4096, 2880, \"float16\"]", "rocm -keys=rocm,gpu -max_num_threads=256 -max_shared_memory_per_block=49152 -max_threads_per_block=1024 -mcpu=gfx942 -model=unknown -mtriple=amdgcn-amd-amdhsa-hcc -thread_warp_size=64", [-1, 16, 64, 65536, 2147483647, 1024, 16, 64], "llvm -keys=cpu -mtriple=x86_64-unknown-linux-gnu", 0, []], [[], [["CHW", 2, "local"], ["SP", 2, 0, 641, [1, 641, 1, 1], 1], ["SP", 2, 5, 4096, [4, 1, 8, 1], 1], ["SP", 2, 10, 2880, [12, 2], 1], ["RE", 2, [0, 5, 1, 6, 2, 7, 10, 11, 3, 8, 12, 4, 9]], ["FSP", 3, 0, 1, 3], ["FSP", 3, 4, 2, 3], ["RE", 3, [0, 4, 1, 5, 2, 6, 3, 7]], ["CA", 2, 3, 5], ["CHR", 1, "shared", [2]], ["CA", 2, 3, 6], ["CHR", 0, "shared", [3]], ["CA", 1, 4, 6], ["FU", 5, [0, 1]], ["AN", 5, 0, 5], ["FU", 5, [1, 2]], ["AN", 5, 1, 4], ["FU", 5, [2, 3]], ["AN", 5, 2, 6], ["FU", 3, [0, 1]], ["SP", 3, 0, 192, [1], 1], ["AN", 3, 1, 2], ["FFSP", 3, 0, [2, 1], 1, 1], ["AN", 3, 1, 6], ["FU", 1, [0, 1]], ["SP", 1, 0, 24, [1], 1], ["AN", 1, 1, 2], ["FFSP", 1, 0, [2, 1], 1, 1], ["AN", 1, 1, 6], ["PR", 4, 0, "auto_unroll_max_step$0"]]]], "r": [[0.0011541, 0.00115417, 0.00115418], 0, 3.70352, 1759481189], "v": "v0.6"}
{"i": [["[\"ansor_mm\", 641, 4096, 2880, \"float16\"]", "rocm -keys=rocm,gpu -max_num_threads=256 -max_shared_memory_per_block=49152 -max_threads_per_block=1024 -mcpu=gfx942 -model=unknown -mtriple=amdgcn-amd-amdhsa-hcc -thread_warp_size=64", [-1, 16, 64, 65536, 2147483647, 1024, 16, 64], "llvm -keys=cpu -mtriple=x86_64-unknown-linux-gnu", 0, []], [[], [["CHW", 2, "local"], ["SP", 2, 0, 641, [1, 1, 1, 1], 1], ["SP", 2, 5, 4096, [1, 64, 4, 2], 1], ["SP", 2, 10, 2880, [16, 1], 1], ["RE", 2, [0, 5, 1, 6, 2, 7, 10, 11, 3, 8, 12, 4, 9]], ["FSP", 3, 0, 1, 3], ["FSP", 3, 4, 2, 3], ["RE", 3, [0, 4, 1, 5, 2, 6, 3, 7]], ["CA", 2, 3, 5], ["CHR", 1, "shared", [2]], ["CA", 2, 3, 6], ["CHR", 0, "shared", [3]], ["CA", 1, 4, 6], ["FU", 5, [0, 1]], ["AN", 5, 0, 5], ["FU", 5, [1, 2]], ["AN", 5, 1, 4], ["FU", 5, [2, 3]], ["AN", 5, 2, 6], ["FU", 3, [0, 1]], ["SP", 3, 0, 128, [2], 1], ["AN", 3, 1, 2], ["FFSP", 3, 0, [2, 1], 1, 1], ["AN", 3, 1, 6], ["FU", 1, [0, 1]], ["SP", 1, 0, 10256, [1], 1], ["AN", 1, 1, 2], ["FFSP", 1, 0, [2, 1], 1, 1], ["AN", 1, 1, 6], ["PR", 4, 0, "auto_unroll_max_step$16"]]]], "r": [[0.00365095, 0.00364992, 0.00365013], 0, 3.43313, 1759481190], "v": "v0.6"}
{"i": [["[\"ansor_mm\", 641, 4096, 2880, \"float16\"]", "rocm -keys=rocm,gpu -max_num_threads=256 -max_shared_memory_per_block=49152 -max_threads_per_block=1024 -mcpu=gfx942 -model=unknown -mtriple=amdgcn-amd-amdhsa-hcc -thread_warp_size=64", [-1, 16, 64, 65536, 2147483647, 1024, 16, 64], "llvm -keys=cpu -mtriple=x86_64-unknown-linux-gnu", 0, []], [[], [["CHW", 2, "local"], ["SP", 2, 0, 641, [1, 641, 1, 1], 1], ["SP", 2, 5, 4096, [8, 1, 16, 4], 1], ["SP", 2, 10, 2880, [1, 1], 1], ["RE", 2, [0, 5, 1, 6, 2, 7, 10, 11, 3, 8, 12, 4, 9]], ["FSP", 3, 0, 1, 3], ["FSP", 3, 4, 2, 3], ["RE", 3, [0, 4, 1, 5, 2, 6, 3, 7]], ["CA", 2, 3, 5], ["CHR", 1, "shared", [2]], ["CA", 2, 3, 6], ["CHR", 0, "shared", [3]], ["CA", 1, 4, 6], ["FU", 5, [0, 1]], ["AN", 5, 0, 5], ["FU", 5, [1, 2]], ["AN", 5, 1, 4], ["FU", 5, [2, 3]], ["AN", 5, 2, 6], ["FU", 3, [0, 1]], ["SP", 3, 0, 960, [2], 1], ["AN", 3, 1, 2], ["FFSP", 3, 0, [2, 1], 1, 1], ["AN", 3, 1, 6], ["FU", 1, [0, 1]], ["SP", 1, 0, 15, [1], 1], ["AN", 1, 1, 2], ["FFSP", 1, 0, [2, 1], 1, 1], ["AN", 1, 1, 6], ["PR", 4, 0, "auto_unroll_max_step$0"]]]], "r": [[0.281495, 0.282442, 0.282311], 0, 12.0635, 1759481199], "v": "v0.6"}
{"i": [["[\"ansor_mm\", 641, 4096, 2880, \"float16\"]", "rocm -keys=rocm,gpu -max_num_threads=256 -max_shared_memory_per_block=49152 -max_threads_per_block=1024 -mcpu=gfx942 -model=unknown -mtriple=amdgcn-amd-amdhsa-hcc -thread_warp_size=64", [-1, 16, 64, 65536, 2147483647, 1024, 16, 64], "llvm -keys=cpu -mtriple=x86_64-unknown-linux-gnu", 0, []], [[], [["CHW", 2, "local"], ["SP", 2, 0, 641, [1, 1, 641, 1], 1], ["SP", 2, 5, 4096, [1, 64, 4, 2], 1], ["SP", 2, 10, 2880, [5, 1], 1], ["RE", 2, [0, 5, 1, 6, 2, 7, 10, 11, 3, 8, 12, 4, 9]], ["FSP", 3, 0, 1, 3], ["FSP", 3, 4, 2, 3], ["RE", 3, [0, 4, 1, 5, 2, 6, 3, 7]], ["CA", 2, 3, 5], ["CHR", 1, "shared", [2]], ["CA", 2, 3, 6], ["CHR", 0, "shared", [3]], ["CA", 1, 4, 6], ["FU", 5, [0, 1]], ["AN", 5, 0, 5], ["FU", 5, [1, 2]], ["AN", 5, 1, 4], ["FU", 5, [2, 3]], ["AN", 5, 2, 6], ["FU", 3, [0, 1]], ["SP", 3, 0, 80, [1], 1], ["AN", 3, 1, 2], ["FFSP", 3, 0, [2, 1], 1, 1], ["AN", 3, 1, 6], ["FU", 1, [0, 1]], ["SP", 1, 0, 6410, [1], 1], ["AN", 1, 1, 2], ["FFSP", 1, 0, [2, 1], 1, 1], ["AN", 1, 1, 6], ["PR", 4, 0, "auto_unroll_max_step$512"]]]], "r": [[0.253176, 0.254052, 0.254191], 0, 11.1834, 1759481208], "v": "v0.6"}
{"i": [["[\"ansor_mm\", 641, 4096, 2880, \"float16\"]", "rocm -keys=rocm,gpu -max_num_threads=256 -max_shared_memory_per_block=49152 -max_threads_per_block=1024 -mcpu=gfx942 -model=unknown -mtriple=amdgcn-amd-amdhsa-hcc -thread_warp_size=64", [-1, 16, 64, 65536, 2147483647, 1024, 16, 64], "llvm -keys=cpu -mtriple=x86_64-unknown-linux-gnu", 0, []], [[], [["CHW", 2, "local"], ["SP", 2, 0, 641, [1, 1, 641, 1], 1], ["SP", 2, 5, 4096, [1, 512, 1, 8], 1], ["SP", 2, 10, 2880, [6, 1], 1], ["RE", 2, [0, 5, 1, 6, 2, 7, 10, 11, 3, 8, 12, 4, 9]], ["FSP", 3, 0, 1, 3], ["FSP", 3, 4, 2, 3], ["RE", 3, [0, 4, 1, 5, 2, 6, 3, 7]], ["CA", 2, 3, 5], ["CHR", 1, "shared", [2]], ["CA", 2, 3, 6], ["CHR", 0, "shared", [3]], ["CA", 1, 4, 6], ["FU", 5, [0, 1]], ["AN", 5, 0, 5], ["FU", 5, [1, 2]], ["AN", 5, 1, 4], ["FU", 5, [2, 3]], ["AN", 5, 2, 6], ["FU", 3, [0, 1]], ["SP", 3, 0, 96, [1], 1], ["AN", 3, 1, 2], ["FFSP", 3, 0, [2, 1], 1, 1], ["AN", 3, 1, 6], ["FU", 1, [0, 1]], ["SP", 1, 0, 3846, [1], 1], ["AN", 1, 1, 2], ["FFSP", 1, 0, [2, 1], 1, 1], ["AN", 1, 1, 6], ["PR", 4, 0, "auto_unroll_max_step$0"]]]], "r": [[0.936514, 0.936646, 0.936722], 0, 32.1278, 1759481237], "v": "v0.6"}
