demo_artifacts/logs/mm_ansor/log_642_1024_4096.json
{"i": [["[\"ansor_mm\", 642, 1024, 4096, \"float16\"]", "rocm -keys=rocm,gpu -max_num_threads=256 -max_shared_memory_per_block=49152 -max_threads_per_block=1024 -mcpu=gfx942 -model=unknown -mtriple=amdgcn-amd-amdhsa-hcc -thread_warp_size=64", [-1, 16, 64, 65536, 2147483647, 1024, 16, 64], "llvm -keys=cpu -mtriple=x86_64-unknown-linux-gnu", 0, []], [[], [["CHW", 2, "local"], ["SP", 2, 0, 642, [1, 1, 214, 3], 1], ["SP", 2, 5, 1024, [1, 256, 1, 4], 1], ["SP", 2, 10, 4096, [8, 1], 1], ["RE", 2, [0, 5, 1, 6, 2, 7, 10, 11, 3, 8, 12, 4, 9]], ["FSP", 3, 0, 1, 3], ["FSP", 3, 4, 2, 3], ["RE", 3, [0, 4, 1, 5, 2, 6, 3, 7]], ["CA", 2, 3, 5], ["CHR", 1, "shared", [2]], ["CA", 2, 3, 6], ["CHR", 0, "shared", [3]], ["CA", 1, 4, 6], ["FU", 5, [0, 1]], ["AN", 5, 0, 5], ["FU", 5, [1, 2]], ["AN", 5, 1, 4], ["FU", 5, [2, 3]], ["AN", 5, 2, 6], ["FU", 3, [0, 1]], ["SP", 3, 0, 16, [1], 1], ["AN", 3, 1, 2], ["FFSP", 3, 0, [2, 1], 1, 1], ["AN", 3, 1, 6], ["FU", 1, [0, 1]], ["SP", 1, 0, 2568, [1], 1], ["AN", 1, 1, 2], ["FFSP", 1, 0, [2, 1], 1, 1], ["AN", 1, 1, 6], ["PR", 4, 0, "auto_unroll_max_step$16"]]]], "r": [[0.331569, 0.33089, 0.331041], 0, 13.5856, 1759460829], "v": "v0.6"}
{"i": [["[\"ansor_mm\", 642, 1024, 4096, \"float16\"]", "rocm -keys=rocm,gpu -max_num_threads=256 -max_shared_memory_per_block=49152 -max_threads_per_block=1024 -mcpu=gfx942 -model=unknown -mtriple=amdgcn-amd-amdhsa-hcc -thread_warp_size=64", [-1, 16, 64, 65536, 2147483647, 1024, 16, 64], "llvm -keys=cpu -mtriple=x86_64-unknown-linux-gnu", 0, []], [[], [["CHW", 2, "local"], ["SP", 2, 0, 642, [1, 1, 1, 1], 1], ["SP", 2, 5, 1024, [2, 64, 2, 2], 1], ["SP", 2, 10, 4096, [2, 4], 1], ["RE", 2, [0, 5, 1, 6, 2, 7, 10, 11, 3, 8, 12, 4, 9]], ["FSP", 3, 0, 1, 3], ["FSP", 3, 4, 2, 3], ["RE", 3, [0, 4, 1, 5, 2, 6, 3, 7]], ["CA", 2, 3, 5], ["CHR", 1, "shared", [2]], ["CA", 2, 3, 6], ["CHR", 0, "shared", [3]], ["CA", 1, 4, 6], ["FU", 5, [0, 1]], ["AN", 5, 0, 5], ["FU", 5, [1, 2]], ["AN", 5, 1, 4], ["FU", 5, [2, 3]], ["AN", 5, 2, 6], ["FU", 3, [0, 1]], ["SP", 3, 0, 32, [1], 1], ["AN", 3, 1, 2], ["FFSP", 3, 0, [2, 1], 1, 1], ["AN", 3, 1, 6], ["FU", 1, [0, 1]], ["SP", 1, 0, 48, [1], 1], ["AN", 1, 1, 2], ["FFSP", 1, 0, [2, 1], 1, 1], ["AN", 1, 1, 6], ["PR", 4, 0, "auto_unroll_max_step$1024"]]]], "r": [[0.00127843, 0.00128163, 0.00127966], 0, 3.55797, 1759460830], "v": "v0.6"}
{"i": [["[\"ansor_mm\", 642, 1024, 4096, \"float16\"]", "rocm -keys=rocm,gpu -max_num_threads=256 -max_shared_memory_per_block=49152 -max_threads_per_block=1024 -mcpu=gfx942 -model=unknown -mtriple=amdgcn-amd-amdhsa-hcc -thread_warp_size=64", [-1, 16, 64, 65536, 2147483647, 1024, 16, 64], "llvm -keys=cpu -mtriple=x86_64-unknown-linux-gnu", 0, []], [[], [["CHW", 2, "local"], ["SP", 2, 0, 642, [1, 1, 1, 6], 1], ["SP", 2, 5, 1024, [2, 64, 2, 2], 1], ["SP", 2, 10, 4096, [2, 4], 1], ["RE", 2, [0, 5, 1, 6, 2, 7, 10, 11, 3, 8, 12, 4, 9]], ["FSP", 3, 0, 1, 3], ["FSP", 3, 4, 2, 3], ["RE", 3, [0, 4, 1, 5, 2, 6, 3, 7]], ["CA", 2, 3, 5], ["CHR", 1, "shared", [2]], ["CA", 2, 3, 6], ["CHR", 0, "shared", [3]], ["CA", 1, 4, 6], ["FU", 5, [0, 1]], ["AN", 5, 0, 5], ["FU", 5, [1, 2]], ["AN", 5, 1, 4], ["FU", 5, [2, 3]], ["AN", 5, 2, 6], ["FU", 3, [0, 1]], ["SP", 3, 0, 32, [4], 1], ["AN", 3, 1, 2], ["FFSP", 3, 0, [2, 1], 1, 1], ["AN", 3, 1, 6], ["FU", 1, [0, 1]], ["SP", 1, 0, 48, [1], 1], ["AN", 1, 1, 2], ["FFSP", 1, 0, [2, 1], 1, 1], ["AN", 1, 1, 6], ["PR", 4, 0, "auto_unroll_max_step$1024"]]]], "r": [[0.000968901, 0.000968625, 0.000968653], 0, 3.64091, 1759460831], "v": "v0.6"}
{"i": [["[\"ansor_mm\", 642, 1024, 4096, \"float16\"]", "rocm -keys=rocm,gpu -max_num_threads=256 -max_shared_memory_per_block=49152 -max_threads_per_block=1024 -mcpu=gfx942 -model=unknown -mtriple=amdgcn-amd-amdhsa-hcc -thread_warp_size=64", [-1, 16, 64, 65536, 2147483647, 1024, 16, 64], "llvm -keys=cpu -mtriple=x86_64-unknown-linux-gnu", 0, []], [[], [["CHW", 2, "local"], ["SP", 2, 0, 642, [1, 107, 1, 1], 1], ["SP", 2, 5, 1024, [1, 1, 512, 1], 1], ["SP", 2, 10, 4096, [1, 4], 1], ["RE", 2, [0, 5, 1, 6, 2, 7, 10, 11, 3, 8, 12, 4, 9]], ["FSP", 3, 0, 1, 3], ["FSP", 3, 4, 2, 3], ["RE", 3, [0, 4, 1, 5, 2, 6, 3, 7]], ["CA", 2, 3, 5], ["CHR", 1, "shared", [2]], ["CA", 2, 3, 6], ["CHR", 0, "shared", [3]], ["CA", 1, 4, 6], ["FU", 5, [0, 1]], ["AN", 5, 0, 5], ["FU", 5, [1, 2]], ["AN", 5, 1, 4], ["FU", 5, [2, 3]], ["AN", 5, 2, 6], ["FU", 3, [0, 1]], ["SP", 3, 0, 2048, [1], 1], ["AN", 3, 1, 2], ["FFSP", 3, 0, [2, 1], 1, 1], ["AN", 3, 1, 6], ["FU", 1, [0, 1]], ["SP", 1, 0, 4, [1], 1], ["AN", 1, 1, 2], ["FFSP", 1, 0, [2, 1], 1, 1], ["AN", 1, 1, 6], ["PR", 4, 0, "auto_unroll_max_step$16"]]]], "r": [[0.0315312, 0.0314924, 0.0314864], 0, 3.82034, 1759460832], "v": "v0.6"}
{"i": [["[\"ansor_mm\", 642, 1024, 4096, \"float16\"]", "rocm -keys=rocm,gpu -max_num_threads=256 -max_shared_memory_per_block=49152 -max_threads_per_block=1024 -mcpu=gfx942 -model=unknown -mtriple=amdgcn-amd-amdhsa-hcc -thread_warp_size=64", [-1, 16, 64, 65536, 2147483647, 1024, 16, 64], "llvm -keys=cpu -mtriple=x86_64-unknown-linux-gnu", 0, []], [[], [["CHW", 2, "local"], ["SP", 2, 0, 642, [6, 107, 1, 1], 1], ["SP", 2, 5, 1024, [2, 1, 1, 64], 1], ["SP", 2, 10, 4096, [2, 8], 1], ["RE", 2, [0, 5, 1, 6, 2, 7, 10, 11, 3, 8, 12, 4, 9]], ["FSP", 3, 0, 1, 3], ["FSP", 3, 4, 2, 3], ["RE", 3, [0, 4, 1, 5, 2, 6, 3, 7]], ["CA", 2, 3, 5], ["CHR", 1, "shared", [2]], ["CA", 2, 3, 6], ["CHR", 0, "shared", [3]], ["CA", 1, 4, 6], ["FU", 5, [0, 1]], ["AN", 5, 0, 5], ["FU", 5, [1, 2]], ["AN", 5, 1, 4], ["FU", 5, [2, 3]], ["AN", 5, 2, 6], ["FU", 3, [0, 1]], ["SP", 3, 0, 32, [4], 1], ["AN", 3, 1, 2], ["FFSP", 3, 0, [2, 1], 1, 1], ["AN", 3, 1, 6], ["FU", 1, [0, 1]], ["SP", 1, 0, 16, [4], 1], ["AN", 1, 1, 2], ["FFSP", 1, 0, [2, 1], 1, 1], ["AN", 1, 1, 6], ["PR", 4, 0, "auto_unroll_max_step$64"]]]], "r": [[0.0455174, 0.0455318, 0.0455216], 0, 4.62773, 1759460834], "v": "v0.6"}
{"i": [["[\"ansor_mm\", 642, 1024, 4096, \"float16\"]", "rocm -keys=rocm,gpu -max_num_threads=256 -max_shared_memory_per_block=49152 -max_threads_per_block=1024 -mcpu=gfx942 -model=unknown -mtriple=amdgcn-amd-amdhsa-hcc -thread_warp_size=64", [-1, 16, 64, 65536, 2147483647, 1024, 16, 64], "llvm -keys=cpu -mtriple=x86_64-unknown-linux-gnu", 0, []], [[], [["CHW", 2, "local"], ["SP", 2, 0, 642, [3, 107, 1, 2], 1], ["SP", 2, 5, 1024, [1, 4, 4, 8], 1], ["SP", 2, 10, 4096, [16, 1], 1], ["RE", 2, [0, 5, 1, 6, 2, 7, 10, 11, 3, 8, 12, 4, 9]], ["FSP", 3, 0, 1, 3], ["FSP", 3, 4, 2, 3], ["RE", 3, [0, 4, 1, 5, 2, 6, 3, 7]], ["CA", 2, 3, 5], ["CHR", 1, "shared", [2]], ["CA", 2, 3, 6], ["CHR", 0, "shared", [3]], ["CA", 1, 4, 6], ["FU", 5, [0, 1]], ["AN", 5, 0, 5], ["FU", 5, [1, 2]], ["AN", 5, 1, 4], ["FU", 5, [2, 3]], ["AN", 5, 2, 6], ["FU", 3, [0, 1]], ["SP", 3, 0, 512, [2], 1], ["AN", 3, 1, 2], ["FFSP", 3, 0, [2, 1], 1, 1], ["AN", 3, 1, 6], ["FU", 1, [0, 1]], ["SP", 1, 0, 32, [1], 1], ["AN", 1, 1, 2], ["FFSP", 1, 0, [2, 1], 1, 1], ["AN", 1, 1, 6], ["PR", 4, 0, "auto_unroll_max_step$512"]]]], "r": [[0.00346425, 0.00346021, 0.0034593], 0, 3.50625, 1759460835], "v": "v0.6"}
{"i": [["[\"ansor_mm\", 642, 1024, 4096, \"float16\"]", "rocm -keys=rocm,gpu -max_num_threads=256 -max_shared_memory_per_block=49152 -max_threads_per_block=1024 -mcpu=gfx942 -model=unknown -mtriple=amdgcn-amd-amdhsa-hcc -thread_warp_size=64", [-1, 16, 64, 65536, 2147483647, 1024, 16, 64], "llvm -keys=cpu -mtriple=x86_64-unknown-linux-gnu", 0, []], [[], [["CHW", 2, "local"], ["SP", 2, 0, 642, [1, 107, 3, 2], 1], ["SP", 2, 5, 1024, [4, 8, 8, 1], 1], ["SP", 2, 10, 4096, [4, 1], 1], ["RE", 2, [0, 5, 1, 6, 2, 7, 10, 11, 3, 8, 12, 4, 9]], ["FSP", 3, 0, 1, 3], ["FSP", 3, 4, 2, 3], ["RE", 3, [0, 4, 1, 5, 2, 6, 3, 7]], ["CA", 2, 3, 5], ["CHR", 1, "shared", [2]], ["CA", 2, 3, 6], ["CHR", 0, "shared", [3]], ["CA", 1, 4, 6], ["FU", 5, [0, 1]], ["AN", 5, 0, 5], ["FU", 5, [1, 2]], ["AN", 5, 1, 4], ["FU", 5, [2, 3]], ["AN", 5, 2, 6], ["FU", 3, [0, 1]], ["SP", 3, 0, 32, [1], 1], ["AN", 3, 1, 2], ["FFSP", 3, 0, [2, 1], 1, 1], ["AN", 3, 1, 6], ["FU", 1, [0, 1]], ["SP", 1, 0, 24, [1], 1], ["AN", 1, 1, 2], ["FFSP", 1, 0, [2, 1], 1, 1], ["AN", 1, 1, 6], ["PR", 4, 0, "auto_unroll_max_step$512"]]]], "r": [[0.0118834, 0.0117755, 0.0118119], 0, 3.69428, 1759460835], "v": "v0.6"}
{"i": [["[\"ansor_mm\", 642, 1024, 4096, \"float16\"]", "rocm -keys=rocm,gpu -max_num_threads=256 -max_shared_memory_per_block=49152 -max_threads_per_block=1024 -mcpu=gfx942 -model=unknown -mtriple=amdgcn-amd-amdhsa-hcc -thread_warp_size=64", [-1, 16, 64, 65536, 2147483647, 1024, 16, 64], "llvm -keys=cpu -mtriple=x86_64-unknown-linux-gnu", 0, []], [[], [["CHW", 2, "local"], ["SP", 2, 0, 642, [1, 1, 1, 2], 1], ["SP", 2, 5, 1024, [2, 2, 32, 4], 1], ["SP", 2, 10, 4096, [4, 2], 1], ["RE", 2, [0, 5, 1, 6, 2, 7, 10, 11, 3, 8, 12, 4, 9]], ["FSP", 3, 0, 1, 3], ["FSP", 3, 4, 2, 3], ["RE", 3, [0, 4, 1, 5, 2, 6, 3, 7]], ["CA", 2, 3, 5], ["CHR", 1, "shared", [2]], ["CA", 2, 3, 6], ["CHR", 0, "shared", [3]], ["CA", 1, 4, 6], ["FU", 5, [0, 1]], ["AN", 5, 0, 5], ["FU", 5, [1, 2]], ["AN", 5, 1, 4], ["FU", 5, [2, 3]], ["AN", 5, 2, 6], ["FU", 3, [0, 1]], ["SP", 3, 0, 4096, [1], 1], ["AN", 3, 1, 2], ["FFSP", 3, 0, [2, 1], 1, 1], ["AN", 3, 1, 6], ["FU", 1, [0, 1]], ["SP", 1, 0, 64, [1], 1], ["AN", 1, 1, 2], ["FFSP", 1, 0, [2, 1], 1, 1], ["AN", 1, 1, 6], ["PR", 4, 0, "auto_unroll_max_step$512"]]]], "r": [[0.0628065, 0.0633995, 0.0622944], 0, 4.94985, 1759460837], "v": "v0.6"}
{"i": [["[\"ansor_mm\", 642, 1024, 4096, \"float16\"]", "rocm -keys=rocm,gpu -max_num_threads=256 -max_shared_memory_per_block=49152 -max_threads_per_block=1024 -mcpu=gfx942 -model=unknown -mtriple=amdgcn-amd-amdhsa-hcc -thread_warp_size=64", [-1, 16, 64, 65536, 2147483647, 1024, 16, 64], "llvm -keys=cpu -mtriple=x86_64-unknown-linux-gnu", 0, []], [[], [["CHW", 2, "local"], ["SP", 2, 0, 642, [2, 107, 1, 3], 1], ["SP", 2, 5, 1024, [2, 8, 1, 8], 1], ["SP", 2, 10, 4096, [16, 1], 1], ["RE", 2, [0, 5, 1, 6, 2, 7, 10, 11, 3, 8, 12, 4, 9]], ["FSP", 3, 0, 1, 3], ["FSP", 3, 4, 2, 3], ["RE", 3, [0, 4, 1, 5, 2, 6, 3, 7]], ["CA", 2, 3, 5], ["CHR", 1, "shared", [2]], ["CA", 2, 3, 6], ["CHR", 0, "shared", [3]], ["CA", 1, 4, 6], ["FU", 5, [0, 1]], ["AN", 5, 0, 5], ["FU", 5, [1, 2]], ["AN", 5, 1, 4], ["FU", 5, [2, 3]], ["AN", 5, 2, 6], ["FU", 3, [0, 1]], ["SP", 3, 0, 256, [1], 1], ["AN", 3, 1, 2], ["FFSP", 3, 0, [2, 1], 1, 1], ["AN", 3, 1, 6], ["FU", 1, [0, 1]], ["SP", 1, 0, 48, [8], 1], ["AN", 1, 1, 2], ["FFSP", 1, 0, [2, 1], 1, 1], ["AN", 1, 1, 6], ["PR", 4, 0, "auto_unroll_max_step$64"]]]], "r": [[0.00221027, 0.00220995, 0.00220996], 0, 3.26998, 1759460838], "v": "v0.6"}
{"i": [["[\"ansor_mm\", 642, 1024, 4096, \"float16\"]", "rocm -keys=rocm,gpu -max_num_threads=256 -max_shared_memory_per_block=49152 -max_threads_per_block=1024 -mcpu=gfx942 -model=unknown -mtriple=amdgcn-amd-amdhsa-hcc -thread_warp_size=64", [-1, 16, 64, 65536, 2147483647, 1024, 16, 64], "llvm -keys=cpu -mtriple=x86_64-unknown-linux-gnu", 0, []], [[], [["CHW", 2, "local"], ["SP", 2, 0, 642, [3, 107, 1, 1], 1], ["SP", 2, 5, 1024, [2, 2, 1, 2], 1], ["SP", 2, 10, 4096, [2, 4], 1], ["RE", 2, [0, 5, 1, 6, 2, 7, 10, 11, 3, 8, 12, 4, 9]], ["FSP", 3, 0, 1, 3], ["FSP", 3, 4, 2, 3], ["RE", 3, [0, 4, 1, 5, 2, 6, 3, 7]], ["CA", 2, 3, 5], ["CHR", 1, "shared", [2]], ["CA", 2, 3, 6], ["CHR", 0, "shared", [3]], ["CA", 1, 4, 6], ["FU", 5, [0, 1]], ["AN", 5, 0, 5], ["FU", 5, [1, 2]], ["AN", 5, 1, 4], ["FU", 5, [2, 3]], ["AN", 5, 2, 6], ["FU", 3, [0, 1]], ["SP", 3, 0, 16, [1], 1], ["AN", 3, 1, 2], ["FFSP", 3, 0, [2, 1], 1, 1], ["AN", 3, 1, 6], ["FU", 1, [0, 1]], ["SP", 1, 0, 24, [1], 1], ["AN", 1, 1, 2], ["FFSP", 1, 0, [2, 1], 1, 1], ["AN", 1, 1, 6], ["PR", 4, 0, "auto_unroll_max_step$0"]]]], "r": [[0.000630529, 0.000630418, 0.000630505], 0, 3.56719, 1759460839], "v": "v0.6"}
{"i": [["[\"ansor_mm\", 642, 1024, 4096, \"float16\"]", "rocm -keys=rocm,gpu -max_num_threads=256 -max_shared_memory_per_block=49152 -max_threads_per_block=1024 -mcpu=gfx942 -model=unknown -mtriple=amdgcn-amd-amdhsa-hcc -thread_warp_size=64", [-1, 16, 64, 65536, 2147483647, 1024, 16, 64], "llvm -keys=cpu -mtriple=x86_64-unknown-linux-gnu", 0, []], [[], [["CHW", 2, "local"], ["SP", 2, 0, 642, [1, 1, 6, 1], 1], ["SP", 2, 5, 1024, [8, 2, 1, 8], 1], ["SP", 2, 10, 4096, [2, 4], 1], ["RE", 2, [0, 5, 1, 6, 2, 7, 10, 11, 3, 8, 12, 4, 9]], ["FSP", 3, 0, 1, 3], ["FSP", 3, 4, 2, 3], ["RE", 3, [0, 4, 1, 5, 2, 6, 3, 7]], ["CA", 2, 3, 5], ["CHR", 1, "shared", [2]], ["CA", 2, 3, 6], ["CHR", 0, "shared", [3]], ["CA", 1, 4, 6], ["FU", 5, [0, 1]], ["AN", 5, 0, 5], ["FU", 5, [1, 2]], ["AN", 5, 1, 4], ["FU", 5, [2, 3]], ["AN", 5, 2, 6], ["FU", 3, [0, 1]], ["SP", 3, 0, 64, [4], 1], ["AN", 3, 1, 2], ["FFSP", 3, 0, [2, 1], 1, 1], ["AN", 3, 1, 6], ["FU", 1, [0, 1]], ["SP", 1, 0, 48, [1], 1], ["AN", 1, 1, 2], ["FFSP", 1, 0, [2, 1], 1, 1], ["AN", 1, 1, 6], ["PR", 4, 0, "auto_unroll_max_step$1024"]]]], "r": [[0.0468656, 0.0469911, 0.0468615], 0, 5.73052, 1759460841], "v": "v0.6"}
{"i": [["[\"ansor_mm\", 642, 1024, 4096, \"float16\"]", "rocm -keys=rocm,gpu -max_num_threads=256 -max_shared_memory_per_block=49152 -max_threads_per_block=1024 -mcpu=gfx942 -model=unknown -mtriple=amdgcn-amd-amdhsa-hcc -thread_warp_size=64", [-1, 16, 64, 65536, 2147483647, 1024, 16, 64], "llvm -keys=cpu -mtriple=x86_64-unknown-linux-gnu", 0, []], [[], [["CHW", 2, "local"], ["SP", 2, 0, 642, [3, 1, 2, 1], 1], ["SP", 2, 5, 1024, [1, 512, 2, 1], 1], ["SP", 2, 10, 4096, [1, 16], 1], ["RE", 2, [0, 5, 1, 6, 2, 7, 10, 11, 3, 8, 12, 4, 9]], ["FSP", 3, 0, 1, 3], ["FSP", 3, 4, 2, 3], ["RE", 3, [0, 4, 1, 5, 2, 6, 3, 7]], ["CA", 2, 3, 5], ["CHR", 1, "shared", [2]], ["CA", 2, 3, 6], ["CHR", 0, "shared", [3]], ["CA", 1, 4, 6], ["FU", 5, [0, 1]], ["AN", 5, 0, 5], ["FU", 5, [1, 2]], ["AN", 5, 1, 4], ["FU", 5, [2, 3]], ["AN", 5, 2, 6], ["FU", 3, [0, 1]], ["SP", 3, 0, 32, [1], 1], ["AN", 3, 1, 2], ["FFSP", 3, 0, [2, 1], 1, 1], ["AN", 3, 1, 6], ["FU", 1, [0, 1]], ["SP", 1, 0, 96, [1], 1], ["AN", 1, 1, 2], ["FFSP", 1, 0, [2, 1], 1, 1], ["AN", 1, 1, 6], ["PR", 4, 0, "auto_unroll_max_step$0"]]]], "r": [[0.00111331, 0.00111346, 0.00111352], 0, 3.29789, 1759460841], "v": "v0.6"}
{"i": [["[\"ansor_mm\", 642, 1024, 4096, \"float16\"]", "rocm -keys=rocm,gpu -max_num_threads=256 -max_shared_memory_per_block=49152 -max_threads_per_block=1024 -mcpu=gfx942 -model=unknown -mtriple=amdgcn-amd-amdhsa-hcc -thread_warp_size=64", [-1, 16, 64, 65536, 2147483647, 1024, 16, 64], "llvm -keys=cpu -mtriple=x86_64-unknown-linux-gnu", 0, []], [[], [["CHW", 2, "local"], ["SP", 2, 0, 642, [6, 1, 1, 1], 1], ["SP", 2, 5, 1024, [1, 512, 1, 1], 1], ["SP", 2, 10, 4096, [2, 2], 1], ["RE", 2, [0, 5, 1, 6, 2, 7, 10, 11, 3, 8, 12, 4, 9]], ["FSP", 3, 0, 1, 3], ["FSP", 3, 4, 2, 3], ["RE", 3, [0, 4, 1, 5, 2, 6, 3, 7]], ["CA", 2, 3, 5], ["CHR", 1, "shared", [2]], ["CA", 2, 3, 6], ["CHR", 0, "shared", [3]], ["CA", 1, 4, 6], ["FU", 5, [0, 1]], ["AN", 5, 0, 5], ["FU", 5, [1, 2]], ["AN", 5, 1, 4], ["FU", 5, [2, 3]], ["AN", 5, 2, 6], ["FU", 3, [0, 1]], ["SP", 3, 0, 4, [4], 1], ["AN", 3, 1, 2], ["FFSP", 3, 0, [2, 1], 1, 1], ["AN", 3, 1, 6], ["FU", 1, [0, 1]], ["SP", 1, 0, 24, [6], 1], ["AN", 1, 1, 2], ["FFSP", 1, 0, [2, 1], 1, 1], ["AN", 1, 1, 6], ["PR", 4, 0, "auto_unroll_max_step$64"]]]], "r": [[0.00239705, 0.00239657, 0.00239643], 0, 3.1393, 1759460842], "v": "v0.6"}
{"i": [["[\"ansor_mm\", 642, 1024, 4096, \"float16\"]", "rocm -keys=rocm,gpu -max_num_threads=256 -max_shared_memory_per_block=49152 -max_threads_per_block=1024 -mcpu=gfx942 -model=unknown -mtriple=amdgcn-amd-amdhsa-hcc -thread_warp_size=64", [-1, 16, 64, 65536, 2147483647, 1024, 16, 64], "llvm -keys=cpu -mtriple=x86_64-unknown-linux-gnu", 0, []], [[], [["CHW", 2, "local"], ["SP", 2, 0, 642, [1, 2, 107, 1], 1], ["SP", 2, 5, 1024, [1, 32, 1, 8], 1], ["SP", 2, 10, 4096, [8, 1], 1], ["RE", 2, [0, 5, 1, 6, 2, 7, 10, 11, 3, 8, 12, 4, 9]], ["FSP", 3, 0, 1, 3], ["FSP", 3, 4, 2, 3], ["RE", 3, [0, 4, 1, 5, 2, 6, 3, 7]], ["CA", 2, 3, 5], ["CHR", 1, "shared", [2]], ["CA", 2, 3, 6], ["CHR", 0, "shared", [3]], ["CA", 1, 4, 6], ["FU", 5, [0, 1]], ["AN", 5, 0, 5], ["FU", 5, [1, 2]], ["AN", 5, 1, 4], ["FU", 5, [2, 3]], ["AN", 5, 2, 6], ["FU", 3, [0, 1]], ["SP", 3, 0, 16, [8], 1], ["AN", 3, 1, 2], ["FFSP", 3, 0, [2, 1], 1, 1], ["AN", 3, 1, 6], ["FU", 1, [0, 1]], ["SP", 1, 0, 2568, [1], 1], ["AN", 1, 1, 2], ["FFSP", 1, 0, [2, 1], 1, 1], ["AN", 1, 1, 6], ["PR", 4, 0, "auto_unroll_max_step$16"]]]], "r": [[0.0588896, 0.0589459, 0.0591635], 0, 4.78268, 1759460844], "v": "v0.6"}
{"i": [["[\"ansor_mm\", 642, 1024, 4096, \"float16\"]", "rocm -keys=rocm,gpu -max_num_threads=256 -max_shared_memory_per_block=49152 -max_threads_per_block=1024 -mcpu=gfx942 -model=unknown -mtriple=amdgcn-amd-amdhsa-hcc -thread_warp_size=64", [-1, 16, 64, 65536, 2147483647, 1024, 16, 64], "llvm -keys=cpu -mtriple=x86_64-unknown-linux-gnu", 0, []], [[], [["CHW", 2, "local"], ["SP", 2, 0, 642, [1, 107, 2, 3], 1], ["SP", 2, 5, 1024, [2, 1, 128, 2], 1], ["SP", 2, 10, 4096, [16, 1], 1], ["RE", 2, [0, 5, 1, 6, 2, 7, 10, 11, 3, 8, 12, 4, 9]], ["FSP", 3, 0, 1, 3], ["FSP", 3, 4, 2, 3], ["RE", 3, [0, 4, 1, 5, 2, 6, 3, 7]], ["CA", 2, 3, 5], ["CHR", 1, "shared", [2]], ["CA", 2, 3, 6], ["CHR", 0, "shared", [3]], ["CA", 1, 4, 6], ["FU", 5, [0, 1]], ["AN", 5, 0, 5], ["FU", 5, [1, 2]], ["AN", 5, 1, 4], ["FU", 5, [2, 3]], ["AN", 5, 2, 6], ["FU", 3, [0, 1]], ["SP", 3, 0, 64, [1], 1], ["AN", 3, 1, 2], ["FFSP", 3, 0, [2, 1], 1, 1], ["AN", 3, 1, 6], ["FU", 1, [0, 1]], ["SP", 1, 0, 48, [1], 1], ["AN", 1, 1, 2], ["FFSP", 1, 0, [2, 1], 1, 1], ["AN", 1, 1, 6], ["PR", 4, 0, "auto_unroll_max_step$1024"]]]], "r": [[0.363311, 0.363993, 0.364531], 0, 14.9417, 1759460855], "v": "v0.6"}
{"i": [["[\"ansor_mm\", 642, 1024, 4096, \"float16\"]", "rocm -keys=rocm,gpu -max_num_threads=256 -max_shared_memory_per_block=49152 -max_threads_per_block=1024 -mcpu=gfx942 -model=unknown -mtriple=amdgcn-amd-amdhsa-hcc -thread_warp_size=64", [-1, 16, 64, 65536, 2147483647, 1024, 16, 64], "llvm -keys=cpu -mtriple=x86_64-unknown-linux-gnu", 0, []], [[], [["CHW", 2, "local"], ["SP", 2, 0, 642, [1, 2, 3, 1], 1], ["SP", 2, 5, 1024, [2, 4, 1, 1], 1], ["SP", 2, 10, 4096, [8, 2], 1], ["RE", 2, [0, 5, 1, 6, 2, 7, 10, 11, 3, 8, 12, 4, 9]], ["FSP", 3, 0, 1, 3], ["FSP", 3, 4, 2, 3], ["RE", 3, [0, 4, 1, 5, 2, 6, 3, 7]], ["CA", 2, 3, 5], ["CHR", 1, "shared", [2]], ["CA", 2, 3, 6], ["CHR", 0, "shared", [3]], ["CA", 1, 4, 6], ["FU", 5, [0, 1]], ["AN", 5, 0, 5], ["FU", 5, [1, 2]], ["AN", 5, 1, 4], ["FU", 5, [2, 3]], ["AN", 5, 2, 6], ["FU", 3, [0, 1]], ["SP", 3, 0, 16, [8], 1], ["AN", 3, 1, 2], ["FFSP", 3, 0, [2, 1], 1, 1], ["AN", 3, 1, 6], ["FU", 1, [0, 1]], ["SP", 1, 0, 48, [1], 1], ["AN", 1, 1, 2], ["FFSP", 1, 0, [2, 1], 1, 1], ["AN", 1, 1, 6], ["PR", 4, 0, "auto_unroll_max_step$1024"]]]], "r": [[0.00163617, 0.00163568, 0.0016372], 0, 3.57328, 1759460856], "v": "v0.6"}
{"i": [["[\"ansor_mm\", 642, 1024, 4096, \"float16\"]", "rocm -keys=rocm,gpu -max_num_threads=256 -max_shared_memory_per_block=49152 -max_threads_per_block=1024 -mcpu=gfx942 -model=unknown -mtriple=amdgcn-amd-amdhsa-hcc -thread_warp_size=64", [-1, 16, 64, 65536, 2147483647, 1024, 16, 64], "llvm -keys=cpu -mtriple=x86_64-unknown-linux-gnu", 0, []], [[], [["CHW", 2, "local"], ["SP", 2, 0, 642, [1, 107, 6, 1], 1], ["SP", 2, 5, 1024, [4, 1, 2, 64], 1], ["SP", 2, 10, 4096, [1, 8], 1], ["RE", 2, [0, 5, 1, 6, 2, 7, 10, 11, 3, 8, 12, 4, 9]], ["FSP", 3, 0, 1, 3], ["FSP", 3, 4, 2, 3], ["RE", 3, [0, 4, 1, 5, 2, 6, 3, 7]], ["CA", 2, 3, 5], ["CHR", 1, "shared", [2]], ["CA", 2, 3, 6], ["CHR", 0, "shared", [3]], ["CA", 1, 4, 6], ["FU", 5, [0, 1]], ["AN", 5, 0, 5], ["FU", 5, [1, 2]], ["AN", 5, 1, 4], ["FU", 5, [2, 3]], ["AN", 5, 2, 6], ["FU", 3, [0, 1]], ["SP", 3, 0, 1024, [1], 1], ["AN", 3, 1, 2], ["FFSP", 3, 0, [2, 1], 1, 1], ["AN", 3, 1, 6], ["FU", 1, [0, 1]], ["SP", 1, 0, 16, [1], 1], ["AN", 1, 1, 2], ["FFSP", 1, 0, [2, 1], 1, 1], ["AN", 1, 1, 6], ["PR", 4, 0, "auto_unroll_max_step$0"]]]], "r": [[0.345032, 0.343741, 0.343932], 0, 14.2556, 1759460867], "v": "v0.6"}
{"i": [["[\"ansor_mm\", 642, 1024, 4096, \"float16\"]", "rocm -keys=rocm,gpu -max_num_threads=256 -max_shared_memory_per_block=49152 -max_threads_per_block=1024 -mcpu=gfx942 -model=unknown -mtriple=amdgcn-amd-amdhsa-hcc -thread_warp_size=64", [-1, 16, 64, 65536, 2147483647, 1024, 16, 64], "llvm -keys=cpu -mtriple=x86_64-unknown-linux-gnu", 0, []], [[], [["CHW", 2, "local"], ["SP", 2, 0, 642, [1, 3, 107, 1], 1], ["SP", 2, 5, 1024, [2, 64, 8, 1], 1], ["SP", 2, 10, 4096, [4, 2], 1], ["RE", 2, [0, 5, 1, 6, 2, 7, 10, 11, 3, 8, 12, 4, 9]], ["FSP", 3, 0, 1, 3], ["FSP", 3, 4, 2, 3], ["RE", 3, [0, 4, 1, 5, 2, 6, 3, 7]], ["CA", 2, 3, 5], ["CHR", 1, "shared", [2]], ["CA", 2, 3, 6], ["CHR", 0, "shared", [3]], ["CA", 1, 4, 6], ["FU", 5, [0, 1]], ["AN", 5, 0, 5], ["FU", 5, [1, 2]], ["AN", 5, 1, 4], ["FU", 5, [2, 3]], ["AN", 5, 2, 6], ["FU", 3, [0, 1]], ["SP", 3, 0, 64, [1], 1], ["AN", 3, 1, 2], ["FFSP", 3, 0, [2, 1], 1, 1], ["AN", 3, 1, 6], ["FU", 1, [0, 1]], ["SP", 1, 0, 856, [1], 1], ["AN", 1, 1, 2], ["FFSP", 1, 0, [2, 1], 1, 1], ["AN", 1, 1, 6], ["PR", 4, 0, "auto_unroll_max_step$16"]]]], "r": [[0.186575, 0.186331, 0.186608], 0, 8.60357, 1759460873], "v": "v0.6"}
{"i": [["[\"ansor_mm\", 642, 1024, 4096, \"float16\"]", "rocm -keys=rocm,gpu -max_num_threads=256 -max_shared_memory_per_block=49152 -max_threads_per_block=1024 -mcpu=gfx942 -model=unknown -mtriple=amdgcn-amd-amdhsa-hcc -thread_warp_size=64", [-1, 16, 64, 65536, 2147483647, 1024, 16, 64], "llvm -keys=cpu -mtriple=x86_64-unknown-linux-gnu", 0, []], [[], [["CHW", 2, "local"], ["SP", 2, 0, 642, [2, 3, 107, 1], 1], ["SP", 2, 5, 1024, [2, 64, 2, 1], 1], ["SP", 2, 10, 4096, [16, 2], 1], ["RE", 2, [0, 5, 1, 6, 2, 7, 10, 11, 3, 8, 12, 4, 9]], ["FSP", 3, 0, 1, 3], ["FSP", 3, 4, 2, 3], ["RE", 3, [0, 4, 1, 5, 2, 6, 3, 7]], ["CA", 2, 3, 5], ["CHR", 1, "shared", [2]], ["CA", 2, 3, 6], ["CHR", 0, "shared", [3]], ["CA", 1, 4, 6], ["FU", 5, [0, 1]], ["AN", 5, 0, 5], ["FU", 5, [1, 2]], ["AN", 5, 1, 4], ["FU", 5, [2, 3]], ["AN", 5, 2, 6], ["FU", 3, [0, 1]], ["SP", 3, 0, 64, [1], 1], ["AN", 3, 1, 2], ["FFSP", 3, 0, [2, 1], 1, 1], ["AN", 3, 1, 6], ["FU", 1, [0, 1]], ["SP", 1, 0, 3424, [1], 1], ["AN", 1, 1, 2], ["FFSP", 1, 0, [2, 1], 1, 1], ["AN", 1, 1, 6], ["PR", 4, 0, "auto_unroll_max_step$1024"]]]], "r": [[0.0841514, 0.0841419, 0.0840407], 0, 5.93474, 1759460876], "v": "v0.6"}
{"i": [["[\"ansor_mm\", 642, 1024, 4096, \"float16\"]", "rocm -keys=rocm,gpu -max_num_threads=256 -max_shared_memory_per_block=49152 -max_threads_per_block=1024 -mcpu=gfx942 -model=unknown -mtriple=amdgcn-amd-amdhsa-hcc -thread_warp_size=64", [-1, 16, 64, 65536, 2147483647, 1024, 16, 64], "llvm -keys=cpu -mtriple=x86_64-unknown-linux-gnu", 0, []], [[], [["CHW", 2, "local"], ["SP", 2, 0, 642, [1, 214, 3, 1], 1], ["SP", 2, 5, 1024, [4, 4, 4, 8], 1], ["SP", 2, 10, 4096, [1, 4], 1], ["RE", 2, [0, 5, 1, 6, 2, 7, 10, 11, 3, 8, 12, 4, 9]], ["FSP", 3, 0, 1, 3], ["FSP", 3, 4, 2, 3], ["RE", 3, [0, 4, 1, 5, 2, 6, 3, 7]], ["CA", 2, 3, 5], ["CHR", 1, "shared", [2]], ["CA", 2, 3, 6], ["CHR", 0, "shared", [3]], ["CA", 1, 4, 6], ["FU", 5, [0, 1]], ["AN", 5, 0, 5], ["FU", 5, [1, 2]], ["AN", 5, 1, 4], ["FU", 5, [2, 3]], ["AN", 5, 2, 6], ["FU", 3, [0, 1]], ["SP", 3, 0, 128, [1], 1], ["AN", 3, 1, 2], ["FFSP", 3, 0, [2, 1], 1, 1], ["AN", 3, 1, 6], ["FU", 1, [0, 1]], ["SP", 1, 0, 12, [1], 1], ["AN", 1, 1, 2], ["FFSP", 1, 0, [2, 1], 1, 1], ["AN", 1, 1, 6], ["PR", 4, 0, "auto_unroll_max_step$0"]]]], "r": [[0.103151, 0.103173, 0.103167], 0, 6.6134, 1759460879], "v": "v0.6"}
{"i": [["[\"ansor_mm\", 642, 1024, 4096, \"float16\"]", "rocm -keys=rocm,gpu -max_num_threads=256 -max_shared_memory_per_block=49152 -max_threads_per_block=1024 -mcpu=gfx942 -model=unknown -mtriple=amdgcn-amd-amdhsa-hcc -thread_warp_size=64", [-1, 16, 64, 65536, 2147483647, 1024, 16, 64], "llvm -keys=cpu -mtriple=x86_64-unknown-linux-gnu", 0, []], [[], [["CHW", 2, "local"], ["SP", 2, 0, 642, [1, 6, 107, 1], 1], ["SP", 2, 5, 1024, [1, 128, 2, 1], 1], ["SP", 2, 10, 4096, [8, 1], 1], ["RE", 2, [0, 5, 1, 6, 2, 7, 10, 11, 3, 8, 12, 4, 9]], ["FSP", 3, 0, 1, 3], ["FSP", 3, 4, 2, 3], ["RE", 3, [0, 4, 1, 5, 2, 6, 3, 7]], ["CA", 2, 3, 5], ["CHR", 1, "shared", [2]], ["CA", 2, 3, 6], ["CHR", 0, "shared", [3]], ["CA", 1, 4, 6], ["FU", 5, [0, 1]], ["AN", 5, 0, 5], ["FU", 5, [1, 2]], ["AN", 5, 1, 4], ["FU", 5, [2, 3]], ["AN", 5, 2, 6], ["FU", 3, [0, 1]], ["SP", 3, 0, 16, [2], 1], ["AN", 3, 1, 2], ["FFSP", 3, 0, [2, 1], 1, 1], ["AN", 3, 1, 6], ["FU", 1, [0, 1]], ["SP", 1, 0, 2568, [1], 1], ["AN", 1, 1, 2], ["FFSP", 1, 0, [2, 1], 1, 1], ["AN", 1, 1, 6], ["PR", 4, 0, "auto_unroll_max_step$16"]]]], "r": [[0.0138183, 0.0138261, 0.013821], 0, 3.60684, 1759460880], "v": "v0.6"}
{"i": [["[\"ansor_mm\", 642, 1024, 4096, \"float16\"]", "rocm -keys=rocm,gpu -max_num_threads=256 -max_shared_memory_per_block=49152 -max_threads_per_block=1024 -mcpu=gfx942 -model=unknown -mtriple=amdgcn-amd-amdhsa-hcc -thread_warp_size=64", [-1, 16, 64, 65536, 2147483647, 1024, 16, 64], "llvm -keys=cpu -mtriple=x86_64-unknown-linux-gnu", 0, []], [[], [["CHW", 2, "local"], ["SP", 2, 0, 642, [1, 321, 1, 1], 1], ["SP", 2, 5, 1024, [2, 2, 4, 1], 1], ["SP", 2, 10, 4096, [16, 1], 1], ["RE", 2, [0, 5, 1, 6, 2, 7, 10, 11, 3, 8, 12, 4, 9]], ["FSP", 3, 0, 1, 3], ["FSP", 3, 4, 2, 3], ["RE", 3, [0, 4, 1, 5, 2, 6, 3, 7]], ["CA", 2, 3, 5], ["CHR", 1, "shared", [2]], ["CA", 2, 3, 6], ["CHR", 0, "shared", [3]], ["CA", 1, 4, 6], ["FU", 5, [0, 1]], ["AN", 5, 0, 5], ["FU", 5, [1, 2]], ["AN", 5, 1, 4], ["FU", 5, [2, 3]], ["AN", 5, 2, 6], ["FU", 3, [0, 1]], ["SP", 3, 0, 128, [1], 1], ["AN", 3, 1, 2], ["FFSP", 3, 0, [2, 1], 1, 1], ["AN", 3, 1, 6], ["FU", 1, [0, 1]], ["SP", 1, 0, 16, [1], 1], ["AN", 1, 1, 2], ["FFSP", 1, 0, [2, 1], 1, 1], ["AN", 1, 1, 6], ["PR", 4, 0, "auto_unroll_max_step$512"]]]], "r": [[0.000589951, 0.000589955, 0.000589932], 0, 3.53928, 1759460881], "v": "v0.6"}
{"i": [["[\"ansor_mm\", 642, 1024, 4096, \"float16\"]", "rocm -keys=rocm,gpu -max_num_threads=256 -max_shared_memory_per_block=49152 -max_threads_per_block=1024 -mcpu=gfx942 -model=unknown -mtriple=amdgcn-amd-amdhsa-hcc -thread_warp_size=64", [-1, 16, 64, 65536, 2147483647, 1024, 16, 64], "llvm -keys=cpu -mtriple=x86_64-unknown-linux-gnu", 0, []], [[], [["CHW", 2, "local"], ["SP", 2, 0, 642, [1, 1, 2, 1], 1], ["SP", 2, 5, 1024, [2, 64, 1, 1], 1], ["SP", 2, 10, 4096, [1, 2], 1], ["RE", 2, [0, 5, 1, 6, 2, 7, 10, 11, 3, 8, 12, 4, 9]], ["FSP", 3, 0, 1, 3], ["FSP", 3, 4, 2, 3], ["RE", 3, [0, 4, 1, 5, 2, 6, 3, 7]], ["CA", 2, 3, 5], ["CHR", 1, "shared", [2]], ["CA", 2, 3, 6], ["CHR", 0, "shared", [3]], ["CA", 1, 4, 6], ["FU", 5, [0, 1]], ["AN", 5, 0, 5], ["FU", 5, [1, 2]], ["AN", 5, 1, 4], ["FU", 5, [2, 3]], ["AN", 5, 2, 6], ["FU", 3, [0, 1]], ["SP", 3, 0, 4, [4], 1], ["AN", 3, 1, 2], ["FFSP", 3, 0, [2, 1], 1, 1], ["AN", 3, 1, 6], ["FU", 1, [0, 1]], ["SP", 1, 0, 8, [1], 1], ["AN", 1, 1, 2], ["FFSP", 1, 0, [2, 1], 1, 1], ["AN", 1, 1, 6], ["PR", 4, 0, "auto_unroll_max_step$64"]]]], "r": [[0.00112797, 0.00112829, 0.001128], 0, 3.50985, 1759460882], "v": "v0.6"}
{"i": [["[\"ansor_mm\", 642, 1024, 4096, \"float16\"]", "rocm -keys=rocm,gpu -max_num_threads=256 -max_shared_memory_per_block=49152 -max_threads_per_block=1024 -mcpu=gfx942 -model=unknown -mtriple=amdgcn-amd-amdhsa-hcc -thread_warp_size=64", [-1, 16, 64, 65536, 2147483647, 1024, 16, 64], "llvm -keys=cpu -mtriple=x86_64-unknown-linux-gnu", 0, []], [[], [["CHW", 2, "local"], ["SP", 2, 0, 642, [1, 642, 1, 1], 1], ["SP", 2, 5, 1024, [4, 1, 8, 1], 1], ["SP", 2, 10, 4096, [2, 1], 1], ["RE", 2, [0, 5, 1, 6, 2, 7, 10, 11, 3, 8, 12, 4, 9]], ["FSP", 3, 0, 1, 3], ["FSP", 3, 4, 2, 3], ["RE", 3, [0, 4, 1, 5, 2, 6, 3, 7]], ["CA", 2, 3, 5], ["CHR", 1, "shared", [2]], ["CA", 2, 3, 6], ["CHR", 0, "shared", [3]], ["CA", 1, 4, 6], ["FU", 5, [0, 1]], ["AN", 5, 0, 5], ["FU", 5, [1, 2]], ["AN", 5, 1, 4], ["FU", 5, [2, 3]], ["AN", 5, 2, 6], ["FU", 3, [0, 1]], ["SP", 3, 0, 16, [1], 1], ["AN", 3, 1, 2], ["FFSP", 3, 0, [2, 1], 1, 1], ["AN", 3, 1, 6], ["FU", 1, [0, 1]], ["SP", 1, 0, 2, [2], 1], ["AN", 1, 1, 2], ["FFSP", 1, 0, [2, 1], 1, 1], ["AN", 1, 1, 6], ["PR", 4, 0, "auto_unroll_max_step$512"]]]], "r": [[0.00271419, 0.00271654, 0.00271486], 0, 3.16542, 1759460882], "v": "v0.6"}
{"i": [["[\"ansor_mm\", 642, 1024, 4096, \"float16\"]", "rocm -keys=rocm,gpu -max_num_threads=256 -max_shared_memory_per_block=49152 -max_threads_per_block=1024 -mcpu=gfx942 -model=unknown -mtriple=amdgcn-amd-amdhsa-hcc -thread_warp_size=64", [-1, 16, 64, 65536, 2147483647, 1024, 16, 64], "llvm -keys=cpu -mtriple=x86_64-unknown-linux-gnu", 0, []], [[], [["CHW", 2, "local"], ["SP", 2, 0, 642, [1, 1, 107, 6], 1], ["SP", 2, 5, 1024, [1, 64, 2, 8], 1], ["SP", 2, 10, 4096, [4, 4], 1], ["RE", 2, [0, 5, 1, 6, 2, 7, 10, 11, 3, 8, 12, 4, 9]], ["FSP", 3, 0, 1, 3], ["FSP", 3, 4, 2, 3], ["RE", 3, [0, 4, 1, 5, 2, 6, 3, 7]], ["CA", 2, 3, 5], ["CHR", 1, "shared", [2]], ["CA", 2, 3, 6], ["CHR", 0, "shared", [3]], ["CA", 1, 4, 6], ["FU", 5, [0, 1]], ["AN", 5, 0, 5], ["FU", 5, [1, 2]], ["AN", 5, 1, 4], ["FU", 5, [2, 3]], ["AN", 5, 2, 6], ["FU", 3, [0, 1]], ["SP", 3, 0, 256, [4], 1], ["AN", 3, 1, 2], ["FFSP", 3, 0, [2, 1], 1, 1], ["AN", 3, 1, 6], ["FU", 1, [0, 1]], ["SP", 1, 0, 10272, [1], 1], ["AN", 1, 1, 2], ["FFSP", 1, 0, [2, 1], 1, 1], ["AN", 1, 1, 6], ["PR", 4, 0, "auto_unroll_max_step$16"]]]], "r": [[0.590326, 0.59054, 0.587623], 0, 23.016, 1759460901], "v": "v0.6"}
{"i": [["[\"ansor_mm\", 642, 1024, 4096, \"float16\"]", "rocm -keys=rocm,gpu -max_num_threads=256 -max_shared_memory_per_block=49152 -max_threads_per_block=1024 -mcpu=gfx942 -model=unknown -mtriple=amdgcn-amd-amdhsa-hcc -thread_warp_size=64", [-1, 16, 64, 65536, 2147483647, 1024, 16, 64], "llvm -keys=cpu -mtriple=x86_64-unknown-linux-gnu", 0, []], [[], [["CHW", 2, "local"], ["SP", 2, 0, 642, [1, 214, 3, 1], 1], ["SP", 2, 5, 1024, [1, 4, 16, 8], 1], ["SP", 2, 10, 4096, [4, 1], 1], ["RE", 2, [0, 5, 1, 6, 2, 7, 10, 11, 3, 8, 12, 4, 9]], ["FSP", 3, 0, 1, 3], ["FSP", 3, 4, 2, 3], ["RE", 3, [0, 4, 1, 5, 2, 6, 3, 7]], ["CA", 2, 3, 5], ["CHR", 1, "shared", [2]], ["CA", 2, 3, 6], ["CHR", 0, "shared", [3]], ["CA", 1, 4, 6], ["FU", 5, [0, 1]], ["AN", 5, 0, 5], ["FU", 5, [1, 2]], ["AN", 5, 1, 4], ["FU", 5, [2, 3]], ["AN", 5, 2, 6], ["FU", 3, [0, 1]], ["SP", 3, 0, 128, [1], 1], ["AN", 3, 1, 2], ["FFSP", 3, 0, [2, 1], 1, 1], ["AN", 3, 1, 6], ["FU", 1, [0, 1]], ["SP", 1, 0, 12, [1], 1], ["AN", 1, 1, 2], ["FFSP", 1, 0, [2, 1], 1, 1], ["AN", 1, 1, 6], ["PR", 4, 0, "auto_unroll_max_step$0"]]]], "r": [[0.0930759, 0.092989, 0.0932109], 0, 5.91595, 1759460904], "v": "v0.6"}
{"i": [["[\"ansor_mm\", 642, 1024, 4096, \"float16\"]", "rocm -keys=rocm,gpu -max_num_threads=256 -max_shared_memory_per_block=49152 -max_threads_per_block=1024 -mcpu=gfx942 -model=unknown -mtriple=amdgcn-amd-amdhsa-hcc -thread_warp_size=64", [-1, 16, 64, 65536, 2147483647, 1024, 16, 64], "llvm -keys=cpu -mtriple=x86_64-unknown-linux-gnu", 0, []], [[], [["CHW", 2, "local"], ["SP", 2, 0, 642, [1, 214, 1, 1], 1], ["SP", 2, 5, 1024, [8, 4, 8, 2], 1], ["SP", 2, 10, 4096, [1, 1], 1], ["RE", 2, [0, 5, 1, 6, 2, 7, 10, 11, 3, 8, 12, 4, 9]], ["FSP", 3, 0, 1, 3], ["FSP", 3, 4, 2, 3], ["RE", 3, [0, 4, 1, 5, 2, 6, 3, 7]], ["CA", 2, 3, 5], ["CHR", 1, "shared", [2]], ["CA", 2, 3, 6], ["CHR", 0, "shared", [3]], ["CA", 1, 4, 6], ["FU", 5, [0, 1]], ["AN", 5, 0, 5], ["FU", 5, [1, 2]], ["AN", 5, 1, 4], ["FU", 5, [2, 3]], ["AN", 5, 2, 6], ["FU", 3, [0, 1]], ["SP", 3, 0, 16, [1], 1], ["AN", 3, 1, 2], ["FFSP", 3, 0, [2, 1], 1, 1], ["AN", 3, 1, 6], ["FU", 1, [0, 1]], ["SP", 1, 0, 1, [1], 1], ["AN", 1, 1, 2], ["FFSP", 1, 0, [2, 1], 1, 1], ["AN", 1, 1, 6], ["PR", 4, 0, "auto_unroll_max_step$16"]]]], "r": [[0.00662195, 0.00660044, 0.00660706], 0, 3.379, 1759460905], "v": "v0.6"}
{"i": [["[\"ansor_mm\", 642, 1024, 4096, \"float16\"]", "rocm -keys=rocm,gpu -max_num_threads=256 -max_shared_memory_per_block=49152 -max_threads_per_block=1024 -mcpu=gfx942 -model=unknown -mtriple=amdgcn-amd-amdhsa-hcc -thread_warp_size=64", [-1, 16, 64, 65536, 2147483647, 1024, 16, 64], "llvm -keys=cpu -mtriple=x86_64-unknown-linux-gnu", 0, []], [[], [["CHW", 2, "local"], ["SP", 2, 0, 642, [1, 1, 6, 1], 1], ["SP", 2, 5, 1024, [1, 512, 1, 1], 1], ["SP", 2, 10, 4096, [2, 2], 1], ["RE", 2, [0, 5, 1, 6, 2, 7, 10, 11, 3, 8, 12, 4, 9]], ["FSP", 3, 0, 1, 3], ["FSP", 3, 4, 2, 3], ["RE", 3, [0, 4, 1, 5, 2, 6, 3, 7]], ["CA", 2, 3, 5], ["CHR", 1, "shared", [2]], ["CA", 2, 3, 6], ["CHR", 0, "shared", [3]], ["CA", 1, 4, 6], ["FU", 5, [0, 1]], ["AN", 5, 0, 5], ["FU", 5, [1, 2]], ["AN", 5, 1, 4], ["FU", 5, [2, 3]], ["AN", 5, 2, 6], ["FU", 3, [0, 1]], ["SP", 3, 0, 4, [4], 1], ["AN", 3, 1, 2], ["FFSP", 3, 0, [2, 1], 1, 1], ["AN", 3, 1, 6], ["FU", 1, [0, 1]], ["SP", 1, 0, 24, [1], 1], ["AN", 1, 1, 2], ["FFSP", 1, 0, [2, 1], 1, 1], ["AN", 1, 1, 6], ["PR", 4, 0, "auto_unroll_max_step$1024"]]]], "r": [[0.00213299, 0.00213316, 0.00213381], 0, 2.88791, 1759460905], "v": "v0.6"}
{"i": [["[\"ansor_mm\", 642, 1024, 4096, \"float16\"]", "rocm -keys=rocm,gpu -max_num_threads=256 -max_shared_memory_per_block=49152 -max_threads_per_block=1024 -mcpu=gfx942 -model=unknown -mtriple=amdgcn-amd-amdhsa-hcc -thread_warp_size=64", [-1, 16, 64, 65536, 2147483647, 1024, 16, 64], "llvm -keys=cpu -mtriple=x86_64-unknown-linux-gnu", 0, []], [[], [["CHW", 2, "local"], ["SP", 2, 0, 642, [1, 107, 3, 1], 1], ["SP", 2, 5, 1024, [4, 8, 8, 1], 1], ["SP", 2, 10, 4096, [4, 1], 1], ["RE", 2, [0, 5, 1, 6, 2, 7, 10, 11, 3, 8, 12, 4, 9]], ["FSP", 3, 0, 1, 3], ["FSP", 3, 4, 2, 3], ["RE", 3, [0, 4, 1, 5, 2, 6, 3, 7]], ["CA", 2, 3, 5], ["CHR", 1, "shared", [2]], ["CA", 2, 3, 6], ["CHR", 0, "shared", [3]], ["CA", 1, 4, 6], ["FU", 5, [0, 1]], ["AN", 5, 0, 5], ["FU", 5, [1, 2]], ["AN", 5, 1, 4], ["FU", 5, [2, 3]], ["AN", 5, 2, 6], ["FU", 3, [0, 1]], ["SP", 3, 0, 32, [1], 1], ["AN", 3, 1, 2], ["FFSP", 3, 0, [2, 1], 1, 1], ["AN", 3, 1, 6], ["FU", 1, [0, 1]], ["SP", 1, 0, 24, [6], 1], ["AN", 1, 1, 2], ["FFSP", 1, 0, [2, 1], 1, 1], ["AN", 1, 1, 6], ["PR", 4, 0, "auto_unroll_max_step$512"]]]], "r": [[0.00359022, 0.00358693, 0.00358573], 0, 3.38496, 1759460906], "v": "v0.6"}
{"i": [["[\"ansor_mm\", 642, 1024, 4096, \"float16\"]", "rocm -keys=rocm,gpu -max_num_threads=256 -max_shared_memory_per_block=49152 -max_threads_per_block=1024 -mcpu=gfx942 -model=unknown -mtriple=amdgcn-amd-amdhsa-hcc -thread_warp_size=64", [-1, 16, 64, 65536, 2147483647, 1024, 16, 64], "llvm -keys=cpu -mtriple=x86_64-unknown-linux-gnu", 0, []], [[], [["CHW", 2, "local"], ["SP", 2, 0, 642, [1, 2, 3, 1], 1], ["SP", 2, 5, 1024, [2, 32, 1, 1], 1], ["SP", 2, 10, 4096, [8, 2], 1], ["RE", 2, [0, 5, 1, 6, 2, 7, 10, 11, 3, 8, 12, 4, 9]], ["FSP", 3, 0, 1, 3], ["FSP", 3, 4, 2, 3], ["RE", 3, [0, 4, 1, 5, 2, 6, 3, 7]], ["CA", 2, 3, 5], ["CHR", 1, "shared", [2]], ["CA", 2, 3, 6], ["CHR", 0, "shared", [3]], ["CA", 1, 4, 6], ["FU", 5, [0, 1]], ["AN", 5, 0, 5], ["FU", 5, [1, 2]], ["AN", 5, 1, 4], ["FU", 5, [2, 3]], ["AN", 5, 2, 6], ["FU", 3, [0, 1]], ["SP", 3, 0, 16, [1], 1], ["AN", 3, 1, 2], ["FFSP", 3, 0, [2, 1], 1, 1], ["AN", 3, 1, 6], ["FU", 1, [0, 1]], ["SP", 1, 0, 48, [1], 1], ["AN", 1, 1, 2], ["FFSP", 1, 0, [2, 1], 1, 1], ["AN", 1, 1, 6], ["PR", 4, 0, "auto_unroll_max_step$1024"]]]], "r": [[0.000409644, 0.000409796, 0.000409833], 0, 3.4231, 1759460907], "v": "v0.6"}
{"i": [["[\"ansor_mm\", 642, 1024, 4096, \"float16\"]", "rocm -keys=rocm,gpu -max_num_threads=256 -max_shared_memory_per_block=49152 -max_threads_per_block=1024 -mcpu=gfx942 -model=unknown -mtriple=amdgcn-amd-amdhsa-hcc -thread_warp_size=64", [-1, 16, 64, 65536, 2147483647, 1024, 16, 64], "llvm -keys=cpu -mtriple=x86_64-unknown-linux-gnu", 0, []], [[], [["CHW", 2, "local"], ["SP", 2, 0, 642, [3, 1, 2, 1], 1], ["SP", 2, 5, 1024, [1, 2, 8, 32], 1], ["SP", 2, 10, 4096, [4, 2], 1], ["RE", 2, [0, 5, 1, 6, 2, 7, 10, 11, 3, 8, 12, 4, 9]], ["FSP", 3, 0, 1, 3], ["FSP", 3, 4, 2, 3], ["RE", 3, [0, 4, 1, 5, 2, 6, 3, 7]], ["CA", 2, 3, 5], ["CHR", 1, "shared", [2]], ["CA", 2, 3, 6], ["CHR", 0, "shared", [3]], ["CA", 1, 4, 6], ["FU", 5, [0, 1]], ["AN", 5, 0, 5], ["FU", 5, [1, 2]], ["AN", 5, 1, 4], ["FU", 5, [2, 3]], ["AN", 5, 2, 6], ["FU", 3, [0, 1]], ["SP", 3, 0, 2048, [1], 1], ["AN", 3, 1, 2], ["FFSP", 3, 0, [2, 1], 1, 1], ["AN", 3, 1, 6], ["FU", 1, [0, 1]], ["SP", 1, 0, 16, [1], 1], ["AN", 1, 1, 2], ["FFSP", 1, 0, [2, 1], 1, 1], ["AN", 1, 1, 6], ["PR", 4, 0, "auto_unroll_max_step$0"]]]], "r": [[1.00917, 1.01049, 1.0111], 0, 34.9407, 1759460938], "v": "v0.6"}
{"i": [["[\"ansor_mm\", 642, 1024, 4096, \"float16\"]", "rocm -keys=rocm,gpu -max_num_threads=256 -max_shared_memory_per_block=49152 -max_threads_per_block=1024 -mcpu=gfx942 -model=unknown -mtriple=amdgcn-amd-amdhsa-hcc -thread_warp_size=64", [-1, 16, 64, 65536, 2147483647, 1024, 16, 64], "llvm -keys=cpu -mtriple=x86_64-unknown-linux-gnu", 0, []], [[], [["CHW", 2, "local"], ["SP", 2, 0, 642, [1, 107, 2, 3], 1], ["SP", 2, 5, 1024, [1, 1, 128, 1], 1], ["SP", 2, 10, 4096, [4, 2], 1], ["RE", 2, [0, 5, 1, 6, 2, 7, 10, 11, 3, 8, 12, 4, 9]], ["FSP", 3, 0, 1, 3], ["FSP", 3, 4, 2, 3], ["RE", 3, [0, 4, 1, 5, 2, 6, 3, 7]], ["CA", 2, 3, 5], ["CHR", 1, "shared", [2]], ["CA", 2, 3, 6], ["CHR", 0, "shared", [3]], ["CA", 1, 4, 6], ["FU", 5, [0, 1]], ["AN", 5, 0, 5], ["FU", 5, [1, 2]], ["AN", 5, 1, 4], ["FU", 5, [2, 3]], ["AN", 5, 2, 6], ["FU", 3, [0, 1]], ["SP", 3, 0, 1024, [1], 1], ["AN", 3, 1, 2], ["FFSP", 3, 0, [2, 1], 1, 1], ["AN", 3, 1, 6], ["FU", 1, [0, 1]], ["SP", 1, 0, 48, [1], 1], ["AN", 1, 1, 2], ["FFSP", 1, 0, [2, 1], 1, 1], ["AN", 1, 1, 6], ["PR", 4, 0, "auto_unroll_max_step$512"]]]], "r": [[0.0561685, 0.056107, 0.0563646], 0, 6.05747, 1759460940], "v": "v0.6"}
{"i": [["[\"ansor_mm\", 642, 1024, 4096, \"float16\"]", "rocm -keys=rocm,gpu -max_num_threads=256 -max_shared_memory_per_block=49152 -max_threads_per_block=1024 -mcpu=gfx942 -model=unknown -mtriple=amdgcn-amd-amdhsa-hcc -thread_warp_size=64", [-1, 16, 64, 65536, 2147483647, 1024, 16, 64], "llvm -keys=cpu -mtriple=x86_64-unknown-linux-gnu", 0, []], [[], [["CHW", 2, "local"], ["SP", 2, 0, 642, [1, 1, 6, 1], 1], ["SP", 2, 5, 1024, [1, 512, 1, 1], 1], ["SP", 2, 10, 4096, [2, 1], 1], ["RE", 2, [0, 5, 1, 6, 2, 7, 10, 11, 3, 8, 12, 4, 9]], ["FSP", 3, 0, 1, 3], ["FSP", 3, 4, 2, 3], ["RE", 3, [0, 4, 1, 5, 2, 6, 3, 7]], ["CA", 2, 3, 5], ["CHR", 1, "shared", [2]], ["CA", 2, 3, 6], ["CHR", 0, "shared", [3]], ["CA", 1, 4, 6], ["FU", 5, [0, 1]], ["AN", 5, 0, 5], ["FU", 5, [1, 2]], ["AN", 5, 1, 4], ["FU", 5, [2, 3]], ["AN", 5, 2, 6], ["FU", 3, [0, 1]], ["SP", 3, 0, 4, [1], 1], ["AN", 3, 1, 2], ["FFSP", 3, 0, [2, 1], 1, 1], ["AN", 3, 1, 6], ["FU", 1, [0, 1]], ["SP", 1, 0, 24, [1], 1], ["AN", 1, 1, 2], ["FFSP", 1, 0, [2, 1], 1, 1], ["AN", 1, 1, 6], ["PR", 4, 0, "auto_unroll_max_step$1024"]]]], "r": [[0.00237491, 0.00237484, 0.00237483], 0, 3.39753, 1759460941], "v": "v0.6"}
{"i": [["[\"ansor_mm\", 642, 1024, 4096, \"float16\"]", "rocm -keys=rocm,gpu -max_num_threads=256 -max_shared_memory_per_block=49152 -max_threads_per_block=1024 -mcpu=gfx942 -model=unknown -mtriple=amdgcn-amd-amdhsa-hcc -thread_warp_size=64", [-1, 16, 64, 65536, 2147483647, 1024, 16, 64], "llvm -keys=cpu -mtriple=x86_64-unknown-linux-gnu", 0, []], [[], [["CHW", 2, "local"], ["SP", 2, 0, 642, [3, 107, 2, 1], 1], ["SP", 2, 5, 1024, [1, 2, 8, 32], 1], ["SP", 2, 10, 4096, [2, 4], 1], ["RE", 2, [0, 5, 1, 6, 2, 7, 10, 11, 3, 8, 12, 4, 9]], ["FSP", 3, 0, 1, 3], ["FSP", 3, 4, 2, 3], ["RE", 3, [0, 4, 1, 5, 2, 6, 3, 7]], ["CA", 2, 3, 5], ["CHR", 1, "shared", [2]], ["CA", 2, 3, 6], ["CHR", 0, "shared", [3]], ["CA", 1, 4, 6], ["FU", 5, [0, 1]], ["AN", 5, 0, 5], ["FU", 5, [1, 2]], ["AN", 5, 1, 4], ["FU", 5, [2, 3]], ["AN", 5, 2, 6], ["FU", 3, [0, 1]], ["SP", 3, 0, 2048, [1], 1], ["AN", 3, 1, 2], ["FFSP", 3, 0, [2, 1], 1, 1], ["AN", 3, 1, 6], ["FU", 1, [0, 1]], ["SP", 1, 0, 16, [2], 1], ["AN", 1, 1, 2], ["FFSP", 1, 0, [2, 1], 1, 1], ["AN", 1, 1, 6], ["PR", 4, 0, "auto_unroll_max_step$0"]]]], "r": [[0.188399, 0.189877, 0.18822], 0, 9.37692, 1759460947], "v": "v0.6"}
{"i": [["[\"ansor_mm\", 642, 1024, 4096, \"float16\"]", "rocm -keys=rocm,gpu -max_num_threads=256 -max_shared_memory_per_block=49152 -max_threads_per_block=1024 -mcpu=gfx942 -model=unknown -mtriple=amdgcn-amd-amdhsa-hcc -thread_warp_size=64", [-1, 16, 64, 65536, 2147483647, 1024, 16, 64], "llvm -keys=cpu -mtriple=x86_64-unknown-linux-gnu", 0, []], [[], [["CHW", 2, "local"], ["SP", 2, 0, 642, [2, 321, 1, 1], 1], ["SP", 2, 5, 1024, [2, 1, 1, 2], 1], ["SP", 2, 10, 4096, [2, 8], 1], ["RE", 2, [0, 5, 1, 6, 2, 7, 10, 11, 3, 8, 12, 4, 9]], ["FSP", 3, 0, 1, 3], ["FSP", 3, 4, 2, 3], ["RE", 3, [0, 4, 1, 5, 2, 6, 3, 7]], ["CA", 2, 3, 5], ["CHR", 1, "shared", [2]], ["CA", 2, 3, 6], ["CHR", 0, "shared", [3]], ["CA", 1, 4, 6], ["FU", 5, [0, 1]], ["AN", 5, 0, 5], ["FU", 5, [1, 2]], ["AN", 5, 1, 4], ["FU", 5, [2, 3]], ["AN", 5, 2, 6], ["FU", 3, [0, 1]], ["SP", 3, 0, 32, [1], 1], ["AN", 3, 1, 2], ["FFSP", 3, 0, [2, 1], 1, 1], ["AN", 3, 1, 6], ["FU", 1, [0, 1]], ["SP", 1, 0, 16, [1], 1], ["AN", 1, 1, 2], ["FFSP", 1, 0, [2, 1], 1, 1], ["AN", 1, 1, 6], ["PR", 4, 0, "auto_unroll_max_step$64"]]]], "r": [[0.000746263, 0.000746486, 0.000746373], 0, 3.36882, 1759460948], "v": "v0.6"}
{"i": [["[\"ansor_mm\", 642, 1024, 4096, \"float16\"]", "rocm -keys=rocm,gpu -max_num_threads=256 -max_shared_memory_per_block=49152 -max_threads_per_block=1024 -mcpu=gfx942 -model=unknown -mtriple=amdgcn-amd-amdhsa-hcc -thread_warp_size=64", [-1, 16, 64, 65536, 2147483647, 1024, 16, 64], "llvm -keys=cpu -mtriple=x86_64-unknown-linux-gnu", 0, []], [[], [["CHW", 2, "local"], ["SP", 2, 0, 642, [2, 1, 321, 1], 1], ["SP", 2, 5, 1024, [8, 64, 2, 1], 1], ["SP", 2, 10, 4096, [1, 2], 1], ["RE", 2, [0, 5, 1, 6, 2, 7, 10, 11, 3, 8, 12, 4, 9]], ["FSP", 3, 0, 1, 3], ["FSP", 3, 4, 2, 3], ["RE", 3, [0, 4, 1, 5, 2, 6, 3, 7]], ["CA", 2, 3, 5], ["CHR", 1, "shared", [2]], ["CA", 2, 3, 6], ["CHR", 0, "shared", [3]], ["CA", 1, 4, 6], ["FU", 5, [0, 1]], ["AN", 5, 0, 5], ["FU", 5, [1, 2]], ["AN", 5, 1, 4], ["FU", 5, [2, 3]], ["AN", 5, 2, 6], ["FU", 3, [0, 1]], ["SP", 3, 0, 4, [2], 1], ["AN", 3, 1, 2], ["FFSP", 3, 0, [2, 1], 1, 1], ["AN", 3, 1, 6], ["FU", 1, [0, 1]], ["SP", 1, 0, 2, [1], 1], ["AN", 1, 1, 2], ["FFSP", 1, 0, [2, 1], 1, 1], ["AN", 1, 1, 6], ["PR", 4, 0, "auto_unroll_max_step$64"]]]], "r": [[0.482081, 0.48071, 0.481168], 0, 18.248, 1759460963], "v": "v0.6"}
{"i": [["[\"ansor_mm\", 642, 1024, 4096, \"float16\"]", "rocm -keys=rocm,gpu -max_num_threads=256 -max_shared_memory_per_block=49152 -max_threads_per_block=1024 -mcpu=gfx942 -model=unknown -mtriple=amdgcn-amd-amdhsa-hcc -thread_warp_size=64", [-1, 16, 64, 65536, 2147483647, 1024, 16, 64], "llvm -keys=cpu -mtriple=x86_64-unknown-linux-gnu", 0, []], [[], [["CHW", 2, "local"], ["SP", 2, 0, 642, [1, 107, 2, 3], 1], ["SP", 2, 5, 1024, [1, 8, 128, 1], 1], ["SP", 2, 10, 4096, [8, 1], 1], ["RE", 2, [0, 5, 1, 6, 2, 7, 10, 11, 3, 8, 12, 4, 9]], ["FSP", 3, 0, 1, 3], ["FSP", 3, 4, 2, 3], ["RE", 3, [0, 4, 1, 5, 2, 6, 3, 7]], ["CA", 2, 3, 5], ["CHR", 1, "shared", [2]], ["CA", 2, 3, 6], ["CHR", 0, "shared", [3]], ["CA", 1, 4, 6], ["FU", 5, [0, 1]], ["AN", 5, 0, 5], ["FU", 5, [1, 2]], ["AN", 5, 1, 4], ["FU", 5, [2, 3]], ["AN", 5, 2, 6], ["FU", 3, [0, 1]], ["SP", 3, 0, 1024, [1], 1], ["AN", 3, 1, 2], ["FFSP", 3, 0, [2, 1], 1, 1], ["AN", 3, 1, 6], ["FU", 1, [0, 1]], ["SP", 1, 0, 48, [1], 1], ["AN", 1, 1, 2], ["FFSP", 1, 0, [2, 1], 1, 1], ["AN", 1, 1, 6], ["PR", 4, 0, "auto_unroll_max_step$16"]]]], "r": [[0.309659, 0.303339, 0.307029], 0, 13.9041, 1759460973], "v": "v0.6"}
{"i": [["[\"ansor_mm\", 642, 1024, 4096, \"float16\"]", "rocm -keys=rocm,gpu -max_num_threads=256 -max_shared_memory_per_block=49152 -max_threads_per_block=1024 -mcpu=gfx942 -model=unknown -mtriple=amdgcn-amd-amdhsa-hcc -thread_warp_size=64", [-1, 16, 64, 65536, 2147483647, 1024, 16, 64], "llvm -keys=cpu -mtriple=x86_64-unknown-linux-gnu", 0, []], [[], [["CHW", 2, "local"], ["SP", 2, 0, 642, [1, 107, 3, 2], 1], ["SP", 2, 5, 1024, [1, 8, 8, 4], 1], ["SP", 2, 10, 4096, [4, 1], 1], ["RE", 2, [0, 5, 1, 6, 2, 7, 10, 11, 3, 8, 12, 4, 9]], ["FSP", 3, 0, 1, 3], ["FSP", 3, 4, 2, 3], ["RE", 3, [0, 4, 1, 5, 2, 6, 3, 7]], ["CA", 2, 3, 5], ["CHR", 1, "shared", [2]], ["CA", 2, 3, 6], ["CHR", 0, "shared", [3]], ["CA", 1, 4, 6], ["FU", 5, [0, 1]], ["AN", 5, 0, 5], ["FU", 5, [1, 2]], ["AN", 5, 1, 4], ["FU", 5, [2, 3]], ["AN", 5, 2, 6], ["FU", 3, [0, 1]], ["SP", 3, 0, 32, [1], 1], ["AN", 3, 1, 2], ["FFSP", 3, 0, [2, 1], 1, 1], ["AN", 3, 1, 6], ["FU", 1, [0, 1]], ["SP", 1, 0, 24, [6], 1], ["AN", 1, 1, 2], ["FFSP", 1, 0, [2, 1], 1, 1], ["AN", 1, 1, 6], ["PR", 4, 0, "auto_unroll_max_step$0"]]]], "r": [[0.0152427, 0.0151483, 0.0151934], 0, 3.63725, 1759460974], "v": "v0.6"}
{"i": [["[\"ansor_mm\", 642, 1024, 4096, \"float16\"]", "rocm -keys=rocm,gpu -max_num_threads=256 -max_shared_memory_per_block=49152 -max_threads_per_block=1024 -mcpu=gfx942 -model=unknown -mtriple=amdgcn-amd-amdhsa-hcc -thread_warp_size=64", [-1, 16, 64, 65536, 2147483647, 1024, 16, 64], "llvm -keys=cpu -mtriple=x86_64-unknown-linux-gnu", 0, []], [[], [["CHW", 2, "local"], ["SP", 2, 0, 642, [1, 107, 2, 3], 1], ["SP", 2, 5, 1024, [8, 1, 8, 4], 1], ["SP", 2, 10, 4096, [2, 16], 1], ["RE", 2, [0, 5, 1, 6, 2, 7, 10, 11, 3, 8, 12, 4, 9]], ["FSP", 3, 0, 1, 3], ["FSP", 3, 4, 2, 3], ["RE", 3, [0, 4, 1, 5, 2, 6, 3, 7]], ["CA", 2, 3, 5], ["CHR", 1, "shared", [2]], ["CA", 2, 3, 6], ["CHR", 0, "shared", [3]], ["CA", 1, 4, 6], ["FU", 5, [0, 1]], ["AN", 5, 0, 5], ["FU", 5, [1, 2]], ["AN", 5, 1, 4], ["FU", 5, [2, 3]], ["AN", 5, 2, 6], ["FU", 3, [0, 1]], ["SP", 3, 0, 256, [1], 1], ["AN", 3, 1, 2], ["FFSP", 3, 0, [2, 1], 1, 1], ["AN", 3, 1, 6], ["FU", 1, [0, 1]], ["SP", 1, 0, 192, [1], 1], ["AN", 1, 1, 2], ["FFSP", 1, 0, [2, 1], 1, 1], ["AN", 1, 1, 6], ["PR", 4, 0, "auto_unroll_max_step$0"]]]], "r": [[0.258908, 0.258405, 0.257295], 0, 13.042, 1759460982], "v": "v0.6"}
{"i": [["[\"ansor_mm\", 642, 1024, 4096, \"float16\"]", "rocm -keys=rocm,gpu -max_num_threads=256 -max_shared_memory_per_block=49152 -max_threads_per_block=1024 -mcpu=gfx942 -model=unknown -mtriple=amdgcn-amd-amdhsa-hcc -thread_warp_size=64", [-1, 16, 64, 65536, 2147483647, 1024, 16, 64], "llvm -keys=cpu -mtriple=x86_64-unknown-linux-gnu", 0, []], [[], [["CHW", 2, "local"], ["SP", 2, 0, 642, [1, 107, 6, 1], 1], ["SP", 2, 5, 1024, [4, 1, 2, 1], 1], ["SP", 2, 10, 4096, [8, 2], 1], ["RE", 2, [0, 5, 1, 6, 2, 7, 10, 11, 3, 8, 12, 4, 9]], ["FSP", 3, 0, 1, 3], ["FSP", 3, 4, 2, 3], ["RE", 3, [0, 4, 1, 5, 2, 6, 3, 7]], ["CA", 2, 3, 5], ["CHR", 1, "shared", [2]], ["CA", 2, 3, 6], ["CHR", 0, "shared", [3]], ["CA", 1, 4, 6], ["FU", 5, [0, 1]], ["AN", 5, 0, 5], ["FU", 5, [1, 2]], ["AN", 5, 1, 4], ["FU", 5, [2, 3]], ["AN", 5, 2, 6], ["FU", 3, [0, 1]], ["SP", 3, 0, 16, [1], 1], ["AN", 3, 1, 2], ["FFSP", 3, 0, [2, 1], 1, 1], ["AN", 3, 1, 6], ["FU", 1, [0, 1]], ["SP", 1, 0, 96, [1], 1], ["AN", 1, 1, 2], ["FFSP", 1, 0, [2, 1], 1, 1], ["AN", 1, 1, 6], ["PR", 4, 0, "auto_unroll_max_step$16"]]]], "r": [[0.00169193, 0.00169241, 0.00169227], 0, 3.62004, 1759460983], "v": "v0.6"}
{"i": [["[\"ansor_mm\", 642, 1024, 4096, \"float16\"]", "rocm -keys=rocm,gpu -max_num_threads=256 -max_shared_memory_per_block=49152 -max_threads_per_block=1024 -mcpu=gfx942 -model=unknown -mtriple=amdgcn-amd-amdhsa-hcc -thread_warp_size=64", [-1, 16, 64, 65536, 2147483647, 1024, 16, 64], "llvm -keys=cpu -mtriple=x86_64-unknown-linux-gnu", 0, []], [[], [["CHW", 2, "local"], ["SP", 2, 0, 642, [1, 107, 1, 3], 1], ["SP", 2, 5, 1024, [1, 1, 1, 4], 1], ["SP", 2, 10, 4096, [16, 1], 1], ["RE", 2, [0, 5, 1, 6, 2, 7, 10, 11, 3, 8, 12, 4, 9]], ["FSP", 3, 0, 1, 3], ["FSP", 3, 4, 2, 3], ["RE", 3, [0, 4, 1, 5, 2, 6, 3, 7]], ["CA", 2, 3, 5], ["CHR", 1, "shared", [2]], ["CA", 2, 3, 6], ["CHR", 0, "shared", [3]], ["CA", 1, 4, 6], ["FU", 5, [0, 1]], ["AN", 5, 0, 5], ["FU", 5, [1, 2]], ["AN", 5, 1, 4], ["FU", 5, [2, 3]], ["AN", 5, 2, 6], ["FU", 3, [0, 1]], ["SP", 3, 0, 64, [2], 1], ["AN", 3, 1, 2], ["FFSP", 3, 0, [2, 1], 1, 1], ["AN", 3, 1, 6], ["FU", 1, [0, 1]], ["SP", 1, 0, 48, [1], 1], ["AN", 1, 1, 2], ["FFSP", 1, 0, [2, 1], 1, 1], ["AN", 1, 1, 6], ["PR", 4, 0, "auto_unroll_max_step$1024"]]]], "r": [[0.000672492, 0.00067265, 0.000672461], 0, 3.68246, 1759460984], "v": "v0.6"}
{"i": [["[\"ansor_mm\", 642, 1024, 4096, \"float16\"]", "rocm -keys=rocm,gpu -max_num_threads=256 -max_shared_memory_per_block=49152 -max_threads_per_block=1024 -mcpu=gfx942 -model=unknown -mtriple=amdgcn-amd-amdhsa-hcc -thread_warp_size=64", [-1, 16, 64, 65536, 2147483647, 1024, 16, 64], "llvm -keys=cpu -mtriple=x86_64-unknown-linux-gnu", 0, []], [[], [["CHW", 2, "local"], ["SP", 2, 0, 642, [1, 6, 1, 1], 1], ["SP", 2, 5, 1024, [2, 16, 2, 4], 1], ["SP", 2, 10, 4096, [8, 1], 1], ["RE", 2, [0, 5, 1, 6, 2, 7, 10, 11, 3, 8, 12, 4, 9]], ["FSP", 3, 0, 1, 3], ["FSP", 3, 4, 2, 3], ["RE", 3, [0, 4, 1, 5, 2, 6, 3, 7]], ["CA", 2, 3, 5], ["CHR", 1, "shared", [2]], ["CA", 2, 3, 6], ["CHR", 0, "shared", [3]], ["CA", 1, 4, 6], ["FU", 5, [0, 1]], ["AN", 5, 0, 5], ["FU", 5, [1, 2]], ["AN", 5, 1, 4], ["FU", 5, [2, 3]], ["AN", 5, 2, 6], ["FU", 3, [0, 1]], ["SP", 3, 0, 64, [1], 1], ["AN", 3, 1, 2], ["FFSP", 3, 0, [2, 1], 1, 1], ["AN", 3, 1, 6], ["FU", 1, [0, 1]], ["SP", 1, 0, 8, [4], 1], ["AN", 1, 1, 2], ["FFSP", 1, 0, [2, 1], 1, 1], ["AN", 1, 1, 6], ["PR", 4, 0, "auto_unroll_max_step$16"]]]], "r": [[0.00283221, 0.00283278, 0.00283249], 0, 3.36207, 1759460984], "v": "v0.6"}
{"i": [["[\"ansor_mm\", 642, 1024, 4096, \"float16\"]", "rocm -keys=rocm,gpu -max_num_threads=256 -max_shared_memory_per_block=49152 -max_threads_per_block=1024 -mcpu=gfx942 -model=unknown -mtriple=amdgcn-amd-amdhsa-hcc -thread_warp_size=64", [-1, 16, 64, 65536, 2147483647, 1024, 16, 64], "llvm -keys=cpu -mtriple=x86_64-unknown-linux-gnu", 0, []], [[], [["CHW", 2, "local"], ["SP", 2, 0, 642, [1, 1, 2, 1], 1], ["SP", 2, 5, 1024, [1, 128, 2, 1], 1], ["SP", 2, 10, 4096, [4, 1], 1], ["RE", 2, [0, 5, 1, 6, 2, 7, 10, 11, 3, 8, 12, 4, 9]], ["FSP", 3, 0, 1, 3], ["FSP", 3, 4, 2, 3], ["RE", 3, [0, 4, 1, 5, 2, 6, 3, 7]], ["CA", 2, 3, 5], ["CHR", 1, "shared", [2]], ["CA", 2, 3, 6], ["CHR", 0, "shared", [3]], ["CA", 1, 4, 6], ["FU", 5, [0, 1]], ["AN", 5, 0, 5], ["FU", 5, [1, 2]], ["AN", 5, 1, 4], ["FU", 5, [2, 3]], ["AN", 5, 2, 6], ["FU", 3, [0, 1]], ["SP", 3, 0, 8, [1], 1], ["AN", 3, 1, 2], ["FFSP", 3, 0, [2, 1], 1, 1], ["AN", 3, 1, 6], ["FU", 1, [0, 1]], ["SP", 1, 0, 8, [1], 1], ["AN", 1, 1, 2], ["FFSP", 1, 0, [2, 1], 1, 1], ["AN", 1, 1, 6], ["PR", 4, 0, "auto_unroll_max_step$64"]]]], "r": [[0.0012948, 0.00129431, 0.00129463], 0, 3.30658, 1759460985], "v": "v0.6"}
{"i": [["[\"ansor_mm\", 642, 1024, 4096, \"float16\"]", "rocm -keys=rocm,gpu -max_num_threads=256 -max_shared_memory_per_block=49152 -max_threads_per_block=1024 -mcpu=gfx942 -model=unknown -mtriple=amdgcn-amd-amdhsa-hcc -thread_warp_size=64", [-1, 16, 64, 65536, 2147483647, 1024, 16, 64], "llvm -keys=cpu -mtriple=x86_64-unknown-linux-gnu", 0, []], [[], [["CHW", 2, "local"], ["SP", 2, 0, 642, [1, 107, 1, 3], 1], ["SP", 2, 5, 1024, [1, 8, 128, 1], 1], ["SP", 2, 10, 4096, [8, 1], 1], ["RE", 2, [0, 5, 1, 6, 2, 7, 10, 11, 3, 8, 12, 4, 9]], ["FSP", 3, 0, 1, 3], ["FSP", 3, 4, 2, 3], ["RE", 3, [0, 4, 1, 5, 2, 6, 3, 7]], ["CA", 2, 3, 5], ["CHR", 1, "shared", [2]], ["CA", 2, 3, 6], ["CHR", 0, "shared", [3]], ["CA", 1, 4, 6], ["FU", 5, [0, 1]], ["AN", 5, 0, 5], ["FU", 5, [1, 2]], ["AN", 5, 1, 4], ["FU", 5, [2, 3]], ["AN", 5, 2, 6], ["FU", 3, [0, 1]], ["SP", 3, 0, 1024, [1], 1], ["AN", 3, 1, 2], ["FFSP", 3, 0, [2, 1], 1, 1], ["AN", 3, 1, 6], ["FU", 1, [0, 1]], ["SP", 1, 0, 48, [1], 1], ["AN", 1, 1, 2], ["FFSP", 1, 0, [2, 1], 1, 1], ["AN", 1, 1, 6], ["PR", 4, 0, "auto_unroll_max_step$16"]]]], "r": [[0.0801443, 0.0802191, 0.0803011], 0, 5.70786, 1759460988], "v": "v0.6"}
{"i": [["[\"ansor_mm\", 642, 1024, 4096, \"float16\"]", "rocm -keys=rocm,gpu -max_num_threads=256 -max_shared_memory_per_block=49152 -max_threads_per_block=1024 -mcpu=gfx942 -model=unknown -mtriple=amdgcn-amd-amdhsa-hcc -thread_warp_size=64", [-1, 16, 64, 65536, 2147483647, 1024, 16, 64], "llvm -keys=cpu -mtriple=x86_64-unknown-linux-gnu", 0, []], [[], [["CHW", 2, "local"], ["SP", 2, 0, 642, [3, 107, 2, 1], 1], ["SP", 2, 5, 1024, [1, 4, 4, 8], 1], ["SP", 2, 10, 4096, [16, 1], 1], ["RE", 2, [0, 5, 1, 6, 2, 7, 10, 11, 3, 8, 12, 4, 9]], ["FSP", 3, 0, 1, 3], ["FSP", 3, 4, 2, 3], ["RE", 3, [0, 4, 1, 5, 2, 6, 3, 7]], ["CA", 2, 3, 5], ["CHR", 1, "shared", [2]], ["CA", 2, 3, 6], ["CHR", 0, "shared", [3]], ["CA", 1, 4, 6], ["FU", 5, [0, 1]], ["AN", 5, 0, 5], ["FU", 5, [1, 2]], ["AN", 5, 1, 4], ["FU", 5, [2, 3]], ["AN", 5, 2, 6], ["FU", 3, [0, 1]], ["SP", 3, 0, 512, [1], 1], ["AN", 3, 1, 2], ["FFSP", 3, 0, [2, 1], 1, 1], ["AN", 3, 1, 6], ["FU", 1, [0, 1]], ["SP", 1, 0, 32, [1], 1], ["AN", 1, 1, 2], ["FFSP", 1, 0, [2, 1], 1, 1], ["AN", 1, 1, 6], ["PR", 4, 0, "auto_unroll_max_step$512"]]]], "r": [[0.00372462, 0.00372797, 0.00372546], 0, 3.15029, 1759460988], "v": "v0.6"}
{"i": [["[\"ansor_mm\", 642, 1024, 4096, \"float16\"]", "rocm -keys=rocm,gpu -max_num_threads=256 -max_shared_memory_per_block=49152 -max_threads_per_block=1024 -mcpu=gfx942 -model=unknown -mtriple=amdgcn-amd-amdhsa-hcc -thread_warp_size=64", [-1, 16, 64, 65536, 2147483647, 1024, 16, 64], "llvm -keys=cpu -mtriple=x86_64-unknown-linux-gnu", 0, []], [[], [["CHW", 2, "local"], ["SP", 2, 0, 642, [1, 107, 3, 1], 1], ["SP", 2, 5, 1024, [16, 4, 4, 2], 1], ["SP", 2, 10, 4096, [32, 1], 1], ["RE", 2, [0, 5, 1, 6, 2, 7, 10, 11, 3, 8, 12, 4, 9]], ["FSP", 3, 0, 1, 3], ["FSP", 3, 4, 2, 3], ["RE", 3, [0, 4, 1, 5, 2, 6, 3, 7]], ["CA", 2, 3, 5], ["CHR", 1, "shared", [2]], ["CA", 2, 3, 6], ["CHR", 0, "shared", [3]], ["CA", 1, 4, 6], ["FU", 5, [0, 1]], ["AN", 5, 0, 5], ["FU", 5, [1, 2]], ["AN", 5, 1, 4], ["FU", 5, [2, 3]], ["AN", 5, 2, 6], ["FU", 3, [0, 1]], ["SP", 3, 0, 256, [1], 1], ["AN", 3, 1, 2], ["FFSP", 3, 0, [2, 1], 1, 1], ["AN", 3, 1, 6], ["FU", 1, [0, 1]], ["SP", 1, 0, 96, [1], 1], ["AN", 1, 1, 2], ["FFSP", 1, 0, [2, 1], 1, 1], ["AN", 1, 1, 6], ["PR", 4, 0, "auto_unroll_max_step$16"]]]], "r": [[0.0415203, 0.0414872, 0.0415605], 0, 4.79104, 1759460990], "v": "v0.6"}
{"i": [["[\"ansor_mm\", 642, 1024, 4096, \"float16\"]", "rocm -keys=rocm,gpu -max_num_threads=256 -max_shared_memory_per_block=49152 -max_threads_per_block=1024 -mcpu=gfx942 -model=unknown -mtriple=amdgcn-amd-amdhsa-hcc -thread_warp_size=64", [-1, 16, 64, 65536, 2147483647, 1024, 16, 64], "llvm -keys=cpu -mtriple=x86_64-unknown-linux-gnu", 0, []], [[], [["CHW", 2, "local"], ["SP", 2, 0, 642, [1, 6, 107, 1], 1], ["SP", 2, 5, 1024, [1, 64, 2, 8], 1], ["SP", 2, 10, 4096, [4, 4], 1], ["RE", 2, [0, 5, 1, 6, 2, 7, 10, 11, 3, 8, 12, 4, 9]], ["FSP", 3, 0, 1, 3], ["FSP", 3, 4, 2, 3], ["RE", 3, [0, 4, 1, 5, 2, 6, 3, 7]], ["CA", 2, 3, 5], ["CHR", 1, "shared", [2]], ["CA", 2, 3, 6], ["CHR", 0, "shared", [3]], ["CA", 1, 4, 6], ["FU", 5, [0, 1]], ["AN", 5, 0, 5], ["FU", 5, [1, 2]], ["AN", 5, 1, 4], ["FU", 5, [2, 3]], ["AN", 5, 2, 6], ["FU", 3, [0, 1]], ["SP", 3, 0, 256, [1], 1], ["AN", 3, 1, 2], ["FFSP", 3, 0, [2, 1], 1, 1], ["AN", 3, 1, 6], ["FU", 1, [0, 1]], ["SP", 1, 0, 10272, [1], 1], ["AN", 1, 1, 2], ["FFSP", 1, 0, [2, 1], 1, 1], ["AN", 1, 1, 6], ["PR", 4, 0, "auto_unroll_max_step$64"]]]], "r": [[0.181282, 0.181403, 0.181708], 0, 8.56992, 1759460996], "v": "v0.6"}
{"i": [["[\"ansor_mm\", 642, 1024, 4096, \"float16\"]", "rocm -keys=rocm,gpu -max_num_threads=256 -max_shared_memory_per_block=49152 -max_threads_per_block=1024 -mcpu=gfx942 -model=unknown -mtriple=amdgcn-amd-amdhsa-hcc -thread_warp_size=64", [-1, 16, 64, 65536, 2147483647, 1024, 16, 64], "llvm -keys=cpu -mtriple=x86_64-unknown-linux-gnu", 0, []], [[], [["CHW", 2, "local"], ["SP", 2, 0, 642, [3, 107, 2, 1], 1], ["SP", 2, 5, 1024, [1, 2, 32, 1], 1], ["SP", 2, 10, 4096, [1, 16], 1], ["RE", 2, [0, 5, 1, 6, 2, 7, 10, 11, 3, 8, 12, 4, 9]], ["FSP", 3, 0, 1, 3], ["FSP", 3, 4, 2, 3], ["RE", 3, [0, 4, 1, 5, 2, 6, 3, 7]], ["CA", 2, 3, 5], ["CHR", 1, "shared", [2]], ["CA", 2, 3, 6], ["CHR", 0, "shared", [3]], ["CA", 1, 4, 6], ["FU", 5, [0, 1]], ["AN", 5, 0, 5], ["FU", 5, [1, 2]], ["AN", 5, 1, 4], ["FU", 5, [2, 3]], ["AN", 5, 2, 6], ["FU", 3, [0, 1]], ["SP", 3, 0, 512, [1], 1], ["AN", 3, 1, 2], ["FFSP", 3, 0, [2, 1], 1, 1], ["AN", 3, 1, 6], ["FU", 1, [0, 1]], ["SP", 1, 0, 32, [2], 1], ["AN", 1, 1, 2], ["FFSP", 1, 0, [2, 1], 1, 1], ["AN", 1, 1, 6], ["PR", 4, 0, "auto_unroll_max_step$0"]]]], "r": [[0.00950718, 0.00953453, 0.00951179], 0, 3.99419, 1759460997], "v": "v0.6"}
{"i": [["[\"ansor_mm\", 642, 1024, 4096, \"float16\"]", "rocm -keys=rocm,gpu -max_num_threads=256 -max_shared_memory_per_block=49152 -max_threads_per_block=1024 -mcpu=gfx942 -model=unknown -mtriple=amdgcn-amd-amdhsa-hcc -thread_warp_size=64", [-1, 16, 64, 65536, 2147483647, 1024, 16, 64], "llvm -keys=cpu -mtriple=x86_64-unknown-linux-gnu", 0, []], [[], [["CHW", 2, "local"], ["SP", 2, 0, 642, [2, 1, 107, 3], 1], ["SP", 2, 5, 1024, [1, 64, 2, 2], 1], ["SP", 2, 10, 4096, [4, 4], 1], ["RE", 2, [0, 5, 1, 6, 2, 7, 10, 11, 3, 8, 12, 4, 9]], ["FSP", 3, 0, 1, 3], ["FSP", 3, 4, 2, 3], ["RE", 3, [0, 4, 1, 5, 2, 6, 3, 7]], ["CA", 2, 3, 5], ["CHR", 1, "shared", [2]], ["CA", 2, 3, 6], ["CHR", 0, "shared", [3]], ["CA", 1, 4, 6], ["FU", 5, [0, 1]], ["AN", 5, 0, 5], ["FU", 5, [1, 2]], ["AN", 5, 1, 4], ["FU", 5, [2, 3]], ["AN", 5, 2, 6], ["FU", 3, [0, 1]], ["SP", 3, 0, 64, [1], 1], ["AN", 3, 1, 2], ["FFSP", 3, 0, [2, 1], 1, 1], ["AN", 3, 1, 6], ["FU", 1, [0, 1]], ["SP", 1, 0, 5136, [4], 1], ["AN", 1, 1, 2], ["FFSP", 1, 0, [2, 1], 1, 1], ["AN", 1, 1, 6], ["PR", 4, 0, "auto_unroll_max_step$0"]]]], "r": [[0.0714715, 0.0715645, 0.0715654], 0, 5.33333, 1759460999], "v": "v0.6"}
{"i": [["[\"ansor_mm\", 642, 1024, 4096, \"float16\"]", "rocm -keys=rocm,gpu -max_num_threads=256 -max_shared_memory_per_block=49152 -max_threads_per_block=1024 -mcpu=gfx942 -model=unknown -mtriple=amdgcn-amd-amdhsa-hcc -thread_warp_size=64", [-1, 16, 64, 65536, 2147483647, 1024, 16, 64], "llvm -keys=cpu -mtriple=x86_64-unknown-linux-gnu", 0, []], [[], [["CHW", 2, "local"], ["SP", 2, 0, 642, [1, 1, 6, 1], 1], ["SP", 2, 5, 1024, [1, 512, 2, 1], 1], ["SP", 2, 10, 4096, [1, 2], 1], ["RE", 2, [0, 5, 1, 6, 2, 7, 10, 11, 3, 8, 12, 4, 9]], ["FSP", 3, 0, 1, 3], ["FSP", 3, 4, 2, 3], ["RE", 3, [0, 4, 1, 5, 2, 6, 3, 7]], ["CA", 2, 3, 5], ["CHR", 1, "shared", [2]], ["CA", 2, 3, 6], ["CHR", 0, "shared", [3]], ["CA", 1, 4, 6], ["FU", 5, [0, 1]], ["AN", 5, 0, 5], ["FU", 5, [1, 2]], ["AN", 5, 1, 4], ["FU", 5, [2, 3]], ["AN", 5, 2, 6], ["FU", 3, [0, 1]], ["SP", 3, 0, 32, [1], 1], ["AN", 3, 1, 2], ["FFSP", 3, 0, [2, 1], 1, 1], ["AN", 3, 1, 6], ["FU", 1, [0, 1]], ["SP", 1, 0, 96, [1], 1], ["AN", 1, 1, 2], ["FFSP", 1, 0, [2, 1], 1, 1], ["AN", 1, 1, 6], ["PR", 4, 0, "auto_unroll_max_step$16"]]]], "r": [[0.00317194, 0.00317385, 0.00317336], 0, 3.07287, 1759461000], "v": "v0.6"}
{"i": [["[\"ansor_mm\", 642, 1024, 4096, \"float16\"]", "rocm -keys=rocm,gpu -max_num_threads=256 -max_shared_memory_per_block=49152 -max_threads_per_block=1024 -mcpu=gfx942 -model=unknown -mtriple=amdgcn-amd-amdhsa-hcc -thread_warp_size=64", [-1, 16, 64, 65536, 2147483647, 1024, 16, 64], "llvm -keys=cpu -mtriple=x86_64-unknown-linux-gnu", 0, []], [[], [["CHW", 2, "local"], ["SP", 2, 0, 642, [1, 321, 2, 1], 1], ["SP", 2, 5, 1024, [1, 2, 32, 8], 1], ["SP", 2, 10, 4096, [1, 8], 1], ["RE", 2, [0, 5, 1, 6, 2, 7, 10, 11, 3, 8, 12, 4, 9]], ["FSP", 3, 0, 1, 3], ["FSP", 3, 4, 2, 3], ["RE", 3, [0, 4, 1, 5, 2, 6, 3, 7]], ["CA", 2, 3, 5], ["CHR", 1, "shared", [2]], ["CA", 2, 3, 6], ["CHR", 0, "shared", [3]], ["CA", 1, 4, 6], ["FU", 5, [0, 1]], ["AN", 5, 0, 5], ["FU", 5, [1, 2]], ["AN", 5, 1, 4], ["FU", 5, [2, 3]], ["AN", 5, 2, 6], ["FU", 3, [0, 1]], ["SP", 3, 0, 2048, [1], 1], ["AN", 3, 1, 2], ["FFSP", 3, 0, [2, 1], 1, 1], ["AN", 3, 1, 6], ["FU", 1, [0, 1]], ["SP", 1, 0, 8, [8], 1], ["AN", 1, 1, 2], ["FFSP", 1, 0, [2, 1], 1, 1], ["AN", 1, 1, 6], ["PR", 4, 0, "auto_unroll_max_step$16"]]]], "r": [[0.0228916, 0.0229287, 0.0229329], 0, 3.77717, 1759461001], "v": "v0.6"}
{"i": [["[\"ansor_mm\", 642, 1024, 4096, \"float16\"]", "rocm -keys=rocm,gpu -max_num_threads=256 -max_shared_memory_per_block=49152 -max_threads_per_block=1024 -mcpu=gfx942 -model=unknown -mtriple=amdgcn-amd-amdhsa-hcc -thread_warp_size=64", [-1, 16, 64, 65536, 2147483647, 1024, 16, 64], "llvm -keys=cpu -mtriple=x86_64-unknown-linux-gnu", 0, []], [[], [["CHW", 2, "local"], ["SP", 2, 0, 642, [1, 2, 3, 1], 1], ["SP", 2, 5, 1024, [1, 32, 1, 2], 1], ["SP", 2, 10, 4096, [16, 2], 1], ["RE", 2, [0, 5, 1, 6, 2, 7, 10, 11, 3, 8, 12, 4, 9]], ["FSP", 3, 0, 1, 3], ["FSP", 3, 4, 2, 3], ["RE", 3, [0, 4, 1, 5, 2, 6, 3, 7]], ["CA", 2, 3, 5], ["CHR", 1, "shared", [2]], ["CA", 2, 3, 6], ["CHR", 0, "shared", [3]], ["CA", 1, 4, 6], ["FU", 5, [0, 1]], ["AN", 5, 0, 5], ["FU", 5, [1, 2]], ["AN", 5, 1, 4], ["FU", 5, [2, 3]], ["AN", 5, 2, 6], ["FU", 3, [0, 1]], ["SP", 3, 0, 128, [2], 1], ["AN", 3, 1, 2], ["FFSP", 3, 0, [2, 1], 1, 1], ["AN", 3, 1, 6], ["FU", 1, [0, 1]], ["SP", 1, 0, 48, [1], 1], ["AN", 1, 1, 2], ["FFSP", 1, 0, [2, 1], 1, 1], ["AN", 1, 1, 6], ["PR", 4, 0, "auto_unroll_max_step$16"]]]], "r": [[0.000156816, 0.000156407, 0.0001565], 0, 3.05105, 1759461001], "v": "v0.6"}
{"i": [["[\"ansor_mm\", 642, 1024, 4096, \"float16\"]", "rocm -keys=rocm,gpu -max_num_threads=256 -max_shared_memory_per_block=49152 -max_threads_per_block=1024 -mcpu=gfx942 -model=unknown -mtriple=amdgcn-amd-amdhsa-hcc -thread_warp_size=64", [-1, 16, 64, 65536, 2147483647, 1024, 16, 64], "llvm -keys=cpu -mtriple=x86_64-unknown-linux-gnu", 0, []], [[], [["CHW", 2, "local"], ["SP", 2, 0, 642, [1, 1, 2, 1], 1], ["SP", 2, 5, 1024, [1, 128, 1, 1], 1], ["SP", 2, 10, 4096, [2, 2], 1], ["RE", 2, [0, 5, 1, 6, 2, 7, 10, 11, 3, 8, 12, 4, 9]], ["FSP", 3, 0, 1, 3], ["FSP", 3, 4, 2, 3], ["RE", 3, [0, 4, 1, 5, 2, 6, 3, 7]], ["CA", 2, 3, 5], ["CHR", 1, "shared", [2]], ["CA", 2, 3, 6], ["CHR", 0, "shared", [3]], ["CA", 1, 4, 6], ["FU", 5, [0, 1]], ["AN", 5, 0, 5], ["FU", 5, [1, 2]], ["AN", 5, 1, 4], ["FU", 5, [2, 3]], ["AN", 5, 2, 6], ["FU", 3, [0, 1]], ["SP", 3, 0, 4, [1], 1], ["AN", 3, 1, 2], ["FFSP", 3, 0, [2, 1], 1, 1], ["AN", 3, 1, 6], ["FU", 1, [0, 1]], ["SP", 1, 0, 8, [1], 1], ["AN", 1, 1, 2], ["FFSP", 1, 0, [2, 1], 1, 1], ["AN", 1, 1, 6], ["PR", 4, 0, "auto_unroll_max_step$1024"]]]], "r": [[0.00156042, 0.00156109, 0.00156103], 0, 3.5399, 1759461002], "v": "v0.6"}
{"i": [["[\"ansor_mm\", 642, 1024, 4096, \"float16\"]", "rocm -keys=rocm,gpu -max_num_threads=256 -max_shared_memory_per_block=49152 -max_threads_per_block=1024 -mcpu=gfx942 -model=unknown -mtriple=amdgcn-amd-amdhsa-hcc -thread_warp_size=64", [-1, 16, 64, 65536, 2147483647, 1024, 16, 64], "llvm -keys=cpu -mtriple=x86_64-unknown-linux-gnu", 0, []], [[], [["CHW", 2, "local"], ["SP", 2, 0, 642, [1, 107, 1, 2], 1], ["SP", 2, 5, 1024, [2, 4, 8, 16], 1], ["SP", 2, 10, 4096, [1, 4], 1], ["RE", 2, [0, 5, 1, 6, 2, 7, 10, 11, 3, 8, 12, 4, 9]], ["FSP", 3, 0, 1, 3], ["FSP", 3, 4, 2, 3], ["RE", 3, [0, 4, 1, 5, 2, 6, 3, 7]], ["CA", 2, 3, 5], ["CHR", 1, "shared", [2]], ["CA", 2, 3, 6], ["CHR", 0, "shared", [3]], ["CA", 1, 4, 6], ["FU", 5, [0, 1]], ["AN", 5, 0, 5], ["FU", 5, [1, 2]], ["AN", 5, 1, 4], ["FU", 5, [2, 3]], ["AN", 5, 2, 6], ["FU", 3, [0, 1]], ["SP", 3, 0, 128, [1], 1], ["AN", 3, 1, 2], ["FFSP", 3, 0, [2, 1], 1, 1], ["AN", 3, 1, 6], ["FU", 1, [0, 1]], ["SP", 1, 0, 4, [1], 1], ["AN", 1, 1, 2], ["FFSP", 1, 0, [2, 1], 1, 1], ["AN", 1, 1, 6], ["PR", 4, 0, "auto_unroll_max_step$64"]]]], "r": [[0.0291053, 0.0291988, 0.0292804], 0, 4.00259, 1759461003], "v": "v0.6"}
