demo_artifacts/logs/mm_ansor/log_706_4096_4096.json
{"i": [["[\"ansor_mm\", 706, 4096, 4096, \"float16\"]", "rocm -keys=rocm,gpu -max_num_threads=256 -max_shared_memory_per_block=49152 -max_threads_per_block=1024 -mcpu=gfx942 -model=unknown -mtriple=amdgcn-amd-amdhsa-hcc -thread_warp_size=64", [-1, 16, 64, 65536, 2147483647, 1024, 16, 64], "llvm -keys=cpu -mtriple=x86_64-unknown-linux-gnu", 0, []], [[], [["CHW", 2, "local"], ["SP", 2, 0, 706, [2, 1, 353, 1], 1], ["SP", 2, 5, 4096, [8, 128, 1, 1], 1], ["SP", 2, 10, 4096, [2, 1], 1], ["RE", 2, [0, 5, 1, 6, 2, 7, 10, 11, 3, 8, 12, 4, 9]], ["FSP", 3, 0, 1, 3], ["FSP", 3, 4, 2, 3], ["RE", 3, [0, 4, 1, 5, 2, 6, 3, 7]], ["CA", 2, 3, 5], ["CHR", 1, "shared", [2]], ["CA", 2, 3, 6], ["CHR", 0, "shared", [3]], ["CA", 1, 4, 6], ["FU", 5, [0, 1]], ["AN", 5, 0, 5], ["FU", 5, [1, 2]], ["AN", 5, 1, 4], ["FU", 5, [2, 3]], ["AN", 5, 2, 6], ["FU", 3, [0, 1]], ["SP", 3, 0, 2, [1], 1], ["AN", 3, 1, 2], ["FFSP", 3, 0, [2, 1], 1, 1], ["AN", 3, 1, 6], ["FU", 1, [0, 1]], ["SP", 1, 0, 1412, [1], 1], ["AN", 1, 1, 2], ["FFSP", 1, 0, [2, 1], 1, 1], ["AN", 1, 1, 6], ["PR", 4, 0, "auto_unroll_max_step$64"]]]], "r": [[0.887016, 0.886911, 0.886936], 0, 31.1885, 1759468911], "v": "v0.6"}
{"i": [["[\"ansor_mm\", 706, 4096, 4096, \"float16\"]", "rocm -keys=rocm,gpu -max_num_threads=256 -max_shared_memory_per_block=49152 -max_threads_per_block=1024 -mcpu=gfx942 -model=unknown -mtriple=amdgcn-amd-amdhsa-hcc -thread_warp_size=64", [-1, 16, 64, 65536, 2147483647, 1024, 16, 64], "llvm -keys=cpu -mtriple=x86_64-unknown-linux-gnu", 0, []], [[], [["CHW", 2, "local"], ["SP", 2, 0, 706, [1, 1, 706, 1], 1], ["SP", 2, 5, 4096, [1, 128, 1, 1], 1], ["SP", 2, 10, 4096, [4, 4], 1], ["RE", 2, [0, 5, 1, 6, 2, 7, 10, 11, 3, 8, 12, 4, 9]], ["FSP", 3, 0, 1, 3], ["FSP", 3, 4, 2, 3], ["RE", 3, [0, 4, 1, 5, 2, 6, 3, 7]], ["CA", 2, 3, 5], ["CHR", 1, "shared", [2]], ["CA", 2, 3, 6], ["CHR", 0, "shared", [3]], ["CA", 1, 4, 6], ["FU", 5, [0, 1]], ["AN", 5, 0, 5], ["FU", 5, [1, 2]], ["AN", 5, 1, 4], ["FU", 5, [2, 3]], ["AN", 5, 2, 6], ["FU", 3, [0, 1]], ["SP", 3, 0, 16, [2], 1], ["AN", 3, 1, 2], ["FFSP", 3, 0, [2, 1], 1, 1], ["AN", 3, 1, 6], ["FU", 1, [0, 1]], ["SP", 1, 0, 11296, [2], 1], ["AN", 1, 1, 2], ["FFSP", 1, 0, [2, 1], 1, 1], ["AN", 1, 1, 6], ["PR", 4, 0, "auto_unroll_max_step$1024"]]]], "r": [[0.037764, 0.0378995, 0.0376937], 0, 4.66557, 1759468913], "v": "v0.6"}
{"i": [["[\"ansor_mm\", 706, 4096, 4096, \"float16\"]", "rocm -keys=rocm,gpu -max_num_threads=256 -max_shared_memory_per_block=49152 -max_threads_per_block=1024 -mcpu=gfx942 -model=unknown -mtriple=amdgcn-amd-amdhsa-hcc -thread_warp_size=64", [-1, 16, 64, 65536, 2147483647, 1024, 16, 64], "llvm -keys=cpu -mtriple=x86_64-unknown-linux-gnu", 0, []], [[], [["CHW", 2, "local"], ["SP", 2, 0, 706, [1, 353, 2, 1], 1], ["SP", 2, 5, 4096, [1, 1, 64, 2], 1], ["SP", 2, 10, 4096, [1, 32], 1], ["RE", 2, [0, 5, 1, 6, 2, 7, 10, 11, 3, 8, 12, 4, 9]], ["FSP", 3, 0, 1, 3], ["FSP", 3, 4, 2, 3], ["RE", 3, [0, 4, 1, 5, 2, 6, 3, 7]], ["CA", 2, 3, 5], ["CHR", 1, "shared", [2]], ["CA", 2, 3, 6], ["CHR", 0, "shared", [3]], ["CA", 1, 4, 6], ["FU", 5, [0, 1]], ["AN", 5, 0, 5], ["FU", 5, [1, 2]], ["AN", 5, 1, 4], ["FU", 5, [2, 3]], ["AN", 5, 2, 6], ["FU", 3, [0, 1]], ["SP", 3, 0, 8192, [1], 1], ["AN", 3, 1, 2], ["FFSP", 3, 0, [2, 1], 1, 1], ["AN", 3, 1, 6], ["FU", 1, [0, 1]], ["SP", 1, 0, 64, [1], 1], ["AN", 1, 1, 2], ["FFSP", 1, 0, [2, 1], 1, 1], ["AN", 1, 1, 6], ["PR", 4, 0, "auto_unroll_max_step$64"]]]], "r": [[0.023786, 0.0238115, 0.0238075], 0, 4.55491, 1759468914], "v": "v0.6"}
{"i": [["[\"ansor_mm\", 706, 4096, 4096, \"float16\"]", "rocm -keys=rocm,gpu -max_num_threads=256 -max_shared_memory_per_block=49152 -max_threads_per_block=1024 -mcpu=gfx942 -model=unknown -mtriple=amdgcn-amd-amdhsa-hcc -thread_warp_size=64", [-1, 16, 64, 65536, 2147483647, 1024, 16, 64], "llvm -keys=cpu -mtriple=x86_64-unknown-linux-gnu", 0, []], [[], [["CHW", 2, "local"], ["SP", 2, 0, 706, [1, 2, 353, 1], 1], ["SP", 2, 5, 4096, [1, 256, 1, 1], 1], ["SP", 2, 10, 4096, [16, 2], 1], ["RE", 2, [0, 5, 1, 6, 2, 7, 10, 11, 3, 8, 12, 4, 9]], ["FSP", 3, 0, 1, 3], ["FSP", 3, 4, 2, 3], ["RE", 3, [0, 4, 1, 5, 2, 6, 3, 7]], ["CA", 2, 3, 5], ["CHR", 1, "shared", [2]], ["CA", 2, 3, 6], ["CHR", 0, "shared", [3]], ["CA", 1, 4, 6], ["FU", 5, [0, 1]], ["AN", 5, 0, 5], ["FU", 5, [1, 2]], ["AN", 5, 1, 4], ["FU", 5, [2, 3]], ["AN", 5, 2, 6], ["FU", 3, [0, 1]], ["SP", 3, 0, 32, [1], 1], ["AN", 3, 1, 2], ["FFSP", 3, 0, [2, 1], 1, 1], ["AN", 3, 1, 6], ["FU", 1, [0, 1]], ["SP", 1, 0, 5648, [1], 1], ["AN", 1, 1, 2], ["FFSP", 1, 0, [2, 1], 1, 1], ["AN", 1, 1, 6], ["PR", 4, 0, "auto_unroll_max_step$0"]]]], "r": [[0.0471321, 0.0471241, 0.0471175], 0, 4.88876, 1759468917], "v": "v0.6"}
{"i": [["[\"ansor_mm\", 706, 4096, 4096, \"float16\"]", "rocm -keys=rocm,gpu -max_num_threads=256 -max_shared_memory_per_block=49152 -max_threads_per_block=1024 -mcpu=gfx942 -model=unknown -mtriple=amdgcn-amd-amdhsa-hcc -thread_warp_size=64", [-1, 16, 64, 65536, 2147483647, 1024, 16, 64], "llvm -keys=cpu -mtriple=x86_64-unknown-linux-gnu", 0, []], [[], [["CHW", 2, "local"], ["SP", 2, 0, 706, [1, 353, 1, 1], 1], ["SP", 2, 5, 4096, [1, 1, 2, 1], 1], ["SP", 2, 10, 4096, [2, 4], 1], ["RE", 2, [0, 5, 1, 6, 2, 7, 10, 11, 3, 8, 12, 4, 9]], ["FSP", 3, 0, 1, 3], ["FSP", 3, 4, 2, 3], ["RE", 3, [0, 4, 1, 5, 2, 6, 3, 7]], ["CA", 2, 3, 5], ["CHR", 1, "shared", [2]], ["CA", 2, 3, 6], ["CHR", 0, "shared", [3]], ["CA", 1, 4, 6], ["FU", 5, [0, 1]], ["AN", 5, 0, 5], ["FU", 5, [1, 2]], ["AN", 5, 1, 4], ["FU", 5, [2, 3]], ["AN", 5, 2, 6], ["FU", 3, [0, 1]], ["SP", 3, 0, 128, [1], 1], ["AN", 3, 1, 2], ["FFSP", 3, 0, [2, 1], 1, 1], ["AN", 3, 1, 6], ["FU", 1, [0, 1]], ["SP", 1, 0, 64, [2], 1], ["AN", 1, 1, 2], ["FFSP", 1, 0, [2, 1], 1, 1], ["AN", 1, 1, 6], ["PR", 4, 0, "auto_unroll_max_step$1024"]]]], "r": [[0.00540308, 0.0054411, 0.00542268], 0, 3.73411, 1759468918], "v": "v0.6"}
{"i": [["[\"ansor_mm\", 706, 4096, 4096, \"float16\"]", "rocm -keys=rocm,gpu -max_num_threads=256 -max_shared_memory_per_block=49152 -max_threads_per_block=1024 -mcpu=gfx942 -model=unknown -mtriple=amdgcn-amd-amdhsa-hcc -thread_warp_size=64", [-1, 16, 64, 65536, 2147483647, 1024, 16, 64], "llvm -keys=cpu -mtriple=x86_64-unknown-linux-gnu", 0, []], [[], [["CHW", 2, "local"], ["SP", 2, 0, 706, [1, 1, 353, 1], 1], ["SP", 2, 5, 4096, [2, 64, 8, 1], 1], ["SP", 2, 10, 4096, [4, 2], 1], ["RE", 2, [0, 5, 1, 6, 2, 7, 10, 11, 3, 8, 12, 4, 9]], ["FSP", 3, 0, 1, 3], ["FSP", 3, 4, 2, 3], ["RE", 3, [0, 4, 1, 5, 2, 6, 3, 7]], ["CA", 2, 3, 5], ["CHR", 1, "shared", [2]], ["CA", 2, 3, 6], ["CHR", 0, "shared", [3]], ["CA", 1, 4, 6], ["FU", 5, [0, 1]], ["AN", 5, 0, 5], ["FU", 5, [1, 2]], ["AN", 5, 1, 4], ["FU", 5, [2, 3]], ["AN", 5, 2, 6], ["FU", 3, [0, 1]], ["SP", 3, 0, 64, [1], 1], ["AN", 3, 1, 2], ["FFSP", 3, 0, [2, 1], 1, 1], ["AN", 3, 1, 6], ["FU", 1, [0, 1]], ["SP", 1, 0, 2824, [1], 1], ["AN", 1, 1, 2], ["FFSP", 1, 0, [2, 1], 1, 1], ["AN", 1, 1, 6], ["PR", 4, 0, "auto_unroll_max_step$0"]]]], "r": [[0.581409, 0.581624, 0.577229], 0, 21.5155, 1759468936], "v": "v0.6"}
{"i": [["[\"ansor_mm\", 706, 4096, 4096, \"float16\"]", "rocm -keys=rocm,gpu -max_num_threads=256 -max_shared_memory_per_block=49152 -max_threads_per_block=1024 -mcpu=gfx942 -model=unknown -mtriple=amdgcn-amd-amdhsa-hcc -thread_warp_size=64", [-1, 16, 64, 65536, 2147483647, 1024, 16, 64], "llvm -keys=cpu -mtriple=x86_64-unknown-linux-gnu", 0, []], [[], [["CHW", 2, "local"], ["SP", 2, 0, 706, [1, 353, 1, 2], 1], ["SP", 2, 5, 4096, [1, 1, 64, 1], 1], ["SP", 2, 10, 4096, [1, 32], 1], ["RE", 2, [0, 5, 1, 6, 2, 7, 10, 11, 3, 8, 12, 4, 9]], ["FSP", 3, 0, 1, 3], ["FSP", 3, 4, 2, 3], ["RE", 3, [0, 4, 1, 5, 2, 6, 3, 7]], ["CA", 2, 3, 5], ["CHR", 1, "shared", [2]], ["CA", 2, 3, 6], ["CHR", 0, "shared", [3]], ["CA", 1, 4, 6], ["FU", 5, [0, 1]], ["AN", 5, 0, 5], ["FU", 5, [1, 2]], ["AN", 5, 1, 4], ["FU", 5, [2, 3]], ["AN", 5, 2, 6], ["FU", 3, [0, 1]], ["SP", 3, 0, 8192, [8], 1], ["AN", 3, 1, 2], ["FFSP", 3, 0, [2, 1], 1, 1], ["AN", 3, 1, 6], ["FU", 1, [0, 1]], ["SP", 1, 0, 64, [1], 1], ["AN", 1, 1, 2], ["FFSP", 1, 0, [2, 1], 1, 1], ["AN", 1, 1, 6], ["PR", 4, 0, "auto_unroll_max_step$64"]]]], "r": [[0.00821636, 0.00821497, 0.00822303], 0, 4.09688, 1759468937], "v": "v0.6"}
{"i": [["[\"ansor_mm\", 706, 4096, 4096, \"float16\"]", "rocm -keys=rocm,gpu -max_num_threads=256 -max_shared_memory_per_block=49152 -max_threads_per_block=1024 -mcpu=gfx942 -model=unknown -mtriple=amdgcn-amd-amdhsa-hcc -thread_warp_size=64", [-1, 16, 64, 65536, 2147483647, 1024, 16, 64], "llvm -keys=cpu -mtriple=x86_64-unknown-linux-gnu", 0, []], [[], [["CHW", 2, "local"], ["SP", 2, 0, 706, [1, 353, 1, 1], 1], ["SP", 2, 5, 4096, [1, 1, 2, 1], 1], ["SP", 2, 10, 4096, [16, 4], 1], ["RE", 2, [0, 5, 1, 6, 2, 7, 10, 11, 3, 8, 12, 4, 9]], ["FSP", 3, 0, 1, 3], ["FSP", 3, 4, 2, 3], ["RE", 3, [0, 4, 1, 5, 2, 6, 3, 7]], ["CA", 2, 3, 5], ["CHR", 1, "shared", [2]], ["CA", 2, 3, 6], ["CHR", 0, "shared", [3]], ["CA", 1, 4, 6], ["FU", 5, [0, 1]], ["AN", 5, 0, 5], ["FU", 5, [1, 2]], ["AN", 5, 1, 4], ["FU", 5, [2, 3]], ["AN", 5, 2, 6], ["FU", 3, [0, 1]], ["SP", 3, 0, 128, [4], 1], ["AN", 3, 1, 2], ["FFSP", 3, 0, [2, 1], 1, 1], ["AN", 3, 1, 6], ["FU", 1, [0, 1]], ["SP", 1, 0, 64, [1], 1], ["AN", 1, 1, 2], ["FFSP", 1, 0, [2, 1], 1, 1], ["AN", 1, 1, 6], ["PR", 4, 0, "auto_unroll_max_step$1024"]]]], "r": [[0.0144655, 0.0144575, 0.0144496], 0, 4.01453, 1759468939], "v": "v0.6"}
{"i": [["[\"ansor_mm\", 706, 4096, 4096, \"float16\"]", "rocm -keys=rocm,gpu -max_num_threads=256 -max_shared_memory_per_block=49152 -max_threads_per_block=1024 -mcpu=gfx942 -model=unknown -mtriple=amdgcn-amd-amdhsa-hcc -thread_warp_size=64", [-1, 16, 64, 65536, 2147483647, 1024, 16, 64], "llvm -keys=cpu -mtriple=x86_64-unknown-linux-gnu", 0, []], [[], [["CHW", 2, "local"], ["SP", 2, 0, 706, [1, 353, 1, 1], 1], ["SP", 2, 5, 4096, [2, 1, 256, 1], 1], ["SP", 2, 10, 4096, [4, 4], 1], ["RE", 2, [0, 5, 1, 6, 2, 7, 10, 11, 3, 8, 12, 4, 9]], ["FSP", 3, 0, 1, 3], ["FSP", 3, 4, 2, 3], ["RE", 3, [0, 4, 1, 5, 2, 6, 3, 7]], ["CA", 2, 3, 5], ["CHR", 1, "shared", [2]], ["CA", 2, 3, 6], ["CHR", 0, "shared", [3]], ["CA", 1, 4, 6], ["FU", 5, [0, 1]], ["AN", 5, 0, 5], ["FU", 5, [1, 2]], ["AN", 5, 1, 4], ["FU", 5, [2, 3]], ["AN", 5, 2, 6], ["FU", 3, [0, 1]], ["SP", 3, 0, 4096, [1], 1], ["AN", 3, 1, 2], ["FFSP", 3, 0, [2, 1], 1, 1], ["AN", 3, 1, 6], ["FU", 1, [0, 1]], ["SP", 1, 0, 32, [1], 1], ["AN", 1, 1, 2], ["FFSP", 1, 0, [2, 1], 1, 1], ["AN", 1, 1, 6], ["PR", 4, 0, "auto_unroll_max_step$512"]]]], "r": [[0.0244884, 0.0244821, 0.0244933], 0, 4.39123, 1759468940], "v": "v0.6"}
{"i": [["[\"ansor_mm\", 706, 4096, 4096, \"float16\"]", "rocm -keys=rocm,gpu -max_num_threads=256 -max_shared_memory_per_block=49152 -max_threads_per_block=1024 -mcpu=gfx942 -model=unknown -mtriple=amdgcn-amd-amdhsa-hcc -thread_warp_size=64", [-1, 16, 64, 65536, 2147483647, 1024, 16, 64], "llvm -keys=cpu -mtriple=x86_64-unknown-linux-gnu", 0, []], [[], [["CHW", 2, "local"], ["SP", 2, 0, 706, [1, 1, 1, 2], 1], ["SP", 2, 5, 4096, [2, 512, 1, 2], 1], ["SP", 2, 10, 4096, [1, 4], 1], ["RE", 2, [0, 5, 1, 6, 2, 7, 10, 11, 3, 8, 12, 4, 9]], ["FSP", 3, 0, 1, 3], ["FSP", 3, 4, 2, 3], ["RE", 3, [0, 4, 1, 5, 2, 6, 3, 7]], ["CA", 2, 3, 5], ["CHR", 1, "shared", [2]], ["CA", 2, 3, 6], ["CHR", 0, "shared", [3]], ["CA", 1, 4, 6], ["FU", 5, [0, 1]], ["AN", 5, 0, 5], ["FU", 5, [1, 2]], ["AN", 5, 1, 4], ["FU", 5, [2, 3]], ["AN", 5, 2, 6], ["FU", 3, [0, 1]], ["SP", 3, 0, 64, [1], 1], ["AN", 3, 1, 2], ["FFSP", 3, 0, [2, 1], 1, 1], ["AN", 3, 1, 6], ["FU", 1, [0, 1]], ["SP", 1, 0, 4, [1], 1], ["AN", 1, 1, 2], ["FFSP", 1, 0, [2, 1], 1, 1], ["AN", 1, 1, 6], ["PR", 4, 0, "auto_unroll_max_step$64"]]]], "r": [[0.00374642, 0.00374738, 0.00374686], 0, 3.67776, 1759468941], "v": "v0.6"}
{"i": [["[\"ansor_mm\", 706, 4096, 4096, \"float16\"]", "rocm -keys=rocm,gpu -max_num_threads=256 -max_shared_memory_per_block=49152 -max_threads_per_block=1024 -mcpu=gfx942 -model=unknown -mtriple=amdgcn-amd-amdhsa-hcc -thread_warp_size=64", [-1, 16, 64, 65536, 2147483647, 1024, 16, 64], "llvm -keys=cpu -mtriple=x86_64-unknown-linux-gnu", 0, []], [[], [["CHW", 2, "local"], ["SP", 2, 0, 706, [2, 1, 1, 1], 1], ["SP", 2, 5, 4096, [8, 128, 1, 1], 1], ["SP", 2, 10, 4096, [1, 1], 1], ["RE", 2, [0, 5, 1, 6, 2, 7, 10, 11, 3, 8, 12, 4, 9]], ["FSP", 3, 0, 1, 3], ["FSP", 3, 4, 2, 3], ["RE", 3, [0, 4, 1, 5, 2, 6, 3, 7]], ["CA", 2, 3, 5], ["CHR", 1, "shared", [2]], ["CA", 2, 3, 6], ["CHR", 0, "shared", [3]], ["CA", 1, 4, 6], ["FU", 5, [0, 1]], ["AN", 5, 0, 5], ["FU", 5, [1, 2]], ["AN", 5, 1, 4], ["FU", 5, [2, 3]], ["AN", 5, 2, 6], ["FU", 3, [0, 1]], ["SP", 3, 0, 2, [1], 1], ["AN", 3, 1, 2], ["FFSP", 3, 0, [2, 1], 1, 1], ["AN", 3, 1, 6], ["FU", 1, [0, 1]], ["SP", 1, 0, 1412, [1], 1], ["AN", 1, 1, 2], ["FFSP", 1, 0, [2, 1], 1, 1], ["AN", 1, 1, 6], ["PR", 4, 0, "auto_unroll_max_step$64"]]]], "r": [[0.00197109, 0.00197099, 0.00197357], 0, 3.84208, 1759469044], "v": "v0.6"}
{"i": [["[\"ansor_mm\", 706, 4096, 4096, \"float16\"]", "rocm -keys=rocm,gpu -max_num_threads=256 -max_shared_memory_per_block=49152 -max_threads_per_block=1024 -mcpu=gfx942 -model=unknown -mtriple=amdgcn-amd-amdhsa-hcc -thread_warp_size=64", [-1, 16, 64, 65536, 2147483647, 1024, 16, 64], "llvm -keys=cpu -mtriple=x86_64-unknown-linux-gnu", 0, []], [[], [["CHW", 2, "local"], ["SP", 2, 0, 706, [1, 1, 353, 2], 1], ["SP", 2, 5, 4096, [2, 128, 1, 1], 1], ["SP", 2, 10, 4096, [2, 1], 1], ["RE", 2, [0, 5, 1, 6, 2, 7, 10, 11, 3, 8, 12, 4, 9]], ["FSP", 3, 0, 1, 3], ["FSP", 3, 4, 2, 3], ["RE", 3, [0, 4, 1, 5, 2, 6, 3, 7]], ["CA", 2, 3, 5], ["CHR", 1, "shared", [2]], ["CA", 2, 3, 6], ["CHR", 0, "shared", [3]], ["CA", 1, 4, 6], ["FU", 5, [0, 1]], ["AN", 5, 0, 5], ["FU", 5, [1, 2]], ["AN", 5, 1, 4], ["FU", 5, [2, 3]], ["AN", 5, 2, 6], ["FU", 3, [0, 1]], ["SP", 3, 0, 2, [2], 1], ["AN", 3, 1, 2], ["FFSP", 3, 0, [2, 1], 1, 1], ["AN", 3, 1, 6], ["FU", 1, [0, 1]], ["SP", 1, 0, 1412, [1], 1], ["AN", 1, 1, 2], ["FFSP", 1, 0, [2, 1], 1, 1], ["AN", 1, 1, 6], ["PR", 4, 0, "auto_unroll_max_step$64"]]]], "r": [[0.489995, 0.493362, 0.488774], 0, 18.6012, 1759469059], "v": "v0.6"}
{"i": [["[\"ansor_mm\", 706, 4096, 4096, \"float16\"]", "rocm -keys=rocm,gpu -max_num_threads=256 -max_shared_memory_per_block=49152 -max_threads_per_block=1024 -mcpu=gfx942 -model=unknown -mtriple=amdgcn-amd-amdhsa-hcc -thread_warp_size=64", [-1, 16, 64, 65536, 2147483647, 1024, 16, 64], "llvm -keys=cpu -mtriple=x86_64-unknown-linux-gnu", 0, []], [[], [["CHW", 2, "local"], ["SP", 2, 0, 706, [2, 1, 1, 1], 1], ["SP", 2, 5, 4096, [2, 64, 2, 2], 1], ["SP", 2, 10, 4096, [1, 2], 1], ["RE", 2, [0, 5, 1, 6, 2, 7, 10, 11, 3, 8, 12, 4, 9]], ["FSP", 3, 0, 1, 3], ["FSP", 3, 4, 2, 3], ["RE", 3, [0, 4, 1, 5, 2, 6, 3, 7]], ["CA", 2, 3, 5], ["CHR", 1, "shared", [2]], ["CA", 2, 3, 6], ["CHR", 0, "shared", [3]], ["CA", 1, 4, 6], ["FU", 5, [0, 1]], ["AN", 5, 0, 5], ["FU", 5, [1, 2]], ["AN", 5, 1, 4], ["FU", 5, [2, 3]], ["AN", 5, 2, 6], ["FU", 3, [0, 1]], ["SP", 3, 0, 64, [1], 1], ["AN", 3, 1, 2], ["FFSP", 3, 0, [2, 1], 1, 1], ["AN", 3, 1, 6], ["FU", 1, [0, 1]], ["SP", 1, 0, 4, [1], 1], ["AN", 1, 1, 2], ["FFSP", 1, 0, [2, 1], 1, 1], ["AN", 1, 1, 6], ["PR", 4, 0, "auto_unroll_max_step$64"]]]], "r": [[0.00149777, 0.00150251, 0.00150247], 0, 3.92348, 1759469061], "v": "v0.6"}
{"i": [["[\"ansor_mm\", 706, 4096, 4096, \"float16\"]", "rocm -keys=rocm,gpu -max_num_threads=256 -max_shared_memory_per_block=49152 -max_threads_per_block=1024 -mcpu=gfx942 -model=unknown -mtriple=amdgcn-amd-amdhsa-hcc -thread_warp_size=64", [-1, 16, 64, 65536, 2147483647, 1024, 16, 64], "llvm -keys=cpu -mtriple=x86_64-unknown-linux-gnu", 0, []], [[], [["CHW", 2, "local"], ["SP", 2, 0, 706, [1, 353, 1, 2], 1], ["SP", 2, 5, 4096, [4, 1, 512, 1], 1], ["SP", 2, 10, 4096, [1, 4], 1], ["RE", 2, [0, 5, 1, 6, 2, 7, 10, 11, 3, 8, 12, 4, 9]], ["FSP", 3, 0, 1, 3], ["FSP", 3, 4, 2, 3], ["RE", 3, [0, 4, 1, 5, 2, 6, 3, 7]], ["CA", 2, 3, 5], ["CHR", 1, "shared", [2]], ["CA", 2, 3, 6], ["CHR", 0, "shared", [3]], ["CA", 1, 4, 6], ["FU", 5, [0, 1]], ["AN", 5, 0, 5], ["FU", 5, [1, 2]], ["AN", 5, 1, 4], ["FU", 5, [2, 3]], ["AN", 5, 2, 6], ["FU", 3, [0, 1]], ["SP", 3, 0, 4096, [1], 1], ["AN", 3, 1, 2], ["FFSP", 3, 0, [2, 1], 1, 1], ["AN", 3, 1, 6], ["FU", 1, [0, 1]], ["SP", 1, 0, 16, [1], 1], ["AN", 1, 1, 2], ["FFSP", 1, 0, [2, 1], 1, 1], ["AN", 1, 1, 6], ["PR", 4, 0, "auto_unroll_max_step$1024"]]]], "r": [[0.20556, 0.205544, 0.205565], 0, 9.75961, 1759469068], "v": "v0.6"}
{"i": [["[\"ansor_mm\", 706, 4096, 4096, \"float16\"]", "rocm -keys=rocm,gpu -max_num_threads=256 -max_shared_memory_per_block=49152 -max_threads_per_block=1024 -mcpu=gfx942 -model=unknown -mtriple=amdgcn-amd-amdhsa-hcc -thread_warp_size=64", [-1, 16, 64, 65536, 2147483647, 1024, 16, 64], "llvm -keys=cpu -mtriple=x86_64-unknown-linux-gnu", 0, []], [[], [["CHW", 2, "local"], ["SP", 2, 0, 706, [1, 2, 1, 1], 1], ["SP", 2, 5, 4096, [1, 256, 2, 8], 1], ["SP", 2, 10, 4096, [2, 1], 1], ["RE", 2, [0, 5, 1, 6, 2, 7, 10, 11, 3, 8, 12, 4, 9]], ["FSP", 3, 0, 1, 3], ["FSP", 3, 4, 2, 3], ["RE", 3, [0, 4, 1, 5, 2, 6, 3, 7]], ["CA", 2, 3, 5], ["CHR", 1, "shared", [2]], ["CA", 2, 3, 6], ["CHR", 0, "shared", [3]], ["CA", 1, 4, 6], ["FU", 5, [0, 1]], ["AN", 5, 0, 5], ["FU", 5, [1, 2]], ["AN", 5, 1, 4], ["FU", 5, [2, 3]], ["AN", 5, 2, 6], ["FU", 3, [0, 1]], ["SP", 3, 0, 32, [1], 1], ["AN", 3, 1, 2], ["FFSP", 3, 0, [2, 1], 1, 1], ["AN", 3, 1, 6], ["FU", 1, [0, 1]], ["SP", 1, 0, 2, [1], 1], ["AN", 1, 1, 2], ["FFSP", 1, 0, [2, 1], 1, 1], ["AN", 1, 1, 6], ["PR", 4, 0, "auto_unroll_max_step$0"]]]], "r": [[0.00288555, 0.00288746, 0.00288921], 0, 3.66745, 1759469069], "v": "v0.6"}
{"i": [["[\"ansor_mm\", 706, 4096, 4096, \"float16\"]", "rocm -keys=rocm,gpu -max_num_threads=256 -max_shared_memory_per_block=49152 -max_threads_per_block=1024 -mcpu=gfx942 -model=unknown -mtriple=amdgcn-amd-amdhsa-hcc -thread_warp_size=64", [-1, 16, 64, 65536, 2147483647, 1024, 16, 64], "llvm -keys=cpu -mtriple=x86_64-unknown-linux-gnu", 0, []], [[], [["CHW", 2, "local"], ["SP", 2, 0, 706, [1, 353, 1, 1], 1], ["SP", 2, 5, 4096, [1, 2, 2, 8], 1], ["SP", 2, 10, 4096, [2, 4], 1], ["RE", 2, [0, 5, 1, 6, 2, 7, 10, 11, 3, 8, 12, 4, 9]], ["FSP", 3, 0, 1, 3], ["FSP", 3, 4, 2, 3], ["RE", 3, [0, 4, 1, 5, 2, 6, 3, 7]], ["CA", 2, 3, 5], ["CHR", 1, "shared", [2]], ["CA", 2, 3, 6], ["CHR", 0, "shared", [3]], ["CA", 1, 4, 6], ["FU", 5, [0, 1]], ["AN", 5, 0, 5], ["FU", 5, [1, 2]], ["AN", 5, 1, 4], ["FU", 5, [2, 3]], ["AN", 5, 2, 6], ["FU", 3, [0, 1]], ["SP", 3, 0, 128, [8], 1], ["AN", 3, 1, 2], ["FFSP", 3, 0, [2, 1], 1, 1], ["AN", 3, 1, 6], ["FU", 1, [0, 1]], ["SP", 1, 0, 16, [1], 1], ["AN", 1, 1, 2], ["FFSP", 1, 0, [2, 1], 1, 1], ["AN", 1, 1, 6], ["PR", 4, 0, "auto_unroll_max_step$64"]]]], "r": [[0.000930048, 0.000930174, 0.000930349], 0, 3.93968, 1759469070], "v": "v0.6"}
{"i": [["[\"ansor_mm\", 706, 4096, 4096, \"float16\"]", "rocm -keys=rocm,gpu -max_num_threads=256 -max_shared_memory_per_block=49152 -max_threads_per_block=1024 -mcpu=gfx942 -model=unknown -mtriple=amdgcn-amd-amdhsa-hcc -thread_warp_size=64", [-1, 16, 64, 65536, 2147483647, 1024, 16, 64], "llvm -keys=cpu -mtriple=x86_64-unknown-linux-gnu", 0, []], [[], [["CHW", 2, "local"], ["SP", 2, 0, 706, [1, 2, 353, 1], 1], ["SP", 2, 5, 4096, [1, 64, 2, 8], 1], ["SP", 2, 10, 4096, [1, 2], 1], ["RE", 2, [0, 5, 1, 6, 2, 7, 10, 11, 3, 8, 12, 4, 9]], ["FSP", 3, 0, 1, 3], ["FSP", 3, 4, 2, 3], ["RE", 3, [0, 4, 1, 5, 2, 6, 3, 7]], ["CA", 2, 3, 5], ["CHR", 1, "shared", [2]], ["CA", 2, 3, 6], ["CHR", 0, "shared", [3]], ["CA", 1, 4, 6], ["FU", 5, [0, 1]], ["AN", 5, 0, 5], ["FU", 5, [1, 2]], ["AN", 5, 1, 4], ["FU", 5, [2, 3]], ["AN", 5, 2, 6], ["FU", 3, [0, 1]], ["SP", 3, 0, 32, [1], 1], ["AN", 3, 1, 2], ["FFSP", 3, 0, [2, 1], 1, 1], ["AN", 3, 1, 6], ["FU", 1, [0, 1]], ["SP", 1, 0, 706, [1], 1], ["AN", 1, 1, 2], ["FFSP", 1, 0, [2, 1], 1, 1], ["AN", 1, 1, 6], ["PR", 4, 0, "auto_unroll_max_step$16"]]]], "r": [[0.359993, 0.359916, 0.359853], 0, 14.6305, 1759469082], "v": "v0.6"}
{"i": [["[\"ansor_mm\", 706, 4096, 4096, \"float16\"]", "rocm -keys=rocm,gpu -max_num_threads=256 -max_shared_memory_per_block=49152 -max_threads_per_block=1024 -mcpu=gfx942 -model=unknown -mtriple=amdgcn-amd-amdhsa-hcc -thread_warp_size=64", [-1, 16, 64, 65536, 2147483647, 1024, 16, 64], "llvm -keys=cpu -mtriple=x86_64-unknown-linux-gnu", 0, []], [[], [["CHW", 2, "local"], ["SP", 2, 0, 706, [1, 353, 1, 1], 1], ["SP", 2, 5, 4096, [4, 2, 16, 16], 1], ["SP", 2, 10, 4096, [8, 1], 1], ["RE", 2, [0, 5, 1, 6, 2, 7, 10, 11, 3, 8, 12, 4, 9]], ["FSP", 3, 0, 1, 3], ["FSP", 3, 4, 2, 3], ["RE", 3, [0, 4, 1, 5, 2, 6, 3, 7]], ["CA", 2, 3, 5], ["CHR", 1, "shared", [2]], ["CA", 2, 3, 6], ["CHR", 0, "shared", [3]], ["CA", 1, 4, 6], ["FU", 5, [0, 1]], ["AN", 5, 0, 5], ["FU", 5, [1, 2]], ["AN", 5, 1, 4], ["FU", 5, [2, 3]], ["AN", 5, 2, 6], ["FU", 3, [0, 1]], ["SP", 3, 0, 4096, [1], 1], ["AN", 3, 1, 2], ["FFSP", 3, 0, [2, 1], 1, 1], ["AN", 3, 1, 6], ["FU", 1, [0, 1]], ["SP", 1, 0, 8, [8], 1], ["AN", 1, 1, 2], ["FFSP", 1, 0, [2, 1], 1, 1], ["AN", 1, 1, 6], ["PR", 4, 0, "auto_unroll_max_step$64"]]]], "r": [[0.365671, 0.365763, 0.365747], 0, 15.5855, 1759469094], "v": "v0.6"}
{"i": [["[\"ansor_mm\", 706, 4096, 4096, \"float16\"]", "rocm -keys=rocm,gpu -max_num_threads=256 -max_shared_memory_per_block=49152 -max_threads_per_block=1024 -mcpu=gfx942 -model=unknown -mtriple=amdgcn-amd-amdhsa-hcc -thread_warp_size=64", [-1, 16, 64, 65536, 2147483647, 1024, 16, 64], "llvm -keys=cpu -mtriple=x86_64-unknown-linux-gnu", 0, []], [[], [["CHW", 2, "local"], ["SP", 2, 0, 706, [1, 353, 1, 1], 1], ["SP", 2, 5, 4096, [4, 2, 256, 2], 1], ["SP", 2, 10, 4096, [2, 1], 1], ["RE", 2, [0, 5, 1, 6, 2, 7, 10, 11, 3, 8, 12, 4, 9]], ["FSP", 3, 0, 1, 3], ["FSP", 3, 4, 2, 3], ["RE", 3, [0, 4, 1, 5, 2, 6, 3, 7]], ["CA", 2, 3, 5], ["CHR", 1, "shared", [2]], ["CA", 2, 3, 6], ["CHR", 0, "shared", [3]], ["CA", 1, 4, 6], ["FU", 5, [0, 1]], ["AN", 5, 0, 5], ["FU", 5, [1, 2]], ["AN", 5, 1, 4], ["FU", 5, [2, 3]], ["AN", 5, 2, 6], ["FU", 3, [0, 1]], ["SP", 3, 0, 1024, [1], 1], ["AN", 3, 1, 2], ["FFSP", 3, 0, [2, 1], 1, 1], ["AN", 3, 1, 6], ["FU", 1, [0, 1]], ["SP", 1, 0, 4, [1], 1], ["AN", 1, 1, 2], ["FFSP", 1, 0, [2, 1], 1, 1], ["AN", 1, 1, 6], ["PR", 4, 0, "auto_unroll_max_step$512"]]]], "r": [[0.891985, 0.893776, 0.89472], 0, 31.1183, 1759469122], "v": "v0.6"}
{"i": [["[\"ansor_mm\", 706, 4096, 4096, \"float16\"]", "rocm -keys=rocm,gpu -max_num_threads=256 -max_shared_memory_per_block=49152 -max_threads_per_block=1024 -mcpu=gfx942 -model=unknown -mtriple=amdgcn-amd-amdhsa-hcc -thread_warp_size=64", [-1, 16, 64, 65536, 2147483647, 1024, 16, 64], "llvm -keys=cpu -mtriple=x86_64-unknown-linux-gnu", 0, []], [[], [["CHW", 2, "local"], ["SP", 2, 0, 706, [1, 1, 1, 1], 1], ["SP", 2, 5, 4096, [1, 128, 4, 1], 1], ["SP", 2, 10, 4096, [1, 32], 1], ["RE", 2, [0, 5, 1, 6, 2, 7, 10, 11, 3, 8, 12, 4, 9]], ["FSP", 3, 0, 1, 3], ["FSP", 3, 4, 2, 3], ["RE", 3, [0, 4, 1, 5, 2, 6, 3, 7]], ["CA", 2, 3, 5], ["CHR", 1, "shared", [2]], ["CA", 2, 3, 6], ["CHR", 0, "shared", [3]], ["CA", 1, 4, 6], ["FU", 5, [0, 1]], ["AN", 5, 0, 5], ["FU", 5, [1, 2]], ["AN", 5, 1, 4], ["FU", 5, [2, 3]], ["AN", 5, 2, 6], ["FU", 3, [0, 1]], ["SP", 3, 0, 128, [4], 1], ["AN", 3, 1, 2], ["FFSP", 3, 0, [2, 1], 1, 1], ["AN", 3, 1, 6], ["FU", 1, [0, 1]], ["SP", 1, 0, 32, [1], 1], ["AN", 1, 1, 2], ["FFSP", 1, 0, [2, 1], 1, 1], ["AN", 1, 1, 6], ["PR", 4, 0, "auto_unroll_max_step$512"]]]], "r": [[0.00533862, 0.00533985, 0.00534269], 0, 3.80354, 1759469123], "v": "v0.6"}
{"i": [["[\"ansor_mm\", 706, 4096, 4096, \"float16\"]", "rocm -keys=rocm,gpu -max_num_threads=256 -max_shared_memory_per_block=49152 -max_threads_per_block=1024 -mcpu=gfx942 -model=unknown -mtriple=amdgcn-amd-amdhsa-hcc -thread_warp_size=64", [-1, 16, 64, 65536, 2147483647, 1024, 16, 64], "llvm -keys=cpu -mtriple=x86_64-unknown-linux-gnu", 0, []], [[], [["CHW", 2, "local"], ["SP", 2, 0, 706, [1, 353, 1, 1], 1], ["SP", 2, 5, 4096, [16, 2, 1, 2], 1], ["SP", 2, 10, 4096, [2, 2], 1], ["RE", 2, [0, 5, 1, 6, 2, 7, 10, 11, 3, 8, 12, 4, 9]], ["FSP", 3, 0, 1, 3], ["FSP", 3, 4, 2, 3], ["RE", 3, [0, 4, 1, 5, 2, 6, 3, 7]], ["CA", 2, 3, 5], ["CHR", 1, "shared", [2]], ["CA", 2, 3, 6], ["CHR", 0, "shared", [3]], ["CA", 1, 4, 6], ["FU", 5, [0, 1]], ["AN", 5, 0, 5], ["FU", 5, [1, 2]], ["AN", 5, 1, 4], ["FU", 5, [2, 3]], ["AN", 5, 2, 6], ["FU", 3, [0, 1]], ["SP", 3, 0, 16, [1], 1], ["AN", 3, 1, 2], ["FFSP", 3, 0, [2, 1], 1, 1], ["AN", 3, 1, 6], ["FU", 1, [0, 1]], ["SP", 1, 0, 4, [4], 1], ["AN", 1, 1, 2], ["FFSP", 1, 0, [2, 1], 1, 1], ["AN", 1, 1, 6], ["PR", 4, 0, "auto_unroll_max_step$16"]]]], "r": [[0.0015664, 0.00156671, 0.00156679], 0, 3.66212, 1759469124], "v": "v0.6"}
{"i": [["[\"ansor_mm\", 706, 4096, 4096, \"float16\"]", "rocm -keys=rocm,gpu -max_num_threads=256 -max_shared_memory_per_block=49152 -max_threads_per_block=1024 -mcpu=gfx942 -model=unknown -mtriple=amdgcn-amd-amdhsa-hcc -thread_warp_size=64", [-1, 16, 64, 65536, 2147483647, 1024, 16, 64], "llvm -keys=cpu -mtriple=x86_64-unknown-linux-gnu", 0, []], [[], [["CHW", 2, "local"], ["SP", 2, 0, 706, [1, 353, 1, 2], 1], ["SP", 2, 5, 4096, [1, 2, 2, 64], 1], ["SP", 2, 10, 4096, [4, 2], 1], ["RE", 2, [0, 5, 1, 6, 2, 7, 10, 11, 3, 8, 12, 4, 9]], ["FSP", 3, 0, 1, 3], ["FSP", 3, 4, 2, 3], ["RE", 3, [0, 4, 1, 5, 2, 6, 3, 7]], ["CA", 2, 3, 5], ["CHR", 1, "shared", [2]], ["CA", 2, 3, 6], ["CHR", 0, "shared", [3]], ["CA", 1, 4, 6], ["FU", 5, [0, 1]], ["AN", 5, 0, 5], ["FU", 5, [1, 2]], ["AN", 5, 1, 4], ["FU", 5, [2, 3]], ["AN", 5, 2, 6], ["FU", 3, [0, 1]], ["SP", 3, 0, 1024, [1], 1], ["AN", 3, 1, 2], ["FFSP", 3, 0, [2, 1], 1, 1], ["AN", 3, 1, 6], ["FU", 1, [0, 1]], ["SP", 1, 0, 16, [1], 1], ["AN", 1, 1, 2], ["FFSP", 1, 0, [2, 1], 1, 1], ["AN", 1, 1, 6], ["PR", 4, 0, "auto_unroll_max_step$0"]]]], "r": [[0.0159714, 0.0159414, 0.0159755], 0, 4.01818, 1759469125], "v": "v0.6"}
{"i": [["[\"ansor_mm\", 706, 4096, 4096, \"float16\"]", "rocm -keys=rocm,gpu -max_num_threads=256 -max_shared_memory_per_block=49152 -max_threads_per_block=1024 -mcpu=gfx942 -model=unknown -mtriple=amdgcn-amd-amdhsa-hcc -thread_warp_size=64", [-1, 16, 64, 65536, 2147483647, 1024, 16, 64], "llvm -keys=cpu -mtriple=x86_64-unknown-linux-gnu", 0, []], [[], [["CHW", 2, "local"], ["SP", 2, 0, 706, [1, 2, 1, 1], 1], ["SP", 2, 5, 4096, [2, 32, 8, 8], 1], ["SP", 2, 10, 4096, [1, 1], 1], ["RE", 2, [0, 5, 1, 6, 2, 7, 10, 11, 3, 8, 12, 4, 9]], ["FSP", 3, 0, 1, 3], ["FSP", 3, 4, 2, 3], ["RE", 3, [0, 4, 1, 5, 2, 6, 3, 7]], ["CA", 2, 3, 5], ["CHR", 1, "shared", [2]], ["CA", 2, 3, 6], ["CHR", 0, "shared", [3]], ["CA", 1, 4, 6], ["FU", 5, [0, 1]], ["AN", 5, 0, 5], ["FU", 5, [1, 2]], ["AN", 5, 1, 4], ["FU", 5, [2, 3]], ["AN", 5, 2, 6], ["FU", 3, [0, 1]], ["SP", 3, 0, 64, [1], 1], ["AN", 3, 1, 2], ["FFSP", 3, 0, [2, 1], 1, 1], ["AN", 3, 1, 6], ["FU", 1, [0, 1]], ["SP", 1, 0, 1, [1], 1], ["AN", 1, 1, 2], ["FFSP", 1, 0, [2, 1], 1, 1], ["AN", 1, 1, 6], ["PR", 4, 0, "auto_unroll_max_step$16"]]]], "r": [[0.0208081, 0.0208091, 0.0208104], 0, 4.0952, 1759469127], "v": "v0.6"}
{"i": [["[\"ansor_mm\", 706, 4096, 4096, \"float16\"]", "rocm -keys=rocm,gpu -max_num_threads=256 -max_shared_memory_per_block=49152 -max_threads_per_block=1024 -mcpu=gfx942 -model=unknown -mtriple=amdgcn-amd-amdhsa-hcc -thread_warp_size=64", [-1, 16, 64, 65536, 2147483647, 1024, 16, 64], "llvm -keys=cpu -mtriple=x86_64-unknown-linux-gnu", 0, []], [[], [["CHW", 2, "local"], ["SP", 2, 0, 706, [1, 353, 2, 1], 1], ["SP", 2, 5, 4096, [1, 1, 64, 4], 1], ["SP", 2, 10, 4096, [1, 32], 1], ["RE", 2, [0, 5, 1, 6, 2, 7, 10, 11, 3, 8, 12, 4, 9]], ["FSP", 3, 0, 1, 3], ["FSP", 3, 4, 2, 3], ["RE", 3, [0, 4, 1, 5, 2, 6, 3, 7]], ["CA", 2, 3, 5], ["CHR", 1, "shared", [2]], ["CA", 2, 3, 6], ["CHR", 0, "shared", [3]], ["CA", 1, 4, 6], ["FU", 5, [0, 1]], ["AN", 5, 0, 5], ["FU", 5, [1, 2]], ["AN", 5, 1, 4], ["FU", 5, [2, 3]], ["AN", 5, 2, 6], ["FU", 3, [0, 1]], ["SP", 3, 0, 8192, [1], 1], ["AN", 3, 1, 2], ["FFSP", 3, 0, [2, 1], 1, 1], ["AN", 3, 1, 6], ["FU", 1, [0, 1]], ["SP", 1, 0, 64, [1], 1], ["AN", 1, 1, 2], ["FFSP", 1, 0, [2, 1], 1, 1], ["AN", 1, 1, 6], ["PR", 4, 0, "auto_unroll_max_step$64"]]]], "r": [[0.0164481, 0.0164004, 0.0164311], 0, 4.25034, 1759469128], "v": "v0.6"}
{"i": [["[\"ansor_mm\", 706, 4096, 4096, \"float16\"]", "rocm -keys=rocm,gpu -max_num_threads=256 -max_shared_memory_per_block=49152 -max_threads_per_block=1024 -mcpu=gfx942 -model=unknown -mtriple=amdgcn-amd-amdhsa-hcc -thread_warp_size=64", [-1, 16, 64, 65536, 2147483647, 1024, 16, 64], "llvm -keys=cpu -mtriple=x86_64-unknown-linux-gnu", 0, []], [[], [["CHW", 2, "local"], ["SP", 2, 0, 706, [1, 353, 1, 1], 1], ["SP", 2, 5, 4096, [8, 1, 16, 8], 1], ["SP", 2, 10, 4096, [1, 2], 1], ["RE", 2, [0, 5, 1, 6, 2, 7, 10, 11, 3, 8, 12, 4, 9]], ["FSP", 3, 0, 1, 3], ["FSP", 3, 4, 2, 3], ["RE", 3, [0, 4, 1, 5, 2, 6, 3, 7]], ["CA", 2, 3, 5], ["CHR", 1, "shared", [2]], ["CA", 2, 3, 6], ["CHR", 0, "shared", [3]], ["CA", 1, 4, 6], ["FU", 5, [0, 1]], ["AN", 5, 0, 5], ["FU", 5, [1, 2]], ["AN", 5, 1, 4], ["FU", 5, [2, 3]], ["AN", 5, 2, 6], ["FU", 3, [0, 1]], ["SP", 3, 0, 256, [1], 1], ["AN", 3, 1, 2], ["FFSP", 3, 0, [2, 1], 1, 1], ["AN", 3, 1, 6], ["FU", 1, [0, 1]], ["SP", 1, 0, 2, [1], 1], ["AN", 1, 1, 2], ["FFSP", 1, 0, [2, 1], 1, 1], ["AN", 1, 1, 6], ["PR", 4, 0, "auto_unroll_max_step$64"]]]], "r": [[0.097031, 0.097024, 0.0970909], 0, 6.95168, 1759469132], "v": "v0.6"}
{"i": [["[\"ansor_mm\", 706, 4096, 4096, \"float16\"]", "rocm -keys=rocm,gpu -max_num_threads=256 -max_shared_memory_per_block=49152 -max_threads_per_block=1024 -mcpu=gfx942 -model=unknown -mtriple=amdgcn-amd-amdhsa-hcc -thread_warp_size=64", [-1, 16, 64, 65536, 2147483647, 1024, 16, 64], "llvm -keys=cpu -mtriple=x86_64-unknown-linux-gnu", 0, []], [[], [["CHW", 2, "local"], ["SP", 2, 0, 706, [1, 353, 1, 1], 1], ["SP", 2, 5, 4096, [1, 2, 32, 1], 1], ["SP", 2, 10, 4096, [16, 4], 1], ["RE", 2, [0, 5, 1, 6, 2, 7, 10, 11, 3, 8, 12, 4, 9]], ["FSP", 3, 0, 1, 3], ["FSP", 3, 4, 2, 3], ["RE", 3, [0, 4, 1, 5, 2, 6, 3, 7]], ["CA", 2, 3, 5], ["CHR", 1, "shared", [2]], ["CA", 2, 3, 6], ["CHR", 0, "shared", [3]], ["CA", 1, 4, 6], ["FU", 5, [0, 1]], ["AN", 5, 0, 5], ["FU", 5, [1, 2]], ["AN", 5, 1, 4], ["FU", 5, [2, 3]], ["AN", 5, 2, 6], ["FU", 3, [0, 1]], ["SP", 3, 0, 2048, [8], 1], ["AN", 3, 1, 2], ["FFSP", 3, 0, [2, 1], 1, 1], ["AN", 3, 1, 6], ["FU", 1, [0, 1]], ["SP", 1, 0, 64, [1], 1], ["AN", 1, 1, 2], ["FFSP", 1, 0, [2, 1], 1, 1], ["AN", 1, 1, 6], ["PR", 4, 0, "auto_unroll_max_step$512"]]]], "r": [[0.00111994, 0.00111958, 0.00111975], 0, 4.05055, 1759469133], "v": "v0.6"}
{"i": [["[\"ansor_mm\", 706, 4096, 4096, \"float16\"]", "rocm -keys=rocm,gpu -max_num_threads=256 -max_shared_memory_per_block=49152 -max_threads_per_block=1024 -mcpu=gfx942 -model=unknown -mtriple=amdgcn-amd-amdhsa-hcc -thread_warp_size=64", [-1, 16, 64, 65536, 2147483647, 1024, 16, 64], "llvm -keys=cpu -mtriple=x86_64-unknown-linux-gnu", 0, []], [[], [["CHW", 2, "local"], ["SP", 2, 0, 706, [1, 1, 1, 2], 1], ["SP", 2, 5, 4096, [16, 2, 1, 2], 1], ["SP", 2, 10, 4096, [32, 1], 1], ["RE", 2, [0, 5, 1, 6, 2, 7, 10, 11, 3, 8, 12, 4, 9]], ["FSP", 3, 0, 1, 3], ["FSP", 3, 4, 2, 3], ["RE", 3, [0, 4, 1, 5, 2, 6, 3, 7]], ["CA", 2, 3, 5], ["CHR", 1, "shared", [2]], ["CA", 2, 3, 6], ["CHR", 0, "shared", [3]], ["CA", 1, 4, 6], ["FU", 5, [0, 1]], ["AN", 5, 0, 5], ["FU", 5, [1, 2]], ["AN", 5, 1, 4], ["FU", 5, [2, 3]], ["AN", 5, 2, 6], ["FU", 3, [0, 1]], ["SP", 3, 0, 64, [1], 1], ["AN", 3, 1, 2], ["FFSP", 3, 0, [2, 1], 1, 1], ["AN", 3, 1, 6], ["FU", 1, [0, 1]], ["SP", 1, 0, 64, [8], 1], ["AN", 1, 1, 2], ["FFSP", 1, 0, [2, 1], 1, 1], ["AN", 1, 1, 6], ["PR", 4, 0, "auto_unroll_max_step$64"]]]], "r": [[0.0560762, 0.0567498, 0.0567191], 0, 5.10623, 1759469135], "v": "v0.6"}
{"i": [["[\"ansor_mm\", 706, 4096, 4096, \"float16\"]", "rocm -keys=rocm,gpu -max_num_threads=256 -max_shared_memory_per_block=49152 -max_threads_per_block=1024 -mcpu=gfx942 -model=unknown -mtriple=amdgcn-amd-amdhsa-hcc -thread_warp_size=64", [-1, 16, 64, 65536, 2147483647, 1024, 16, 64], "llvm -keys=cpu -mtriple=x86_64-unknown-linux-gnu", 0, []], [[], [["CHW", 2, "local"], ["SP", 2, 0, 706, [1, 353, 1, 1], 1], ["SP", 2, 5, 4096, [1, 1, 2, 1], 1], ["SP", 2, 10, 4096, [16, 4], 1], ["RE", 2, [0, 5, 1, 6, 2, 7, 10, 11, 3, 8, 12, 4, 9]], ["FSP", 3, 0, 1, 3], ["FSP", 3, 4, 2, 3], ["RE", 3, [0, 4, 1, 5, 2, 6, 3, 7]], ["CA", 2, 3, 5], ["CHR", 1, "shared", [2]], ["CA", 2, 3, 6], ["CHR", 0, "shared", [3]], ["CA", 1, 4, 6], ["FU", 5, [0, 1]], ["AN", 5, 0, 5], ["FU", 5, [1, 2]], ["AN", 5, 1, 4], ["FU", 5, [2, 3]], ["AN", 5, 2, 6], ["FU", 3, [0, 1]], ["SP", 3, 0, 128, [1], 1], ["AN", 3, 1, 2], ["FFSP", 3, 0, [2, 1], 1, 1], ["AN", 3, 1, 6], ["FU", 1, [0, 1]], ["SP", 1, 0, 64, [1], 1], ["AN", 1, 1, 2], ["FFSP", 1, 0, [2, 1], 1, 1], ["AN", 1, 1, 6], ["PR", 4, 0, "auto_unroll_max_step$1024"]]]], "r": [[0.0144731, 0.0144839, 0.0144879], 0, 4.00545, 1759469136], "v": "v0.6"}
{"i": [["[\"ansor_mm\", 706, 4096, 4096, \"float16\"]", "rocm -keys=rocm,gpu -max_num_threads=256 -max_shared_memory_per_block=49152 -max_threads_per_block=1024 -mcpu=gfx942 -model=unknown -mtriple=amdgcn-amd-amdhsa-hcc -thread_warp_size=64", [-1, 16, 64, 65536, 2147483647, 1024, 16, 64], "llvm -keys=cpu -mtriple=x86_64-unknown-linux-gnu", 0, []], [[], [["CHW", 2, "local"], ["SP", 2, 0, 706, [1, 353, 1, 1], 1], ["SP", 2, 5, 4096, [1, 1, 2, 1], 1], ["SP", 2, 10, 4096, [8, 4], 1], ["RE", 2, [0, 5, 1, 6, 2, 7, 10, 11, 3, 8, 12, 4, 9]], ["FSP", 3, 0, 1, 3], ["FSP", 3, 4, 2, 3], ["RE", 3, [0, 4, 1, 5, 2, 6, 3, 7]], ["CA", 2, 3, 5], ["CHR", 1, "shared", [2]], ["CA", 2, 3, 6], ["CHR", 0, "shared", [3]], ["CA", 1, 4, 6], ["FU", 5, [0, 1]], ["AN", 5, 0, 5], ["FU", 5, [1, 2]], ["AN", 5, 1, 4], ["FU", 5, [2, 3]], ["AN", 5, 2, 6], ["FU", 3, [0, 1]], ["SP", 3, 0, 128, [4], 1], ["AN", 3, 1, 2], ["FFSP", 3, 0, [2, 1], 1, 1], ["AN", 3, 1, 6], ["FU", 1, [0, 1]], ["SP", 1, 0, 64, [8], 1], ["AN", 1, 1, 2], ["FFSP", 1, 0, [2, 1], 1, 1], ["AN", 1, 1, 6], ["PR", 4, 0, "auto_unroll_max_step$1024"]]]], "r": [[0.00193571, 0.00193961, 0.00194368], 0, 3.92658, 1759469138], "v": "v0.6"}
{"i": [["[\"ansor_mm\", 706, 4096, 4096, \"float16\"]", "rocm -keys=rocm,gpu -max_num_threads=256 -max_shared_memory_per_block=49152 -max_threads_per_block=1024 -mcpu=gfx942 -model=unknown -mtriple=amdgcn-amd-amdhsa-hcc -thread_warp_size=64", [-1, 16, 64, 65536, 2147483647, 1024, 16, 64], "llvm -keys=cpu -mtriple=x86_64-unknown-linux-gnu", 0, []], [[], [["CHW", 2, "local"], ["SP", 2, 0, 706, [1, 353, 1, 1], 1], ["SP", 2, 5, 4096, [2, 2, 32, 16], 1], ["SP", 2, 10, 4096, [8, 1], 1], ["RE", 2, [0, 5, 1, 6, 2, 7, 10, 11, 3, 8, 12, 4, 9]], ["FSP", 3, 0, 1, 3], ["FSP", 3, 4, 2, 3], ["RE", 3, [0, 4, 1, 5, 2, 6, 3, 7]], ["CA", 2, 3, 5], ["CHR", 1, "shared", [2]], ["CA", 2, 3, 6], ["CHR", 0, "shared", [3]], ["CA", 1, 4, 6], ["FU", 5, [0, 1]], ["AN", 5, 0, 5], ["FU", 5, [1, 2]], ["AN", 5, 1, 4], ["FU", 5, [2, 3]], ["AN", 5, 2, 6], ["FU", 3, [0, 1]], ["SP", 3, 0, 4096, [1], 1], ["AN", 3, 1, 2], ["FFSP", 3, 0, [2, 1], 1, 1], ["AN", 3, 1, 6], ["FU", 1, [0, 1]], ["SP", 1, 0, 8, [1], 1], ["AN", 1, 1, 2], ["FFSP", 1, 0, [2, 1], 1, 1], ["AN", 1, 1, 6], ["PR", 4, 0, "auto_unroll_max_step$0"]]]], "r": [[0.739326, 0.738853, 0.739965], 0, 26.4366, 1759469161], "v": "v0.6"}
{"i": [["[\"ansor_mm\", 706, 4096, 4096, \"float16\"]", "rocm -keys=rocm,gpu -max_num_threads=256 -max_shared_memory_per_block=49152 -max_threads_per_block=1024 -mcpu=gfx942 -model=unknown -mtriple=amdgcn-amd-amdhsa-hcc -thread_warp_size=64", [-1, 16, 64, 65536, 2147483647, 1024, 16, 64], "llvm -keys=cpu -mtriple=x86_64-unknown-linux-gnu", 0, []], [[], [["CHW", 2, "local"], ["SP", 2, 0, 706, [1, 353, 1, 1], 1], ["SP", 2, 5, 4096, [1, 2, 32, 1], 1], ["SP", 2, 10, 4096, [16, 4], 1], ["RE", 2, [0, 5, 1, 6, 2, 7, 10, 11, 3, 8, 12, 4, 9]], ["FSP", 3, 0, 1, 3], ["FSP", 3, 4, 2, 3], ["RE", 3, [0, 4, 1, 5, 2, 6, 3, 7]], ["CA", 2, 3, 5], ["CHR", 1, "shared", [2]], ["CA", 2, 3, 6], ["CHR", 0, "shared", [3]], ["CA", 1, 4, 6], ["FU", 5, [0, 1]], ["AN", 5, 0, 5], ["FU", 5, [1, 2]], ["AN", 5, 1, 4], ["FU", 5, [2, 3]], ["AN", 5, 2, 6], ["FU", 3, [0, 1]], ["SP", 3, 0, 2048, [1], 1], ["AN", 3, 1, 2], ["FFSP", 3, 0, [2, 1], 1, 1], ["AN", 3, 1, 6], ["FU", 1, [0, 1]], ["SP", 1, 0, 64, [1], 1], ["AN", 1, 1, 2], ["FFSP", 1, 0, [2, 1], 1, 1], ["AN", 1, 1, 6], ["PR", 4, 0, "auto_unroll_max_step$512"]]]], "r": [[0.00112959, 0.00112993, 0.00113008], 0, 4.04929, 1759469162], "v": "v0.6"}
{"i": [["[\"ansor_mm\", 706, 4096, 4096, \"float16\"]", "rocm -keys=rocm,gpu -max_num_threads=256 -max_shared_memory_per_block=49152 -max_threads_per_block=1024 -mcpu=gfx942 -model=unknown -mtriple=amdgcn-amd-amdhsa-hcc -thread_warp_size=64", [-1, 16, 64, 65536, 2147483647, 1024, 16, 64], "llvm -keys=cpu -mtriple=x86_64-unknown-linux-gnu", 0, []], [[], [["CHW", 2, "local"], ["SP", 2, 0, 706, [1, 1, 353, 1], 1], ["SP", 2, 5, 4096, [16, 8, 1, 4], 1], ["SP", 2, 10, 4096, [4, 1], 1], ["RE", 2, [0, 5, 1, 6, 2, 7, 10, 11, 3, 8, 12, 4, 9]], ["FSP", 3, 0, 1, 3], ["FSP", 3, 4, 2, 3], ["RE", 3, [0, 4, 1, 5, 2, 6, 3, 7]], ["CA", 2, 3, 5], ["CHR", 1, "shared", [2]], ["CA", 2, 3, 6], ["CHR", 0, "shared", [3]], ["CA", 1, 4, 6], ["FU", 5, [0, 1]], ["AN", 5, 0, 5], ["FU", 5, [1, 2]], ["AN", 5, 1, 4], ["FU", 5, [2, 3]], ["AN", 5, 2, 6], ["FU", 3, [0, 1]], ["SP", 3, 0, 16, [1], 1], ["AN", 3, 1, 2], ["FFSP", 3, 0, [2, 1], 1, 1], ["AN", 3, 1, 6], ["FU", 1, [0, 1]], ["SP", 1, 0, 4, [1], 1], ["AN", 1, 1, 2], ["FFSP", 1, 0, [2, 1], 1, 1], ["AN", 1, 1, 6], ["PR", 4, 0, "auto_unroll_max_step$16"]]]], "r": [[0.839229, 0.837792, 0.838689], 0, 30.0553, 1759469189], "v": "v0.6"}
{"i": [["[\"ansor_mm\", 706, 4096, 4096, \"float16\"]", "rocm -keys=rocm,gpu -max_num_threads=256 -max_shared_memory_per_block=49152 -max_threads_per_block=1024 -mcpu=gfx942 -model=unknown -mtriple=amdgcn-amd-amdhsa-hcc -thread_warp_size=64", [-1, 16, 64, 65536, 2147483647, 1024, 16, 64], "llvm -keys=cpu -mtriple=x86_64-unknown-linux-gnu", 0, []], [[], [["CHW", 2, "local"], ["SP", 2, 0, 706, [2, 353, 1, 1], 1], ["SP", 2, 5, 4096, [1, 1, 32, 8], 1], ["SP", 2, 10, 4096, [8, 4], 1], ["RE", 2, [0, 5, 1, 6, 2, 7, 10, 11, 3, 8, 12, 4, 9]], ["FSP", 3, 0, 1, 3], ["FSP", 3, 4, 2, 3], ["RE", 3, [0, 4, 1, 5, 2, 6, 3, 7]], ["CA", 2, 3, 5], ["CHR", 1, "shared", [2]], ["CA", 2, 3, 6], ["CHR", 0, "shared", [3]], ["CA", 1, 4, 6], ["FU", 5, [0, 1]], ["AN", 5, 0, 5], ["FU", 5, [1, 2]], ["AN", 5, 1, 4], ["FU", 5, [2, 3]], ["AN", 5, 2, 6], ["FU", 3, [0, 1]], ["SP", 3, 0, 8192, [1], 1], ["AN", 3, 1, 2], ["FFSP", 3, 0, [2, 1], 1, 1], ["AN", 3, 1, 6], ["FU", 1, [0, 1]], ["SP", 1, 0, 64, [1], 1], ["AN", 1, 1, 2], ["FFSP", 1, 0, [2, 1], 1, 1], ["AN", 1, 1, 6], ["PR", 4, 0, "auto_unroll_max_step$0"]]]], "r": [[0.292094, 0.292444, 0.292085], 0, 12.8559, 1759469199], "v": "v0.6"}
{"i": [["[\"ansor_mm\", 706, 4096, 4096, \"float16\"]", "rocm -keys=rocm,gpu -max_num_threads=256 -max_shared_memory_per_block=49152 -max_threads_per_block=1024 -mcpu=gfx942 -model=unknown -mtriple=amdgcn-amd-amdhsa-hcc -thread_warp_size=64", [-1, 16, 64, 65536, 2147483647, 1024, 16, 64], "llvm -keys=cpu -mtriple=x86_64-unknown-linux-gnu", 0, []], [[], [["CHW", 2, "local"], ["SP", 2, 0, 706, [1, 1, 1, 1], 1], ["SP", 2, 5, 4096, [1, 128, 4, 1], 1], ["SP", 2, 10, 4096, [1, 32], 1], ["RE", 2, [0, 5, 1, 6, 2, 7, 10, 11, 3, 8, 12, 4, 9]], ["FSP", 3, 0, 1, 3], ["FSP", 3, 4, 2, 3], ["RE", 3, [0, 4, 1, 5, 2, 6, 3, 7]], ["CA", 2, 3, 5], ["CHR", 1, "shared", [2]], ["CA", 2, 3, 6], ["CHR", 0, "shared", [3]], ["CA", 1, 4, 6], ["FU", 5, [0, 1]], ["AN", 5, 0, 5], ["FU", 5, [1, 2]], ["AN", 5, 1, 4], ["FU", 5, [2, 3]], ["AN", 5, 2, 6], ["FU", 3, [0, 1]], ["SP", 3, 0, 128, [2], 1], ["AN", 3, 1, 2], ["FFSP", 3, 0, [2, 1], 1, 1], ["AN", 3, 1, 6], ["FU", 1, [0, 1]], ["SP", 1, 0, 32, [1], 1], ["AN", 1, 1, 2], ["FFSP", 1, 0, [2, 1], 1, 1], ["AN", 1, 1, 6], ["PR", 4, 0, "auto_unroll_max_step$0"]]]], "r": [[0.0115995, 0.0116025, 0.0116028], 0, 3.75231, 1759469200], "v": "v0.6"}
{"i": [["[\"ansor_mm\", 706, 4096, 4096, \"float16\"]", "rocm -keys=rocm,gpu -max_num_threads=256 -max_shared_memory_per_block=49152 -max_threads_per_block=1024 -mcpu=gfx942 -model=unknown -mtriple=amdgcn-amd-amdhsa-hcc -thread_warp_size=64", [-1, 16, 64, 65536, 2147483647, 1024, 16, 64], "llvm -keys=cpu -mtriple=x86_64-unknown-linux-gnu", 0, []], [[], [["CHW", 2, "local"], ["SP", 2, 0, 706, [1, 1, 353, 1], 1], ["SP", 2, 5, 4096, [16, 2, 1, 4], 1], ["SP", 2, 10, 4096, [2, 1], 1], ["RE", 2, [0, 5, 1, 6, 2, 7, 10, 11, 3, 8, 12, 4, 9]], ["FSP", 3, 0, 1, 3], ["FSP", 3, 4, 2, 3], ["RE", 3, [0, 4, 1, 5, 2, 6, 3, 7]], ["CA", 2, 3, 5], ["CHR", 1, "shared", [2]], ["CA", 2, 3, 6], ["CHR", 0, "shared", [3]], ["CA", 1, 4, 6], ["FU", 5, [0, 1]], ["AN", 5, 0, 5], ["FU", 5, [1, 2]], ["AN", 5, 1, 4], ["FU", 5, [2, 3]], ["AN", 5, 2, 6], ["FU", 3, [0, 1]], ["SP", 3, 0, 16, [1], 1], ["AN", 3, 1, 2], ["FFSP", 3, 0, [2, 1], 1, 1], ["AN", 3, 1, 6], ["FU", 1, [0, 1]], ["SP", 1, 0, 4, [1], 1], ["AN", 1, 1, 2], ["FFSP", 1, 0, [2, 1], 1, 1], ["AN", 1, 1, 6], ["PR", 4, 0, "auto_unroll_max_step$16"]]]], "r": [[0.810635, 0.810904, 0.810295], 0, 29.2245, 1759469226], "v": "v0.6"}
{"i": [["[\"ansor_mm\", 706, 4096, 4096, \"float16\"]", "rocm -keys=rocm,gpu -max_num_threads=256 -max_shared_memory_per_block=49152 -max_threads_per_block=1024 -mcpu=gfx942 -model=unknown -mtriple=amdgcn-amd-amdhsa-hcc -thread_warp_size=64", [-1, 16, 64, 65536, 2147483647, 1024, 16, 64], "llvm -keys=cpu -mtriple=x86_64-unknown-linux-gnu", 0, []], [[], [["CHW", 2, "local"], ["SP", 2, 0, 706, [1, 1, 1, 2], 1], ["SP", 2, 5, 4096, [4, 128, 4, 1], 1], ["SP", 2, 10, 4096, [1, 2], 1], ["RE", 2, [0, 5, 1, 6, 2, 7, 10, 11, 3, 8, 12, 4, 9]], ["FSP", 3, 0, 1, 3], ["FSP", 3, 4, 2, 3], ["RE", 3, [0, 4, 1, 5, 2, 6, 3, 7]], ["CA", 2, 3, 5], ["CHR", 1, "shared", [2]], ["CA", 2, 3, 6], ["CHR", 0, "shared", [3]], ["CA", 1, 4, 6], ["FU", 5, [0, 1]], ["AN", 5, 0, 5], ["FU", 5, [1, 2]], ["AN", 5, 1, 4], ["FU", 5, [2, 3]], ["AN", 5, 2, 6], ["FU", 3, [0, 1]], ["SP", 3, 0, 8, [1], 1], ["AN", 3, 1, 2], ["FFSP", 3, 0, [2, 1], 1, 1], ["AN", 3, 1, 6], ["FU", 1, [0, 1]], ["SP", 1, 0, 4, [2], 1], ["AN", 1, 1, 2], ["FFSP", 1, 0, [2, 1], 1, 1], ["AN", 1, 1, 6], ["PR", 4, 0, "auto_unroll_max_step$0"]]]], "r": [[0.00200629, 0.00200009, 0.00200126], 0, 3.80561, 1759469227], "v": "v0.6"}
{"i": [["[\"ansor_mm\", 706, 4096, 4096, \"float16\"]", "rocm -keys=rocm,gpu -max_num_threads=256 -max_shared_memory_per_block=49152 -max_threads_per_block=1024 -mcpu=gfx942 -model=unknown -mtriple=amdgcn-amd-amdhsa-hcc -thread_warp_size=64", [-1, 16, 64, 65536, 2147483647, 1024, 16, 64], "llvm -keys=cpu -mtriple=x86_64-unknown-linux-gnu", 0, []], [[], [["CHW", 2, "local"], ["SP", 2, 0, 706, [1, 2, 1, 1], 1], ["SP", 2, 5, 4096, [1, 256, 16, 1], 1], ["SP", 2, 10, 4096, [1, 1], 1], ["RE", 2, [0, 5, 1, 6, 2, 7, 10, 11, 3, 8, 12, 4, 9]], ["FSP", 3, 0, 1, 3], ["FSP", 3, 4, 2, 3], ["RE", 3, [0, 4, 1, 5, 2, 6, 3, 7]], ["CA", 2, 3, 5], ["CHR", 1, "shared", [2]], ["CA", 2, 3, 6], ["CHR", 0, "shared", [3]], ["CA", 1, 4, 6], ["FU", 5, [0, 1]], ["AN", 5, 0, 5], ["FU", 5, [1, 2]], ["AN", 5, 1, 4], ["FU", 5, [2, 3]], ["AN", 5, 2, 6], ["FU", 3, [0, 1]], ["SP", 3, 0, 32, [1], 1], ["AN", 3, 1, 2], ["FFSP", 3, 0, [2, 1], 1, 1], ["AN", 3, 1, 6], ["FU", 1, [0, 1]], ["SP", 1, 0, 2, [1], 1], ["AN", 1, 1, 2], ["FFSP", 1, 0, [2, 1], 1, 1], ["AN", 1, 1, 6], ["PR", 4, 0, "auto_unroll_max_step$16"]]]], "r": [[0.00276461, 0.00276555, 0.00277091], 0, 3.67323, 1759469228], "v": "v0.6"}
{"i": [["[\"ansor_mm\", 706, 4096, 4096, \"float16\"]", "rocm -keys=rocm,gpu -max_num_threads=256 -max_shared_memory_per_block=49152 -max_threads_per_block=1024 -mcpu=gfx942 -model=unknown -mtriple=amdgcn-amd-amdhsa-hcc -thread_warp_size=64", [-1, 16, 64, 65536, 2147483647, 1024, 16, 64], "llvm -keys=cpu -mtriple=x86_64-unknown-linux-gnu", 0, []], [[], [["CHW", 2, "local"], ["SP", 2, 0, 706, [1, 1, 706, 1], 1], ["SP", 2, 5, 4096, [2, 16, 1, 16], 1], ["SP", 2, 10, 4096, [16, 1], 1], ["RE", 2, [0, 5, 1, 6, 2, 7, 10, 11, 3, 8, 12, 4, 9]], ["FSP", 3, 0, 1, 3], ["FSP", 3, 4, 2, 3], ["RE", 3, [0, 4, 1, 5, 2, 6, 3, 7]], ["CA", 2, 3, 5], ["CHR", 1, "shared", [2]], ["CA", 2, 3, 6], ["CHR", 0, "shared", [3]], ["CA", 1, 4, 6], ["FU", 5, [0, 1]], ["AN", 5, 0, 5], ["FU", 5, [1, 2]], ["AN", 5, 1, 4], ["FU", 5, [2, 3]], ["AN", 5, 2, 6], ["FU", 3, [0, 1]], ["SP", 3, 0, 64, [1], 1], ["AN", 3, 1, 2], ["FFSP", 3, 0, [2, 1], 1, 1], ["AN", 3, 1, 6], ["FU", 1, [0, 1]], ["SP", 1, 0, 5648, [1], 1], ["AN", 1, 1, 2], ["FFSP", 1, 0, [2, 1], 1, 1], ["AN", 1, 1, 6], ["PR", 4, 0, "auto_unroll_max_step$16"]]]], "r": [[0.510509, 0.510836, 0.509537], 0, 19.5618, 1759469346], "v": "v0.6"}
{"i": [["[\"ansor_mm\", 706, 4096, 4096, \"float16\"]", "rocm -keys=rocm,gpu -max_num_threads=256 -max_shared_memory_per_block=49152 -max_threads_per_block=1024 -mcpu=gfx942 -model=unknown -mtriple=amdgcn-amd-amdhsa-hcc -thread_warp_size=64", [-1, 16, 64, 65536, 2147483647, 1024, 16, 64], "llvm -keys=cpu -mtriple=x86_64-unknown-linux-gnu", 0, []], [[], [["CHW", 2, "local"], ["SP", 2, 0, 706, [1, 706, 1, 1], 1], ["SP", 2, 5, 4096, [1, 1, 512, 2], 1], ["SP", 2, 10, 4096, [2, 2], 1], ["RE", 2, [0, 5, 1, 6, 2, 7, 10, 11, 3, 8, 12, 4, 9]], ["FSP", 3, 0, 1, 3], ["FSP", 3, 4, 2, 3], ["RE", 3, [0, 4, 1, 5, 2, 6, 3, 7]], ["CA", 2, 3, 5], ["CHR", 1, "shared", [2]], ["CA", 2, 3, 6], ["CHR", 0, "shared", [3]], ["CA", 1, 4, 6], ["FU", 5, [0, 1]], ["AN", 5, 0, 5], ["FU", 5, [1, 2]], ["AN", 5, 1, 4], ["FU", 5, [2, 3]], ["AN", 5, 2, 6], ["FU", 3, [0, 1]], ["SP", 3, 0, 2048, [1], 1], ["AN", 3, 1, 2], ["FFSP", 3, 0, [2, 1], 1, 1], ["AN", 3, 1, 6], ["FU", 1, [0, 1]], ["SP", 1, 0, 4, [1], 1], ["AN", 1, 1, 2], ["FFSP", 1, 0, [2, 1], 1, 1], ["AN", 1, 1, 6], ["PR", 4, 0, "auto_unroll_max_step$1024"]]]], "r": [[0.372956, 0.372971, 0.372774], 0, 15.0205, 1759469358], "v": "v0.6"}
{"i": [["[\"ansor_mm\", 706, 4096, 4096, \"float16\"]", "rocm -keys=rocm,gpu -max_num_threads=256 -max_shared_memory_per_block=49152 -max_threads_per_block=1024 -mcpu=gfx942 -model=unknown -mtriple=amdgcn-amd-amdhsa-hcc -thread_warp_size=64", [-1, 16, 64, 65536, 2147483647, 1024, 16, 64], "llvm -keys=cpu -mtriple=x86_64-unknown-linux-gnu", 0, []], [[], [["CHW", 2, "local"], ["SP", 2, 0, 706, [1, 353, 1, 2], 1], ["SP", 2, 5, 4096, [16, 2, 1, 8], 1], ["SP", 2, 10, 4096, [1, 1], 1], ["RE", 2, [0, 5, 1, 6, 2, 7, 10, 11, 3, 8, 12, 4, 9]], ["FSP", 3, 0, 1, 3], ["FSP", 3, 4, 2, 3], ["RE", 3, [0, 4, 1, 5, 2, 6, 3, 7]], ["CA", 2, 3, 5], ["CHR", 1, "shared", [2]], ["CA", 2, 3, 6], ["CHR", 0, "shared", [3]], ["CA", 1, 4, 6], ["FU", 5, [0, 1]], ["AN", 5, 0, 5], ["FU", 5, [1, 2]], ["AN", 5, 1, 4], ["FU", 5, [2, 3]], ["AN", 5, 2, 6], ["FU", 3, [0, 1]], ["SP", 3, 0, 64, [1], 1], ["AN", 3, 1, 2], ["FFSP", 3, 0, [2, 1], 1, 1], ["AN", 3, 1, 6], ["FU", 1, [0, 1]], ["SP", 1, 0, 16, [4], 1], ["AN", 1, 1, 2], ["FFSP", 1, 0, [2, 1], 1, 1], ["AN", 1, 1, 6], ["PR", 4, 0, "auto_unroll_max_step$16"]]]], "r": [[0.0222201, 0.0222558, 0.0222433], 0, 4.17788, 1759469359], "v": "v0.6"}
{"i": [["[\"ansor_mm\", 706, 4096, 4096, \"float16\"]", "rocm -keys=rocm,gpu -max_num_threads=256 -max_shared_memory_per_block=49152 -max_threads_per_block=1024 -mcpu=gfx942 -model=unknown -mtriple=amdgcn-amd-amdhsa-hcc -thread_warp_size=64", [-1, 16, 64, 65536, 2147483647, 1024, 16, 64], "llvm -keys=cpu -mtriple=x86_64-unknown-linux-gnu", 0, []], [[], [["CHW", 2, "local"], ["SP", 2, 0, 706, [1, 1, 353, 2], 1], ["SP", 2, 5, 4096, [1, 32, 2, 2], 1], ["SP", 2, 10, 4096, [2, 2], 1], ["RE", 2, [0, 5, 1, 6, 2, 7, 10, 11, 3, 8, 12, 4, 9]], ["FSP", 3, 0, 1, 3], ["FSP", 3, 4, 2, 3], ["RE", 3, [0, 4, 1, 5, 2, 6, 3, 7]], ["CA", 2, 3, 5], ["CHR", 1, "shared", [2]], ["CA", 2, 3, 6], ["CHR", 0, "shared", [3]], ["CA", 1, 4, 6], ["FU", 5, [0, 1]], ["AN", 5, 0, 5], ["FU", 5, [1, 2]], ["AN", 5, 1, 4], ["FU", 5, [2, 3]], ["AN", 5, 2, 6], ["FU", 3, [0, 1]], ["SP", 3, 0, 8, [1], 1], ["AN", 3, 1, 2], ["FFSP", 3, 0, [2, 1], 1, 1], ["AN", 3, 1, 6], ["FU", 1, [0, 1]], ["SP", 1, 0, 2824, [1], 1], ["AN", 1, 1, 2], ["FFSP", 1, 0, [2, 1], 1, 1], ["AN", 1, 1, 6], ["PR", 4, 0, "auto_unroll_max_step$16"]]]], "r": [[0.138225, 0.137197, 0.137994], 0, 7.75708, 1759469364], "v": "v0.6"}
{"i": [["[\"ansor_mm\", 706, 4096, 4096, \"float16\"]", "rocm -keys=rocm,gpu -max_num_threads=256 -max_shared_memory_per_block=49152 -max_threads_per_block=1024 -mcpu=gfx942 -model=unknown -mtriple=amdgcn-amd-amdhsa-hcc -thread_warp_size=64", [-1, 16, 64, 65536, 2147483647, 1024, 16, 64], "llvm -keys=cpu -mtriple=x86_64-unknown-linux-gnu", 0, []], [[], [["CHW", 2, "local"], ["SP", 2, 0, 706, [1, 353, 1, 1], 1], ["SP", 2, 5, 4096, [1, 1, 16, 2], 1], ["SP", 2, 10, 4096, [1, 1], 1], ["RE", 2, [0, 5, 1, 6, 2, 7, 10, 11, 3, 8, 12, 4, 9]], ["FSP", 3, 0, 1, 3], ["FSP", 3, 4, 2, 3], ["RE", 3, [0, 4, 1, 5, 2, 6, 3, 7]], ["CA", 2, 3, 5], ["CHR", 1, "shared", [2]], ["CA", 2, 3, 6], ["CHR", 0, "shared", [3]], ["CA", 1, 4, 6], ["FU", 5, [0, 1]], ["AN", 5, 0, 5], ["FU", 5, [1, 2]], ["AN", 5, 1, 4], ["FU", 5, [2, 3]], ["AN", 5, 2, 6], ["FU", 3, [0, 1]], ["SP", 3, 0, 32, [1], 1], ["AN", 3, 1, 2], ["FFSP", 3, 0, [2, 1], 1, 1], ["AN", 3, 1, 6], ["FU", 1, [0, 1]], ["SP", 1, 0, 1, [1], 1], ["AN", 1, 1, 2], ["FFSP", 1, 0, [2, 1], 1, 1], ["AN", 1, 1, 6], ["PR", 4, 0, "auto_unroll_max_step$512"]]]], "r": [[0.00311123, 0.00310986, 0.00311024], 0, 3.64053, 1759469365], "v": "v0.6"}
{"i": [["[\"ansor_mm\", 706, 4096, 4096, \"float16\"]", "rocm -keys=rocm,gpu -max_num_threads=256 -max_shared_memory_per_block=49152 -max_threads_per_block=1024 -mcpu=gfx942 -model=unknown -mtriple=amdgcn-amd-amdhsa-hcc -thread_warp_size=64", [-1, 16, 64, 65536, 2147483647, 1024, 16, 64], "llvm -keys=cpu -mtriple=x86_64-unknown-linux-gnu", 0, []], [[], [["CHW", 2, "local"], ["SP", 2, 0, 706, [1, 1, 1, 1], 1], ["SP", 2, 5, 4096, [2, 256, 1, 1], 1], ["SP", 2, 10, 4096, [2, 4], 1], ["RE", 2, [0, 5, 1, 6, 2, 7, 10, 11, 3, 8, 12, 4, 9]], ["FSP", 3, 0, 1, 3], ["FSP", 3, 4, 2, 3], ["RE", 3, [0, 4, 1, 5, 2, 6, 3, 7]], ["CA", 2, 3, 5], ["CHR", 1, "shared", [2]], ["CA", 2, 3, 6], ["CHR", 0, "shared", [3]], ["CA", 1, 4, 6], ["FU", 5, [0, 1]], ["AN", 5, 0, 5], ["FU", 5, [1, 2]], ["AN", 5, 1, 4], ["FU", 5, [2, 3]], ["AN", 5, 2, 6], ["FU", 3, [0, 1]], ["SP", 3, 0, 8, [1], 1], ["AN", 3, 1, 2], ["FFSP", 3, 0, [2, 1], 1, 1], ["AN", 3, 1, 6], ["FU", 1, [0, 1]], ["SP", 1, 0, 8, [1], 1], ["AN", 1, 1, 2], ["FFSP", 1, 0, [2, 1], 1, 1], ["AN", 1, 1, 6], ["PR", 4, 0, "auto_unroll_max_step$64"]]]], "r": [[0.00592857, 0.00592937, 0.00593087], 0, 3.71808, 1759469366], "v": "v0.6"}
{"i": [["[\"ansor_mm\", 706, 4096, 4096, \"float16\"]", "rocm -keys=rocm,gpu -max_num_threads=256 -max_shared_memory_per_block=49152 -max_threads_per_block=1024 -mcpu=gfx942 -model=unknown -mtriple=amdgcn-amd-amdhsa-hcc -thread_warp_size=64", [-1, 16, 64, 65536, 2147483647, 1024, 16, 64], "llvm -keys=cpu -mtriple=x86_64-unknown-linux-gnu", 0, []], [[], [["CHW", 2, "local"], ["SP", 2, 0, 706, [1, 1, 1, 1], 1], ["SP", 2, 5, 4096, [8, 128, 4, 1], 1], ["SP", 2, 10, 4096, [1, 2], 1], ["RE", 2, [0, 5, 1, 6, 2, 7, 10, 11, 3, 8, 12, 4, 9]], ["FSP", 3, 0, 1, 3], ["FSP", 3, 4, 2, 3], ["RE", 3, [0, 4, 1, 5, 2, 6, 3, 7]], ["CA", 2, 3, 5], ["CHR", 1, "shared", [2]], ["CA", 2, 3, 6], ["CHR", 0, "shared", [3]], ["CA", 1, 4, 6], ["FU", 5, [0, 1]], ["AN", 5, 0, 5], ["FU", 5, [1, 2]], ["AN", 5, 1, 4], ["FU", 5, [2, 3]], ["AN", 5, 2, 6], ["FU", 3, [0, 1]], ["SP", 3, 0, 8, [1], 1], ["AN", 3, 1, 2], ["FFSP", 3, 0, [2, 1], 1, 1], ["AN", 3, 1, 6], ["FU", 1, [0, 1]], ["SP", 1, 0, 4, [1], 1], ["AN", 1, 1, 2], ["FFSP", 1, 0, [2, 1], 1, 1], ["AN", 1, 1, 6], ["PR", 4, 0, "auto_unroll_max_step$0"]]]], "r": [[0.00460828, 0.00460813, 0.00460875], 0, 3.76393, 1759469367], "v": "v0.6"}
{"i": [["[\"ansor_mm\", 706, 4096, 4096, \"float16\"]", "rocm -keys=rocm,gpu -max_num_threads=256 -max_shared_memory_per_block=49152 -max_threads_per_block=1024 -mcpu=gfx942 -model=unknown -mtriple=amdgcn-amd-amdhsa-hcc -thread_warp_size=64", [-1, 16, 64, 65536, 2147483647, 1024, 16, 64], "llvm -keys=cpu -mtriple=x86_64-unknown-linux-gnu", 0, []], [[], [["CHW", 2, "local"], ["SP", 2, 0, 706, [1, 2, 1, 1], 1], ["SP", 2, 5, 4096, [1, 256, 2, 8], 1], ["SP", 2, 10, 4096, [2, 1], 1], ["RE", 2, [0, 5, 1, 6, 2, 7, 10, 11, 3, 8, 12, 4, 9]], ["FSP", 3, 0, 1, 3], ["FSP", 3, 4, 2, 3], ["RE", 3, [0, 4, 1, 5, 2, 6, 3, 7]], ["CA", 2, 3, 5], ["CHR", 1, "shared", [2]], ["CA", 2, 3, 6], ["CHR", 0, "shared", [3]], ["CA", 1, 4, 6], ["FU", 5, [0, 1]], ["AN", 5, 0, 5], ["FU", 5, [1, 2]], ["AN", 5, 1, 4], ["FU", 5, [2, 3]], ["AN", 5, 2, 6], ["FU", 3, [0, 1]], ["SP", 3, 0, 32, [2], 1], ["AN", 3, 1, 2], ["FFSP", 3, 0, [2, 1], 1, 1], ["AN", 3, 1, 6], ["FU", 1, [0, 1]], ["SP", 1, 0, 2, [1], 1], ["AN", 1, 1, 2], ["FFSP", 1, 0, [2, 1], 1, 1], ["AN", 1, 1, 6], ["PR", 4, 0, "auto_unroll_max_step$512"]]]], "r": [[0.00178662, 0.00178599, 0.00178557], 0, 3.91118, 1759469369], "v": "v0.6"}
{"i": [["[\"ansor_mm\", 706, 4096, 4096, \"float16\"]", "rocm -keys=rocm,gpu -max_num_threads=256 -max_shared_memory_per_block=49152 -max_threads_per_block=1024 -mcpu=gfx942 -model=unknown -mtriple=amdgcn-amd-amdhsa-hcc -thread_warp_size=64", [-1, 16, 64, 65536, 2147483647, 1024, 16, 64], "llvm -keys=cpu -mtriple=x86_64-unknown-linux-gnu", 0, []], [[], [["CHW", 2, "local"], ["SP", 2, 0, 706, [1, 2, 1, 1], 1], ["SP", 2, 5, 4096, [1, 256, 2, 8], 1], ["SP", 2, 10, 4096, [2, 1], 1], ["RE", 2, [0, 5, 1, 6, 2, 7, 10, 11, 3, 8, 12, 4, 9]], ["FSP", 3, 0, 1, 3], ["FSP", 3, 4, 2, 3], ["RE", 3, [0, 4, 1, 5, 2, 6, 3, 7]], ["CA", 2, 3, 5], ["CHR", 1, "shared", [2]], ["CA", 2, 3, 6], ["CHR", 0, "shared", [3]], ["CA", 1, 4, 6], ["FU", 5, [0, 1]], ["AN", 5, 0, 5], ["FU", 5, [1, 2]], ["AN", 5, 1, 4], ["FU", 5, [2, 3]], ["AN", 5, 2, 6], ["FU", 3, [0, 1]], ["SP", 3, 0, 32, [1], 1], ["AN", 3, 1, 2], ["FFSP", 3, 0, [2, 1], 1, 1], ["AN", 3, 1, 6], ["FU", 1, [0, 1]], ["SP", 1, 0, 2, [2], 1], ["AN", 1, 1, 2], ["FFSP", 1, 0, [2, 1], 1, 1], ["AN", 1, 1, 6], ["PR", 4, 0, "auto_unroll_max_step$0"]]]], "r": [[0.00285906, 0.00286165, 0.00286032], 0, 3.6217, 1759469370], "v": "v0.6"}
{"i": [["[\"ansor_mm\", 706, 4096, 4096, \"float16\"]", "rocm -keys=rocm,gpu -max_num_threads=256 -max_shared_memory_per_block=49152 -max_threads_per_block=1024 -mcpu=gfx942 -model=unknown -mtriple=amdgcn-amd-amdhsa-hcc -thread_warp_size=64", [-1, 16, 64, 65536, 2147483647, 1024, 16, 64], "llvm -keys=cpu -mtriple=x86_64-unknown-linux-gnu", 0, []], [[], [["CHW", 2, "local"], ["SP", 2, 0, 706, [2, 1, 1, 1], 1], ["SP", 2, 5, 4096, [1, 1, 1, 2], 1], ["SP", 2, 10, 4096, [1, 1], 1], ["RE", 2, [0, 5, 1, 6, 2, 7, 10, 11, 3, 8, 12, 4, 9]], ["FSP", 3, 0, 1, 3], ["FSP", 3, 4, 2, 3], ["RE", 3, [0, 4, 1, 5, 2, 6, 3, 7]], ["CA", 2, 3, 5], ["CHR", 1, "shared", [2]], ["CA", 2, 3, 6], ["CHR", 0, "shared", [3]], ["CA", 1, 4, 6], ["FU", 5, [0, 1]], ["AN", 5, 0, 5], ["FU", 5, [1, 2]], ["AN", 5, 1, 4], ["FU", 5, [2, 3]], ["AN", 5, 2, 6], ["FU", 3, [0, 1]], ["SP", 3, 0, 32, [16], 1], ["AN", 3, 1, 2], ["FFSP", 3, 0, [2, 1], 1, 1], ["AN", 3, 1, 6], ["FU", 1, [0, 1]], ["SP", 1, 0, 1, [1], 1], ["AN", 1, 1, 2], ["FFSP", 1, 0, [2, 1], 1, 1], ["AN", 1, 1, 6], ["PR", 4, 0, "auto_unroll_max_step$512"]]]], "r": [[0.0899648, 0.0899504, 0.0899524], 0, 6.08368, 1759469373], "v": "v0.6"}
{"i": [["[\"ansor_mm\", 706, 4096, 4096, \"float16\"]", "rocm -keys=rocm,gpu -max_num_threads=256 -max_shared_memory_per_block=49152 -max_threads_per_block=1024 -mcpu=gfx942 -model=unknown -mtriple=amdgcn-amd-amdhsa-hcc -thread_warp_size=64", [-1, 16, 64, 65536, 2147483647, 1024, 16, 64], "llvm -keys=cpu -mtriple=x86_64-unknown-linux-gnu", 0, []], [[], [["CHW", 2, "local"], ["SP", 2, 0, 706, [1, 353, 2, 1], 1], ["SP", 2, 5, 4096, [4, 1, 1024, 1], 1], ["SP", 2, 10, 4096, [1, 4], 1], ["RE", 2, [0, 5, 1, 6, 2, 7, 10, 11, 3, 8, 12, 4, 9]], ["FSP", 3, 0, 1, 3], ["FSP", 3, 4, 2, 3], ["RE", 3, [0, 4, 1, 5, 2, 6, 3, 7]], ["CA", 2, 3, 5], ["CHR", 1, "shared", [2]], ["CA", 2, 3, 6], ["CHR", 0, "shared", [3]], ["CA", 1, 4, 6], ["FU", 5, [0, 1]], ["AN", 5, 0, 5], ["FU", 5, [1, 2]], ["AN", 5, 1, 4], ["FU", 5, [2, 3]], ["AN", 5, 2, 6], ["FU", 3, [0, 1]], ["SP", 3, 0, 4096, [8], 1], ["AN", 3, 1, 2], ["FFSP", 3, 0, [2, 1], 1, 1], ["AN", 3, 1, 6], ["FU", 1, [0, 1]], ["SP", 1, 0, 8, [1], 1], ["AN", 1, 1, 2], ["FFSP", 1, 0, [2, 1], 1, 1], ["AN", 1, 1, 6], ["PR", 4, 0, "auto_unroll_max_step$16"]]]], "r": [[0.389231, 0.389404, 0.389419], 0, 15.4847, 1759469386], "v": "v0.6"}
{"i": [["[\"ansor_mm\", 706, 4096, 4096, \"float16\"]", "rocm -keys=rocm,gpu -max_num_threads=256 -max_shared_memory_per_block=49152 -max_threads_per_block=1024 -mcpu=gfx942 -model=unknown -mtriple=amdgcn-amd-amdhsa-hcc -thread_warp_size=64", [-1, 16, 64, 65536, 2147483647, 1024, 16, 64], "llvm -keys=cpu -mtriple=x86_64-unknown-linux-gnu", 0, []], [[], [["CHW", 2, "local"], ["SP", 2, 0, 706, [1, 1, 1, 2], 1], ["SP", 2, 5, 4096, [2, 1, 16, 8], 1], ["SP", 2, 10, 4096, [2, 4], 1], ["RE", 2, [0, 5, 1, 6, 2, 7, 10, 11, 3, 8, 12, 4, 9]], ["FSP", 3, 0, 1, 3], ["FSP", 3, 4, 2, 3], ["RE", 3, [0, 4, 1, 5, 2, 6, 3, 7]], ["CA", 2, 3, 5], ["CHR", 1, "shared", [2]], ["CA", 2, 3, 6], ["CHR", 0, "shared", [3]], ["CA", 1, 4, 6], ["FU", 5, [0, 1]], ["AN", 5, 0, 5], ["FU", 5, [1, 2]], ["AN", 5, 1, 4], ["FU", 5, [2, 3]], ["AN", 5, 2, 6], ["FU", 3, [0, 1]], ["SP", 3, 0, 1024, [1], 1], ["AN", 3, 1, 2], ["FFSP", 3, 0, [2, 1], 1, 1], ["AN", 3, 1, 6], ["FU", 1, [0, 1]], ["SP", 1, 0, 16, [1], 1], ["AN", 1, 1, 2], ["FFSP", 1, 0, [2, 1], 1, 1], ["AN", 1, 1, 6], ["PR", 4, 0, "auto_unroll_max_step$1024"]]]], "r": [[0.205438, 0.203908, 0.204215], 0, 10.5307, 1759469393], "v": "v0.6"}
{"i": [["[\"ansor_mm\", 706, 4096, 4096, \"float16\"]", "rocm -keys=rocm,gpu -max_num_threads=256 -max_shared_memory_per_block=49152 -max_threads_per_block=1024 -mcpu=gfx942 -model=unknown -mtriple=amdgcn-amd-amdhsa-hcc -thread_warp_size=64", [-1, 16, 64, 65536, 2147483647, 1024, 16, 64], "llvm -keys=cpu -mtriple=x86_64-unknown-linux-gnu", 0, []], [[], [["CHW", 2, "local"], ["SP", 2, 0, 706, [1, 353, 1, 2], 1], ["SP", 2, 5, 4096, [8, 1, 256, 2], 1], ["SP", 2, 10, 4096, [1, 1], 1], ["RE", 2, [0, 5, 1, 6, 2, 7, 10, 11, 3, 8, 12, 4, 9]], ["FSP", 3, 0, 1, 3], ["FSP", 3, 4, 2, 3], ["RE", 3, [0, 4, 1, 5, 2, 6, 3, 7]], ["CA", 2, 3, 5], ["CHR", 1, "shared", [2]], ["CA", 2, 3, 6], ["CHR", 0, "shared", [3]], ["CA", 1, 4, 6], ["FU", 5, [0, 1]], ["AN", 5, 0, 5], ["FU", 5, [1, 2]], ["AN", 5, 1, 4], ["FU", 5, [2, 3]], ["AN", 5, 2, 6], ["FU", 3, [0, 1]], ["SP", 3, 0, 1024, [2], 1], ["AN", 3, 1, 2], ["FFSP", 3, 0, [2, 1], 1, 1], ["AN", 3, 1, 6], ["FU", 1, [0, 1]], ["SP", 1, 0, 4, [1], 1], ["AN", 1, 1, 2], ["FFSP", 1, 0, [2, 1], 1, 1], ["AN", 1, 1, 6], ["PR", 4, 0, "auto_unroll_max_step$512"]]]], "r": [[0.561482, 0.563719, 0.562766], 0, 20.9917, 1759469411], "v": "v0.6"}
{"i": [["[\"ansor_mm\", 706, 4096, 4096, \"float16\"]", "rocm -keys=rocm,gpu -max_num_threads=256 -max_shared_memory_per_block=49152 -max_threads_per_block=1024 -mcpu=gfx942 -model=unknown -mtriple=amdgcn-amd-amdhsa-hcc -thread_warp_size=64", [-1, 16, 64, 65536, 2147483647, 1024, 16, 64], "llvm -keys=cpu -mtriple=x86_64-unknown-linux-gnu", 0, []], [[], [["CHW", 2, "local"], ["SP", 2, 0, 706, [1, 353, 1, 1], 1], ["SP", 2, 5, 4096, [16, 2, 1, 4], 1], ["SP", 2, 10, 4096, [4, 1], 1], ["RE", 2, [0, 5, 1, 6, 2, 7, 10, 11, 3, 8, 12, 4, 9]], ["FSP", 3, 0, 1, 3], ["FSP", 3, 4, 2, 3], ["RE", 3, [0, 4, 1, 5, 2, 6, 3, 7]], ["CA", 2, 3, 5], ["CHR", 1, "shared", [2]], ["CA", 2, 3, 6], ["CHR", 0, "shared", [3]], ["CA", 1, 4, 6], ["FU", 5, [0, 1]], ["AN", 5, 0, 5], ["FU", 5, [1, 2]], ["AN", 5, 1, 4], ["FU", 5, [2, 3]], ["AN", 5, 2, 6], ["FU", 3, [0, 1]], ["SP", 3, 0, 16, [1], 1], ["AN", 3, 1, 2], ["FFSP", 3, 0, [2, 1], 1, 1], ["AN", 3, 1, 6], ["FU", 1, [0, 1]], ["SP", 1, 0, 4, [1], 1], ["AN", 1, 1, 2], ["FFSP", 1, 0, [2, 1], 1, 1], ["AN", 1, 1, 6], ["PR", 4, 0, "auto_unroll_max_step$0"]]]], "r": [[0.00245467, 0.00245531, 0.00245589], 0, 3.79475, 1759469412], "v": "v0.6"}
{"i": [["[\"ansor_mm\", 706, 4096, 4096, \"float16\"]", "rocm -keys=rocm,gpu -max_num_threads=256 -max_shared_memory_per_block=49152 -max_threads_per_block=1024 -mcpu=gfx942 -model=unknown -mtriple=amdgcn-amd-amdhsa-hcc -thread_warp_size=64", [-1, 16, 64, 65536, 2147483647, 1024, 16, 64], "llvm -keys=cpu -mtriple=x86_64-unknown-linux-gnu", 0, []], [[], [["CHW", 2, "local"], ["SP", 2, 0, 706, [1, 1, 1, 1], 1], ["SP", 2, 5, 4096, [8, 64, 1, 1], 1], ["SP", 2, 10, 4096, [2, 4], 1], ["RE", 2, [0, 5, 1, 6, 2, 7, 10, 11, 3, 8, 12, 4, 9]], ["FSP", 3, 0, 1, 3], ["FSP", 3, 4, 2, 3], ["RE", 3, [0, 4, 1, 5, 2, 6, 3, 7]], ["CA", 2, 3, 5], ["CHR", 1, "shared", [2]], ["CA", 2, 3, 6], ["CHR", 0, "shared", [3]], ["CA", 1, 4, 6], ["FU", 5, [0, 1]], ["AN", 5, 0, 5], ["FU", 5, [1, 2]], ["AN", 5, 1, 4], ["FU", 5, [2, 3]], ["AN", 5, 2, 6], ["FU", 3, [0, 1]], ["SP", 3, 0, 8, [1], 1], ["AN", 3, 1, 2], ["FFSP", 3, 0, [2, 1], 1, 1], ["AN", 3, 1, 6], ["FU", 1, [0, 1]], ["SP", 1, 0, 8, [1], 1], ["AN", 1, 1, 2], ["FFSP", 1, 0, [2, 1], 1, 1], ["AN", 1, 1, 6], ["PR", 4, 0, "auto_unroll_max_step$64"]]]], "r": [[0.00493015, 0.00492003, 0.00497812], 0, 3.72707, 1759469413], "v": "v0.6"}
{"i": [["[\"ansor_mm\", 706, 4096, 4096, \"float16\"]", "rocm -keys=rocm,gpu -max_num_threads=256 -max_shared_memory_per_block=49152 -max_threads_per_block=1024 -mcpu=gfx942 -model=unknown -mtriple=amdgcn-amd-amdhsa-hcc -thread_warp_size=64", [-1, 16, 64, 65536, 2147483647, 1024, 16, 64], "llvm -keys=cpu -mtriple=x86_64-unknown-linux-gnu", 0, []], [[], [["CHW", 2, "local"], ["SP", 2, 0, 706, [2, 353, 1, 1], 1], ["SP", 2, 5, 4096, [8, 2, 1, 2], 1], ["SP", 2, 10, 4096, [4, 2], 1], ["RE", 2, [0, 5, 1, 6, 2, 7, 10, 11, 3, 8, 12, 4, 9]], ["FSP", 3, 0, 1, 3], ["FSP", 3, 4, 2, 3], ["RE", 3, [0, 4, 1, 5, 2, 6, 3, 7]], ["CA", 2, 3, 5], ["CHR", 1, "shared", [2]], ["CA", 2, 3, 6], ["CHR", 0, "shared", [3]], ["CA", 1, 4, 6], ["FU", 5, [0, 1]], ["AN", 5, 0, 5], ["FU", 5, [1, 2]], ["AN", 5, 1, 4], ["FU", 5, [2, 3]], ["AN", 5, 2, 6], ["FU", 3, [0, 1]], ["SP", 3, 0, 32, [1], 1], ["AN", 3, 1, 2], ["FFSP", 3, 0, [2, 1], 1, 1], ["AN", 3, 1, 6], ["FU", 1, [0, 1]], ["SP", 1, 0, 16, [1], 1], ["AN", 1, 1, 2], ["FFSP", 1, 0, [2, 1], 1, 1], ["AN", 1, 1, 6], ["PR", 4, 0, "auto_unroll_max_step$64"]]]], "r": [[0.00146981, 0.00146905, 0.00146798], 0, 3.99084, 1759469414], "v": "v0.6"}
{"i": [["[\"ansor_mm\", 706, 4096, 4096, \"float16\"]", "rocm -keys=rocm,gpu -max_num_threads=256 -max_shared_memory_per_block=49152 -max_threads_per_block=1024 -mcpu=gfx942 -model=unknown -mtriple=amdgcn-amd-amdhsa-hcc -thread_warp_size=64", [-1, 16, 64, 65536, 2147483647, 1024, 16, 64], "llvm -keys=cpu -mtriple=x86_64-unknown-linux-gnu", 0, []], [[], [["CHW", 2, "local"], ["SP", 2, 0, 706, [1, 353, 1, 1], 1], ["SP", 2, 5, 4096, [1, 1, 1024, 4], 1], ["SP", 2, 10, 4096, [2, 2], 1], ["RE", 2, [0, 5, 1, 6, 2, 7, 10, 11, 3, 8, 12, 4, 9]], ["FSP", 3, 0, 1, 3], ["FSP", 3, 4, 2, 3], ["RE", 3, [0, 4, 1, 5, 2, 6, 3, 7]], ["CA", 2, 3, 5], ["CHR", 1, "shared", [2]], ["CA", 2, 3, 6], ["CHR", 0, "shared", [3]], ["CA", 1, 4, 6], ["FU", 5, [0, 1]], ["AN", 5, 0, 5], ["FU", 5, [1, 2]], ["AN", 5, 1, 4], ["FU", 5, [2, 3]], ["AN", 5, 2, 6], ["FU", 3, [0, 1]], ["SP", 3, 0, 16384, [1], 1], ["AN", 3, 1, 2], ["FFSP", 3, 0, [2, 1], 1, 1], ["AN", 3, 1, 6], ["FU", 1, [0, 1]], ["SP", 1, 0, 4, [1], 1], ["AN", 1, 1, 2], ["FFSP", 1, 0, [2, 1], 1, 1], ["AN", 1, 1, 6], ["PR", 4, 0, "auto_unroll_max_step$512"]]]], "r": [[0.796283, 0.796749, 0.796514], 0, 28.0876, 1759469440], "v": "v0.6"}
