demo_artifacts/logs/mm_ansor/log_641_2880_4096.json
{"i": [["[\"ansor_mm\", 641, 2880, 4096, \"float16\"]", "rocm -keys=rocm,gpu -max_num_threads=256 -max_shared_memory_per_block=49152 -max_threads_per_block=1024 -mcpu=gfx942 -model=unknown -mtriple=amdgcn-amd-amdhsa-hcc -thread_warp_size=64", [-1, 16, 64, 65536, 2147483647, 1024, 16, 64], "llvm -keys=cpu -mtriple=x86_64-unknown-linux-gnu", 0, []], [[], [["CHW", 2, "local"], ["SP", 2, 0, 641, [1, 641, 1, 1], 1], ["SP", 2, 5, 2880, [1, 1, 18, 2], 1], ["SP", 2, 10, 4096, [1, 4], 1], ["RE", 2, [0, 5, 1, 6, 2, 7, 10, 11, 3, 8, 12, 4, 9]], ["FSP", 3, 0, 1, 3], ["FSP", 3, 4, 2, 3], ["RE", 3, [0, 4, 1, 5, 2, 6, 3, 7]], ["CA", 2, 3, 5], ["CHR", 1, "shared", [2]], ["CA", 2, 3, 6], ["CHR", 0, "shared", [3]], ["CA", 1, 4, 6], ["FU", 5, [0, 1]], ["AN", 5, 0, 5], ["FU", 5, [1, 2]], ["AN", 5, 1, 4], ["FU", 5, [2, 3]], ["AN", 5, 2, 6], ["FU", 3, [0, 1]], ["SP", 3, 0, 24, [1], 1], ["AN", 3, 1, 2], ["FFSP", 3, 0, [2, 1], 1, 1], ["AN", 3, 1, 6], ["FU", 1, [0, 1]], ["SP", 1, 0, 4, [4], 1], ["AN", 1, 1, 2], ["FFSP", 1, 0, [2, 1], 1, 1], ["AN", 1, 1, 6], ["PR", 4, 0, "auto_unroll_max_step$64"]]]], "r": [[0.00190769, 0.0019077, 0.00190851], 0, 3.74649, 1759482639], "v": "v0.6"}
{"i": [["[\"ansor_mm\", 641, 2880, 4096, \"float16\"]", "rocm -keys=rocm,gpu -max_num_threads=256 -max_shared_memory_per_block=49152 -max_threads_per_block=1024 -mcpu=gfx942 -model=unknown -mtriple=amdgcn-amd-amdhsa-hcc -thread_warp_size=64", [-1, 16, 64, 65536, 2147483647, 1024, 16, 64], "llvm -keys=cpu -mtriple=x86_64-unknown-linux-gnu", 0, []], [[], [["CHW", 2, "local"], ["SP", 2, 0, 641, [1, 1, 641, 1], 1], ["SP", 2, 5, 2880, [1, 1, 8, 1], 1], ["SP", 2, 10, 4096, [16, 1], 1], ["RE", 2, [0, 5, 1, 6, 2, 7, 10, 11, 3, 8, 12, 4, 9]], ["FSP", 3, 0, 1, 3], ["FSP", 3, 4, 2, 3], ["RE", 3, [0, 4, 1, 5, 2, 6, 3, 7]], ["CA", 2, 3, 5], ["CHR", 1, "shared", [2]], ["CA", 2, 3, 6], ["CHR", 0, "shared", [3]], ["CA", 1, 4, 6], ["FU", 5, [0, 1]], ["AN", 5, 0, 5], ["FU", 5, [1, 2]], ["AN", 5, 1, 4], ["FU", 5, [2, 3]], ["AN", 5, 2, 6], ["FU", 3, [0, 1]], ["SP", 3, 0, 1536, [1], 1], ["AN", 3, 1, 2], ["FFSP", 3, 0, [2, 1], 1, 1], ["AN", 3, 1, 6], ["FU", 1, [0, 1]], ["SP", 1, 0, 16, [1], 1], ["AN", 1, 1, 2], ["FFSP", 1, 0, [2, 1], 1, 1], ["AN", 1, 1, 6], ["PR", 4, 0, "auto_unroll_max_step$16"]]]], "r": [[0.490365, 0.490471, 0.491794], 0, 18.534, 1759482655], "v": "v0.6"}
{"i": [["[\"ansor_mm\", 641, 2880, 4096, \"float16\"]", "rocm -keys=rocm,gpu -max_num_threads=256 -max_shared_memory_per_block=49152 -max_threads_per_block=1024 -mcpu=gfx942 -model=unknown -mtriple=amdgcn-amd-amdhsa-hcc -thread_warp_size=64", [-1, 16, 64, 65536, 2147483647, 1024, 16, 64], "llvm -keys=cpu -mtriple=x86_64-unknown-linux-gnu", 0, []], [[], [["CHW", 2, "local"], ["SP", 2, 0, 641, [1, 641, 1, 1], 1], ["SP", 2, 5, 2880, [10, 1, 6, 1], 1], ["SP", 2, 10, 4096, [32, 1], 1], ["RE", 2, [0, 5, 1, 6, 2, 7, 10, 11, 3, 8, 12, 4, 9]], ["FSP", 3, 0, 1, 3], ["FSP", 3, 4, 2, 3], ["RE", 3, [0, 4, 1, 5, 2, 6, 3, 7]], ["CA", 2, 3, 5], ["CHR", 1, "shared", [2]], ["CA", 2, 3, 6], ["CHR", 0, "shared", [3]], ["CA", 1, 4, 6], ["FU", 5, [0, 1]], ["AN", 5, 0, 5], ["FU", 5, [1, 2]], ["AN", 5, 1, 4], ["FU", 5, [2, 3]], ["AN", 5, 2, 6], ["FU", 3, [0, 1]], ["SP", 3, 0, 576, [1], 1], ["AN", 3, 1, 2], ["FFSP", 3, 0, [2, 1], 1, 1], ["AN", 3, 1, 6], ["FU", 1, [0, 1]], ["SP", 1, 0, 32, [1], 1], ["AN", 1, 1, 2], ["FFSP", 1, 0, [2, 1], 1, 1], ["AN", 1, 1, 6], ["PR", 4, 0, "auto_unroll_max_step$16"]]]], "r": [[0.00268873, 0.00268867, 0.00268853], 0, 3.58494, 1759482656], "v": "v0.6"}
{"i": [["[\"ansor_mm\", 641, 2880, 4096, \"float16\"]", "rocm -keys=rocm,gpu -max_num_threads=256 -max_shared_memory_per_block=49152 -max_threads_per_block=1024 -mcpu=gfx942 -model=unknown -mtriple=amdgcn-amd-amdhsa-hcc -thread_warp_size=64", [-1, 16, 64, 65536, 2147483647, 1024, 16, 64], "llvm -keys=cpu -mtriple=x86_64-unknown-linux-gnu", 0, []], [[], [["CHW", 2, "local"], ["SP", 2, 0, 641, [1, 641, 1, 1], 1], ["SP", 2, 5, 2880, [15, 1, 1, 3], 1], ["SP", 2, 10, 4096, [1, 32], 1], ["RE", 2, [0, 5, 1, 6, 2, 7, 10, 11, 3, 8, 12, 4, 9]], ["FSP", 3, 0, 1, 3], ["FSP", 3, 4, 2, 3], ["RE", 3, [0, 4, 1, 5, 2, 6, 3, 7]], ["CA", 2, 3, 5], ["CHR", 1, "shared", [2]], ["CA", 2, 3, 6], ["CHR", 0, "shared", [3]], ["CA", 1, 4, 6], ["FU", 5, [0, 1]], ["AN", 5, 0, 5], ["FU", 5, [1, 2]], ["AN", 5, 1, 4], ["FU", 5, [2, 3]], ["AN", 5, 2, 6], ["FU", 3, [0, 1]], ["SP", 3, 0, 3, [3], 1], ["AN", 3, 1, 2], ["FFSP", 3, 0, [2, 1], 1, 1], ["AN", 3, 1, 6], ["FU", 1, [0, 1]], ["SP", 1, 0, 1, [1], 1], ["AN", 1, 1, 2], ["FFSP", 1, 0, [2, 1], 1, 1], ["AN", 1, 1, 6], ["PR", 4, 0, "auto_unroll_max_step$0"]]]], "r": [[0.00525557, 0.00525426, 0.00525313], 0, 3.49008, 1759482657], "v": "v0.6"}
{"i": [["[\"ansor_mm\", 641, 2880, 4096, \"float16\"]", "rocm -keys=rocm,gpu -max_num_threads=256 -max_shared_memory_per_block=49152 -max_threads_per_block=1024 -mcpu=gfx942 -model=unknown -mtriple=amdgcn-amd-amdhsa-hcc -thread_warp_size=64", [-1, 16, 64, 65536, 2147483647, 1024, 16, 64], "llvm -keys=cpu -mtriple=x86_64-unknown-linux-gnu", 0, []], [[], [["CHW", 2, "local"], ["SP", 2, 0, 641, [1, 641, 1, 1], 1], ["SP", 2, 5, 2880, [4, 1, 24, 2], 1], ["SP", 2, 10, 4096, [4, 2], 1], ["RE", 2, [0, 5, 1, 6, 2, 7, 10, 11, 3, 8, 12, 4, 9]], ["FSP", 3, 0, 1, 3], ["FSP", 3, 4, 2, 3], ["RE", 3, [0, 4, 1, 5, 2, 6, 3, 7]], ["CA", 2, 3, 5], ["CHR", 1, "shared", [2]], ["CA", 2, 3, 6], ["CHR", 0, "shared", [3]], ["CA", 1, 4, 6], ["FU", 5, [0, 1]], ["AN", 5, 0, 5], ["FU", 5, [1, 2]], ["AN", 5, 1, 4], ["FU", 5, [2, 3]], ["AN", 5, 2, 6], ["FU", 3, [0, 1]], ["SP", 3, 0, 384, [1], 1], ["AN", 3, 1, 2], ["FFSP", 3, 0, [2, 1], 1, 1], ["AN", 3, 1, 6], ["FU", 1, [0, 1]], ["SP", 1, 0, 8, [1], 1], ["AN", 1, 1, 2], ["FFSP", 1, 0, [2, 1], 1, 1], ["AN", 1, 1, 6], ["PR", 4, 0, "auto_unroll_max_step$1024"]]]], "r": [[0.00588475, 0.00588111, 0.00587732], 0, 3.69213, 1759482658], "v": "v0.6"}
{"i": [["[\"ansor_mm\", 641, 2880, 4096, \"float16\"]", "rocm -keys=rocm,gpu -max_num_threads=256 -max_shared_memory_per_block=49152 -max_threads_per_block=1024 -mcpu=gfx942 -model=unknown -mtriple=amdgcn-amd-amdhsa-hcc -thread_warp_size=64", [-1, 16, 64, 65536, 2147483647, 1024, 16, 64], "llvm -keys=cpu -mtriple=x86_64-unknown-linux-gnu", 0, []], [[], [["CHW", 2, "local"], ["SP", 2, 0, 641, [1, 1, 1, 1], 1], ["SP", 2, 5, 2880, [1, 1, 24, 8], 1], ["SP", 2, 10, 4096, [4, 2], 1], ["RE", 2, [0, 5, 1, 6, 2, 7, 10, 11, 3, 8, 12, 4, 9]], ["FSP", 3, 0, 1, 3], ["FSP", 3, 4, 2, 3], ["RE", 3, [0, 4, 1, 5, 2, 6, 3, 7]], ["CA", 2, 3, 5], ["CHR", 1, "shared", [2]], ["CA", 2, 3, 6], ["CHR", 0, "shared", [3]], ["CA", 1, 4, 6], ["FU", 5, [0, 1]], ["AN", 5, 0, 5], ["FU", 5, [1, 2]], ["AN", 5, 1, 4], ["FU", 5, [2, 3]], ["AN", 5, 2, 6], ["FU", 3, [0, 1]], ["SP", 3, 0, 384, [1], 1], ["AN", 3, 1, 2], ["FFSP", 3, 0, [2, 1], 1, 1], ["AN", 3, 1, 6], ["FU", 1, [0, 1]], ["SP", 1, 0, 8, [8], 1], ["AN", 1, 1, 2], ["FFSP", 1, 0, [2, 1], 1, 1], ["AN", 1, 1, 6], ["PR", 4, 0, "auto_unroll_max_step$0"]]]], "r": [[0.177706, 0.177589, 0.177723], 0, 8.79094, 1759482664], "v": "v0.6"}
{"i": [["[\"ansor_mm\", 641, 2880, 4096, \"float16\"]", "rocm -keys=rocm,gpu -max_num_threads=256 -max_shared_memory_per_block=49152 -max_threads_per_block=1024 -mcpu=gfx942 -model=unknown -mtriple=amdgcn-amd-amdhsa-hcc -thread_warp_size=64", [-1, 16, 64, 65536, 2147483647, 1024, 16, 64], "llvm -keys=cpu -mtriple=x86_64-unknown-linux-gnu", 0, []], [[], [["CHW", 2, "local"], ["SP", 2, 0, 641, [1, 1, 641, 1], 1], ["SP", 2, 5, 2880, [15, 64, 1, 1], 1], ["SP", 2, 10, 4096, [1, 16], 1], ["RE", 2, [0, 5, 1, 6, 2, 7, 10, 11, 3, 8, 12, 4, 9]], ["FSP", 3, 0, 1, 3], ["FSP", 3, 4, 2, 3], ["RE", 3, [0, 4, 1, 5, 2, 6, 3, 7]], ["CA", 2, 3, 5], ["CHR", 1, "shared", [2]], ["CA", 2, 3, 6], ["CHR", 0, "shared", [3]], ["CA", 1, 4, 6], ["FU", 5, [0, 1]], ["AN", 5, 0, 5], ["FU", 5, [1, 2]], ["AN", 5, 1, 4], ["FU", 5, [2, 3]], ["AN", 5, 2, 6], ["FU", 3, [0, 1]], ["SP", 3, 0, 16, [1], 1], ["AN", 3, 1, 2], ["FFSP", 3, 0, [2, 1], 1, 1], ["AN", 3, 1, 6], ["FU", 1, [0, 1]], ["SP", 1, 0, 10256, [1], 1], ["AN", 1, 1, 2], ["FFSP", 1, 0, [2, 1], 1, 1], ["AN", 1, 1, 6], ["PR", 4, 0, "auto_unroll_max_step$0"]]]], "r": [[0.316847, 0.31723, 0.317117], 0, 13.1039, 1759482674], "v": "v0.6"}
{"i": [["[\"ansor_mm\", 641, 2880, 4096, \"float16\"]", "rocm -keys=rocm,gpu -max_num_threads=256 -max_shared_memory_per_block=49152 -max_threads_per_block=1024 -mcpu=gfx942 -model=unknown -mtriple=amdgcn-amd-amdhsa-hcc -thread_warp_size=64", [-1, 16, 64, 65536, 2147483647, 1024, 16, 64], "llvm -keys=cpu -mtriple=x86_64-unknown-linux-gnu", 0, []], [[], [["CHW", 2, "local"], ["SP", 2, 0, 641, [1, 641, 1, 1], 1], ["SP", 2, 5, 2880, [3, 1, 4, 6], 1], ["SP", 2, 10, 4096, [32, 1], 1], ["RE", 2, [0, 5, 1, 6, 2, 7, 10, 11, 3, 8, 12, 4, 9]], ["FSP", 3, 0, 1, 3], ["FSP", 3, 4, 2, 3], ["RE", 3, [0, 4, 1, 5, 2, 6, 3, 7]], ["CA", 2, 3, 5], ["CHR", 1, "shared", [2]], ["CA", 2, 3, 6], ["CHR", 0, "shared", [3]], ["CA", 1, 4, 6], ["FU", 5, [0, 1]], ["AN", 5, 0, 5], ["FU", 5, [1, 2]], ["AN", 5, 1, 4], ["FU", 5, [2, 3]], ["AN", 5, 2, 6], ["FU", 3, [0, 1]], ["SP", 3, 0, 48, [1], 1], ["AN", 3, 1, 2], ["FFSP", 3, 0, [2, 1], 1, 1], ["AN", 3, 1, 6], ["FU", 1, [0, 1]], ["SP", 1, 0, 2, [1], 1], ["AN", 1, 1, 2], ["FFSP", 1, 0, [2, 1], 1, 1], ["AN", 1, 1, 6], ["PR", 4, 0, "auto_unroll_max_step$512"]]]], "r": [[0.00248249, 0.0024826, 0.00248258], 0, 3.5671, 1759482675], "v": "v0.6"}
{"i": [["[\"ansor_mm\", 641, 2880, 4096, \"float16\"]", "rocm -keys=rocm,gpu -max_num_threads=256 -max_shared_memory_per_block=49152 -max_threads_per_block=1024 -mcpu=gfx942 -model=unknown -mtriple=amdgcn-amd-amdhsa-hcc -thread_warp_size=64", [-1, 16, 64, 65536, 2147483647, 1024, 16, 64], "llvm -keys=cpu -mtriple=x86_64-unknown-linux-gnu", 0, []], [[], [["CHW", 2, "local"], ["SP", 2, 0, 641, [1, 641, 1, 1], 1], ["SP", 2, 5, 2880, [6, 1, 15, 1], 1], ["SP", 2, 10, 4096, [1, 4], 1], ["RE", 2, [0, 5, 1, 6, 2, 7, 10, 11, 3, 8, 12, 4, 9]], ["FSP", 3, 0, 1, 3], ["FSP", 3, 4, 2, 3], ["RE", 3, [0, 4, 1, 5, 2, 6, 3, 7]], ["CA", 2, 3, 5], ["CHR", 1, "shared", [2]], ["CA", 2, 3, 6], ["CHR", 0, "shared", [3]], ["CA", 1, 4, 6], ["FU", 5, [0, 1]], ["AN", 5, 0, 5], ["FU", 5, [1, 2]], ["AN", 5, 1, 4], ["FU", 5, [2, 3]], ["AN", 5, 2, 6], ["FU", 3, [0, 1]], ["SP", 3, 0, 60, [1], 1], ["AN", 3, 1, 2], ["FFSP", 3, 0, [2, 1], 1, 1], ["AN", 3, 1, 6], ["FU", 1, [0, 1]], ["SP", 1, 0, 4, [1], 1], ["AN", 1, 1, 2], ["FFSP", 1, 0, [2, 1], 1, 1], ["AN", 1, 1, 6], ["PR", 4, 0, "auto_unroll_max_step$0"]]]], "r": [[0.0110673, 0.0110596, 0.0110631], 0, 3.54536, 1759482676], "v": "v0.6"}
{"i": [["[\"ansor_mm\", 641, 2880, 4096, \"float16\"]", "rocm -keys=rocm,gpu -max_num_threads=256 -max_shared_memory_per_block=49152 -max_threads_per_block=1024 -mcpu=gfx942 -model=unknown -mtriple=amdgcn-amd-amdhsa-hcc -thread_warp_size=64", [-1, 16, 64, 65536, 2147483647, 1024, 16, 64], "llvm -keys=cpu -mtriple=x86_64-unknown-linux-gnu", 0, []], [[], [["CHW", 2, "local"], ["SP", 2, 0, 641, [1, 641, 1, 1], 1], ["SP", 2, 5, 2880, [2, 1, 6, 48], 1], ["SP", 2, 10, 4096, [4, 1], 1], ["RE", 2, [0, 5, 1, 6, 2, 7, 10, 11, 3, 8, 12, 4, 9]], ["FSP", 3, 0, 1, 3], ["FSP", 3, 4, 2, 3], ["RE", 3, [0, 4, 1, 5, 2, 6, 3, 7]], ["CA", 2, 3, 5], ["CHR", 1, "shared", [2]], ["CA", 2, 3, 6], ["CHR", 0, "shared", [3]], ["CA", 1, 4, 6], ["FU", 5, [0, 1]], ["AN", 5, 0, 5], ["FU", 5, [1, 2]], ["AN", 5, 1, 4], ["FU", 5, [2, 3]], ["AN", 5, 2, 6], ["FU", 3, [0, 1]], ["SP", 3, 0, 288, [1], 1], ["AN", 3, 1, 2], ["FFSP", 3, 0, [2, 1], 1, 1], ["AN", 3, 1, 6], ["FU", 1, [0, 1]], ["SP", 1, 0, 1, [1], 1], ["AN", 1, 1, 2], ["FFSP", 1, 0, [2, 1], 1, 1], ["AN", 1, 1, 6], ["PR", 4, 0, "auto_unroll_max_step$16"]]]], "r": [[0.195017, 0.194922, 0.194741], 0, 10.1384, 1759482682], "v": "v0.6"}
{"i": [["[\"ansor_mm\", 641, 2880, 4096, \"float16\"]", "rocm -keys=rocm,gpu -max_num_threads=256 -max_shared_memory_per_block=49152 -max_threads_per_block=1024 -mcpu=gfx942 -model=unknown -mtriple=amdgcn-amd-amdhsa-hcc -thread_warp_size=64", [-1, 16, 64, 65536, 2147483647, 1024, 16, 64], "llvm -keys=cpu -mtriple=x86_64-unknown-linux-gnu", 0, []], [[], [["CHW", 2, "local"], ["SP", 2, 0, 641, [1, 641, 1, 1], 1], ["SP", 2, 5, 2880, [1, 1, 3, 3], 1], ["SP", 2, 10, 4096, [2, 4], 1], ["RE", 2, [0, 5, 1, 6, 2, 7, 10, 11, 3, 8, 12, 4, 9]], ["FSP", 3, 0, 1, 3], ["FSP", 3, 4, 2, 3], ["RE", 3, [0, 4, 1, 5, 2, 6, 3, 7]], ["CA", 2, 3, 5], ["CHR", 1, "shared", [2]], ["CA", 2, 3, 6], ["CHR", 0, "shared", [3]], ["CA", 1, 4, 6], ["FU", 5, [0, 1]], ["AN", 5, 0, 5], ["FU", 5, [1, 2]], ["AN", 5, 1, 4], ["FU", 5, [2, 3]], ["AN", 5, 2, 6], ["FU", 3, [0, 1]], ["SP", 3, 0, 1152, [1], 1], ["AN", 3, 1, 2], ["FFSP", 3, 0, [2, 1], 1, 1], ["AN", 3, 1, 6], ["FU", 1, [0, 1]], ["SP", 1, 0, 8, [2], 1], ["AN", 1, 1, 2], ["FFSP", 1, 0, [2, 1], 1, 1], ["AN", 1, 1, 6], ["PR", 4, 0, "auto_unroll_max_step$64"]]]], "r": [[0.00250881, 0.00251129, 0.0025084], 0, 3.46268, 1759482683], "v": "v0.6"}
{"i": [["[\"ansor_mm\", 641, 2880, 4096, \"float16\"]", "rocm -keys=rocm,gpu -max_num_threads=256 -max_shared_memory_per_block=49152 -max_threads_per_block=1024 -mcpu=gfx942 -model=unknown -mtriple=amdgcn-amd-amdhsa-hcc -thread_warp_size=64", [-1, 16, 64, 65536, 2147483647, 1024, 16, 64], "llvm -keys=cpu -mtriple=x86_64-unknown-linux-gnu", 0, []], [[], [["CHW", 2, "local"], ["SP", 2, 0, 641, [1, 1, 1, 1], 1], ["SP", 2, 5, 2880, [1, 90, 1, 32], 1], ["SP", 2, 10, 4096, [2, 4], 1], ["RE", 2, [0, 5, 1, 6, 2, 7, 10, 11, 3, 8, 12, 4, 9]], ["FSP", 3, 0, 1, 3], ["FSP", 3, 4, 2, 3], ["RE", 3, [0, 4, 1, 5, 2, 6, 3, 7]], ["CA", 2, 3, 5], ["CHR", 1, "shared", [2]], ["CA", 2, 3, 6], ["CHR", 0, "shared", [3]], ["CA", 1, 4, 6], ["FU", 5, [0, 1]], ["AN", 5, 0, 5], ["FU", 5, [1, 2]], ["AN", 5, 1, 4], ["FU", 5, [2, 3]], ["AN", 5, 2, 6], ["FU", 3, [0, 1]], ["SP", 3, 0, 128, [1], 1], ["AN", 3, 1, 2], ["FFSP", 3, 0, [2, 1], 1, 1], ["AN", 3, 1, 6], ["FU", 1, [0, 1]], ["SP", 1, 0, 8, [8], 1], ["AN", 1, 1, 2], ["FFSP", 1, 0, [2, 1], 1, 1], ["AN", 1, 1, 6], ["PR", 4, 0, "auto_unroll_max_step$0"]]]], "r": [[0.0190198, 0.0190258, 0.0190342], 0, 3.76493, 1759482684], "v": "v0.6"}
{"i": [["[\"ansor_mm\", 641, 2880, 4096, \"float16\"]", "rocm -keys=rocm,gpu -max_num_threads=256 -max_shared_memory_per_block=49152 -max_threads_per_block=1024 -mcpu=gfx942 -model=unknown -mtriple=amdgcn-amd-amdhsa-hcc -thread_warp_size=64", [-1, 16, 64, 65536, 2147483647, 1024, 16, 64], "llvm -keys=cpu -mtriple=x86_64-unknown-linux-gnu", 0, []], [[], [["CHW", 2, "local"], ["SP", 2, 0, 641, [1, 641, 1, 1], 1], ["SP", 2, 5, 2880, [2, 1, 8, 10], 1], ["SP", 2, 10, 4096, [8, 4], 1], ["RE", 2, [0, 5, 1, 6, 2, 7, 10, 11, 3, 8, 12, 4, 9]], ["FSP", 3, 0, 1, 3], ["FSP", 3, 4, 2, 3], ["RE", 3, [0, 4, 1, 5, 2, 6, 3, 7]], ["CA", 2, 3, 5], ["CHR", 1, "shared", [2]], ["CA", 2, 3, 6], ["CHR", 0, "shared", [3]], ["CA", 1, 4, 6], ["FU", 5, [0, 1]], ["AN", 5, 0, 5], ["FU", 5, [1, 2]], ["AN", 5, 1, 4], ["FU", 5, [2, 3]], ["AN", 5, 2, 6], ["FU", 3, [0, 1]], ["SP", 3, 0, 2560, [1], 1], ["AN", 3, 1, 2], ["FFSP", 3, 0, [2, 1], 1, 1], ["AN", 3, 1, 6], ["FU", 1, [0, 1]], ["SP", 1, 0, 32, [1], 1], ["AN", 1, 1, 2], ["FFSP", 1, 0, [2, 1], 1, 1], ["AN", 1, 1, 6], ["PR", 4, 0, "auto_unroll_max_step$16"]]]], "r": [[0.00576664, 0.00576187, 0.00576139], 0, 3.75132, 1759482685], "v": "v0.6"}
{"i": [["[\"ansor_mm\", 641, 2880, 4096, \"float16\"]", "rocm -keys=rocm,gpu -max_num_threads=256 -max_shared_memory_per_block=49152 -max_threads_per_block=1024 -mcpu=gfx942 -model=unknown -mtriple=amdgcn-amd-amdhsa-hcc -thread_warp_size=64", [-1, 16, 64, 65536, 2147483647, 1024, 16, 64], "llvm -keys=cpu -mtriple=x86_64-unknown-linux-gnu", 0, []], [[], [["CHW", 2, "local"], ["SP", 2, 0, 641, [1, 641, 1, 1], 1], ["SP", 2, 5, 2880, [12, 1, 4, 3], 1], ["SP", 2, 10, 4096, [2, 1], 1], ["RE", 2, [0, 5, 1, 6, 2, 7, 10, 11, 3, 8, 12, 4, 9]], ["FSP", 3, 0, 1, 3], ["FSP", 3, 4, 2, 3], ["RE", 3, [0, 4, 1, 5, 2, 6, 3, 7]], ["CA", 2, 3, 5], ["CHR", 1, "shared", [2]], ["CA", 2, 3, 6], ["CHR", 0, "shared", [3]], ["CA", 1, 4, 6], ["FU", 5, [0, 1]], ["AN", 5, 0, 5], ["FU", 5, [1, 2]], ["AN", 5, 1, 4], ["FU", 5, [2, 3]], ["AN", 5, 2, 6], ["FU", 3, [0, 1]], ["SP", 3, 0, 48, [2], 1], ["AN", 3, 1, 2], ["FFSP", 3, 0, [2, 1], 1, 1], ["AN", 3, 1, 6], ["FU", 1, [0, 1]], ["SP", 1, 0, 2, [1], 1], ["AN", 1, 1, 2], ["FFSP", 1, 0, [2, 1], 1, 1], ["AN", 1, 1, 6], ["PR", 4, 0, "auto_unroll_max_step$1024"]]]], "r": [[0.00735005, 0.0073505, 0.00731659], 0, 3.69458, 1759482686], "v": "v0.6"}
{"i": [["[\"ansor_mm\", 641, 2880, 4096, \"float16\"]", "rocm -keys=rocm,gpu -max_num_threads=256 -max_shared_memory_per_block=49152 -max_threads_per_block=1024 -mcpu=gfx942 -model=unknown -mtriple=amdgcn-amd-amdhsa-hcc -thread_warp_size=64", [-1, 16, 64, 65536, 2147483647, 1024, 16, 64], "llvm -keys=cpu -mtriple=x86_64-unknown-linux-gnu", 0, []], [[], [["CHW", 2, "local"], ["SP", 2, 0, 641, [1, 1, 1, 1], 1], ["SP", 2, 5, 2880, [2, 120, 1, 6], 1], ["SP", 2, 10, 4096, [1, 4], 1], ["RE", 2, [0, 5, 1, 6, 2, 7, 10, 11, 3, 8, 12, 4, 9]], ["FSP", 3, 0, 1, 3], ["FSP", 3, 4, 2, 3], ["RE", 3, [0, 4, 1, 5, 2, 6, 3, 7]], ["CA", 2, 3, 5], ["CHR", 1, "shared", [2]], ["CA", 2, 3, 6], ["CHR", 0, "shared", [3]], ["CA", 1, 4, 6], ["FU", 5, [0, 1]], ["AN", 5, 0, 5], ["FU", 5, [1, 2]], ["AN", 5, 1, 4], ["FU", 5, [2, 3]], ["AN", 5, 2, 6], ["FU", 3, [0, 1]], ["SP", 3, 0, 24, [2], 1], ["AN", 3, 1, 2], ["FFSP", 3, 0, [2, 1], 1, 1], ["AN", 3, 1, 6], ["FU", 1, [0, 1]], ["SP", 1, 0, 4, [1], 1], ["AN", 1, 1, 2], ["FFSP", 1, 0, [2, 1], 1, 1], ["AN", 1, 1, 6], ["PR", 4, 0, "auto_unroll_max_step$1024"]]]], "r": [[0.00113453, 0.00113763, 0.00113976], 0, 3.81596, 1759482687], "v": "v0.6"}
{"i": [["[\"ansor_mm\", 641, 2880, 4096, \"float16\"]", "rocm -keys=rocm,gpu -max_num_threads=256 -max_shared_memory_per_block=49152 -max_threads_per_block=1024 -mcpu=gfx942 -model=unknown -mtriple=amdgcn-amd-amdhsa-hcc -thread_warp_size=64", [-1, 16, 64, 65536, 2147483647, 1024, 16, 64], "llvm -keys=cpu -mtriple=x86_64-unknown-linux-gnu", 0, []], [[], [["CHW", 2, "local"], ["SP", 2, 0, 641, [1, 641, 1, 1], 1], ["SP", 2, 5, 2880, [4, 1, 10, 4], 1], ["SP", 2, 10, 4096, [8, 4], 1], ["RE", 2, [0, 5, 1, 6, 2, 7, 10, 11, 3, 8, 12, 4, 9]], ["FSP", 3, 0, 1, 3], ["FSP", 3, 4, 2, 3], ["RE", 3, [0, 4, 1, 5, 2, 6, 3, 7]], ["CA", 2, 3, 5], ["CHR", 1, "shared", [2]], ["CA", 2, 3, 6], ["CHR", 0, "shared", [3]], ["CA", 1, 4, 6], ["FU", 5, [0, 1]], ["AN", 5, 0, 5], ["FU", 5, [1, 2]], ["AN", 5, 1, 4], ["FU", 5, [2, 3]], ["AN", 5, 2, 6], ["FU", 3, [0, 1]], ["SP", 3, 0, 1280, [1], 1], ["AN", 3, 1, 2], ["FFSP", 3, 0, [2, 1], 1, 1], ["AN", 3, 1, 6], ["FU", 1, [0, 1]], ["SP", 1, 0, 32, [1], 1], ["AN", 1, 1, 2], ["FFSP", 1, 0, [2, 1], 1, 1], ["AN", 1, 1, 6], ["PR", 4, 0, "auto_unroll_max_step$16"]]]], "r": [[0.0068274, 0.00682416, 0.00680882], 0, 3.85806, 1759482688], "v": "v0.6"}
{"i": [["[\"ansor_mm\", 641, 2880, 4096, \"float16\"]", "rocm -keys=rocm,gpu -max_num_threads=256 -max_shared_memory_per_block=49152 -max_threads_per_block=1024 -mcpu=gfx942 -model=unknown -mtriple=amdgcn-amd-amdhsa-hcc -thread_warp_size=64", [-1, 16, 64, 65536, 2147483647, 1024, 16, 64], "llvm -keys=cpu -mtriple=x86_64-unknown-linux-gnu", 0, []], [[], [["CHW", 2, "local"], ["SP", 2, 0, 641, [1, 641, 1, 1], 1], ["SP", 2, 5, 2880, [3, 1, 96, 1], 1], ["SP", 2, 10, 4096, [1, 8], 1], ["RE", 2, [0, 5, 1, 6, 2, 7, 10, 11, 3, 8, 12, 4, 9]], ["FSP", 3, 0, 1, 3], ["FSP", 3, 4, 2, 3], ["RE", 3, [0, 4, 1, 5, 2, 6, 3, 7]], ["CA", 2, 3, 5], ["CHR", 1, "shared", [2]], ["CA", 2, 3, 6], ["CHR", 0, "shared", [3]], ["CA", 1, 4, 6], ["FU", 5, [0, 1]], ["AN", 5, 0, 5], ["FU", 5, [1, 2]], ["AN", 5, 1, 4], ["FU", 5, [2, 3]], ["AN", 5, 2, 6], ["FU", 3, [0, 1]], ["SP", 3, 0, 768, [1], 1], ["AN", 3, 1, 2], ["FFSP", 3, 0, [2, 1], 1, 1], ["AN", 3, 1, 6], ["FU", 1, [0, 1]], ["SP", 1, 0, 8, [1], 1], ["AN", 1, 1, 2], ["FFSP", 1, 0, [2, 1], 1, 1], ["AN", 1, 1, 6], ["PR", 4, 0, "auto_unroll_max_step$16"]]]], "r": [[0.0130671, 0.0130552, 0.0130745], 0, 3.95605, 1759482689], "v": "v0.6"}
{"i": [["[\"ansor_mm\", 641, 2880, 4096, \"float16\"]", "rocm -keys=rocm,gpu -max_num_threads=256 -max_shared_memory_per_block=49152 -max_threads_per_block=1024 -mcpu=gfx942 -model=unknown -mtriple=amdgcn-amd-amdhsa-hcc -thread_warp_size=64", [-1, 16, 64, 65536, 2147483647, 1024, 16, 64], "llvm -keys=cpu -mtriple=x86_64-unknown-linux-gnu", 0, []], [[], [["CHW", 2, "local"], ["SP", 2, 0, 641, [1, 641, 1, 1], 1], ["SP", 2, 5, 2880, [1, 1, 6, 3], 1], ["SP", 2, 10, 4096, [1, 8], 1], ["RE", 2, [0, 5, 1, 6, 2, 7, 10, 11, 3, 8, 12, 4, 9]], ["FSP", 3, 0, 1, 3], ["FSP", 3, 4, 2, 3], ["RE", 3, [0, 4, 1, 5, 2, 6, 3, 7]], ["CA", 2, 3, 5], ["CHR", 1, "shared", [2]], ["CA", 2, 3, 6], ["CHR", 0, "shared", [3]], ["CA", 1, 4, 6], ["FU", 5, [0, 1]], ["AN", 5, 0, 5], ["FU", 5, [1, 2]], ["AN", 5, 1, 4], ["FU", 5, [2, 3]], ["AN", 5, 2, 6], ["FU", 3, [0, 1]], ["SP", 3, 0, 1440, [1], 1], ["AN", 3, 1, 2], ["FFSP", 3, 0, [2, 1], 1, 1], ["AN", 3, 1, 6], ["FU", 1, [0, 1]], ["SP", 1, 0, 16, [4], 1], ["AN", 1, 1, 2], ["FFSP", 1, 0, [2, 1], 1, 1], ["AN", 1, 1, 6], ["PR", 4, 0, "auto_unroll_max_step$1024"]]]], "r": [[0.00107344, 0.00107374, 0.00107383], 0, 3.83641, 1759482690], "v": "v0.6"}
{"i": [["[\"ansor_mm\", 641, 2880, 4096, \"float16\"]", "rocm -keys=rocm,gpu -max_num_threads=256 -max_shared_memory_per_block=49152 -max_threads_per_block=1024 -mcpu=gfx942 -model=unknown -mtriple=amdgcn-amd-amdhsa-hcc -thread_warp_size=64", [-1, 16, 64, 65536, 2147483647, 1024, 16, 64], "llvm -keys=cpu -mtriple=x86_64-unknown-linux-gnu", 0, []], [[], [["CHW", 2, "local"], ["SP", 2, 0, 641, [1, 1, 1, 1], 1], ["SP", 2, 5, 2880, [3, 1, 2, 60], 1], ["SP", 2, 10, 4096, [2, 4], 1], ["RE", 2, [0, 5, 1, 6, 2, 7, 10, 11, 3, 8, 12, 4, 9]], ["FSP", 3, 0, 1, 3], ["FSP", 3, 4, 2, 3], ["RE", 3, [0, 4, 1, 5, 2, 6, 3, 7]], ["CA", 2, 3, 5], ["CHR", 1, "shared", [2]], ["CA", 2, 3, 6], ["CHR", 0, "shared", [3]], ["CA", 1, 4, 6], ["FU", 5, [0, 1]], ["AN", 5, 0, 5], ["FU", 5, [1, 2]], ["AN", 5, 1, 4], ["FU", 5, [2, 3]], ["AN", 5, 2, 6], ["FU", 3, [0, 1]], ["SP", 3, 0, 960, [1], 1], ["AN", 3, 1, 2], ["FFSP", 3, 0, [2, 1], 1, 1], ["AN", 3, 1, 6], ["FU", 1, [0, 1]], ["SP", 1, 0, 8, [1], 1], ["AN", 1, 1, 2], ["FFSP", 1, 0, [2, 1], 1, 1], ["AN", 1, 1, 6], ["PR", 4, 0, "auto_unroll_max_step$512"]]]], "r": [[0.250441, 0.249173, 0.248792], 0, 12.0549, 1759482698], "v": "v0.6"}
{"i": [["[\"ansor_mm\", 641, 2880, 4096, \"float16\"]", "rocm -keys=rocm,gpu -max_num_threads=256 -max_shared_memory_per_block=49152 -max_threads_per_block=1024 -mcpu=gfx942 -model=unknown -mtriple=amdgcn-amd-amdhsa-hcc -thread_warp_size=64", [-1, 16, 64, 65536, 2147483647, 1024, 16, 64], "llvm -keys=cpu -mtriple=x86_64-unknown-linux-gnu", 0, []], [[], [["CHW", 2, "local"], ["SP", 2, 0, 641, [1, 641, 1, 1], 1], ["SP", 2, 5, 2880, [5, 1, 72, 2], 1], ["SP", 2, 10, 4096, [4, 2], 1], ["RE", 2, [0, 5, 1, 6, 2, 7, 10, 11, 3, 8, 12, 4, 9]], ["FSP", 3, 0, 1, 3], ["FSP", 3, 4, 2, 3], ["RE", 3, [0, 4, 1, 5, 2, 6, 3, 7]], ["CA", 2, 3, 5], ["CHR", 1, "shared", [2]], ["CA", 2, 3, 6], ["CHR", 0, "shared", [3]], ["CA", 1, 4, 6], ["FU", 5, [0, 1]], ["AN", 5, 0, 5], ["FU", 5, [1, 2]], ["AN", 5, 1, 4], ["FU", 5, [2, 3]], ["AN", 5, 2, 6], ["FU", 3, [0, 1]], ["SP", 3, 0, 1152, [1], 1], ["AN", 3, 1, 2], ["FFSP", 3, 0, [2, 1], 1, 1], ["AN", 3, 1, 6], ["FU", 1, [0, 1]], ["SP", 1, 0, 8, [1], 1], ["AN", 1, 1, 2], ["FFSP", 1, 0, [2, 1], 1, 1], ["AN", 1, 1, 6], ["PR", 4, 0, "auto_unroll_max_step$1024"]]]], "r": [[0.119156, 0.119193, 0.11918], 0, 7.09755, 1759482702], "v": "v0.6"}
{"i": [["[\"ansor_mm\", 641, 2880, 4096, \"float16\"]", "rocm -keys=rocm,gpu -max_num_threads=256 -max_shared_memory_per_block=49152 -max_threads_per_block=1024 -mcpu=gfx942 -model=unknown -mtriple=amdgcn-amd-amdhsa-hcc -thread_warp_size=64", [-1, 16, 64, 65536, 2147483647, 1024, 16, 64], "llvm -keys=cpu -mtriple=x86_64-unknown-linux-gnu", 0, []], [[], [["CHW", 2, "local"], ["SP", 2, 0, 641, [1, 641, 1, 1], 1], ["SP", 2, 5, 2880, [4, 1, 2, 8], 1], ["SP", 2, 10, 4096, [1, 2], 1], ["RE", 2, [0, 5, 1, 6, 2, 7, 10, 11, 3, 8, 12, 4, 9]], ["FSP", 3, 0, 1, 3], ["FSP", 3, 4, 2, 3], ["RE", 3, [0, 4, 1, 5, 2, 6, 3, 7]], ["CA", 2, 3, 5], ["CHR", 1, "shared", [2]], ["CA", 2, 3, 6], ["CHR", 0, "shared", [3]], ["CA", 1, 4, 6], ["FU", 5, [0, 1]], ["AN", 5, 0, 5], ["FU", 5, [1, 2]], ["AN", 5, 1, 4], ["FU", 5, [2, 3]], ["AN", 5, 2, 6], ["FU", 3, [0, 1]], ["SP", 3, 0, 32, [1], 1], ["AN", 3, 1, 2], ["FFSP", 3, 0, [2, 1], 1, 1], ["AN", 3, 1, 6], ["FU", 1, [0, 1]], ["SP", 1, 0, 2, [2], 1], ["AN", 1, 1, 2], ["FFSP", 1, 0, [2, 1], 1, 1], ["AN", 1, 1, 6], ["PR", 4, 0, "auto_unroll_max_step$512"]]]], "r": [[0.00361003, 0.0036128, 0.00361059], 0, 3.53715, 1759482703], "v": "v0.6"}
{"i": [["[\"ansor_mm\", 641, 2880, 4096, \"float16\"]", "rocm -keys=rocm,gpu -max_num_threads=256 -max_shared_memory_per_block=49152 -max_threads_per_block=1024 -mcpu=gfx942 -model=unknown -mtriple=amdgcn-amd-amdhsa-hcc -thread_warp_size=64", [-1, 16, 64, 65536, 2147483647, 1024, 16, 64], "llvm -keys=cpu -mtriple=x86_64-unknown-linux-gnu", 0, []], [[], [["CHW", 2, "local"], ["SP", 2, 0, 641, [1, 641, 1, 1], 1], ["SP", 2, 5, 2880, [3, 1, 96, 1], 1], ["SP", 2, 10, 4096, [1, 1], 1], ["RE", 2, [0, 5, 1, 6, 2, 7, 10, 11, 3, 8, 12, 4, 9]], ["FSP", 3, 0, 1, 3], ["FSP", 3, 4, 2, 3], ["RE", 3, [0, 4, 1, 5, 2, 6, 3, 7]], ["CA", 2, 3, 5], ["CHR", 1, "shared", [2]], ["CA", 2, 3, 6], ["CHR", 0, "shared", [3]], ["CA", 1, 4, 6], ["FU", 5, [0, 1]], ["AN", 5, 0, 5], ["FU", 5, [1, 2]], ["AN", 5, 1, 4], ["FU", 5, [2, 3]], ["AN", 5, 2, 6], ["FU", 3, [0, 1]], ["SP", 3, 0, 768, [1], 1], ["AN", 3, 1, 2], ["FFSP", 3, 0, [2, 1], 1, 1], ["AN", 3, 1, 6], ["FU", 1, [0, 1]], ["SP", 1, 0, 8, [1], 1], ["AN", 1, 1, 2], ["FFSP", 1, 0, [2, 1], 1, 1], ["AN", 1, 1, 6], ["PR", 4, 0, "auto_unroll_max_step$16"]]]], "r": [[0.0320549, 0.0320113, 0.0319188], 0, 4.25183, 1759482704], "v": "v0.6"}
{"i": [["[\"ansor_mm\", 641, 2880, 4096, \"float16\"]", "rocm -keys=rocm,gpu -max_num_threads=256 -max_shared_memory_per_block=49152 -max_threads_per_block=1024 -mcpu=gfx942 -model=unknown -mtriple=amdgcn-amd-amdhsa-hcc -thread_warp_size=64", [-1, 16, 64, 65536, 2147483647, 1024, 16, 64], "llvm -keys=cpu -mtriple=x86_64-unknown-linux-gnu", 0, []], [[], [["CHW", 2, "local"], ["SP", 2, 0, 641, [1, 641, 1, 1], 1], ["SP", 2, 5, 2880, [1, 1, 12, 48], 1], ["SP", 2, 10, 4096, [1, 2], 1], ["RE", 2, [0, 5, 1, 6, 2, 7, 10, 11, 3, 8, 12, 4, 9]], ["FSP", 3, 0, 1, 3], ["FSP", 3, 4, 2, 3], ["RE", 3, [0, 4, 1, 5, 2, 6, 3, 7]], ["CA", 2, 3, 5], ["CHR", 1, "shared", [2]], ["CA", 2, 3, 6], ["CHR", 0, "shared", [3]], ["CA", 1, 4, 6], ["FU", 5, [0, 1]], ["AN", 5, 0, 5], ["FU", 5, [1, 2]], ["AN", 5, 1, 4], ["FU", 5, [2, 3]], ["AN", 5, 2, 6], ["FU", 3, [0, 1]], ["SP", 3, 0, 288, [1], 1], ["AN", 3, 1, 2], ["FFSP", 3, 0, [2, 1], 1, 1], ["AN", 3, 1, 6], ["FU", 1, [0, 1]], ["SP", 1, 0, 1, [1], 1], ["AN", 1, 1, 2], ["FFSP", 1, 0, [2, 1], 1, 1], ["AN", 1, 1, 6], ["PR", 4, 0, "auto_unroll_max_step$16"]]]], "r": [[0.145457, 0.145501, 0.145435], 0, 7.94601, 1759482709], "v": "v0.6"}
{"i": [["[\"ansor_mm\", 641, 2880, 4096, \"float16\"]", "rocm -keys=rocm,gpu -max_num_threads=256 -max_shared_memory_per_block=49152 -max_threads_per_block=1024 -mcpu=gfx942 -model=unknown -mtriple=amdgcn-amd-amdhsa-hcc -thread_warp_size=64", [-1, 16, 64, 65536, 2147483647, 1024, 16, 64], "llvm -keys=cpu -mtriple=x86_64-unknown-linux-gnu", 0, []], [[], [["CHW", 2, "local"], ["SP", 2, 0, 641, [1, 1, 1, 1], 1], ["SP", 2, 5, 2880, [1, 240, 1, 6], 1], ["SP", 2, 10, 4096, [1, 4], 1], ["RE", 2, [0, 5, 1, 6, 2, 7, 10, 11, 3, 8, 12, 4, 9]], ["FSP", 3, 0, 1, 3], ["FSP", 3, 4, 2, 3], ["RE", 3, [0, 4, 1, 5, 2, 6, 3, 7]], ["CA", 2, 3, 5], ["CHR", 1, "shared", [2]], ["CA", 2, 3, 6], ["CHR", 0, "shared", [3]], ["CA", 1, 4, 6], ["FU", 5, [0, 1]], ["AN", 5, 0, 5], ["FU", 5, [1, 2]], ["AN", 5, 1, 4], ["FU", 5, [2, 3]], ["AN", 5, 2, 6], ["FU", 3, [0, 1]], ["SP", 3, 0, 24, [6], 1], ["AN", 3, 1, 2], ["FFSP", 3, 0, [2, 1], 1, 1], ["AN", 3, 1, 6], ["FU", 1, [0, 1]], ["SP", 1, 0, 4, [1], 1], ["AN", 1, 1, 2], ["FFSP", 1, 0, [2, 1], 1, 1], ["AN", 1, 1, 6], ["PR", 4, 0, "auto_unroll_max_step$1024"]]]], "r": [[0.00114757, 0.00114963, 0.00115199], 0, 3.72053, 1759482711], "v": "v0.6"}
{"i": [["[\"ansor_mm\", 641, 2880, 4096, \"float16\"]", "rocm -keys=rocm,gpu -max_num_threads=256 -max_shared_memory_per_block=49152 -max_threads_per_block=1024 -mcpu=gfx942 -model=unknown -mtriple=amdgcn-amd-amdhsa-hcc -thread_warp_size=64", [-1, 16, 64, 65536, 2147483647, 1024, 16, 64], "llvm -keys=cpu -mtriple=x86_64-unknown-linux-gnu", 0, []], [[], [["CHW", 2, "local"], ["SP", 2, 0, 641, [1, 1, 1, 1], 1], ["SP", 2, 5, 2880, [3, 1, 4, 12], 1], ["SP", 2, 10, 4096, [2, 64], 1], ["RE", 2, [0, 5, 1, 6, 2, 7, 10, 11, 3, 8, 12, 4, 9]], ["FSP", 3, 0, 1, 3], ["FSP", 3, 4, 2, 3], ["RE", 3, [0, 4, 1, 5, 2, 6, 3, 7]], ["CA", 2, 3, 5], ["CHR", 1, "shared", [2]], ["CA", 2, 3, 6], ["CHR", 0, "shared", [3]], ["CA", 1, 4, 6], ["FU", 5, [0, 1]], ["AN", 5, 0, 5], ["FU", 5, [1, 2]], ["AN", 5, 1, 4], ["FU", 5, [2, 3]], ["AN", 5, 2, 6], ["FU", 3, [0, 1]], ["SP", 3, 0, 768, [6], 1], ["AN", 3, 1, 2], ["FFSP", 3, 0, [2, 1], 1, 1], ["AN", 3, 1, 6], ["FU", 1, [0, 1]], ["SP", 1, 0, 16, [1], 1], ["AN", 1, 1, 2], ["FFSP", 1, 0, [2, 1], 1, 1], ["AN", 1, 1, 6], ["PR", 4, 0, "auto_unroll_max_step$16"]]]], "r": [[0.322306, 0.322313, 0.322296], 0, 13.3263, 1759482721], "v": "v0.6"}
{"i": [["[\"ansor_mm\", 641, 2880, 4096, \"float16\"]", "rocm -keys=rocm,gpu -max_num_threads=256 -max_shared_memory_per_block=49152 -max_threads_per_block=1024 -mcpu=gfx942 -model=unknown -mtriple=amdgcn-amd-amdhsa-hcc -thread_warp_size=64", [-1, 16, 64, 65536, 2147483647, 1024, 16, 64], "llvm -keys=cpu -mtriple=x86_64-unknown-linux-gnu", 0, []], [[], [["CHW", 2, "local"], ["SP", 2, 0, 641, [1, 1, 641, 1], 1], ["SP", 2, 5, 2880, [1, 72, 5, 8], 1], ["SP", 2, 10, 4096, [1, 2], 1], ["RE", 2, [0, 5, 1, 6, 2, 7, 10, 11, 3, 8, 12, 4, 9]], ["FSP", 3, 0, 1, 3], ["FSP", 3, 4, 2, 3], ["RE", 3, [0, 4, 1, 5, 2, 6, 3, 7]], ["CA", 2, 3, 5], ["CHR", 1, "shared", [2]], ["CA", 2, 3, 6], ["CHR", 0, "shared", [3]], ["CA", 1, 4, 6], ["FU", 5, [0, 1]], ["AN", 5, 0, 5], ["FU", 5, [1, 2]], ["AN", 5, 1, 4], ["FU", 5, [2, 3]], ["AN", 5, 2, 6], ["FU", 3, [0, 1]], ["SP", 3, 0, 80, [4], 1], ["AN", 3, 1, 2], ["FFSP", 3, 0, [2, 1], 1, 1], ["AN", 3, 1, 6], ["FU", 1, [0, 1]], ["SP", 1, 0, 10256, [4], 1], ["AN", 1, 1, 2], ["FFSP", 1, 0, [2, 1], 1, 1], ["AN", 1, 1, 6], ["PR", 4, 0, "auto_unroll_max_step$16"]]]], "r": [[0.76131, 0.760725, 0.76084], 0, 27.1789, 1759482745], "v": "v0.6"}
{"i": [["[\"ansor_mm\", 641, 2880, 4096, \"float16\"]", "rocm -keys=rocm,gpu -max_num_threads=256 -max_shared_memory_per_block=49152 -max_threads_per_block=1024 -mcpu=gfx942 -model=unknown -mtriple=amdgcn-amd-amdhsa-hcc -thread_warp_size=64", [-1, 16, 64, 65536, 2147483647, 1024, 16, 64], "llvm -keys=cpu -mtriple=x86_64-unknown-linux-gnu", 0, []], [[], [["CHW", 2, "local"], ["SP", 2, 0, 641, [1, 641, 1, 1], 1], ["SP", 2, 5, 2880, [2, 1, 12, 40], 1], ["SP", 2, 10, 4096, [2, 8], 1], ["RE", 2, [0, 5, 1, 6, 2, 7, 10, 11, 3, 8, 12, 4, 9]], ["FSP", 3, 0, 1, 3], ["FSP", 3, 4, 2, 3], ["RE", 3, [0, 4, 1, 5, 2, 6, 3, 7]], ["CA", 2, 3, 5], ["CHR", 1, "shared", [2]], ["CA", 2, 3, 6], ["CHR", 0, "shared", [3]], ["CA", 1, 4, 6], ["FU", 5, [0, 1]], ["AN", 5, 0, 5], ["FU", 5, [1, 2]], ["AN", 5, 1, 4], ["FU", 5, [2, 3]], ["AN", 5, 2, 6], ["FU", 3, [0, 1]], ["SP", 3, 0, 7680, [2], 1], ["AN", 3, 1, 2], ["FFSP", 3, 0, [2, 1], 1, 1], ["AN", 3, 1, 6], ["FU", 1, [0, 1]], ["SP", 1, 0, 16, [1], 1], ["AN", 1, 1, 2], ["FFSP", 1, 0, [2, 1], 1, 1], ["AN", 1, 1, 6], ["PR", 4, 0, "auto_unroll_max_step$64"]]]], "r": [[0.194532, 0.194566, 0.194605], 0, 9.90096, 1759482752], "v": "v0.6"}
{"i": [["[\"ansor_mm\", 641, 2880, 4096, \"float16\"]", "rocm -keys=rocm,gpu -max_num_threads=256 -max_shared_memory_per_block=49152 -max_threads_per_block=1024 -mcpu=gfx942 -model=unknown -mtriple=amdgcn-amd-amdhsa-hcc -thread_warp_size=64", [-1, 16, 64, 65536, 2147483647, 1024, 16, 64], "llvm -keys=cpu -mtriple=x86_64-unknown-linux-gnu", 0, []], [[], [["CHW", 2, "local"], ["SP", 2, 0, 641, [1, 1, 1, 1], 1], ["SP", 2, 5, 2880, [2, 1, 90, 1], 1], ["SP", 2, 10, 4096, [8, 4], 1], ["RE", 2, [0, 5, 1, 6, 2, 7, 10, 11, 3, 8, 12, 4, 9]], ["FSP", 3, 0, 1, 3], ["FSP", 3, 4, 2, 3], ["RE", 3, [0, 4, 1, 5, 2, 6, 3, 7]], ["CA", 2, 3, 5], ["CHR", 1, "shared", [2]], ["CA", 2, 3, 6], ["CHR", 0, "shared", [3]], ["CA", 1, 4, 6], ["FU", 5, [0, 1]], ["AN", 5, 0, 5], ["FU", 5, [1, 2]], ["AN", 5, 1, 4], ["FU", 5, [2, 3]], ["AN", 5, 2, 6], ["FU", 3, [0, 1]], ["SP", 3, 0, 2880, [1], 1], ["AN", 3, 1, 2], ["FFSP", 3, 0, [2, 1], 1, 1], ["AN", 3, 1, 6], ["FU", 1, [0, 1]], ["SP", 1, 0, 32, [1], 1], ["AN", 1, 1, 2], ["FFSP", 1, 0, [2, 1], 1, 1], ["AN", 1, 1, 6], ["PR", 4, 0, "auto_unroll_max_step$1024"]]]], "r": [[0.306886, 0.308581, 0.309677], 0, 13.0692, 1759482762], "v": "v0.6"}
{"i": [["[\"ansor_mm\", 641, 2880, 4096, \"float16\"]", "rocm -keys=rocm,gpu -max_num_threads=256 -max_shared_memory_per_block=49152 -max_threads_per_block=1024 -mcpu=gfx942 -model=unknown -mtriple=amdgcn-amd-amdhsa-hcc -thread_warp_size=64", [-1, 16, 64, 65536, 2147483647, 1024, 16, 64], "llvm -keys=cpu -mtriple=x86_64-unknown-linux-gnu", 0, []], [[], [["CHW", 2, "local"], ["SP", 2, 0, 641, [1, 1, 1, 1], 1], ["SP", 2, 5, 2880, [1, 240, 1, 6], 1], ["SP", 2, 10, 4096, [1, 16], 1], ["RE", 2, [0, 5, 1, 6, 2, 7, 10, 11, 3, 8, 12, 4, 9]], ["FSP", 3, 0, 1, 3], ["FSP", 3, 4, 2, 3], ["RE", 3, [0, 4, 1, 5, 2, 6, 3, 7]], ["CA", 2, 3, 5], ["CHR", 1, "shared", [2]], ["CA", 2, 3, 6], ["CHR", 0, "shared", [3]], ["CA", 1, 4, 6], ["FU", 5, [0, 1]], ["AN", 5, 0, 5], ["FU", 5, [1, 2]], ["AN", 5, 1, 4], ["FU", 5, [2, 3]], ["AN", 5, 2, 6], ["FU", 3, [0, 1]], ["SP", 3, 0, 24, [1], 1], ["AN", 3, 1, 2], ["FFSP", 3, 0, [2, 1], 1, 1], ["AN", 3, 1, 6], ["FU", 1, [0, 1]], ["SP", 1, 0, 4, [1], 1], ["AN", 1, 1, 2], ["FFSP", 1, 0, [2, 1], 1, 1], ["AN", 1, 1, 6], ["PR", 4, 0, "auto_unroll_max_step$1024"]]]], "r": [[0.00273938, 0.00274032, 0.0027425], 0, 3.53676, 1759482763], "v": "v0.6"}
{"i": [["[\"ansor_mm\", 641, 2880, 4096, \"float16\"]", "rocm -keys=rocm,gpu -max_num_threads=256 -max_shared_memory_per_block=49152 -max_threads_per_block=1024 -mcpu=gfx942 -model=unknown -mtriple=amdgcn-amd-amdhsa-hcc -thread_warp_size=64", [-1, 16, 64, 65536, 2147483647, 1024, 16, 64], "llvm -keys=cpu -mtriple=x86_64-unknown-linux-gnu", 0, []], [[], [["CHW", 2, "local"], ["SP", 2, 0, 641, [1, 1, 641, 1], 1], ["SP", 2, 5, 2880, [2, 120, 1, 2], 1], ["SP", 2, 10, 4096, [2, 2], 1], ["RE", 2, [0, 5, 1, 6, 2, 7, 10, 11, 3, 8, 12, 4, 9]], ["FSP", 3, 0, 1, 3], ["FSP", 3, 4, 2, 3], ["RE", 3, [0, 4, 1, 5, 2, 6, 3, 7]], ["CA", 2, 3, 5], ["CHR", 1, "shared", [2]], ["CA", 2, 3, 6], ["CHR", 0, "shared", [3]], ["CA", 1, 4, 6], ["FU", 5, [0, 1]], ["AN", 5, 0, 5], ["FU", 5, [1, 2]], ["AN", 5, 1, 4], ["FU", 5, [2, 3]], ["AN", 5, 2, 6], ["FU", 3, [0, 1]], ["SP", 3, 0, 32, [1], 1], ["AN", 3, 1, 2], ["FFSP", 3, 0, [2, 1], 1, 1], ["AN", 3, 1, 6], ["FU", 1, [0, 1]], ["SP", 1, 0, 16, [4], 1], ["AN", 1, 1, 2], ["FFSP", 1, 0, [2, 1], 1, 1], ["AN", 1, 1, 6], ["PR", 4, 0, "auto_unroll_max_step$16"]]]], "r": [[0.173918, 0.174732, 0.174706], 0, 8.60019, 1759482768], "v": "v0.6"}
{"i": [["[\"ansor_mm\", 641, 2880, 4096, \"float16\"]", "rocm -keys=rocm,gpu -max_num_threads=256 -max_shared_memory_per_block=49152 -max_threads_per_block=1024 -mcpu=gfx942 -model=unknown -mtriple=amdgcn-amd-amdhsa-hcc -thread_warp_size=64", [-1, 16, 64, 65536, 2147483647, 1024, 16, 64], "llvm -keys=cpu -mtriple=x86_64-unknown-linux-gnu", 0, []], [[], [["CHW", 2, "local"], ["SP", 2, 0, 641, [1, 641, 1, 1], 1], ["SP", 2, 5, 2880, [8, 1, 3, 2], 1], ["SP", 2, 10, 4096, [4, 8], 1], ["RE", 2, [0, 5, 1, 6, 2, 7, 10, 11, 3, 8, 12, 4, 9]], ["FSP", 3, 0, 1, 3], ["FSP", 3, 4, 2, 3], ["RE", 3, [0, 4, 1, 5, 2, 6, 3, 7]], ["CA", 2, 3, 5], ["CHR", 1, "shared", [2]], ["CA", 2, 3, 6], ["CHR", 0, "shared", [3]], ["CA", 1, 4, 6], ["FU", 5, [0, 1]], ["AN", 5, 0, 5], ["FU", 5, [1, 2]], ["AN", 5, 1, 4], ["FU", 5, [2, 3]], ["AN", 5, 2, 6], ["FU", 3, [0, 1]], ["SP", 3, 0, 384, [1], 1], ["AN", 3, 1, 2], ["FFSP", 3, 0, [2, 1], 1, 1], ["AN", 3, 1, 6], ["FU", 1, [0, 1]], ["SP", 1, 0, 32, [1], 1], ["AN", 1, 1, 2], ["FFSP", 1, 0, [2, 1], 1, 1], ["AN", 1, 1, 6], ["PR", 4, 0, "auto_unroll_max_step$0"]]]], "r": [[0.0026224, 0.00262319, 0.0026219], 0, 3.82174, 1759482770], "v": "v0.6"}
{"i": [["[\"ansor_mm\", 641, 2880, 4096, \"float16\"]", "rocm -keys=rocm,gpu -max_num_threads=256 -max_shared_memory_per_block=49152 -max_threads_per_block=1024 -mcpu=gfx942 -model=unknown -mtriple=amdgcn-amd-amdhsa-hcc -thread_warp_size=64", [-1, 16, 64, 65536, 2147483647, 1024, 16, 64], "llvm -keys=cpu -mtriple=x86_64-unknown-linux-gnu", 0, []], [[], [["CHW", 2, "local"], ["SP", 2, 0, 641, [1, 641, 1, 1], 1], ["SP", 2, 5, 2880, [4, 1, 2, 8], 1], ["SP", 2, 10, 4096, [1, 4], 1], ["RE", 2, [0, 5, 1, 6, 2, 7, 10, 11, 3, 8, 12, 4, 9]], ["FSP", 3, 0, 1, 3], ["FSP", 3, 4, 2, 3], ["RE", 3, [0, 4, 1, 5, 2, 6, 3, 7]], ["CA", 2, 3, 5], ["CHR", 1, "shared", [2]], ["CA", 2, 3, 6], ["CHR", 0, "shared", [3]], ["CA", 1, 4, 6], ["FU", 5, [0, 1]], ["AN", 5, 0, 5], ["FU", 5, [1, 2]], ["AN", 5, 1, 4], ["FU", 5, [2, 3]], ["AN", 5, 2, 6], ["FU", 3, [0, 1]], ["SP", 3, 0, 32, [1], 1], ["AN", 3, 1, 2], ["FFSP", 3, 0, [2, 1], 1, 1], ["AN", 3, 1, 6], ["FU", 1, [0, 1]], ["SP", 1, 0, 2, [1], 1], ["AN", 1, 1, 2], ["FFSP", 1, 0, [2, 1], 1, 1], ["AN", 1, 1, 6], ["PR", 4, 0, "auto_unroll_max_step$512"]]]], "r": [[0.00310356, 0.00310369, 0.00310313], 0, 3.54903, 1759482770], "v": "v0.6"}
{"i": [["[\"ansor_mm\", 641, 2880, 4096, \"float16\"]", "rocm -keys=rocm,gpu -max_num_threads=256 -max_shared_memory_per_block=49152 -max_threads_per_block=1024 -mcpu=gfx942 -model=unknown -mtriple=amdgcn-amd-amdhsa-hcc -thread_warp_size=64", [-1, 16, 64, 65536, 2147483647, 1024, 16, 64], "llvm -keys=cpu -mtriple=x86_64-unknown-linux-gnu", 0, []], [[], [["CHW", 2, "local"], ["SP", 2, 0, 641, [1, 641, 1, 1], 1], ["SP", 2, 5, 2880, [3, 1, 96, 1], 1], ["SP", 2, 10, 4096, [4, 1], 1], ["RE", 2, [0, 5, 1, 6, 2, 7, 10, 11, 3, 8, 12, 4, 9]], ["FSP", 3, 0, 1, 3], ["FSP", 3, 4, 2, 3], ["RE", 3, [0, 4, 1, 5, 2, 6, 3, 7]], ["CA", 2, 3, 5], ["CHR", 1, "shared", [2]], ["CA", 2, 3, 6], ["CHR", 0, "shared", [3]], ["CA", 1, 4, 6], ["FU", 5, [0, 1]], ["AN", 5, 0, 5], ["FU", 5, [1, 2]], ["AN", 5, 1, 4], ["FU", 5, [2, 3]], ["AN", 5, 2, 6], ["FU", 3, [0, 1]], ["SP", 3, 0, 768, [1], 1], ["AN", 3, 1, 2], ["FFSP", 3, 0, [2, 1], 1, 1], ["AN", 3, 1, 6], ["FU", 1, [0, 1]], ["SP", 1, 0, 8, [4], 1], ["AN", 1, 1, 2], ["FFSP", 1, 0, [2, 1], 1, 1], ["AN", 1, 1, 6], ["PR", 4, 0, "auto_unroll_max_step$0"]]]], "r": [[0.0190799, 0.0191712, 0.0190733], 0, 3.97374, 1759482771], "v": "v0.6"}
{"i": [["[\"ansor_mm\", 641, 2880, 4096, \"float16\"]", "rocm -keys=rocm,gpu -max_num_threads=256 -max_shared_memory_per_block=49152 -max_threads_per_block=1024 -mcpu=gfx942 -model=unknown -mtriple=amdgcn-amd-amdhsa-hcc -thread_warp_size=64", [-1, 16, 64, 65536, 2147483647, 1024, 16, 64], "llvm -keys=cpu -mtriple=x86_64-unknown-linux-gnu", 0, []], [[], [["CHW", 2, "local"], ["SP", 2, 0, 641, [1, 641, 1, 1], 1], ["SP", 2, 5, 2880, [15, 1, 6, 1], 1], ["SP", 2, 10, 4096, [8, 1], 1], ["RE", 2, [0, 5, 1, 6, 2, 7, 10, 11, 3, 8, 12, 4, 9]], ["FSP", 3, 0, 1, 3], ["FSP", 3, 4, 2, 3], ["RE", 3, [0, 4, 1, 5, 2, 6, 3, 7]], ["CA", 2, 3, 5], ["CHR", 1, "shared", [2]], ["CA", 2, 3, 6], ["CHR", 0, "shared", [3]], ["CA", 1, 4, 6], ["FU", 5, [0, 1]], ["AN", 5, 0, 5], ["FU", 5, [1, 2]], ["AN", 5, 1, 4], ["FU", 5, [2, 3]], ["AN", 5, 2, 6], ["FU", 3, [0, 1]], ["SP", 3, 0, 192, [1], 1], ["AN", 3, 1, 2], ["FFSP", 3, 0, [2, 1], 1, 1], ["AN", 3, 1, 6], ["FU", 1, [0, 1]], ["SP", 1, 0, 32, [8], 1], ["AN", 1, 1, 2], ["FFSP", 1, 0, [2, 1], 1, 1], ["AN", 1, 1, 6], ["PR", 4, 0, "auto_unroll_max_step$16"]]]], "r": [[0.00346559, 0.0034636, 0.00346653], 0, 3.60968, 1759482772], "v": "v0.6"}
{"i": [["[\"ansor_mm\", 641, 2880, 4096, \"float16\"]", "rocm -keys=rocm,gpu -max_num_threads=256 -max_shared_memory_per_block=49152 -max_threads_per_block=1024 -mcpu=gfx942 -model=unknown -mtriple=amdgcn-amd-amdhsa-hcc -thread_warp_size=64", [-1, 16, 64, 65536, 2147483647, 1024, 16, 64], "llvm -keys=cpu -mtriple=x86_64-unknown-linux-gnu", 0, []], [[], [["CHW", 2, "local"], ["SP", 2, 0, 641, [1, 1, 1, 1], 1], ["SP", 2, 5, 2880, [15, 1, 1, 3], 1], ["SP", 2, 10, 4096, [32, 1], 1], ["RE", 2, [0, 5, 1, 6, 2, 7, 10, 11, 3, 8, 12, 4, 9]], ["FSP", 3, 0, 1, 3], ["FSP", 3, 4, 2, 3], ["RE", 3, [0, 4, 1, 5, 2, 6, 3, 7]], ["CA", 2, 3, 5], ["CHR", 1, "shared", [2]], ["CA", 2, 3, 6], ["CHR", 0, "shared", [3]], ["CA", 1, 4, 6], ["FU", 5, [0, 1]], ["AN", 5, 0, 5], ["FU", 5, [1, 2]], ["AN", 5, 1, 4], ["FU", 5, [2, 3]], ["AN", 5, 2, 6], ["FU", 3, [0, 1]], ["SP", 3, 0, 3, [3], 1], ["AN", 3, 1, 2], ["FFSP", 3, 0, [2, 1], 1, 1], ["AN", 3, 1, 6], ["FU", 1, [0, 1]], ["SP", 1, 0, 1, [1], 1], ["AN", 1, 1, 2], ["FFSP", 1, 0, [2, 1], 1, 1], ["AN", 1, 1, 6], ["PR", 4, 0, "auto_unroll_max_step$64"]]]], "r": [[0.0693026, 0.0693369, 0.0691751], 0, 5.33174, 1759482775], "v": "v0.6"}
{"i": [["[\"ansor_mm\", 641, 2880, 4096, \"float16\"]", "rocm -keys=rocm,gpu -max_num_threads=256 -max_shared_memory_per_block=49152 -max_threads_per_block=1024 -mcpu=gfx942 -model=unknown -mtriple=amdgcn-amd-amdhsa-hcc -thread_warp_size=64", [-1, 16, 64, 65536, 2147483647, 1024, 16, 64], "llvm -keys=cpu -mtriple=x86_64-unknown-linux-gnu", 0, []], [[], [["CHW", 2, "local"], ["SP", 2, 0, 641, [1, 641, 1, 1], 1], ["SP", 2, 5, 2880, [4, 1, 40, 1], 1], ["SP", 2, 10, 4096, [8, 4], 1], ["RE", 2, [0, 5, 1, 6, 2, 7, 10, 11, 3, 8, 12, 4, 9]], ["FSP", 3, 0, 1, 3], ["FSP", 3, 4, 2, 3], ["RE", 3, [0, 4, 1, 5, 2, 6, 3, 7]], ["CA", 2, 3, 5], ["CHR", 1, "shared", [2]], ["CA", 2, 3, 6], ["CHR", 0, "shared", [3]], ["CA", 1, 4, 6], ["FU", 5, [0, 1]], ["AN", 5, 0, 5], ["FU", 5, [1, 2]], ["AN", 5, 1, 4], ["FU", 5, [2, 3]], ["AN", 5, 2, 6], ["FU", 3, [0, 1]], ["SP", 3, 0, 1280, [2], 1], ["AN", 3, 1, 2], ["FFSP", 3, 0, [2, 1], 1, 1], ["AN", 3, 1, 6], ["FU", 1, [0, 1]], ["SP", 1, 0, 32, [1], 1], ["AN", 1, 1, 2], ["FFSP", 1, 0, [2, 1], 1, 1], ["AN", 1, 1, 6], ["PR", 4, 0, "auto_unroll_max_step$1024"]]]], "r": [[0.00612659, 0.00613012, 0.0061265], 0, 3.87519, 1759482776], "v": "v0.6"}
{"i": [["[\"ansor_mm\", 641, 2880, 4096, \"float16\"]", "rocm -keys=rocm,gpu -max_num_threads=256 -max_shared_memory_per_block=49152 -max_threads_per_block=1024 -mcpu=gfx942 -model=unknown -mtriple=amdgcn-amd-amdhsa-hcc -thread_warp_size=64", [-1, 16, 64, 65536, 2147483647, 1024, 16, 64], "llvm -keys=cpu -mtriple=x86_64-unknown-linux-gnu", 0, []], [[], [["CHW", 2, "local"], ["SP", 2, 0, 641, [1, 1, 641, 1], 1], ["SP", 2, 5, 2880, [1, 72, 5, 1], 1], ["SP", 2, 10, 4096, [1, 16], 1], ["RE", 2, [0, 5, 1, 6, 2, 7, 10, 11, 3, 8, 12, 4, 9]], ["FSP", 3, 0, 1, 3], ["FSP", 3, 4, 2, 3], ["RE", 3, [0, 4, 1, 5, 2, 6, 3, 7]], ["CA", 2, 3, 5], ["CHR", 1, "shared", [2]], ["CA", 2, 3, 6], ["CHR", 0, "shared", [3]], ["CA", 1, 4, 6], ["FU", 5, [0, 1]], ["AN", 5, 0, 5], ["FU", 5, [1, 2]], ["AN", 5, 1, 4], ["FU", 5, [2, 3]], ["AN", 5, 2, 6], ["FU", 3, [0, 1]], ["SP", 3, 0, 80, [1], 1], ["AN", 3, 1, 2], ["FFSP", 3, 0, [2, 1], 1, 1], ["AN", 3, 1, 6], ["FU", 1, [0, 1]], ["SP", 1, 0, 10256, [1], 1], ["AN", 1, 1, 2], ["FFSP", 1, 0, [2, 1], 1, 1], ["AN", 1, 1, 6], ["PR", 4, 0, "auto_unroll_max_step$16"]]]], "r": [[0.109596, 0.109329, 0.109693], 0, 6.66735, 1759482780], "v": "v0.6"}
{"i": [["[\"ansor_mm\", 641, 2880, 4096, \"float16\"]", "rocm -keys=rocm,gpu -max_num_threads=256 -max_shared_memory_per_block=49152 -max_threads_per_block=1024 -mcpu=gfx942 -model=unknown -mtriple=amdgcn-amd-amdhsa-hcc -thread_warp_size=64", [-1, 16, 64, 65536, 2147483647, 1024, 16, 64], "llvm -keys=cpu -mtriple=x86_64-unknown-linux-gnu", 0, []], [[], [["CHW", 2, "local"], ["SP", 2, 0, 641, [1, 641, 1, 1], 1], ["SP", 2, 5, 2880, [6, 1, 96, 1], 1], ["SP", 2, 10, 4096, [8, 2], 1], ["RE", 2, [0, 5, 1, 6, 2, 7, 10, 11, 3, 8, 12, 4, 9]], ["FSP", 3, 0, 1, 3], ["FSP", 3, 4, 2, 3], ["RE", 3, [0, 4, 1, 5, 2, 6, 3, 7]], ["CA", 2, 3, 5], ["CHR", 1, "shared", [2]], ["CA", 2, 3, 6], ["CHR", 0, "shared", [3]], ["CA", 1, 4, 6], ["FU", 5, [0, 1]], ["AN", 5, 0, 5], ["FU", 5, [1, 2]], ["AN", 5, 1, 4], ["FU", 5, [2, 3]], ["AN", 5, 2, 6], ["FU", 3, [0, 1]], ["SP", 3, 0, 1536, [4], 1], ["AN", 3, 1, 2], ["FFSP", 3, 0, [2, 1], 1, 1], ["AN", 3, 1, 6], ["FU", 1, [0, 1]], ["SP", 1, 0, 16, [4], 1], ["AN", 1, 1, 2], ["FFSP", 1, 0, [2, 1], 1, 1], ["AN", 1, 1, 6], ["PR", 4, 0, "auto_unroll_max_step$16"]]]], "r": [[0.0964816, 0.0964962, 0.0964757], 0, 6.59168, 1759482789], "v": "v0.6"}
{"i": [["[\"ansor_mm\", 641, 2880, 4096, \"float16\"]", "rocm -keys=rocm,gpu -max_num_threads=256 -max_shared_memory_per_block=49152 -max_threads_per_block=1024 -mcpu=gfx942 -model=unknown -mtriple=amdgcn-amd-amdhsa-hcc -thread_warp_size=64", [-1, 16, 64, 65536, 2147483647, 1024, 16, 64], "llvm -keys=cpu -mtriple=x86_64-unknown-linux-gnu", 0, []], [[], [["CHW", 2, "local"], ["SP", 2, 0, 641, [1, 641, 1, 1], 1], ["SP", 2, 5, 2880, [3, 1, 96, 1], 1], ["SP", 2, 10, 4096, [32, 1], 1], ["RE", 2, [0, 5, 1, 6, 2, 7, 10, 11, 3, 8, 12, 4, 9]], ["FSP", 3, 0, 1, 3], ["FSP", 3, 4, 2, 3], ["RE", 3, [0, 4, 1, 5, 2, 6, 3, 7]], ["CA", 2, 3, 5], ["CHR", 1, "shared", [2]], ["CA", 2, 3, 6], ["CHR", 0, "shared", [3]], ["CA", 1, 4, 6], ["FU", 5, [0, 1]], ["AN", 5, 0, 5], ["FU", 5, [1, 2]], ["AN", 5, 1, 4], ["FU", 5, [2, 3]], ["AN", 5, 2, 6], ["FU", 3, [0, 1]], ["SP", 3, 0, 768, [1], 1], ["AN", 3, 1, 2], ["FFSP", 3, 0, [2, 1], 1, 1], ["AN", 3, 1, 6], ["FU", 1, [0, 1]], ["SP", 1, 0, 8, [1], 1], ["AN", 1, 1, 2], ["FFSP", 1, 0, [2, 1], 1, 1], ["AN", 1, 1, 6], ["PR", 4, 0, "auto_unroll_max_step$16"]]]], "r": [[0.02338, 0.0234062, 0.0234043], 0, 4.07742, 1759482790], "v": "v0.6"}
{"i": [["[\"ansor_mm\", 641, 2880, 4096, \"float16\"]", "rocm -keys=rocm,gpu -max_num_threads=256 -max_shared_memory_per_block=49152 -max_threads_per_block=1024 -mcpu=gfx942 -model=unknown -mtriple=amdgcn-amd-amdhsa-hcc -thread_warp_size=64", [-1, 16, 64, 65536, 2147483647, 1024, 16, 64], "llvm -keys=cpu -mtriple=x86_64-unknown-linux-gnu", 0, []], [[], [["CHW", 2, "local"], ["SP", 2, 0, 641, [1, 641, 1, 1], 1], ["SP", 2, 5, 2880, [15, 1, 2, 12], 1], ["SP", 2, 10, 4096, [1, 8], 1], ["RE", 2, [0, 5, 1, 6, 2, 7, 10, 11, 3, 8, 12, 4, 9]], ["FSP", 3, 0, 1, 3], ["FSP", 3, 4, 2, 3], ["RE", 3, [0, 4, 1, 5, 2, 6, 3, 7]], ["CA", 2, 3, 5], ["CHR", 1, "shared", [2]], ["CA", 2, 3, 6], ["CHR", 0, "shared", [3]], ["CA", 1, 4, 6], ["FU", 5, [0, 1]], ["AN", 5, 0, 5], ["FU", 5, [1, 2]], ["AN", 5, 1, 4], ["FU", 5, [2, 3]], ["AN", 5, 2, 6], ["FU", 3, [0, 1]], ["SP", 3, 0, 960, [1], 1], ["AN", 3, 1, 2], ["FFSP", 3, 0, [2, 1], 1, 1], ["AN", 3, 1, 6], ["FU", 1, [0, 1]], ["SP", 1, 0, 8, [1], 1], ["AN", 1, 1, 2], ["FFSP", 1, 0, [2, 1], 1, 1], ["AN", 1, 1, 6], ["PR", 4, 0, "auto_unroll_max_step$512"]]]], "r": [[0.0163242, 0.0163118, 0.0163109], 0, 4.77312, 1759482791], "v": "v0.6"}
{"i": [["[\"ansor_mm\", 641, 2880, 4096, \"float16\"]", "rocm -keys=rocm,gpu -max_num_threads=256 -max_shared_memory_per_block=49152 -max_threads_per_block=1024 -mcpu=gfx942 -model=unknown -mtriple=amdgcn-amd-amdhsa-hcc -thread_warp_size=64", [-1, 16, 64, 65536, 2147483647, 1024, 16, 64], "llvm -keys=cpu -mtriple=x86_64-unknown-linux-gnu", 0, []], [[], [["CHW", 2, "local"], ["SP", 2, 0, 641, [1, 1, 1, 1], 1], ["SP", 2, 5, 2880, [1, 4, 1, 6], 1], ["SP", 2, 10, 4096, [1, 4], 1], ["RE", 2, [0, 5, 1, 6, 2, 7, 10, 11, 3, 8, 12, 4, 9]], ["FSP", 3, 0, 1, 3], ["FSP", 3, 4, 2, 3], ["RE", 3, [0, 4, 1, 5, 2, 6, 3, 7]], ["CA", 2, 3, 5], ["CHR", 1, "shared", [2]], ["CA", 2, 3, 6], ["CHR", 0, "shared", [3]], ["CA", 1, 4, 6], ["FU", 5, [0, 1]], ["AN", 5, 0, 5], ["FU", 5, [1, 2]], ["AN", 5, 1, 4], ["FU", 5, [2, 3]], ["AN", 5, 2, 6], ["FU", 3, [0, 1]], ["SP", 3, 0, 24, [1], 1], ["AN", 3, 1, 2], ["FFSP", 3, 0, [2, 1], 1, 1], ["AN", 3, 1, 6], ["FU", 1, [0, 1]], ["SP", 1, 0, 4, [1], 1], ["AN", 1, 1, 2], ["FFSP", 1, 0, [2, 1], 1, 1], ["AN", 1, 1, 6], ["PR", 4, 0, "auto_unroll_max_step$1024"]]]], "r": [[0.0211393, 0.0211474, 0.0211495], 0, 3.85173, 1759482792], "v": "v0.6"}
{"i": [["[\"ansor_mm\", 641, 2880, 4096, \"float16\"]", "rocm -keys=rocm,gpu -max_num_threads=256 -max_shared_memory_per_block=49152 -max_threads_per_block=1024 -mcpu=gfx942 -model=unknown -mtriple=amdgcn-amd-amdhsa-hcc -thread_warp_size=64", [-1, 16, 64, 65536, 2147483647, 1024, 16, 64], "llvm -keys=cpu -mtriple=x86_64-unknown-linux-gnu", 0, []], [[], [["CHW", 2, "local"], ["SP", 2, 0, 641, [1, 641, 1, 1], 1], ["SP", 2, 5, 2880, [8, 1, 180, 1], 1], ["SP", 2, 10, 4096, [1, 2], 1], ["RE", 2, [0, 5, 1, 6, 2, 7, 10, 11, 3, 8, 12, 4, 9]], ["FSP", 3, 0, 1, 3], ["FSP", 3, 4, 2, 3], ["RE", 3, [0, 4, 1, 5, 2, 6, 3, 7]], ["CA", 2, 3, 5], ["CHR", 1, "shared", [2]], ["CA", 2, 3, 6], ["CHR", 0, "shared", [3]], ["CA", 1, 4, 6], ["FU", 5, [0, 1]], ["AN", 5, 0, 5], ["FU", 5, [1, 2]], ["AN", 5, 1, 4], ["FU", 5, [2, 3]], ["AN", 5, 2, 6], ["FU", 3, [0, 1]], ["SP", 3, 0, 360, [8], 1], ["AN", 3, 1, 2], ["FFSP", 3, 0, [2, 1], 1, 1], ["AN", 3, 1, 6], ["FU", 1, [0, 1]], ["SP", 1, 0, 2, [1], 1], ["AN", 1, 1, 2], ["FFSP", 1, 0, [2, 1], 1, 1], ["AN", 1, 1, 6], ["PR", 4, 0, "auto_unroll_max_step$512"]]]], "r": [[0.244472, 0.244418, 0.244519], 0, 10.7884, 1759482800], "v": "v0.6"}
{"i": [["[\"ansor_mm\", 641, 2880, 4096, \"float16\"]", "rocm -keys=rocm,gpu -max_num_threads=256 -max_shared_memory_per_block=49152 -max_threads_per_block=1024 -mcpu=gfx942 -model=unknown -mtriple=amdgcn-amd-amdhsa-hcc -thread_warp_size=64", [-1, 16, 64, 65536, 2147483647, 1024, 16, 64], "llvm -keys=cpu -mtriple=x86_64-unknown-linux-gnu", 0, []], [[], [["CHW", 2, "local"], ["SP", 2, 0, 641, [1, 1, 1, 1], 1], ["SP", 2, 5, 2880, [2, 120, 3, 1], 1], ["SP", 2, 10, 4096, [2, 8], 1], ["RE", 2, [0, 5, 1, 6, 2, 7, 10, 11, 3, 8, 12, 4, 9]], ["FSP", 3, 0, 1, 3], ["FSP", 3, 4, 2, 3], ["RE", 3, [0, 4, 1, 5, 2, 6, 3, 7]], ["CA", 2, 3, 5], ["CHR", 1, "shared", [2]], ["CA", 2, 3, 6], ["CHR", 0, "shared", [3]], ["CA", 1, 4, 6], ["FU", 5, [0, 1]], ["AN", 5, 0, 5], ["FU", 5, [1, 2]], ["AN", 5, 1, 4], ["FU", 5, [2, 3]], ["AN", 5, 2, 6], ["FU", 3, [0, 1]], ["SP", 3, 0, 32, [1], 1], ["AN", 3, 1, 2], ["FFSP", 3, 0, [2, 1], 1, 1], ["AN", 3, 1, 6], ["FU", 1, [0, 1]], ["SP", 1, 0, 16, [2], 1], ["AN", 1, 1, 2], ["FFSP", 1, 0, [2, 1], 1, 1], ["AN", 1, 1, 6], ["PR", 4, 0, "auto_unroll_max_step$512"]]]], "r": [[0.00644897, 0.00642502, 0.00643565], 0, 3.62132, 1759482801], "v": "v0.6"}
{"i": [["[\"ansor_mm\", 641, 2880, 4096, \"float16\"]", "rocm -keys=rocm,gpu -max_num_threads=256 -max_shared_memory_per_block=49152 -max_threads_per_block=1024 -mcpu=gfx942 -model=unknown -mtriple=amdgcn-amd-amdhsa-hcc -thread_warp_size=64", [-1, 16, 64, 65536, 2147483647, 1024, 16, 64], "llvm -keys=cpu -mtriple=x86_64-unknown-linux-gnu", 0, []], [[], [["CHW", 2, "local"], ["SP", 2, 0, 641, [1, 1, 1, 1], 1], ["SP", 2, 5, 2880, [8, 1, 3, 4], 1], ["SP", 2, 10, 4096, [4, 8], 1], ["RE", 2, [0, 5, 1, 6, 2, 7, 10, 11, 3, 8, 12, 4, 9]], ["FSP", 3, 0, 1, 3], ["FSP", 3, 4, 2, 3], ["RE", 3, [0, 4, 1, 5, 2, 6, 3, 7]], ["CA", 2, 3, 5], ["CHR", 1, "shared", [2]], ["CA", 2, 3, 6], ["CHR", 0, "shared", [3]], ["CA", 1, 4, 6], ["FU", 5, [0, 1]], ["AN", 5, 0, 5], ["FU", 5, [1, 2]], ["AN", 5, 1, 4], ["FU", 5, [2, 3]], ["AN", 5, 2, 6], ["FU", 3, [0, 1]], ["SP", 3, 0, 384, [1], 1], ["AN", 3, 1, 2], ["FFSP", 3, 0, [2, 1], 1, 1], ["AN", 3, 1, 6], ["FU", 1, [0, 1]], ["SP", 1, 0, 32, [1], 1], ["AN", 1, 1, 2], ["FFSP", 1, 0, [2, 1], 1, 1], ["AN", 1, 1, 6], ["PR", 4, 0, "auto_unroll_max_step$0"]]]], "r": [[0.215406, 0.214973, 0.214447], 0, 9.97703, 1759482808], "v": "v0.6"}
{"i": [["[\"ansor_mm\", 641, 2880, 4096, \"float16\"]", "rocm -keys=rocm,gpu -max_num_threads=256 -max_shared_memory_per_block=49152 -max_threads_per_block=1024 -mcpu=gfx942 -model=unknown -mtriple=amdgcn-amd-amdhsa-hcc -thread_warp_size=64", [-1, 16, 64, 65536, 2147483647, 1024, 16, 64], "llvm -keys=cpu -mtriple=x86_64-unknown-linux-gnu", 0, []], [[], [["CHW", 2, "local"], ["SP", 2, 0, 641, [1, 641, 1, 1], 1], ["SP", 2, 5, 2880, [4, 1, 24, 2], 1], ["SP", 2, 10, 4096, [2, 2], 1], ["RE", 2, [0, 5, 1, 6, 2, 7, 10, 11, 3, 8, 12, 4, 9]], ["FSP", 3, 0, 1, 3], ["FSP", 3, 4, 2, 3], ["RE", 3, [0, 4, 1, 5, 2, 6, 3, 7]], ["CA", 2, 3, 5], ["CHR", 1, "shared", [2]], ["CA", 2, 3, 6], ["CHR", 0, "shared", [3]], ["CA", 1, 4, 6], ["FU", 5, [0, 1]], ["AN", 5, 0, 5], ["FU", 5, [1, 2]], ["AN", 5, 1, 4], ["FU", 5, [2, 3]], ["AN", 5, 2, 6], ["FU", 3, [0, 1]], ["SP", 3, 0, 384, [1], 1], ["AN", 3, 1, 2], ["FFSP", 3, 0, [2, 1], 1, 1], ["AN", 3, 1, 6], ["FU", 1, [0, 1]], ["SP", 1, 0, 8, [1], 1], ["AN", 1, 1, 2], ["FFSP", 1, 0, [2, 1], 1, 1], ["AN", 1, 1, 6], ["PR", 4, 0, "auto_unroll_max_step$0"]]]], "r": [[0.0069043, 0.00689896, 0.00690577], 0, 3.66297, 1759482809], "v": "v0.6"}
{"i": [["[\"ansor_mm\", 641, 2880, 4096, \"float16\"]", "rocm -keys=rocm,gpu -max_num_threads=256 -max_shared_memory_per_block=49152 -max_threads_per_block=1024 -mcpu=gfx942 -model=unknown -mtriple=amdgcn-amd-amdhsa-hcc -thread_warp_size=64", [-1, 16, 64, 65536, 2147483647, 1024, 16, 64], "llvm -keys=cpu -mtriple=x86_64-unknown-linux-gnu", 0, []], [[], [["CHW", 2, "local"], ["SP", 2, 0, 641, [1, 641, 1, 1], 1], ["SP", 2, 5, 2880, [1, 1, 12, 8], 1], ["SP", 2, 10, 4096, [1, 32], 1], ["RE", 2, [0, 5, 1, 6, 2, 7, 10, 11, 3, 8, 12, 4, 9]], ["FSP", 3, 0, 1, 3], ["FSP", 3, 4, 2, 3], ["RE", 3, [0, 4, 1, 5, 2, 6, 3, 7]], ["CA", 2, 3, 5], ["CHR", 1, "shared", [2]], ["CA", 2, 3, 6], ["CHR", 0, "shared", [3]], ["CA", 1, 4, 6], ["FU", 5, [0, 1]], ["AN", 5, 0, 5], ["FU", 5, [1, 2]], ["AN", 5, 1, 4], ["FU", 5, [2, 3]], ["AN", 5, 2, 6], ["FU", 3, [0, 1]], ["SP", 3, 0, 3072, [1], 1], ["AN", 3, 1, 2], ["FFSP", 3, 0, [2, 1], 1, 1], ["AN", 3, 1, 6], ["FU", 1, [0, 1]], ["SP", 1, 0, 32, [1], 1], ["AN", 1, 1, 2], ["FFSP", 1, 0, [2, 1], 1, 1], ["AN", 1, 1, 6], ["PR", 4, 0, "auto_unroll_max_step$1024"]]]], "r": [[0.00305831, 0.0030575, 0.00305862], 0, 3.70178, 1759482810], "v": "v0.6"}
{"i": [["[\"ansor_mm\", 641, 2880, 4096, \"float16\"]", "rocm -keys=rocm,gpu -max_num_threads=256 -max_shared_memory_per_block=49152 -max_threads_per_block=1024 -mcpu=gfx942 -model=unknown -mtriple=amdgcn-amd-amdhsa-hcc -thread_warp_size=64", [-1, 16, 64, 65536, 2147483647, 1024, 16, 64], "llvm -keys=cpu -mtriple=x86_64-unknown-linux-gnu", 0, []], [[], [["CHW", 2, "local"], ["SP", 2, 0, 641, [1, 641, 1, 1], 1], ["SP", 2, 5, 2880, [5, 1, 72, 2], 1], ["SP", 2, 10, 4096, [2, 4], 1], ["RE", 2, [0, 5, 1, 6, 2, 7, 10, 11, 3, 8, 12, 4, 9]], ["FSP", 3, 0, 1, 3], ["FSP", 3, 4, 2, 3], ["RE", 3, [0, 4, 1, 5, 2, 6, 3, 7]], ["CA", 2, 3, 5], ["CHR", 1, "shared", [2]], ["CA", 2, 3, 6], ["CHR", 0, "shared", [3]], ["CA", 1, 4, 6], ["FU", 5, [0, 1]], ["AN", 5, 0, 5], ["FU", 5, [1, 2]], ["AN", 5, 1, 4], ["FU", 5, [2, 3]], ["AN", 5, 2, 6], ["FU", 3, [0, 1]], ["SP", 3, 0, 1152, [1], 1], ["AN", 3, 1, 2], ["FFSP", 3, 0, [2, 1], 1, 1], ["AN", 3, 1, 6], ["FU", 1, [0, 1]], ["SP", 1, 0, 8, [4], 1], ["AN", 1, 1, 2], ["FFSP", 1, 0, [2, 1], 1, 1], ["AN", 1, 1, 6], ["PR", 4, 0, "auto_unroll_max_step$512"]]]], "r": [[0.0621099, 0.0621116, 0.0620435], 0, 5.21129, 1759482812], "v": "v0.6"}
{"i": [["[\"ansor_mm\", 641, 2880, 4096, \"float16\"]", "rocm -keys=rocm,gpu -max_num_threads=256 -max_shared_memory_per_block=49152 -max_threads_per_block=1024 -mcpu=gfx942 -model=unknown -mtriple=amdgcn-amd-amdhsa-hcc -thread_warp_size=64", [-1, 16, 64, 65536, 2147483647, 1024, 16, 64], "llvm -keys=cpu -mtriple=x86_64-unknown-linux-gnu", 0, []], [[], [["CHW", 2, "local"], ["SP", 2, 0, 641, [1, 641, 1, 1], 1], ["SP", 2, 5, 2880, [1, 1, 1, 3], 1], ["SP", 2, 10, 4096, [1, 4], 1], ["RE", 2, [0, 5, 1, 6, 2, 7, 10, 11, 3, 8, 12, 4, 9]], ["FSP", 3, 0, 1, 3], ["FSP", 3, 4, 2, 3], ["RE", 3, [0, 4, 1, 5, 2, 6, 3, 7]], ["CA", 2, 3, 5], ["CHR", 1, "shared", [2]], ["CA", 2, 3, 6], ["CHR", 0, "shared", [3]], ["CA", 1, 4, 6], ["FU", 5, [0, 1]], ["AN", 5, 0, 5], ["FU", 5, [1, 2]], ["AN", 5, 1, 4], ["FU", 5, [2, 3]], ["AN", 5, 2, 6], ["FU", 3, [0, 1]], ["SP", 3, 0, 3, [3], 1], ["AN", 3, 1, 2], ["FFSP", 3, 0, [2, 1], 1, 1], ["AN", 3, 1, 6], ["FU", 1, [0, 1]], ["SP", 1, 0, 1, [1], 1], ["AN", 1, 1, 2], ["FFSP", 1, 0, [2, 1], 1, 1], ["AN", 1, 1, 6], ["PR", 4, 0, "auto_unroll_max_step$64"]]]], "r": [[0.00529394, 0.00531366, 0.00528291], 0, 4.0693, 1759482819], "v": "v0.6"}
{"i": [["[\"ansor_mm\", 641, 2880, 4096, \"float16\"]", "rocm -keys=rocm,gpu -max_num_threads=256 -max_shared_memory_per_block=49152 -max_threads_per_block=1024 -mcpu=gfx942 -model=unknown -mtriple=amdgcn-amd-amdhsa-hcc -thread_warp_size=64", [-1, 16, 64, 65536, 2147483647, 1024, 16, 64], "llvm -keys=cpu -mtriple=x86_64-unknown-linux-gnu", 0, []], [[], [["CHW", 2, "local"], ["SP", 2, 0, 641, [1, 1, 1, 1], 1], ["SP", 2, 5, 2880, [3, 1, 4, 6], 1], ["SP", 2, 10, 4096, [2, 1], 1], ["RE", 2, [0, 5, 1, 6, 2, 7, 10, 11, 3, 8, 12, 4, 9]], ["FSP", 3, 0, 1, 3], ["FSP", 3, 4, 2, 3], ["RE", 3, [0, 4, 1, 5, 2, 6, 3, 7]], ["CA", 2, 3, 5], ["CHR", 1, "shared", [2]], ["CA", 2, 3, 6], ["CHR", 0, "shared", [3]], ["CA", 1, 4, 6], ["FU", 5, [0, 1]], ["AN", 5, 0, 5], ["FU", 5, [1, 2]], ["AN", 5, 1, 4], ["FU", 5, [2, 3]], ["AN", 5, 2, 6], ["FU", 3, [0, 1]], ["SP", 3, 0, 48, [1], 1], ["AN", 3, 1, 2], ["FFSP", 3, 0, [2, 1], 1, 1], ["AN", 3, 1, 6], ["FU", 1, [0, 1]], ["SP", 1, 0, 2, [1], 1], ["AN", 1, 1, 2], ["FFSP", 1, 0, [2, 1], 1, 1], ["AN", 1, 1, 6], ["PR", 4, 0, "auto_unroll_max_step$1024"]]]], "r": [[0.0316014, 0.0317229, 0.0317343], 0, 4.17279, 1759482820], "v": "v0.6"}
{"i": [["[\"ansor_mm\", 641, 2880, 4096, \"float16\"]", "rocm -keys=rocm,gpu -max_num_threads=256 -max_shared_memory_per_block=49152 -max_threads_per_block=1024 -mcpu=gfx942 -model=unknown -mtriple=amdgcn-amd-amdhsa-hcc -thread_warp_size=64", [-1, 16, 64, 65536, 2147483647, 1024, 16, 64], "llvm -keys=cpu -mtriple=x86_64-unknown-linux-gnu", 0, []], [[], [["CHW", 2, "local"], ["SP", 2, 0, 641, [1, 1, 641, 1], 1], ["SP", 2, 5, 2880, [4, 144, 1, 1], 1], ["SP", 2, 10, 4096, [1, 1], 1], ["RE", 2, [0, 5, 1, 6, 2, 7, 10, 11, 3, 8, 12, 4, 9]], ["FSP", 3, 0, 1, 3], ["FSP", 3, 4, 2, 3], ["RE", 3, [0, 4, 1, 5, 2, 6, 3, 7]], ["CA", 2, 3, 5], ["CHR", 1, "shared", [2]], ["CA", 2, 3, 6], ["CHR", 0, "shared", [3]], ["CA", 1, 4, 6], ["FU", 5, [0, 1]], ["AN", 5, 0, 5], ["FU", 5, [1, 2]], ["AN", 5, 1, 4], ["FU", 5, [2, 3]], ["AN", 5, 2, 6], ["FU", 3, [0, 1]], ["SP", 3, 0, 2, [1], 1], ["AN", 3, 1, 2], ["FFSP", 3, 0, [2, 1], 1, 1], ["AN", 3, 1, 6], ["FU", 1, [0, 1]], ["SP", 1, 0, 1282, [2], 1], ["AN", 1, 1, 2], ["FFSP", 1, 0, [2, 1], 1, 1], ["AN", 1, 1, 6], ["PR", 4, 0, "auto_unroll_max_step$512"]]]], "r": [[0.484874, 0.484379, 0.484237], 0, 18.2284, 1759482836], "v": "v0.6"}
{"i": [["[\"ansor_mm\", 641, 2880, 4096, \"float16\"]", "rocm -keys=rocm,gpu -max_num_threads=256 -max_shared_memory_per_block=49152 -max_threads_per_block=1024 -mcpu=gfx942 -model=unknown -mtriple=amdgcn-amd-amdhsa-hcc -thread_warp_size=64", [-1, 16, 64, 65536, 2147483647, 1024, 16, 64], "llvm -keys=cpu -mtriple=x86_64-unknown-linux-gnu", 0, []], [[], [["CHW", 2, "local"], ["SP", 2, 0, 641, [1, 641, 1, 1], 1], ["SP", 2, 5, 2880, [5, 1, 72, 2], 1], ["SP", 2, 10, 4096, [2, 4], 1], ["RE", 2, [0, 5, 1, 6, 2, 7, 10, 11, 3, 8, 12, 4, 9]], ["FSP", 3, 0, 1, 3], ["FSP", 3, 4, 2, 3], ["RE", 3, [0, 4, 1, 5, 2, 6, 3, 7]], ["CA", 2, 3, 5], ["CHR", 1, "shared", [2]], ["CA", 2, 3, 6], ["CHR", 0, "shared", [3]], ["CA", 1, 4, 6], ["FU", 5, [0, 1]], ["AN", 5, 0, 5], ["FU", 5, [1, 2]], ["AN", 5, 1, 4], ["FU", 5, [2, 3]], ["AN", 5, 2, 6], ["FU", 3, [0, 1]], ["SP", 3, 0, 1152, [1], 1], ["AN", 3, 1, 2], ["FFSP", 3, 0, [2, 1], 1, 1], ["AN", 3, 1, 6], ["FU", 1, [0, 1]], ["SP", 1, 0, 8, [1], 1], ["AN", 1, 1, 2], ["FFSP", 1, 0, [2, 1], 1, 1], ["AN", 1, 1, 6], ["PR", 4, 0, "auto_unroll_max_step$16"]]]], "r": [[0.062381, 0.0624007, 0.0624046], 0, 5.27524, 1759482838], "v": "v0.6"}
{"i": [["[\"ansor_mm\", 641, 2880, 4096, \"float16\"]", "rocm -keys=rocm,gpu -max_num_threads=256 -max_shared_memory_per_block=49152 -max_threads_per_block=1024 -mcpu=gfx942 -model=unknown -mtriple=amdgcn-amd-amdhsa-hcc -thread_warp_size=64", [-1, 16, 64, 65536, 2147483647, 1024, 16, 64], "llvm -keys=cpu -mtriple=x86_64-unknown-linux-gnu", 0, []], [[], [["CHW", 2, "local"], ["SP", 2, 0, 641, [1, 1, 1, 1], 1], ["SP", 2, 5, 2880, [2, 90, 16, 1], 1], ["SP", 2, 10, 4096, [2, 2], 1], ["RE", 2, [0, 5, 1, 6, 2, 7, 10, 11, 3, 8, 12, 4, 9]], ["FSP", 3, 0, 1, 3], ["FSP", 3, 4, 2, 3], ["RE", 3, [0, 4, 1, 5, 2, 6, 3, 7]], ["CA", 2, 3, 5], ["CHR", 1, "shared", [2]], ["CA", 2, 3, 6], ["CHR", 0, "shared", [3]], ["CA", 1, 4, 6], ["FU", 5, [0, 1]], ["AN", 5, 0, 5], ["FU", 5, [1, 2]], ["AN", 5, 1, 4], ["FU", 5, [2, 3]], ["AN", 5, 2, 6], ["FU", 3, [0, 1]], ["SP", 3, 0, 64, [1], 1], ["AN", 3, 1, 2], ["FFSP", 3, 0, [2, 1], 1, 1], ["AN", 3, 1, 6], ["FU", 1, [0, 1]], ["SP", 1, 0, 4, [1], 1], ["AN", 1, 1, 2], ["FFSP", 1, 0, [2, 1], 1, 1], ["AN", 1, 1, 6], ["PR", 4, 0, "auto_unroll_max_step$16"]]]], "r": [[0.0126251, 0.0126364, 0.0126294], 0, 3.57536, 1759482839], "v": "v0.6"}
{"i": [["[\"ansor_mm\", 641, 2880, 4096, \"float16\"]", "rocm -keys=rocm,gpu -max_num_threads=256 -max_shared_memory_per_block=49152 -max_threads_per_block=1024 -mcpu=gfx942 -model=unknown -mtriple=amdgcn-amd-amdhsa-hcc -thread_warp_size=64", [-1, 16, 64, 65536, 2147483647, 1024, 16, 64], "llvm -keys=cpu -mtriple=x86_64-unknown-linux-gnu", 0, []], [[], [["CHW", 2, "local"], ["SP", 2, 0, 641, [1, 641, 1, 1], 1], ["SP", 2, 5, 2880, [3, 1, 96, 1], 1], ["SP", 2, 10, 4096, [8, 1], 1], ["RE", 2, [0, 5, 1, 6, 2, 7, 10, 11, 3, 8, 12, 4, 9]], ["FSP", 3, 0, 1, 3], ["FSP", 3, 4, 2, 3], ["RE", 3, [0, 4, 1, 5, 2, 6, 3, 7]], ["CA", 2, 3, 5], ["CHR", 1, "shared", [2]], ["CA", 2, 3, 6], ["CHR", 0, "shared", [3]], ["CA", 1, 4, 6], ["FU", 5, [0, 1]], ["AN", 5, 0, 5], ["FU", 5, [1, 2]], ["AN", 5, 1, 4], ["FU", 5, [2, 3]], ["AN", 5, 2, 6], ["FU", 3, [0, 1]], ["SP", 3, 0, 768, [1], 1], ["AN", 3, 1, 2], ["FFSP", 3, 0, [2, 1], 1, 1], ["AN", 3, 1, 6], ["FU", 1, [0, 1]], ["SP", 1, 0, 8, [1], 1], ["AN", 1, 1, 2], ["FFSP", 1, 0, [2, 1], 1, 1], ["AN", 1, 1, 6], ["PR", 4, 0, "auto_unroll_max_step$16"]]]], "r": [[0.0356002, 0.0356, 0.0356144], 0, 4.40007, 1759482841], "v": "v0.6"}
{"i": [["[\"ansor_mm\", 641, 2880, 4096, \"float16\"]", "rocm -keys=rocm,gpu -max_num_threads=256 -max_shared_memory_per_block=49152 -max_threads_per_block=1024 -mcpu=gfx942 -model=unknown -mtriple=amdgcn-amd-amdhsa-hcc -thread_warp_size=64", [-1, 16, 64, 65536, 2147483647, 1024, 16, 64], "llvm -keys=cpu -mtriple=x86_64-unknown-linux-gnu", 0, []], [[], [["CHW", 2, "local"], ["SP", 2, 0, 641, [1, 641, 1, 1], 1], ["SP", 2, 5, 2880, [1, 1, 48, 3], 1], ["SP", 2, 10, 4096, [2, 4], 1], ["RE", 2, [0, 5, 1, 6, 2, 7, 10, 11, 3, 8, 12, 4, 9]], ["FSP", 3, 0, 1, 3], ["FSP", 3, 4, 2, 3], ["RE", 3, [0, 4, 1, 5, 2, 6, 3, 7]], ["CA", 2, 3, 5], ["CHR", 1, "shared", [2]], ["CA", 2, 3, 6], ["CHR", 0, "shared", [3]], ["CA", 1, 4, 6], ["FU", 5, [0, 1]], ["AN", 5, 0, 5], ["FU", 5, [1, 2]], ["AN", 5, 1, 4], ["FU", 5, [2, 3]], ["AN", 5, 2, 6], ["FU", 3, [0, 1]], ["SP", 3, 0, 1152, [1], 1], ["AN", 3, 1, 2], ["FFSP", 3, 0, [2, 1], 1, 1], ["AN", 3, 1, 6], ["FU", 1, [0, 1]], ["SP", 1, 0, 8, [1], 1], ["AN", 1, 1, 2], ["FFSP", 1, 0, [2, 1], 1, 1], ["AN", 1, 1, 6], ["PR", 4, 0, "auto_unroll_max_step$64"]]]], "r": [[0.00456716, 0.00456611, 0.00456491], 0, 3.57147, 1759482842], "v": "v0.6"}
