demo_artifacts/logs/mm_ms/rocm_mm_1280_15360_8192/database_tuning_record.json
[0,[[[["GetBlock",[],["C","main"],["b0"]],["GetBlock",[],["root","main"],["b1"]],["Annotate",["b0","\"SSSRRSRS\""],["meta_schedule.tiling_structure"],[]],["GetLoops",["b0"],[],["l2","l3","l4"]],["SamplePerfectTile",["l2"],[5,64],["v5","v6","v7","v8","v9"]],["Split",["l2","v5","v6","v7","v8","v9"],[1,0],["l10","l11","l12","l13","l14"]],["SamplePerfectTile",["l3"],[5,64],["v15","v16","v17","v18","v19"]],["Split",["l3","v15","v16","v17","v18","v19"],[1,0],["l20","l21","l22","l23","l24"]],["SamplePerfectTile",["l4"],[3,64],["v25","v26","v27"]],["Split",["l4","v25","v26","v27"],[1,0],["l28","l29","l30"]],["Reorder",["l10","l20","l11","l21","l12","l22","l28","l29","l13","l23","l30","l14","l24"],[],[]],["Fuse",["l10","l20"],[1],["l31"]],["Bind",["l31"],["blockIdx.x"],[]],["Fuse",["l11","l21"],[1],["l32"]],["Bind",["l32"],["vthread.x"],[]],["Fuse",["l12","l22"],[1],["l33"]],["Bind",["l33"],["threadIdx.x"],[]],["Annotate",["b0",64],["meta_schedule.thread_extent_low_inclusive"],[]],["Annotate",["b0",1024],["meta_schedule.thread_extent_high_inclusive"],[]],["CacheWrite",["b0",[]],[0,"local"],["b34"]],["ReverseComputeAt",["b34","l33"],[1,-1],[]],["CacheRead",["b0",["b0"]],[0,"shared"],["b35"]],["ComputeAt",["b35","l28"],[1,-1],[]],["GetLoops",["b35"],[],["l36","l37","l38","l39","l40","l41"]],["Fuse",["l40","l41"],[1],["l42"]],["SampleCategorical",[],[[1,2,4,8],[0.25,0.25,0.25,0.25]],["v43"]],["Annotate",["b35","v43"],["meta_schedule.cooperative_fetch"],[]],["CacheRead",["b0",["b0"]],[1,"shared"],["b44"]],["ComputeAt",["b44","l28"],[1,-1],[]],["GetLoops",["b44"],[],["l45","l46","l47","l48","l49","l50"]],["Fuse",["l49","l50"],[1],["l51"]],["SampleCategorical",[],[[1,2,4,8],[0.25,0.25,0.25,0.25]],["v52"]],["Annotate",["b44","v52"],["meta_schedule.cooperative_fetch"],[]],["SampleCategorical",[],[[0,16,64,512,1024],[0.2000000000000000111,0.2000000000000000111,0.2000000000000000111,0.2000000000000000111,0.2000000000000000111]],["v53"]],["Annotate",["b1","v53"],["meta_schedule.unroll_explicit"],[]],["EnterPostproc",[],[],[]],["Unannotate",["b35"],["meta_schedule.cooperative_fetch"],[]],["GetLoops",["b35"],[],["l54","l55","l56","l57","l58"]],["Split",["l58","None",64,2],[1,0],["l59","l60","l61"]],["Vectorize",["l61"],[],[]],["Bind",["l60"],["threadIdx.x"],[]],["Unannotate",["b44"],["meta_schedule.cooperative_fetch"],[]],["GetLoops",["b44"],[],["l62","l63","l64","l65","l66"]],["Split",["l66","None",64,8],[1,0],["l67","l68","l69"]],["Vectorize",["l69"],[],[]],["Bind",["l68"],["threadIdx.x"],[]],["GetBlock",[],["root","main"],["b70"]],["Unannotate",["b70"],["meta_schedule.unroll_explicit"],[]],["GetChildBlocks",["b70"],[],["b71","b72","b73","b74"]],["GetLoops",["b71"],[],["l75","l76","l77","l78","l79","l80","l81"]],["GetLoops",["b72"],[],["l82","l83","l84","l85","l86","l87","l88"]],["GetLoops",["b73"],[],["l89","l90","l91","l92","l93","l94","l95","l96","l97","l98"]],["Annotate",["l89",64],["pragma_auto_unroll_max_step"],[]],["Annotate",["l89",1],["pragma_unroll_explicit"],[]],["GetLoops",["b74"],[],["l99","l100","l101","l102","l103"]],["GetBlock",[],["C","main"],["b104"]],["GetLoops",["b104"],[],["l105","l106","l107","l108","l109","l110","l111","l112","l113","l114"]],["DecomposeReduction",["b104","l108"],[],["b115"]]],[[4,[1,1,8,160,1]],[6,[40,1,8,2,24]],[8,[4096,2,1]],[25,1],[31,3],[33,2]]],[0.66999137366666661197,0.66978824866666675231,0.66999283833333322935],{"host":{"keys":["cpu"],"kind":"llvm","mtriple":"x86_64-unknown-linux-gnu","tag":""},"keys":["rocm","gpu"],"kind":"rocm","max_num_threads":256,"max_shared_memory_per_block":49152,"max_threads_per_block":1024,"mcpu":"gfx942","model":"MI300","mtriple":"amdgcn-amd-amdhsa-hcc","tag":"","thread_warp_size":64},[["TENSOR","float16",[1280,8192]],["TENSOR","float16",[8192,15360]],["TENSOR","float16",[1280,15360]]]]]
[0,[[[["GetBlock",[],["C","main"],["b0"]],["GetBlock",[],["root","main"],["b1"]],["Annotate",["b0","\"SSSRRSRS\""],["meta_schedule.tiling_structure"],[]],["GetLoops",["b0"],[],["l2","l3","l4"]],["SamplePerfectTile",["l2"],[5,64],["v5","v6","v7","v8","v9"]],["Split",["l2","v5","v6","v7","v8","v9"],[1,0],["l10","l11","l12","l13","l14"]],["SamplePerfectTile",["l3"],[5,64],["v15","v16","v17","v18","v19"]],["Split",["l3","v15","v16","v17","v18","v19"],[1,0],["l20","l21","l22","l23","l24"]],["SamplePerfectTile",["l4"],[3,64],["v25","v26","v27"]],["Split",["l4","v25","v26","v27"],[1,0],["l28","l29","l30"]],["Reorder",["l10","l20","l11","l21","l12","l22","l28","l29","l13","l23","l30","l14","l24"],[],[]],["Fuse",["l10","l20"],[1],["l31"]],["Bind",["l31"],["blockIdx.x"],[]],["Fuse",["l11","l21"],[1],["l32"]],["Bind",["l32"],["vthread.x"],[]],["Fuse",["l12","l22"],[1],["l33"]],["Bind",["l33"],["threadIdx.x"],[]],["Annotate",["b0",64],["meta_schedule.thread_extent_low_inclusive"],[]],["Annotate",["b0",1024],["meta_schedule.thread_extent_high_inclusive"],[]],["CacheWrite",["b0",[]],[0,"local"],["b34"]],["ReverseComputeAt",["b34","l33"],[1,-1],[]],["CacheRead",["b0",["b0"]],[0,"shared"],["b35"]],["ComputeAt",["b35","l28"],[1,-1],[]],["GetLoops",["b35"],[],["l36","l37","l38","l39","l40","l41"]],["Fuse",["l40","l41"],[1],["l42"]],["SampleCategorical",[],[[1,2,4,8],[0.25,0.25,0.25,0.25]],["v43"]],["Annotate",["b35","v43"],["meta_schedule.cooperative_fetch"],[]],["CacheRead",["b0",["b0"]],[1,"shared"],["b44"]],["ComputeAt",["b44","l28"],[1,-1],[]],["GetLoops",["b44"],[],["l45","l46","l47","l48","l49","l50"]],["Fuse",["l49","l50"],[1],["l51"]],["SampleCategorical",[],[[1,2,4,8],[0.25,0.25,0.25,0.25]],["v52"]],["Annotate",["b44","v52"],["meta_schedule.cooperative_fetch"],[]],["SampleCategorical",[],[[0,16,64,512,1024],[0.2000000000000000111,0.2000000000000000111,0.2000000000000000111,0.2000000000000000111,0.2000000000000000111]],["v53"]],["Annotate",["b1","v53"],["meta_schedule.unroll_explicit"],[]],["EnterPostproc",[],[],[]],["Unannotate",["b35"],["meta_schedule.cooperative_fetch"],[]],["GetLoops",["b35"],[],["l54","l55","l56","l57","l58"]],["Split",["l58","None",80,2],[1,0],["l59","l60","l61"]],["Vectorize",["l61"],[],[]],["Bind",["l60"],["threadIdx.x"],[]],["Unannotate",["b44"],["meta_schedule.cooperative_fetch"],[]],["GetLoops",["b44"],[],["l62","l63","l64","l65","l66"]],["Split",["l66","None",80,2],[1,0],["l67","l68","l69"]],["Vectorize",["l69"],[],[]],["Bind",["l68"],["threadIdx.x"],[]],["GetBlock",[],["root","main"],["b70"]],["Unannotate",["b70"],["meta_schedule.unroll_explicit"],[]],["GetChildBlocks",["b70"],[],["b71","b72","b73","b74"]],["GetLoops",["b71"],[],["l75","l76","l77","l78","l79","l80","l81"]],["GetLoops",["b72"],[],["l82","l83","l84","l85","l86","l87","l88"]],["GetLoops",["b73"],[],["l89","l90","l91","l92","l93","l94","l95","l96","l97","l98"]],["GetLoops",["b74"],[],["l99","l100","l101","l102","l103"]],["GetBlock",[],["C","main"],["b104"]],["GetLoops",["b104"],[],["l105","l106","l107","l108","l109","l110","l111","l112","l113","l114"]],["DecomposeReduction",["b104","l108"],[],["b115"]]],[[4,[4,8,10,4,1]],[6,[96,2,8,5,2]],[8,[512,16,1]],[25,1],[31,1],[33,0]]],[0.2399991046666666572,0.23974279766666664604,0.24001145400000001295],{"host":{"keys":["cpu"],"kind":"llvm","mtriple":"x86_64-unknown-linux-gnu","tag":""},"keys":["rocm","gpu"],"kind":"rocm","max_num_threads":256,"max_shared_memory_per_block":49152,"max_threads_per_block":1024,"mcpu":"gfx942","model":"MI300","mtriple":"amdgcn-amd-amdhsa-hcc","tag":"","thread_warp_size":64},[["TENSOR","float16",[1280,8192]],["TENSOR","float16",[8192,15360]],["TENSOR","float16",[1280,15360]]]]]
[0,[[[["GetBlock",[],["C","main"],["b0"]],["GetBlock",[],["root","main"],["b1"]],["Annotate",["b0","\"SSSRRSRS\""],["meta_schedule.tiling_structure"],[]],["GetLoops",["b0"],[],["l2","l3","l4"]],["SamplePerfectTile",["l2"],[5,64],["v5","v6","v7","v8","v9"]],["Split",["l2","v5","v6","v7","v8","v9"],[1,0],["l10","l11","l12","l13","l14"]],["SamplePerfectTile",["l3"],[5,64],["v15","v16","v17","v18","v19"]],["Split",["l3","v15","v16","v17","v18","v19"],[1,0],["l20","l21","l22","l23","l24"]],["SamplePerfectTile",["l4"],[3,64],["v25","v26","v27"]],["Split",["l4","v25","v26","v27"],[1,0],["l28","l29","l30"]],["Reorder",["l10","l20","l11","l21","l12","l22","l28","l29","l13","l23","l30","l14","l24"],[],[]],["Fuse",["l10","l20"],[1],["l31"]],["Bind",["l31"],["blockIdx.x"],[]],["Fuse",["l11","l21"],[1],["l32"]],["Bind",["l32"],["vthread.x"],[]],["Fuse",["l12","l22"],[1],["l33"]],["Bind",["l33"],["threadIdx.x"],[]],["Annotate",["b0",64],["meta_schedule.thread_extent_low_inclusive"],[]],["Annotate",["b0",1024],["meta_schedule.thread_extent_high_inclusive"],[]],["CacheWrite",["b0",[]],[0,"local"],["b34"]],["ReverseComputeAt",["b34","l33"],[1,-1],[]],["CacheRead",["b0",["b0"]],[0,"shared"],["b35"]],["ComputeAt",["b35","l28"],[1,-1],[]],["GetLoops",["b35"],[],["l36","l37","l38","l39","l40","l41"]],["Fuse",["l40","l41"],[1],["l42"]],["SampleCategorical",[],[[1,2,4,8],[0.25,0.25,0.25,0.25]],["v43"]],["Annotate",["b35","v43"],["meta_schedule.cooperative_fetch"],[]],["CacheRead",["b0",["b0"]],[1,"shared"],["b44"]],["ComputeAt",["b44","l28"],[1,-1],[]],["GetLoops",["b44"],[],["l45","l46","l47","l48","l49","l50"]],["Fuse",["l49","l50"],[1],["l51"]],["SampleCategorical",[],[[1,2,4,8],[0.25,0.25,0.25,0.25]],["v52"]],["Annotate",["b44","v52"],["meta_schedule.cooperative_fetch"],[]],["SampleCategorical",[],[[0,16,64,512,1024],[0.2000000000000000111,0.2000000000000000111,0.2000000000000000111,0.2000000000000000111,0.2000000000000000111]],["v53"]],["Annotate",["b1","v53"],["meta_schedule.unroll_explicit"],[]],["EnterPostproc",[],[],[]],["Unannotate",["b35"],["meta_schedule.cooperative_fetch"],[]],["GetLoops",["b35"],[],["l54","l55","l56","l57","l58"]],["Split",["l58","None",240,8],[1,0],["l59","l60","l61"]],["Vectorize",["l61"],[],[]],["Bind",["l60"],["threadIdx.x"],[]],["Unannotate",["b44"],["meta_schedule.cooperative_fetch"],[]],["GetLoops",["b44"],[],["l62","l63","l64","l65","l66"]],["Split",["l66","None",240],[1,0],["l67","l68"]],["Bind",["l68"],["threadIdx.x"],[]],["GetBlock",[],["root","main"],["b69"]],["Unannotate",["b69"],["meta_schedule.unroll_explicit"],[]],["GetChildBlocks",["b69"],[],["b70","b71","b72","b73"]],["GetLoops",["b70"],[],["l74","l75","l76","l77","l78","l79","l80"]],["GetLoops",["b71"],[],["l81","l82","l83","l84","l85","l86"]],["GetLoops",["b72"],[],["l87","l88","l89","l90","l91","l92","l93","l94","l95","l96"]],["Annotate",["l87",16],["pragma_auto_unroll_max_step"],[]],["Annotate",["l87",1],["pragma_unroll_explicit"],[]],["GetLoops",["b73"],[],["l97","l98","l99","l100","l101"]],["GetBlock",[],["C","main"],["b102"]],["GetLoops",["b102"],[],["l103","l104","l105","l106","l107","l108","l109","l110","l111","l112"]],["DecomposeReduction",["b102","l106"],[],["b113"]]],[[4,[1,1,40,8,4]],[6,[80,4,6,2,4]],[8,[1024,1,8]],[25,3],[31,0],[33,1]]],[0.87011791966666673925,0.87076456700000004485,0.86860302733333349945],{"host":{"keys":["cpu"],"kind":"llvm","mtriple":"x86_64-unknown-linux-gnu","tag":""},"keys":["rocm","gpu"],"kind":"rocm","max_num_threads":256,"max_shared_memory_per_block":49152,"max_threads_per_block":1024,"mcpu":"gfx942","model":"MI300","mtriple":"amdgcn-amd-amdhsa-hcc","tag":"","thread_warp_size":64},[["TENSOR","float16",[1280,8192]],["TENSOR","float16",[8192,15360]],["TENSOR","float16",[1280,15360]]]]]
[0,[[[["GetBlock",[],["C","main"],["b0"]],["GetBlock",[],["root","main"],["b1"]],["Annotate",["b0","\"SSSRRSRS\""],["meta_schedule.tiling_structure"],[]],["GetLoops",["b0"],[],["l2","l3","l4"]],["SamplePerfectTile",["l2"],[5,64],["v5","v6","v7","v8","v9"]],["Split",["l2","v5","v6","v7","v8","v9"],[1,0],["l10","l11","l12","l13","l14"]],["SamplePerfectTile",["l3"],[5,64],["v15","v16","v17","v18","v19"]],["Split",["l3","v15","v16","v17","v18","v19"],[1,0],["l20","l21","l22","l23","l24"]],["SamplePerfectTile",["l4"],[3,64],["v25","v26","v27"]],["Split",["l4","v25","v26","v27"],[1,0],["l28","l29","l30"]],["Reorder",["l10","l20","l11","l21","l12","l22","l28","l29","l13","l23","l30","l14","l24"],[],[]],["Fuse",["l10","l20"],[1],["l31"]],["Bind",["l31"],["blockIdx.x"],[]],["Fuse",["l11","l21"],[1],["l32"]],["Bind",["l32"],["vthread.x"],[]],["Fuse",["l12","l22"],[1],["l33"]],["Bind",["l33"],["threadIdx.x"],[]],["Annotate",["b0",64],["meta_schedule.thread_extent_low_inclusive"],[]],["Annotate",["b0",1024],["meta_schedule.thread_extent_high_inclusive"],[]],["CacheWrite",["b0",[]],[0,"local"],["b34"]],["ReverseComputeAt",["b34","l33"],[1,-1],[]],["CacheRead",["b0",["b0"]],[0,"shared"],["b35"]],["ComputeAt",["b35","l28"],[1,-1],[]],["GetLoops",["b35"],[],["l36","l37","l38","l39","l40","l41"]],["Fuse",["l40","l41"],[1],["l42"]],["SampleCategorical",[],[[1,2,4,8],[0.25,0.25,0.25,0.25]],["v43"]],["Annotate",["b35","v43"],["meta_schedule.cooperative_fetch"],[]],["CacheRead",["b0",["b0"]],[1,"shared"],["b44"]],["ComputeAt",["b44","l28"],[1,-1],[]],["GetLoops",["b44"],[],["l45","l46","l47","l48","l49","l50"]],["Fuse",["l49","l50"],[1],["l51"]],["SampleCategorical",[],[[1,2,4,8],[0.25,0.25,0.25,0.25]],["v52"]],["Annotate",["b44","v52"],["meta_schedule.cooperative_fetch"],[]],["SampleCategorical",[],[[0,16,64,512,1024],[0.2000000000000000111,0.2000000000000000111,0.2000000000000000111,0.2000000000000000111,0.2000000000000000111]],["v53"]],["Annotate",["b1","v53"],["meta_schedule.unroll_explicit"],[]],["EnterPostproc",[],[],[]],["Unannotate",["b35"],["meta_schedule.cooperative_fetch"],[]],["GetLoops",["b35"],[],["l54","l55","l56","l57","l58"]],["Split",["l58","None",768,8],[1,0],["l59","l60","l61"]],["Vectorize",["l61"],[],[]],["Bind",["l60"],["threadIdx.x"],[]],["Unannotate",["b44"],["meta_schedule.cooperative_fetch"],[]],["GetLoops",["b44"],[],["l62","l63","l64","l65","l66"]],["Split",["l66","None",768,4],[1,0],["l67","l68","l69"]],["Vectorize",["l69"],[],[]],["Bind",["l68"],["threadIdx.x"],[]],["GetBlock",[],["root","main"],["b70"]],["Unannotate",["b70"],["meta_schedule.unroll_explicit"],[]],["GetChildBlocks",["b70"],[],["b71","b72","b73","b74"]],["GetLoops",["b71"],[],["l75","l76","l77","l78","l79","l80","l81"]],["GetLoops",["b72"],[],["l82","l83","l84","l85","l86","l87","l88"]],["GetLoops",["b73"],[],["l89","l90","l91","l92","l93","l94","l95","l96","l97","l98"]],["Annotate",["l89",16],["pragma_auto_unroll_max_step"],[]],["Annotate",["l89",1],["pragma_unroll_explicit"],[]],["GetLoops",["b74"],[],["l99","l100","l101","l102","l103"]],["GetBlock",[],["C","main"],["b104"]],["GetLoops",["b104"],[],["l105","l106","l107","l108","l109","l110","l111","l112","l113","l114"]],["DecomposeReduction",["b104","l108"],[],["b115"]]],[[4,[1,1,128,5,2]],[6,[320,1,6,2,4]],[8,[512,1,16]],[25,3],[31,2],[33,1]]],[0.024326942399999999106,0.024341700599999998439,0.024375332600000000627],{"host":{"keys":["cpu"],"kind":"llvm","mtriple":"x86_64-unknown-linux-gnu","tag":""},"keys":["rocm","gpu"],"kind":"rocm","max_num_threads":256,"max_shared_memory_per_block":49152,"max_threads_per_block":1024,"mcpu":"gfx942","model":"MI300","mtriple":"amdgcn-amd-amdhsa-hcc","tag":"","thread_warp_size":64},[["TENSOR","float16",[1280,8192]],["TENSOR","float16",[8192,15360]],["TENSOR","float16",[1280,15360]]]]]
[0,[[[["GetBlock",[],["C","main"],["b0"]],["GetBlock",[],["root","main"],["b1"]],["Annotate",["b0","\"SSSRRSRS\""],["meta_schedule.tiling_structure"],[]],["GetLoops",["b0"],[],["l2","l3","l4"]],["SamplePerfectTile",["l2"],[5,64],["v5","v6","v7","v8","v9"]],["Split",["l2","v5","v6","v7","v8","v9"],[1,0],["l10","l11","l12","l13","l14"]],["SamplePerfectTile",["l3"],[5,64],["v15","v16","v17","v18","v19"]],["Split",["l3","v15","v16","v17","v18","v19"],[1,0],["l20","l21","l22","l23","l24"]],["SamplePerfectTile",["l4"],[3,64],["v25","v26","v27"]],["Split",["l4","v25","v26","v27"],[1,0],["l28","l29","l30"]],["Reorder",["l10","l20","l11","l21","l12","l22","l28","l29","l13","l23","l30","l14","l24"],[],[]],["Fuse",["l10","l20"],[1],["l31"]],["Bind",["l31"],["blockIdx.x"],[]],["Fuse",["l11","l21"],[1],["l32"]],["Bind",["l32"],["vthread.x"],[]],["Fuse",["l12","l22"],[1],["l33"]],["Bind",["l33"],["threadIdx.x"],[]],["Annotate",["b0",64],["meta_schedule.thread_extent_low_inclusive"],[]],["Annotate",["b0",1024],["meta_schedule.thread_extent_high_inclusive"],[]],["CacheWrite",["b0",[]],[0,"local"],["b34"]],["ReverseComputeAt",["b34","l33"],[1,-1],[]],["CacheRead",["b0",["b0"]],[0,"shared"],["b35"]],["ComputeAt",["b35","l28"],[1,-1],[]],["GetLoops",["b35"],[],["l36","l37","l38","l39","l40","l41"]],["Fuse",["l40","l41"],[1],["l42"]],["SampleCategorical",[],[[1,2,4,8],[0.25,0.25,0.25,0.25]],["v43"]],["Annotate",["b35","v43"],["meta_schedule.cooperative_fetch"],[]],["CacheRead",["b0",["b0"]],[1,"shared"],["b44"]],["ComputeAt",["b44","l28"],[1,-1],[]],["GetLoops",["b44"],[],["l45","l46","l47","l48","l49","l50"]],["Fuse",["l49","l50"],[1],["l51"]],["SampleCategorical",[],[[1,2,4,8],[0.25,0.25,0.25,0.25]],["v52"]],["Annotate",["b44","v52"],["meta_schedule.cooperative_fetch"],[]],["SampleCategorical",[],[[0,16,64,512,1024],[0.2000000000000000111,0.2000000000000000111,0.2000000000000000111,0.2000000000000000111,0.2000000000000000111]],["v53"]],["Annotate",["b1","v53"],["meta_schedule.unroll_explicit"],[]],["EnterPostproc",[],[],[]],["Unannotate",["b35"],["meta_schedule.cooperative_fetch"],[]],["GetLoops",["b35"],[],["l54","l55","l56","l57","l58"]],["Split",["l58","None",128,4],[1,0],["l59","l60","l61"]],["Vectorize",["l61"],[],[]],["Bind",["l60"],["threadIdx.x"],[]],["Unannotate",["b44"],["meta_schedule.cooperative_fetch"],[]],["GetLoops",["b44"],[],["l62","l63","l64","l65","l66"]],["Split",["l66","None",128,8],[1,0],["l67","l68","l69"]],["Vectorize",["l69"],[],[]],["Bind",["l68"],["threadIdx.x"],[]],["GetBlock",[],["root","main"],["b70"]],["Unannotate",["b70"],["meta_schedule.unroll_explicit"],[]],["GetChildBlocks",["b70"],[],["b71","b72","b73","b74"]],["GetLoops",["b71"],[],["l75","l76","l77","l78","l79","l80","l81"]],["GetLoops",["b72"],[],["l82","l83","l84","l85","l86","l87","l88"]],["GetLoops",["b73"],[],["l89","l90","l91","l92","l93","l94","l95","l96","l97","l98"]],["GetLoops",["b74"],[],["l99","l100","l101","l102","l103"]],["GetBlock",[],["C","main"],["b104"]],["GetLoops",["b104"],[],["l105","l106","l107","l108","l109","l110","l111","l112","l113","l114"]],["DecomposeReduction",["b104","l108"],[],["b115"]]],[[4,[40,16,2,1,1]],[6,[16,5,64,1,3]],[8,[8192,1,1]],[25,2],[31,3],[33,0]]],[0.26908430966666668782,0.26894372533333332775,0.26815940333333332379],{"host":{"keys":["cpu"],"kind":"llvm","mtriple":"x86_64-unknown-linux-gnu","tag":""},"keys":["rocm","gpu"],"kind":"rocm","max_num_threads":256,"max_shared_memory_per_block":49152,"max_threads_per_block":1024,"mcpu":"gfx942","model":"MI300","mtriple":"amdgcn-amd-amdhsa-hcc","tag":"","thread_warp_size":64},[["TENSOR","float16",[1280,8192]],["TENSOR","float16",[8192,15360]],["TENSOR","float16",[1280,15360]]]]]
[0,[[[["GetBlock",[],["C","main"],["b0"]],["GetBlock",[],["root","main"],["b1"]],["Annotate",["b0","\"SSSRRSRS\""],["meta_schedule.tiling_structure"],[]],["GetLoops",["b0"],[],["l2","l3","l4"]],["SamplePerfectTile",["l2"],[5,64],["v5","v6","v7","v8","v9"]],["Split",["l2","v5","v6","v7","v8","v9"],[1,0],["l10","l11","l12","l13","l14"]],["SamplePerfectTile",["l3"],[5,64],["v15","v16","v17","v18","v19"]],["Split",["l3","v15","v16","v17","v18","v19"],[1,0],["l20","l21","l22","l23","l24"]],["SamplePerfectTile",["l4"],[3,64],["v25","v26","v27"]],["Split",["l4","v25","v26","v27"],[1,0],["l28","l29","l30"]],["Reorder",["l10","l20","l11","l21","l12","l22","l28","l29","l13","l23","l30","l14","l24"],[],[]],["Fuse",["l10","l20"],[1],["l31"]],["Bind",["l31"],["blockIdx.x"],[]],["Fuse",["l11","l21"],[1],["l32"]],["Bind",["l32"],["vthread.x"],[]],["Fuse",["l12","l22"],[1],["l33"]],["Bind",["l33"],["threadIdx.x"],[]],["Annotate",["b0",64],["meta_schedule.thread_extent_low_inclusive"],[]],["Annotate",["b0",1024],["meta_schedule.thread_extent_high_inclusive"],[]],["CacheWrite",["b0",[]],[0,"local"],["b34"]],["ReverseComputeAt",["b34","l33"],[1,-1],[]],["CacheRead",["b0",["b0"]],[0,"shared"],["b35"]],["ComputeAt",["b35","l28"],[1,-1],[]],["GetLoops",["b35"],[],["l36","l37","l38","l39","l40","l41"]],["Fuse",["l40","l41"],[1],["l42"]],["SampleCategorical",[],[[1,2,4,8],[0.25,0.25,0.25,0.25]],["v43"]],["Annotate",["b35","v43"],["meta_schedule.cooperative_fetch"],[]],["CacheRead",["b0",["b0"]],[1,"shared"],["b44"]],["ComputeAt",["b44","l28"],[1,-1],[]],["GetLoops",["b44"],[],["l45","l46","l47","l48","l49","l50"]],["Fuse",["l49","l50"],[1],["l51"]],["SampleCategorical",[],[[1,2,4,8],[0.25,0.25,0.25,0.25]],["v52"]],["Annotate",["b44","v52"],["meta_schedule.cooperative_fetch"],[]],["SampleCategorical",[],[[0,16,64,512,1024],[0.2000000000000000111,0.2000000000000000111,0.2000000000000000111,0.2000000000000000111,0.2000000000000000111]],["v53"]],["Annotate",["b1","v53"],["meta_schedule.unroll_explicit"],[]],["EnterPostproc",[],[],[]],["Unannotate",["b35"],["meta_schedule.cooperative_fetch"],[]],["GetLoops",["b35"],[],["l54","l55","l56","l57","l58"]],["Split",["l58","None",1024,2],[1,0],["l59","l60","l61"]],["Vectorize",["l61"],[],[]],["Bind",["l60"],["threadIdx.x"],[]],["Unannotate",["b44"],["meta_schedule.cooperative_fetch"],[]],["GetLoops",["b44"],[],["l62","l63","l64","l65","l66"]],["Split",["l66","None",1024,2],[1,0],["l67","l68","l69"]],["Vectorize",["l69"],[],[]],["Bind",["l68"],["threadIdx.x"],[]],["GetBlock",[],["root","main"],["b70"]],["Unannotate",["b70"],["meta_schedule.unroll_explicit"],[]],["GetChildBlocks",["b70"],[],["b71","b72","b73","b74"]],["GetLoops",["b71"],[],["l75","l76","l77","l78","l79","l80","l81"]],["GetLoops",["b72"],[],["l82","l83","l84","l85","l86","l87","l88"]],["GetLoops",["b73"],[],["l89","l90","l91","l92","l93","l94","l95","l96","l97","l98"]],["GetLoops",["b74"],[],["l99","l100","l101","l102","l103"]],["GetBlock",[],["C","main"],["b104"]],["GetLoops",["b104"],[],["l105","l106","l107","l108","l109","l110","l111","l112","l113","l114"]],["DecomposeReduction",["b104","l108"],[],["b115"]]],[[4,[8,1,16,1,10]],[6,[4,10,64,6,1]],[8,[4096,2,1]],[25,1],[31,1],[33,0]]],[1.2243703609999998516,1.2262966306666667204,1.2273407386666665975],{"host":{"keys":["cpu"],"kind":"llvm","mtriple":"x86_64-unknown-linux-gnu","tag":""},"keys":["rocm","gpu"],"kind":"rocm","max_num_threads":256,"max_shared_memory_per_block":49152,"max_threads_per_block":1024,"mcpu":"gfx942","model":"MI300","mtriple":"amdgcn-amd-amdhsa-hcc","tag":"","thread_warp_size":64},[["TENSOR","float16",[1280,8192]],["TENSOR","float16",[8192,15360]],["TENSOR","float16",[1280,15360]]]]]
[0,[[[["GetBlock",[],["C","main"],["b0"]],["GetBlock",[],["root","main"],["b1"]],["Annotate",["b0","\"SSSRRSRS\""],["meta_schedule.tiling_structure"],[]],["GetLoops",["b0"],[],["l2","l3","l4"]],["SamplePerfectTile",["l2"],[5,64],["v5","v6","v7","v8","v9"]],["Split",["l2","v5","v6","v7","v8","v9"],[1,0],["l10","l11","l12","l13","l14"]],["SamplePerfectTile",["l3"],[5,64],["v15","v16","v17","v18","v19"]],["Split",["l3","v15","v16","v17","v18","v19"],[1,0],["l20","l21","l22","l23","l24"]],["SamplePerfectTile",["l4"],[3,64],["v25","v26","v27"]],["Split",["l4","v25","v26","v27"],[1,0],["l28","l29","l30"]],["Reorder",["l10","l20","l11","l21","l12","l22","l28","l29","l13","l23","l30","l14","l24"],[],[]],["Fuse",["l10","l20"],[1],["l31"]],["Bind",["l31"],["blockIdx.x"],[]],["Fuse",["l11","l21"],[1],["l32"]],["Bind",["l32"],["vthread.x"],[]],["Fuse",["l12","l22"],[1],["l33"]],["Bind",["l33"],["threadIdx.x"],[]],["Annotate",["b0",64],["meta_schedule.thread_extent_low_inclusive"],[]],["Annotate",["b0",1024],["meta_schedule.thread_extent_high_inclusive"],[]],["CacheWrite",["b0",[]],[0,"local"],["b34"]],["ReverseComputeAt",["b34","l33"],[1,-1],[]],["CacheRead",["b0",["b0"]],[0,"shared"],["b35"]],["ComputeAt",["b35","l28"],[1,-1],[]],["GetLoops",["b35"],[],["l36","l37","l38","l39","l40","l41"]],["Fuse",["l40","l41"],[1],["l42"]],["SampleCategorical",[],[[1,2,4,8],[0.25,0.25,0.25,0.25]],["v43"]],["Annotate",["b35","v43"],["meta_schedule.cooperative_fetch"],[]],["CacheRead",["b0",["b0"]],[1,"shared"],["b44"]],["ComputeAt",["b44","l28"],[1,-1],[]],["GetLoops",["b44"],[],["l45","l46","l47","l48","l49","l50"]],["Fuse",["l49","l50"],[1],["l51"]],["SampleCategorical",[],[[1,2,4,8],[0.25,0.25,0.25,0.25]],["v52"]],["Annotate",["b44","v52"],["meta_schedule.cooperative_fetch"],[]],["SampleCategorical",[],[[0,16,64,512,1024],[0.2000000000000000111,0.2000000000000000111,0.2000000000000000111,0.2000000000000000111,0.2000000000000000111]],["v53"]],["Annotate",["b1","v53"],["meta_schedule.unroll_explicit"],[]],["EnterPostproc",[],[],[]],["Unannotate",["b35"],["meta_schedule.cooperative_fetch"],[]],["GetLoops",["b35"],[],["l54","l55","l56","l57","l58"]],["Split",["l58","None",768],[1,0],["l59","l60"]],["Bind",["l60"],["threadIdx.x"],[]],["Unannotate",["b44"],["meta_schedule.cooperative_fetch"],[]],["GetLoops",["b44"],[],["l61","l62","l63","l64","l65"]],["Split",["l65","None",768,8],[1,0],["l66","l67","l68"]],["Vectorize",["l68"],[],[]],["Bind",["l67"],["threadIdx.x"],[]],["GetBlock",[],["root","main"],["b69"]],["Unannotate",["b69"],["meta_schedule.unroll_explicit"],[]],["GetChildBlocks",["b69"],[],["b70","b71","b72","b73"]],["GetLoops",["b70"],[],["l74","l75","l76","l77","l78","l79"]],["GetLoops",["b71"],[],["l80","l81","l82","l83","l84","l85","l86"]],["GetLoops",["b72"],[],["l87","l88","l89","l90","l91","l92","l93","l94","l95","l96"]],["Annotate",["l87",16],["pragma_auto_unroll_max_step"],[]],["Annotate",["l87",1],["pragma_unroll_explicit"],[]],["GetLoops",["b73"],[],["l97","l98","l99","l100","l101"]],["GetBlock",[],["C","main"],["b102"]],["GetLoops",["b102"],[],["l103","l104","l105","l106","l107","l108","l109","l110","l111","l112"]],["DecomposeReduction",["b102","l106"],[],["b113"]]],[[4,[5,1,128,1,2]],[6,[320,1,6,8,1]],[8,[512,1,16]],[25,0],[31,3],[33,1]]],[0.0097980505454545452348,0.0098184841818181808892,0.0098059858181818188722],{"host":{"keys":["cpu"],"kind":"llvm","mtriple":"x86_64-unknown-linux-gnu","tag":""},"keys":["rocm","gpu"],"kind":"rocm","max_num_threads":256,"max_shared_memory_per_block":49152,"max_threads_per_block":1024,"mcpu":"gfx942","model":"MI300","mtriple":"amdgcn-amd-amdhsa-hcc","tag":"","thread_warp_size":64},[["TENSOR","float16",[1280,8192]],["TENSOR","float16",[8192,15360]],["TENSOR","float16",[1280,15360]]]]]
[0,[[[["GetBlock",[],["C","main"],["b0"]],["GetBlock",[],["root","main"],["b1"]],["Annotate",["b0","\"SSSRRSRS\""],["meta_schedule.tiling_structure"],[]],["GetLoops",["b0"],[],["l2","l3","l4"]],["SamplePerfectTile",["l2"],[5,64],["v5","v6","v7","v8","v9"]],["Split",["l2","v5","v6","v7","v8","v9"],[1,0],["l10","l11","l12","l13","l14"]],["SamplePerfectTile",["l3"],[5,64],["v15","v16","v17","v18","v19"]],["Split",["l3","v15","v16","v17","v18","v19"],[1,0],["l20","l21","l22","l23","l24"]],["SamplePerfectTile",["l4"],[3,64],["v25","v26","v27"]],["Split",["l4","v25","v26","v27"],[1,0],["l28","l29","l30"]],["Reorder",["l10","l20","l11","l21","l12","l22","l28","l29","l13","l23","l30","l14","l24"],[],[]],["Fuse",["l10","l20"],[1],["l31"]],["Bind",["l31"],["blockIdx.x"],[]],["Fuse",["l11","l21"],[1],["l32"]],["Bind",["l32"],["vthread.x"],[]],["Fuse",["l12","l22"],[1],["l33"]],["Bind",["l33"],["threadIdx.x"],[]],["Annotate",["b0",64],["meta_schedule.thread_extent_low_inclusive"],[]],["Annotate",["b0",1024],["meta_schedule.thread_extent_high_inclusive"],[]],["CacheWrite",["b0",[]],[0,"local"],["b34"]],["ReverseComputeAt",["b34","l33"],[1,-1],[]],["CacheRead",["b0",["b0"]],[0,"shared"],["b35"]],["ComputeAt",["b35","l28"],[1,-1],[]],["GetLoops",["b35"],[],["l36","l37","l38","l39","l40","l41"]],["Fuse",["l40","l41"],[1],["l42"]],["SampleCategorical",[],[[1,2,4,8],[0.25,0.25,0.25,0.25]],["v43"]],["Annotate",["b35","v43"],["meta_schedule.cooperative_fetch"],[]],["CacheRead",["b0",["b0"]],[1,"shared"],["b44"]],["ComputeAt",["b44","l28"],[1,-1],[]],["GetLoops",["b44"],[],["l45","l46","l47","l48","l49","l50"]],["Fuse",["l49","l50"],[1],["l51"]],["SampleCategorical",[],[[1,2,4,8],[0.25,0.25,0.25,0.25]],["v52"]],["Annotate",["b44","v52"],["meta_schedule.cooperative_fetch"],[]],["SampleCategorical",[],[[0,16,64,512,1024],[0.2000000000000000111,0.2000000000000000111,0.2000000000000000111,0.2000000000000000111,0.2000000000000000111]],["v53"]],["Annotate",["b1","v53"],["meta_schedule.unroll_explicit"],[]],["EnterPostproc",[],[],[]],["Unannotate",["b35"],["meta_schedule.cooperative_fetch"],[]],["GetLoops",["b35"],[],["l54","l55","l56","l57","l58"]],["Split",["l58","None",240,8],[1,0],["l59","l60","l61"]],["Vectorize",["l61"],[],[]],["Bind",["l60"],["threadIdx.x"],[]],["Unannotate",["b44"],["meta_schedule.cooperative_fetch"],[]],["GetLoops",["b44"],[],["l62","l63","l64","l65","l66"]],["Split",["l66","None",240,8],[1,0],["l67","l68","l69"]],["Vectorize",["l69"],[],[]],["Bind",["l68"],["threadIdx.x"],[]],["GetBlock",[],["root","main"],["b70"]],["Unannotate",["b70"],["meta_schedule.unroll_explicit"],[]],["GetChildBlocks",["b70"],[],["b71","b72","b73","b74"]],["GetLoops",["b71"],[],["l75","l76","l77","l78","l79","l80","l81"]],["GetLoops",["b72"],[],["l82","l83","l84","l85","l86","l87","l88"]],["GetLoops",["b73"],[],["l89","l90","l91","l92","l93","l94","l95","l96","l97","l98"]],["Annotate",["l89",64],["pragma_auto_unroll_max_step"],[]],["Annotate",["l89",1],["pragma_unroll_explicit"],[]],["GetLoops",["b74"],[],["l99","l100","l101","l102","l103"]],["GetBlock",[],["C","main"],["b104"]],["GetLoops",["b104"],[],["l105","l106","l107","l108","l109","l110","l111","l112","l113","l114"]],["DecomposeReduction",["b104","l108"],[],["b115"]]],[[4,[1,1,40,8,4]],[6,[80,4,6,2,4]],[8,[4096,1,2]],[25,3],[31,3],[33,2]]],[0.22999216699999999736,0.23093644199999999178,0.23065216033333335588],{"host":{"keys":["cpu"],"kind":"llvm","mtriple":"x86_64-unknown-linux-gnu","tag":""},"keys":["rocm","gpu"],"kind":"rocm","max_num_threads":256,"max_shared_memory_per_block":49152,"max_threads_per_block":1024,"mcpu":"gfx942","model":"MI300","mtriple":"amdgcn-amd-amdhsa-hcc","tag":"","thread_warp_size":64},[["TENSOR","float16",[1280,8192]],["TENSOR","float16",[8192,15360]],["TENSOR","float16",[1280,15360]]]]]
[0,[[[["GetBlock",[],["C","main"],["b0"]],["GetBlock",[],["root","main"],["b1"]],["Annotate",["b0","\"SSSRRSRS\""],["meta_schedule.tiling_structure"],[]],["GetLoops",["b0"],[],["l2","l3","l4"]],["SamplePerfectTile",["l2"],[5,64],["v5","v6","v7","v8","v9"]],["Split",["l2","v5","v6","v7","v8","v9"],[1,0],["l10","l11","l12","l13","l14"]],["SamplePerfectTile",["l3"],[5,64],["v15","v16","v17","v18","v19"]],["Split",["l3","v15","v16","v17","v18","v19"],[1,0],["l20","l21","l22","l23","l24"]],["SamplePerfectTile",["l4"],[3,64],["v25","v26","v27"]],["Split",["l4","v25","v26","v27"],[1,0],["l28","l29","l30"]],["Reorder",["l10","l20","l11","l21","l12","l22","l28","l29","l13","l23","l30","l14","l24"],[],[]],["Fuse",["l10","l20"],[1],["l31"]],["Bind",["l31"],["blockIdx.x"],[]],["Fuse",["l11","l21"],[1],["l32"]],["Bind",["l32"],["vthread.x"],[]],["Fuse",["l12","l22"],[1],["l33"]],["Bind",["l33"],["threadIdx.x"],[]],["Annotate",["b0",64],["meta_schedule.thread_extent_low_inclusive"],[]],["Annotate",["b0",1024],["meta_schedule.thread_extent_high_inclusive"],[]],["CacheWrite",["b0",[]],[0,"local"],["b34"]],["ReverseComputeAt",["b34","l33"],[1,-1],[]],["CacheRead",["b0",["b0"]],[0,"shared"],["b35"]],["ComputeAt",["b35","l28"],[1,-1],[]],["GetLoops",["b35"],[],["l36","l37","l38","l39","l40","l41"]],["Fuse",["l40","l41"],[1],["l42"]],["SampleCategorical",[],[[1,2,4,8],[0.25,0.25,0.25,0.25]],["v43"]],["Annotate",["b35","v43"],["meta_schedule.cooperative_fetch"],[]],["CacheRead",["b0",["b0"]],[1,"shared"],["b44"]],["ComputeAt",["b44","l28"],[1,-1],[]],["GetLoops",["b44"],[],["l45","l46","l47","l48","l49","l50"]],["Fuse",["l49","l50"],[1],["l51"]],["SampleCategorical",[],[[1,2,4,8],[0.25,0.25,0.25,0.25]],["v52"]],["Annotate",["b44","v52"],["meta_schedule.cooperative_fetch"],[]],["SampleCategorical",[],[[0,16,64,512,1024],[0.2000000000000000111,0.2000000000000000111,0.2000000000000000111,0.2000000000000000111,0.2000000000000000111]],["v53"]],["Annotate",["b1","v53"],["meta_schedule.unroll_explicit"],[]],["EnterPostproc",[],[],[]],["Unannotate",["b35"],["meta_schedule.cooperative_fetch"],[]],["GetLoops",["b35"],[],["l54","l55","l56","l57","l58"]],["Split",["l58","None",128,4],[1,0],["l59","l60","l61"]],["Vectorize",["l61"],[],[]],["Bind",["l60"],["threadIdx.x"],[]],["Unannotate",["b44"],["meta_schedule.cooperative_fetch"],[]],["GetLoops",["b44"],[],["l62","l63","l64","l65","l66"]],["Split",["l66","None",128],[1,0],["l67","l68"]],["Bind",["l68"],["threadIdx.x"],[]],["GetBlock",[],["root","main"],["b69"]],["Unannotate",["b69"],["meta_schedule.unroll_explicit"],[]],["GetChildBlocks",["b69"],[],["b70","b71","b72","b73"]],["GetLoops",["b70"],[],["l74","l75","l76","l77","l78","l79","l80"]],["GetLoops",["b71"],[],["l81","l82","l83","l84","l85","l86"]],["GetLoops",["b72"],[],["l87","l88","l89","l90","l91","l92","l93","l94","l95","l96"]],["Annotate",["l87",64],["pragma_auto_unroll_max_step"],[]],["Annotate",["l87",1],["pragma_unroll_explicit"],[]],["GetLoops",["b73"],[],["l97","l98","l99","l100","l101"]],["GetBlock",[],["C","main"],["b102"]],["GetLoops",["b102"],[],["l103","l104","l105","l106","l107","l108","l109","l110","l111","l112"]],["DecomposeReduction",["b102","l106"],[],["b113"]]],[[4,[40,16,2,1,1]],[6,[16,1,64,5,3]],[8,[8192,1,1]],[25,2],[31,0],[33,2]]],[0.058824991666666666401,0.058238759333333327273,0.058671055999999999209],{"host":{"keys":["cpu"],"kind":"llvm","mtriple":"x86_64-unknown-linux-gnu","tag":""},"keys":["rocm","gpu"],"kind":"rocm","max_num_threads":256,"max_shared_memory_per_block":49152,"max_threads_per_block":1024,"mcpu":"gfx942","model":"MI300","mtriple":"amdgcn-amd-amdhsa-hcc","tag":"","thread_warp_size":64},[["TENSOR","float16",[1280,8192]],["TENSOR","float16",[8192,15360]],["TENSOR","float16",[1280,15360]]]]]
[0,[[[["GetBlock",[],["C","main"],["b0"]],["GetBlock",[],["root","main"],["b1"]],["Annotate",["b0","\"SSSRRSRS\""],["meta_schedule.tiling_structure"],[]],["GetLoops",["b0"],[],["l2","l3","l4"]],["SamplePerfectTile",["l2"],[5,64],["v5","v6","v7","v8","v9"]],["Split",["l2","v5","v6","v7","v8","v9"],[1,0],["l10","l11","l12","l13","l14"]],["SamplePerfectTile",["l3"],[5,64],["v15","v16","v17","v18","v19"]],["Split",["l3","v15","v16","v17","v18","v19"],[1,0],["l20","l21","l22","l23","l24"]],["SamplePerfectTile",["l4"],[3,64],["v25","v26","v27"]],["Split",["l4","v25","v26","v27"],[1,0],["l28","l29","l30"]],["Reorder",["l10","l20","l11","l21","l12","l22","l28","l29","l13","l23","l30","l14","l24"],[],[]],["Fuse",["l10","l20"],[1],["l31"]],["Bind",["l31"],["blockIdx.x"],[]],["Fuse",["l11","l21"],[1],["l32"]],["Bind",["l32"],["vthread.x"],[]],["Fuse",["l12","l22"],[1],["l33"]],["Bind",["l33"],["threadIdx.x"],[]],["Annotate",["b0",64],["meta_schedule.thread_extent_low_inclusive"],[]],["Annotate",["b0",1024],["meta_schedule.thread_extent_high_inclusive"],[]],["CacheWrite",["b0",[]],[0,"local"],["b34"]],["ReverseComputeAt",["b34","l33"],[1,-1],[]],["CacheRead",["b0",["b0"]],[0,"shared"],["b35"]],["ComputeAt",["b35","l28"],[1,-1],[]],["GetLoops",["b35"],[],["l36","l37","l38","l39","l40","l41"]],["Fuse",["l40","l41"],[1],["l42"]],["SampleCategorical",[],[[1,2,4,8],[0.25,0.25,0.25,0.25]],["v43"]],["Annotate",["b35","v43"],["meta_schedule.cooperative_fetch"],[]],["CacheRead",["b0",["b0"]],[1,"shared"],["b44"]],["ComputeAt",["b44","l28"],[1,-1],[]],["GetLoops",["b44"],[],["l45","l46","l47","l48","l49","l50"]],["Fuse",["l49","l50"],[1],["l51"]],["SampleCategorical",[],[[1,2,4,8],[0.25,0.25,0.25,0.25]],["v52"]],["Annotate",["b44","v52"],["meta_schedule.cooperative_fetch"],[]],["SampleCategorical",[],[[0,16,64,512,1024],[0.2000000000000000111,0.2000000000000000111,0.2000000000000000111,0.2000000000000000111,0.2000000000000000111]],["v53"]],["Annotate",["b1","v53"],["meta_schedule.unroll_explicit"],[]],["EnterPostproc",[],[],[]],["Unannotate",["b35"],["meta_schedule.cooperative_fetch"],[]],["GetLoops",["b35"],[],["l54","l55","l56","l57","l58"]],["Split",["l58","None",200,2],[1,0],["l59","l60","l61"]],["Vectorize",["l61"],[],[]],["Bind",["l60"],["threadIdx.x"],[]],["Unannotate",["b44"],["meta_schedule.cooperative_fetch"],[]],["GetLoops",["b44"],[],["l62","l63","l64","l65","l66"]],["Split",["l66","None",200,2],[1,0],["l67","l68","l69"]],["Vectorize",["l69"],[],[]],["Bind",["l68"],["threadIdx.x"],[]],["GetBlock",[],["root","main"],["b70"]],["Unannotate",["b70"],["meta_schedule.unroll_explicit"],[]],["GetChildBlocks",["b70"],[],["b71","b72","b73","b74"]],["GetLoops",["b71"],[],["l75","l76","l77","l78","l79","l80","l81"]],["GetLoops",["b72"],[],["l82","l83","l84","l85","l86","l87","l88"]],["GetLoops",["b73"],[],["l89","l90","l91","l92","l93","l94","l95","l96","l97","l98"]],["Annotate",["l89",512],["pragma_auto_unroll_max_step"],[]],["Annotate",["l89",1],["pragma_unroll_explicit"],[]],["GetLoops",["b74"],[],["l99","l100","l101","l102","l103"]],["GetBlock",[],["C","main"],["b104"]],["GetLoops",["b104"],[],["l105","l106","l107","l108","l109","l110","l111","l112","l113","l114"]],["DecomposeReduction",["b104","l108"],[],["b115"]]],[[4,[8,4,10,4,1]],[6,[8,1,20,2,48]],[8,[1024,2,4]],[25,1],[31,1],[33,3]]],[0.087906910999999990364,0.087994923666666668982,0.088092915666666674057],{"host":{"keys":["cpu"],"kind":"llvm","mtriple":"x86_64-unknown-linux-gnu","tag":""},"keys":["rocm","gpu"],"kind":"rocm","max_num_threads":256,"max_shared_memory_per_block":49152,"max_threads_per_block":1024,"mcpu":"gfx942","model":"MI300","mtriple":"amdgcn-amd-amdhsa-hcc","tag":"","thread_warp_size":64},[["TENSOR","float16",[1280,8192]],["TENSOR","float16",[8192,15360]],["TENSOR","float16",[1280,15360]]]]]
[0,[[[["GetBlock",[],["C","main"],["b0"]],["GetBlock",[],["root","main"],["b1"]],["Annotate",["b0","\"SSSRRSRS\""],["meta_schedule.tiling_structure"],[]],["GetLoops",["b0"],[],["l2","l3","l4"]],["SamplePerfectTile",["l2"],[5,64],["v5","v6","v7","v8","v9"]],["Split",["l2","v5","v6","v7","v8","v9"],[1,0],["l10","l11","l12","l13","l14"]],["SamplePerfectTile",["l3"],[5,64],["v15","v16","v17","v18","v19"]],["Split",["l3","v15","v16","v17","v18","v19"],[1,0],["l20","l21","l22","l23","l24"]],["SamplePerfectTile",["l4"],[3,64],["v25","v26","v27"]],["Split",["l4","v25","v26","v27"],[1,0],["l28","l29","l30"]],["Reorder",["l10","l20","l11","l21","l12","l22","l28","l29","l13","l23","l30","l14","l24"],[],[]],["Fuse",["l10","l20"],[1],["l31"]],["Bind",["l31"],["blockIdx.x"],[]],["Fuse",["l11","l21"],[1],["l32"]],["Bind",["l32"],["vthread.x"],[]],["Fuse",["l12","l22"],[1],["l33"]],["Bind",["l33"],["threadIdx.x"],[]],["Annotate",["b0",64],["meta_schedule.thread_extent_low_inclusive"],[]],["Annotate",["b0",1024],["meta_schedule.thread_extent_high_inclusive"],[]],["CacheWrite",["b0",[]],[0,"local"],["b34"]],["ReverseComputeAt",["b34","l33"],[1,-1],[]],["CacheRead",["b0",["b0"]],[0,"shared"],["b35"]],["ComputeAt",["b35","l28"],[1,-1],[]],["GetLoops",["b35"],[],["l36","l37","l38","l39","l40","l41"]],["Fuse",["l40","l41"],[1],["l42"]],["SampleCategorical",[],[[1,2,4,8],[0.25,0.25,0.25,0.25]],["v43"]],["Annotate",["b35","v43"],["meta_schedule.cooperative_fetch"],[]],["CacheRead",["b0",["b0"]],[1,"shared"],["b44"]],["ComputeAt",["b44","l28"],[1,-1],[]],["GetLoops",["b44"],[],["l45","l46","l47","l48","l49","l50"]],["Fuse",["l49","l50"],[1],["l51"]],["SampleCategorical",[],[[1,2,4,8],[0.25,0.25,0.25,0.25]],["v52"]],["Annotate",["b44","v52"],["meta_schedule.cooperative_fetch"],[]],["SampleCategorical",[],[[0,16,64,512,1024],[0.2000000000000000111,0.2000000000000000111,0.2000000000000000111,0.2000000000000000111,0.2000000000000000111]],["v53"]],["Annotate",["b1","v53"],["meta_schedule.unroll_explicit"],[]],["EnterPostproc",[],[],[]],["Unannotate",["b35"],["meta_schedule.cooperative_fetch"],[]],["GetLoops",["b35"],[],["l54","l55","l56","l57","l58"]],["Split",["l58","None",64],[1,0],["l59","l60"]],["Bind",["l60"],["threadIdx.x"],[]],["Unannotate",["b44"],["meta_schedule.cooperative_fetch"],[]],["GetLoops",["b44"],[],["l61","l62","l63","l64","l65"]],["Split",["l65","None",64,2],[1,0],["l66","l67","l68"]],["Vectorize",["l68"],[],[]],["Bind",["l67"],["threadIdx.x"],[]],["GetBlock",[],["root","main"],["b69"]],["Unannotate",["b69"],["meta_schedule.unroll_explicit"],[]],["GetChildBlocks",["b69"],[],["b70","b71","b72","b73"]],["GetLoops",["b70"],[],["l74","l75","l76","l77","l78","l79"]],["GetLoops",["b71"],[],["l80","l81","l82","l83","l84","l85","l86"]],["GetLoops",["b72"],[],["l87","l88","l89","l90","l91","l92","l93","l94","l95","l96"]],["Annotate",["l87",64],["pragma_auto_unroll_max_step"],[]],["Annotate",["l87",1],["pragma_unroll_explicit"],[]],["GetLoops",["b73"],[],["l97","l98","l99","l100","l101"]],["GetBlock",[],["C","main"],["b102"]],["GetLoops",["b102"],[],["l103","l104","l105","l106","l107","l108","l109","l110","l111","l112"]],["DecomposeReduction",["b102","l106"],[],["b113"]]],[[4,[32,5,4,2,1]],[6,[8,6,16,1,20]],[8,[4096,1,2]],[25,0],[31,1],[33,2]]],[0.15588617933333334675,0.15620589166666667968,0.15589564000000000199],{"host":{"keys":["cpu"],"kind":"llvm","mtriple":"x86_64-unknown-linux-gnu","tag":""},"keys":["rocm","gpu"],"kind":"rocm","max_num_threads":256,"max_shared_memory_per_block":49152,"max_threads_per_block":1024,"mcpu":"gfx942","model":"MI300","mtriple":"amdgcn-amd-amdhsa-hcc","tag":"","thread_warp_size":64},[["TENSOR","float16",[1280,8192]],["TENSOR","float16",[8192,15360]],["TENSOR","float16",[1280,15360]]]]]
[0,[[[["GetBlock",[],["C","main"],["b0"]],["GetBlock",[],["root","main"],["b1"]],["Annotate",["b0","\"SSSRRSRS\""],["meta_schedule.tiling_structure"],[]],["GetLoops",["b0"],[],["l2","l3","l4"]],["SamplePerfectTile",["l2"],[5,64],["v5","v6","v7","v8","v9"]],["Split",["l2","v5","v6","v7","v8","v9"],[1,0],["l10","l11","l12","l13","l14"]],["SamplePerfectTile",["l3"],[5,64],["v15","v16","v17","v18","v19"]],["Split",["l3","v15","v16","v17","v18","v19"],[1,0],["l20","l21","l22","l23","l24"]],["SamplePerfectTile",["l4"],[3,64],["v25","v26","v27"]],["Split",["l4","v25","v26","v27"],[1,0],["l28","l29","l30"]],["Reorder",["l10","l20","l11","l21","l12","l22","l28","l29","l13","l23","l30","l14","l24"],[],[]],["Fuse",["l10","l20"],[1],["l31"]],["Bind",["l31"],["blockIdx.x"],[]],["Fuse",["l11","l21"],[1],["l32"]],["Bind",["l32"],["vthread.x"],[]],["Fuse",["l12","l22"],[1],["l33"]],["Bind",["l33"],["threadIdx.x"],[]],["Annotate",["b0",64],["meta_schedule.thread_extent_low_inclusive"],[]],["Annotate",["b0",1024],["meta_schedule.thread_extent_high_inclusive"],[]],["CacheWrite",["b0",[]],[0,"local"],["b34"]],["ReverseComputeAt",["b34","l33"],[1,-1],[]],["CacheRead",["b0",["b0"]],[0,"shared"],["b35"]],["ComputeAt",["b35","l28"],[1,-1],[]],["GetLoops",["b35"],[],["l36","l37","l38","l39","l40","l41"]],["Fuse",["l40","l41"],[1],["l42"]],["SampleCategorical",[],[[1,2,4,8],[0.25,0.25,0.25,0.25]],["v43"]],["Annotate",["b35","v43"],["meta_schedule.cooperative_fetch"],[]],["CacheRead",["b0",["b0"]],[1,"shared"],["b44"]],["ComputeAt",["b44","l28"],[1,-1],[]],["GetLoops",["b44"],[],["l45","l46","l47","l48","l49","l50"]],["Fuse",["l49","l50"],[1],["l51"]],["SampleCategorical",[],[[1,2,4,8],[0.25,0.25,0.25,0.25]],["v52"]],["Annotate",["b44","v52"],["meta_schedule.cooperative_fetch"],[]],["SampleCategorical",[],[[0,16,64,512,1024],[0.2000000000000000111,0.2000000000000000111,0.2000000000000000111,0.2000000000000000111,0.2000000000000000111]],["v53"]],["Annotate",["b1","v53"],["meta_schedule.unroll_explicit"],[]],["EnterPostproc",[],[],[]],["Unannotate",["b35"],["meta_schedule.cooperative_fetch"],[]],["GetLoops",["b35"],[],["l54","l55","l56","l57","l58"]],["Split",["l58","None",64,4],[1,0],["l59","l60","l61"]],["Vectorize",["l61"],[],[]],["Bind",["l60"],["threadIdx.x"],[]],["Unannotate",["b44"],["meta_schedule.cooperative_fetch"],[]],["GetLoops",["b44"],[],["l62","l63","l64","l65","l66"]],["Split",["l66","None",64,4],[1,0],["l67","l68","l69"]],["Vectorize",["l69"],[],[]],["Bind",["l68"],["threadIdx.x"],[]],["GetBlock",[],["root","main"],["b70"]],["Unannotate",["b70"],["meta_schedule.unroll_explicit"],[]],["GetChildBlocks",["b70"],[],["b71","b72","b73","b74"]],["GetLoops",["b71"],[],["l75","l76","l77","l78","l79","l80","l81"]],["GetLoops",["b72"],[],["l82","l83","l84","l85","l86","l87","l88"]],["GetLoops",["b73"],[],["l89","l90","l91","l92","l93","l94","l95","l96","l97","l98"]],["Annotate",["l89",16],["pragma_auto_unroll_max_step"],[]],["Annotate",["l89",1],["pragma_unroll_explicit"],[]],["GetLoops",["b74"],[],["l99","l100","l101","l102","l103"]],["GetBlock",[],["C","main"],["b104"]],["GetLoops",["b104"],[],["l105","l106","l107","l108","l109","l110","l111","l112","l113","l114"]],["DecomposeReduction",["b104","l108"],[],["b115"]]],[[4,[1,10,64,2,1]],[6,[64,2,1,12,10]],[8,[512,2,8]],[25,2],[31,2],[33,1]]],[0.89404679333333325619,0.89323331699999997113,0.89249348933333338962],{"host":{"keys":["cpu"],"kind":"llvm","mtriple":"x86_64-unknown-linux-gnu","tag":""},"keys":["rocm","gpu"],"kind":"rocm","max_num_threads":256,"max_shared_memory_per_block":49152,"max_threads_per_block":1024,"mcpu":"gfx942","model":"MI300","mtriple":"amdgcn-amd-amdhsa-hcc","tag":"","thread_warp_size":64},[["TENSOR","float16",[1280,8192]],["TENSOR","float16",[8192,15360]],["TENSOR","float16",[1280,15360]]]]]
[0,[[[["GetBlock",[],["C","main"],["b0"]],["GetBlock",[],["root","main"],["b1"]],["Annotate",["b0","\"SSSRRSRS\""],["meta_schedule.tiling_structure"],[]],["GetLoops",["b0"],[],["l2","l3","l4"]],["SamplePerfectTile",["l2"],[5,64],["v5","v6","v7","v8","v9"]],["Split",["l2","v5","v6","v7","v8","v9"],[1,0],["l10","l11","l12","l13","l14"]],["SamplePerfectTile",["l3"],[5,64],["v15","v16","v17","v18","v19"]],["Split",["l3","v15","v16","v17","v18","v19"],[1,0],["l20","l21","l22","l23","l24"]],["SamplePerfectTile",["l4"],[3,64],["v25","v26","v27"]],["Split",["l4","v25","v26","v27"],[1,0],["l28","l29","l30"]],["Reorder",["l10","l20","l11","l21","l12","l22","l28","l29","l13","l23","l30","l14","l24"],[],[]],["Fuse",["l10","l20"],[1],["l31"]],["Bind",["l31"],["blockIdx.x"],[]],["Fuse",["l11","l21"],[1],["l32"]],["Bind",["l32"],["vthread.x"],[]],["Fuse",["l12","l22"],[1],["l33"]],["Bind",["l33"],["threadIdx.x"],[]],["Annotate",["b0",64],["meta_schedule.thread_extent_low_inclusive"],[]],["Annotate",["b0",1024],["meta_schedule.thread_extent_high_inclusive"],[]],["CacheWrite",["b0",[]],[0,"local"],["b34"]],["ReverseComputeAt",["b34","l33"],[1,-1],[]],["CacheRead",["b0",["b0"]],[0,"shared"],["b35"]],["ComputeAt",["b35","l28"],[1,-1],[]],["GetLoops",["b35"],[],["l36","l37","l38","l39","l40","l41"]],["Fuse",["l40","l41"],[1],["l42"]],["SampleCategorical",[],[[1,2,4,8],[0.25,0.25,0.25,0.25]],["v43"]],["Annotate",["b35","v43"],["meta_schedule.cooperative_fetch"],[]],["CacheRead",["b0",["b0"]],[1,"shared"],["b44"]],["ComputeAt",["b44","l28"],[1,-1],[]],["GetLoops",["b44"],[],["l45","l46","l47","l48","l49","l50"]],["Fuse",["l49","l50"],[1],["l51"]],["SampleCategorical",[],[[1,2,4,8],[0.25,0.25,0.25,0.25]],["v52"]],["Annotate",["b44","v52"],["meta_schedule.cooperative_fetch"],[]],["SampleCategorical",[],[[0,16,64,512,1024],[0.2000000000000000111,0.2000000000000000111,0.2000000000000000111,0.2000000000000000111,0.2000000000000000111]],["v53"]],["Annotate",["b1","v53"],["meta_schedule.unroll_explicit"],[]],["EnterPostproc",[],[],[]],["Unannotate",["b35"],["meta_schedule.cooperative_fetch"],[]],["GetLoops",["b35"],[],["l54","l55","l56","l57","l58"]],["Split",["l58","None",256,4],[1,0],["l59","l60","l61"]],["Vectorize",["l61"],[],[]],["Bind",["l60"],["threadIdx.x"],[]],["Unannotate",["b44"],["meta_schedule.cooperative_fetch"],[]],["GetLoops",["b44"],[],["l62","l63","l64","l65","l66"]],["Split",["l66","None",256],[1,0],["l67","l68"]],["Bind",["l68"],["threadIdx.x"],[]],["GetBlock",[],["root","main"],["b69"]],["Unannotate",["b69"],["meta_schedule.unroll_explicit"],[]],["GetChildBlocks",["b69"],[],["b70","b71","b72","b73"]],["GetLoops",["b70"],[],["l74","l75","l76","l77","l78","l79","l80"]],["GetLoops",["b71"],[],["l81","l82","l83","l84","l85","l86"]],["GetLoops",["b72"],[],["l87","l88","l89","l90","l91","l92","l93","l94","l95","l96"]],["GetLoops",["b73"],[],["l97","l98","l99","l100","l101"]],["GetBlock",[],["C","main"],["b102"]],["GetLoops",["b102"],[],["l103","l104","l105","l106","l107","l108","l109","l110","l111","l112"]],["DecomposeReduction",["b102","l106"],[],["b113"]]],[[4,[8,1,4,1,40]],[6,[3,10,64,2,4]],[8,[8192,1,1]],[25,2],[31,0],[33,0]]],[1.6490338539999997991,1.6519967446666665722,1.6476546223333334851],{"host":{"keys":["cpu"],"kind":"llvm","mtriple":"x86_64-unknown-linux-gnu","tag":""},"keys":["rocm","gpu"],"kind":"rocm","max_num_threads":256,"max_shared_memory_per_block":49152,"max_threads_per_block":1024,"mcpu":"gfx942","model":"MI300","mtriple":"amdgcn-amd-amdhsa-hcc","tag":"","thread_warp_size":64},[["TENSOR","float16",[1280,8192]],["TENSOR","float16",[8192,15360]],["TENSOR","float16",[1280,15360]]]]]
[0,[[[["GetBlock",[],["C","main"],["b0"]],["GetBlock",[],["root","main"],["b1"]],["Annotate",["b0","\"SSSRRSRS\""],["meta_schedule.tiling_structure"],[]],["GetLoops",["b0"],[],["l2","l3","l4"]],["SamplePerfectTile",["l2"],[5,64],["v5","v6","v7","v8","v9"]],["Split",["l2","v5","v6","v7","v8","v9"],[1,0],["l10","l11","l12","l13","l14"]],["SamplePerfectTile",["l3"],[5,64],["v15","v16","v17","v18","v19"]],["Split",["l3","v15","v16","v17","v18","v19"],[1,0],["l20","l21","l22","l23","l24"]],["SamplePerfectTile",["l4"],[3,64],["v25","v26","v27"]],["Split",["l4","v25","v26","v27"],[1,0],["l28","l29","l30"]],["Reorder",["l10","l20","l11","l21","l12","l22","l28","l29","l13","l23","l30","l14","l24"],[],[]],["Fuse",["l10","l20"],[1],["l31"]],["Bind",["l31"],["blockIdx.x"],[]],["Fuse",["l11","l21"],[1],["l32"]],["Bind",["l32"],["vthread.x"],[]],["Fuse",["l12","l22"],[1],["l33"]],["Bind",["l33"],["threadIdx.x"],[]],["Annotate",["b0",64],["meta_schedule.thread_extent_low_inclusive"],[]],["Annotate",["b0",1024],["meta_schedule.thread_extent_high_inclusive"],[]],["CacheWrite",["b0",[]],[0,"local"],["b34"]],["ReverseComputeAt",["b34","l33"],[1,-1],[]],["CacheRead",["b0",["b0"]],[0,"shared"],["b35"]],["ComputeAt",["b35","l28"],[1,-1],[]],["GetLoops",["b35"],[],["l36","l37","l38","l39","l40","l41"]],["Fuse",["l40","l41"],[1],["l42"]],["SampleCategorical",[],[[1,2,4,8],[0.25,0.25,0.25,0.25]],["v43"]],["Annotate",["b35","v43"],["meta_schedule.cooperative_fetch"],[]],["CacheRead",["b0",["b0"]],[1,"shared"],["b44"]],["ComputeAt",["b44","l28"],[1,-1],[]],["GetLoops",["b44"],[],["l45","l46","l47","l48","l49","l50"]],["Fuse",["l49","l50"],[1],["l51"]],["SampleCategorical",[],[[1,2,4,8],[0.25,0.25,0.25,0.25]],["v52"]],["Annotate",["b44","v52"],["meta_schedule.cooperative_fetch"],[]],["SampleCategorical",[],[[0,16,64,512,1024],[0.2000000000000000111,0.2000000000000000111,0.2000000000000000111,0.2000000000000000111,0.2000000000000000111]],["v53"]],["Annotate",["b1","v53"],["meta_schedule.unroll_explicit"],[]],["EnterPostproc",[],[],[]],["Unannotate",["b35"],["meta_schedule.cooperative_fetch"],[]],["GetLoops",["b35"],[],["l54","l55","l56","l57","l58"]],["Split",["l58","None",768,8],[1,0],["l59","l60","l61"]],["Vectorize",["l61"],[],[]],["Bind",["l60"],["threadIdx.x"],[]],["Unannotate",["b44"],["meta_schedule.cooperative_fetch"],[]],["GetLoops",["b44"],[],["l62","l63","l64","l65","l66"]],["Split",["l66","None",768,4],[1,0],["l67","l68","l69"]],["Vectorize",["l69"],[],[]],["Bind",["l68"],["threadIdx.x"],[]],["GetBlock",[],["root","main"],["b70"]],["Unannotate",["b70"],["meta_schedule.unroll_explicit"],[]],["GetChildBlocks",["b70"],[],["b71","b72","b73","b74"]],["GetLoops",["b71"],[],["l75","l76","l77","l78","l79","l80","l81"]],["GetLoops",["b72"],[],["l82","l83","l84","l85","l86","l87","l88"]],["GetLoops",["b73"],[],["l89","l90","l91","l92","l93","l94","l95","l96","l97","l98"]],["Annotate",["l89",16],["pragma_auto_unroll_max_step"],[]],["Annotate",["l89",1],["pragma_unroll_explicit"],[]],["GetLoops",["b74"],[],["l99","l100","l101","l102","l103"]],["GetBlock",[],["C","main"],["b104"]],["GetLoops",["b104"],[],["l105","l106","l107","l108","l109","l110","l111","l112","l113","l114"]],["DecomposeReduction",["b104","l108"],[],["b115"]]],[[4,[1,1,128,1,10]],[6,[320,1,6,8,1]],[8,[512,1,16]],[25,3],[31,2],[33,1]]],[0.011877873666666666913,0.011878309444444444878,0.011839451222222220628],{"host":{"keys":["cpu"],"kind":"llvm","mtriple":"x86_64-unknown-linux-gnu","tag":""},"keys":["rocm","gpu"],"kind":"rocm","max_num_threads":256,"max_shared_memory_per_block":49152,"max_threads_per_block":1024,"mcpu":"gfx942","model":"MI300","mtriple":"amdgcn-amd-amdhsa-hcc","tag":"","thread_warp_size":64},[["TENSOR","float16",[1280,8192]],["TENSOR","float16",[8192,15360]],["TENSOR","float16",[1280,15360]]]]]
[0,[[[["GetBlock",[],["C","main"],["b0"]],["GetBlock",[],["root","main"],["b1"]],["Annotate",["b0","\"SSSRRSRS\""],["meta_schedule.tiling_structure"],[]],["GetLoops",["b0"],[],["l2","l3","l4"]],["SamplePerfectTile",["l2"],[5,64],["v5","v6","v7","v8","v9"]],["Split",["l2","v5","v6","v7","v8","v9"],[1,0],["l10","l11","l12","l13","l14"]],["SamplePerfectTile",["l3"],[5,64],["v15","v16","v17","v18","v19"]],["Split",["l3","v15","v16","v17","v18","v19"],[1,0],["l20","l21","l22","l23","l24"]],["SamplePerfectTile",["l4"],[3,64],["v25","v26","v27"]],["Split",["l4","v25","v26","v27"],[1,0],["l28","l29","l30"]],["Reorder",["l10","l20","l11","l21","l12","l22","l28","l29","l13","l23","l30","l14","l24"],[],[]],["Fuse",["l10","l20"],[1],["l31"]],["Bind",["l31"],["blockIdx.x"],[]],["Fuse",["l11","l21"],[1],["l32"]],["Bind",["l32"],["vthread.x"],[]],["Fuse",["l12","l22"],[1],["l33"]],["Bind",["l33"],["threadIdx.x"],[]],["Annotate",["b0",64],["meta_schedule.thread_extent_low_inclusive"],[]],["Annotate",["b0",1024],["meta_schedule.thread_extent_high_inclusive"],[]],["CacheWrite",["b0",[]],[0,"local"],["b34"]],["ReverseComputeAt",["b34","l33"],[1,-1],[]],["CacheRead",["b0",["b0"]],[0,"shared"],["b35"]],["ComputeAt",["b35","l28"],[1,-1],[]],["GetLoops",["b35"],[],["l36","l37","l38","l39","l40","l41"]],["Fuse",["l40","l41"],[1],["l42"]],["SampleCategorical",[],[[1,2,4,8],[0.25,0.25,0.25,0.25]],["v43"]],["Annotate",["b35","v43"],["meta_schedule.cooperative_fetch"],[]],["CacheRead",["b0",["b0"]],[1,"shared"],["b44"]],["ComputeAt",["b44","l28"],[1,-1],[]],["GetLoops",["b44"],[],["l45","l46","l47","l48","l49","l50"]],["Fuse",["l49","l50"],[1],["l51"]],["SampleCategorical",[],[[1,2,4,8],[0.25,0.25,0.25,0.25]],["v52"]],["Annotate",["b44","v52"],["meta_schedule.cooperative_fetch"],[]],["SampleCategorical",[],[[0,16,64,512,1024],[0.2000000000000000111,0.2000000000000000111,0.2000000000000000111,0.2000000000000000111,0.2000000000000000111]],["v53"]],["Annotate",["b1","v53"],["meta_schedule.unroll_explicit"],[]],["EnterPostproc",[],[],[]],["Unannotate",["b35"],["meta_schedule.cooperative_fetch"],[]],["GetLoops",["b35"],[],["l54","l55","l56","l57","l58"]],["Split",["l58","None",256,4],[1,0],["l59","l60","l61"]],["Vectorize",["l61"],[],[]],["Bind",["l60"],["threadIdx.x"],[]],["Unannotate",["b44"],["meta_schedule.cooperative_fetch"],[]],["GetLoops",["b44"],[],["l62","l63","l64","l65","l66"]],["Split",["l66","None",256],[1,0],["l67","l68"]],["Bind",["l68"],["threadIdx.x"],[]],["GetBlock",[],["root","main"],["b69"]],["Unannotate",["b69"],["meta_schedule.unroll_explicit"],[]],["GetChildBlocks",["b69"],[],["b70","b71","b72","b73"]],["GetLoops",["b70"],[],["l74","l75","l76","l77","l78","l79","l80"]],["GetLoops",["b71"],[],["l81","l82","l83","l84","l85","l86"]],["GetLoops",["b72"],[],["l87","l88","l89","l90","l91","l92","l93","l94","l95","l96"]],["Annotate",["l87",64],["pragma_auto_unroll_max_step"],[]],["Annotate",["l87",1],["pragma_unroll_explicit"],[]],["GetLoops",["b73"],[],["l97","l98","l99","l100","l101"]],["GetBlock",[],["C","main"],["b102"]],["GetLoops",["b102"],[],["l103","l104","l105","l106","l107","l108","l109","l110","l111","l112"]],["DecomposeReduction",["b102","l106"],[],["b113"]]],[[4,[8,1,4,1,40]],[6,[3,10,64,2,4]],[8,[4096,1,2]],[25,2],[31,0],[33,2]]],[1.3520144039999999475,1.354602864333333434,1.3487089026666667646],{"host":{"keys":["cpu"],"kind":"llvm","mtriple":"x86_64-unknown-linux-gnu","tag":""},"keys":["rocm","gpu"],"kind":"rocm","max_num_threads":256,"max_shared_memory_per_block":49152,"max_threads_per_block":1024,"mcpu":"gfx942","model":"MI300","mtriple":"amdgcn-amd-amdhsa-hcc","tag":"","thread_warp_size":64},[["TENSOR","float16",[1280,8192]],["TENSOR","float16",[8192,15360]],["TENSOR","float16",[1280,15360]]]]]
[0,[[[["GetBlock",[],["C","main"],["b0"]],["GetBlock",[],["root","main"],["b1"]],["Annotate",["b0","\"SSSRRSRS\""],["meta_schedule.tiling_structure"],[]],["GetLoops",["b0"],[],["l2","l3","l4"]],["SamplePerfectTile",["l2"],[5,64],["v5","v6","v7","v8","v9"]],["Split",["l2","v5","v6","v7","v8","v9"],[1,0],["l10","l11","l12","l13","l14"]],["SamplePerfectTile",["l3"],[5,64],["v15","v16","v17","v18","v19"]],["Split",["l3","v15","v16","v17","v18","v19"],[1,0],["l20","l21","l22","l23","l24"]],["SamplePerfectTile",["l4"],[3,64],["v25","v26","v27"]],["Split",["l4","v25","v26","v27"],[1,0],["l28","l29","l30"]],["Reorder",["l10","l20","l11","l21","l12","l22","l28","l29","l13","l23","l30","l14","l24"],[],[]],["Fuse",["l10","l20"],[1],["l31"]],["Bind",["l31"],["blockIdx.x"],[]],["Fuse",["l11","l21"],[1],["l32"]],["Bind",["l32"],["vthread.x"],[]],["Fuse",["l12","l22"],[1],["l33"]],["Bind",["l33"],["threadIdx.x"],[]],["Annotate",["b0",64],["meta_schedule.thread_extent_low_inclusive"],[]],["Annotate",["b0",1024],["meta_schedule.thread_extent_high_inclusive"],[]],["CacheWrite",["b0",[]],[0,"local"],["b34"]],["ReverseComputeAt",["b34","l33"],[1,-1],[]],["CacheRead",["b0",["b0"]],[0,"shared"],["b35"]],["ComputeAt",["b35","l28"],[1,-1],[]],["GetLoops",["b35"],[],["l36","l37","l38","l39","l40","l41"]],["Fuse",["l40","l41"],[1],["l42"]],["SampleCategorical",[],[[1,2,4,8],[0.25,0.25,0.25,0.25]],["v43"]],["Annotate",["b35","v43"],["meta_schedule.cooperative_fetch"],[]],["CacheRead",["b0",["b0"]],[1,"shared"],["b44"]],["ComputeAt",["b44","l28"],[1,-1],[]],["GetLoops",["b44"],[],["l45","l46","l47","l48","l49","l50"]],["Fuse",["l49","l50"],[1],["l51"]],["SampleCategorical",[],[[1,2,4,8],[0.25,0.25,0.25,0.25]],["v52"]],["Annotate",["b44","v52"],["meta_schedule.cooperative_fetch"],[]],["SampleCategorical",[],[[0,16,64,512,1024],[0.2000000000000000111,0.2000000000000000111,0.2000000000000000111,0.2000000000000000111,0.2000000000000000111]],["v53"]],["Annotate",["b1","v53"],["meta_schedule.unroll_explicit"],[]],["EnterPostproc",[],[],[]],["Unannotate",["b35"],["meta_schedule.cooperative_fetch"],[]],["GetLoops",["b35"],[],["l54","l55","l56","l57","l58"]],["Split",["l58","None",256,2],[1,0],["l59","l60","l61"]],["Vectorize",["l61"],[],[]],["Bind",["l60"],["threadIdx.x"],[]],["Unannotate",["b44"],["meta_schedule.cooperative_fetch"],[]],["GetLoops",["b44"],[],["l62","l63","l64","l65","l66"]],["Split",["l66","None",256,2],[1,0],["l67","l68","l69"]],["Vectorize",["l69"],[],[]],["Bind",["l68"],["threadIdx.x"],[]],["GetBlock",[],["root","main"],["b70"]],["Unannotate",["b70"],["meta_schedule.unroll_explicit"],[]],["GetChildBlocks",["b70"],[],["b71","b72","b73","b74"]],["GetLoops",["b71"],[],["l75","l76","l77","l78","l79","l80","l81"]],["GetLoops",["b72"],[],["l82","l83","l84","l85","l86","l87","l88"]],["GetLoops",["b73"],[],["l89","l90","l91","l92","l93","l94","l95","l96","l97","l98"]],["Annotate",["l89",1024],["pragma_auto_unroll_max_step"],[]],["Annotate",["l89",1],["pragma_unroll_explicit"],[]],["GetLoops",["b74"],[],["l99","l100","l101","l102","l103"]],["GetBlock",[],["C","main"],["b104"]],["GetLoops",["b104"],[],["l105","l106","l107","l108","l109","l110","l111","l112","l113","l114"]],["DecomposeReduction",["b104","l108"],[],["b115"]]],[[4,[1,16,8,1,10]],[6,[60,2,32,4,1]],[8,[1024,4,2]],[25,1],[31,1],[33,4]]],[2.4769176430000001687,2.4680418293333334923,2.4666806640000000783],{"host":{"keys":["cpu"],"kind":"llvm","mtriple":"x86_64-unknown-linux-gnu","tag":""},"keys":["rocm","gpu"],"kind":"rocm","max_num_threads":256,"max_shared_memory_per_block":49152,"max_threads_per_block":1024,"mcpu":"gfx942","model":"MI300","mtriple":"amdgcn-amd-amdhsa-hcc","tag":"","thread_warp_size":64},[["TENSOR","float16",[1280,8192]],["TENSOR","float16",[8192,15360]],["TENSOR","float16",[1280,15360]]]]]
