demo_artifacts/logs/mm_ms/rocm_mm_642_14336_4096/database_tuning_record.json
[0,[[[["GetBlock",[],["C","main"],["b0"]],["GetBlock",[],["root","main"],["b1"]],["Annotate",["b0","\"SSSRRSRS\""],["meta_schedule.tiling_structure"],[]],["GetLoops",["b0"],[],["l2","l3","l4"]],["SamplePerfectTile",["l2"],[5,64],["v5","v6","v7","v8","v9"]],["Split",["l2","v5","v6","v7","v8","v9"],[1,0],["l10","l11","l12","l13","l14"]],["SamplePerfectTile",["l3"],[5,64],["v15","v16","v17","v18","v19"]],["Split",["l3","v15","v16","v17","v18","v19"],[1,0],["l20","l21","l22","l23","l24"]],["SamplePerfectTile",["l4"],[3,64],["v25","v26","v27"]],["Split",["l4","v25","v26","v27"],[1,0],["l28","l29","l30"]],["Reorder",["l10","l20","l11","l21","l12","l22","l28","l29","l13","l23","l30","l14","l24"],[],[]],["Fuse",["l10","l20"],[1],["l31"]],["Bind",["l31"],["blockIdx.x"],[]],["Fuse",["l11","l21"],[1],["l32"]],["Bind",["l32"],["vthread.x"],[]],["Fuse",["l12","l22"],[1],["l33"]],["Bind",["l33"],["threadIdx.x"],[]],["Annotate",["b0",64],["meta_schedule.thread_extent_low_inclusive"],[]],["Annotate",["b0",1024],["meta_schedule.thread_extent_high_inclusive"],[]],["CacheWrite",["b0",[]],[0,"local"],["b34"]],["ReverseComputeAt",["b34","l33"],[1,-1],[]],["CacheRead",["b0",["b0"]],[0,"shared"],["b35"]],["ComputeAt",["b35","l28"],[1,-1],[]],["GetLoops",["b35"],[],["l36","l37","l38","l39","l40","l41"]],["Fuse",["l40","l41"],[1],["l42"]],["SampleCategorical",[],[[1,2,4,8],[0.25,0.25,0.25,0.25]],["v43"]],["Annotate",["b35","v43"],["meta_schedule.cooperative_fetch"],[]],["CacheRead",["b0",["b0"]],[1,"shared"],["b44"]],["ComputeAt",["b44","l28"],[1,-1],[]],["GetLoops",["b44"],[],["l45","l46","l47","l48","l49","l50"]],["Fuse",["l49","l50"],[1],["l51"]],["SampleCategorical",[],[[1,2,4,8],[0.25,0.25,0.25,0.25]],["v52"]],["Annotate",["b44","v52"],["meta_schedule.cooperative_fetch"],[]],["SampleCategorical",[],[[0,16,64,512,1024],[0.2000000000000000111,0.2000000000000000111,0.2000000000000000111,0.2000000000000000111,0.2000000000000000111]],["v53"]],["Annotate",["b1","v53"],["meta_schedule.unroll_explicit"],[]],["EnterPostproc",[],[],[]],["Unannotate",["b35"],["meta_schedule.cooperative_fetch"],[]],["GetLoops",["b35"],[],["l54","l55","l56","l57","l58"]],["Split",["l58","None",321],[1,0],["l59","l60"]],["Bind",["l60"],["threadIdx.x"],[]],["Unannotate",["b44"],["meta_schedule.cooperative_fetch"],[]],["GetLoops",["b44"],[],["l61","l62","l63","l64","l65"]],["Split",["l65","None",321],[1,0],["l66","l67"]],["Bind",["l67"],["threadIdx.x"],[]],["GetBlock",[],["root","main"],["b68"]],["Unannotate",["b68"],["meta_schedule.unroll_explicit"],[]],["GetChildBlocks",["b68"],[],["b69","b70","b71","b72"]],["GetLoops",["b69"],[],["l73","l74","l75","l76","l77","l78"]],["GetLoops",["b70"],[],["l79","l80","l81","l82","l83","l84"]],["GetLoops",["b71"],[],["l85","l86","l87","l88","l89","l90","l91","l92","l93","l94"]],["Annotate",["l85",64],["pragma_auto_unroll_max_step"],[]],["Annotate",["l85",1],["pragma_unroll_explicit"],[]],["GetLoops",["b72"],[],["l95","l96","l97","l98","l99"]],["GetBlock",[],["C","main"],["b100"]],["GetLoops",["b100"],[],["l101","l102","l103","l104","l105","l106","l107","l108","l109","l110"]],["DecomposeReduction",["b100","l104"],[],["b111"]]],[[4,[2,1,321,1,1]],[6,[112,2,1,1,64]],[8,[1024,1,4]],[25,3],[31,0],[33,2]]],[0.0028711948857142854247,0.002872107142857143261,0.0028723318857142858714],{"host":{"keys":["cpu"],"kind":"llvm","mtriple":"x86_64-unknown-linux-gnu","tag":""},"keys":["rocm","gpu"],"kind":"rocm","max_num_threads":256,"max_shared_memory_per_block":49152,"max_threads_per_block":1024,"mcpu":"gfx942","model":"MI300","mtriple":"amdgcn-amd-amdhsa-hcc","tag":"","thread_warp_size":64},[["TENSOR","float16",[642,4096]],["TENSOR","float16",[4096,14336]],["TENSOR","float16",[642,14336]]]]]
[0,[[[["GetBlock",[],["C","main"],["b0"]],["GetBlock",[],["root","main"],["b1"]],["Annotate",["b0","\"SSSRRSRS\""],["meta_schedule.tiling_structure"],[]],["GetLoops",["b0"],[],["l2","l3","l4"]],["SamplePerfectTile",["l2"],[5,64],["v5","v6","v7","v8","v9"]],["Split",["l2","v5","v6","v7","v8","v9"],[1,0],["l10","l11","l12","l13","l14"]],["SamplePerfectTile",["l3"],[5,64],["v15","v16","v17","v18","v19"]],["Split",["l3","v15","v16","v17","v18","v19"],[1,0],["l20","l21","l22","l23","l24"]],["SamplePerfectTile",["l4"],[3,64],["v25","v26","v27"]],["Split",["l4","v25","v26","v27"],[1,0],["l28","l29","l30"]],["Reorder",["l10","l20","l11","l21","l12","l22","l28","l29","l13","l23","l30","l14","l24"],[],[]],["Fuse",["l10","l20"],[1],["l31"]],["Bind",["l31"],["blockIdx.x"],[]],["Fuse",["l11","l21"],[1],["l32"]],["Bind",["l32"],["vthread.x"],[]],["Fuse",["l12","l22"],[1],["l33"]],["Bind",["l33"],["threadIdx.x"],[]],["Annotate",["b0",64],["meta_schedule.thread_extent_low_inclusive"],[]],["Annotate",["b0",1024],["meta_schedule.thread_extent_high_inclusive"],[]],["CacheWrite",["b0",[]],[0,"local"],["b34"]],["ReverseComputeAt",["b34","l33"],[1,-1],[]],["CacheRead",["b0",["b0"]],[0,"shared"],["b35"]],["ComputeAt",["b35","l28"],[1,-1],[]],["GetLoops",["b35"],[],["l36","l37","l38","l39","l40","l41"]],["Fuse",["l40","l41"],[1],["l42"]],["SampleCategorical",[],[[1,2,4,8],[0.25,0.25,0.25,0.25]],["v43"]],["Annotate",["b35","v43"],["meta_schedule.cooperative_fetch"],[]],["CacheRead",["b0",["b0"]],[1,"shared"],["b44"]],["ComputeAt",["b44","l28"],[1,-1],[]],["GetLoops",["b44"],[],["l45","l46","l47","l48","l49","l50"]],["Fuse",["l49","l50"],[1],["l51"]],["SampleCategorical",[],[[1,2,4,8],[0.25,0.25,0.25,0.25]],["v52"]],["Annotate",["b44","v52"],["meta_schedule.cooperative_fetch"],[]],["SampleCategorical",[],[[0,16,64,512,1024],[0.2000000000000000111,0.2000000000000000111,0.2000000000000000111,0.2000000000000000111,0.2000000000000000111]],["v53"]],["Annotate",["b1","v53"],["meta_schedule.unroll_explicit"],[]],["EnterPostproc",[],[],[]],["Unannotate",["b35"],["meta_schedule.cooperative_fetch"],[]],["GetLoops",["b35"],[],["l54","l55","l56","l57","l58"]],["Split",["l58","None",84,4],[1,0],["l59","l60","l61"]],["Vectorize",["l61"],[],[]],["Bind",["l60"],["threadIdx.x"],[]],["Unannotate",["b44"],["meta_schedule.cooperative_fetch"],[]],["GetLoops",["b44"],[],["l62","l63","l64","l65","l66"]],["Split",["l66","None",84,2],[1,0],["l67","l68","l69"]],["Vectorize",["l69"],[],[]],["Bind",["l68"],["threadIdx.x"],[]],["GetBlock",[],["root","main"],["b70"]],["Unannotate",["b70"],["meta_schedule.unroll_explicit"],[]],["GetChildBlocks",["b70"],[],["b71","b72","b73","b74"]],["GetLoops",["b71"],[],["l75","l76","l77","l78","l79","l80","l81"]],["GetLoops",["b72"],[],["l82","l83","l84","l85","l86","l87","l88"]],["GetLoops",["b73"],[],["l89","l90","l91","l92","l93","l94","l95","l96","l97","l98"]],["Annotate",["l89",64],["pragma_auto_unroll_max_step"],[]],["Annotate",["l89",1],["pragma_unroll_explicit"],[]],["GetLoops",["b74"],[],["l99","l100","l101","l102","l103"]],["GetBlock",[],["C","main"],["b104"]],["GetLoops",["b104"],[],["l105","l106","l107","l108","l109","l110","l111","l112","l113","l114"]],["DecomposeReduction",["b104","l108"],[],["b115"]]],[[4,[214,1,3,1,1]],[6,[256,1,28,2,1]],[8,[64,2,32]],[25,2],[31,1],[33,2]]],[0.010271324899999999952,0.010262860799999998923,0.010283327400000000229],{"host":{"keys":["cpu"],"kind":"llvm","mtriple":"x86_64-unknown-linux-gnu","tag":""},"keys":["rocm","gpu"],"kind":"rocm","max_num_threads":256,"max_shared_memory_per_block":49152,"max_threads_per_block":1024,"mcpu":"gfx942","model":"MI300","mtriple":"amdgcn-amd-amdhsa-hcc","tag":"","thread_warp_size":64},[["TENSOR","float16",[642,4096]],["TENSOR","float16",[4096,14336]],["TENSOR","float16",[642,14336]]]]]
[0,[[[["GetBlock",[],["C","main"],["b0"]],["GetBlock",[],["root","main"],["b1"]],["Annotate",["b0","\"SSSRRSRS\""],["meta_schedule.tiling_structure"],[]],["GetLoops",["b0"],[],["l2","l3","l4"]],["SamplePerfectTile",["l2"],[5,64],["v5","v6","v7","v8","v9"]],["Split",["l2","v5","v6","v7","v8","v9"],[1,0],["l10","l11","l12","l13","l14"]],["SamplePerfectTile",["l3"],[5,64],["v15","v16","v17","v18","v19"]],["Split",["l3","v15","v16","v17","v18","v19"],[1,0],["l20","l21","l22","l23","l24"]],["SamplePerfectTile",["l4"],[3,64],["v25","v26","v27"]],["Split",["l4","v25","v26","v27"],[1,0],["l28","l29","l30"]],["Reorder",["l10","l20","l11","l21","l12","l22","l28","l29","l13","l23","l30","l14","l24"],[],[]],["Fuse",["l10","l20"],[1],["l31"]],["Bind",["l31"],["blockIdx.x"],[]],["Fuse",["l11","l21"],[1],["l32"]],["Bind",["l32"],["vthread.x"],[]],["Fuse",["l12","l22"],[1],["l33"]],["Bind",["l33"],["threadIdx.x"],[]],["Annotate",["b0",64],["meta_schedule.thread_extent_low_inclusive"],[]],["Annotate",["b0",1024],["meta_schedule.thread_extent_high_inclusive"],[]],["CacheWrite",["b0",[]],[0,"local"],["b34"]],["ReverseComputeAt",["b34","l33"],[1,-1],[]],["CacheRead",["b0",["b0"]],[0,"shared"],["b35"]],["ComputeAt",["b35","l28"],[1,-1],[]],["GetLoops",["b35"],[],["l36","l37","l38","l39","l40","l41"]],["Fuse",["l40","l41"],[1],["l42"]],["SampleCategorical",[],[[1,2,4,8],[0.25,0.25,0.25,0.25]],["v43"]],["Annotate",["b35","v43"],["meta_schedule.cooperative_fetch"],[]],["CacheRead",["b0",["b0"]],[1,"shared"],["b44"]],["ComputeAt",["b44","l28"],[1,-1],[]],["GetLoops",["b44"],[],["l45","l46","l47","l48","l49","l50"]],["Fuse",["l49","l50"],[1],["l51"]],["SampleCategorical",[],[[1,2,4,8],[0.25,0.25,0.25,0.25]],["v52"]],["Annotate",["b44","v52"],["meta_schedule.cooperative_fetch"],[]],["SampleCategorical",[],[[0,16,64,512,1024],[0.2000000000000000111,0.2000000000000000111,0.2000000000000000111,0.2000000000000000111,0.2000000000000000111]],["v53"]],["Annotate",["b1","v53"],["meta_schedule.unroll_explicit"],[]],["EnterPostproc",[],[],[]],["Unannotate",["b35"],["meta_schedule.cooperative_fetch"],[]],["GetLoops",["b35"],[],["l54","l55","l56","l57","l58"]],["Split",["l58","None",428,8],[1,0],["l59","l60","l61"]],["Vectorize",["l61"],[],[]],["Bind",["l60"],["threadIdx.x"],[]],["Unannotate",["b44"],["meta_schedule.cooperative_fetch"],[]],["GetLoops",["b44"],[],["l62","l63","l64","l65","l66"]],["Split",["l66","None",428,4],[1,0],["l67","l68","l69"]],["Vectorize",["l69"],[],[]],["Bind",["l68"],["threadIdx.x"],[]],["GetBlock",[],["root","main"],["b70"]],["Unannotate",["b70"],["meta_schedule.unroll_explicit"],[]],["GetChildBlocks",["b70"],[],["b71","b72","b73","b74"]],["GetLoops",["b71"],[],["l75","l76","l77","l78","l79","l80","l81"]],["GetLoops",["b72"],[],["l82","l83","l84","l85","l86","l87","l88"]],["GetLoops",["b73"],[],["l89","l90","l91","l92","l93","l94","l95","l96","l97","l98"]],["Annotate",["l89",512],["pragma_auto_unroll_max_step"],[]],["Annotate",["l89",1],["pragma_unroll_explicit"],[]],["GetLoops",["b74"],[],["l99","l100","l101","l102","l103"]],["GetBlock",[],["C","main"],["b104"]],["GetLoops",["b104"],[],["l105","l106","l107","l108","l109","l110","l111","l112","l113","l114"]],["DecomposeReduction",["b104","l108"],[],["b115"]]],[[4,[1,1,107,3,2]],[6,[32,2,4,8,7]],[8,[1024,1,4]],[25,3],[31,2],[33,3]]],[0.10329573566666666595,0.1034579669999999979,0.10342136633333331996],{"host":{"keys":["cpu"],"kind":"llvm","mtriple":"x86_64-unknown-linux-gnu","tag":""},"keys":["rocm","gpu"],"kind":"rocm","max_num_threads":256,"max_shared_memory_per_block":49152,"max_threads_per_block":1024,"mcpu":"gfx942","model":"MI300","mtriple":"amdgcn-amd-amdhsa-hcc","tag":"","thread_warp_size":64},[["TENSOR","float16",[642,4096]],["TENSOR","float16",[4096,14336]],["TENSOR","float16",[642,14336]]]]]
[0,[[[["GetBlock",[],["C","main"],["b0"]],["GetBlock",[],["root","main"],["b1"]],["Annotate",["b0","\"SSSRRSRS\""],["meta_schedule.tiling_structure"],[]],["GetLoops",["b0"],[],["l2","l3","l4"]],["SamplePerfectTile",["l2"],[5,64],["v5","v6","v7","v8","v9"]],["Split",["l2","v5","v6","v7","v8","v9"],[1,0],["l10","l11","l12","l13","l14"]],["SamplePerfectTile",["l3"],[5,64],["v15","v16","v17","v18","v19"]],["Split",["l3","v15","v16","v17","v18","v19"],[1,0],["l20","l21","l22","l23","l24"]],["SamplePerfectTile",["l4"],[3,64],["v25","v26","v27"]],["Split",["l4","v25","v26","v27"],[1,0],["l28","l29","l30"]],["Reorder",["l10","l20","l11","l21","l12","l22","l28","l29","l13","l23","l30","l14","l24"],[],[]],["Fuse",["l10","l20"],[1],["l31"]],["Bind",["l31"],["blockIdx.x"],[]],["Fuse",["l11","l21"],[1],["l32"]],["Bind",["l32"],["vthread.x"],[]],["Fuse",["l12","l22"],[1],["l33"]],["Bind",["l33"],["threadIdx.x"],[]],["Annotate",["b0",64],["meta_schedule.thread_extent_low_inclusive"],[]],["Annotate",["b0",1024],["meta_schedule.thread_extent_high_inclusive"],[]],["CacheWrite",["b0",[]],[0,"local"],["b34"]],["ReverseComputeAt",["b34","l33"],[1,-1],[]],["CacheRead",["b0",["b0"]],[0,"shared"],["b35"]],["ComputeAt",["b35","l28"],[1,-1],[]],["GetLoops",["b35"],[],["l36","l37","l38","l39","l40","l41"]],["Fuse",["l40","l41"],[1],["l42"]],["SampleCategorical",[],[[1,2,4,8],[0.25,0.25,0.25,0.25]],["v43"]],["Annotate",["b35","v43"],["meta_schedule.cooperative_fetch"],[]],["CacheRead",["b0",["b0"]],[1,"shared"],["b44"]],["ComputeAt",["b44","l28"],[1,-1],[]],["GetLoops",["b44"],[],["l45","l46","l47","l48","l49","l50"]],["Fuse",["l49","l50"],[1],["l51"]],["SampleCategorical",[],[[1,2,4,8],[0.25,0.25,0.25,0.25]],["v52"]],["Annotate",["b44","v52"],["meta_schedule.cooperative_fetch"],[]],["SampleCategorical",[],[[0,16,64,512,1024],[0.2000000000000000111,0.2000000000000000111,0.2000000000000000111,0.2000000000000000111,0.2000000000000000111]],["v53"]],["Annotate",["b1","v53"],["meta_schedule.unroll_explicit"],[]],["EnterPostproc",[],[],[]],["Unannotate",["b35"],["meta_schedule.cooperative_fetch"],[]],["GetLoops",["b35"],[],["l54","l55","l56","l57","l58"]],["Split",["l58","None",428,8],[1,0],["l59","l60","l61"]],["Vectorize",["l61"],[],[]],["Bind",["l60"],["threadIdx.x"],[]],["Unannotate",["b44"],["meta_schedule.cooperative_fetch"],[]],["GetLoops",["b44"],[],["l62","l63","l64","l65","l66"]],["Split",["l66","None",428,2],[1,0],["l67","l68","l69"]],["Vectorize",["l69"],[],[]],["Bind",["l68"],["threadIdx.x"],[]],["GetBlock",[],["root","main"],["b70"]],["Unannotate",["b70"],["meta_schedule.unroll_explicit"],[]],["GetChildBlocks",["b70"],[],["b71","b72","b73","b74"]],["GetLoops",["b71"],[],["l75","l76","l77","l78","l79","l80","l81"]],["GetLoops",["b72"],[],["l82","l83","l84","l85","l86","l87","l88"]],["GetLoops",["b73"],[],["l89","l90","l91","l92","l93","l94","l95","l96","l97","l98"]],["Annotate",["l89",512],["pragma_auto_unroll_max_step"],[]],["Annotate",["l89",1],["pragma_unroll_explicit"],[]],["GetLoops",["b74"],[],["l99","l100","l101","l102","l103"]],["GetBlock",[],["C","main"],["b104"]],["GetLoops",["b104"],[],["l105","l106","l107","l108","l109","l110","l111","l112","l113","l114"]],["DecomposeReduction",["b104","l108"],[],["b115"]]],[[4,[1,1,107,3,2]],[6,[32,2,4,8,7]],[8,[1024,1,4]],[25,3],[31,1],[33,3]]],[0.10267127466666665925,0.102606211333333322,0.10252792333333334007],{"host":{"keys":["cpu"],"kind":"llvm","mtriple":"x86_64-unknown-linux-gnu","tag":""},"keys":["rocm","gpu"],"kind":"rocm","max_num_threads":256,"max_shared_memory_per_block":49152,"max_threads_per_block":1024,"mcpu":"gfx942","model":"MI300","mtriple":"amdgcn-amd-amdhsa-hcc","tag":"","thread_warp_size":64},[["TENSOR","float16",[642,4096]],["TENSOR","float16",[4096,14336]],["TENSOR","float16",[642,14336]]]]]
[0,[[[["GetBlock",[],["C","main"],["b0"]],["GetBlock",[],["root","main"],["b1"]],["Annotate",["b0","\"SSSRRSRS\""],["meta_schedule.tiling_structure"],[]],["GetLoops",["b0"],[],["l2","l3","l4"]],["SamplePerfectTile",["l2"],[5,64],["v5","v6","v7","v8","v9"]],["Split",["l2","v5","v6","v7","v8","v9"],[1,0],["l10","l11","l12","l13","l14"]],["SamplePerfectTile",["l3"],[5,64],["v15","v16","v17","v18","v19"]],["Split",["l3","v15","v16","v17","v18","v19"],[1,0],["l20","l21","l22","l23","l24"]],["SamplePerfectTile",["l4"],[3,64],["v25","v26","v27"]],["Split",["l4","v25","v26","v27"],[1,0],["l28","l29","l30"]],["Reorder",["l10","l20","l11","l21","l12","l22","l28","l29","l13","l23","l30","l14","l24"],[],[]],["Fuse",["l10","l20"],[1],["l31"]],["Bind",["l31"],["blockIdx.x"],[]],["Fuse",["l11","l21"],[1],["l32"]],["Bind",["l32"],["vthread.x"],[]],["Fuse",["l12","l22"],[1],["l33"]],["Bind",["l33"],["threadIdx.x"],[]],["Annotate",["b0",64],["meta_schedule.thread_extent_low_inclusive"],[]],["Annotate",["b0",1024],["meta_schedule.thread_extent_high_inclusive"],[]],["CacheWrite",["b0",[]],[0,"local"],["b34"]],["ReverseComputeAt",["b34","l33"],[1,-1],[]],["CacheRead",["b0",["b0"]],[0,"shared"],["b35"]],["ComputeAt",["b35","l28"],[1,-1],[]],["GetLoops",["b35"],[],["l36","l37","l38","l39","l40","l41"]],["Fuse",["l40","l41"],[1],["l42"]],["SampleCategorical",[],[[1,2,4,8],[0.25,0.25,0.25,0.25]],["v43"]],["Annotate",["b35","v43"],["meta_schedule.cooperative_fetch"],[]],["CacheRead",["b0",["b0"]],[1,"shared"],["b44"]],["ComputeAt",["b44","l28"],[1,-1],[]],["GetLoops",["b44"],[],["l45","l46","l47","l48","l49","l50"]],["Fuse",["l49","l50"],[1],["l51"]],["SampleCategorical",[],[[1,2,4,8],[0.25,0.25,0.25,0.25]],["v52"]],["Annotate",["b44","v52"],["meta_schedule.cooperative_fetch"],[]],["SampleCategorical",[],[[0,16,64,512,1024],[0.2000000000000000111,0.2000000000000000111,0.2000000000000000111,0.2000000000000000111,0.2000000000000000111]],["v53"]],["Annotate",["b1","v53"],["meta_schedule.unroll_explicit"],[]],["EnterPostproc",[],[],[]],["Unannotate",["b35"],["meta_schedule.cooperative_fetch"],[]],["GetLoops",["b35"],[],["l54","l55","l56","l57","l58"]],["Split",["l58","None",214,2],[1,0],["l59","l60","l61"]],["Vectorize",["l61"],[],[]],["Bind",["l60"],["threadIdx.x"],[]],["Unannotate",["b44"],["meta_schedule.cooperative_fetch"],[]],["GetLoops",["b44"],[],["l62","l63","l64","l65","l66"]],["Split",["l66","None",214,2],[1,0],["l67","l68","l69"]],["Vectorize",["l69"],[],[]],["Bind",["l68"],["threadIdx.x"],[]],["GetBlock",[],["root","main"],["b70"]],["Unannotate",["b70"],["meta_schedule.unroll_explicit"],[]],["GetChildBlocks",["b70"],[],["b71","b72","b73","b74"]],["GetLoops",["b71"],[],["l75","l76","l77","l78","l79","l80","l81"]],["GetLoops",["b72"],[],["l82","l83","l84","l85","l86","l87","l88"]],["GetLoops",["b73"],[],["l89","l90","l91","l92","l93","l94","l95","l96","l97","l98"]],["GetLoops",["b74"],[],["l99","l100","l101","l102","l103"]],["GetBlock",[],["C","main"],["b104"]],["GetLoops",["b104"],[],["l105","l106","l107","l108","l109","l110","l111","l112","l113","l114"]],["DecomposeReduction",["b104","l108"],[],["b115"]]],[[4,[1,1,107,1,6]],[6,[7,1,2,16,64]],[8,[512,2,4]],[25,1],[31,1],[33,0]]],[0.70811897766666664911,0.70773600233333333609,0.70916007466666652892],{"host":{"keys":["cpu"],"kind":"llvm","mtriple":"x86_64-unknown-linux-gnu","tag":""},"keys":["rocm","gpu"],"kind":"rocm","max_num_threads":256,"max_shared_memory_per_block":49152,"max_threads_per_block":1024,"mcpu":"gfx942","model":"MI300","mtriple":"amdgcn-amd-amdhsa-hcc","tag":"","thread_warp_size":64},[["TENSOR","float16",[642,4096]],["TENSOR","float16",[4096,14336]],["TENSOR","float16",[642,14336]]]]]
[0,[[[["GetBlock",[],["C","main"],["b0"]],["GetBlock",[],["root","main"],["b1"]],["Annotate",["b0","\"SSSRRSRS\""],["meta_schedule.tiling_structure"],[]],["GetLoops",["b0"],[],["l2","l3","l4"]],["SamplePerfectTile",["l2"],[5,64],["v5","v6","v7","v8","v9"]],["Split",["l2","v5","v6","v7","v8","v9"],[1,0],["l10","l11","l12","l13","l14"]],["SamplePerfectTile",["l3"],[5,64],["v15","v16","v17","v18","v19"]],["Split",["l3","v15","v16","v17","v18","v19"],[1,0],["l20","l21","l22","l23","l24"]],["SamplePerfectTile",["l4"],[3,64],["v25","v26","v27"]],["Split",["l4","v25","v26","v27"],[1,0],["l28","l29","l30"]],["Reorder",["l10","l20","l11","l21","l12","l22","l28","l29","l13","l23","l30","l14","l24"],[],[]],["Fuse",["l10","l20"],[1],["l31"]],["Bind",["l31"],["blockIdx.x"],[]],["Fuse",["l11","l21"],[1],["l32"]],["Bind",["l32"],["vthread.x"],[]],["Fuse",["l12","l22"],[1],["l33"]],["Bind",["l33"],["threadIdx.x"],[]],["Annotate",["b0",64],["meta_schedule.thread_extent_low_inclusive"],[]],["Annotate",["b0",1024],["meta_schedule.thread_extent_high_inclusive"],[]],["CacheWrite",["b0",[]],[0,"local"],["b34"]],["ReverseComputeAt",["b34","l33"],[1,-1],[]],["CacheRead",["b0",["b0"]],[0,"shared"],["b35"]],["ComputeAt",["b35","l28"],[1,-1],[]],["GetLoops",["b35"],[],["l36","l37","l38","l39","l40","l41"]],["Fuse",["l40","l41"],[1],["l42"]],["SampleCategorical",[],[[1,2,4,8],[0.25,0.25,0.25,0.25]],["v43"]],["Annotate",["b35","v43"],["meta_schedule.cooperative_fetch"],[]],["CacheRead",["b0",["b0"]],[1,"shared"],["b44"]],["ComputeAt",["b44","l28"],[1,-1],[]],["GetLoops",["b44"],[],["l45","l46","l47","l48","l49","l50"]],["Fuse",["l49","l50"],[1],["l51"]],["SampleCategorical",[],[[1,2,4,8],[0.25,0.25,0.25,0.25]],["v52"]],["Annotate",["b44","v52"],["meta_schedule.cooperative_fetch"],[]],["SampleCategorical",[],[[0,16,64,512,1024],[0.2000000000000000111,0.2000000000000000111,0.2000000000000000111,0.2000000000000000111,0.2000000000000000111]],["v53"]],["Annotate",["b1","v53"],["meta_schedule.unroll_explicit"],[]],["EnterPostproc",[],[],[]],["Unannotate",["b35"],["meta_schedule.cooperative_fetch"],[]],["GetLoops",["b35"],[],["l54","l55","l56","l57","l58"]],["Split",["l58","None",107,2],[1,0],["l59","l60","l61"]],["Vectorize",["l61"],[],[]],["Bind",["l60"],["threadIdx.x"],[]],["Unannotate",["b44"],["meta_schedule.cooperative_fetch"],[]],["GetLoops",["b44"],[],["l62","l63","l64","l65","l66"]],["Split",["l66","None",107],[1,0],["l67","l68"]],["Bind",["l68"],["threadIdx.x"],[]],["GetBlock",[],["root","main"],["b69"]],["Unannotate",["b69"],["meta_schedule.unroll_explicit"],[]],["GetChildBlocks",["b69"],[],["b70","b71","b72","b73"]],["GetLoops",["b70"],[],["l74","l75","l76","l77","l78","l79","l80"]],["GetLoops",["b71"],[],["l81","l82","l83","l84","l85","l86"]],["GetLoops",["b72"],[],["l87","l88","l89","l90","l91","l92","l93","l94","l95","l96"]],["GetLoops",["b73"],[],["l97","l98","l99","l100","l101"]],["GetBlock",[],["C","main"],["b102"]],["GetLoops",["b102"],[],["l103","l104","l105","l106","l107","l108","l109","l110","l111","l112"]],["DecomposeReduction",["b102","l106"],[],["b113"]]],[[4,[6,1,107,1,1]],[6,[64,112,1,2,1]],[8,[256,4,4]],[25,1],[31,0],[33,0]]],[0.23253812633333334481,0.23350120033333332525,0.23307352700000003032],{"host":{"keys":["cpu"],"kind":"llvm","mtriple":"x86_64-unknown-linux-gnu","tag":""},"keys":["rocm","gpu"],"kind":"rocm","max_num_threads":256,"max_shared_memory_per_block":49152,"max_threads_per_block":1024,"mcpu":"gfx942","model":"MI300","mtriple":"amdgcn-amd-amdhsa-hcc","tag":"","thread_warp_size":64},[["TENSOR","float16",[642,4096]],["TENSOR","float16",[4096,14336]],["TENSOR","float16",[642,14336]]]]]
[0,[[[["GetBlock",[],["C","main"],["b0"]],["GetBlock",[],["root","main"],["b1"]],["Annotate",["b0","\"SSSRRSRS\""],["meta_schedule.tiling_structure"],[]],["GetLoops",["b0"],[],["l2","l3","l4"]],["SamplePerfectTile",["l2"],[5,64],["v5","v6","v7","v8","v9"]],["Split",["l2","v5","v6","v7","v8","v9"],[1,0],["l10","l11","l12","l13","l14"]],["SamplePerfectTile",["l3"],[5,64],["v15","v16","v17","v18","v19"]],["Split",["l3","v15","v16","v17","v18","v19"],[1,0],["l20","l21","l22","l23","l24"]],["SamplePerfectTile",["l4"],[3,64],["v25","v26","v27"]],["Split",["l4","v25","v26","v27"],[1,0],["l28","l29","l30"]],["Reorder",["l10","l20","l11","l21","l12","l22","l28","l29","l13","l23","l30","l14","l24"],[],[]],["Fuse",["l10","l20"],[1],["l31"]],["Bind",["l31"],["blockIdx.x"],[]],["Fuse",["l11","l21"],[1],["l32"]],["Bind",["l32"],["vthread.x"],[]],["Fuse",["l12","l22"],[1],["l33"]],["Bind",["l33"],["threadIdx.x"],[]],["Annotate",["b0",64],["meta_schedule.thread_extent_low_inclusive"],[]],["Annotate",["b0",1024],["meta_schedule.thread_extent_high_inclusive"],[]],["CacheWrite",["b0",[]],[0,"local"],["b34"]],["ReverseComputeAt",["b34","l33"],[1,-1],[]],["CacheRead",["b0",["b0"]],[0,"shared"],["b35"]],["ComputeAt",["b35","l28"],[1,-1],[]],["GetLoops",["b35"],[],["l36","l37","l38","l39","l40","l41"]],["Fuse",["l40","l41"],[1],["l42"]],["SampleCategorical",[],[[1,2,4,8],[0.25,0.25,0.25,0.25]],["v43"]],["Annotate",["b35","v43"],["meta_schedule.cooperative_fetch"],[]],["CacheRead",["b0",["b0"]],[1,"shared"],["b44"]],["ComputeAt",["b44","l28"],[1,-1],[]],["GetLoops",["b44"],[],["l45","l46","l47","l48","l49","l50"]],["Fuse",["l49","l50"],[1],["l51"]],["SampleCategorical",[],[[1,2,4,8],[0.25,0.25,0.25,0.25]],["v52"]],["Annotate",["b44","v52"],["meta_schedule.cooperative_fetch"],[]],["SampleCategorical",[],[[0,16,64,512,1024],[0.2000000000000000111,0.2000000000000000111,0.2000000000000000111,0.2000000000000000111,0.2000000000000000111]],["v53"]],["Annotate",["b1","v53"],["meta_schedule.unroll_explicit"],[]],["EnterPostproc",[],[],[]],["Unannotate",["b35"],["meta_schedule.cooperative_fetch"],[]],["GetLoops",["b35"],[],["l54","l55","l56","l57","l58"]],["Split",["l58","None",321,2],[1,0],["l59","l60","l61"]],["Vectorize",["l61"],[],[]],["Bind",["l60"],["threadIdx.x"],[]],["Unannotate",["b44"],["meta_schedule.cooperative_fetch"],[]],["GetLoops",["b44"],[],["l62","l63","l64","l65","l66"]],["Split",["l66","None",321,2],[1,0],["l67","l68","l69"]],["Vectorize",["l69"],[],[]],["Bind",["l68"],["threadIdx.x"],[]],["GetBlock",[],["root","main"],["b70"]],["Unannotate",["b70"],["meta_schedule.unroll_explicit"],[]],["GetChildBlocks",["b70"],[],["b71","b72","b73","b74"]],["GetLoops",["b71"],[],["l75","l76","l77","l78","l79","l80","l81"]],["GetLoops",["b72"],[],["l82","l83","l84","l85","l86","l87","l88"]],["GetLoops",["b73"],[],["l89","l90","l91","l92","l93","l94","l95","l96","l97","l98"]],["Annotate",["l89",64],["pragma_auto_unroll_max_step"],[]],["Annotate",["l89",1],["pragma_unroll_explicit"],[]],["GetLoops",["b74"],[],["l99","l100","l101","l102","l103"]],["GetBlock",[],["C","main"],["b104"]],["GetLoops",["b104"],[],["l105","l106","l107","l108","l109","l110","l111","l112","l113","l114"]],["DecomposeReduction",["b104","l108"],[],["b115"]]],[[4,[1,1,321,1,2]],[6,[8,112,1,8,2]],[8,[1024,2,2]],[25,1],[31,1],[33,2]]],[1.2802453609999999706,1.2809109700000000931,1.2811210936666665994],{"host":{"keys":["cpu"],"kind":"llvm","mtriple":"x86_64-unknown-linux-gnu","tag":""},"keys":["rocm","gpu"],"kind":"rocm","max_num_threads":256,"max_shared_memory_per_block":49152,"max_threads_per_block":1024,"mcpu":"gfx942","model":"MI300","mtriple":"amdgcn-amd-amdhsa-hcc","tag":"","thread_warp_size":64},[["TENSOR","float16",[642,4096]],["TENSOR","float16",[4096,14336]],["TENSOR","float16",[642,14336]]]]]
[0,[[[["GetBlock",[],["C","main"],["b0"]],["GetBlock",[],["root","main"],["b1"]],["Annotate",["b0","\"SSSRRSRS\""],["meta_schedule.tiling_structure"],[]],["GetLoops",["b0"],[],["l2","l3","l4"]],["SamplePerfectTile",["l2"],[5,64],["v5","v6","v7","v8","v9"]],["Split",["l2","v5","v6","v7","v8","v9"],[1,0],["l10","l11","l12","l13","l14"]],["SamplePerfectTile",["l3"],[5,64],["v15","v16","v17","v18","v19"]],["Split",["l3","v15","v16","v17","v18","v19"],[1,0],["l20","l21","l22","l23","l24"]],["SamplePerfectTile",["l4"],[3,64],["v25","v26","v27"]],["Split",["l4","v25","v26","v27"],[1,0],["l28","l29","l30"]],["Reorder",["l10","l20","l11","l21","l12","l22","l28","l29","l13","l23","l30","l14","l24"],[],[]],["Fuse",["l10","l20"],[1],["l31"]],["Bind",["l31"],["blockIdx.x"],[]],["Fuse",["l11","l21"],[1],["l32"]],["Bind",["l32"],["vthread.x"],[]],["Fuse",["l12","l22"],[1],["l33"]],["Bind",["l33"],["threadIdx.x"],[]],["Annotate",["b0",64],["meta_schedule.thread_extent_low_inclusive"],[]],["Annotate",["b0",1024],["meta_schedule.thread_extent_high_inclusive"],[]],["CacheWrite",["b0",[]],[0,"local"],["b34"]],["ReverseComputeAt",["b34","l33"],[1,-1],[]],["CacheRead",["b0",["b0"]],[0,"shared"],["b35"]],["ComputeAt",["b35","l28"],[1,-1],[]],["GetLoops",["b35"],[],["l36","l37","l38","l39","l40","l41"]],["Fuse",["l40","l41"],[1],["l42"]],["SampleCategorical",[],[[1,2,4,8],[0.25,0.25,0.25,0.25]],["v43"]],["Annotate",["b35","v43"],["meta_schedule.cooperative_fetch"],[]],["CacheRead",["b0",["b0"]],[1,"shared"],["b44"]],["ComputeAt",["b44","l28"],[1,-1],[]],["GetLoops",["b44"],[],["l45","l46","l47","l48","l49","l50"]],["Fuse",["l49","l50"],[1],["l51"]],["SampleCategorical",[],[[1,2,4,8],[0.25,0.25,0.25,0.25]],["v52"]],["Annotate",["b44","v52"],["meta_schedule.cooperative_fetch"],[]],["SampleCategorical",[],[[0,16,64,512,1024],[0.2000000000000000111,0.2000000000000000111,0.2000000000000000111,0.2000000000000000111,0.2000000000000000111]],["v53"]],["Annotate",["b1","v53"],["meta_schedule.unroll_explicit"],[]],["EnterPostproc",[],[],[]],["Unannotate",["b35"],["meta_schedule.cooperative_fetch"],[]],["GetLoops",["b35"],[],["l54","l55","l56","l57","l58"]],["Split",["l58","None",642,4],[1,0],["l59","l60","l61"]],["Vectorize",["l61"],[],[]],["Bind",["l60"],["threadIdx.x"],[]],["Unannotate",["b44"],["meta_schedule.cooperative_fetch"],[]],["GetLoops",["b44"],[],["l62","l63","l64","l65","l66"]],["Split",["l66","None",642],[1,0],["l67","l68"]],["Bind",["l68"],["threadIdx.x"],[]],["GetBlock",[],["root","main"],["b69"]],["Unannotate",["b69"],["meta_schedule.unroll_explicit"],[]],["GetChildBlocks",["b69"],[],["b70","b71","b72","b73"]],["GetLoops",["b70"],[],["l74","l75","l76","l77","l78","l79","l80"]],["GetLoops",["b71"],[],["l81","l82","l83","l84","l85","l86"]],["GetLoops",["b72"],[],["l87","l88","l89","l90","l91","l92","l93","l94","l95","l96"]],["Annotate",["l87",64],["pragma_auto_unroll_max_step"],[]],["Annotate",["l87",1],["pragma_unroll_explicit"],[]],["GetLoops",["b73"],[],["l97","l98","l99","l100","l101"]],["GetBlock",[],["C","main"],["b102"]],["GetLoops",["b102"],[],["l103","l104","l105","l106","l107","l108","l109","l110","l111","l112"]],["DecomposeReduction",["b102","l106"],[],["b113"]]],[[4,[1,1,321,1,2]],[6,[1024,7,2,1,1]],[8,[128,16,2]],[25,2],[31,0],[33,2]]],[0.0055696605555555552675,0.0055690705555555553019,0.005568732333333333874],{"host":{"keys":["cpu"],"kind":"llvm","mtriple":"x86_64-unknown-linux-gnu","tag":""},"keys":["rocm","gpu"],"kind":"rocm","max_num_threads":256,"max_shared_memory_per_block":49152,"max_threads_per_block":1024,"mcpu":"gfx942","model":"MI300","mtriple":"amdgcn-amd-amdhsa-hcc","tag":"","thread_warp_size":64},[["TENSOR","float16",[642,4096]],["TENSOR","float16",[4096,14336]],["TENSOR","float16",[642,14336]]]]]
[0,[[[["GetBlock",[],["C","main"],["b0"]],["GetBlock",[],["root","main"],["b1"]],["Annotate",["b0","\"SSSRRSRS\""],["meta_schedule.tiling_structure"],[]],["GetLoops",["b0"],[],["l2","l3","l4"]],["SamplePerfectTile",["l2"],[5,64],["v5","v6","v7","v8","v9"]],["Split",["l2","v5","v6","v7","v8","v9"],[1,0],["l10","l11","l12","l13","l14"]],["SamplePerfectTile",["l3"],[5,64],["v15","v16","v17","v18","v19"]],["Split",["l3","v15","v16","v17","v18","v19"],[1,0],["l20","l21","l22","l23","l24"]],["SamplePerfectTile",["l4"],[3,64],["v25","v26","v27"]],["Split",["l4","v25","v26","v27"],[1,0],["l28","l29","l30"]],["Reorder",["l10","l20","l11","l21","l12","l22","l28","l29","l13","l23","l30","l14","l24"],[],[]],["Fuse",["l10","l20"],[1],["l31"]],["Bind",["l31"],["blockIdx.x"],[]],["Fuse",["l11","l21"],[1],["l32"]],["Bind",["l32"],["vthread.x"],[]],["Fuse",["l12","l22"],[1],["l33"]],["Bind",["l33"],["threadIdx.x"],[]],["Annotate",["b0",64],["meta_schedule.thread_extent_low_inclusive"],[]],["Annotate",["b0",1024],["meta_schedule.thread_extent_high_inclusive"],[]],["CacheWrite",["b0",[]],[0,"local"],["b34"]],["ReverseComputeAt",["b34","l33"],[1,-1],[]],["CacheRead",["b0",["b0"]],[0,"shared"],["b35"]],["ComputeAt",["b35","l28"],[1,-1],[]],["GetLoops",["b35"],[],["l36","l37","l38","l39","l40","l41"]],["Fuse",["l40","l41"],[1],["l42"]],["SampleCategorical",[],[[1,2,4,8],[0.25,0.25,0.25,0.25]],["v43"]],["Annotate",["b35","v43"],["meta_schedule.cooperative_fetch"],[]],["CacheRead",["b0",["b0"]],[1,"shared"],["b44"]],["ComputeAt",["b44","l28"],[1,-1],[]],["GetLoops",["b44"],[],["l45","l46","l47","l48","l49","l50"]],["Fuse",["l49","l50"],[1],["l51"]],["SampleCategorical",[],[[1,2,4,8],[0.25,0.25,0.25,0.25]],["v52"]],["Annotate",["b44","v52"],["meta_schedule.cooperative_fetch"],[]],["SampleCategorical",[],[[0,16,64,512,1024],[0.2000000000000000111,0.2000000000000000111,0.2000000000000000111,0.2000000000000000111,0.2000000000000000111]],["v53"]],["Annotate",["b1","v53"],["meta_schedule.unroll_explicit"],[]],["EnterPostproc",[],[],[]],["Unannotate",["b35"],["meta_schedule.cooperative_fetch"],[]],["GetLoops",["b35"],[],["l54","l55","l56","l57","l58"]],["Split",["l58","None",128],[1,0],["l59","l60"]],["Bind",["l60"],["threadIdx.x"],[]],["Unannotate",["b44"],["meta_schedule.cooperative_fetch"],[]],["GetLoops",["b44"],[],["l61","l62","l63","l64","l65"]],["Split",["l65","None",128,4],[1,0],["l66","l67","l68"]],["Vectorize",["l68"],[],[]],["Bind",["l67"],["threadIdx.x"],[]],["GetBlock",[],["root","main"],["b69"]],["Unannotate",["b69"],["meta_schedule.unroll_explicit"],[]],["GetChildBlocks",["b69"],[],["b70","b71","b72","b73"]],["GetLoops",["b70"],[],["l74","l75","l76","l77","l78","l79"]],["GetLoops",["b71"],[],["l80","l81","l82","l83","l84","l85","l86"]],["GetLoops",["b72"],[],["l87","l88","l89","l90","l91","l92","l93","l94","l95","l96"]],["Annotate",["l87",1024],["pragma_auto_unroll_max_step"],[]],["Annotate",["l87",1],["pragma_unroll_explicit"],[]],["GetLoops",["b73"],[],["l97","l98","l99","l100","l101"]],["GetBlock",[],["C","main"],["b102"]],["GetLoops",["b102"],[],["l103","l104","l105","l106","l107","l108","l109","l110","l111","l112"]],["DecomposeReduction",["b102","l106"],[],["b113"]]],[[4,[107,1,1,6,1]],[6,[4,1,128,4,7]],[8,[2048,1,2]],[25,0],[31,2],[33,4]]],[0.0031806297187499999769,0.0031793114999999999397,0.0031795856875000000352],{"host":{"keys":["cpu"],"kind":"llvm","mtriple":"x86_64-unknown-linux-gnu","tag":""},"keys":["rocm","gpu"],"kind":"rocm","max_num_threads":256,"max_shared_memory_per_block":49152,"max_threads_per_block":1024,"mcpu":"gfx942","model":"MI300","mtriple":"amdgcn-amd-amdhsa-hcc","tag":"","thread_warp_size":64},[["TENSOR","float16",[642,4096]],["TENSOR","float16",[4096,14336]],["TENSOR","float16",[642,14336]]]]]
[0,[[[["GetBlock",[],["C","main"],["b0"]],["GetBlock",[],["root","main"],["b1"]],["Annotate",["b0","\"SSSRRSRS\""],["meta_schedule.tiling_structure"],[]],["GetLoops",["b0"],[],["l2","l3","l4"]],["SamplePerfectTile",["l2"],[5,64],["v5","v6","v7","v8","v9"]],["Split",["l2","v5","v6","v7","v8","v9"],[1,0],["l10","l11","l12","l13","l14"]],["SamplePerfectTile",["l3"],[5,64],["v15","v16","v17","v18","v19"]],["Split",["l3","v15","v16","v17","v18","v19"],[1,0],["l20","l21","l22","l23","l24"]],["SamplePerfectTile",["l4"],[3,64],["v25","v26","v27"]],["Split",["l4","v25","v26","v27"],[1,0],["l28","l29","l30"]],["Reorder",["l10","l20","l11","l21","l12","l22","l28","l29","l13","l23","l30","l14","l24"],[],[]],["Fuse",["l10","l20"],[1],["l31"]],["Bind",["l31"],["blockIdx.x"],[]],["Fuse",["l11","l21"],[1],["l32"]],["Bind",["l32"],["vthread.x"],[]],["Fuse",["l12","l22"],[1],["l33"]],["Bind",["l33"],["threadIdx.x"],[]],["Annotate",["b0",64],["meta_schedule.thread_extent_low_inclusive"],[]],["Annotate",["b0",1024],["meta_schedule.thread_extent_high_inclusive"],[]],["CacheWrite",["b0",[]],[0,"local"],["b34"]],["ReverseComputeAt",["b34","l33"],[1,-1],[]],["CacheRead",["b0",["b0"]],[0,"shared"],["b35"]],["ComputeAt",["b35","l28"],[1,-1],[]],["GetLoops",["b35"],[],["l36","l37","l38","l39","l40","l41"]],["Fuse",["l40","l41"],[1],["l42"]],["SampleCategorical",[],[[1,2,4,8],[0.25,0.25,0.25,0.25]],["v43"]],["Annotate",["b35","v43"],["meta_schedule.cooperative_fetch"],[]],["CacheRead",["b0",["b0"]],[1,"shared"],["b44"]],["ComputeAt",["b44","l28"],[1,-1],[]],["GetLoops",["b44"],[],["l45","l46","l47","l48","l49","l50"]],["Fuse",["l49","l50"],[1],["l51"]],["SampleCategorical",[],[[1,2,4,8],[0.25,0.25,0.25,0.25]],["v52"]],["Annotate",["b44","v52"],["meta_schedule.cooperative_fetch"],[]],["SampleCategorical",[],[[0,16,64,512,1024],[0.2000000000000000111,0.2000000000000000111,0.2000000000000000111,0.2000000000000000111,0.2000000000000000111]],["v53"]],["Annotate",["b1","v53"],["meta_schedule.unroll_explicit"],[]],["EnterPostproc",[],[],[]],["Unannotate",["b35"],["meta_schedule.cooperative_fetch"],[]],["GetLoops",["b35"],[],["l54","l55","l56","l57","l58"]],["Split",["l58","None",192,2],[1,0],["l59","l60","l61"]],["Vectorize",["l61"],[],[]],["Bind",["l60"],["threadIdx.x"],[]],["Unannotate",["b44"],["meta_schedule.cooperative_fetch"],[]],["GetLoops",["b44"],[],["l62","l63","l64","l65","l66"]],["Split",["l66","None",192],[1,0],["l67","l68"]],["Bind",["l68"],["threadIdx.x"],[]],["GetBlock",[],["root","main"],["b69"]],["Unannotate",["b69"],["meta_schedule.unroll_explicit"],[]],["GetChildBlocks",["b69"],[],["b70","b71","b72","b73"]],["GetLoops",["b70"],[],["l74","l75","l76","l77","l78","l79","l80"]],["GetLoops",["b71"],[],["l81","l82","l83","l84","l85","l86"]],["GetLoops",["b72"],[],["l87","l88","l89","l90","l91","l92","l93","l94","l95","l96"]],["Annotate",["l87",512],["pragma_auto_unroll_max_step"],[]],["Annotate",["l87",1],["pragma_unroll_explicit"],[]],["GetLoops",["b73"],[],["l97","l98","l99","l100","l101"]],["GetBlock",[],["C","main"],["b102"]],["GetLoops",["b102"],[],["l103","l104","l105","l106","l107","l108","l109","l110","l111","l112"]],["DecomposeReduction",["b102","l106"],[],["b113"]]],[[4,[1,2,3,107,1]],[6,[7,16,64,2,1]],[8,[1024,4,1]],[25,1],[31,0],[33,3]]],[0.25737925200000000281,0.25782403533333336787,0.25771728499999996265],{"host":{"keys":["cpu"],"kind":"llvm","mtriple":"x86_64-unknown-linux-gnu","tag":""},"keys":["rocm","gpu"],"kind":"rocm","max_num_threads":256,"max_shared_memory_per_block":49152,"max_threads_per_block":1024,"mcpu":"gfx942","model":"MI300","mtriple":"amdgcn-amd-amdhsa-hcc","tag":"","thread_warp_size":64},[["TENSOR","float16",[642,4096]],["TENSOR","float16",[4096,14336]],["TENSOR","float16",[642,14336]]]]]
[0,[[[["GetBlock",[],["C","main"],["b0"]],["GetBlock",[],["root","main"],["b1"]],["Annotate",["b0","\"SSSRRSRS\""],["meta_schedule.tiling_structure"],[]],["GetLoops",["b0"],[],["l2","l3","l4"]],["SamplePerfectTile",["l2"],[5,64],["v5","v6","v7","v8","v9"]],["Split",["l2","v5","v6","v7","v8","v9"],[1,0],["l10","l11","l12","l13","l14"]],["SamplePerfectTile",["l3"],[5,64],["v15","v16","v17","v18","v19"]],["Split",["l3","v15","v16","v17","v18","v19"],[1,0],["l20","l21","l22","l23","l24"]],["SamplePerfectTile",["l4"],[3,64],["v25","v26","v27"]],["Split",["l4","v25","v26","v27"],[1,0],["l28","l29","l30"]],["Reorder",["l10","l20","l11","l21","l12","l22","l28","l29","l13","l23","l30","l14","l24"],[],[]],["Fuse",["l10","l20"],[1],["l31"]],["Bind",["l31"],["blockIdx.x"],[]],["Fuse",["l11","l21"],[1],["l32"]],["Bind",["l32"],["vthread.x"],[]],["Fuse",["l12","l22"],[1],["l33"]],["Bind",["l33"],["threadIdx.x"],[]],["Annotate",["b0",64],["meta_schedule.thread_extent_low_inclusive"],[]],["Annotate",["b0",1024],["meta_schedule.thread_extent_high_inclusive"],[]],["CacheWrite",["b0",[]],[0,"local"],["b34"]],["ReverseComputeAt",["b34","l33"],[1,-1],[]],["CacheRead",["b0",["b0"]],[0,"shared"],["b35"]],["ComputeAt",["b35","l28"],[1,-1],[]],["GetLoops",["b35"],[],["l36","l37","l38","l39","l40","l41"]],["Fuse",["l40","l41"],[1],["l42"]],["SampleCategorical",[],[[1,2,4,8],[0.25,0.25,0.25,0.25]],["v43"]],["Annotate",["b35","v43"],["meta_schedule.cooperative_fetch"],[]],["CacheRead",["b0",["b0"]],[1,"shared"],["b44"]],["ComputeAt",["b44","l28"],[1,-1],[]],["GetLoops",["b44"],[],["l45","l46","l47","l48","l49","l50"]],["Fuse",["l49","l50"],[1],["l51"]],["SampleCategorical",[],[[1,2,4,8],[0.25,0.25,0.25,0.25]],["v52"]],["Annotate",["b44","v52"],["meta_schedule.cooperative_fetch"],[]],["SampleCategorical",[],[[0,16,64,512,1024],[0.2000000000000000111,0.2000000000000000111,0.2000000000000000111,0.2000000000000000111,0.2000000000000000111]],["v53"]],["Annotate",["b1","v53"],["meta_schedule.unroll_explicit"],[]],["EnterPostproc",[],[],[]],["Unannotate",["b35"],["meta_schedule.cooperative_fetch"],[]],["GetLoops",["b35"],[],["l54","l55","l56","l57","l58"]],["Split",["l58","None",428],[1,0],["l59","l60"]],["Bind",["l60"],["threadIdx.x"],[]],["Unannotate",["b44"],["meta_schedule.cooperative_fetch"],[]],["GetLoops",["b44"],[],["l61","l62","l63","l64","l65"]],["Split",["l65","None",428,2],[1,0],["l66","l67","l68"]],["Vectorize",["l68"],[],[]],["Bind",["l67"],["threadIdx.x"],[]],["GetBlock",[],["root","main"],["b69"]],["Unannotate",["b69"],["meta_schedule.unroll_explicit"],[]],["GetChildBlocks",["b69"],[],["b70","b71","b72","b73"]],["GetLoops",["b70"],[],["l74","l75","l76","l77","l78","l79"]],["GetLoops",["b71"],[],["l80","l81","l82","l83","l84","l85","l86"]],["GetLoops",["b72"],[],["l87","l88","l89","l90","l91","l92","l93","l94","l95","l96"]],["Annotate",["l87",64],["pragma_auto_unroll_max_step"],[]],["Annotate",["l87",1],["pragma_unroll_explicit"],[]],["GetLoops",["b73"],[],["l97","l98","l99","l100","l101"]],["GetBlock",[],["C","main"],["b102"]],["GetLoops",["b102"],[],["l103","l104","l105","l106","l107","l108","l109","l110","l111","l112"]],["DecomposeReduction",["b102","l106"],[],["b113"]]],[[4,[1,2,107,3,1]],[6,[56,1,4,8,8]],[8,[1024,2,2]],[25,0],[31,1],[33,2]]],[0.061105341333333333675,0.061095530000000002058,0.061179667000000000077],{"host":{"keys":["cpu"],"kind":"llvm","mtriple":"x86_64-unknown-linux-gnu","tag":""},"keys":["rocm","gpu"],"kind":"rocm","max_num_threads":256,"max_shared_memory_per_block":49152,"max_threads_per_block":1024,"mcpu":"gfx942","model":"MI300","mtriple":"amdgcn-amd-amdhsa-hcc","tag":"","thread_warp_size":64},[["TENSOR","float16",[642,4096]],["TENSOR","float16",[4096,14336]],["TENSOR","float16",[642,14336]]]]]
[0,[[[["GetBlock",[],["C","main"],["b0"]],["GetBlock",[],["root","main"],["b1"]],["Annotate",["b0","\"SSSRRSRS\""],["meta_schedule.tiling_structure"],[]],["GetLoops",["b0"],[],["l2","l3","l4"]],["SamplePerfectTile",["l2"],[5,64],["v5","v6","v7","v8","v9"]],["Split",["l2","v5","v6","v7","v8","v9"],[1,0],["l10","l11","l12","l13","l14"]],["SamplePerfectTile",["l3"],[5,64],["v15","v16","v17","v18","v19"]],["Split",["l3","v15","v16","v17","v18","v19"],[1,0],["l20","l21","l22","l23","l24"]],["SamplePerfectTile",["l4"],[3,64],["v25","v26","v27"]],["Split",["l4","v25","v26","v27"],[1,0],["l28","l29","l30"]],["Reorder",["l10","l20","l11","l21","l12","l22","l28","l29","l13","l23","l30","l14","l24"],[],[]],["Fuse",["l10","l20"],[1],["l31"]],["Bind",["l31"],["blockIdx.x"],[]],["Fuse",["l11","l21"],[1],["l32"]],["Bind",["l32"],["vthread.x"],[]],["Fuse",["l12","l22"],[1],["l33"]],["Bind",["l33"],["threadIdx.x"],[]],["Annotate",["b0",64],["meta_schedule.thread_extent_low_inclusive"],[]],["Annotate",["b0",1024],["meta_schedule.thread_extent_high_inclusive"],[]],["CacheWrite",["b0",[]],[0,"local"],["b34"]],["ReverseComputeAt",["b34","l33"],[1,-1],[]],["CacheRead",["b0",["b0"]],[0,"shared"],["b35"]],["ComputeAt",["b35","l28"],[1,-1],[]],["GetLoops",["b35"],[],["l36","l37","l38","l39","l40","l41"]],["Fuse",["l40","l41"],[1],["l42"]],["SampleCategorical",[],[[1,2,4,8],[0.25,0.25,0.25,0.25]],["v43"]],["Annotate",["b35","v43"],["meta_schedule.cooperative_fetch"],[]],["CacheRead",["b0",["b0"]],[1,"shared"],["b44"]],["ComputeAt",["b44","l28"],[1,-1],[]],["GetLoops",["b44"],[],["l45","l46","l47","l48","l49","l50"]],["Fuse",["l49","l50"],[1],["l51"]],["SampleCategorical",[],[[1,2,4,8],[0.25,0.25,0.25,0.25]],["v52"]],["Annotate",["b44","v52"],["meta_schedule.cooperative_fetch"],[]],["SampleCategorical",[],[[0,16,64,512,1024],[0.2000000000000000111,0.2000000000000000111,0.2000000000000000111,0.2000000000000000111,0.2000000000000000111]],["v53"]],["Annotate",["b1","v53"],["meta_schedule.unroll_explicit"],[]],["EnterPostproc",[],[],[]],["Unannotate",["b35"],["meta_schedule.cooperative_fetch"],[]],["GetLoops",["b35"],[],["l54","l55","l56","l57","l58"]],["Split",["l58","None",107],[1,0],["l59","l60"]],["Bind",["l60"],["threadIdx.x"],[]],["Unannotate",["b44"],["meta_schedule.cooperative_fetch"],[]],["GetLoops",["b44"],[],["l61","l62","l63","l64","l65"]],["Split",["l65","None",107,8],[1,0],["l66","l67","l68"]],["Vectorize",["l68"],[],[]],["Bind",["l67"],["threadIdx.x"],[]],["GetBlock",[],["root","main"],["b69"]],["Unannotate",["b69"],["meta_schedule.unroll_explicit"],[]],["GetChildBlocks",["b69"],[],["b70","b71","b72","b73"]],["GetLoops",["b70"],[],["l74","l75","l76","l77","l78","l79"]],["GetLoops",["b71"],[],["l80","l81","l82","l83","l84","l85","l86"]],["GetLoops",["b72"],[],["l87","l88","l89","l90","l91","l92","l93","l94","l95","l96"]],["Annotate",["l87",512],["pragma_auto_unroll_max_step"],[]],["Annotate",["l87",1],["pragma_unroll_explicit"],[]],["GetLoops",["b73"],[],["l97","l98","l99","l100","l101"]],["GetBlock",[],["C","main"],["b102"]],["GetLoops",["b102"],[],["l103","l104","l105","l106","l107","l108","l109","l110","l111","l112"]],["DecomposeReduction",["b102","l106"],[],["b113"]]],[[4,[1,3,107,1,2]],[6,[16,8,1,56,2]],[8,[1024,4,1]],[25,0],[31,3],[33,3]]],[0.19676572666666666822,0.19628440333333332934,0.19716084766666663874],{"host":{"keys":["cpu"],"kind":"llvm","mtriple":"x86_64-unknown-linux-gnu","tag":""},"keys":["rocm","gpu"],"kind":"rocm","max_num_threads":256,"max_shared_memory_per_block":49152,"max_threads_per_block":1024,"mcpu":"gfx942","model":"MI300","mtriple":"amdgcn-amd-amdhsa-hcc","tag":"","thread_warp_size":64},[["TENSOR","float16",[642,4096]],["TENSOR","float16",[4096,14336]],["TENSOR","float16",[642,14336]]]]]
[0,[[[["GetBlock",[],["C","main"],["b0"]],["GetBlock",[],["root","main"],["b1"]],["Annotate",["b0","\"SSSRRSRS\""],["meta_schedule.tiling_structure"],[]],["GetLoops",["b0"],[],["l2","l3","l4"]],["SamplePerfectTile",["l2"],[5,64],["v5","v6","v7","v8","v9"]],["Split",["l2","v5","v6","v7","v8","v9"],[1,0],["l10","l11","l12","l13","l14"]],["SamplePerfectTile",["l3"],[5,64],["v15","v16","v17","v18","v19"]],["Split",["l3","v15","v16","v17","v18","v19"],[1,0],["l20","l21","l22","l23","l24"]],["SamplePerfectTile",["l4"],[3,64],["v25","v26","v27"]],["Split",["l4","v25","v26","v27"],[1,0],["l28","l29","l30"]],["Reorder",["l10","l20","l11","l21","l12","l22","l28","l29","l13","l23","l30","l14","l24"],[],[]],["Fuse",["l10","l20"],[1],["l31"]],["Bind",["l31"],["blockIdx.x"],[]],["Fuse",["l11","l21"],[1],["l32"]],["Bind",["l32"],["vthread.x"],[]],["Fuse",["l12","l22"],[1],["l33"]],["Bind",["l33"],["threadIdx.x"],[]],["Annotate",["b0",64],["meta_schedule.thread_extent_low_inclusive"],[]],["Annotate",["b0",1024],["meta_schedule.thread_extent_high_inclusive"],[]],["CacheWrite",["b0",[]],[0,"local"],["b34"]],["ReverseComputeAt",["b34","l33"],[1,-1],[]],["CacheRead",["b0",["b0"]],[0,"shared"],["b35"]],["ComputeAt",["b35","l28"],[1,-1],[]],["GetLoops",["b35"],[],["l36","l37","l38","l39","l40","l41"]],["Fuse",["l40","l41"],[1],["l42"]],["SampleCategorical",[],[[1,2,4,8],[0.25,0.25,0.25,0.25]],["v43"]],["Annotate",["b35","v43"],["meta_schedule.cooperative_fetch"],[]],["CacheRead",["b0",["b0"]],[1,"shared"],["b44"]],["ComputeAt",["b44","l28"],[1,-1],[]],["GetLoops",["b44"],[],["l45","l46","l47","l48","l49","l50"]],["Fuse",["l49","l50"],[1],["l51"]],["SampleCategorical",[],[[1,2,4,8],[0.25,0.25,0.25,0.25]],["v52"]],["Annotate",["b44","v52"],["meta_schedule.cooperative_fetch"],[]],["SampleCategorical",[],[[0,16,64,512,1024],[0.2000000000000000111,0.2000000000000000111,0.2000000000000000111,0.2000000000000000111,0.2000000000000000111]],["v53"]],["Annotate",["b1","v53"],["meta_schedule.unroll_explicit"],[]],["EnterPostproc",[],[],[]],["Unannotate",["b35"],["meta_schedule.cooperative_fetch"],[]],["GetLoops",["b35"],[],["l54","l55","l56","l57","l58"]],["Split",["l58","None",214],[1,0],["l59","l60"]],["Bind",["l60"],["threadIdx.x"],[]],["Unannotate",["b44"],["meta_schedule.cooperative_fetch"],[]],["GetLoops",["b44"],[],["l61","l62","l63","l64","l65"]],["Split",["l65","None",214,4],[1,0],["l66","l67","l68"]],["Vectorize",["l68"],[],[]],["Bind",["l67"],["threadIdx.x"],[]],["GetBlock",[],["root","main"],["b69"]],["Unannotate",["b69"],["meta_schedule.unroll_explicit"],[]],["GetChildBlocks",["b69"],[],["b70","b71","b72","b73"]],["GetLoops",["b70"],[],["l74","l75","l76","l77","l78","l79"]],["GetLoops",["b71"],[],["l80","l81","l82","l83","l84","l85","l86"]],["GetLoops",["b72"],[],["l87","l88","l89","l90","l91","l92","l93","l94","l95","l96"]],["Annotate",["l87",512],["pragma_auto_unroll_max_step"],[]],["Annotate",["l87",1],["pragma_unroll_explicit"],[]],["GetLoops",["b73"],[],["l97","l98","l99","l100","l101"]],["GetBlock",[],["C","main"],["b102"]],["GetLoops",["b102"],[],["l103","l104","l105","l106","l107","l108","l109","l110","l111","l112"]],["DecomposeReduction",["b102","l106"],[],["b113"]]],[[4,[1,1,214,3,1]],[6,[64,1,1,16,14]],[8,[4096,1,1]],[25,2],[31,2],[33,3]]],[0.12155289699999999309,0.12071307366666667038,0.1216228230000000049],{"host":{"keys":["cpu"],"kind":"llvm","mtriple":"x86_64-unknown-linux-gnu","tag":""},"keys":["rocm","gpu"],"kind":"rocm","max_num_threads":256,"max_shared_memory_per_block":49152,"max_threads_per_block":1024,"mcpu":"gfx942","model":"MI300","mtriple":"amdgcn-amd-amdhsa-hcc","tag":"","thread_warp_size":64},[["TENSOR","float16",[642,4096]],["TENSOR","float16",[4096,14336]],["TENSOR","float16",[642,14336]]]]]
[0,[[[["GetBlock",[],["C","main"],["b0"]],["GetBlock",[],["root","main"],["b1"]],["Annotate",["b0","\"SSSRRSRS\""],["meta_schedule.tiling_structure"],[]],["GetLoops",["b0"],[],["l2","l3","l4"]],["SamplePerfectTile",["l2"],[5,64],["v5","v6","v7","v8","v9"]],["Split",["l2","v5","v6","v7","v8","v9"],[1,0],["l10","l11","l12","l13","l14"]],["SamplePerfectTile",["l3"],[5,64],["v15","v16","v17","v18","v19"]],["Split",["l3","v15","v16","v17","v18","v19"],[1,0],["l20","l21","l22","l23","l24"]],["SamplePerfectTile",["l4"],[3,64],["v25","v26","v27"]],["Split",["l4","v25","v26","v27"],[1,0],["l28","l29","l30"]],["Reorder",["l10","l20","l11","l21","l12","l22","l28","l29","l13","l23","l30","l14","l24"],[],[]],["Fuse",["l10","l20"],[1],["l31"]],["Bind",["l31"],["blockIdx.x"],[]],["Fuse",["l11","l21"],[1],["l32"]],["Bind",["l32"],["vthread.x"],[]],["Fuse",["l12","l22"],[1],["l33"]],["Bind",["l33"],["threadIdx.x"],[]],["Annotate",["b0",64],["meta_schedule.thread_extent_low_inclusive"],[]],["Annotate",["b0",1024],["meta_schedule.thread_extent_high_inclusive"],[]],["CacheWrite",["b0",[]],[0,"local"],["b34"]],["ReverseComputeAt",["b34","l33"],[1,-1],[]],["CacheRead",["b0",["b0"]],[0,"shared"],["b35"]],["ComputeAt",["b35","l28"],[1,-1],[]],["GetLoops",["b35"],[],["l36","l37","l38","l39","l40","l41"]],["Fuse",["l40","l41"],[1],["l42"]],["SampleCategorical",[],[[1,2,4,8],[0.25,0.25,0.25,0.25]],["v43"]],["Annotate",["b35","v43"],["meta_schedule.cooperative_fetch"],[]],["CacheRead",["b0",["b0"]],[1,"shared"],["b44"]],["ComputeAt",["b44","l28"],[1,-1],[]],["GetLoops",["b44"],[],["l45","l46","l47","l48","l49","l50"]],["Fuse",["l49","l50"],[1],["l51"]],["SampleCategorical",[],[[1,2,4,8],[0.25,0.25,0.25,0.25]],["v52"]],["Annotate",["b44","v52"],["meta_schedule.cooperative_fetch"],[]],["SampleCategorical",[],[[0,16,64,512,1024],[0.2000000000000000111,0.2000000000000000111,0.2000000000000000111,0.2000000000000000111,0.2000000000000000111]],["v53"]],["Annotate",["b1","v53"],["meta_schedule.unroll_explicit"],[]],["EnterPostproc",[],[],[]],["Unannotate",["b35"],["meta_schedule.cooperative_fetch"],[]],["GetLoops",["b35"],[],["l54","l55","l56","l57","l58"]],["Split",["l58","None",64,4],[1,0],["l59","l60","l61"]],["Vectorize",["l61"],[],[]],["Bind",["l60"],["threadIdx.x"],[]],["Unannotate",["b44"],["meta_schedule.cooperative_fetch"],[]],["GetLoops",["b44"],[],["l62","l63","l64","l65","l66"]],["Split",["l66","None",64],[1,0],["l67","l68"]],["Bind",["l68"],["threadIdx.x"],[]],["GetBlock",[],["root","main"],["b69"]],["Unannotate",["b69"],["meta_schedule.unroll_explicit"],[]],["GetChildBlocks",["b69"],[],["b70","b71","b72","b73"]],["GetLoops",["b70"],[],["l74","l75","l76","l77","l78","l79","l80"]],["GetLoops",["b71"],[],["l81","l82","l83","l84","l85","l86"]],["GetLoops",["b72"],[],["l87","l88","l89","l90","l91","l92","l93","l94","l95","l96"]],["Annotate",["l87",16],["pragma_auto_unroll_max_step"],[]],["Annotate",["l87",1],["pragma_unroll_explicit"],[]],["GetLoops",["b73"],[],["l97","l98","l99","l100","l101"]],["GetBlock",[],["C","main"],["b102"]],["GetLoops",["b102"],[],["l103","l104","l105","l106","l107","l108","l109","l110","l111","l112"]],["DecomposeReduction",["b102","l106"],[],["b113"]]],[[4,[1,107,1,6,1]],[6,[16,1,64,1,14]],[8,[1024,4,1]],[25,2],[31,0],[33,1]]],[2.4045162759999998414,2.3969868163333334365,2.3980177406666665085],{"host":{"keys":["cpu"],"kind":"llvm","mtriple":"x86_64-unknown-linux-gnu","tag":""},"keys":["rocm","gpu"],"kind":"rocm","max_num_threads":256,"max_shared_memory_per_block":49152,"max_threads_per_block":1024,"mcpu":"gfx942","model":"MI300","mtriple":"amdgcn-amd-amdhsa-hcc","tag":"","thread_warp_size":64},[["TENSOR","float16",[642,4096]],["TENSOR","float16",[4096,14336]],["TENSOR","float16",[642,14336]]]]]
[0,[[[["GetBlock",[],["C","main"],["b0"]],["GetBlock",[],["root","main"],["b1"]],["Annotate",["b0","\"SSSRRSRS\""],["meta_schedule.tiling_structure"],[]],["GetLoops",["b0"],[],["l2","l3","l4"]],["SamplePerfectTile",["l2"],[5,64],["v5","v6","v7","v8","v9"]],["Split",["l2","v5","v6","v7","v8","v9"],[1,0],["l10","l11","l12","l13","l14"]],["SamplePerfectTile",["l3"],[5,64],["v15","v16","v17","v18","v19"]],["Split",["l3","v15","v16","v17","v18","v19"],[1,0],["l20","l21","l22","l23","l24"]],["SamplePerfectTile",["l4"],[3,64],["v25","v26","v27"]],["Split",["l4","v25","v26","v27"],[1,0],["l28","l29","l30"]],["Reorder",["l10","l20","l11","l21","l12","l22","l28","l29","l13","l23","l30","l14","l24"],[],[]],["Fuse",["l10","l20"],[1],["l31"]],["Bind",["l31"],["blockIdx.x"],[]],["Fuse",["l11","l21"],[1],["l32"]],["Bind",["l32"],["vthread.x"],[]],["Fuse",["l12","l22"],[1],["l33"]],["Bind",["l33"],["threadIdx.x"],[]],["Annotate",["b0",64],["meta_schedule.thread_extent_low_inclusive"],[]],["Annotate",["b0",1024],["meta_schedule.thread_extent_high_inclusive"],[]],["CacheWrite",["b0",[]],[0,"local"],["b34"]],["ReverseComputeAt",["b34","l33"],[1,-1],[]],["CacheRead",["b0",["b0"]],[0,"shared"],["b35"]],["ComputeAt",["b35","l28"],[1,-1],[]],["GetLoops",["b35"],[],["l36","l37","l38","l39","l40","l41"]],["Fuse",["l40","l41"],[1],["l42"]],["SampleCategorical",[],[[1,2,4,8],[0.25,0.25,0.25,0.25]],["v43"]],["Annotate",["b35","v43"],["meta_schedule.cooperative_fetch"],[]],["CacheRead",["b0",["b0"]],[1,"shared"],["b44"]],["ComputeAt",["b44","l28"],[1,-1],[]],["GetLoops",["b44"],[],["l45","l46","l47","l48","l49","l50"]],["Fuse",["l49","l50"],[1],["l51"]],["SampleCategorical",[],[[1,2,4,8],[0.25,0.25,0.25,0.25]],["v52"]],["Annotate",["b44","v52"],["meta_schedule.cooperative_fetch"],[]],["SampleCategorical",[],[[0,16,64,512,1024],[0.2000000000000000111,0.2000000000000000111,0.2000000000000000111,0.2000000000000000111,0.2000000000000000111]],["v53"]],["Annotate",["b1","v53"],["meta_schedule.unroll_explicit"],[]],["EnterPostproc",[],[],[]],["Unannotate",["b35"],["meta_schedule.cooperative_fetch"],[]],["GetLoops",["b35"],[],["l54","l55","l56","l57","l58"]],["Split",["l58","None",112],[1,0],["l59","l60"]],["Bind",["l60"],["threadIdx.x"],[]],["Unannotate",["b44"],["meta_schedule.cooperative_fetch"],[]],["GetLoops",["b44"],[],["l61","l62","l63","l64","l65"]],["Split",["l65","None",112,8],[1,0],["l66","l67","l68"]],["Vectorize",["l68"],[],[]],["Bind",["l67"],["threadIdx.x"],[]],["GetBlock",[],["root","main"],["b69"]],["Unannotate",["b69"],["meta_schedule.unroll_explicit"],[]],["GetChildBlocks",["b69"],[],["b70","b71","b72","b73"]],["GetLoops",["b70"],[],["l74","l75","l76","l77","l78","l79"]],["GetLoops",["b71"],[],["l80","l81","l82","l83","l84","l85","l86"]],["GetLoops",["b72"],[],["l87","l88","l89","l90","l91","l92","l93","l94","l95","l96"]],["Annotate",["l87",1024],["pragma_auto_unroll_max_step"],[]],["Annotate",["l87",1],["pragma_unroll_explicit"],[]],["GetLoops",["b73"],[],["l97","l98","l99","l100","l101"]],["GetBlock",[],["C","main"],["b102"]],["GetLoops",["b102"],[],["l103","l104","l105","l106","l107","l108","l109","l110","l111","l112"]],["DecomposeReduction",["b102","l106"],[],["b113"]]],[[4,[2,1,1,107,3]],[6,[4,1,112,32,1]],[8,[1024,1,4]],[25,0],[31,3],[33,4]]],[1.3822576496666665324,1.3913736976666666312,1.3908829750000002434],{"host":{"keys":["cpu"],"kind":"llvm","mtriple":"x86_64-unknown-linux-gnu","tag":""},"keys":["rocm","gpu"],"kind":"rocm","max_num_threads":256,"max_shared_memory_per_block":49152,"max_threads_per_block":1024,"mcpu":"gfx942","model":"MI300","mtriple":"amdgcn-amd-amdhsa-hcc","tag":"","thread_warp_size":64},[["TENSOR","float16",[642,4096]],["TENSOR","float16",[4096,14336]],["TENSOR","float16",[642,14336]]]]]
[0,[[[["GetBlock",[],["C","main"],["b0"]],["GetBlock",[],["root","main"],["b1"]],["Annotate",["b0","\"SSSRRSRS\""],["meta_schedule.tiling_structure"],[]],["GetLoops",["b0"],[],["l2","l3","l4"]],["SamplePerfectTile",["l2"],[5,64],["v5","v6","v7","v8","v9"]],["Split",["l2","v5","v6","v7","v8","v9"],[1,0],["l10","l11","l12","l13","l14"]],["SamplePerfectTile",["l3"],[5,64],["v15","v16","v17","v18","v19"]],["Split",["l3","v15","v16","v17","v18","v19"],[1,0],["l20","l21","l22","l23","l24"]],["SamplePerfectTile",["l4"],[3,64],["v25","v26","v27"]],["Split",["l4","v25","v26","v27"],[1,0],["l28","l29","l30"]],["Reorder",["l10","l20","l11","l21","l12","l22","l28","l29","l13","l23","l30","l14","l24"],[],[]],["Fuse",["l10","l20"],[1],["l31"]],["Bind",["l31"],["blockIdx.x"],[]],["Fuse",["l11","l21"],[1],["l32"]],["Bind",["l32"],["vthread.x"],[]],["Fuse",["l12","l22"],[1],["l33"]],["Bind",["l33"],["threadIdx.x"],[]],["Annotate",["b0",64],["meta_schedule.thread_extent_low_inclusive"],[]],["Annotate",["b0",1024],["meta_schedule.thread_extent_high_inclusive"],[]],["CacheWrite",["b0",[]],[0,"local"],["b34"]],["ReverseComputeAt",["b34","l33"],[1,-1],[]],["CacheRead",["b0",["b0"]],[0,"shared"],["b35"]],["ComputeAt",["b35","l28"],[1,-1],[]],["GetLoops",["b35"],[],["l36","l37","l38","l39","l40","l41"]],["Fuse",["l40","l41"],[1],["l42"]],["SampleCategorical",[],[[1,2,4,8],[0.25,0.25,0.25,0.25]],["v43"]],["Annotate",["b35","v43"],["meta_schedule.cooperative_fetch"],[]],["CacheRead",["b0",["b0"]],[1,"shared"],["b44"]],["ComputeAt",["b44","l28"],[1,-1],[]],["GetLoops",["b44"],[],["l45","l46","l47","l48","l49","l50"]],["Fuse",["l49","l50"],[1],["l51"]],["SampleCategorical",[],[[1,2,4,8],[0.25,0.25,0.25,0.25]],["v52"]],["Annotate",["b44","v52"],["meta_schedule.cooperative_fetch"],[]],["SampleCategorical",[],[[0,16,64,512,1024],[0.2000000000000000111,0.2000000000000000111,0.2000000000000000111,0.2000000000000000111,0.2000000000000000111]],["v53"]],["Annotate",["b1","v53"],["meta_schedule.unroll_explicit"],[]],["EnterPostproc",[],[],[]],["Unannotate",["b35"],["meta_schedule.cooperative_fetch"],[]],["GetLoops",["b35"],[],["l54","l55","l56","l57","l58"]],["Split",["l58","None",256],[1,0],["l59","l60"]],["Bind",["l60"],["threadIdx.x"],[]],["Unannotate",["b44"],["meta_schedule.cooperative_fetch"],[]],["GetLoops",["b44"],[],["l61","l62","l63","l64","l65"]],["Split",["l65","None",256],[1,0],["l66","l67"]],["Bind",["l67"],["threadIdx.x"],[]],["GetBlock",[],["root","main"],["b68"]],["Unannotate",["b68"],["meta_schedule.unroll_explicit"],[]],["GetChildBlocks",["b68"],[],["b69","b70","b71","b72"]],["GetLoops",["b69"],[],["l73","l74","l75","l76","l77","l78"]],["GetLoops",["b70"],[],["l79","l80","l81","l82","l83","l84"]],["GetLoops",["b71"],[],["l85","l86","l87","l88","l89","l90","l91","l92","l93","l94"]],["Annotate",["l85",64],["pragma_auto_unroll_max_step"],[]],["Annotate",["l85",1],["pragma_unroll_explicit"],[]],["GetLoops",["b72"],[],["l95","l96","l97","l98","l99"]],["GetBlock",[],["C","main"],["b100"]],["GetLoops",["b100"],[],["l101","l102","l103","l104","l105","l106","l107","l108","l109","l110"]],["DecomposeReduction",["b100","l104"],[],["b111"]]],[[4,[642,1,1,1,1]],[6,[56,1,256,1,1]],[8,[512,8,1]],[25,0],[31,0],[33,2]]],[0.012697096749999999335,0.012697828250000001149,0.012708423499999999678],{"host":{"keys":["cpu"],"kind":"llvm","mtriple":"x86_64-unknown-linux-gnu","tag":""},"keys":["rocm","gpu"],"kind":"rocm","max_num_threads":256,"max_shared_memory_per_block":49152,"max_threads_per_block":1024,"mcpu":"gfx942","model":"MI300","mtriple":"amdgcn-amd-amdhsa-hcc","tag":"","thread_warp_size":64},[["TENSOR","float16",[642,4096]],["TENSOR","float16",[4096,14336]],["TENSOR","float16",[642,14336]]]]]
[0,[[[["GetBlock",[],["C","main"],["b0"]],["GetBlock",[],["root","main"],["b1"]],["Annotate",["b0","\"SSSRRSRS\""],["meta_schedule.tiling_structure"],[]],["GetLoops",["b0"],[],["l2","l3","l4"]],["SamplePerfectTile",["l2"],[5,64],["v5","v6","v7","v8","v9"]],["Split",["l2","v5","v6","v7","v8","v9"],[1,0],["l10","l11","l12","l13","l14"]],["SamplePerfectTile",["l3"],[5,64],["v15","v16","v17","v18","v19"]],["Split",["l3","v15","v16","v17","v18","v19"],[1,0],["l20","l21","l22","l23","l24"]],["SamplePerfectTile",["l4"],[3,64],["v25","v26","v27"]],["Split",["l4","v25","v26","v27"],[1,0],["l28","l29","l30"]],["Reorder",["l10","l20","l11","l21","l12","l22","l28","l29","l13","l23","l30","l14","l24"],[],[]],["Fuse",["l10","l20"],[1],["l31"]],["Bind",["l31"],["blockIdx.x"],[]],["Fuse",["l11","l21"],[1],["l32"]],["Bind",["l32"],["vthread.x"],[]],["Fuse",["l12","l22"],[1],["l33"]],["Bind",["l33"],["threadIdx.x"],[]],["Annotate",["b0",64],["meta_schedule.thread_extent_low_inclusive"],[]],["Annotate",["b0",1024],["meta_schedule.thread_extent_high_inclusive"],[]],["CacheWrite",["b0",[]],[0,"local"],["b34"]],["ReverseComputeAt",["b34","l33"],[1,-1],[]],["CacheRead",["b0",["b0"]],[0,"shared"],["b35"]],["ComputeAt",["b35","l28"],[1,-1],[]],["GetLoops",["b35"],[],["l36","l37","l38","l39","l40","l41"]],["Fuse",["l40","l41"],[1],["l42"]],["SampleCategorical",[],[[1,2,4,8],[0.25,0.25,0.25,0.25]],["v43"]],["Annotate",["b35","v43"],["meta_schedule.cooperative_fetch"],[]],["CacheRead",["b0",["b0"]],[1,"shared"],["b44"]],["ComputeAt",["b44","l28"],[1,-1],[]],["GetLoops",["b44"],[],["l45","l46","l47","l48","l49","l50"]],["Fuse",["l49","l50"],[1],["l51"]],["SampleCategorical",[],[[1,2,4,8],[0.25,0.25,0.25,0.25]],["v52"]],["Annotate",["b44","v52"],["meta_schedule.cooperative_fetch"],[]],["SampleCategorical",[],[[0,16,64,512,1024],[0.2000000000000000111,0.2000000000000000111,0.2000000000000000111,0.2000000000000000111,0.2000000000000000111]],["v53"]],["Annotate",["b1","v53"],["meta_schedule.unroll_explicit"],[]],["EnterPostproc",[],[],[]],["Unannotate",["b35"],["meta_schedule.cooperative_fetch"],[]],["GetLoops",["b35"],[],["l54","l55","l56","l57","l58"]],["Split",["l58","None",1024,8],[1,0],["l59","l60","l61"]],["Vectorize",["l61"],[],[]],["Bind",["l60"],["threadIdx.x"],[]],["Unannotate",["b44"],["meta_schedule.cooperative_fetch"],[]],["GetLoops",["b44"],[],["l62","l63","l64","l65","l66"]],["Split",["l66","None",1024,8],[1,0],["l67","l68","l69"]],["Vectorize",["l69"],[],[]],["Bind",["l68"],["threadIdx.x"],[]],["GetBlock",[],["root","main"],["b70"]],["Unannotate",["b70"],["meta_schedule.unroll_explicit"],[]],["GetChildBlocks",["b70"],[],["b71","b72","b73","b74"]],["GetLoops",["b71"],[],["l75","l76","l77","l78","l79","l80","l81"]],["GetLoops",["b72"],[],["l82","l83","l84","l85","l86","l87","l88"]],["GetLoops",["b73"],[],["l89","l90","l91","l92","l93","l94","l95","l96","l97","l98"]],["GetLoops",["b74"],[],["l99","l100","l101","l102","l103"]],["GetBlock",[],["C","main"],["b104"]],["GetLoops",["b104"],[],["l105","l106","l107","l108","l109","l110","l111","l112","l113","l114"]],["DecomposeReduction",["b104","l108"],[],["b115"]]],[[4,[1,3,2,107,1]],[6,[7,1,512,1,4]],[8,[1024,1,4]],[25,3],[31,3],[33,0]]],[0.17130897999999997183,0.17127693666666668482,0.17137172433333333621],{"host":{"keys":["cpu"],"kind":"llvm","mtriple":"x86_64-unknown-linux-gnu","tag":""},"keys":["rocm","gpu"],"kind":"rocm","max_num_threads":256,"max_shared_memory_per_block":49152,"max_threads_per_block":1024,"mcpu":"gfx942","model":"MI300","mtriple":"amdgcn-amd-amdhsa-hcc","tag":"","thread_warp_size":64},[["TENSOR","float16",[642,4096]],["TENSOR","float16",[4096,14336]],["TENSOR","float16",[642,14336]]]]]
